0,1,2
 내공     혈압약 반으로 쪼개 먹어도 될까요 ,안녕하세요   살 남자이고 듀카브정      약  년정도 복용중입니다  제가 고혈압을 인지하게 된건   살 신체검사때 알게 됫어요 신검때 본태성고혈압이라고 말해주었고 혈압은                 이였어요  아마 청소년때부터 혈압이 높았던거 같고  부모님  분 혈압 높으세요 약 먹을 생각은 안했고  혈압이 높았지만 군대도 문제없이 다녀왔어요  그렇게   년넘는 기간동안 잘 지내왔었던거 같아요  저는 술담배도 안하고 헬스도 꾸준히 해서 지방이 많이 없고 근육체형이에요  그런데  년전부터 걱정이 되어 약복용을 시작했어요  현재는               정도 왓다갓다 나오더라구요 이제 거의 정상범위로 돌아온거같은데  제가 약을 반으로 쪼개서 먹거나  아님 이틀간격으로 먹어도 될까요  감사합니다 ,순환기내과
심장 두근거림,안녕하세요   요새 심장 두근거림이 크게 느껴져서 글을 적게 됐어요   맥박을 재어보니 정상박동이에요    분에      정도입니다   그런데 그냥 가만히 앉거나 누워 있어도  심장 두근거림이 좀 크게 느껴집니다   쿵  쿵  뛰는 게 지속 되다가 다시 나아지고      이런 게 반복되는 것 같아요   심정 통증이나 호흡 곤란은 없습니다만  왜 이렇게 심장의 두근거림이 요새 크게 느껴지는 건지      얼마전에 접종한 모더나 백신 때문인가 싶기도 하고      저는   대 중반 여성이고요  술담배는 전혀 하지 않습니다   얼마전 건강검진에서 심전도 유소견  동빈맥 진단을 받았습니다   일주일 전에 모더나  차 접종까지 했습니다   예전에도 건강검진에서 심전도가 조금 빨리 뛴다고 얘기를 들었었는데요   건강검진에서도 유소견에 심근염심낭염 가능성이 있다는 모더나까지 맞아서 그런지 더 우려가 되네요     혹시 소견이나 의견 부탁드립니다    광고나 성의없는 글은 절대 채택을 누르지 않습니다    ,순환기내과
명치 통증  질문이요,이게 아주 애매한부위인데 최근들어 이상한느낌이 들어질문합니다    정확히 명치라하긴애매하고 만졌을때 정중앙기준 갈비뼈 맨아래 부분  거기서 제 신체기준 살짝 좌측부분 신체 안쪽이 간지럽다해야하나  다리에 피 오랫동안 안통하다가 갑자기 통할때 드는 전기흐르는 느낌  비슷한느낌이 계속드네요 누르면아프구요 그냥 통증이 느껴지는정도    다른곳은 눌러도 느낌안나구요  이전에는  몇 년된거같기도하고     가끔가다 느껴지는게  최근 일주일동안 하루에도 수십번 그게 느껴져서 질문해봅니다   아무문제 없는거겟지요  ,순환기내과
고혈압될까요,초 입니다  아까 쟀는데 혈압    에   였나 그러  는데 라면 먹으면 고혈업 될  까요   ,순환기내과
위초음파내시경   시   분  혈압약은 언제먹나요 ,위내시경검사후 이상소견으로 위초음파내시경을 예약했는데   시간이 오전   시   분이네요   금식은 몇시부터해야하고 혈압약은 몇시에 먹어야 하는건지 궁금합니다  알려주셔요 ,순환기내과
기립성 저혈압인가요  빈혈인가요 ,   일정도 하루 한끼 두끼정도만 먹었고 어제 하루는 안먹었지만 철분제랑 영양제도 챙겨먹는 편입니다 지금은 월경중이고요 어제부터 약간 어질어질 하더니 오늘부터 잠깐 앉았다 일어나도 시야에 초점이 안맞춰지고 균형감각도 못잡겠는 증상이 한     초정도 지속되는데 가만히 있어도 은근히 머리가 띵하고 어지러운 느낌이고 누웠다가 일어나면 특히 심합니다 그리고  일전에  차 화이자 백신을 맞았는데 이것도 백신부작용인가요    내공   ,순환기내과
미녹시딜정과 피임약을 함께 복용하면 나타나는 부작용은 어떤 게 있나요 ,탈모로 미녹시딜정을 처방받아 복용중인데 미녹시딜정의 작용인지 나이가 들어선지 생리가 불규칙해요    년간 캍같은 생리주기가 유지되어 왔는데 이유가 나이탓인지 뭔지는 모르겠어요   미녹시딜정   t 와 머시론  t씩 먹을 계획인데 부작용 없을까요  머시론 설명서 보니까 고혈압환자는 복용하면 안되는 것 같은데  제가 고혈압환자는 아니지만 정상혈압  미녹시딜정이 중증 고혈압 치료제거든요   약사님들과 의사선생님들의 답변 기다립니다 ,순환기내과
자는데 양손이 하얗게 변합니다,버스에 앉아 양손 팔짱끼고 앉아서  자는데 양손이 하얗게 변합니다   자다깨서 황급히 움직이면 다시  원래대로 돌아옵니다   왜이럴까요   목자세가 안좋다는데  목문제인지  혈액순환 문제인건지 불안합니다   경동맥    mm라는데 얼마나 안좋은건지 알려주시면 감사드리겠습니다 ,순환기내과
심혈관 나이가   세이면 좋은건가요     ,심혈관 나이가   세이면 좋은건가요         저는   대 초반입니다    ,순환기내과
먹을 때 심박수,뭐 먹을 때마다 맥박이     이상으로 계속 오르는데 왜 그런걸까요  ,순환기내과
심박수나 맥박재는걸 앉아서하거나 누워서하는 이유가 뭔가요,누웠을때랑 앉으면   몇인데 서서재면   에서    이 나와요 왜그런가요  서서활동하다가 잰것도 아니고 움직이다가 잰것도 아닌데 말이져,순환기내과
배부르게 밥 먹으면 심장 빨리뜀,밥을 엄청 배부르게 먹으면 심장이 빨리 뛰어요 특히 텐동만 먹으면 심장이 더 빨리 뛰어서 심박수가    까지 나옵니다  소화되기 전까지    쯤 평균으로 뛰고 몸이 엄청 힘듭니다  텐동 먹으면 이런 형상이 계속 나오는데 혹시 음식 알레르기 일까요   아님 원래 이런가요 ,순환기내과
어머니 추운날 가슴뻐근 증상 급해요  ,엄마가 추운날 나가면 가슴이 뻐근하시다고해요 심장이 약한거라 하던데 예전에 그래서 심근경색 검사랑 다해봤는데   시간 부정맥검사는 안함  정상으로나왔어요 이런경우 부정맥 인건가요   어떻게 해야할까요 걱정되요 전문의선생님들 도와주세요  고지혈 고혈압 약 드시고 계시고 위내시경결과는 깨끗해요,순환기내과
뇌경색 질문,안녕하세요  오늘 혈액검사를 하다가 콜레스테롤이 높게 나왔다는걸 알았어요  근데 콜레스테롤이 높으면 뇌경색이나 심장질환을 일으킨다고 하더라고요  근데 제가 궁금한게 최근들어 머리가 어지럽고 두통이 심해서 mri mra를 찍어봤을땐 아무런 문제가 없었어요  그러면 뇌경색은 배제해도 되는건가요     오늘 혈액검사 하면서 d dimer도 봤는데 그것도    로 아주 낮은 수치가 나왔는데 이러면 동맥경화도 배제해도 되는건지도 궁금하고   심장초음파상 정상이면 심장질환도 걱정 하지말고 식단관리랑 운동하는게 맞는건지 너무 걱정됩니다  나이는   살입니다,순환기내과
간장질환 의심,안녕하세요 최근 건강검진을 받았는데 간장질환 의심이라고 나왔어요  AST    ALT    감마지티피     술도 안마시는데 왜 이런 수치가 나온건지 모르겠습니다 정말 큰 병원가서 검사를 받아봐야 하는건가요 ,순환기내과
  대부모님 건강질문이여,  세 어머니이신데여 목부터 열감이오르면 머리속이 뜨겁다고하시고 새벽에 열감때문에 잠에서 깨신다고 하네여 제가 열감있을때 온도를재도     도 정상이신데 어느병원을 가야하는지 혈압약이랑 혈전제 부정맥 약드시고있습니다 답변 부탁드립니다,순환기내과
고콜레스테롤혈증 의심, 년만에 이런 진단을 받았네요       세 여자입니다  절대 비만아니고  체질량지수 정상   직장생활로  몇년동안 거의 운동을 하지않았습니다  어떻게 관리를 해야하는지       답변바래요 ,순환기내과
오메가  이상지질혈증 약을 처방받았는데,적절한 식이요법 및 운동이 필요하다고 써있는데 그냥 먹으면 안되나요 날이 추워서 유산소운동하러 가기가 쉽지 않네요,순환기내과
뇌혈관 기형 전문의 전문가분들만 답해주세요 내공   ,안녕하세요 저는 고 인 남학생인데요 제가 초등학교 학년때에 의도치않게 머리에 ct를 찍다가 뇌혈관기형이 있다는 것을 알게 되었는데요   그래서 사이즈가 커졌는지 혈관 덩어리가 이동을 하였는지 검사하기위해서  년 마다 MRI를 찍고 중 가 되던 무렵에 담당의 께서 사이즈도 그대로고 별다른 이상이 없으니 걱정말고 MRI를 그만 찍어도 된다고 하셨습니다  그래서 안심하고 지금까지 살았었는데 최극에 자꾸 뒷통수가 무겁고 땡기는 느낌이 들어서 걱정되서 질문해봅니다      뇌혈관 기형이 있으면 무조건 수술을 해야하나요        지금은 안그런데 옛날에는 편두통이 심했습니다 관련이 있을까요        만약 수술을 하지않아도 된다면 향후 관리를 어떻게 할까요   ,순환기내과
