0,1,2
심부전으로 인해 심박출량이 감소했는데 왜 고혈압인가요 ,자세한 기전과 원리 설명해 주시면 감사하겠습니다   이 환자는 변이형 협심증이 있으시고 심실세동이 있으셔서 cpr도 하셨고 전체적인 heart failure있으신 분입니다  분명 심장 기능 저하로 심박출량이 감소했을 텐데  이분은 계속 혈압이    대로 높게 뜁니다    왜 그런걸까요  혈압은 심박출량과 비례한다고 알고있는데요  내공 드려요,순환기내과
건강검진 전,건강검진 받는 날 아침에 혈압약 먹고 가도 될까요 혈압이 지극히 높아 약을 먹고 있어서요 ,순환기내과
콜레스테롤 수치 좀 봐주세요,  대 초반 우연찮은 혈액검사로 고지혈증임을 알았습니다  그당시 수치도    정도  배가 만삭처럼 나온 아저씨 수준이라고약을 먹어야한다기에 약을 몇달복용하고 다시 검사하고 그러다 병원을 옮기게되었는데 마른비만체질이라 그런거라시면서 약복용을 중단시키셨죠  그렇게   년이 지나 특별히 검사없이 살다 건강검진으로 검진을 받았는데 총콜레스테롤이     hdl    중성지방   ldl    총콜레스테롤이 높아 안좋은데 hdl이 많아 괜찮다는 소리는 들었습니다  총콜레스테롤 수치가 이렇게 높아도 괜찮은건지 걱정입니다  저는 키    에 체중이   키로이고 주말빼고 거의 매일 운동을 합니다  운동한지  년이나 되었고 체중관리도 늘 하고있습니다 육류를 좋아하지도 않고 그외에 식습관도 나쁜편이 아닙니다  그런데 운동을하고 단백질 섭취를 적절히 해도 근육이 잘 늘지 않고 평소혈액순환도 잘 되지않습니다  사계절내내 손발이 찬편이고 이제는 찬기가 발에서 종아리까지 올라와 시림을 느낍니다  풍문으로는 고지혈증 때문이라는데 곧 무릎까지도 올라온다는    근육이 잘 늘지 않는것도 체질적인 고지혈증과 관련이 있는걸까요  전 어찌해야 되는걸까요 너무 궁금해요 분석 부탁드립니다 ,순환기내과
혈압 문제입니다,  대 남성이고요  약  개월전 병역판정검사 결과 수축기     이완기   이라는 결과를 받았고 약  달전 국민건강공단 검사결과 수축기     이완기   라는 결과를 받았습니다  헌데 오늘 동네의원에서 혈압을 측정했는데 수축기    이라는 엄청난 결과가 나왔습니다  평소 집에 혈압기가 있어 혈압을 재었는데 항상 정상이었습니다  어떻게 이렇게 차이가 날 수있는지 궁금해서 질문드립니다  참고로 어떤 기저질환도 앓고 있지 않습니다  비만도 아니고요  ,순환기내과
혈압에 관해서 문의드립니다 ,안녕하세요   종합병원 내과 진료대기실에 자동혈압측정기가 있어서 여러번 혈압을 측정해봤습니다   높게 나올때는         낮게 나올때는        정도가 나왔습니다   모든 혈압 측정은   분이상 충분히 휴식후에 했고 같은 시간대에 제가 스스로 측정했습니다   이런 경우 낮게 나온 값을 제 혈압으로 보면 되는지요    아니면 평균 값이 제 혈압인가요 ,순환기내과
고혈압에 좋은 음식 부탁드립니다 ,아직 나이는   대 입니다   스트레스로 혈압이 계속 올라가는 상황이라서  관리를 좀 해보려고 합니다 ,순환기내과
