0,1,2
추운날 운동후 손목혈관통증을 느낍니다  , 월  일  시부터  시까지 밖에서 축구를했습니다 반팔입고했는데 집에오니 손등이나 손목 쪽 두꺼운 혈관에 과도한 압력이 가해지는거같습니다 손을 내리면 혈관에 압력높아져서 통증이 있습니다 올리면 괜찮은데 중력으로 피가 쏠리면 혈관에 통증이 오네요    시간 지나면 괜찮아질까요  병원가서 정밀검사 를 받아야할까요    아 참 저녁에 약간 감기기운이 있어서 상비약을 복용했습니다 아스피린으로 알고있습니다 ,순환기내과
혈압약 질문,이전에 복용중이던약은 트윈콤비     제품이였고 이번에 처방받은 약은 세비카정     입니다 알아보니 각각 혈압을 낮추는 방식이 다르더라구요 혹시 각각의 약의 이점이나 단점을 알려주실수있나요,순환기내과
심박수 정상인가요 ,최근 가만히 앉아있는데도 두근거리는 증상이있어요  애플워치 확인해보면 심박수         사이이고 서있을때 운동량X  최대    까지 나왔어요  빠른걸음으로 잠깐 걸었는데 숨차는 증상과 두근거림  어지러움이   분가량 지속됐어요  잘때 심박수는 최대   까지 나오는데 이게 정상인가요   애플워치 심박수가 정황하지 않다는 말이 있는데 괜히 신경쓰여서 두근거리나 싶기도 해요     답변 부탁드립니다   ,순환기내과
저 심근경색인가요 ,  살 학생입니다  일주일 전에 가슴이랑 명치쪽이 답답하고 심장이 철렁 내려앉는 느낌이 들어 근처 내과에 방문하여 심전도  심장 초음파  혈액 검사  흉부 엑스레이를 했는데 전혀 이상이 없다고 나왔습니다  근데 결과 나온뒤 며칠 뒤에 이전에는 없던 하루에 한번씩 좀 심한 명치랑 복부 통증이 오길래 대학병원 소아청소년과 가서 심전도    시간 홀터  흉부 엑스레이  운동부하검사를 받았고 다음주 금요일날 결과 들으러 가야합니다  근데 어젯밤에 갑자기 왼쪽 팔뚝이 아프길래 더욱 불안해졌습니다  심근경색 전조증상하고 너무 일치하는거 같은데 검사결과가 이상없으면 안심해도 될까요  갑자기 무슨일이 생길까봐 두렵습니다 ,순환기내과
맥박이 빨리 뛰어요,안녕하세요 제가  분에 맥박이   회정도 뛰는데 속이 안좋아서 이틀동안 먹은것도 없고 물만먹고 이틀동안 딱  시간밖에 못잤어요   아침에 어지럽고 컨디션이 안좋고 일어날 힘도 없어서 밥먹고 쉬고있는데 심장이 빨리뛰고 열도 좀 나는거같아요 몸살처럼 막 아프진않은데 몸에 무리가 생긴거같고 뻐근해요   그래서 맥박수치를 재봤는데 갑자기  분에    번이 뛰어요 컨디션이 안좋으면 하루아침에 이렇게 맥박이 빨리 뛸 수가 있나요    자고 일어나면 괜찮아 질까요 ,순환기내과
이것도 수면장애일까요 ,자면서 저는 못느끼는데 가족들이 저보고 막 끙끙 앓는다고 하더라고요    코는 안고는데 계속 끙끙 앓는다고 하더라고요    잠에서 깻을 때 피곤함이 느껴지지도 않고  평소 피곤하지도 않습니다   수면 장애의 여러 증상 중에서 코고는 거는 많이 들어봤어도 앓는 소리를 내지만 일상생활에는 영향이 없는것도 증상 중 하나 일까 싶어서 질문드립니다   그냥 꿈을 많이 꾸는 정도인데 말이죠    일단 검사는 받을 예정이지만 불안해서 그럽니다    ,순환기내과
총 콜레스테롤이 매우높게    가 나왔어요  매우위험인가요  ,제가   대후반인데 총 콜레스테롤이 매우높게    가 나왔어요   수치로 봤을땐 매우 높음인데 HDL     LDL     중성지방   으로 나왔거든요   그럼 매우 위험정도는 아닌걸까요  조금만 조심하면 떨어질까요 비만 아니구요  먹는게 밀가루 위주고 운동도 매일해요,순환기내과
혈압약 고지혈증약 부작용,한달 전부터 고지혈증약 혈압약을 복용하고 있는데요  약을 먹고 난 이후부터 이전에 없던 증상이 생겨서여   맥박이 가끔    이상으로 유지가 되고 박동성 이명이 생겼습니다  그리고 갑자기 설 때 어지러운 증상이 생겼는데요  두 번째 증상은 혈압약을 반으로 잘라 먹고 부터는 괜찮아졌습니다   현재 혈압은               정도 유지되고 있습니다   저 증상들이 혹시 약과 관련이 있을까요  대학병원에서 진단 받고 처방을 한 거라 의사를  월   일 전까지 만날 수가 없네요 예약이 안 된다고 해서   그 전에 다른 내과를 방문하는 게 맞을까요  그리고 약의 부작용이 맞을까요  답변 부탁드립니다   약은 투베로정      mg 노바스크정  mg 인데 노바스크정은 반 잘라 먹습니다 ,순환기내과
건강검진 결과 간장질환 ast   에 alt    감마지티피   이 나왔는데 alt는   이하가 정상이라며 간기능 이상 의심이 체크되어있어요 ,건강검진 결과 간장질환 ast   에 alt    감마지티피   이 나왔는데 alt는   이하가 정상이라며 간기능 이상 의심이 체크되어있어요  추가검진받아야하나요   어떤 경우에 alt가 올라가는건가요   참고로 술은 거의 안마시지만 최근    년간가끔마셨습니다,순환기내과
  시간혈압검사,제가 혈압이 높아서   시간 혈압검사를 하고있는데 집에선 평균 수축기         이완기        정도 나오는데   시 부터 지금까지                                                         이리 나왔는데 정확한건가요  긴장은 전혀 안했습니다  높게 나오는걸 아는지라 근데 갭차이가 큰것도 있고 해서,순환기내과
저밀도 콜레스테롤이 좀높게 나왔어요,건강검진시 총 콜레스테롤 결과     기준범위        중성지방 TG  결과    기준범위        고밀도 콜레스테롤 결과    기준범위       저밀도 콜레스테롤 계산식  결과    기준범위       저밀도 콜레스테롤이 좀높게 나왔어요 어떻게해야됩니까  ,순환기내과
혈압약 약국,혈압이 평균 수치보다 좀 높을때 있고 정상일때 있는데요 잠시 일하는거 때문에 혈압을 좀 낮출려고 하는데 혈압 체크할일 있을때 높아서 다시 하고 한적이 몇번 잇어서 혈압약 먹고 체크할려고 하는데 도움 되나요  혈압약 약국에서 처방되는지요 ,순환기내과
혈압관련 질문 드립니다 ,가슴 묵직함 답답함이 있어서 혈압을 계속 채크하고있는데 높을때는       정도 낮을때는      이렇게 왔다갔다하는데 혈압이 높을때 가슴 묵직함 답답함이 더한거같습니다  혈압과 가슴답답함이 관계가 있나요 ,순환기내과
턱밑 임파선,임파선 부운곳을 마사지 해주면 괜찮을까요 ,순환기내과
부정맥 자연치유될수있나요,카페인줄이고 잠잘자고 스트레스안받으면 된다는데 지금은 주기는 불규칙적인데 가끔 심장빨리뛰고 답답한느낌 들고      분 그러다 잠잠해집니다,순환기내과
흥분하거나 긴장하면 손   얼굴   발이 저려요,게임에 엄청 집중할때나 너무 화가나거나 슬프거나 하면 몸끝부터 저리고 마비가 되요 꼼짝 못하는 마비까지인지는 모르겠습니다 그정도까진 안가봐서  이게 외가쪽 유전하고 관련이 있는거 같고요  어머니도 저러심  검색을 해봐도 진짜 하나도 관련 정보를 찾을 수가 없었어요 이게 무슨 증상인지 줄이거나 없앨 순 없는지 알려주시면 감사하겠습니다 게임할때 불편하기도 하고 혹시나 이게 뭐 많이 안좋은거 일까봐 질문해봐요,순환기내과
부정맥  코로나 백신,제가 지금   살이 되었는데 부정맥이 있거든요  근데 아직 백신  차도 안 맞았는데  차 맞아도 괜찮을까요 ,순환기내과
다리 혈관 색 질문이 있어요,다리가 이렇게 보랏빛 혈관이 보이는데 어떤증상일까요   딱히 아프진않아요,순환기내과
이게 뭘까요  하지정맥류인가요  아프진 않은데 신경쓰이네요 평소 손발차갑고 가끔 쥐도나기도 합니다 서있는 직업은 아닙니다,이게 뭘까요  하지정맥류인가요  아프진 않은데 신경쓰이네요 평소 손발차갑고 가끔 쥐도나기도 합니다 서있는 직업은 아닙니다,순환기내과
심장이 조이는 느낌이 들어요,낮에 활동할땐 괜찮구요 한  일 전쯤부터 의자에 가만히 앉아서 가슴을 피는 동작을  분정도 유지하면 심장쪽이 조이는 느낌이 들어요    저 자세 할때만 아프구 그외엔 이상이 없긴 한데 무슨 심근경색  이런거 전조증상일수도있나요 ,순환기내과
심근경색일 가능성이 있나요 ,어제 새벽에   분 넘게 가슴 한 가운데에서 조금 왼쪽 부분이 짓누르는 것 처럼 아파오면서 왼쪽팔이 저렸었는데 호흡곤란 식은땀 그런건 동반하지 않았어요  급성 심근경색이나 그런 거일 가능성 있나요  지금은 또 괜찮아요 아직   대인데 요즘 살이 갑자기 엄청 찌기는 했어요 병원을 가야한다면 어디로 가야하나요 ,순환기내과
심장 통증,한  일전부터 심장쪽 조이는 통증이 강하게 갑자기 와요    괜찮다가 갑자기 그러고 한번 아프면 통증이 너무 강해요 갈비뼈쪽도 같이 아픈 느낌인데 왜 이런건지 알수있을까요   다른분들도 원래 이런 통증이 가끔 별 문제없이  생기나요  ,순환기내과
 도방실블록에서 에피네프린을,주는 이유는 뭐에요   ,순환기내과
 일째 명치 복부 통증 심근경색인가요,처음엔 가슴이 좀 답답하다가 최근  일간 명치랑 복부 통증이 너무 심해서 밥도 못먹고 있습니다  낮에는 음식만 안먹으면 괜찮은데 이상하게 저녁    시만 되면 계속 아프네요 거의    시간 가량 통증이 지속됩니다  처음 아파오기 전날에 내과에서 심전도 피검사 심장초음파 엑스레이 다 해봤는데 문제 없다네요  그래도 걱정되길래 대학병원으로 가서 오늘   시간 홀터 검사 기계 차고 왔습니다  급성 심근경색 전조 증상에 가슴이 안 아파도 명치랑 복부가 체한것처럼 아픈게 있다는데 제가 딱 그래서 너무 무섭네요  심근경색 이상 소견이 발견이 안됬는데 며칠 뒤에 갑자기 생길 수 있나요  급성 심근경색 전조 증상이  일동안  시간씩 있을 수 있나요 ,순환기내과
심근염 심낭염,심근염과 심낭염에 걸리면 무조건 열이나나요  ,순환기내과
 월LDL    HDL     월LDL    HDL   인   대여성입니다 콜레스테롤 약을처방받았는데 평생먹는거라 복용전 오메가 를사서 한달정도, 월LDL    HDL     월LDL    HDL   인   대여성입니다 콜레스테롤 약을처방받았는데 평생먹는거라 복용전 오메가 를사서 한달정도먹어보고 다시검사를하면어떨까하는데 효과가있을까요 ,순환기내과
 일 안에 간수치를 정상치로 낮춰야 합니다 , 일 전에 검사한 간수치는 AST     ALT       일 전에 검사한 간수치는 AST     ALT      r GTP    입니다    일 뒤 검진에서 반드시 정상 수치 내로 들어와야 하는데  어떻게 해야 할까요    간곡히 부탁드립니다,순환기내과
하지정맥류 수술후 백신,하지정맥류 수술하고  달 정도지나고 백신맞았는데 염증수치가 올라가서 그런가요 갑자기 다리에 안보였던 혈관들이 다시 올라오는데 이거 며칠 지나면 없어지나요   ,순환기내과
병역 신체검사 기립성 저혈압 관련,갑자기 일어남으로 인해 정신을 잃고 쓰러진 적이 두 번 있어서 대학병원에 갔는데 기립성 저혈압 판정 받았습니다  기립성 저혈압이 신체검사 받는 것에 연관이 있나요   저 군대가고 싶어요,순환기내과
피검사결과 질문 빈혈수치 질문,볼줄 모르겠는데요  혹시  번째 혈색소가 빈혈 수치인가요   문제가 있는건지 없는건지 궁금해요 ,순환기내과
빈혈 수치가 다른 빈혈 환자 보다 낮다는데,술 마시면 안되는거죠     철분제 먹어도 그떄만 올라가고 계속 치료 해야 한다고 하네요 일상생활 불편함까지 느껴서,순환기내과
간 검진 결과,저는 B형 간염 보유자 비활성 입니다  작년   월   일에 건강관리협화에서 초음파 검사를 받았는데 관찰소견  거친 에코  혈청 알파태아단백검사   정량법     ng mL   기준치    ng mL 이하  권고사항으로 의심스러울 정도로 간실질 에코가 거칠어 보여 간질환의 가능성을 생각할 수 있음  그 외에 간종괴  비장 종대  담도 확장 소견 없으며 담낭 내 특이 소견 없다  결론  간질환 의심  이라고 나왔어요  간질환  간경화 가능성이 있는건가요  간 전문 병원에서 재검을 받아야 할까요  간 전문 병원이 어디일까요  실생활에서 주의 해야할 점이 있을까요 ,순환기내과
고혈압 약 한달째 복용 중 높은 혈압,고혈압 약 한달째 복용 중인데 평균    정도가 나옵니다 괜찮을까요  처방해준 병원에서는    대로 쭉 나오는게 아니고        대도 나오는 날이 있기때문에 약 적응중이라고 생각하라는데  걱정이 듭니다 ,순환기내과
팔뚝에 멍이  개월전부터 생겨서 안 없어져요  혈전 인가요  혈관 내과 피부과 ,안녕하세요  팔뚝 멍은    개월 전엔 되게 작았는데요  지금은 저렇게 연하게 커졌습니다     비슷한 멍이 등까지 생기기 시작했구요  멍든 부위가 자기 전에 가끔 가렵고 모기 물린것처럼 뭐가 올라옵니다  의원에 가서 피검사했는데 피검사는 문제가 없다고 대학병원 가보라고 하네요    이것때문에 아직 백신도 못 맞고 있어요    의원에서 맞지 말라고 하네요    혈관의 문제인가요  아니면 피부의 문제인가요    다리에는 빨간색 작은점이 좀 여러개 생기기도 했어요   심각한 건강의 적신호인가요  대학병원 가봐야하는걸까요 ,순환기내과
임파선 부음,제가 살이 안찌는 체질이라 턱선이 항상 보였는데 거울이 보니까 턱선이 사라져서 자세히 살펴보니 목이 살짝 부운건지 살이 붙은건지 턱선이 안 보이더라구요  찾아봤는데 임파선이 부었을수도 있겠다 싶어서요  그 부분을 누르거나 가만히 있어도 다른 통증이나 증상은 없어요  근데 목 울대  기준으로 양쪽이 한꺼번에 그런거면 그냥 살이 붙은걸까요 ,순환기내과
고혈압 의병제대,안녕하세요 현재 군 복무중인 사람입니다 혈압이         사이를 왔다갔다 하면서 일상생황에서 조차도 무리가 갈만큼 버티기가 힘듭니다 사회에 있을때 몇번 쓰러진 이력도 있습니다  식습관조절  술 담배 안하고 혈압약도  달넘게 복용중인데 수치가 내려가지않습니다 수도병원이랑 민간병원 다니면서 거의  차성 고혈압일거라는 판정을 받고있는데 의병제대 가능하나요  검사가 다 완료되야 판정을 받으수있나요   고혈압으로 의병제대가 가능하나요    징문에 맞지않는 답들은 다 차단합니다,순환기내과
  살    cm   kg 혈압 차이가 너무 심합니다  할머니 아버지 고혈압이신데 이번에 건강검진때 병원가서 기계로 재니 옷도  겹입고 긴장탓인,  살    cm   kg 혈압 차이가 너무 심합니다  할머니 아버지 고혈압이신데 이번에 건강검진때 병원가서 기계로 재니 옷도  겹입고 긴장탓인지        이 떠서 혈압계 사서 집에서 재보니       입니다  고혈압약 먹어야되나요 꾸준히  시간걷기 하고있습니다,순환기내과
고혈압약을 먹고 있는데요  오늘 아침에 혈압이         가 나 왔는데요   그리고는 점차 내려서        까지 내렸는데요   위의 저런,고혈압약을 먹고 있는데요  오늘 아침에 혈압이         가 나 왔는데요   그리고는 점차 내려서        까지 내렸는데요   위의 저런 혈압도 있습니까    병원을 빨리 가안 되나요  ,순환기내과
요즘    일 전부터 심장이 너무 크게 뛰는 느낌이에요 심장뛰는게 너무 느껴진달까    그걸 의식해서 그런지 호흡도 조금 모자란거같고    병원,요즘    일 전부터 심장이 너무 크게 뛰는 느낌이에요 심장뛰는게 너무 느껴진달까    그걸 의식해서 그런지 호흡도 조금 모자란거같고    병원 가봐야할까요   분당 맥박 수는   회 입니다,순환기내과
빈맥 현상  백신,특정 상황에서 빈맥 증상이 일어납니다  갑자기 숨을 들이 마쉴 때  갑자기 움직일 때  갑자기 고개를 숙일 때  짧게는  초  길면  분 동안 빈맥 증상이 나타납니다  하지만 위와 같이 갑작스런 행동만 하지 않는다면 빈맥은 발생하지 않지요  저는 부정맥입니까  발작성 빈맥입니까   백신이 위협이 될까요  아직  차도 안 맞았습니다 ,순환기내과
  세인데 심근경색인가요 ,오늘 새벽부터 왼쪽 가슴이 쪼이는 것 처럼 아프고 왼쪽 팔도 아픕니다  숨 쉬는게 조금 가빠지고 이틀 전 부터 토하고 소화불량이 왔습니다  이틀 전 소아과에서는 변비에 가까운 증상이라고 그러는데 오늘 새벽부터 왼쪽 가슴하고 왼쪽 팔이 아픈 것 때문에 조금 불안합니다   어머니께서는 너무 과도한 걱정이라면서 스트레스 받아서 그런다고 하는건데 전문의한테 진료를 받아봐야 할까요     대 심근경색은 거의 없다고 하는데 조금 불안해서   답변 부탁드립니다  ,순환기내과
항체 항원 결합,항체는 혈액과 림프를 순환하면서 항원과 접촉한다들었는데 항원과 항체가 처음으로 접촉해서 활성화증식되는 장소가 림프절인가요  처음접촉장소는 무조건 림프절에서 일어나고 클론들이 생겨 혈액으로 가 퍼지면서 항원과 결합하는건가요 ,순환기내과
화이자 맞고 부작용으로 혈압 급상승 하나요 ,화이자 백신 부작용 고혈압 일단   대중반 기저질환자로 혈압약 복용해서       미만 유지중이었습니다  차까진 흉통외엔 부작용이 없었는데 부스터샷 맞고  주뒤부터 머리가 아파오더니 지속적으로 혈압이 상승하네요 매일 재는데 이전까진                수준이던 혈압이                 계속오르다가 어제 자다가 머리가 깨질듯하여 병원가서 재니까                수준이 나와 급하게 혈압약 추가 처방 받아서  일간 복용했더니                 왔다갔다 하네요 일단 의사쌤도 혈압약 추가한걸로도 안잡히면 대학병원 응급실가서 뇌부터찍으라고 하시길래 내일 당장 대학병원 가려는데 이것도 기저질환자라고 처리할지 의문이네요,순환기내과
혈액검사결과 췌장염증수치,마른체질에 고혈압이있어 혈압약복용중인데 맥박이 빠른편이여서  신장파열로 왼쪽신장적출했음 혹시나 갑상선이나 신장에 문제가 있을까싶어 건강검진차 혈액검사했는데 다른건 다 정상으로 나왔는데 췌장염증수치가 살짝 높게나왔어요  혹시 다시 다른 검사가 필요한지 아니면 그냥 지내도 되는건지 궁굼합니다 ,순환기내과
손에 핏줄이 이상해요,방금 샤워하고 딱 손을봤는데 핏줄이 이상해져있어서 외부충격때문에 이렇게 된건지 심장에 문제가 있어서 그런지 궁금해요  딱히 충격을 받은건 없어요 ,순환기내과
혈압잴때 수치 ,병원에 있는데 혈압잴때        이렇게 말하던데 어느정도가 정상이고 안좋은지 알려주세요,순환기내과
코로나백신,코로나 백신 관련해서 여줘봅니다  일단 저는 올해   살이고 모더나  차를  월   일에 맞고 모더나  차를   월   일에 맞았었습니다  이번에 친구랑 같이 맞기 위해 어제 날짜인  월  일에 예약을 했고 화이자 부스터를 맞았습니다  질문     차와  차 간격이  개월이 안되는데 문제가 발생할까요           차는 모더나 맞고  차는 화이자 맞았는데 아무 상관없는 걸까요   ,순환기내과
심근경색 시술후 감두탕 복용,심근경색 스탠트 시술 후  일이 지났습니다 감두탕이 혈관 개선에 좋다고 하는데 복용해도 될까요  운동은 언제부터 가능한지 오메가  나 비타민도 바로 복용가능한지요 첨이라 걱정이네요  ,순환기내과
심장 뻐근,안녕하세요 왼쪽 가슴쪽 심장이 뻐근한데 화이자 부작용이 아닌지   화이자  차 접종 완료는     년  월   일에 완료했습니다  뻐근 한 건 한 이틀 전부터 그랬고 막 아프거나 콕콕 찌르는 건 없고 그 외 다른 이상반응은 없습니다  ,순환기내과
남자친구가 심장병 입니다,저의 남자친구가  일 전에 헤어지자고 하였는데요 그 이유가 심장이 좋지 않아서 라고 합니다 이미 병원에는 입원 하였고 최소 일년동안 입원을 해야한다고 하고 연락도 잘 안된다고 하네요 그리고 제가 혹시 죽을 수 도 있는거냐고 물어보니 절대 안죽는다고는 장담 못한다고 해요 저 너무 불안해서 잠도 안옵니다 참고로 그 사람은 이제   살입니다 사망률이 얼마나 되나요 정말 불안 합니다,순환기내과
심장박동수가 가만있어도 높아요,얼마전부터 심장박동수가 가만있어도        인데 문제가있는건가요 잠잘때만  정도로내려가고 안잘때는 가만있어도    대이고 일주일전만해도 평소  정도에 심한운동시   이였는데 뭔가 문제가있는거같아요 갑자기  일동안 심장박동수가       에서 안떨어지는데 부정맥인가요 병원은어디로가야하나요 ,순환기내과
가슴 찌르는 통증,며칠 전부터 가끔씩 왼쪽 가슴 은은하게 찌르는듯한 통증이 생겼는데요 숨쉬는 데엔 문제없고   숨차게 운동하거나 크게 들이마셔도 괜찮은데 이따금씩 따끔해서 신경쓰이네요 심장에 문제가 있는걸까요 ,순환기내과
오른쪽 서혜부가 몇일동안 아프더니 가만히있어도 약간의통증과 느낌이 이상하고 안에 혹이있는 것처럼 동글동글 만져지고 앉아있다가 일어날때 너무 아파,오른쪽 서혜부가 몇일동안 아프더니 가만히있어도 약간의통증과 느낌이 이상하고 안에 혹이있는 것처럼 동글동글 만져지고 앉아있다가 일어날때 너무 아파요 피곤해서 임파선이 부은걸까요  병원은 무슨 과로 가야하죠 ,순환기내과
코로나 관련 질문 ,코로나 치료중인데 부정맥이 오면 어떻게 치료가 되는지요    코로나 걸렷는데 부정맥이 오면 더 심각한가요   구체적으로 말씀좀 해주세요   상태라든지 치료는 어떻게 해야하는지  ,순환기내과
괜기저질환자 코로나 접종 문의,  대초반인 제가  년전 심장 스템프  개 시술후 고혈압  고지혈증 으로 장기간 약을 복용하고 있어 간과 신장이 안좋다고 하는데 이러한 질환이 있는 사람도 코로나백신 접종해도 괜찬은가요  코로나가 점점심각해져 저도 문재만 없다면 백신접종하려고 생각중에 있습니다  접종후에 현재 머리 어지럽고 시력관련 하고는 문재가 없는건가요 ,순환기내과
혈압약 복용 후 체중감소 원인은 ,안녕하세요  저희 어머니가 당뇨와 고혈압으로 병원에서 약을 처방 받아 드시고 계시는데  몇 달 전부터 체중이 계속 빠지고 계십니다  거의   kg이상이 빠졌습니다  아침  아스트릭스캡슐    mg   딜라트렌에스알캡슐   mg   크레스토정  mg   포시가정   mg   글루코파지XR서방정    mg   디오반필름코팅정    mg 저녁  글루코파지XR서방정    mg   노바스크정  mg     T  위와 같이 약을 복용하고 계신데 약을 복용하면 몸속  심장 혹은 아랫배 이 뜨거워지면서 혈압이 오른다고 하십니다  혈압 약이 안 맞아서 체중도 감소하고 속에서 열이 나는 것인지 알려 주시면 감사하겠습니다 ,순환기내과
