0,1,2
국가검진 검사결과가 일부 누락되었습니다 ,국가건강검진을 받았습니다   혈압이 높게 나와서  병원에서 콜레스테롤 검사를 추가로 권해서  받았는데요   검사받은 후 의사한테 현재 LDL수치가 높다고 콜레스테롤에 대한 설명을 들었습니다   한번 더 정확한 수치를 확인해보고 싶어서 국민건강보험공단에 접속해서 조회를 했는데  첨부한 이미지에 나온거처럼  콜레스테롤 검사 결과가 전부  비해당 으로 나옵니다   병원에 문의해보니 이건 외래로 받은거라 국민건강보험공단 조회로는 원래 안나오고 무조건 다시 해당 병원에 와야만 조회된다는데 맞나요   질문을 요약하자면  콜레스테롤 검사를 받았음에도  국민건강보험공단에 접속해서 조회했는데 해당 검사결과가 저렇게  비해당 으로 나오는게 맞나요   저게 맞는건지  해당 병원실수로 누락된건지  여부가 궁금합니다 ,순환기내과
혈액검사로 알수없는 빈혈도 있나요 ,제가 예전에 빈혈이 있었는데 빈혈약먹고 괜찮아졌어요  몇년이지나고 다시 예전과 같은 증세가 나타나 다시 피검사해보니깐 빈혈수치는 정상이라고합니다  근데 증상은 예전에 그랬던것 처럼 똑같습니다  혹시 피검사에서 빈혈수치정상으로나와도 빈혈관련질병이 있나요  있으면 어떤것이 있나요 ,순환기내과
혈압약 복용 질문,이전에 약  년정도 복용중이던 약은 세비카정       이었는데 이번에 이사하면서 병원을 옮기다보니 다른 병원에가서 처방받은 약이 디핀스정     mg 입니다 혹시 두 약의 장단점이나 복용해도 상관이 없는지 알려주시면 감사하겠습니다 ,순환기내과
빈혈증상인가요  내공    ,어제 저녁준비하는 과정에서 불앞에서 요리하다가 순간 정신이 몽롱해지면서 중심을 잃을뻔하다가 겨우 정신잡고 다시 요리를했습니다 그이후인 오늘은 큰 증상은없긴한데 걱정이되서요 이런경우 또 병원은 어디로 가야하나요,순환기내과
간장질환 수치 AST ALT GTP 질문드립니다,최근에 건강검진을 받았는데 AST    ALT    GTP    나왔어요  ALT가    이하로 나오야 정상이라던데   이 초과되었네요  많이 심각한 수치인지 질문드립니다  그리고 앞으로 어떻게 해야하는지도 조언해주시면 감사드리겠습니다,순환기내과
심장두근거림증상으로 여러가지검사를했는데 피검사 심전도 심장초음파 운동과부하모두 특별한것없이정상인데 돌연사확률검사수치가    이하가정상   나옴 ,심장두근거림증상으로 여러가지검사를했는데 피검사 심전도 심장초음파 운동과부하모두 특별한것없이정상인데 돌연사확률검사수치가    이하가정상   나옴  아기를돌보다가도 가슴이답답하면 심장마비가올것같고 두렵습니다  그럴가능성도있겠죠  대학병원에가서 다시검사를해야할까요 ,순환기내과
  대    서맥 판단,  월  째주  스트레스를 과하게 받고 흉통이 좀 있고 심장이 두근 거리길래 응급실을 갔는데  심전도 이상이 없길래 그냥 지내다가 또 스트레스 받는 일이 생겨 흉통이 조금 있고 심장이 두근거리고 가끔 답답하길래 병원을 갔는데 심장 초음파는 이상이 없지만 부정맥 검사에서 서맥 판단을 받았습니다   근데 의사선생님이 이건 일반 소견이 아니라서 대학병원가서 더 자세한 진료나 검사를 받으라더군요    주 남았는데 너무 불안해서 그러는데    평소에 운동도 급하게 하는 것도 아닌데 왜 생긴거죠       서맥 판단을 듣고 숨이 더 차고 흉통은 없는데 피곤하다 느끼는게 그냥 신경써서 그러는건지    약물 치료말곤 그냥 본인이 스스로 조정하는거 말곤 무조건 심장 박동기 삽입해야하나요  비용도 비싸고 무서워서요    ,순환기내과
심장박동수,스마트워치확실한가요    정도에서 움직이면     대 일하면    때인데 정상인가요  ,순환기내과
저지혈증에 좋은약,일반건강검진 받으면 고지혈은 좋게 나오는데  저지혈증은 좀 안좋네요  고지혈 저지혈증에 대해 알려주식 어떤 약이 좋을까요 ,순환기내과
대뇌동맥류에 항혈전제를 쓰는 경우   ,코일색전술이나 시술은 전혀 하지도 않았는데 대뇌동맥류에 항혈전제를 복용중입니다 신경외과 교수님이 왜 이런 처방을 내었을까요  궁금합니다   과거력으로는 OMI 오래된 심근경색증  인데   이경우엔 보통 약을 복용하지 않는걸로 알고있는데 왜 안플원 항혈전제 을 복용할까요   의사선생님들 답변 부탁드립니다 ,순환기내과
심작 박동 bpm 질문드립니다,제가 갤럭시워치 로 종종 심장 박동수 bpm을 재보는데요 보통        이렇게 나옵니다  별다른 운동을 안하고 그냥 앉아있거나 잴 때도 이러더라구요 갤럭시워치  기기에는 평균 bpm이       이라고 하던데 병원에 가봐야 하나요  심장 관련한 검사는   년  월에 백신 맞고 심장 부분에 통증이 있어서 심전도  심초음파   시간 홀터검사를 했는데 별 문제는 없었습니다  그때 진단해주신 심장내과 선생님 말씀으로는 병원에서 맥박을 잴때는    정도로 높은데 집에서 재는   시간 홀터검사 결과지를 보면 정상이라고 긴장을 많이 하는 성격이냐고 이렇게 물으신 적이 있으십니다  그래서 그때는 모두다 정상  별다른 약도 처방받지 않았습니다 ,순환기내과
어지럽고요울렁거리고요 혈압이 올랐다 내렸다 안잡혀요        맥박은   나왔어요 다시 재니혈압기 에라나요 혈압 오르고 내리고 계속 어지럽고울,어지럽고요울렁거리고요 혈압이 올랐다 내렸다 안잡혀요        맥박은   나왔어요 다시 재니혈압기 에라나요 혈압 오르고 내리고 계속 어지럽고울렁거려요 병원가서 피검사부터 CT MRl찍었는데 아무이상 없데요 다섯시간후 혈압 잡혔어요 왜 혈압이 이럴까요,순환기내과
스페인 감초분말차 를 하루 g씩  티스픈 아침 저녁으로 약 주간 복용했는데 정해진 복용법  혈압이    까지 상승 하고 거품뇨가 나오네요  복용,안녕하세요    세 남성 입니다 스페인 감초분말차 를 하루 g씩  티스픈 아침 저녁으로 약 주간 복용했는데 정해진 복용법  혈압이    까지 상승 하고 거품뇨가 나오네요  복용을 중단하면 혈압이 정상으로 돌아올까요 아니면 병원진료를 받아야 하나요 진료를 받는다면 병원 어느과로 가야하나요   고견을부탁 드림니다  ,순환기내과
관장동맥 조영술 받았습니다,관상동맥 조영술을 받았습니다 경련성 혈관이라면서 약물치료 해보자고 콜레스테롤 약을 처방받았습니다 관상동맥 조영술 한지 일주일이 지났습니다  언제부터 술 마실수 있나요 ,순환기내과
자율신경실조증인가요 ,가끔 두통 어지러움 가슴이꽉막혀있는느낌 호흡곤란  누워있다일어나면 어지럽고 가만히서있으면 심장이빨리뜀 숨참 명치조임 가슴조임 ct 폐 엑스레이   시간심전도 피검사 심장초음파 까지 다해봤는데 건강하답니다  아직   살밖에 안되서   심장문제는 아닌거같은데 심한스트레스받고 이런증상들이생겼는데 이제  개월가까이 되고있습니다  공황장애는 아닌거같고 자율신경실조증인가요 ,순환기내과
병원 어느과를 가야할까요 ,작년   월에 건강검진을 받은 후 부터 밥을 먹으면 얻히는 느낌이    일 계속되서 병원을 갔었습니다  건강검진시에 위내시경에서는 약한 위염소견이 있었지만 신경쓸 정도는 아니라며 약을 처방받았습니다   인터넷에 보니 체한느낌이 심장관련 질환의 증상일 수도 있다고 하여 가족력도 있어서  순환기내과를 방문하여 증상을 말하고  엑스레이와 심전도  피검사를 받았습니다  피검사에서는 경계에 걸쳐있어서 약을 처방받지는 않았지만 콜레스테롤 수치가 좀 있다고 하고  심전도는 특이사항 없었고  엑스레이상에 변이 조금 보인다고 약을 처방 받았습니다  소화가 안돼는 증상은 조금 지켜보자고 하고 대략 한달정도가 되었습니다   현재는 얻히는 느낌은 없지만 밥을 조금만 먹어도 배부른 느낌이 많이 들고 왼쪽 가슴에 뻑뻑   한 느낌과 콕콕찌르는 느낌이 있습니다  왼쪽 가슴통증은 저녁을 먹은 후에 더 심해지지만 곧 사라지기는 합니다     년전에도 비슷한 통증으로 심장관련 병원을 방문하여 심전도 기계를 달고 집으로 와서 계속 체크했었는데 부정맥이 있기는 하지만 일반인은 못느낄 정도라고  가족력때문에 예민한 것 같다고 했었습니다   통증이 오랫동안 지속되는 것도 아니고  일상생활에 지장을 줄 정도 역시 아닙니다  병원을 가봐야 할 것 같은데    역시 심장관련 병원을 가보는게 맞을까요   아  그리고 건강검진에서 감마지피티 수치가 높게 나왔습니다   그리고 큰 병원가서 심장혈관검사 같은 걸 받아보면  실비처리가 되나요  병이 확정되지 않으면 실비처리가 되지 않나요  ,순환기내과
제가 기립성 저혈압에 서맥성 부정맥이,고등학생이고 제가 기립성 저혈압에 서맥성 부정맥이 있는데 운동을 해서 심박수를 높이는게 도움이 되나요  서맥에 좋은 운동  음식 알려주세요,순환기내과
허벅지 저림 증상도 하지정맥류 의심해봐야 하나요 ,장시간 의자에 앉아 있는 사무직입니다  최근 앉아 있을 때 허벅지 뒤쪽 엉덩이 근처 부위가 찌릿찌릿한 느낌이 드는데 쥐 나기 전  약간 저린 그런 느낌입니다  오른다리를 꼬는 습관이 있는데  오른쪽만 해당 증상이 있는데 찾아보니 하지정맥류 초기 증상일 수 있다고 해서 질문해봅니다    찌릿함이 느껴질 때 허리를 펴면 괜찮았는데  최근에는 바른 자세로 앉아 있어도 의자에 앉은 뒤 일정 시간이 지나면 해당 증상이 있어서 어떻게 해야 해결되는지 알고 싶습니다    운동하면 되는지  쿠션을 쓴다든지 해결책을 알려주시면 감사하겠습니다 ,순환기내과
기립성 저혈압 두통,학생입니다    월쯤 학교 조퇴 할 정도로 편두통이 심하게 와서 동네 병원에 갔는데 제가 기립성 저혈압도 있어서 방학 때 대학병원 가서 검사를 받아보라고 하셨어요  근데 그 후로 편두통 증상은 없고   월달부터 원래 앓고있던 기립성 저혈압이 좀 심해지면서 요 근래에 잔두통이 많이 있네요   이게 관련이 있나요  만약에 맞으면 대학병원에 가야하나요 ,순환기내과
혈액검사 결과 간 수치,AST     ALT     GTP      가 나왔습니다  어떤질병이 의심되나요 ,순환기내과
제가 발작성 상심실성빈맥 으로 인해 시술 예정인데 본래 부정맥도 있는것 같은데 의사분이 아실까요 ,고주파전극도자절제술 예정인데 그 이유가 발작성 상심실성빈맥때문에 한다는데  제가 가끔 발작성 그게 안일어날때도 심장박동수가  초에    번정도로 빠르거든요  이게 그냥 부정맥도 있는 것 같은데 이게 있다는걸 병원가서 이것저것 검사했을때 결과로 의사분도 알고 계실까요   시술 후 발작성 상심실성빈맥만 고쳐지고 부정맥은 안고쳐지는게 아닌지 불안하네요   의사분은 다 알고 계시겠죠  ,순환기내과
숙였을때 심장통증,원래 안그랬는데 한  개월전부터 신발끈 묶으려고할때 상체 숙이는자세 있잖아요   그자세를 할때 심장인지는 모르겠는데 왼가슴쪽이 윽 하면서 아프네요  관련 병이 뭐가 있을까요 ,순환기내과
하지정맥류가 맞나요,제 다리 상태가 이런데 하지정맥류가 맞나요 맞으면 수술해야하는지 비용은 얼마가 나올까요 평소 다리가 한번씩 저림을 느낍니다,순환기내과
코로나 밀접접촉자 재검사,어머니께서 코로나 확진 후   밀접접촉자로 자가격리까지 다 하고 격리해제 전 음성판정까지 받았습니다   본인  그런데  주일 뒤에 저는 또 다시 재검사를 받아야하나요 ,순환기내과
걸을때마다 눈앞이 핑 돕니다,앉았다 일어나면 기립성 저혈압이 있긴 잇는데요 요즘은 그정도가 아니고 그냥 걷다가 눈앞이 핑돕니다 기립성 저혈압때 느끼는 느낌이 아니라 좀 다른 증상 입니다 원래 부정맥이 있고 인데놀을 먹고있는데 부정맥이 약먹을 정도는 아니라 해서 약안먹었는데 우울증 공황이 있어서 인데놀을 먹습니다 그런데 정신과약 먹은 이후로 일처리가 너무 느려져서 약을  일정도 끊었는데 갑작스런 증상이 이렇게 나타나네요 약먹기 전에는 이런 증상이 없었는데 약먹은 이후로 심장이 약먹을정도가 아닌데 약 복용으로 무리를 느낀건지 복용 중단후 걸음걸음마다 핑 돌면서 의식을 잃을 것 같은 느낌을 계속 받습니다 약부작용인거죠 이거 아니면 뭔가요,순환기내과
손가락 손바닥 혈관이 스스로 터젔어요,예전에 새끼 손가락 또 검지엄지 그리고 지금은 손가락과 손바닥 이어지는 부분의 혈관이 스스로 터졌거든요 일단 갑자기 가만히 못 있을 정도로 그 혈관이 뜨거워지고 풍선 터지는듯한  통증이 약  초  분 쯤 되다가 터지고 나면 주변이 빨개지고 다음날 퍼렇게 멍이들고 몇일 지나면 없어져요 저는 계속 왼손에서만 그래요 병원가서 손톱 밑 혈관 검사 했는데 괜찮다고 했었는데   몇년전이지만요 무슨 검사를 해봐야하고 어떤 치료가 있을까요 뇌   혈관이 터질까 겁나요  ,순환기내과
한번씩 혈맥이 불끈불끈 거립니다 ,관자놀이라든가  엉덩이라든가 팔쪽이라든가  하루에    번씩   한번 발생하면 해당 부위에서  번정도 혈맥이 불끈불끈  이런 느낌을 받습니다   이게 혹시 혈액이 역류하는건가요  혈관이 튀어나오거나 통증이 있거나 그러진 않습니다   증상의 이유와  이 증상을 개선하려면 어떻게 해야하는지 여쭙고 싶습니다 ,순환기내과
  세   정상 체중 하지만   고콜레스테롤혈증 의심    어떻게 해야할까요    충격이 큽니다   ,총 콜레스테롤       HDL 콜레스테롤      트리글리세라이드       LDL 콜레스테롤           세   정상 체중 하지만   고콜레스테롤혈증 의심      대 건장한 청년이 왜 콜레스테롤이 높은지 모르겠고    객관적으로 이 수치가 어떤 수준인거고    앞으로 어떻게 해야하는지 궁금하네요     이 나이에 약을 먹는건 아닌 것 같고     충격이 큽니다   ,순환기내과
심근경색으로 오래전에 스탠트를 네개 시술하셨고요  화장실에서 대변을 보신후 의식이 없으셔서 심정지가 왔던터라 심폐소생술을하고    와 함께 인근,심근경색으로 오래전에 스탠트를 네개 시술하셨고요  화장실에서 대변을 보신후 의식이 없으셔서 심정지가 왔던터라 심폐소생술을하고    와 함께 인근병원 중환자실에 계시는데요 의식이 아직 안깨어나네요 뇌는 이상없고 부정맥이 보여 약물투여중인데요 의식이 깨어날확률이 궁굼합니,순환기내과
심장  분에   회정도 뛰는데 평소에,그리고 가끔씩 엄청빨리뛰고 머리까지두근거림  답답하고 약간 현기증나는데 부정맥이겠죠  초기에 잡으면 완치가능한가요  특전사가 진로인데 후   ,순환기내과
기립성 저혈압,제가 일어났는데 갑자기 머리 엄청 띵하고 순간적으로 더우면서 추워지고    귀 엄청 먹먹해지고 숨쉬기 힘들어지던데 이거 뭔가요 개쫄았네요 순간,순환기내과
낮은 HDL의심이라고 나오는데 어떤건가요 찾아보니 고혈압 당뇨 치매 걸릴확율높다고  나오는데    뭐가 문제인가요 어떻게해야되나요 알려주세요,낮은 HDL의심이라고 나오는데 어떤건가요 찾아보니 고혈압 당뇨 치매 걸릴확율높다고  나오는데    뭐가 문제인가요 어떻게해야되나요 알려주세요,순환기내과
고혈압 지병을 가지고 있는 사람이  저혈압 수치까지 떨어지는 것,안녕하세요 저희 어머니는 고혈압 약을 매일 복용중이십니다  그런데 요즘  저혈압이 되었다가 고혈압이 되었다가  혈압이 굉장히 불규칙하게 나오신대서 걱정이 심하게 됩니다   어머니가 최근에 스트레스를 심하게 받을 상황에 처해 계셔서 더욱 더 걱정이 돼요   할아버님 병간호 중이시고  정신적 스트레스   운동을 못 하고 계신 상황   한 줄 요약 고혈압 지병을 가지고 있는 사람이  저혈압 수치까지 떨어지는 것  걱정 안 해도되는 상활 일까요 ,순환기내과
재발성 구내염 베체트병일까요,제가 구내염을 달고 살았었는데 요즘 피곤하니  개월사이에 구내염 생겨서 병원을  번정도 갔었어요 처음엔 약먹고 좋아지는거 같더니 이번엔 심해서 회복이 더디네요 아랫입술은 갯수를 셀 수 없이 생겼고 혓바닥도 페여서 말하는데에도 무리가 있고 먹는것도 힘듭니다     제가 몇년전에도 구내염달고 살다가 목구멍도 헐고 생식기 궤양도 생겼었는데  다시 구내염이 심해지니 겁이 나네요 찾아보니 베체트병이랑 비슷한거 같은데 생식기궤양은 몇년전에 두세개 생겼다 없어졌었어요 류마티스 내과가서 검사를 해보는게 좋을까요 ,순환기내과
만  세 여성입니다 이번 건강검진에서 콜레스테롤 수치가 이렇게 나왔네요  고지혈증약을 당장 먹어야하나요 이약은 한번 먹음 평생 먹어야하는건가요 ,만  세 여성입니다 이번 건강검진에서 콜레스테롤 수치가 이렇게 나왔네요  고지혈증약을 당장 먹어야하나요 이약은 한번 먹음 평생 먹어야하는건가요 ,순환기내과
고혈압과 시알리스,고혈압환자인데 시알리스 복용하면 혈압이 많이 떨어지나요,순환기내과
혈액검사결과 질문,혈액검사를 했는데 Em HS CRP 심혈관 질환 예측지표 가 참고치는      인데 저는      으로 결과가 나왔는데요 전에 부정맥 조기심실수축 판정을 받았었는데 이 영향일까요 ,순환기내과
콜레스테롤 수치,총 콜레스테롤     HDL     LDL      중성지방       혈압          공복혈당     키    cm  체중   kg    세  비흡연 비음주 운동 주  회 꾸준히 하고 있고 고열량 고탄수화물 자제하고 있는데 콜레스트롤 만큼은   년째 어떻게 조절이 안되네요 선생님의 고견을 듣고 싶습니다,순환기내과
발작성 빈맥,안녕하세요 최근  년동안 저희 엄마가 약  달에 한번 씩 갑자기 심장이 빨리 뛴다고 하시거든요 그러다가 한  분 지나면 괜찮으시대요  저도  년전에 딱 한번 그런적이 있었어요 제가 그때 많이 지치고 힘들었을때여서 그런가     이 외의 다른증상은 전혀 없으시대요 제 생각엔 스트레스를 많이 받거나 피곤하실때 그러시는거같아요 찾아보니까 심하면 돌연사로 죽을수도 있다고   제발 별일 아니었으면 좋겠네요        저희 엄마 증상을 봤을때 병원을 가야하나요     병원가서 검사할때 어떤식으로 하나요 ,순환기내과
수면 중 심박수 상승,요즘 잘때 수면 질 측정을 위해 애플워치를 차고 자는데  꼭 주   회 정도는 새벽  시쯤에 심박수가    까지 상승합니다   사진의 분홍색 그래프  이 사이에 깨는 것도 아니고  평소에 심장이 빨리 뛴다고 느낀 적도 없는데 꼭 새벽에 이런 기록이 남아있더라구요  제 애플워치가 잘못된건지  아니면 병원에 가봐야하는건지 모르겠습니다  수면 중 심박수가    까지 뛰는게 말이 되나요    ,순환기내과
키가     몸무게는   kg이고요,안녕하세요 엄마가 건강검진을 하고 결과가 나오셨는데 고밀도콜레스테롤이 너무 높게 나온것 같아서요  고밀도 콜레스텔로이   이 나왔는데 고콜레스테롤혈증의심으로 나와서 걱정되서 높게 나오는 이유와 고칠수있는 방법을 조언 구하고 싶어서 올렸습니다    키가     몸무게는   kg이고요 나이는   살 여자입니다,순환기내과
혈압약 문의,오늘   시간혈압검사를 받고 고혈압 판정을 받아서 혈압약 처방을 했습니다  먹고 한 한시간 정도 지났는데 지금 심장 쿵쿵거리는게 느껴지고 얼굴은 뜨거워집니다  문제가 있는걸까요 ,순환기내과
심장 관련 질문,오늘따라 몸이 이상합니다  운동을 쉰지 일주일 정도 되었는데  평소에  km도 문제없이 뛰었는데    m도 안뛰었는데 갑자기 숨이 헐떡여지고  집에 오니까 조금 어지럽더라구요  집에 온지  시간 정도 뒤 즈음에 갑자기 심장이 답답하고 조금 빨리 뛰었습니다  분당   회정도 뛰던거 같습니다  심장에 뭔가 문제가 생긴걸까요   가족력도 없고 선천적으로 심장 관련해서 아무런 질병도 없습니다   ,순환기내과
간수치 궁금해서 질문드립니다,  세 남성이구요   AST    ALT    감마지티피    간기능 이상 의심 건강검진 결과입니다    체중은 정상범위이고 술을 상당히 즐겨먹습니다   혹시 간에 문제가 있는걸까요 ,순환기내과
고지혈증 가족력이 있는데 이뇨제  일 복용해도 될까요,이명 때문에 이비인후과를 다니고 있습니다 선생님이 이뇨제 중 다이크로짇을 처방해주셨는데요 가족 중에 고지혈증 환자도 있고 저도 건강검진 때 콜레스트롤이 좀 높게 나왔던 적이 있어서 먹기 좀 꺼려지네요  일 복용으로 고지혈증에 걸리진 않겠죠 ,순환기내과
술마실때마다 머리에 물찬느낌이들고 어,  살여자입니다 술마실때마다 머리에 물찬느낌이들고 어지럽고 귀가멍멍해지고 심장 가슴이 아픕니다   왜그럴까요  어디병원을가야하지 요새 감기도걸려서 목기침부터해서 코로나는아닌데 너무힘듭니다,순환기내과
청소년 고혈압   살,  살인데 혈압이       인데 고혈압인가요 ,순환기내과
혈압이 있어 매일아침마다 체크를합니다 그런데 얼마전부터 고개만숙이면 어지러워 핑돌다 정신차리면 숨이가쁩니 다 혈압체크할때 마다 혈압이 떨어져있어,혈압이 있어 매일아침마다 체크를합니다 그런데 얼마전부터 고개만숙이면 어지러워 핑돌다 정신차리면 숨이가쁩니 다 혈압체크할때 마다 혈압이 떨어져있어서 약때문에 그런건지 모르겠네요 혈압약때문에 어지러운가요 약은 텔미원플러스정        밀리그램 먹고있습니다,순환기내과
뇌동맥경화로 인한 협착 및 혈전으로 말미암아 뇌경색이 왔습니다 퇴원후 고지혈증약과 항혈전약을 복용 중입니다 치료와 회복에 도움이 될까하여 고압산,뇌동맥경화로 인한 협착 및 혈전으로 말미암아 뇌경색이 왔습니다 퇴원후 고지혈증약과 항혈전약을 복용 중입니다 치료와 회복에 도움이 될까하여 고압산소치료를 알아보고 있는데요 도움이 되는지요  오히려 해가 되는지요  답변부탁드립니다,순환기내과
볼일 볼때 힘을 주면 머리가 띵하니 아픈데   ,제가 약간 변비가 있긴 하는데요  볼일을 볼 때 힘을 좀 주고 나면 머리가 띵    하고 아픈 느낌이 와요   이런 증상이 갑자기 혈압이 올라서 그런 건지 해서 혈압기로 측정을 해보면 혈압은        이렇거든요   도대체 어떤 증상일까요  혹시 그러다 뇌에 문제가 생기는 건 아닌지 궁금합니다 ,순환기내과
ekg 봐주세요 심근경색 인가요 ,기계에 어브노말 이케이지 라고 나오는데 이거 심근경색 양상인가요 ,순환기내과
심장 초음파  심전도  혈액검사 정상인데 부정맥 가능성,검사 결과 전부 정상이라 하셨구요  심장 초음파도 되게 꼼꼼하게 해주시던데 심장두께  판막 전부 정상이라 하셨거든요   심전도도 일정하구요 그래도 부정맥일수도 잇을까요  부정맥도 가벼운 부정맥이 있던데 만약 있다해도 가벼운 정도일까요 ,순환기내과
이두에 혈관 막힘,혈관이 막힌듯있어요   운동을 하니 쪼금더 심해진거같은데 병원가야하는건가요  ,순환기내과
