121,내공    드립니다 검지 손가락 꿰멘 후 주먹이 안 쥐어져요,안녕하세요  제가 저번주 목요일에 칼에 검지손가락 윗부분을 사선으로 베여서 응급실 가서 바로 꼬매고 쭉 스프린트를 낀 상태로 있고 중간중간에 소독할때마다 주먹을 쥐어보려고 했는데 잘 안되서 꿰멘 거 때문에 그런가 생각하고 있었는데 오늘도 방금 소독하려고 스프린트 제거하고 주먹을 굽히려고 하는데 뭔가 주먹이 애매하게 굽어지고 엄청 힘을 줘야지 비슷하게 주먹이 쥐어지고 완벽하게는 안 쥐어져요   그리고 세게 힘주면 뭔가 땡기는거처럼 아프구요   응급실에서 꼬매기 전에 힘줄이 끊어졌을 수도 있어서 확인 여러번 해서 다행히 힘줄은 안끊어졌다고 했는데 지금 주먹이 잘 안쥐어지는거면 혹시 힘줄이 끊어진건지 걱정이 되서요   아시는 분 계시면 저 좀 알려주시면 감사하겠습니다    진짜 너무 걱정이 되서요    내공     드릴게요  감사합니다  도와주세요  ,응급의학과
122,코로나 자가격리중 양성,혹시 코로나 자가격리하다가 양성이뜰수있나요  제 친구가 어제 확진판정받고 저는 밀접접촉이라고 어제부터 자가격리 들어가서 검사했는데 음성이 나왔구요 근데 어제 저녘부터 조금씩 목 간지럽더니 지금은 기침도 조금씩나오고 목도 아프기 시작해요    목이 답답한기분  근데 혹시나 양성이라면 어제 검사해서 음성떴는데 하루만에 양성이될수가있나요   머리도 아프고 몸도 욱씬거리고 조금씩 어지러워요  ,응급의학과
123,탁 막히는 호흡,뭔가 목에서 걸리는거처럼 막히는 호흡곤란 이 왔을때는 대처법이 어떻게 되나요 ,응급의학과
124,손바닥 색깔 노란색인가요  황달인가요,손바닥 노란색 아닌가요 ,응급의학과
125,머리가 어지럽고 아프고 기침이 잘 안 멎어요,  살 여학생인데요 저번주부터 주말에  일 연속으로 무리하게 놀면서 몸살에 심하게 걸렸었어요 제가 원래 감기걸리면 목이 잘 부어서 기침이 많이 나고 쉽게 안 낫거든요 그래서 병원을 단골 두 군데를 가서 총  번 정도는 다녀왔던 거 같아요 처음 병원에서는 항생제랑 기침약 처방 해주셔서 먹었고 조금은 나았던 거 같고 좀 낫고 나서 두번째로 간 병원에서는 항생제 말고 그냥 좀 강한 약을 처방해 주셨어요 근데 꾸준히 먹고는 있는데  일째 자기 전에 몸살 끼가 돌고 지금 어머니랑 저 둘 다 머리가 어지럽고 띵하고 몸이 뜨거운 것 같아요 심지어 저는 기침도 좀 나요 열 재보니 둘 다 정상이긴 했는데 혹시 코로나나 독감일까 무서워서요 어머니는 월요일닐 검사하러 가시는데 저도 코로나일까봐 무섭지만 저희 어머니는 진짜 다른 지병 생기면 안되거든요 수 금요일날 중요한 수술이 있어서 늦어지면 악성종양이 다른 곳에도 전이가 될 수가 있어서 그 때 하셔야하는데 너무 무서워요   저도 검사를 해봐야 하긴 하는데 지금 당장은 못하니까   또 병원을 두 군데나 갔는데도 발견을 못할 수도 있는거겠죠   ,응급의학과
126,유리에 찔림,이틀 전에 일하다가 얇고 긴 유리에 손가락이 찔렸는데 유리가 사진에 표시한 만큼  센치정도까지 들어왔다가 나갔는데 병원을 안 갔어요     근데 오늘 봤는데 이렇게 돼 있는데 괴사하거나 그런 건 아니겠죠      병원을 꼭 가야 할까요 ,응급의학과
127,생리중 백신접종,금요일밤에 생리통이 너무 심해서 응급실에서 수액맞고 토요일 새벽에 들어왔습니다 이제는 생리통이 별로 없는데 월요일에 백신 맞아도 될까요  ,응급의학과
128,어디병원으로 가야하는지 알려주세요 ,엄마가 얼마전부터 귀 위쪽부분 머리가 지끈지끈 아프다하시더니 속도 며칠내내 메스꺼워서 소화도 잘 안된다하셨는데 오늘 아침에는 얼굴이 심할정도로 퉁퉁 부어서 외출을 할수없을정도로 부으셨다는데 이런 증상은 어디병원으로 가야 검사받을수있을까요   ,응급의학과
129,급해요 명치꼬이는 느낌,오늘 일어났을 때부터 아직까지도 명치 꼬이는 느낌때문에 속이 진짜 땡기듯이 아프고 토할거 같은데요 지금은 걷지도 못하겠고 명치에 손만 스쳐도 아파요 응급실 가도 되나요   아빠가 응급실은 진짜 죽을듯이 위급할때만 가는거라는데요 그렇게 계속 듣고 나니까 또 죽을거 까진 아닌거 같음데 진심으로 아무것도 못하겠어요 대학병원 응급실 말고  차병원 응급실도 가면 안되나요 ,응급의학과
130,닭뼈가목에걸렸었을때,치킨을먹다 잘못해서 작은뼈가목에걸린느낌나서 토를했는데 토하는도중 피가조금나오고 뼈가 내려갔는지 어쩐진 몰르겠는데 목에뭐가거린느낌이나요 응급처치할수있는방법이있을까요 ,응급의학과
131,채혈 시 알코올 솜 오염 감염,건강검진을 하였는데 간호사가 이것저것 만지고 검진해주며 그손으로 채혈을 했는데요   채혈 시 알콜솜을 꺼내서 씻지도 않은 손가락으로 주물어서 알콜이 뚝뚝떨어지게 짜내고 그솜으로 소독 후 채혈한다음 책상위에 두었다가 그솜으로 다시 지혈하였습니다   주사부위 발적이나 통증은 없는데 영 찜찜하고 불안합니다   피부감염 말고 다른 병에 감염될 확률이 있을까요   며칠 지켜보면 괜찮을 일인지 알려주세요   혹시 감염병이 걸릴수 있다면 어떤 병 종류가 있을까요 ,응급의학과
132,어떻게 하나요,저희 엄마가 저녁에 죽을 한그릇에 그의 반  정도 더 먹으면서 음식 매운 것 드시고  나중에 배가 너무 아프다고 하셨어요  화장실도 다녀오셨어요 그래서 지금 약을 사서 먹어야하나요  급해요,응급의학과
133,팔이 칼에 베였을 때,팔이 칼에 깊게 베였을 때 신경이 잘릴 수가 있나요   팔 신경이 잘리면 일상적인 생활을 하지 못하나요 ,응급의학과
134,답변 부탁드려요,이번주부터 허리 옆쪽 뒤쪽아프고 사타구니아프고 배아래아픈거는 전립선문제인가요 맹장문제인가요 대변을 오늘 자주쌌습니다,응급의학과
135,화상,제가 어제 화상을 입고 어제 병원을 가서 노란색 약을 먹고 큰 파스같이 생긴 밴드 를 붙였거든요  근데 아까부터 그 밴드가 너무 축축해서 봤는데 엄지발가락쪽에 엄청 큰 물집이 있더라구요 축축한 이유가 이거인지는 모르겠지만    이 물집 냅둬도 되겠죠  오늘 다시 병원을 가긴 하거든요   그리구 좀 축축한데 이거 괜찮을까요   축축한 이유는 뭘까요 좀 전체적으로 축축해요 그 엄지에 있는 물집은 안 터졌어요 ,응급의학과
136,실수로 몽고메리 결절을 짰는데 병원에 꼭 가야할까요   ,몽고메리 결절을 짰는데 처음에는 고름이 나오고 시간이 지날수록 피가 섞여서 나왔어요 짤 때 아프거나 하지는 않았고 지금은 연고 바르고 밴드를 붙여놓은 상태입니다    병원을 꼭 가야 할까요  연고를 계속 바르면 나아지지 않을까요    ,응급의학과
137,무슨 병인지 알려주세요,두통에 화장실도 많이가고 설사 같은게 나오고 소화도 잘 안되는 느낌에 숨 쉬기도 불편하고 뼈마디도 아픕니다 목도 쉬어서 목소리도 안나와요 왜 이러죠 일주일째 이럽니다,응급의학과
138,발톱 들어감,들고있던 물건을 놓쳐서 발에 떨어뜨렸다가 발톱이 이렇게 들어갔는데 이거 괜찮은건가요 몇시간 지났는데 제대로 걷거나 그냥 가만히 있어도 욱신거립니다 병원 가봐야 되나요 ,응급의학과
139,이거 어디가 아픈건가요 ,일단 제가 아픈곳이 한 두 군데가 아니라 헷갈리시겠지만 적어볼게요   증상들은 화이자  차 접종   월  이후 부터예요   대 여자구요  사진에 표시한 왼쪽 가슴 밑이 아파요 접종 후 몇주는 정말 찌르는듯이 세게 짧은 시간동안 아팠는데 점점 괜찮아지더라고요 그래서 사라질 줄 알았더니 아예 없어지진 않구요 크게 움직일 때  왼쪽으로 누울 때 아플때도 안 아플때도 있음   그리고 누를 때 아파요 가슴중앙 통증은 그냥 뻐근하게 계속 아파서 제가 운동부족이 심한편이라 무시했는데 위에 말한거처럼 통증이 같이 있어서 걱정되네요 또 가끔 표시된 왼쪽팔이 시리게 아플때가 있어요 이건 안움직이면 괜찮아집니다 위의 통증때문에 병원에 가서 가슴 X lay 랑 심전도 받았을때는 결과에 뭐가 없었구요 또 다른 하나는 제가 소화불량이랑 위산역류가 있어요 변비랑 같이    근데 병원에서는 증상이 비슷할 수가 있다고 하셔서 관련약을  일정도 복용했을때 조금 괜찮았던거 같기도 하고 그냥 기분탓인거 같기도 하고    깔끔히 낫지는 않았어요 여기서 무슨 병원에 가서 어떤 검사를 받아야 할까요 ,응급의학과
140,철제 캐비넷에 손가락 베였어요  ,제곧내입니다 탈의실에서 옷 갈아입다가 철제 캐비넷 문쪽에 손가락 베였는데    상처가 깊지는 않아요 파상풍 예방 주사 맞아야하나요     녹슬진 않았는데 그렇다고 안녹슨것도 아니고     조금 연식있는 캐비넷입니    ,응급의학과
141,울렁거림과 두통,정확히 그저께  금요일부터 속이 계속 안좋아요 목요일에 너무 많이 먹고 자서   시간자고 강의듣고 그래서 그런건줄 알았는데 충분히 자고 일어나도 속이 안좋고 은은한 두통이있네요 백신 차맞고나서 몸살 후 지속되는 은은한 두통과 증상이 같아요  배고픔은 계속 느껴지지않고 금요일부터 생리가 시작됐어요  토요일 오후 시부터 새벽 시까지 일하면서 빈속에 아메리카노를 마셔서 그런지 속쓰림  울렁거림 어지러움이 있었고 좀 나아지는듯하더니 퇴근하고 밥먹었더니 평소 양으로 먹었는데도 울렁거림과 은은한 두통이 있어요  체한것같아 손도 따보고  까스활명수도 먹고 하였지만 효과가 없었어요      체했을 때도 두통이 있나요  그럼 왜 며칠이 지나도 체기가 안 가라앉죠     혹시 경미한 증상의 코로나일 수도 있나요  그럼 제가 혹시몰라 검사하는것도 돈을 지불해야할까요      생리통이 허리 배 통증말고는 없었는데 새로 생길수도 있는건가요 ,응급의학과
142,쇄골에 멍울 ,어느날 갑자기 쇄골에 이상한 멍울 같은게 생겼습니다   외상은 없는데 만져보면 안에 뭐가 있는 느낌이랄까요  이게 뭔가요 ,응급의학과
143,할머니 뇌출혈  ,아까   시쯤에 할머니께서 넘어지셔서 응급차로 병원까지 실려가시고있다는데 지금까지도 실려가시고있으시대요     시간이나지났는데 무슨 문제생기는거 아닌가요  의식은 있으시다는데,응급의학과
144,입안이 아파요,입안이 사진처럼 하얗게되었는데 아파요   이게 뭘까요 ,응급의학과
145,화이자  차,제가   월   일 화이자 백신  차를 접종했는데 오후  시까지 괜찮다가 갑자기 토요일로 넘어가면서 열이      까지 올랐어요 백신 접종한 병원으로 가야하나요 ,응급의학과
146,스테이플러 손가락 찍힘,스테이플러를 손가락에 냅다 찍은건 아닌데    그 종이가 두꺼워서 안박힌거 뽑다가 사진 부위에 찍혔거든요    시험기간인데 저는 쓰면서 외우는 편이라 연필잡는 곳에 저렇게 찔리니까 너무 이프더군요 기숙사 생이라 매일 보건실가서 후시딘이랑 연고 발랐는데 딱히 소독은 안했어요 근데 피부가 뚫린부분이 다시 자란 것 같은데 여전히 연필을 잡아도 아파요    파상풍인가요   ,응급의학과
147,뇌수막염인가요 ,어제부터 오한과 두통이 심하고 열이   도 이상에서 내려올 기미를 안 보여서 오늘 동네 병원에 가봤는데 약을 이틀치 지어주시더니 이틀 지나도 호전 기미가 없으면 큰 병원에 가서 뇌수막염 검사를 해보라고 그러더라고요  병원 다녀온 뒤로 두통은 확실히 좀 아라졌는데 열이랑 오한은 그대로라서 조금 걱정이 되네요  뇌수막염 의심 증상에 움직이면 뇌가 울리는 듯한 느낌에 헛구역질이 날 수 있다던데 그런 느낌은 한 번도 없었고 속도 괜찮습니다  뇌수막염일 가능성이 있나요 ,응급의학과
148,코로나 증상,오늘 아침에 갑자기 허리가 아프고 열이    까지오르고 코도 좀 막힌거 같은데 이거 코로나 증상인가요    어제는 목이 부어서 병원갔다가 왔어요 그리고 오늘 선별진료소 갈예정,응급의학과
149,너무피곤함,제가  일전부터 갑자기 너무피곤하고 머리도 약간 어지럽고 노란가래가 나오더라고요 이게 무슨증상이죠,응급의학과
150,니크롬선에 찔렸어요 ,집에서 니크롬선 열선으로 뭘 만들다가 엄지가 찔려서 피가 났는데요   혹시 파상풍에 걸릴수도 있나요 ,응급의학과
151,상처 회복되고 있는거 맞나요 ,현재 소독해주고 하루동안은 후시딘을 사용하다 계속 마데카솔을 주기적으로 발라주는데 하얀색 곰팡이 같은게 올라오고 점점 상처가 파여가는 느낌이 드네요  새살이 자라는 과정일까요 아니면 염증일까요  ,응급의학과
152,새끼 손가락 꺾였는데 내공   ,아까  시반쯤 장난치다가 손가락이 어떻게 꺾인건지는 몰라도 순간적으로 확 어떻게 됬거든요 그러고 잠깐 아프더니 별생각 없었는데 좀 지나고 나니까 새끼손가락이 구부릴때 쫙필때 아파요 못하는건 아닌데 할때마다 아파요 부은건지는 질 모르겠어요 병원을 가봐야할까요 ,응급의학과
153,교통사고 입원,교통사고가 난 뒤에 입원을 빨리 해야 좋나요  오늘 첫날이라 부딪친 부분만 통증이 있어 아직 참을만 해서 입원은 안하려고 하는데 혹시라도 다른 곳도 아프기 시작하면 입원을 하려고 합니다  사고일 시점으로 일주일 내로 입원하면 된다고 하는데 사고일 기준 입원을 빨리 해야 피해자 입장에서 더 좋나요  아니면 일주일 내 아무때나 입원해도 차이가 없는건가요 ,응급의학과
154,머리 부딪히고   시간 후 통증,중학생입니다  아까 점심시간에 머리 높이에 달려있던 위급상황에 쓰는 손전등 통의 날카로운 모서리에 뒤통수를 세게 부딪혔는데 아직까지도 통증이 남아있습니다  머리도 좀 부었고요  부딪힐 때 하늘이 노래지고 세상이 빙빙 돌았습니다  이런 경험은 처음이네요  베개에 뒤통수를 대면 눌려서 통증이 있습니다  다른 머리보다 그 부위가 살짝 뜨거워요   시      분 쯤 부딪혔는데 지금은   시간이 지났네요  아직도 아픈데 정상이겠죠    불안해서 잠을 못 자겠네요  위로라도 좋으니 빨리 답변 부탁드려요   일단 질문분야는 뜬 응급의학과로 하긴 했습니다,응급의학과
155,두통   속 울렁거림   구토 등,뒷목 두통이 너무 심해서 처음엔 정형외과에 갔습니다 목 뼈  근육엔 아무런 문제가 없다고 소염진통제 처방을 받았는데 복용하니까 두통이 더 심해지는것같아서 중단하고 내과를 갔어요 소염진통제 처방을 하시는것같길래 정형외과에서도 받았었는데 머리가 더 아프더라라고 하니 그럼 조금 더 쎈 소염 진통제를 주겠으니 먹어보고 계속 아프면 MRI찍어보라 하셨습니다 내과에서 준 약을 복용하니 갑자기 소화가 안되고 두통 속 울렁거림 구토할거같은 증상이 나타나네요  위염증상인거같기도 한데 뭘까요    ,응급의학과
156,급해요    화상 정도   채택 바로 해드릴게요    부탁드립니다,탕후루 만들다가 데였는데   어느정도의 화상인가요    응급처치는 어떻게 해야하나요 ,응급의학과
157,손가락에 뭐가 났어요,손가락에 물집마냥 뭐가잡혔는데 바늘로찔러도 나오는것도없고 그러네요  사진보면 옆에 작게 또 하나 자라나고있는데 댜체 뭘까요  그냥 물집인가요 ,응급의학과
158,변비약 먹고 화장실을 못감 어요  ,오후 여섯시에 변비약을 먹었는데 원래 새벽쯤에 일어나서 화장실에 갈려고 했거든요 아근데 자버려서 지금 아침에 배가  라 아픈데 아이거 어캄    배짇짜 지금 존나 아픈데 똥이 안나옴 ,응급의학과
159,장상피에 관한 약처방 문의,안녕하십니까  식사후 음식물이 내려가지 않고 가슴부위에 있는 것 처럼 느껴지며 소화가 잘 되지 않아 지난      토      분경에 거제 대우병원에서 국가암검진으로 위내시경을 하였습니다  의사 선생님의 설명은 위가 많이 늙었으며 장상피의 소견이 있다고 말씀하셨습니다        토 에 거제 대우병원 내과 김과장님께 장상피에 대한 약 처방을 받고져 합니다  가능하십니까       년  월  일생 신숙철,응급의학과
160,화상 통증 지속시간,어제 저녁에 라면끓이다가  도 화상을 입었는데 아직도 너무나 아픕니다 언제쯤 통증이 사라지나요,응급의학과
161,두통으로 링거를 맞았는데 성분이 먼지알려주세여,그림첨부 두통으로 링거를 맞았는데 성분이 먼지알려주세여,응급의학과
162,유증상 음성,두통 인후통 미열 증상 계속 있어도 검사 결과 음성 나오면 격리 제외인가요 아니면  주   주  격리인가요 급해요,응급의학과
163,화상치료 문의드립니다,약  주 전에 주말저녁 화상입고 물집이 있는 상태로 피부과로 갔습니다 가서 물집에있는 물 빼고 약을발라주고 드레싱했는데요  일에 한번씩오래서 갔는데 미보연고발라주고 드레싱해주고 반복입니다 드레싱할때 보니가 물집이 약간 피부처럼 달라붙었던데 이이후치료는 어케될까요    최근일주일은 물집의변화가 없어보여서요  물집자리는 첨에 의사가 물 빼다가 잘못찔러서 피났는  그안에서 마른건지 잘못찌른부위가 유독 빨갛더라구요   언제까지 이래야하는지 궁금해서 작성합니다 이물집 껍데기가 언젠간 뜯러지는건지   ,응급의학과
164,갑자기 어지러워요,가슴이 답답해지는지 빨리 뛰는지는 까먹었는데 둘 중 하나였고 기립성 저혈압일때 눈에 압력있고 눈이 웅하는 것도 있었어요 속도 매스꺼워져서 잠깐 누워서 숨 크게 몇번 쉬니까 괜찮아졌어요 지금 해외에서 자가격리 중이라 병원을 못 가는데 괜찮은 건가요 ,응급의학과
165,코로나  차,제가 교통 사고로 인해 폐기능이 정상인과는 많이다릅니다 코로나 백신 모더나를맞고  일뒤에 호흡곤 란과 통증때문에 응급실에 실려갓어요 그래서  차는안맞지 않앗어요 근대 안맞으면 까페 커피숍 식당 다못들어 간다는대 제가사무직이라 밖에서 밥을 먹어야되는대 꼭백신 맞아야되나요 ,응급의학과
166,백신부작용   ,어제부터 엄마가 진짜 말도 안 되게 엄청 시름시름 앓고 있는데 증상이 오한도 있고 발열도 있다가 근육통 때문에 죽을 거 같다 그러고 목도 아프다 그러고 다리가 떨어져 나갈 거 같다고 하시면서 계속 침대에서 못 일어나시고 있었는데 혹시나 코로나 의심증상일까 봐 엄마가 오늘 아침에 검사를 받고 오셨는데 오늘은 허리가 너무 아파서 떨어질 거 같다 그러시고 검사는 받아서 당장 병원은 못 가겠고 도저히 어떻게 해야 하는지 모르겠어요    아무리 네이버에 별걸 다 쳐봐도 약 처방이라든지 병원 방문  마사지 이런 거밖에 없던데 약은 어제부터 진통제 먹고 다 해봤는데도 효과가 없었고 마사지를 해줘도 아무런 효력이 없는거같아요      아파서 소리내면서 계속 못주무시다가 방금 소리가 끊겼는데 진짜 혹시나 해서 가봤는데 숨은 쉬어요 이제 막 잠들었는데 괜히 깨우면 진짜 도움도 안 되고 엄청 혼날까 봐 확인만 하고 가만히 있는데 기절 아니겠죠       진짜 어떻게 해야 하는지 모르겠어요    엄마가 또 몸이 그렇게 좋지는 않으신데 기저질환 대표 종류에 해당되는 건 없고요 면역력이 좀 약하세요 저희 가족은 분가라 엄마 아니면 다 학생들인데 상황 판단도 못하겠고 네이버만 잡고 있는데 제발 어떻게 해 여하는 지 조금이라도 알려주세요    ,응급의학과
167,냉동치료   일째 물집이 생겼는데 어떻게 해야 하나요 병원 가야 하나요 아님 가라앉을때까지 기다려야 하나요 병원 갈 시간이 안되서요 가만히 놔두,냉동치료   일째 물집이 생겼는데 어떻게 해야 하나요 병원 가야 하나요 아님 가라앉을때까지 기다려야 하나요 병원 갈 시간이 안되서요 가만히 놔두면 문제가 생기나요,응급의학과
168,백신 차접종후 단기기억상실,제가 도무지 기억이 전혀 나지않은 답답한 상황때문에 저와같이 단기적으로 기억이 끊긴사례가 혹시 있나싶어 올려봅니다 당시 마트를다녀온후 빠진게 있어서 다시마와 간장을사러간 기억이 나요 두가지만 사오려고 트렁크에서 작은 장가방만메고 가서 사온기억은 나는데 그걸 계산안하고 왔다는거에요 cctv를보니 분명 나맞는데 그게 인정이 안되고 믿을수가없고  그냥머리가 하얘졌어요너무충격이라       원어친데 열배로 이십만원 배상해주고왔죠 치매검사예약해놓고 뇌영양제받아오고 봐주던손주들도 보내고  하여튼 일생일대의 사건이 생겼는데 그후 정수기관리매니저가 와서 이런얘길 했더니 매일집집마다 다니다보니 단기적으로 기억이 날아가버린사람 사례를 자주듣는다면서 몇가지 얘기를 해주더군요 갑자기 무서움에 소름이 돋았어요 평생살면서 이런일이 처음이라 감당도 안되고요 백신접종후 한두달 안에 나타나는 증상이라네요 이런 사례가 있는지 궁금합니다,응급의학과
169,백신  주째 미열,백신  차 맞고  주째 하루도 빠짐없이     이상 미열이 나는데 병원에서는 계속 해열제만 처방해주는데 괜찮은건가요 ,응급의학과
170,의사분이랑 상담 ,의사분들이랑 전화를해서 상담같은거나 하고싶은데 그런게있나요  몇일전에 큰병원가서 검사받고 아무런이상이 없다고해서 안심하고 쉬다가 출근하니 다시증상들이 세져서 혹시잘못될까봐 걱정됩니다 이병원에 의사선생님한테 연락같은것도 할수있나요  뭐를 물어보고싶고 다른병원과를 가고싶어도 모르니 답답하고 지금 진짜 죽을거같은 몸상태라서 너무걱정됩니다 답변부탁드립니다,응급의학과
171,수액 부작용 인가요  ,저번에 배가 아프고 머리도 아파서 응급실 갔는데 수액맞고 있는데 갑자기 계속 손 발이 떨렸어요   머리는 계속 찌릿 거리면서 아프고 배는 꼭꼭 찌르듯이 아파서 그러고 수액 맞아서 손 발이 떨리는건지 잘 모르겠어여   도와주세요,응급의학과
172,대변 감염성,제가 공중화장실을 이용하게 되서  기다리다가 들어갔는데  그 변기에서 역하고 숨쉬기 힘든 썩은냄새가 났지만  급해서 물을  번이상 내리고 볼일을 봤는데  그이후부터 눈이 피곤하고 침침하고 힘이 안나거든요  혹시 대변도 균의 의한 감염될수있나요   아니면 대변 냄새로도 감염 되나요    계속 찜찜하네요   정확한 답변 부탁드립니다 ,응급의학과
173,손에 가시가 박혔는데,엄지에 정말 작은 가시가 박혔는데 눈에 제대로 보이지도 않을 정도입니다  꼭 뽑아야 하나요  병 원에 꼭 가야 하는지 궁금합니다 ,응급의학과
