61,급성 위장염 걸린지  일차인데 열이나네요  ,안녕하세요  제가 월요일에 급성 위장염 진단을 받았습니다  월요일 아침에 배가 엄청 아파서 병원을 갔는데 급성 위장염이라고 하더라구요  월요일 오후에는 배는 괜찮았고 미열     도였고 어제는     도 였습니다  점점 열이 내려가서 장염이 다 낫나 싶었는데 오늘 오후부터          도까지 올라가더라구요  어지러움도 살짝 있구요   원래 급성 위장염을 걸리게 되면 미열과 어지럼증이 나타나나요   코로나 검사 결과 음성나왔구요  기침 가래 일절 없습니다 ,응급의학과
62,화상 치료 및 흉터,봉고데기 화상  일째 입니다  출근전에 데이고   분뒤 출근해서 아이스스틱으로 대고 있다가  시간 반뒤에 약국 문열어서 미보 연고 바르고 메디랩 드레싱 멸균반창고로 오전 오후 두번씩 발라줬는데 화상 병원에 가야할까요  흉터가 질까요 걱정입니다   지금 상황에서 어떻게 하면 좋을까요,응급의학과
63,저 뇌종양 있을까요 ,제가 눈이 흔들린다는 말을 듣고 대학병원에 가게 됐는데 의사쌤이 눈알 자체가 흔들린다 하더라구요 그리고 mri찍어보라는데 뇌종양일수도 있다고   참고로 머리가 자주 아픈거 빼고는 다 어디 이상 없어요  저 아직 앞날 창창한 미성년자인데 진짜 눈물 나오고   ,응급의학과
64,저 뇌종양 있을까요 ,제가 눈이 흔들린다는 말을 듣고 대학병원에 가게 됐는데 의사쌤이 눈알 자체가 흔들린다 하더라구요 그리고 mri찍어보라는데 뇌종양일수도 있다고   참고로 머리가 자주 아픈거 빼고는 다 어디 이상 없어요  저 아직 앞날 창창한 미성년자인데 진짜 눈물 나오고   ,응급의학과
65,의료원에서 다른병원으로 예약해줄때,의료원에서 다른병원으로 예약해줄때 필요한 서류가 있을까요   대리로 할려고 하는데 의료원에서 예약하고 다른병원으로 가야하는데 의료원에서 예약을 해준다고 하는데 필료한 서류가 어떤거 있을까요,응급의학과
66,화상처럼 화끈거림,화상은 아니고 매운걸 만진것도 아닌데 손가락 특정 부분만 화끈거립니다 뜨겁거나 따듯한 물로 좀 오래 씻고 나면 그런거 같은데 매번 그런것도 아닙니다   이유가 뭘까요   ,응급의학과
67,제 손톱이 이상해요,그 흰색부분이 까져서 없어지고 살이 나왔어요 후시딘 발랐는데 부어 오르기만 해요,응급의학과
68,왼쪽 윗배 통증,매일 아픈건 아니에요 지금 아픈지는  주정도    대체로 밥먹으면   분내로 왼쪽 윗배가 살살 아파요 참을만은 해요 매번 밥먹을때만도 아니고 가끔 아파서   엄청 아픈적은 지금까지 한두번 있었어요 평상시에는 괜찮구요 뭘까요   소화제 먹긴 하는데 잘모르겧어요  병원 가봐야할까요     쥐어짜는 통증 밥먹고 난후 통증 최근 피곤함 한달동안  참을만함,응급의학과
69,솔라씨 잘못삼켰는데 이대로 자도 되나요,막힌 느낌인데 숨은 쉬어져서 따뜻한 물 마시고 계속 있었더니 목에 걸린 느낌은 드는데 다른 건 다 괜찮아요 이젱자야하는데 이대로 자도 될까요 그리고 혹시 물마시는 거 말고 바로 이거 내려가게 할 수 있나요,응급의학과
70,오늘 조리하면서칼을 사용하다가 칼에베엿는데 피는  시간정도나다가멈췄거든요  가끔 욱신되기는한데 집에서케어해도될까요 아님병원을가야하나요  해산물이,오늘 조리하면서칼을 사용하다가 칼에베엿는데 피는  시간정도나다가멈췄거든요  가끔 욱신되기는한데 집에서케어해도될까요 아님병원을가야하나요  해산물이나 고기를 썰었던칼이라 불안해서요  ,응급의학과
71,임파선염 멍울,볼쪽이랑 귀밑에  센치정도되는 콩같은게 만져지고 겉으로보일만큼 부어있진않아요    통증이있어서 이비인후과가서 초음파를보고 약을 먹었는데도      미열 오한이 매일 밤마다 수시로있어요    초음파상 모양이 나쁘거나 크기도 크지않다고하셨고  두통까지있어요   임파선염은 다 나아도 멍울이 계속남아있을수있나요     주정도됐는데 미열두통증상이 오래갈수도있는건가요  ,응급의학과
72,급성심부전으로 입원하면 누워있나요  앉아있나요 ,급성심부전으로 입원하면 누워있나요  앉아있나요   누워서 치료받나요  앉아서 치료받나요 ,응급의학과
73,명치 밑이 아파요,따갑고 욱신  겉에 말고 안쪽이요  ,응급의학과
74,혓바늘 뽑아도 돼요 ,이미 뽑은거같아요   핀셋으로 뽑았는데 하얗고 쪼꼬만한게 핀셋에 있더라고요   손으로 만져보니까 뭔가 없는 느낌도 들어요 뽑은 자리가 따끔따끔 쑤셔요  이거 뽑은거 맞나요   병원 가야하나요   음식 맛을 못느끼지 않나요   뽑은거 다시 나나요   겁나 많은데 서너개 없어졌다고 큰일 생길까요   의사쌤 답변  부탁 드려여    아니면 한번 뽑아본 사람 답변도      똑똑한 사람들 답변해주세여  ,응급의학과
75,CK mb 수치가 정상수치긴 한데 열배 올랐어요 ,심근 효소 수치인 ckmb가  개월전에    인가 그랬는데  현재     로 상승하였습니다    간헐적으로 가슴이 콕콕대고 아프긴 했는데      도증상이나 통증이 생길만한 수치인가요    미만이 정상수치인거는 인지하고있습니다 ,응급의학과
76,편도가 베였습니다,저도 모르게 베인거 같아요 갈라져서 눈에 보일정도인데 그렇다고 피가 나진 않네요 그리 아프지도 않고 이거 병원가야하나요 ,응급의학과
77,첫 헌혈후 피멍,제가   일에 처음으로 헌혈의 집에서 전혈헌혈을 하고 그 날 밤에 밴드를 땔려고 보니까 혈관이 부어있고 피멍이 들어있는 상태였어요 당시에 사진을 따로 못 찍어뒀었는데 헌혈 뒤에 압박도 시간 맞춰서 잘 하고 압박 밴드 까지 차고 있었는데 지금 붓기는 가라앉고 피멍 주위도 시푸렇게 되어있는 상태인데 이게 정상인가요   제 몸이 헌혈 하면 안되는 몸인가요  저랑 같이 헌혈 했던 친구는 피멍 하나도 없이 주사자국 정도만 생겼더라구요  사진에 초록 동그라미가 주사 넣었던 부분이고 그 옆에 피멍이 있고 부어있었던 상황이였어요,응급의학과
78, 차 차아스트라제네카 맞고  차 모더나 맞고 몸이 아파 다음날부터 한달째 입원중입니다 병원에서도 뚜렷한 원인도 모른다고 지켜보자고만 하고 왜 이, 차 차아스트라제네카 맞고  차 모더나 맞고 몸이 아파 다음날부터 한달째 입원중입니다 병원에서도 뚜렷한 원인도 모른다고 지켜보자고만 하고 왜 이럴까요 ,응급의학과
79,배가 아파서 병원갔다가왔는데 x ray찍어보니까 가스가 조금 차있다고 하는데 오른쪽배가 아프고 식욕도 없고 어지럽고 어떤병일까요,배가 아파서 병원갔다가왔는데 x ray찍어보니까 가스가 조금 차있다고 하는데 오른쪽배가 아프고 식욕도 없고 어지럽고 어떤병일까요,응급의학과
80,화이자 부작용인가요 ,제가 화이자를  차까지 다 맞았어요 그리고  달 지났는데 갑자기 오늘 자고 일어났더니 오른쪽 어깨가 움직이면 앜 소리 나고 아팠어요 주사는 왼쪽에 맞았는데 오른쪽 어깨가 아파도 이거 백신 부작용인가요 ,응급의학과
81,머리상처 병원,술먹고 머리박아서 사진처럼 요렇게대서 병원갔는데 꾸맬정도는 아니라고하셧거든요 지금 일차인데 딱지는안잡히고 살찢어진그게 잡히는거같아요 그땐 응급실갓는데 내일 가려는데 어딜가야하나요 ,응급의학과
82,파상풍 저림증상,안녕하세요 얼마전 녹슨 눈썹칼로 눈썹밑 눈위부분 눈썹을 제거했습니다 상처가 딱히 난것같짓 않습니다 하지만 제가 눈썹칼을 잘 다뤄보지 못해 칼로 모공 을 거의 후벼파듯이 눈썹정리를 했습니다  특히 끝부분으로 그랬는데 하필 끝부분에만 녹이 짙게 묻어있었습니다   그리고 눈썹칼 녹은 주황색으로 휴지록 슥 닦기만했는데 없어질정도였습니다 그래서 모공같은데 안에 쉽게 들어갔을것같아요 지금 하루정도 지났는데 그부분이 너무 저려서 타이레놀 복용했습니다  이거 제가 신경써서 이런걸까요 아니면 심각하게 받아들여야할까요 왜냐면 파상풍 잠복기가 보통  일에서   일인데 하루만에 저리니깐 제가 너무 걱정해서 그렇게 느끼나해서 여쭙니다 쉽게 병원갈 처지가 아니라 정말 필요하다고 느낄시 병원 권유 부탁드립니다   감사합니다,응급의학과
83,두통 오한 양쪽 옆구리 통즈 메스꺼움,두통 오한 양쪽 옆구리 통증 메스꺼움 무슨증상인가요,응급의학과
84,체외배출 정자로 임신이 가능한가요,체외로 사정한 정액이 손가락에 묻었었는데 물티슈로 손가락 대충 한번 닦고 조금 시간 지난 후에 손가락을 여친 질 속에 삽입했었는데 그걸로 임신이 가능한가요   ,응급의학과
85,계속      인데 괜찮음 ,   달 정도 계속 이럼 평균이     임     도는 기본으로 넘고 부모님은 괜찮다는데 어캄 병원 가야 하는거 아닌가  코로나 음성 나옴  예전에 했던거  근데도 왜 계속 나는지 의문,응급의학과
86,몸이 자꾸 안좋아지는 이유,원래 소화기간이 안좋긴했는데 일년에 한번 아픈 정도였는데 어느 순간부터 몸이 너무 안좋아졌어요  올해 응급실도 많이 가고 요최근에는 앉아있을때 어지럼고 토할거같고 뭐먹으면 목구멍에서 안넘어가는거같고 어그제부터는 물설사까지 하는데 별 문제 없겠죠   백신은  차까지 맞았어요,응급의학과
87,이마 찢어 졌을때   ,안녕하세요 저희 할아버지께서 갑자기 어지러우시다면서 비틀거리 시다가 넘어지시면서 모서리 쪽에 머리를 박으셨어요 그러면서 이마도 찢어지신것 같구    머리에 피도 많이 나셨어요        불러서 응급조치를 취하긴 했는데    응급조치를 할때 잠깐 경직이 되면서 몸이 굳으셨어요 무슨 증상인지는 잘 모르겠는데    알려주실수 있나요  다 치료 받으신 후에 괜찮아 지실까요  그리고 할아버지께서 술도 좀많이 드셨거든요    빠른답변 부탁드려요    감사합니다   ,응급의학과
88,뭐 먹으면 토 할 것 같아요,어제 자정쯤에 어제 오후에 밥 한끼 먹고 저녁에 통닭 조금 먹은거 다 토하고 나서 오한도 느껴지고 속이 계속 더부룩한데 오늘 오후  시쯤 밥 먹으니까 속이 너무 안좋아요   많이 안좋은 걸까요  ,응급의학과
89,손톱을 잘못 뜯어서 사진처럼 되었는데 손톱이 빠질까요  병원에 가야 한다면 무슨 과에 가야 하나요  검게 변한 부분이 무엇인가요 ,손톱을 잘못 뜯어서 사진처럼 되었는데 손톱이 빠질까요  병원에 가야 한다면 무슨 과에 가야 하나요  검게 변한 부분이 무엇인가요 ,응급의학과
90,가스렌지 옆에 달궈진 냄비 뚜껑을 모르고 잡았다가 저렇게 되었어요  일지났는데 물집이 저정도면 물을 빼줘야하나요   병원가는게 좋을까요  ,가스렌지 옆에 달궈진 냄비 뚜껑을 모르고 잡았다가 저렇게 되었어요  일지났는데 물집이 저정도면 물을 빼줘야하나요   병원가는게 좋을까요  ,응급의학과
91,백신 부작용,백신 맞고나서 음식 먹기만 하면 속아프고 팔에 힘이 없어서 진짜 핸드폰 들기도 힘든데 어뜨케여 지금도 한손으로 타자 치는중 지금 속이 그 약간 콜라 엄청 많이 먹었는데 트름이 안나와서 더부룩한 느낌인데 아무리 물을 마셔도 느낌이 안사라져요 ,응급의학과
92,뇌졸증 증상,밤에 갑자기 시야가 위에서부터 뭔가 내려오는듯 수면마취 할때처럼 기절할것 같은 느낌이 들었는데 오른쪽 얼굴에 감각이 너무 이상하고 왼쪽 손이 말려들어가는듯 얼얼하게 저려오는 느낌이 들었어요  쇼파에 앉아있는 상태였고 남편이 바로 눕혀줘서 쓰러지지는 않았는데 증세가 또 금방 사라졌어요 혹시 몰라 응급상담전화하고 응급실 가서 심전도 혈압 혈액검사랑 심장엑스레이 머리쪽ct찍고왔는데 일단 검사는 아무것도 안나왔어요  이전에도 저혈압증상으로 쓰러진 적이 몇번 있었긴한데 그때랑은 느낌이 완전 달랐고 뇌졸증같은게 ct로는 안나온다는 말을 들은적이 있어서 좀 불안한데 의사선생님은 얼굴이랑 손한쪽 감각 이상이 서로 방향이 달라서 뇌쪽으로는 이상이 없을거라고 하시고 평소에 엎드릴때 심장이 빨리뛰는 증상이 있다고 하니까 심장질환쪽으로 검사 받아보라고 하시더라구요  얼굴이랑 팔 한쪽 감각이 이상한게 방향이 다르면 확실히 뇌쪽은 이상이 없는게 맞나요  의사선생님이 아닐거라고 하시기는 했고 제가   대초반이라 젊어서 확률도 낮다고 하셨는데 제가 원래 몸이 엄청 약해서  혹시 mri를 찍어봐야하나 혼자 너무 불안해서요    ,응급의학과
93,이틀간격으로 차 사고 두번 났는데요,첫번째는 제 차 주차하다가 벽에 들이받았구 그때부터 숨이 좀 안쉬어지더니 심장 벌렁거림이 좀 있었어요 이틀 후 두번째 주차하다가 다른 차 박았는데 그 뒤로 밥도 못먹겠고 심장이 너무 빨리 뛰어서 숨도 안쉬어지구요 머리도 어지럽고 그런데 어떻게 해야해요  충격은 크게 없었어요 차만 보면 지금 불 안하고 제 차 타지도 못하겠고 그래요,응급의학과
94,젓꼭지가 아파요,남자   세    센치이 고요   얼마전 부터 오른쪽은괜찮은데  왼쪽이 누르면아픕니다 너무불편해서요  이유나 해결법이 있을까요   남자입니다,응급의학과
95,철사에 손이 긁혔는데,기름 묻은 철사에 손가락이 긁혔는데 상처는 크지않고 살점이 약간 나가고 긁힌 정도    입니다 물로 대충 피 좀 씻어내고 후시딘 바르고 방수밴드 붙여두고 일했는데 내과라도 가봐야하나요  상처 크기는 손가락 반마디 길이 정도입니다,응급의학과
96,화이자 맞고 안아픈데 설마   많은 의견좀  ,프로필 사진이 의사분이 아니면 무시하겠습니다   차 화이자 어제 맞았는데  안 아픈데   어제 주사 맞고 피가 많이 나왔는데  그게 화이자가 들어가다가 다시 다 나온거 아닌가요    ,응급의학과
97,편도 수술 후 출혈  사진 있음 ,이거 병원 가야 할 정도의 출혈은 아닌거죵    대학병원이라 만약에 병원 가야할 때 응급실로 오라하셨는데 거기서 출혈 생기면 엄청 무섭게 철철 쏟아질 거라고 했거든용  어쨌든 출혈인가요        저녁에 다시 보니 곱이 떨어진 건지 약간의 출혈이 있는 건지 구분이 안 갑니당  ,응급의학과
98,검진 받기전 공복 질문이요 ,공복삽태로 검진을 받아와야한다고 하는데요  전날 저녁 이후로 안먹나요  그날 아침 안먹으면되나요   검진시간은 오전 시부터 점심  시까지 입니다 ,응급의학과
99,코로나 확진자 질문,   저 아직 학생인데 만약 코로나 걸리면 저 혼자 지내는 건가요     빨래는 어디서 해야하나요     병원 밖 편의점이나 이런데 나갈수 있나요     언제 퇴소하나요     계속 병원에 있으면 학교도 못 나가는데 저만 졸업을 못 하는 건가요 ,응급의학과
100,원래 이러는게 맞나요 ,제가 오늘부로 화이자  차 맞은지   째 되는 날입니다 제가 어쩔때는 진짜 졸려서  시간자고 일어나고 그럽니다 근데 아직도 백신 맞기전에 그 몸이 아직 아닌거 같습니다 제가 운동도 잘 안하고 활동성이 별로 없어요   그리고 가끔씩 머리가 아플때도 있어요 그래도 전보다는 많이 괜찮아지곤 있는거 같습니다 그래도 약간의 피곤함과 몇몇 증상들이 아직도 있는거 같습니다 제가 밤에 늦게자고 일찍일어나는  아무튼 그런데 그거때문에 졸릴 수도 있나요   ,응급의학과
101,코로나    ,제가 이번주에 볼일이있어서 술을먹게될거같은데 제가 이번주에  차맞거든요 그러면 백신맞은지   일이 안된거잖아요   이런경우에는 술집   밥집   이런곳에 갈 수 있나요    저포함 두명인데 저는 아직안맞고 상대방은 다 맞았어요 ,응급의학과
102,배꼽이 아파요 ,엊그제부터 갑자기 배꼽이 아파요  방금 전까지는 견딜만 했는데  지금은 정신이 온통 배꼽에 가있을 정도로 아파요  냄새나 진물은 안 나고 그냥 배꼽이 찢어진 것처럼 아파요  그리고 약간 피가 차오르는 듯한 느낌이 나는데 느낌일뿐 피 안 납니다  엄마가 배꼽 만졌냐고 하는데 안 만졌고요  과식한거 아니냐고 하는데 과식 안 했어요  병원을 가야하는 거라면 어떤 병원을 가야하나요   저 지금 너무 심각하니 내공     겁니다 ,응급의학과
103,임신관련 질문,  월 일날 관계를 가졋고 질내사정을 하엿고 그때는 가임기 엿고 배란기때 질내사정을 두번 더햇는데 임신이 될까요 그리고 몇일전부터 속이 조금 안좋고 한번씩 아랫배 쪽이 찌릿찌릿 아픈데 이건 뭐때문에 아픈거일까요    ,응급의학과
104,화이자 백신 차, 월 초에 화이자 백신  차 맞고 부작용 때문에 심장초음파 등 검사를 받느라 시간도 지체 됐고  더러 겁도 나서  차를 못 맞고 있는데요   방역패스 계도기간도 이제 끝나서 백신을 맞아야하나 고민이 너무 됩니다    궁굼한건 만약 맞으려면   차 맞고 난 후 시간이 많이 지났는데 그냥  차 맞으러 가면 되는건가요    차 맞을 때 원래 날짜 지정해주잖아요 미루고 미루다 못 가서 취소  됐는데 잔여백신을 재신청을 해야 맞을 수 있는건가요   아니면  차부터 다시 맞아야 하나요   추가로 방역패스 시행되면 미접종자가 갈 수 있는곳이 어디인가요 ,응급의학과
105,스트레스를 더 받을수록 아파오고 손끝저림도 같이 옵니다    양쪽 손목의 빨간부분이 특히나도 아파요 ,손목이 너무 아파서 정형외과를 가서 물리치료받아도 의미가 없었어요   스트레스를 더 받을수록 아파오고 손끝저림도 같이 옵니다    양쪽 손목의 빨간부분이 특히나도 아파요   어느 병원을 가서 어떤 치료를 받아야 좋을까요   ,응급의학과
106,치킨이랑 밥 먹었는데 갑자기 피부 급해요  ,치킨이랑 밥 먹고 앉아있는데 갑자기 사타구니랑 턱아랫 부분이 간지럽더니 팔꿈치에 모기 물린 것 처럼 뭐가 막 나오면서 엄청 간지럽습니다 응급실 가봐야 할까요 ,응급의학과
107,방광염 응급실,금요일부터 방광염이 심하게 와서 비뇨기과에서 항생제도 받고해서 약도  일째 먹고있는   괜찮아지지않고 약 부작용으로 설사하고 두통이 심해도 방광염이 더 우선이라 저녁먹고 먹었는데 지금 일을 봤는데 약 효과는 없고 잔뇨감 때문에 미치겠어요 혈뇨는 안나오는데 응급실 가야할까요 아니면 참았다가 아침에 가야할까요  ,응급의학과
108,눈 옆 상처 언제 아무나요 ,긁혔는데 언제쯤 상처 아물까요   ,응급의학과
109,배아픔 복부 통증,하 진짜 너무 배가 아파요   아니 뭔가 장이 꼬이는 느낌도 들고 그러다가 좀 지나면 안아프고 그러다 지나면 또 엄청 아프고 하 왜이러죠  요즘 방귀도 자주 나오고 그러는데 이유가 있을까요  ,응급의학과
110,안녕하세요 며칠 전 넘어진 상처가 이렇게 되었는데 숨을 쉬게 둬야 할까요 아니면 마데카솔이나 후시딘을 바르고 밴드를 붙여야 할까요   ,안녕하세요 며칠 전 넘어진 상처가 이렇게 되었는데 숨을 쉬게 둬야 할까요 아니면 마데카솔이나 후시딘을 바르고 밴드를 붙여야 할까요   ,응급의학과
111,열이 납니다  ,코로나 음성 나왔고요  몸은 괜찮은데   열이     도 입니다  어떻게 해야할지 모르겠네요  정말    그냥 평상시 컨디션이고 몸은 정말 멀쩡합니다  어떻게 해야할까요   ,응급의학과
112,Mental 기면 상태,Mental에 sli  drowsy라 써있으면 무슨 뜻인가요   drowsy는 기면 상태인데 앞에 sli은 왜 적혀있는건가요   ,응급의학과
113,배꼽 바로 옆이 아파요 사진 참고해주새요, 핑크색이 아픈 곳  동그란게 배꼽  아픈거가 눌럿을땨 살짝 통증 말고는 옶어요 열도 안 나고 똥도 건강한데   갑자기 오  이러죠  맹장염이에요 뭐예요  그리고 학생입니다  원래 빈혈  기립성 저혈압이 있어요,응급의학과
114,검은색 변,원래 술을 자주 먹는 편은 아니고 한 번 먹을 때 조금 많이 마시는 편인데  둘이서 최소  병 정도    술을 먹어도 토는 절대 안 하는 스타일인데 한  주   주  정도 전부터 배가 갑자기 아프고 장기가 쿡쿡 찔리는 거 같고 숨만 쉬어도 아플 때가 있었는데 자주 이랬어서 그냥 넘겼는데 그러고 둘이서 소주  병 정도 마셨는데 이틀 뒤부터 뭐 먹을 때마다 토하고 계속 헛구역질 하고 삼일 연속 그러니까 힘들어서 음식 안 먹으니까 괜찮아서 이제 괜찮아졌나 보다 하고 또 술을 마셨는데 또 토하고 어제도 술을 먹고 또 토하고 검은색 변을 봤는데 어디 문제가 있는 걸까요    ,응급의학과
115,꿰맨 상처 소독하고 밴드,상처 꿰매고 셀프로 소독하려는데 소독 다 하고 다이소 습윤밴드 붙여도 되나요   그 커다란 밴드요 ,응급의학과
116, 도화상인가요 ,알바하다가 양은냄비같은거 손잡이에 화상을 입었는데 데이자 마자 데인부분이 하얗게 변했어요 쓰라려서 연고바르고 집에왔는데 흉터남을까봐 겁나요   처음에 은 주변이 빨갛게 변했다가 지금은 대인 그부분빼고 쪼금만 빨개용물집은 아닌거같은데  ,응급의학과
117,아이가 축농증으로 항생제 처방을 받아,초등학생 아이가 축농증으로 항생제 처방을 받아서  일 복용했어요   마이크로라이드계 항생제  일 복용  다니 던 병원이 멀어서 다른 병원에서 오늘 항생제 처방을 추가로 받았는데 계열이 다르네요    세팔로스포렌 계열 항생제 처방 받음  남편이 아이 데리고 가서 약봉투 보여주고 받았는데 계열이 달라요 아이 어릴 적부터 항생제 잘 안먹이고 키워서 내성이 걱정 되어서요  마이크로라이드계 항생제  일 복용하다 세팔로스포렌 항생제  일 복용해도 괜찮을까요      약사님 계시면 알려주시면 너무 감사할 것 같습니다,응급의학과
118,코로나 검사중,코로나 검사를 받으러 가서 줄을 서있었는데 앞에 서있던  명의 친구들이 거리두기도 지키지 않고 앞에서 신나게 떠들던군요 대략   분정도 기다리는동안에도 쉬지않고 떠들었습니다  저는 이친구들 바로 뒤에 있지않고 조금 뒤로 물러서서 기다렸는데 이친구들이 코로나에 걸려있는 상태였다면 옮을 가능성이 있을까요  둘다 kf마스크를 쓰고있었고 저 또한 쓰고있었습니다   저는 접촉자도 아니고 그냥 증상만 있어서 검사받으러 간것인데요    옮진 않겠죠 ,응급의학과
119,회사에 확진자가 방문했는데   ,어제 회사에 거래처 사람이 왔는데 오늘 그 사람이 확진자라고 문자왔네요 같은 회의실에 들어가긴했는데 선별진료소에 직접 가면 되나요  저녁에 하면 검사결과 언제 나올까요  또 더 해야하는거 있나요 ,응급의학과
120,두통 속 울렁거림,이번주에 매일매일 술을 마셨는데요 술병이나서 속 울렁거리고 두통이 있는걸까요    제가 혹시나 해서 임신 극초기 증상 같아서 관계후   일뒤에 혈액검사 받았는데 임신은 아니라고 했어요 두통있고 음식 먹으면 속 울렁거려요    술병일까요   뭐 때문일까요,응급의학과
