64,넘어진 후 울렁거림,제가 경사길에서 발목을 접지르면서 넘어졌거든요 그런데 넘어지고 나서부터 속이 울렁거리고 토할 것 같은 느낌이 들어요 넘어진 직후부터 울렁거려서 잠깐 앉아 있긴 했거든요 머리를 부딪혔다거나 그러진 않았는데 왜그런걸까요 ,응급의학과
65,무릎을 구부릴 때 안 아픈데 피면 아파요,무릎을 구부릴 때 안 아픈데 쫙 피는 순간 아파요 심한통증이 오는 건 아니고 신경쓰이는 정돈데 뭔 증상일까요 ,응급의학과
66,속 울렁거림,아까 낮에 점심먹고 저녁에 버스탓는데 유난히 오늘따라 멀미가 심해서 속이 토할거같이 울렁거렸는데 버스에서 내리고 난 한참 뒤에도 계속 울렁거림이 지속되는데       배꼽아래쪽도 통증이 있는거같아여   왜이러는건지 아시나요 ,응급의학과
67,누르면 아파요,왼쪽 배꼽옆 부분이 누르면 끈어질 듯이 아파요 그냥 두면 안아픈데      그리고 윗배가 자주 딱딱해져요 윗배 누르면 꾸르륵 소리랑 함께 다시 괜찮아 지는데 왜이럴까요   그리고 요즘 조금만 먹어도 쉽게 배불러요      세 여자입니다,응급의학과
68,왼쪽 명치 밑이 갑자기 아파요,일하고 있는데 갑자기 왼쪽 명치 밑이 너무 아팠어요 지금은 괜찮긴한데 갑자기 확 쪼이는 느낌들고 그러고 머리 아픈데 그냥 잠깐 이런건가여   ,응급의학과
69,몇도 화상인건가요 ,고기 기름 안티게 막아주는 망이 떨어지려고 해서 잡다가    물집생기고 살짝 쭈굴쭈글 해졌어요 물집이 하얗게 변했어요 사진이랑 똑같이 엄지도 그렇고 새끼손가락이랑 중간손가락은 물집은 없어요 지금 아파서 흐르는 찬물로 하고있어요 화상연고는 있는데 병원을 가야하나요 ,응급의학과
70,두통과 속 울렁거림 화이자 백신 부작용인가요 ,제가 어제 화이자 백신  차를 맞았는데 어젠 팔만 좀 저렸어서 괜찮았는데 오늘은 두통과 속 울렁거림이 더해지고 오한까지 생겼는데 이거 백신 부작용인가요   ,응급의학과
71,미열 두통 복통 인후통이 있는데 원인이 궁금해요,열이   도까지 올라서 코로나 검사 받았는데 음성 판정 받았어요 그래서 병원에 다녀왔는데 비대면 진단이라 정확한 진단은 못 받았거든요 약은 처방받았는데 약을 먹어도 계속 미열이 있고 두통이랑 명치  윗배 통증이 심해요    그리고 약 먹으려고 밥을 먹으면 속까지 안 좋아지는데 도대체 원인이 뭘까요  인후통은 심하진 않은데 약 먹고 컨디션 좋아지기 전까진 계속 있어요,응급의학과
72,배가 아프고 머리가 아파요,간단하게 말 할 게요     열은 안 나고  일째 머리가 지끈거려요    정확히 명치가 욱신거리고 아파요    첫 날에는 하루종일 소화가 안 되고 다음날에는 밤만 되면 소화가 안되요    카페인 중독 온 사람처럼 심장이 가끔 욱신거리고 쿵쾅거려요    가끔 오한이 느껴져요  왜 그런거죠    제일 신경쓰이는 건 머리가 너무 아파서 힘들어요    만약 병원을 간다면 어디 병원으로 가야 하죠  내과는 아직 못 가서 ,응급의학과
73,백신  차 접종 후 증상, 차 화이자를 맞고 숨이 안쉬어져서 응급실에 갔고  차는 최근에 맞았는데 별 증상은 없었는데 왼쪽 뇌 가 상당히 두근거려요  맞은지  일차고 관자놀이보다 뒤쪽이 뇌 일부분이 두근거리는데 아픈건 아닌데 심하게 두근거려서 신경쓰입니다  병원을 가봐야할까요  병원에가서 할 수 있는게 뭐가 있죠  ,응급의학과
74,코로나 검사,전날 제 동생반에서 코로나 확진자 나와서 검사를 받고 음성이 떴는데 오늘 저희 층에서 또 확진자가 나왔어요    검사해야하나요  아직   시간 안지났어요 참고로 어제 방학식이어서 검사한 시점 이후에는 접촉 안했습니다 ,응급의학과
75,화상 응급처치후,냄비 손잡이 잡다가 화상을 입었습니다 너무 아픈데 연고 바르면 될까요 ,응급의학과
76,입 안에 뭐가 났는데,피곤할 때 나는 평범한 무언가처럼 생겼었는데  오래동안 안없어지길래 확인해보니 이렇게 변해있네요   너무 하얗고  밑부분은 피 색처럼 검붉어요 이건 뭔가요  병원치료가 필요하다면 어느 병원에 가야 할까요 ,응급의학과
77,코로나 동선이 겹쳤어요,제가 다이소 갈려고   번 버스를 탔는데 동선이 겹쳤더라구요 그래서 궁금한 점이 몇 개 있습니다    동선 겹쳐서 코로나 검사 하러 가는데 일반 코로나 검사 해주는 선별진료소 하는 병원 가서 하면 되나요     만약에 검사 하고 음성이 나왔는데 음성이 나와도  일 자가격리 해야 하나요       이제 막 중학생이 된 올해   살인데 부모님 없이 가도 괜찮을까요 ,응급의학과
78,등에 흑색종인가요 ,우연히등보니 생겨서 당황스럽네요,응급의학과
79,속이 울렁거리고 머리가 깨질듯이 아파요,속이 너무 심하게 울렁거리고 머리도 깨질듯이 아파요 오른쪽이 아픈거같고 토 나올거 같은데 토는 안 나와요    약을 목었는데도 계속 아픈데 어떡하죠   ,응급의학과
80,혀에 빨간 뭔가가 났는데 병원 가봐야되나요,끝부분이 삼각형 끝부분처럼 뾰족하고 빨간색에 많이 아픈건 아닌데 신경이 쓰이네요 병원가봐야되나요,응급의학과
81,뇌진탕으로 기절한 사람 응급처치 방법이 궁금해요,머리를 부딪혀 기절을 하게 되면 구급차가 오기 전까지 무엇을 해야하나요   호흡이 있다고 가정할 때  의식이 돌아오도록 흔들거나 큰소리로 깨우는 방법이 최선인가요 ,응급의학과
82,발에 굳은살이 잡혔는데요  이상한 병인가요 ,이제 고 되는 학생입니다  발을 보다가 굳은살이 잡혔는데 당뇨와 연관된 병인가요  아직 고 인데 무섭네요     ,응급의학과
83,발가락에 가시가 있는거 같아요,며칠전 부터 걸을때 아파서 오늘 봤더니 가시가 있는거 같아요 빼기엔 너무 늦은구 같은데 어떡해요  가만히 나둘수도없고,응급의학과
84,백신 부작용 탈모,  살인데 백신 부작용으로 탈모 생기게 되면 치료를 해야하나요 ,응급의학과
85,오른쪽 목이 아파요  ,오른쪽 목이 담걸린것처럼 아파요   고개를 오른쪽으로 돌려도 아프고 눌러도 아프고  담걸린건가요      빨리 풀고싶어요    너무 아프고 불편해요  ,응급의학과
86,화상으로 잉한 따가움 빨리요  ,뭐 만들다가 글루건 액이 제 엄지손에 뭍었는데 굉장히 뜨거웠는데 그건 둘째치고 굉장히 따가워요 흐르는 차가운 물에 했다가 지금은 아이스팩에 톹톹톹 치고 있는데 열기는 둘째치고 따가워 죽겠어요 도와주세요,응급의학과
87,손톱 세로줄  깨짐 원인,삼촌이 폐렴을 앓으신적 있는데 그때 항생제를 장기간 복용하면서 위도 많이 약해져서 고기나 자극적인 음식을 못드시고 수시로 속이 안좋거나 탈이납니다 이게 현재 건강상태입니다  손톱상태가 점점 안좋아지는데 건강과 관련이 있을까요 원인을 알고싶습니다,응급의학과
88,머리가 아픈데  차백신,머리아픈지 이틀차인데 머리아픈이유가 신경쓸일잇엇더니 머리가 게속 아프네요 내일  차백신인데 맞아도될가요   ,응급의학과
89,손가락에 이게 뭔가요   병원에 가야하나요  ,정확히 기억이 안 나는데요  예전부터 어느날 손가락에 이런게 생겼더라구요  병원가야하나  이게 뭐지  하고 생각은 많이 해봤는데 자꾸 깜빡하고 잊어버려서 질문을 못했네요  이게 뭐 때문에 생긴 걸까요  왼손 검지  오른손 엄지 말고는 멀쩡한데   아픈 느낌도 없어요  점점 번져서 많아지는거 같기도 하고요  알레르기같은 건가요  특별한 알레르기같은건 없는데   질병인건가요 ,응급의학과
90,화상치료 후 통증, 년전 쯤 주차해 놓은 오토바이 머플러에 살짝 닿아서 화상치료를 받았는데요   겉피부는 상처없이 잘 아물었습니다    그런데 속에 있는 피부가 아리듯이 아픕니다    주기적으로 아픈 증상이 있는데 건조해서 그런건지   저   안쪽 피부가 아픈데 병원을 다시 가봐야 하는 건지요    겉보기에 아무 상처도 없이 아물어서 병원에서는 해줄게 없을 거 같아서요   아니면 연고같은 거 계속 발라주면 낫는건지  어떤 연고 발라야 하는지 아시는 분 알려주세요,응급의학과
91,기관절개관 사용기한 ,어머니가 폐렴이 오셔서    갑자기 응급실 가셨는데  호흡곤란으로  병원 중환자실까지 가셨습니다     호흡기 교수님이 기관절개술를 해보자하는데  누구 말대로는 그게 안나으면    장기간 고생 한다는데   그리고  잘못하면 식사도 제대로 못먹는다 하던데   그게  맞는건지  교수들은 대충 얘기하시니  입원한지    일째고요    일 중환자실에서  이제 일반실로 갔는데  언제까지 병원에 있으시는건지  대형병원은 빨리 내보낸다하는데   ,응급의학과
92,오른쪽 엄지손톱에 검은세로줄이 생겼어요  괜찮은건가요 ,며칠전부터 갑자기 검은세로줄이 생겼는데 검색해보면 흑색종 이나 몸에 안좋은 이상신호라는데 병원에 가봐야하나요  아니면 그냥 둬도되는건가요   ,응급의학과
93,오늘 백신접종,어제 등산하고 왔는데 오늘  시에 백신 접종하고 낼까지 쉬고 모레 스키 타러 가는데 괜찮나요 ,응급의학과
94,링겔 가격,안녕하세요 어제 마라탕을 먹었더니 위경련인지 위염인지 속이 쥐어짜듯이 아프면서 속도 울렁거리면서 토 할 거 같고 잠도 못 자는데 병원가서 링겔 한 번 맞으려고 하는데 가격이 얼마정도 할까요,응급의학과
95,일요일부터 으슬으슬 춥길래 쌍화탕이랑 판콜에스 사먹었어요 월요일 되니 증상이 더 심해져서 병원가서 비타민 주사를 맞았는데요 글쎄 증상이 추운데,일요일부터 으슬으슬 춥길래 쌍화탕이랑 판콜에스 사먹었어요 월요일 되니 증상이 더 심해져서 병원가서 비타민 주사를 맞았는데요 글쎄 증상이 추운데 덥고 땀나고 온몸이 찌릿찌릿 전기에 감전된듯한 증상이 계속 되고 있어요   조금씩 나아지긴 하는거 같은데  언제 괜찮아질까요 ,응급의학과
96,갑자기 명치가 아파요 ,오늘 아침부터 갑자기 명치가 아팠어요  일어날때도 웃을때도 아파요 ,응급의학과
97,음성확인서 발급때문에 검사받아보려고하는데요,무증상에 밀접접촉자도 아닙니다 일반 임시선별소에 가서 검사받아도 되는건가요  꼭 선별진료소로 가야되나요 ,응급의학과
98,건강검진수치 질문,어머니께서 건강검진받으셨는데 병원에 전화해서 물어보려했는데 전화를 안받아서 지식인에 여쭤봅니다    각 항목중에 H는 어떤문제인지   약먹어야하는지   어떻게 어느부분을 조심해야하는지   자세한 설명부탁드려요  ,응급의학과
99,팔 지방 흡입 후 양쪽이 달라요  ,한지는  주 다 되어가고 왼팔은 수술직후부터 아프지도 활동하는것도 불편감 없이 만세도 잘 되었어요 그 당시에는 오른팔이 코끼리처럼 붓고 멍도 손가락까지 내려와서 오른팔이 잘 못 된줄 알았지만 문제는 왼팔이였어요 팔도 덜렁덜렁 거리고 누가봐더 날개살이 덜렁덜렁 거려요 오른팔은 단단하고 딱 붙어있는 기분이라면 왼팔은 전이랑 차이를 못느끼겠어요    붓기라고는 하는데 멍도 거의 없고 너무 출렁거려서 걱정이에요,응급의학과
100,화상 질문,  분전에 튀김기 기름을 빨아드리는 정제기 호스를 움켜진 채로  초 정도 잡고 있었습니다 찬물로 그 부위를 씻겨냈고 현재는 저상태 입니다  이경우  도 화상이 아닌  도 화상에 해당하나요 ,응급의학과
101,빨리빨리요 ,제가  일됬나  어   걸을때 허리가 아프면서 숨이 조금씩 막힌다고해야되나 그냥 약간 좀  답답해서 병원을 가려는데 정형외과를 가야하나요 아님  이비인후과를 가야하나요 ,응급의학과
102,손가락에 사마귀때문에 냉동치료,손가락에 사마귀 때문에 냉동치료를 했는데요 지금 일주일정도 지났어요 근데 이렇게 검게 변하고 검게 변한 부분이 물렁물렁한 게 맞는 가요 맞다해도 왜 물렁거리는 건가요  ,응급의학과
103,화상 관련 질문,치킨 튀기는 일을 하다가 많이 데여봣는데 이번엔 좀 지나니까 이렇게 되더라고요 시간이 많이 없어서 병원 갈 시간이 많이 없는데 냅두고 후시딘 발라주면 낫나요   흉터는 상관 없습니다 낫기만 하면 돼요,응급의학과
104,오한  속 메스꺼움  두통  물설사 증상, 시간 째 속이 금방이라도 구토할 것 처럼 메스껍고 춥고 두통  물설사를 해요      시에 잠에 들었는데  시에 증상때문에 다시 깼구요    체온은     로 정상이예요    빠른 시간 내에 나을 방법은 없을까요    계속 그래서 잠에 못 들고 있어요     ,응급의학과
105,어지러움 ,제가 일이 있어서  일전에 밥도 잘 안먹고 울고 정신 나가 있엇긴했엇거든요  근데 어제 오늘 어지러움과 약간의 두통과 뭔가 띵 한느낌 이 있다고 해야되나요   링거맞으러 가는게 좋을까요 아니면 약국에 가서 증상 말하구약 먹는게 나을까요  링거든 약국이든 증상을 그냥 어지러움이 있고 띵한 늑낌이 있다 이런식으로 말해야할지   아무튼 뭐가 나을까요  ,응급의학과
106,목에 작은 음식물 걸림,새벽에 튀김 먹다가 조금한 튀김이 목에 걸렸어요  물을 아무리 마셔도 안내려가서 걍 자고 일어났는데 아직도 목에 걸려있네요  어떻게 빼죠 이거  ,응급의학과
107,화상인건가요  ,배에 따뜻한 온열물베게를 안고 잤는데 일어나보니 손에 이렇게 되어있었습니다  그렇게 온도가 높지않앗고 손에는 직접적으로 안닿인 것 같은데 이거 화상인가요 빨간 부위가 아프지도 않고 그냥 육안으로만 빨개요 병원에가야할가요,응급의학과
108,여자 오른쪽 배가 아픈데요 ,맹장수술은     년   월에 했어요  배꼽을 중심으로 오른쪽부분인데 옆구리는 아닌데 옆구리 가까이에요  이곳엔 무슨 장기가 들어있나요   아프다가   안아프다가 자꾸 이러니 병원을 가야하나 말아야하나   지금  일정도 됐고   병원을 간다면 어떤 과로 진료를 봐야할까요  ,응급의학과
109,양상엽 내 염증성 반흔이 뭔 가요 ,얼마 전에 보건증 검사를 받았는데 다 정상으로 나왔는데 비고란에 양상엽 내 염증성 반흔이라고 적혀있네요 병원 가봐야 하나요  참고로 금연  개월 차입니다,응급의학과
110,동상  동창 치료 및 병원,손가락이 빨개지며 부어오르고 통증이 있음과 동시에 가려움도 살짝 있었습니다 환부에 열감도 있습니다 피부과를 갔는데 물리거나 다른사람치아에 닿았다거나 무언가에 찔린 상처에 바이러스성 감염이 아닌가 하는 진단을 받았고 바이러스질환 항생제와 소염진통제를 처방 받았습니다 손톱 주변을 뜯지도 않고 타인의 치아에 닿은적도 없고 뭐에 물리거나 베인적도 없습니다 주변 사람들 이야기를 듣다보니 동상  동창 증세와 비슷해 보이는것 같습니다     붓기와 피부색  통증 등 증세가 점점 심해지는데 어느병원 어떤과 치료를 받아야할까요    전라도 광주에 갈만한 병원 있으면 추천해주세요  이제 손가락이 구부러지지도 않습니다     ,응급의학과
111,멀미할거 같은기분,안녕하세요   대 남자입니다 조금전까지 아무이상없었는데 갑자기 속이 토할거 같이 메스껍고 방귀가 계속 나옵니다  가만히 있으면 좀 덜한데 움직이거나 숨을 크게 들이마시면 좀 심해지네요 이런 병이 있나요 ,응급의학과
112,소화기에도 담 이 오나요 ,문뜩 어지럽고 속이 안좋을 때가 있고 복식호흡할 때 배 쪽이 찌릿찌릿하거나 오른쪽 왼쪽 옆구리에 통증이 있을 때도 있어요 왜 그런걸까요  소화기의 문제인가요  피로해서 그런가요 ,응급의학과
113,이마를 벽에 세게 박았는데 파인거같아요,계단 내려가다가 벽에다가 쎄게 박았는데 지금 동그랗게 피멍들고 이마가 원래 딱딱하잠 아요 근데 이마가 말랑말랑 하고 멍든곳이 푹 들어갔어요 다시 돌아올까요  병원 가야되나요,응급의학과
114,작은 멍들,어디 부닥치지도않는데 갑자기 어느순간보면 저런 작은 멍들이 생겨있는데 혹시 무슨증상이있는걸까요 ,응급의학과
115,눈이 아프고 속이 울렁거림,너무 늦게 자고 너무 늦게 일어나서 배가 별로 안 고파서 밥을 안 먹은지  일이나 지났는데 오늘 밤에 닭발  개랑 주먹밥  알을 먹었는데 속이 안 좋고 밥도 안 넘어가고 머리도 살짝 아프고 눈도 살짝 아픈데 왜 이럴 까요   ,응급의학과
116,손가락 휨,이거 진짜 고치는 방법 없나요  이거 때문에 거슬려서 사진도 못찍어요   병원 가야겠나요    도와주세요   첫번째 사진은 힘 안주는 거고여 두번째꺼는 살짝 줬어요,응급의학과
117,화상부위에 감염  ,안녕하세요 제가 커피머신에 얕은 화상을 입고 얼음으로 처치를      분 하고  시간 방치했다가 혹시몰라 화상상처 보호 밴드를 구매해 붙였습니다  하루 지나고 뜯어보니 손톱 큐티클처럼 올라왔길래 흉이 그대로 질까봐 큐티클 제거하는 도구 그냥 물로 씻어서 그 부분만 잘라내었습니다   그랬더니 상처가 벌어져버렸는데 그 상태로 다시 보호 밴드를 붙였습니다    분도 되지 않아서 왼팔이 저릿하고 근육이 살짝 아프다가 갑자기 두통이 시작되어서 타이레놀을  개 먹었는데   아무 이상 없을까요   혹시 파상풍일까요   ,응급의학과
118,손발 저림,혈액순환 문제가 있다고 생각했는데 요즘 심하게 다리 전체 저림 특히 발이 심하고 손도 저립니다 침대에 다리 쭉뻣고 있는데도 계속 전기오듯이 저린데요 무슨과로 병원에 가야하나요  전문가님 제발 알려주세요  순환기내과  신경과  혈액과 ,응급의학과
119,제 친구가 사고 후 트라우마로 인해 밤에 잠을 잘 못자고 쪽잠만 자서 너무 걱정됩니다 그래서 그런데 혹시 병원에 가지 않고 본인이 해결할수 있거,제 친구가 사고 후 트라우마로 인해 밤에 잠을 잘 못자고 쪽잠만 자서 너무 걱정됩니다 그래서 그런데 혹시 병원에 가지 않고 본인이 해결할수 있거나 친구가 도와줘서 해결할수 있는 해결방안 이 있는지 궁금합니다 급해요   ,응급의학과
120,제가 말귀를 못알아 듣는데 난독증 인가요 , 질문 그대로 입니다 ,응급의학과
121,소염제 질문,귀두가 휴지에 쓸려서 상처가 약간 나서 소염제를 하나 사먹으려고 하는데 어떤걸로 달라고 하면 될까요 ,응급의학과
122, 차백신 다른거 맞아도 되나요, 월초에 화이자  차 맞고 부작용와서 응급실   만원 땅바닥에 버리고   안맞았는데  차까지 맞아야 한다 이지랄 해서  차 맞으려 합니다  근데  차도 화이자로 맞아야하나요  잔여백신은 모더나가 많이 남아서요 근데  달 지낫는데  차접종으로 인정해주는지는 모르겠네요   정확히 알려주세요,응급의학과
123,왼쪽 갈비뼈 라인으로 전면  옆구리 등쪽 부분 통증 및 숨막힘, 틀전부터 통증이 왔습니다  밤에 잠잘수 없을정도로 통증으로 순간 숨을 못쉬게 되는 통증이 동반됩니다   처음엔 왼쪽 갈비뼈 전면만 아픈거 같더니  시간이 지나서 보니 누을때  숨 크게쉴때  등을 바르게 필때 급격한 갈비뼈쪽에 알수없는 통증으로 숨도 못쉬게 됩니다   증상이 어떤병명인지와 병원에 갈 예정인데 어느 곳으로 가야되는지 궁금합니다   인터넷 검색해도 갈비뼈쪽 통증과 숨이 막히는  팽창하는 곳에 뭐가 걸리는 느낌 증상 그리고 갑자기 트름이 많이 나오고 대변이 나오지 않아서 내과를 가야되는지 고민중에 있습니다  도와주세요   최근검강검진시 간수치 등 문제가 있어서 다이어트 하기로 가정의학과들려서 조치받았습니다  참고로   건강한 상태는 아닌듯합니다   ,응급의학과
124,갑자기 일어났는데 어지러워서 쓰러졌는데 무서운 경험이였어요,핸드폰하다가 바른자세에 대해 찾아보고 난 어떤 자세일까 하면서 일어나서 벽면으로 가서 기댔어요 여기까진 괜찮았는데 갑자기 진짜 말그대로 귀에서 삐  소리가 들리고 세상이 어질어질하더니 쓰러졌어요 그리고 막 부들대진 않았고 벽면에 쓰러져서 한쪽팔만 약간 원모양 으로 주먹 꽉쥐고 돌리고 있었어요  약간 무섭기도 하고 뒤에서 누가 제 손을 잡고 돌리는 느낌 이였는데 무서운 경험이였습니다   왜그랬던 걸까요   가끔씩 갑자기 일어서면 어지러워서 비틀거린적은 있는데 바닥에 주저앉은 적은 처음이여서요  ,응급의학과
125, 도 화상 물집,라면 끓이다가 끓는 물을 발에 쏟았어요   시간 경과 후 보니까 물집이 생겼더라고여 요즘 넘 바빠서 병원 갈 시간이 없는데 연고는 뭐 발라야하죠  연고 사러가기 귀찮은데 걍 둬도되나요 ,응급의학과
126,병원 가야하나요         ,움직일때마다 배 정 가운데가 아파요 느낌이 꽉차있는데 툭툭 건드리는 느낌이라 얘가 저 놀리는거 같아서 좀 그래요              볼일 볼 때마다 설사하고 코피도 나요 건조해서 그런걸 수도 있는것 같긴 한데 혹시 몰라서   대체 뭘먹었길래   ,응급의학과
127,이건 도대체 뭔가요     심각한거에여        병원 가야 하나요      의사선생님 알려주세요     저게 아프지는 않고 등 만질때 좀 거,이건 도대체 뭔가요     심각한거에여        병원 가야 하나요      의사선생님 알려주세요     저게 아프지는 않고 등 만질때 좀 거슬려요     저게 뭔지 왜 생겼는지 아시는 의사선생님 알려주세요    제발 저게 점점 더 커질까봐 무서워요        ,응급의학과
128,아침마다 목이부음,제가 새벽출근을 해서 새벽 시가량에 일어나서 출근을하는데요  기상 후   분  시간이지나면 갑자기 목이 아무것도 못먹을정도로 부었다가 점차사라져요 왜그럴까요  흡연때문이라고도 생각해봤지만 아침말고는 이런증상이없어서 원인을 잘 모르겠네요 ,응급의학과
129,위액을 자꾸 토합니다,한시부터 지금 시까지 총 위액만 번은 토했어요  목이 너무 따갑고 물도 못마실정 도입니다   술먹긴했지만 이정도로 토한적은 없었는데 어떻게해야할까요  병원을 가야할까요    살려주세요    ,응급의학과
130,스트레스로 인해,스트레스로 인해 몸의 반쪽이 마비가 올 수 있나요 ,응급의학과
131,알수없는 보통 및 가슴통증,어제 오후   시경 첫끼로 밥을  공기 이상 먹고 바로 누웠습니다 취침은  시정도 했고 계속 누워있었는데 일어나자마자 배랑 가슴이 너무 아프고 속이 메스꺼워 토도 했습니다 누우면 더 아파서 앉아있는데 병원을 가려고 하는데 내과도 괜찮나요   그리고 왜 아픈걸까요,응급의학과
132,녹슨 옷걸이에 긁혔는데 파상풍 걸릴까요 ,옷걸이를 걸다가 긁혔는데 깊이 난건 아닌데 녹이 슬어있던거라 조금 걱정인데 파상풍 걸릴 정도일까요    바로 약국에서 약 사서 소독하고 연고 발랐습니다  ,응급의학과
133,배 땡기면서 아픈데 왜이럴까요,오늘 아침  시  분쯤에 일어나서 언니랑 같이 산책을 나갔는데 왼쪽 윗배  쪽이 슬슬 아프더니 걷다보니까 너무 아파서 돌아왔거든요   약간 배가 땡기는 듯한 느낌도 나고 몸을 피는 것 보가 웅크리는게 훨씬 덜 아파요  왼쪽 배고요   살짝 소화가 안되는 느낌도 들고   코감기가 이제 거의 나아가는뎁  딱히 원인을 모르겠어서 나열해보면 어제 운동하고 와서 밤 에 뭘 좀 먹었고     그 외에는 딱히 집히는게 없어용   아시는 분 있으면 성의있는 답변 부탁드립니당  ,응급의학과
