134,화이자  차 부스터샷 접종 후 발열,           화이자  차 부스터샷 접종 후   일 차인 현재까지 발열이 지속 되고 있습니다     도 이상  약을 먹어도 해열이 되지 않습니다      어디다 문의를 해야 할까요     오늘 퇴근 후 응급실에 가려고 하는데  병원을 가면 수액을 맞을수 있을까요   ,응급의학과
135,화이자  차 부스터샷 접종 후 발열,           화이자  차 부스터샷 접종 후 현재       까지 발열이 지속되고 있습니다       도 이상  약을 먹어도 해열이 되지 않습니다  어디에다 문의를 해야 할까요      오늘 퇴근 후 응급실을 가려고 하는데    가면 어떤 조치를 받게될까요    내공 드리겠습니다       ,응급의학과
136,화상치료 문의, 일전 그릇이 불근처에서 달궈져 있는지 모르고 잡았다 엄지 중지에 화상을 입었습니다  바로 병원을 가니 물집을 제거하고 소독후 스펀지 같은 밴드를 감아 주었습니다  이틀 간격으로 계속 오라해서   가고있는데 찾아보니 물집은 터트리지 말라는데 지금 상태 괜찮나요  첫 사진이 화상 작후 중지 두번째는 치료  일째 붕대가 풀려 찍은 엄지 입니다,응급의학과
137,화상인데 병원가야할까요 , 일쯤 전에 밥먹으려다 국을 쏟았는데 화상연고바르고 거즈붙이고 나아지는것같았습니다 그런데 점점 더 아프네요 병원에 꼭  야할까요  화상정도가 심한건가요  지금처럼 화상용거즈붙이고 하면 될까요 ,응급의학과
138,등에 뭐가 생겼는데 봐주세요,등에 빨갛게 움푹 파인거처럼 저렇게 있어요 몇개월정도 등이 화끈하고 따가웠었는데 오늘 보니 저렇게 되어있네요 눌러보면 살짝 파인 느낌이예요,응급의학과
139,췌장염 재발,급성췌장염으로   일 전쯤에 입원해서 치료 받았습니다  그 후  주 정도 후에 조영제 ct와 혈액검사에서 이상이 없다고 해서 치료 종료했는데요  완치 이후 한달 안에 췌장염이 재발할 수 있나요  이상은 없습니다  몸에 혹시 한달 만에 암이 생길 수가 있나요  씨티를 보고 의사가 이상이 없다고 했으면 암일리는 없는 거죠  씨티 촬영으로 췌장염 췌장암 같이 확인이 가능한 건가요   후에 검진은 어떻게 받는 게 좋은가요,응급의학과
140,화이자 부작용인가요,백신을   월   일에 맞았고 다음날부터 가슴이 답답했어요 어제까지 응급실 왔다갔다 했고 피검사 소변검사 엑스레이 맥박까지 검사 해봤는데 모두 정상이고 그냥 수액만 맞고 돌아왔었거든요 근데 계속 왼쪽가슴이 찌릿하고 누워있으면 탁 막힌거 같고 서서 있으면 또 배가 막힌 느낌   아시나요   아무튼 그랬는데 오늘 빨간게 올라와서 이게 혈전증  인가 해서요    무슨 부작용인가요,응급의학과
141,암 일까봐 걱정이들어요,재택근무로 의자에 거의 하루종일 앉아있다보니 처음엔 허리가 아파서 허리문제인줄 알았는데 살도 많이찌다보니 간수치가 높다고 운동좀하라고 하셨는데 문제는  주전부터 옆구리 허리통증이 생기면서 내장이라고 해야하나 좌측 아팠다가 우측 아팠다가 허리 뒤로 쿡쿡 쑤시는 느낌이 잦아졌어요 그리고 뭔가 아픔인지 이질적이게 통증이 배에 생기고 어제는 소변보는데 압박감 같은게 느껴졌는데 흡연은  년간 했구요 최근  년은 거의 운동에서 멀리하다 싶이해서   현재    kg   kg도 나와요  병원을 가야한다면 어느분야쪽으로 가서 검사를 받아야하나요  비용은 많이 비싼가요 ,응급의학과
142,백신접종후 이상반응,가슴 통증은 없는데 조금 답답한 느낌이 드네요  오늘로써 맞은지 딱  일 경과입니다  일단 경과를 지켜볼까요 아니면 병원엘 가볼까요  간다면 내과로 가는 게 맞겠죠 ,응급의학과
143,어질어질 울렁울렁 왜그럴까요 ,무거운 짐을 옴길때  계단을 다오르고 딱 멈췄을때  몸이 힘들때  속이 울렁울렁 니글니글 하고 어질어질해요 핑  도는거 같기도 하고 그순간 붕  떠있는거같은 설명을 잘못하겠지만 그순간 어디앉아서 있거나 누워있으면 또 괜찮인 지거든요 왜 이런증상이 나타나나요  멀미하는거 같은 뱃속 상황   아시는분 알려주세요,응급의학과
144,잠안오고 토하고,새벽에 깻는데 엄마가 아직까지 안자고 있네요 수면제 멱으면서 잤다고 하는데 제가 저번에 의존하면서 살게된다고 먹지말라그랬는데 안먹고 지금 새벽  신데도 안자고 일어나서 물먹고 토하고 그래요 이거 어떡해요  ,응급의학과
145,계란삶는기계에 손을 대었었는데,살짝 하얗게  물집이 생기듯 부어오르네요 어떡하죠,응급의학과
146,화상질문이요,화상입고 색깔좀 변했는데 치료받은지   일지났는데 똑같으면 붕대감은거 풀어도 된다는데 물닿아도 될까요  관리는 어찌하죠 ,응급의학과
147,사고가 생겨서 칼에 베였습니다 이런 상처가 생겼는데 소독해두고 밴드로 고정만해둬도 될까요  피는 멈췄고 상처가 그렇게 깊게 파고들진 않았습니다,사고가 생겨서 칼에 베였습니다  이런 상처가 생겼는데 소독해두고 밴드로 고정만해둬도 될까요  피는 멈췄고 상처가 그렇게 깊게 파고들진 않았습니다 흉지는건 상관 없습니다 꼭 병원에 가는게 좋을까요 ,응급의학과
148,임용고시 시험장에서 약을 소지하고 있어도 되나요 ,불안 관련 약인데 응급시에 먹으려고 소지하고 있어도 되나요   혹시나 시험장에서 긴장해서 공황이 올까봐 미리 챙겨놓는 건데 이것도 혹시 부정행위나 이런거에 해당되는지 궁금하네요 겉표지 뗀 물이랑 같이 소지해도 될까요 ,응급의학과
149,오른쪽 윗배 통증,지금이 아니고 예전의 일이였습니다 그때 대학 입학 문제로 스트레스를 심하게 받았습니다 장염도 걸리고 속도 안좋고 식욕도 없고 몸에 힘도 없었습니다 이 증상들은 괜찮아 졌지만 오른쪽 윗배 통증은 여전했습니다 아픈건 아니였고 수시는 기분이였습니다   초 정도 수시는 기분이 들었고 괜찮다가 몇시간뒤 다시   초 정도 수시다가 괜찮아 지고  월부터   월초 까지 통증이 있었습니다  월에 병원갔을때 스트레스의 영향이 크다면서 큰병 아니다 라고 말했습니다   월부터는 병원을 안갔습니다 근데 제가 약간의 건강염려증이 있습니다 사실 오른쪽 윗배 통증때문에 계속 걱정했습니다 근데   월부터 헬스를 시작했었는데 언제부턴가 통증이 사라졌습다 그때는 왜 통증이 있었고 지금은 괜찮을까요 ,응급의학과
150,파상풍일까요 ,술에취해 기억이없는데 자구일어나보니 손바닥에 이상처가있어요 뒤루 넘어지다 바닥을짚구 난 상처인지 유리조각이 들어간건지  많이심각해보이나요  마데카솔만 발라도될지 내일병원을가야할지 모르겠어요 상처주변에 멍도있어서 무섭네요,응급의학과
151,동상 심한건가요,며칠전부터 동상이 온 거 같았는데 긴기민가해서 계속 병원 안 갔다가 네이버에서 봤는데 동상이라더라구요 근데 빨간날이 껴 있어서 병원을 계속 못갔거든요  근데 지금 약간 색깔이 변해서     많이 심한가요  사진으로는 별로 안 심한데 실제는 살짝 좀 더 어두운 색깔이거든요                               동상 심하게 온 건가요             ,응급의학과
152,클리마졸질정을넣었는데 자고일어나서보니 속옷에 아무것도나오지 않았는데 괜찬은건가요 ,원래 약품이 흘러내려와야되는거 아닌가요  휴지에도 안묻어 나던데 안에서 찌꺼기가 덕지덕지 남아있으면 어쩌죠  넣을때 처음부터 잘못넣었는데 깊숙히넣지도않았는데 너무아프기도했고 다시빼서 물을 묻혀 넣었는데도 삽입이 제대로안된느낌이였는데 상관없겠져  그리고 네이버설명서읽어보니 동물실험만된 제품 이라는데 이것도괜찬은건가요 ,응급의학과
153,가슴속이 시렵고 답답해요,찬공기를 마시고 숨찬 것처럼 안이 시렵고 답답한 느낌이 들어요 숨이 약간 차는 느낌이고 왜 이러는 걸까요  어제부터 그랬어요,응급의학과
154,등허리 불편감 질문 대충   일 정도 된 거 같음 처음부터 아프지 않았음 단지 불편감이 컸음 시간 지나니 정도는 나아짐   참고로 필자는 운동함,등허리 불편감 질문  대충   일 정도 된 거 같음  처음부터 아프지 않았음  단지 불편감이 컸음  시간 지나니 정도는 나아짐    참고로 필자는 운동함                 이것은 허리  증상 검은곳      ,응급의학과
155,어제 너무 구역질이 나서 자다 깼어요 ,잠을 자다가 기분이 이상하고 입이 텁텁한 기분이 들어서 계속 삼켜내면서 참았는데 이게 토할 것 같은 기분이란 걸 인식하자마자 딱 깼어요  허겁지겁 물 마셨는데 그대로길래 화장실에 있었는데 또 괜찮아지더라고요    요즘 피부도 안 좋아진 것 같고 몸이 쇠약해진 기분이긴 한데 도대체 이게 무슨 증상인지 잘 모르겠어요 ,응급의학과
156,친구만 코로나 양성,어제 오후 시에 코로나 검사를 친구랑 맡고왔는데 저녁 시쯤 헤어졌고 오늘 아침에 저는 음성 친구는 양성인데 이게 말이 되나요  친구랑 이틀간 같이있었는데 왜 저만 음성이죠  검사받기 전까지 계속 같이있고 밥도 같이 먹고 술도먹고 마스크없이 오랜시간 같이있었는데 밀접접촉자 인건 맞는데 혹시 제가 안걸렸을 가능성이 있나요 ,응급의학과
157,기흉수술  간질약 뇌졸증질환   있는데 백신맞아도 되나요  ,안녕하세요  대전 을지대병원에서 기흉수술   년전에 했고 응급으로  번   전신마취 번 이런식으로 했습니다  간질약도   년 전부터 지금 까지 계속 먹고있습니다  약먹으면 틱은 오지 않습니다  최근 서울 아산병원에서 뇌쪽으로 사진 다 찍었습니다  다 정상 나왔습니다  그치만 교수님이 검사에서는 안나올수있다  약은 계속 먹는게 좋을꺼같다고 하셨습니다  고개를 돌리면 어지럽증도 있어서 기넥신약도 먹고있구요   근데 문제는 백신을 맞아도 되는지 안되는지 너무 궁금하고 무섭습니다  가게를 하고있는데 안맞을수도 없고 도와주세요  ,응급의학과
158,코로나 친구만 양성, 일날 만나서 저녁먹고 밤에 술집에서 술마시고 다음날 오후  시쯤 코로나 검사을 받았는데 딱히 증상은 없어요 오늘 아침 저는 음성이나왔고 친구가 양성이 나왔다는데 이렇게 같이있었음에도 저만 음성이라는게 말이 되나요   저가 안걸렬을 확률도 존재하나요 ,응급의학과
159,백신 응급실 질문,백신 아직  차맞고  주가 안지났습니다 백신패스인가요  응급실에 보호자로 들어갈수 있나요  환자분과 제가 보호자로요 ,응급의학과
160,콜린성 두드러기 알레르기 화이자 백신,사진 혐 주의띠  약 두달 전 콜린성 두드러기로 의심되는 알레르기 반응이 올라왔었습니다  발 끝부터 손목 까지 손 손목 팔꿈치 아래 허벅지 종아리 오금 발목 발 등등  팔을 제외한 상반신은 증상 없음  기도쪽 증상 없음  대략 일주일간 응급실에    회 방문해서 스테로이드 처방 및 수액 받았습니다 증상은 간지러움과 약간 뜨거운 느낌을 받았고 증상이 올라오면 약   분동안 팔과 다리에 증상이 왔다갔다 했고 특히 허벅지 종아리 오금에 심하게 붓기 시작했습니다  오늘 화이자  차 받았는데 주의해야 할 점이 있을까요,응급의학과
161,수면장애 어떻게 할까요,잠은 오는데 잠에 들지는 않고 졸음이 쏟아져서 침대에 누워서 자려고 눈을 감으면 진짜 귀신같이 심장이 빨라지고 신경이 곤두세워지고 주변 소리에 예민해져 작은소리에도 화들짝 놀라 잠이 싹 달아나면서 심장이 빨라지니 몸도 후끈후끈 달아올라 여름이불에 반팔반바지 차림이여도 더워지고 걍 눈만 감고 있는상태로 잠 못자고 밤을 보내버린게 진짜 일주일에 한두번 간격으로 이러네요 카패인이 문제일까봐 커피를 마시지도 않습니다 일부러 진짜 다음날 죽을거같아도 카페인 입에도 안댑니다 뭐 먹어봤자 편의점 녹차 한병정도네요   죽을거같아요 왜이럴까요 진짜 뇌와 몸이 저를 놀리는거같아요 잠자는 시간이 제일 좋아했던 저인데 이제 잠자는 시간대가 다가오면 너무 두려워요 이거 처음겪어본게     년인데 몇개월에 가끔씩 이랬다가   년   월 들어서는 너무 자주이러네요,응급의학과
162,허리가 아파요,가끔 갑자기 허리가 쑤시듯이 아파요  전체가 아픈 건 아니고 빨강색으로 칠한 부분만 아픈데 왜 아픈걸까요   계속 아픈 게 아니라 주기적으로 몇 번씩 갑자기 아프다가  일  일이 지나면 또 안아파요 ,응급의학과
163,폐로 산소 공급이 잘 되는데 안 되는 느낌입니다 ,예비 고 입니다  원래 괜찮았는데 요새 더 그러는 것 같아요  숨을 쉬면 제가 스스로 인지를 하긴 해요  현재 내 폐 속에서는 산소가 있구나  그런데 몸이나 기분은 산소가 안 들어온 것 같아요 그럴 일은 없겠지만 공기가 너무 답답합니다  마스크를 풀어도 마찬가지고요  물론 제 폐 속에 산소가 들어가는 것은 알고 있습니다만 몸이나 기분은 다시 이산화탄소를 들이킨 듯이 숨이 안 쉬어지는 듯 합니다  그와 관련된 병이나 질환은 태어나고 걸려본 적 없습니다  이것때문에 스트레스를 조금 받아서 여쭈어봅니다 ,응급의학과
164,이정도면 화상 표재성인가요 심재성인가요,어젯밤에 고대기에 데였어요 물집이 터졌고 진물이 나옵니다,응급의학과
165,코피 목구멍,코피 났는데 거즈로 말아서 콧구멍에 넣었는데 피가 목구멍쪽으로 역류하더라구요 뱉으려했는데 실수로 삼켜버렸어요 별일 없겠죠    ,응급의학과
166,아랫배가 왜 아플까요,어제부터 배 전체가 아프더니 이제는 그냥 아랫배가 아프네요    누르면 아파요 걷을때도 쑤시고요 아프다가 왼쪽 옆구리도 통증이 좀 와요대변은 어제 낮에 한번보고 못 봤어요 병원가보니 잘 모르겠다고 일단 위장약 먹어보자고 하더라고요  일전에 남자친구랑 관계를 맺긴 했는데 질내사정은 안했어요 남자친구가 불안하다고 해서 혹시나 해서 물어봅니다 대변을 못 싸서 그런걸까요 ,응급의학과
167,직장인 건강검진을 받았는데요 의사소견에 미세 세분절 무기폐 의심 이라고 진단이 나왔습니다,직장인 건강검진을 받았는데요 의사소견에 미세 세분절 무기폐 의심 이라고 진단이 나왔습니다  직장에서는 들어보지 못한 내용이라고해서 궁금하여 글남 남겨봅니다   평소에 술담배로 인하여 급격하게 몸무게가 증가한거 외에는 태어나서   항상건강했는데 궁금합니다 ,응급의학과
168,파상풍 질문,파상풍인가 걱정이 되서요  예방주사 맞았던 것도   년이 안지났어요  귀찌에 긁혀서 살짝 피가 났었는데 지금은 상처가 다 나은 상태인것 같아요  상처부분은 눌러도 아프지 않아요 ,응급의학과
169,마그네슘 먹었더니,마그네슘 알약 먹은 이후로 왼쪽 옆구리 쪽이 불편하고 뭔가 찬 느낌이 드는데 부작용인가요 ,응급의학과
170,파상풍 주사 맞아야 할까요 ,동파 문제로 급히 짐 정리를 하느라 맨발로 발목까지 물에 담근 상태로 움직이다보니 발 여기저기에 심하게 긁히고 피가 났습니다  일단 짐 정리가 다 끝난 후에 간단히 알콜솜으로 소독은 했는데 화분용 흙과 창고 속 각종 짐이 물에 섞여 떠다녔기 때문에 걱정이 되어 질문글 작성합니다  그리고 만약 주사를 맞아야 한다면 어떤 병원으로 가야할까요  그냥 인근 내과나 이비인후과에 가도 맞을 수 있을지 궁금합니다 ,응급의학과
171,파상풍 주사 접종 후 이상증상,파상풍 주사 접종후  일 지났는데요    저번 금요일부터 심장 불규칙적인 운동감 쿵쿵 잘 뛰다가 갑자기 부르르르 떨리면서 다시 쿵쿵 정상적인 움직임 이 난생 처음 느껴져 놀랐습니다  그러고나서 가슴통증이 간간이 느껴졌다가 저번 토요일엔 왼쪽 가슴이 꾹 누르는듯한 답답한 느낌의 통증이 다시 느꼈다가 오늘도 같은증상이 느껴졌습니다   주사맞고 이럴수 있나요    주사맞은게 저번 일요일었는데 전날 거의 날새서 잤고 일욜도 일찍 일어나 컨디션이 안좋긴 했습니다   주말이라 대학병원 응급실에서 맞았는데 이럴경우 주사맞은 곳의 내과로 가야하나요 ,응급의학과
172,한달여 동안 오란다라는 과자에 중독되어 매일 거의  봉씩 먹고있는데  계속 이렇게 먹을경우 건강에 안좋을까요    대이고 질환은 없습니다 ,한달여 동안 오란다라는 과자에 중독되어 매일 거의  봉씩 먹고있는데  계속 이렇게 먹을경우 건강에 안좋을까요    대이고 질환은 없습니다 ,응급의학과
173,,,
174,,,
175,,,
176,,,
177,,,
