title,content,department
대장내시경후 아랫배 복통,대장내시경후 아랫배 웟배 다 아픕니다 꾹꾹 쑤시거나 싸하게 계속 아픕니다 어저깨 응급실 갔다 왔는데 ct는 이상 없는데 피검사에서 아밀라제가 높았습니다 장청공 아닌가요  내시경한지   일째입니다,소화기내과
대장 내시경은 몇살부터,하는게 좋은건가요  회사에서 신청 하라고 하는데    아직 젊어서 안해도 될지   무료로 해주는거라 해야 할지 망설여지네요 ,소화기내과
B형간염치료제 비리어드 와 탈모 관계 궁금합니다 ,나이는   대여서 탈모가 생길 수 있는 나이대라고 생각되기는 합니다만       B형간염치료를 지속적으로 받고 있는데 처방약으로 비리어드정을 복용하고 있습니다  그런데 한  년전쯤부터 칼슘  비타민D가 부족하다면서 비리어드정과 함께 칼데라이트라는 칼슘 비타민D 보충제를 함께 복용중입니다  아마 그 즈음부터 시작된 거 같은데 머리카락이 얇아지면서 탈모가 일부 발생하는 것 같고  손톱이 얇아지면서 자주 손톱끝이 날까로와지면서 까지는 것 같습니다  물론 둘의 상관관계가 있는지 잘은 모르겠지만 아무래도 칼슘같은 것이 머리카락  손톱의 주성분인 케라틴에도 영향을 미쳐서 그러는 거 아닌가 싶어서 문의드립니다   만약 맞다면 어떻게 해야 머리카락과 손톱을 다시 예전처럼 굵게 할 수 있는지요   비리어드정이 칼슘  비타민D 등의 흡수를 저해하는 경우가 있어서 이렇게 의사선생님이 처방을 해준 것으로 알고 있거든요   전문가 분들의 고견이 듣고 싶습니다 ,소화기내과
체중감소원인, 월까지체중이보통        정도됐어요 현재     정도나갑니다  월달부터 몸이 힘들고 식은땀과 미열 급기야   월 일 두통 뇌mri 이상없음 이시작되더니  일낮부터    까지 열이났습니다 응급실에서 피검사 엑스레이 소변 심전도 다괜찮다고합니다 왜열이나는지 모르겧대요 작년부터병원다니면서 위 대장 소장내시경 했고 췌장 간 복부 씨티로 볼수있는건다했구요 피검사 지난달엔 혈액정밀검사도 다 받았습니다 결과는 이상없구요 또 재작년부터 마른기침이시작됗는데 ct까지 찍어봤는데 이상없구요 그러다 작년엔 한번도 마른기침증상이없다가 올해 월부터 또시작됐습니다 갱년기증상도있고 아주오래전부터 잠은 거의 두세시간 어떨땐 꼬박세울때도많고 요즘 살도빠지는것같아 스트레스가 이만저만이 아닙니다 암같은 병에 걸렸을까봐 너무 무섭습니다 병원검사 또할게있을까요 너무 스트레스 받는지 소화도안되고 살빠지는게 두려워 억지로 더 많이 먹는데 이것도 너무힘드네요 아침에 변을보고나서 체중재는게 스트레스다보니 새벽 시쯤이면 긴장되면서 똥이마려워 이것때문에 그냥 잠자리에서 일어나버립니다 그리고 게속 화장실 체중계 이렇게 반복하면서    이라도 적게나오면 또 걱정하고있구 하루종일 그것만 신경쓰느라 아무것도 할수가없어요 이런 제가너무 피곤합니다 어쩌면좋을까요,소화기내과
간기능이 약해지면 간쪽이 불편하나요 ,올해초 술로인한 급성간염 경험이있습니다 정상수치가되었지만 그후부터 무기력 몸살 간쪽불편함이 지속되어 내원하여 ct검사 혈액검사를 받아보았지만 이상소견을 못받았습니다 정상수치인데도 불구하고 후유증이라는이유로 간기능이 떨어져 이러한 증상이 있을수있나요  아님 단지 신경성인가요  시간이 지날수록 호전이 될 기미가 안보여서요,소화기내과
대자장내시경후 복통,대장내시경을   일전 봤았습니다 받고나서 뻐근한 증상이 있었습니다 몇일뒤 좀더 아픈증상이 있어 피검사를 했는데 아밀라제가 조금높다고 했습니다 아밀라제가 높은거는 장에 문제 있는거 아닌가요  그전주에 건강검진에서는 피검사 정상 이었습니다 지금은 아랫배 윗배 아픔니다 아밀라제가 높다는건 천공이나 출혈아닌가요  제발 전문의분들 답을듯고 싶습니다,소화기내과
왼쪽 복부 혹 멍울  만져지고 움직일때 왼쪽 옆구리 허리쪽 통증,사진에 왼쪽에 저부분이 뭔가 잡히고요 요며칠 소화가 안되고 가스가 차서 복부팽만이 있고 그러다 보니 여기저기 아프고 몸이 천근만근 같은데 우연히 복부를 만지다 꼬집으며 맛사지를 하던중 왼쪽 복부에 깊게 꼬집듯 만지니 덩어리가 잡힙니다  오른쪽도 만져보니 오른쪽엔 없구요 처음엔 통증이 없다가 계속 만져서 그런지 아프기 시작했어요 누르면 아프고 만져집니다  정확한 위치가 왼쪽 옆구리보다 살짝 안쪽 복부  이부위에 악성 종양이 생길수 있나요  생기면 무슨암이죠  아직 체중이 줄거나 식욕이 줄거나 하지는 않았어요 변은 변비중인데 변을보면 묽은변 후 설사가 나오고 있습니다,소화기내과
간수치 및 bilirubin 수치,제가 약 이년전쯤 몸이 안좋아 피검사를 받았는데 간수치가     대까지 올라가서  일정도 입원후에 정상에 근접한 수치로 떨어져서 퇴원했었거든요 그 이후에 가끔씩 피 검사 해도 간수치는 정상이었구요 그 때 당시에 abc형같은 바이러스성은 아니라고 했는데 제가 음주는 좀 하구 담배는 안하거든요 최근에 검진을 했는데 역시나 간수치는 정상인데 빌리루빈 수치가 조금 높아서 눈도 보면 심한수준은 아닌데 항상 노란 느낌입니다    왜 이러는 걸까요  최근 두달전 검진 결과 표 사진 첨부합니다  혹시나 자가면역간염일수도 있나요,소화기내과
간 수치 ALT만 정상보다 높게 나와요,안녕하세요    살 만   세  직장인 입니다   건강 검진을 통하여 간 수치를 확인하게 되었는데  AST    ALT    감마지티피     위와 같이 수치가 나왔습니다   체중이 많이 나가서 주  회이상  시간 반  시간 운동 하며  영양제도 챙겨먹고 있습니다   영양제는 종합 비타민  칼슘  마그네슘  오메가   코큐텐  유산균  콜라겐  다이어트 보조식품 초록이 분홍이 을 섭취하고 있습니다   혹시 간에 영향을 많이 주는 제품이 있는건지  저 수치가 많이 위험한지 궁금합니다 ,소화기내과
  살에 유당블내증 생길수 있는건가요,흰우유를 막으면   배가 아프더니 설사를 하거든요   근데 또 초코 바나나같은 과일섞여있는 우유는 안그러고 유독 흰우유만 반응이 이딴식인데   유당블내증이나 다른 질환인건가요  다른 질환이면 알려주시고요 집에서 치료나 자연치유가 있다면 알려주시길 ,소화기내과
A형간염 접종,오늘 독감 맞으러 갔더니 A형간염 접종 맞아야 한다며  얘기하시던데 제가 임신중에 맞았던거 같거든요   항체검사도하고   금액도 만만치않더라구요   A형 간염 예방주사는 해마다 맞아야하나요 ,소화기내과
장상피화생 조직검사 관련 질문드립니다 ,안녕하세요  건강검진 위내시경때 회백색으로 융기된게 하나 있어 육안 소견은 장상피화생으로 보인다 하셨는데 일주일 후 조직검사에는 장상피화생은 아니고 헬리코박터균으로 인한 만성 활동성 위염이라고 나왔습니다  위염으로 인해 회백색으로 융기된 게 생기기도 하나요  염증으로 인해 나타나는 건 점막이 빨갛게 되거나 허는 등의 증상이 아닌가 싶어서 질문해봅니다 ,소화기내과
피검사 해석,올해 심장수술 하신 저희 할머니 피검사내역이에요 최근에 식후 및 새벽에 복통이 심해져서 복부ct찍고 피검사해보았는데 ct결과는 이상이없었고 피검사에서 염증이 CRP는    으로 정상인데 ESR인지 하나가 정상이   인데   이 나왔다고 조금 높다고 해서 걱정이에요 우선은 위궤양같은 소화성궤양약이 추가가됐는데 할머니가 최근 방광염 증상이 있어서 비뇨기과를 가려고했는데 이것때문일까요  잠을 잘 못주무셔서 스트레스도 있었어요  한달전쯤 소변검사했을때 소변에 염증이 있다 했는데 별다른 증상이 없으셔서 넘어갔다가 시간이 지나니 증상이 나타나더라구요 또 하나 의심된다면 기침 하신지가 오래되었고 가래도 계속 나오구요 병원갈때마다 폐렴오실까 무서워서 검사하면 기침말고 별다른 증상이없어서 괜찮다 그래요 관절도 아파하시는데 퇴행성인지 류마티스인지 저는 잘 모르지만 계속 전신이 아프다고 하시고 류마티스인자인자  검사한거에서 양성이 나왔어서 이쪽인지도 생각돼요  염증이 무서운건데 수술후컨디션도 그렇고 살도 많이 빠지셨고 갈수록 더 아픈곳만 느시고 ct를 자주 찍게되니 이러다 암이 올까봐도 무서워요,소화기내과
담낭 용종    cm이 있어요,안녕하세요   제가 얼마전에 초음파 검진으로  담낭에    cm 용종이 있다는 얘기를 들었어요   콜레스테롤 수치도 조금 높다고 해서 아마 콜레스테롤성 용종인거 같기는 한데    제가 최근  년 사이에 거의    키로가 찌면서 살이 많이 찌긴 했습니다     저지방으로 식단 관리를 하면서 운동하고 살을 좀 빼면 용종이 사라지는 경우도 있나요    cm이 되면 수술로 담낭 자체를 제거해야하는데  아직 나이가 젊어서   그건 안하고 싶어요 ,소화기내과
궤양성 대장염 약 복용중인데 혈변이 나옵니다 ,저번달에 궤양성 직장염 판정 받았습니다 펜타사 좌약  g  달치 처방받고 약  주  주 째 복용중입니다  하루에    회 변을 보구요 처음 복용 할 당시에 변을보면 설사처럼 된 흰색물질이 먼저 나오고 변이 나오다 저번주 부터 혈변증상이 추가가 되었는데  약을 계속 복용을 하면 괜찮아 질까요  병원에 가서 다시 진단을 받아 봐야 할까요  화장실 가는 횟수에는 변화가 없고 약을 복용했을때 변을 볼땨까지 장에서 계속 꾸르륵 소리가 납니다   복용중인 약은 좌약 하나고  유산균 이틀전부터 먹고 있습니다 ,소화기내과
대장내시경 이틀전 오리백숙 녹두 죽,안녕하세요 제가 대장내시경 하기 이틀 전인 오늘 점심에 오리백숙과 찹쌀녹두들어간 죽을 먹었어요 이틀 후 오전   시에 대장내시경 시 문제있을까요 ,소화기내과
알콜간염을 앓고 후유증 이 오래갑니다,올해 월에 알콜간염을 앓고 고생했었는데요  주정도지나 정상수치가 되었지만 그후로부터 무려 지금까지 자고일어나면 무기력함이 강하게오고 어떠한날은 몸살로 이어지고 또어떠한날은 휴식을 게속취하면 조금은 괜찬지만 활동을하면 몸이 아파오기시작합니다 이상하게 새벽시간쯔음되면 조금 안정됩니다 혈액검사도 매번해보고 큰병원까지가며 ct초음파등 검사를 받아보았지만 이상소견은 없었습니다 도대체 왜그러는거고  치료방법이궁금합니다,소화기내과
홍삼이 간에 무리가고 안좋나요 , 년전 간염을 앓은적이있는데 그후 무기력몸살이 지금까지 지속되서 홍삼을 복용해보려합니다 검사상 지금은 정상이구요    홍삼을 복용하면 효능이있고  간에 무리가가고 안좋으려나요 ,소화기내과
간 수치가 높은데 질문 있어요   ,운동은 꾸준히 하는   대 남성입니다 최근에 하체 운동을 스쿼트나 헬스 기구로 몇달만에 했더니 새벽에 잠 깰정도로 통증이 심하고 소변에서 콜라색이 한번 나와서 내과 검사 해보니  결과가 사진처럼 나왔고 의사선생님께서 자세한 설명을 하셨는데 기억이 잘 나지않아 질문 올립니다    정확하게 몸 전체적으로 수치가 어떤 상태인가요    횡문근융해증은 맞다고 하시는데 헷갈리네요 소변에서도 단백뇨가 좀 나왔다고 하십니다 답변 부탁드려요     그리고 크게 지금은 치료할게 없고    주뒤에 통증 부위가 완전 회복되면 다시 검사 해보자고 하시네요 너무 걱정됩니다  간수치가     이 나오다니요    횡문근융해증때문에 일시적으로 올라간건가요 ,소화기내과
위궤양 내시경전 투약 정지,안녕하세요  작년 말에 건강검진을 받고 만성 위궤양 진단을 받았습니다  궤양 상태가 장기적으로 오년정도 형성된거 같다며 투약을  개월 정도 받아가며 치료해보다 해서 진행했는데 코비드 상황도 그렇고해서 자주 진단을 못받고기존 투약내용으로 약을 먹었습니다   왼쪽 배 중간 부위 가슴 아래부위 쪽 갈비뼈 경계부위가 새벽에도 좀 더부륵하며 평소 낮에도 그런편입니다 두세달 전엔 좀 아프기도 하였고 지금도 간헐적으로 가끔 찌르듯이 아픕니다   투약을 받은건 무스코타 식후와 아침식전 넥시움입니다   어제 진료를 받는데  위궤양 만성인거 같다면서 다시 내시경을 해보자고 하여 그렇게 하자고했습니다  물론 저도 내시경 해보려고 진료 받으러 간것이고요  그런데 의사는 투약을    주 끈고 그 이후에 내시경을 하자고 하더라고요  말은 약을 안먹고 이후에 상태를 봐야 한다고는 하는데이런 방법이 맞는지 의아합니다  계속 치료해 나아져야 하는데 투약을 끈어 자칫 더 안좋아 지면 어쩌지    이게 정말 맞는 방법인지 궁급합니다   해외에 있어서인지 좀 이런 부분에서 걱정이 되는데 소통의 한계가 있어서 여기에 여쭈어 봅니다 ,소화기내과
ct찍으면 장천공이나 장출혈 알수있나요 ,제목 그대로입니다 대장내시경후 일주인째 복통이 있습니다 응급실가서 ct찍었는데 이상 없답니다 근데 배가 계속 아픕니다 피검사에서 아밀라제가 조금상승 했습니다 내시경하기전에는 피검사 정상 이었습니다,소화기내과
장염 후  주일 지났는데,장염 후  주일 지났습니다  식후 전처럼은 아니지만 약간에 복통은 있는 상태고 점점 하루하루 나아가고 있는 상황인듯 합니다 근데 어제 까지 대변이 다 풀어진 황색이라고 해야되나 그런 대변이 나오다가 오늘아침부터 대변이 설사는 아니고 진갈색 대변이 나옵니다 혹시 문제 없는걸까요  다음주 화요일날 취소 할수 없는 술 약속이 있는데 음주 괜찮을까요 ,소화기내과
복통 설사 식은땀,어제 자기 세시간전에 치킨을 먹고 막대아이스크림 하나 먹고 새벽 시쯤에 잤습니다 근데  시 좀 넘어서 배가 꼬이는듯 미칠듯이 아프고 꼬르륵 소리가 엄청 크게 나면서 식은땀이 나기 시작했어요   분정도 앓다가 화장실을 갔는데 바로 설사를 하고 속이 불편한채로 잠들었어요 그리고 오늘 하루종일 윗쪽배가 계속 불편한데 왜그런거죠  체한건가요   어떻게 하면 괜찮아져요   ,소화기내과
딱딱한 대변이 나오는 원인이 뭡니까 ,딱딱한 대변이 나오는 원인이 뭡니까  어떻게하면 부드러운 대변을 볼수 있습니까  두번 연속으로 연기가 막혀서 괴롭습니다 ,소화기내과
건강검진결과 간초음파 의견좀봐주십시요, 년 경과후  결과입니다  소견좀 내어주십시요  제가 어떻게 하면될까요     ,소화기내과
b형 간염 주사 간격,안녕하세요 b형 간염 백신주사  는  차  차  차 맞잖아요  주사 맞는 간격이 어떻게 되나요  차맞고 며칠후  차맞고 며칠후  차 접종인가요 ,소화기내과
장염 눕기만 해도 배통증,장염이랑 감기가 동시에 걸렸었는데 병원을 하루 뒤에 갔습니다   일치 약을 받아왔고 약은 하나 남았습니다  장염 증상은 아직까지 계속되고 어제 저녁부터는 잠을 자려고 누워도 배가 너무 아파서 괴로울 정도였습니다  잠도 몇시간 못자고 자다깨다를 반복했네요   지금도 앉아있어도 누워있어도 고통스러운 정도이고 배에서 소리가 자꾸 나는데 이럴 때는 어떻게 해야하나요  광고 글은 자제해주세요  ,소화기내과
속쓰림 구토 가슴답답 두통,속쓰림 구토 가슴답답 두통  약먹어도 별 효과가없는데  무슨방법이없을까요  ,소화기내과
소화불량 검사,소화불량 복부팽만으로  최근에 위내시경 복부초음파를 받아봤는데 역류성 식도염 조금 있는거 빼곤 아무 이상없다고 하셨는데 증상이 호전이 없다면 대장내시경이라던지 CT라던지 다른 검사도 받아봐야 할까요 ,소화기내과
변비가 심하고 똥이 마려워도 안 나와요,제가 변비가 심한데 병원가서 관장 약도 넣어서 해보고 어린 나이에는 처음 해봐서 너무 힘들어서 의사선생님이 항문에 손을 넣어서 어찌저찌 변을 빼내셨어요  그 이후로 물 이랑 밥 잘 챙겨 먹으면 잘 나올 거란 생각에 관장약을 한 번 더 넣자 했는데 안 했어요   그땐 괜찮은 느낌이어서   근데 현재로서 제 몸은 전이랑 같은 느낌이에요  누워있어도 앉아있어도 걷고 있을 때도 안절부절 못 하는 느낌이에요  밖이든 어디든 변이 나올 거 같은 느낌인데 안 나오고 가스만 조금씩 조금씩 나와서 눈치 보이고   괄약근에 힘을 주니까 체력소모도 꽤 나서 힘들어요     지금은 변비약이랑 아기오    라는 괄입인가   약 처방 받아서 먹는 중입니다  어떻게 하면 지금 안 나오는 똥이 잘 나올 수 있을까요    수분이 없어서 인듯 한데      그래도 최근 들어서 물 자주 마시는 편이에요  유산균도 먹고   변을 누고 싶은 느낌은 엄청 드는데 똥꼬가 아픈 느낌이라서 오히려 참게 돼요   어떡하면 좋죠   다시 병원 가서 빼달라고 하는 게 답일까요     ,소화기내과
배에 복수가 찼습니다,오늘 동네 내과가보니 간이 안좋아진거에 비해 복수가 많이 찻다고하고 간경화끼가 살짝보인다하고 큰병원으로 가보랍니다 이후 입원까지하고 치료를 받으면 완쾌 할수 있을까요  집안내력으로 간이 안좋습니다,소화기내과
체지방 수치는 낮은데 복부팽만,몇주 전부터 배가 붓는 느낌이더니 배를 만져보면 확연히 전이랑 차이가나더라구요 예전엔 밥을 먹어도 일시적으로 윗배만 나올뿐 아랫배는 쏙 들어가있었는데 지금은 평소에도 배가 전체적으로 팽만한느낌이며 특히 배꼽주변이 더합니다 덩어리도 만져지고 변비라서 그런가 싶어도 장청소도 하고 난 뒤에도 여전하고 복근  갈비뼈 드러날정도로 마른여잡니다   아무리 봐도 뱃살은 아닌거같은데 원인이 뭘까요 평소에 위장도 안좋고 간도 안좋고 자궁근종도 약하게 있는지라 의심할만한 요소들이 하도 많아서 정확한 원인을 찾고싶습니다,소화기내과
동네 의원에서 췌장 초음파와 혈액검사를 했는데요,혈액 검사상의 황달수치가 약간 높은 점을 제외하면  혈액검사상으로나 초음파 검사상으로나   별다른 문제가 없어 보인다고 하셨거든요    이 정도면 정밀 진단까지는 필요가 없는 상황일까요      최근에 잠을 자려고 똑바로 누으면 왼쪽 등이 너무 아파서요   추가로 소화도 잘 안되고 명치쪽이 아파오기도 합니다    검색을 해보니 췌장암 증상이라는 것 같아서요     동네 병원 의사 선생님의 이야기를 신뢰하고   원인을 다른 곳에서 찾아야 할까요  ,소화기내과
B형 간염 보균자인데 병원가서 어떤검사를해야하나요 ,만  대후반인데딱히 관리하고있지않습니다  활동성인지 비활동성인지도 검사하면 나오나요 ,소화기내과
체한 것 같이 명치 답답함 지속됨,명치가 답답하고 배에서 크게호흡하거나 역동적으로 움직일때 꼬르륵소리가 나고 체한 것처럼 소화가 안되는 느낌인데 위장약과 소화제를 먹었는데  주일정도 지속되고있습니다  백신 부작용으로 위나 장에 문제가 생긴걸까요  ,소화기내과
흑변에관해서,제가 일정도흑변을보다가오늘아침은흑변이아니여서요제가아침저녁밥먹을때시금치를섭취했는데시금치때문에흑변을볼수가있나요,소화기내과
대장내시경에서 조직검사를 했습니다 ,수면 대장내시경을 했는데 일단 용종은 없고 깨끗하다고 하는데 대장 내에    군데가 좀 부어있고 염증같이 생겼다고는 하시는데 애매해서 조직검사를 했다고 합니다   결과가 나와봐야하고 의사 선생님이 걱정은 하지말라고 하셨지만 혹시나 암같은 최악의 상황일까 불안합니다   내시경을 진행했을때 조직검사 결과전에 정확하게는 못하겠지만 의사가 육안으로 이게 암인지 염증인지 구분할 수 있나요  ,소화기내과
B형 간염 약 먹으먼,B형 간염 약 베믈리디  먹고 수치 정상화되면 더이상 전염 안되나요  몇일 전 성관계를 가졌는데 불안하네요  ,소화기내과
간경화도 신호가 온후에 발생하나요 ,올해초 술로인한간염을 앓은적있습니다 하지만 정상수치가되었는데요 지금까지 무기력 몸살 두통 오른쪽상복부불편함에 시달리고 있는데요   개월전에  차병원까지가서 간기능검사를 받아 조금의 지방간외엔 이상없다는걸 확인했습니다 하지만 통증은 게속되네요  혹시 간경화도 신호가 오고 서서히 오나싶어서요  도와주세요,소화기내과
b형 간염으로 바라쿠르드를 처방받아 복용한지  달이 지났습니다 혹시 간수치가  달 내로 떨어질까요  복용전 간수치는    이었습니다,b형 간염으로 바라쿠르드를 처방받아 복용한지  달이 지났습니다 혹시 간수치가  달 내로 떨어질까요   복용전 간수치는    이었습니다,소화기내과
장염이 복통만 있을수도 있나요,고삼인데 어제부터 복통이 심하네요   뭐 잘못 먹은 건 없는데   다음주가 수능인데 어쩌죠    내일 병원 가면 목요일까지는 괜찮을까요  제가 장염에 자주 걸리는편인데 복통이 딱 장염 걸렸을 때의 복통이에요 근데 다른때와 다르게 설사는 안하네요,소화기내과
무결석 담낭염 질문드립니다  ,무결석 담낭염 판정 받고 대학병원에서 담당의 진료 기다리고있는데요  일주일 정도 남았습니다 병원에서 검사만 하고 다른 설명을 듣지 못해 심각한건지 알 고 싶습니다  경구 피임약  년간 장기복용해왔고 소화불량 우상복부통증 생긴지는 오래 되었구요  년 이상  통증은    시간정도지속 구토증상 가끔있고 한달에 한두번정도 통증이 있습니다 병원에서 배 눌러보고 아프냐고 물어보시는데 아프긴한데 많이 아프지않아서 이게 세게 눌러서 아픈건지 아니먄 진짜 아파서 아픈건 잘 모르겠더라구요   초음파 사진 보시면 수술이 필요해 보이시나요 ,소화기내과
B형간염에 대해서,최근에 헌혈을 하고 검사결과를 보았는데 B형간염에 대해 양성이라고 나왔습니다  예전에는 음성으로 나왔는데 치료법이나 예방법같은게 있나요 ,소화기내과
,,
,,
,,
,,
,,
왼쪽 아랫배 통증,방금 앉아있다가 갑자기 왼쪽 아랫배  옆구리쪽에 통증이 있습니다  골반 살짝 위고 좀 많이 아픕니다  약간 칼로 찌르는 듯한 통증이고 아팠다가 조금 괜찮았다가 반복합니다  성별은 남자고요  통증이 발생한 지는 한  분정도 되었습니다  갑자기 생겼는데 무슨 증상일까요  지금은 아까보다 좀 나아졌습니다  또 글을 쓰고있는 와중에 통증이 사라졌습니다  뭐죠 ,소화기내과
제가 급성 충수염 복강경 수술했는데 또다시 재발할수있나요 ,충수염 복강경 수술했는데 또다시 아프거나 또다시 재발할수있나요  ,소화기내과
맹장염에 대해서,안녕하세요  제가 일주일 좀 전에 위염 판정을 받고 약을 꾸준히 먹었는데도 불구하고 계속 배가 아프더라고요 근데 위치가 오른쪽 아랫배라 맹장쪽인 것 같아 오늘 병원에 갔구요 병원에서는 여기저기 눌러보시더니 맹장 그 꼬리   그 쪽 바로 위에 염증이 있어서 아픈 것 같다고 일단 약을 줄테니 먹고 더 아파지면 그때 검사를 해보자고 하셨는데 맹장 바로 위에 염증이 있는거면 몸이 계속 안 좋은 상태면 맹장까지 그 염증이 내려올 수도 있는건가요 ,소화기내과
