title,content,department
장염 큰 병원에 가 봐야 할까요   ,증상은  일 정도 되었습니다 첫째날 밤에 오한으로 시작되었습니다 갑자기 밖이었다가 집에 오자마자 온몸이 덜덜 떨리게 추웠어요 둘째날 일어나고 나선 물설사를 계속 했어요 구역질도 많이 했지만 구토를 실제 하진 않았고 트림만 했고요 기운도 다 빠지고 배도 고프지 않아서 그냥 밥을 먹지 않다가  동네 내과에서 주사 맞고 약 처방 받아온 후 흰죽을 먹었습니다 그리고 둘째날 새벽에 먹은 것을 다 토했습니다 셋째날에 일어나자마자 토하러 달려갔고  물이라도 먹으면 토했습니다 계속 토하고  물설사 하고 반복이었어요 그래서 이대로면 안 되겠다 싶어 둘째날 간 병원에 가서 주사를 또 맞고 수액도 맞았습니다  전엔 분명 주사 맞으면 확연히 괜찮아졌기에  넷째날인 오늘 괜찮아 졌을 거라 생각했는데   전혀 괜찮지가 않습니다     저 이번주에 수업도 있고 알바  일 더 나가야 하는데    이미 이 증상으로 한 번 빠져서 더 이상 빠지는 것도 민폐라 생각되는데 오늘 알바도 빠져야 할까요     먹은 게 없어서 그런가 이제 더 이상 변이 나오진 않아서 설사를 하는지는 모르겠는데  배가 계속 꾸르륵 거리고요 토는 자꾸만 하고   약도 토하고    어떡하면 좋나요     머리도 계속 어질어질하고 미칠 것 같습니다    살려주세요  ,소화기내과
핼리코박터균 진료거부,제가  개월전쯤 핼리코박터균  차로 약을 처방받았는데요  약을 처방 받고 핼리코박터균이 없는지 확인해야하니 다시 오라 하셨습니다  근데 그때 당시 몸이 괜찮아지길래 안 갔었거든요  근데 지금 위가 다시 아파와서 핼리코박터균 치료랑 확인이 가능한지 물어보니  당시 담당 의사선생님께서 안 계셔서 다른 의사선생님께 진료 받았습니다  의사선생님께서 이미 먹은 것을 어찌냐면서 위장약만 받았습니다  이런 경우는 치료가 불가능한건가요  물론 그 때 안 간 것에 대해 후회하고 반성하고 있습니다  걱정이 많이 되서 글 올려봅니다 ,소화기내과
담낭벽비후 소화기내과 어느 병원을 가면 좋을까요 ,복부초음파검사후 담낭 벽비후라는 진단을 받았는데요   의사쌤께서 큰병원 소화기내과를 방문하라고 합니다      수도권에 소화기내과 큰병원 유명한곳이 어디가 있을까요       큰병원을 찾아가면 바로 치료를 하는건가요   진료 과정이 어떻게 되나요     답변 부탁드립니다 의사쌤들 ,소화기내과
위대장내시경 수면마취 가수면 ,다음주쯤에 위대장내시경 받아볼라하는데요   가수면은 완전 수면이 아닌건가요   그러면 통증을 다 느끼는건가요   완전 수면마취를 하고싶은데 걱정되네요      이 병원은 가수면이라고 돼있는데 하   ,소화기내과
간장질환 ast    alt    감마gtp    ,국가건강검진을  월쯤에 받고 지내다 생각나서 질문드립니다   나이는   살이구요   간수치 ast    alt    감마gtp      정상 범주가 아니라는 것은 잘 압니다  그런데 정말 엄청 심각한 정도인가요   평소 음주를 즐기긴합니다    그리고 당일 검진전에 핀페시아  알 먹고 갔는데 이게 혹시 영향을 줄 수 있나요   혹시 정말 심각해서 바로 재검진 받아봐야하는 거면 어느쪽으로 방문해야하나요  아니면 국가건강검진으로 재검 되나요 ,소화기내과
맹장염초기증상,갑자기 시간전부터 배가찢엊 듯이아파요 배가 전체적으로 조금부풀어올랐어요 오른쪽아랫배가뭔가 찌릿찌릿한느낌이느는데 이거 맹장염인가요   못앉아잇겟어서 누웠는데도 아파요,소화기내과
담적병인가요 ,중학샹인데 요즘 밥먹으면 속안좋고 머리 아프고 어지럽고 토할거 같고 트름 나고 속이 꽉찬 느낌이 드는데 담적병인가요  스트레스도 많이 받은거 같에요 요즘,소화기내과
수면내시경 하다가 죽을 수도 있나요 ,수면내시경은 잠 들게 해서 하잖아요 그때 말도 못할텐데 망약 수면내시경을 하다가 죽을 수도 있나요 죽는다면 그냥 잠든상태로 죽는게 되나요 아니면 숨막혀서 죽는 느낌이 드나요 마지막으로 수면내시경으로 사망하신 분이 있나요 사망한다면 무슨 이유로 사망하는건가요 ,소화기내과
복부ct로 간염여부 알수있나요 ,복부 ct로 간염인지 아닌지 알수 있나요 ,소화기내과
장염 피검사 염증수치,발열 최고   도  설사  울렁거림   속쓰림등 장염 증상이 있습니다   병원에서 피검사를했는데 염증수치가   이랍니다  정상은    라는데  얼마나 가늠이 가는지 잘 모르겠습니다  보통 장염걸리면 이정도 수치가 나오나요 ,소화기내과
대장내시경 약 추천,저는 비위도 약하고 물을 잘 못마셔요 금방 물배가 차서 거북해가지고    ml도 겨우 마셔요 하루에 물도 거의 안마시고 알약은 진짜 못먹어요 진짜 작은 약도 하나씩 따로따로 먹어요 피코라이트 크리콜론 알약  쿨프렙산 뭐가 젤 나을까요 제가 비위가 많이 약해요   ,소화기내과
변비 문제 좀요  ,요즘 들어 대변을 보는데 설사가 나오는데 음식을 잘못먹어서 그런가요    배에서 꼬르륽 소리가 나는데 배가 고픈건 아니에요 ,소화기내과
크론병 질문드립니다 ,아이가 크론병 검사를받았는데 내시경을확인하고 조직검사를하였습니다  조직검사결과는 아직 나오지않았고 교수님께서 크론병이확실하다고하셨는데 조직검사결과에서 크론병이 아닐수도 있는 확률이 있을까요  아이는 복통도없고 설사도 안합니다  혈변은있고여,소화기내과
위경련 질문,제가 담석증 진단을 받고 우루사를 복용하고 있습니다 그런데 원래 없었던 위경련이 생겼습니다  병이 악화된건가요   ,소화기내과
병원 피검사 결과 해석 부탁드려용,몸이 안좋아 병원에서 피검사를 받았어요 전체적으로 별 이상이 없다고 쌤이 말씀하셨는데  그래도 제 몸이니 상세항목이 궁금합니다 해석 부탁드려요 온통 영어 약어라 무슨말인지 모르겠네요    기준치 이상이나 이하가 있다면 또 말씀해주시면 감사하겠습니당,소화기내과
수면 내시경 바늘 재사용 관련입니다,얼마전에 서울에 있는 대형병원에서 건강검진 받았습니다  위 내시경을 수면으로 받았는데 이때 바늘을 손등에 꽂았습니다  수면제 넣을 주사기입니다  근데 바늘을 넣기 전 순간 바늘을 봤는데  바늘 앞쪽이 붉은  색을 띈 느낌이 있었습니다  원래 수면내시경 바늘 색깔이 붉은 빛을띄나요  바늘 재사용 관령하여 감염의 우려로 좀 찝찝하네요  수면 내시경 특성상 바늘을 꽂고 대기실로 가서 대기하다가 내시경실로 들어가는거라 재사용할리가 없을거 같은데  붉은 색 을 보고 좀 찝찝하네요  의사님 간호사님 답변부탁드립니다 ,소화기내과
담석 음식섭취 질문,담석이 담낭 입구를 막고있어서 수술 예정인데 치킨이나 삼겹살 이런 걸 먹으면 복통이 오고 그냥 죽이나 밥과 반찬을 먹으면 전혀 통증 자체가 없습니다 원래 그런가요    수술전까지 뭘먹어야 안아플까요 ,소화기내과
크론병 질문,크론에 걸리면 정상적인 삶이라든지 먹는거라든지 뭔가 삶이 제한적으로 변하나요  아님 약이랑 정기 검진만 받으면 정상적이게 살 수 있나요,소화기내과
과민성대장증후군 질문드립니다,최근에 장염 관련해서 약을 처방받아서 먹고있습니다  증상이  주 가까이 지속되고 있는데요  배꼽 주위로 복통 살짝  설사 조금하고 발열과 구토는 없습니다   첫  주는 진경제만 받다가 최근에 노르믹스 정 항생제를 처방받고 지금  일째 복용중입니다  그래도 별 차도가 없고 설사가 하루    번 조금씩 하는데 의사분께서는 과민성대장증후군 의심하더라구요   작년에 과민성대장증후군 진단을 받기는 했었는데 거의  년 가까이 증상이 없었습니다  의사쌤은 청진기와 배 눌러보시는 검사만 하시던데 혹시 장염과 과민성대장증후군을 구분하는 기준이 있나요 ,소화기내과
대장내시경 용종 제거 후,안녕하세요   살 대학생 여성 인데요 어제 대장내시경과 혈액검사 소변검사 폐엑스레이 검사 심전도 검사 등을 했는데요  대장내시경에서 용종 개가 발견이 되어서 제거한 후에 작은용종 한개를 제거 했다고 해서 첫날에는 단팥죽를 먹고 안에 들어있는 떡은 안먹었습니다   그리고  두번째날에도 점심에는 단팥죽을 먹고 저녁에는 빵과 참치야채죽을 먹었는데 괜찮을까요     아이스크림 베스킨라빈스 은 아직 못먹는걸까요   검사결과는  월  일날 오전 중으로 보기로 했습니다  ,소화기내과
궤양성대장염,약 먹으면서 살도 찌고 했는데 약 그대로 먹고있는게 효과도 잘보고 해서 그런건가요  살이 쪘다고 몸무게에 맞게 약을 더먹어야되거나 그런가요 ,소화기내과
코로나  차 접종다음날 위내시경 검사 괜찬을까요 ,  세 남자입니다  오늘 오후에 화이자  차 접종을 했는데 내일 아침에 위내시경 예약이 되어있어 걱정입니다  위내시경을 해도 될까요 ,소화기내과
장염 증상인가요 ,어제부터 아무것도 안먹으면 아무렇지 않은데 물만 마시면 배가 아프고 설사를 합니다     장염증상인가요  병원에 가야할까요 ,소화기내과
제가  월달부터 스트레스 받는 일이 있어서 밥도 하루에 한끼만 먹고 살도  키로가 확 빠졌었어요 보름전에는 뭘 먹으면 바로 배가 아파서 설사를,제가  월달부터 스트레스 받는 일이 있어서 밥도 하루에 한끼만 먹고 살도  키로가 확 빠졌었어요 보름전에는 뭘 먹으면 바로 배가 아파서 설사를 했었는데 지금은 응가가 안나와요  살면서 변비 걸려본적이 없는데 생각보다 힘드네요   병원을 가봐야 할까요 ,소화기내과
툭하면 체해요,오늘도 밀가루 좀 먹었다고 바로 체해서 지금 죽을거같아요      체하면 너무 아파서 잠도 못자는데   뭔가 방법이 없을까요   소화제는 이미 먹었는데 효과가 없어서요 위로나 조언 부탁드립니다       ,소화기내과
키위먹고 목에 뭐가 걸린 느낌이 나요,키위먹고 목에 걸린 느낌이 나요 기침는 안하는데 나올거 같기도 하고 그래요 내일 되면 없어지나요  잠을 잘 수 있나요  지금 따뜻한 물 많이 먹고 있어요,소화기내과
췌장 낭종,아는 지인분께서 CT 찍어서 췌장에    cm 낭종이 발견되서 의사분 말로는 수술하다가 복막염까지 갈 수 있어서 수술 못하다고 하고 약 먹으면서 지켜보다가  달후에 다시오라고 하셨는데 너무 걱정하시네요   수술도 안된다고 해서요   혹시 다른방법이라도 있을까요   ,소화기내과
  살 위내시경 하는법,저희 친누나가 최근에 유방암진단을받아서 저도 암에대한 불안감이있는데 최근 몇달간 식사이휴 명치쪽이 계속 부글부글 거려서 위암초기증세하고 비슷해서 의심이되는데 불안감에떨빠에 그냥 위내시경받고싶은데 어떻게라나요 그냥 병원가서 하고싶다고 말하면 될까요     살인데 건강검진이 내년이라길래 그냥사비로주고하고싶은데 그냥돈내고 하면될까요  ,소화기내과
혈변 질문  급해요   ,  세이고 아침에 갑자기 혈변이 나왔어요  덩어리 정도인데 그중 하나가 엄지손가락 한마디 정도되고 혈변인것 같았어요  나머지 두개는 멀쩡했고요     변의 한 부분에 피가 섞여있는 것 같았고요  사실 어제 저녁에 배가 아프고 속 쓰린 느낌이 들었는데 무슨 증상일까요  혹시 큰 병은 아니겠죠   ,소화기내과
C형간염치료제,이번에 c형간염  형으로확진받았는데 병원 에서 소발디 리바비린   주 병행치료 한다고 하는데 요즘은 마비렛으로 치료많이 한다고 하는데 어떻게 해야하나요 ,소화기내과
지방간 간수치 봐주세요  ,  대 여자인데요  년 전에 초음파로 지방간 진단 받고 간수치는 정상이었어요 근데 엊그저께 피검사에서 GOT     GPT      감마     나왔다고 전화로 결과 받았는데 지방간이 심해진 건가요     년 동안 술 많이 먹고 몸무게   kg이상 증가했습니다   얼마나 심각한 건가요     간경변이나 간경화 이렇게까지 갔을 확률 있나요   ,소화기내과
혹시 변비가 몇일 지속되면 병원에 가야할까요,변비가  일째긴 하거든요 속도 더부룩하고 병원가는게 답일까요   ,소화기내과
담도암 항암치료중인데 암수치 질문있어요,암수치가     정도로 높이 나오다가 이번 피검사에서는      이상으로 측정불가가 나왔습니다 항암이 안듣는다고 방사선 치료로 해보자고 하시네요 다른수치는 정상인데 암수치만 계속이러네요 암수치가 높다는게 무엇을 의미하는건지 정확히 모르겠고 떨어뜨리는방법이 없을까요 ,소화기내과
췌장염 관련 소화기과 의사 선생님의 조언이 절실합니다 ,의사 선생님의 절실한 조언이 필요하여 이렇게 글을 올립니다    환자     세 여성   지난  월초 아스트카제네카 백신을 맞은후  일째 되던날 저녁 심한 복통을 호소하셔서 응글실에 내원하였습니다  진단결과 급성 췌장염으로 수치가     이 넘어 위험한 상황이라며 수액및 진통제를 맞고 금식하며  주간을 병원에 입원하였습니다  담낭에서 담석이 빠져나오다 걸려서 이러한 증상이 발생된거라 하시며 우선 혈관 확장 시술을 권하여 받게 되었습니다  이후 췌장수치가 어느정도 정상수치까지 근접하여 통원치료로 퇴원하게 되었습니다   불과  달전 종합검진 결과에서도 아무런 이상이 없었고  매년 건강검진을 받아오던 터라 백신 부작용을 의심할수 밖에 없는 상황이였습니다  본론으로 들어가서   췌장염은 어느정도 치료가 되었으나  추가적으로 췌장에  센티 이하의 작은 혹이 하나 발견되었는데 암의 우려가 있으니 큰병원 내원하여 정밀 검사를 받아보길 권하였고  간에도 큰 물혹이 있으니 아마 제거를 해야 될 수도 있으니 같이 검사를 받으라는 것 입니다  또한 담남의 담석이 잘잘하게 아직도 남아 있어 추후 동일한 췌장염이 발생 될 소지가 있으니 담낭제거또한 필요할거라 합니다  의사가 서울의 큰병원을 추천해주며 소견서까지 작성해주어 큰병을 가게 되었습니다   큰 병원의 경우 소화기 내과 외과가 따로 있더군요  내과는 췌장을  외과는 간을 진료하는듯 하였습니다  병원에 내원하여 다시 MRI를 찍고 각각 선생을 만나본 결과   내과 의사 소견   췌장염 수치가 많이 좋아졌으니 약복용하며  개월 뒤 한번 더 확인해보자는 답변입니다  췌장에 혹에 대한 이야기는 없이 면담을 끝내려고 하길래  혹이 암의 우려는 없는지 제가 되물었습니다  헌데 머가 기분이 나빴는지 몰라도 언성이 살짝 올라가며 단순 혹으로 보이니 수술이 필요할것 같지는 않다며  개월뒤에 다시 확인해보자는 겁니다   제 입장에서는   만원이 넘는 MRI를 찍고 집에서 서울까지 왕복  시간 걸려 병원에 왔는데 너무 화가 났지만 치료전이라 감정을 추스리고  번째 외과 의사를 만났습니다  외과 의사 소견   간에 물혹은 단순 물혹으로 보이며 간의 물혹제거는 간 절제술이라 암수술 만큼 큰 수술이라고 하시며  현 환자의 상태는 당장 수술은 필요하지 않을 것 같다고 합니다   개월뒤 한번 더 확인해보자는 의견이였습니다  담낭은 제거 해야 차후 췌장염이 재발되지 않으니 제거수술을 권하였습니다   어머님 연세도 있으셔서 수술보다는  담낭의 경우 혈관 확장 시술도 받으셨고 식습관 개선이나  약물 치료로 관리를 통한 개선방법은 없는지 물어봤더니  이  의사분도 머가 기분 나쁘셨는지 언성을 높이며 멀쩡한데 수술을 하자는게 아니고 담석이 있고 차후 동일 문제가 생길수 있으니 제거 하자는 거라고 합니다   해서  제가 문제가 있으니 제거 하자는 뜻은 이해하겠으나 관리를 통한 방법은 없는건지 여쭈어본거라고 되묻자 췌장염 복통으로 그렇게 아파보시고도 그런 말씀을 하냐고 하네요  결국 담낭 제거 수술 날짜만 잡고 병원 밖을 나오게 되었습니다   현직 의사이시거나  관련 업종에 계신분의 절실한 조언이 필요합니다   현재 담낭에 담석이 잘잘하게 남아 있긴하나 혈관 확장시술을 받았고   달째 식습관및 운동을 통해 소화가 살짝 안되는 부분은 있으나 통증 없이 관리 되고 있습니다   간에 큰 물혹이 있고  췌장에는  센티 이하의 혹이 있으나 암의 문제 소지는 없으니  새월뒤 한번 더 보자고 합니다   이 상황에서 쓸개 제거를 하는게 맞을까요   제가 걱정하는건 유투브나 네이버 글을 보니 담낭과 간에서 음식물을 소화시키는 분비액이 나온다고 알고 있습니다  췌장염도 백신 맞은후 처음으로 발생된 증상이며 기존에도 담석은 있었으나 아무런 문제가 없었습니다  또한 당장은 아니겠지만  차후 간에 물혹을 제거 할 경우    을 도려내야 하는데 그때 소화를 돕는 기관이 담낭의 역할이 중요하다고 보는데  현 시점에서 담낭 제거를 하는게 맞을까요   의사 선생님의 의사를 믿고 따르고 싶지만  개인적으로 느끼기에 너무나 짧은 상담 시간과 질문에 언성만 높이는 무성의한 모습에 판단이 내려지지가 않습니다   의사선생님의 조언이 절실합니다 ,소화기내과
디스크 수술 후 약 지속 복용 후 과민성대장증후군이 심해진듯한데요  좋은 음식 추천 부탁드려요 ,저희 남편이 디스크 수술 후 지속적으로 약을 복용해서 그런건지 지금 기존에 있던 과민성대장증후군이 더 심해진듯합니다   배가 많이 아파서 음식을 잘 못먹어요     수술 후라서 계속 약은 먹어야하는 상태라서 약을 안먹을 수도 없고요     혹시 디스크 수술 후 먹는 약과 같이 먹을 수 있는 과민성대장증후군을 감소 할 수 있는 약이라든지    아니면 좋은 음식이 뭐가 있을까요   며칠동안 흰죽을 먹다가 너무 기운없을꺼 같아서 소고기 야채죽 끊여서 먹게하고 소고기 장조림도 해주고 했는데요     당연히 금방 좋아지지는 않겠지만 좋은 음식 좀 추천 부탁드려요   ,소화기내과
위장 불편함   질문드립니다   내과 ,요새 속이 좀안좋아서   자초지종을 먼저 설명드리겠습니다         주 전 금요일 저녁에 오한  발열  두통 발생과 설사를 했음   구토X      병원안가고 집에서 아세트아미노펜 약을 복용함    아침 낮엔 괜찮았으나  점심 이후 오후    시쯤 컨디션이 매우 안좋아서 집으로 복귀함 이때 미열       도 정도  두통도 다시 생김      월요일에 병원가니 장염인것 같다면서 장염약과 항생제  유산균 등을 처방해줌        일 정도 약을 복용했고  지속적인 미열과 두통은 사라졌으나  오후    시만 되면 명치쪽 답답함과 두통등이 반복됨      병원가니 장염은 아니고 위쪽인것 같다면서 다른약을 처방해줌  위장약       전체적으로 좀 편안해졌으나  점심식시후 오후  시만되면 답답함이 생김   조금씩 호전되고 있고 일주일째 약을 먹고있지만  완전히 사라지는건 아님     이런상태 입니다   위 내시경을 해야할까요   명치 아래부분을 누르면 통증이 있습니다  ,소화기내과
이런경우 대장내시경을 받아봐야 할까요,일단 저는 담석증이 있구요   mm고 수술 안하려고 우루사 들어가있는 무슨 약을 한달씩 처방받아서 먹고 있습니다   달정도 먹고 있습니다    근데 한번씩 위경련처럼 배가 엄청 아프고 나면 짧게는  주일 길게는 한달씩 설사랑 복통이 심하구요 이때는 뭘 먹어도 그냥 다 설사로 나와요  그리고 이렇게 설사가 심하면 살도 많이 빠져요  많이 빠지면 한달에  키로씩 이렇게 빠지긴 하는데 크론병이나 궤양성 대장염은 아니겠죠      글고 만성 치루라고 해야하나요 뭐가 볼록 튀어나온게 있고 이번에는  일째 대변만 누면 설사 피때문에 흥건해져요  이거때문인지 좀 많이 피곤하긴 해요  그리고 더부룩하고 좀 좋은 느낌은 아니에요   그리고 말르지도 않고 비만입니다   ,소화기내과
설사에서 피,어제 배가 너무 아파서 물설사를 엄청 많이  번정도 했는데 보니까 변에서 피같은게 나와요   뭘까요 참고로 병원갔어요,소화기내과
췌장염 증상일까요,어머니시고요 이식환자인데 지금 이식한지 좀 많이 되어서 몸이 좀 안 좋은 상태셨는데  년전에 급성 췌장염으로 입원까지하시고 살이 엄청 빠졌습니다   다행히 당시 치료 받고 퇴원했는데 그 이후에 계속 입맛이 없어  살이 점점 빠졌습니다  회복이 잘 안되더군요    최근에 또 검사하니까 췌장 수치가 좀 뛴다면서 다시 검사할 예정인데 최근엔 살이 여전히 많이 빠지고 회복이 안되는 상태에다가 기력이 많이 떨어진 상태였는데  또 췌장염이 재발한걸까요 ,소화기내과
심장초음파,chest X ray에서도 cardiomegaly ECG상 LVH Echo상 supravalvar AS Peak PG      mean PG   mmHg    살이구요 심장잡음 때문에 심장초음파했는데 해석부탁드려요 심한정도인가요      ,소화기내과
위궤양이 맞는지 궁금합니다 ,   위궤양인가요  조기위암인가요     위내시경 때 조직검사는 안 했는데  다시 내시경받고 조직검사 해야하나요     첫번째 사진에서 제가 표시한 부분은 뭘까요   이 부분은 설명을 못 들었습니다  ,소화기내과
ALT 간수치   ,병원에서 피검사를 했는데 간수치가   이 나왔습니다 나이는   살입니다 관리를 어떻게 해야 수치가 내려갈까요  심각한 수준인가요  신체검사때는 간염 급 이라고 했었습니다,소화기내과
간 수치 금식 질문,간수치가 정상보다 조금 높은데 검사전  일간 금식 금주를 하면 간 수치가 정상으로 내려갈까요 ,소화기내과
역류성식도염인데   ,안녕하세요  엄마가 역류성식도염 후두염이라고하시는데 가슴이답답하고 자꾸 헛기침이 나오는이유를 모르겟어요   식도염때문일까요  약은 먹고잇는데 아니면 심장내과 를 가야되는지모르겠네요 ,소화기내과
간기능 검사에서 b형간염바이러스,간기능 검사를 했는데 다른건 이상이 없는데 글로불린이         수치가 정상인데    이 나왔고 b향간염바이러스 항체는 양성         이라 항체가 있는데 항원도 양성        이 나왔어요 너무 걱정되는데     저 간질환 이런거에 걸린건가요    년전에도  년전에도 간기능 검사상 b형간염바이러스 항체는 양성이고 항원은 음성인데 갑자기 올해 검사하니 저런데   혹시 오류 일수도 있는 걸까요   걱정되서 잠도 안와요,소화기내과
지방간문제 입니다 ,지방간인데 알코올 비알코올성 지방간이 다있고  비장비대가 있다는데 금주하며 체중감량등 하면  지방간과 비장비대는 좋아져서 비장은 원래상태대로  돌아올까요   그리고 지방간있는사람이 L 카르니틴 먹어도 되나요  ,소화기내과
우유를 먹으면 속이 안좋아져요 ,우유를 먹으면 속이 안좋아요  그래서 유당불내증인가해서 락토프리 우유를 먹어봤는데 배에 가스가 차요  영영 우유를 못먹을 운명인가요  우유를 소화 잘되게 먹을 수 있는 방법이 없을까요 ,소화기내과
