,3,4,5
154,코로나 걸렸을까요   ,저희 언니가 걸렸고 증상 보이고 난후에 하루 이틀 정도 같이 보냈는데  물론 접촉 없이    너무너무너무 불안해요    차까지 맞긴 했는데 코로나 바이러스 가 집에 남아있었을수도 있고       저 오늘 pcr검사했는데 내일 결과 나오거든요  언니 코로나 걸리고  일 정도 지났는데 증상 하나도 안보였어요      너무 떨려요  ,가정의학과
155,두드러기   ,등 날개에서 부터 귀밑에 까지 두드러기가 나오는데요     동네병원가서 주사 및 약  알레르기  처방 받아서 먹는데도 나아지질 않네요    이 약을 계속 먹어야 될까요      제생각에는 음식 뭐 그런거 보다 샤워할때 너무너무 뜨거운물로   어깨 목 부위를 샤워기물로 마사지 한뒤로 생기는거 같은데요     화상입은줄 알았어요      그냥 나두면 나을까요   두드러기 부위에서 미열이 좀 나고 가렵네요    전에 두드러기 생긴적이 없어요   ,가정의학과
156,코로나 오미크론,   제 몸에 바이러스가 퍼지기 전이면 양성 안나오나요      꼭 아프기 시작해야 양성 나오는건가요  ,가정의학과
157,간수치가 두배 상승   괜찮나요  ,제가 엊그제 채용검진을 했는데     년도 보다 간수치가 두배나 올랐어요   정상범위긴 한데  속상합니다      년     년 건강검진시 간수치가 상당히 좋았는데   그때 오히려 일도 많이하고 술도 많이먹고 방탕하게 살았습니다      년  월 간수치        이렇게 나왔는데   어제 검사한 채용검진 간수치 보니 두배가 올랐오요    SGOT     SGPT    이렇게 나왔습니다    까지 정상 범위긴 한데   나이가 들수록 정상범위 안에서 지표가 나빠지는거 같아서 걱정이 됩니다        이범위도 괜찮은가요   살찐게 원인일수도 있나요  ,가정의학과
158,  살 여학생인데 키는    cm입니다 키가 중  이 후부터 잘 안크는데 이제 더 이상 키가 안크는 것일까요    생리도 합니다 ,  살 여학생인데 키는    cm입니다 키가 중  이 후부터 잘 안크는데 이제 더 이상 키가 안크는 것일까요    생리도 합니다 ,가정의학과
159,코로나 검사,제가 코로나가 양성이면 증상이  일전부터 있었다고 하고   일전에 만났던 사람도 검사 받아야 하나요  꼭 답변 부탁드립니다 ,가정의학과
160,고열 후 두통, 차 백신을 맞고 부작용으로 고열이 하루종일 났었는데요 PCR검사 결과 음성나와서 부작용이 맞습니다    고열이 나면서 머리가 심하게 아팠을때는 열이 나서 그런가보다 하고 참았습니다    차 백신 맞은지 일주일이 넘었는데 이제 열은 하나도 안나고 다 멀쩡한데 두통이 아직도 있습니다    완전 정상체온인데도 아직도 관자놀이쪽이랑 뒤통수가 아프고 많이 어지럽습니다   살짝 귀가 먹먹한 느낌도 있구요    이것도 백신 부작용인가요  아니면 고열이 난 뒤로 문제가 생긴건가요  ,가정의학과
161,이거 무슨 증상일까요    ,요즘 매일마다 겪는데 왜 이런지 모르겠어요 뭐 때문인진 모르겠는데 힘들고 눈물도 많아지고 아무것도 하기 싫고 항상 혼자 있고 싶고    참고로   살 학생이에요,가정의학과
162,코로나가족격리,가족중 한명이 오늘 오빠가 코로나가확진되었습니다 저도검사를받으러가야되는데   차접종후  일지난  저는 집에 들어간적없었고   차접종까지끝난  남자친구와동거중이었는데 격리를해야하는건가요  음성이라면 남자친구집에서격리를하면안되나요 ,가정의학과
163,기침이 너무 심합니다 도움 부탁드립니다,기침을 시작한지   년 정도 된거 같아요  겨울에 특히 심하구요  기침을 하다보면 구토가 나올때까지 합니다  요즘은 기침을 하다가 가끔 현기증이 나서 넘어지기도 하고  기침을 할때 자주 팔이 저립니다  병원을 가도 별문제는 없다고 하고  종합검진을 받았을 때도 별 말이 없더라구요  무슨증세지 모르겠어서 한번 적어봅니다  도움 좀 부탁드립니다,가정의학과
164,다이어트약처방,다이어트약 처방은 한병원에서 계속처방이가능한가요 아님  인당정해진 처방 개월수가따로 있나요 지금성형외과에서처방받아 먹고있는데 하루에두포 먹으랬는데 한포씩만 먹어도효과가좋아서 이틀한포 삼일에한포 이렇게 조절해서 먹고 있는데 또 처방해달라하면 해줄지 아님 다른병원을 가야 하는지요 처방전받아서 약을 빨리 먹을려는건아니고 조절해서 먹고 있거든요,가정의학과
165,LDL수치,LDL 콜레스테롤 수치가     년   월 건강검진에서 는     로 높게나왔는데  개월뒤 몇일전에 핼액검사를 다시했는데   으로 더높게나오는데  개월만에 이렇게 높게 나올수도 있은지  나름 관리한다고했는데 조언부탁드립니다  ,가정의학과
166,스트레스 받을때,제가 스트레스를 많이 받는편인데 취미도 없고 해소할 방법이 없더라고요   그래서 제가 스트레스 받을때 좋아하는 아이돌 노래 듣는데 이거 말고 막 숨쉬면 괜찮아진다는  이런 방법 알렺세요   그리고 스트레스 푸는방법이랑 잡생각이 안나는 행동  도 알려주세요 ,가정의학과
167,중학교 학년질문,매일 오줌을 눌때 심장이 쿵쾅쿵쾅하는데 정상인가요 ,가정의학과
168,코로나 관련,제가 오늘 아침에 자가키트로 코로나 검사를  번이나 했는데요   음성이 나왔는데 목이 살짝 간지럽고 가래도 끼는것 같은데   양성인가요   ,가정의학과
169,친구가 확진인데 키트로만 검사해도 되나요 ,제목 그대론데 제가 이번주에 정말 자주 만난 친구가 확진이에요   근데 저는 어케해야할까요 그냥 키트로만 검사하고 일상생활 해도 되나요  백신은 다 맞았어요 증상 없고  ,가정의학과
170,목디스크 아닌 사람 목보호대,요즘 전자기기를 많이 써서 그런지 거북목 처럼 되고 목이 뻐근한데 파란색 목 보호대 써도 괜찮은가요  보호대 쓰면 목 아픈게 좋아질까요  ,가정의학과
171,코로나 증상,안녕하세요 오늘 갑자기 두통이 생기고 기침도 조금 하고 목이 따끔해요 몸도 축 쳐진 것 같고 힘이 없어요 근데 제가 다니는 학원에 코로나 확진자가 나왔다고 하셔서 나도 확진 됐나  해서 그 자가용키트 로 해봤더니 음성이 나오긴 했는데 다 정확하지 않다고 해서 너무 걱정 돼요 저 확진 됐을 수도 있나요 ,가정의학과
172,학생인데 겨드랑이가 아파요,한달전부터 두통이 심했고 저번주부터 콧대가 아프고 목이 부은것 같은데 일요일 부터 겨드랑이가 아파요   살여잔데 무슨 증상인가요       ,가정의학과
173,가족 코로나 확진,여동생이 몇 일전 부터 감기 증상이 있었는데 감기 안 떨어지길래 어제 코로나 검진키트 사다가 검사를 했습니다   번 했는데 다  줄 양성 떠서  가족 단체로 오늘 아침일찍 PCR 검사를 하고 왔습니다  여동생 제외하고 모든 가족이 음성 통보 받았는데  출근이나 운동시설 다녀도 괜찮을까요  여동생 포함 모든 가족  차까지 접종 완료했습니다 ,가정의학과
174,,,
175,,,
176,,,
177,,,
178,,,
179,,,
180,,,
181,,,
182,,,
183,,,
