,3,4,5
106,진찰 받으려고 하는데요 ,제가 인후통 기침 가래 콧물 등의 증상이 있어서 A이비인후과에 가서 진찰 받고 약을 지어 왔습니다  그리고 여기에서 코로나 검사를 받았는데 양성 반응이 나왔습니다  바로 보건소 가서 검사받고 확진자 판정 받았습니다       주일 후에도 감기 증상이 계속될 경우  반드시 A 이비인후과로 가서 진료를 받고 약을 받아야 하나요  집 근처에 있는 가까운 가정의학과에 가서 진료 받고 약을 처방 받아도 되나요 ,가정의학과
107,코로나 관련 질문,제 친구가 오늘 확진되었는데 제가 그 친구랑 일요일에 같이 밥을 먹고 놀아서 오늘 자가 진단 키트로 검사를 했는데 두줄이 나왔어요  그런데 두줄중에 t 에 있는 줄이 조금 연해서  시간   분 정도 뒤에 다시 새로운 자가진단 키트로 검사를 했는데 그때는 음성이 나왔어요 내일 보건소 가서 PCR 검사할건데 음성 나올까요 ,가정의학과
108,코로나 확진 질문,안녕하세요 아빠가  일전에 코로나 확진이 되고  아빠는 각방에 혼자 있어서 접촉 X  저랑 엄마랑 동생도 pcr 검사해서 저랑 엄마는 음성 동생은 재검사 떴어요 저는 그냥 잘못찔렀나 보다 싶어서 pcr 검사받은 그다음날에 동생이랑 붙어 있었는데 목이 너무 칼칼한거에요   동생도 마찬가지 였고요   처음에는 목만 칼칼하다가 미열도 나고 동생은 고열이 났어용 그래서 그 다음 날 아침에 동생이 소아과 같은데를 가서 저빼고 엄마랑 동생이 코로나 검사를 했는데 동생이 양성인 거에요  pcr이 아니라 정확하진 않은데 대충 맞음  근데 저와 동생이 증상이 같아요 증상이 머리띵하고 목에 가래낀것 같고 미열나고  약먹으먼     칼칼이정도 이거든요  콧물 이나 후각미각상실은 아니에요   근데 어짜피 저희 가족이 아빠땜에 자가격리를 하고 있어서 그냥 따로 pcr 안받고  요즘에 코로나도 감기라고 하잖아요  이번주는 집에서 자가 치료할려고 했는데  약도타옴  한 한달전에 제가 안구 통증이랑 머리아픔이 고열 심하게 왔을때 청소년 외과에서 노란색 링거 인것같은데 비타민 링거 인것 같아요  그거 한방을 맞았는데 진짜 신기하게 싹 나은거에요   그래서 심해지면 링거를 맞으려 하는데 괜찮을까요   질문    제가 코로나일 가능성    코로나 걸려도 pcr 안하고 집에서 약먹고 치료해도 되나요    너무 아플시 비타민 링거 맞아도 되나요    긴글 읽어 주셔서 감사하고 성의있는 답변 부탁드려요,가정의학과
109,전해질 불균형   인가요,안녕하세요 나이는   대초반 보디빌딩을 좋아하는 청년입니다  운동강도는 일반인은 혀를 내두를정도로 하는데요 하체  가슴운동을 너무 강도있게 하면 운동끝나고   분뒤쯤부터 경련인지   근육이 접힌다고 해야하나  뷰르르으 떨리고 미치겠습니다  쥐는 아닙니다  도대체 어떻게 해결해야할까요 원래 포카리 마시면서 운동할땐 갠찮았는데 노로바이러스 걸린이후엔 포카리도 소용이 없네요 Bcaa 먹으면서 운동할때가 가장 효과가 좋긴 했습니다  지금 bcaa가 없어서 실험을 못하네요     경련이 엄청 일어나긴 하지만 또 자고 일어나면 근육통만 엄청심하고 경련은 귀신같이 사라집니다  제발 도와주세요 하체  가슴운동할때 너무 겁납니다 ,가정의학과
110,유방암 진단 받고 수술전입니다 ,어머님이 유방암 진단받고 대학병원에서 검사진행 중이십니다       수술은  개월 뒤라고 하는데 그동안 비타민 d 챙겨 먹어도 될까요      수술전에 챙겨먹어야 될 음식이라던가 있을까요       잎새버섯 암에 좋다고 해서 물 끓여 먹었는데 수술 전에는 끊어야 될까요   아님 먹어도 되는건가요       수술전에 홍삼 먹어도 될까요   모르는게 너무많아 의사한테 물을수도 없고 질문 전부 아니라도 조금이라도 아시면 답변 부탁드립니다    급해요   ,가정의학과
111,잘 때 다리 밑에 베게 배고자는거 좋나요 ,제가 오래 앉아서 하는 일을 하는데요 다리 밑에 배게배고 자는게 좋다고하더라고요 어느정도 높이의 배게를 배고 자는게 효과가 좋나요  그리고 이 방법이 정말 효과가 있나요  아 그리고 압박스타킹도 같이 신고자는게 좋을까요 ,가정의학과
112,자기진단 키트,병원가서 코로나 검사했는데 양성이면 pcr검사에서 음성 나올 확률은 적은가요 ,가정의학과
113,  대 남성 코로나 백신접종,  년  월   일에 화이자 백신으로  차접종을 완료한   세 남성입니다   접종 익일 새벽에 체온이     도까지 상승하였으나 정상 반응이라 생각되어 타이레놀  정 복용하였으며  이후 체온이     도까지 하락하는 것을 확인하였습니다  그러나 당일 오후부터 체온이 빠르게 재상승  접종 후  일차가 되는 날에는 체온이   도까지 상승하였습니다  약을 복용하고 체온은 재차 하락하였으나 그 이후에도 여전히 약 복용 없이는 체온이   도 근처에서 유지되는 상황이었습니다   일간 지속된 고열이 이상하다고 생각되어 병원을 방문한 결과  코로나   신속항원검사에서 양성 판정을 받아 현재 pcr 검사 실시 후 결과 대기 중입니다          상기한 이상 반응이 통상적인 이상반응의 범위인지     그리고 백신 접종과 짧은 시간적 간격을 두고 실시한 신속항원검사에서 백신 접종만으로 양성 판정이 되는 경우는 없는지 궁금합니다 ,가정의학과
114,코로나 확진자 격리,동거인은 격리 안하는거 알겠는데 그럼 확진자 본인은 격리 몇일 하게되나요  이것도 의무는 아닌가요  하긴 동거인이면 확진자나 다름없는데 격리가 의무가 아니면 확진자 본인도 의무가 아니겠네요 ,가정의학과
115,실내소독기 인체 영향,요즘 들어 실내 소독기 사용하는 일이 많지 않습니까  사무실에서 소독시킨다고 업무중에 자주 사용하고는 하는데  혹시 소독 성분이 다 날아가기 전까지 기다리기에는 업무가 많습니다  그러다 보니 아직 강하게 소독제 냄새가 나는데도  그냥 맡으며 일을 봅니다  혹시 소독제가 폐 등 신체에 미치는 영향을 의학적 사실에 기반해서 설명해주실분 계신가요 ,가정의학과
116,어제부터 열이나고 오한이 있어요,몇일전에 바지락을 먹고 설사를 한번했어요 그이후 열이나고 오한이 드네요 해열진통제를 먹어도 열이 안떨어지는데 왜이런걸까요 열이계속나니까 머리까지 아파요 열나도 병원가면 진료볼수 있나요 ,가정의학과
117,코로나 확진자 가족 질문,혹시 가족중 한명이 확진이 되면 다른 가족들도 전부 pcr검사로 해야하나요  아니면 혹시 신속항원검사로도 가능한가요 ,가정의학과
118,침샘비대증인가요 ,제가 오늘 술을 마시고 구토를 하였는데 그뒤에 한    시간 뒤 잠깐 엎드려서 자고 일어났더니 턱 아래가 아프더라구요 부운것처럼 점점 완화되는거 같기는 한데 혹시 큰 문제 일까요 ,가정의학과
119,코로나 양성,숨 쉴 때마다 이상한 소리가 나는 거예요 이상하기도 했는데 그냥 넘겼어요 그리고 엄마 앞에서 하품하니깐 트림했냐길래 하품이라고 했거든요  근데 왜 이렇게 이상한 소리가 나냐길래 저도 모른다고 했어요 제가 인후통 증상이 있는데 경험이 없어서 인후통 증상 중 하나인 줄 알았어요 근데 아니래요 이거 무슨 증상이고 저 괜찮긴 한가요  참고로 코로나 확진자입니다,가정의학과
120,갑자기 목구멍이 꽉 막히는 것 같은 증상과 울렁거리는 증상이 생깁니다  계속적으로 나타나는 것은 아니고 하루에    번씩 간헐적으로 증상이 나타,갑자기 목구멍이 꽉 막히는 것 같은 증상과 울렁거리는 증상이 생깁니다  계속적으로 나타나는 것은 아니고 하루에    번씩 간헐적으로 증상이 나타납니다  속이 쓰리지는 않으나 가끔 두통이 동반되고 피곤함이 계속됩니다 ,가정의학과
121,긴장되고 사람 만나기 무서워요,고등학교에 곧 입학할 예비고 인데요 옛날부터 낯을 많이 가렸는데 중 후반 되면서 엄청 심해졌어요 버스타는 것도 너무 힘들고 아는 사람 마주칠 것 같거나 사람 많으면 오래 걸려도 버스 안 타고 걸어서 가요 학원에서도 조금이라도 사람 마주치면 너무 불편하고 그래서 옮긴 횟수도 정말 많고 수업을 하고 나면 옷은 땀 범벅이고 종이도 젖어있어요 친구  가족이 아닌 사람과 전화라도 하면 바로 몸에서 열이 얼굴로 훅 올라오면서 땀이나기도 해요 그냥 새로운 사람을 마주치고 밖에만 갔다와도 막 답답하고 힘들어요 어쩌면 좋을까요 해결방법 좀 알려주세요 ,가정의학과
122,명치 멍울  피로감,안녕하세요  한달 전에 우연히 명치 쪽을 눌렀는데 멍울이 만져지더라구요  서있거나 앉아있을 때 만지면 안 느껴지는데 옆으로 돌아서 누웠을 때나 허리를 숙인 상태에서 명치 쪽을 만지면    원 정도 크기의 동글동글하고 말랑거리는 멍울이 만져집니다  멍울을 만지면 아프고 움직이기도 해요   식습관이 안 좋아져서 요즘 운동하면서 관리하고 있는데 제가 빵을 자주 먹거든요    잠도 새벽에 자고 낮잠도 안 자서 그런지 오후만 되면 엄청 피곤합니다  또 역류성 식도염이 있고 음식을 먹으면 명치 쪽이 조금 땡기다가 괜찮아져요  조사해보니까 검상돌기 같은데 혹시 종양일 가능성이 있나요 ,가정의학과
123,코로나 걸린 후 등교,  일에 코로나가 걸려서 자가진단 키트로 진단 했더니  줄이 선명하게 나왔어요  그때부터 지금까지 계속 격리중이고 지금은  일째 되는 날입니다  열은 한번도 없었고 목만 조금 따가웠는데 현재 증상은 아예 없습니다  저는 pcr 검사를 받고 음성이 나와야 학교에 가야되는거 아닌가 했는데 부모님께서 그냥 가라고 하셔서 어떻게 해야될지 잘 모르겠습니다  이대로 학교에 가도 되는건가요 ,가정의학과
124,병원에서 링겔 받는 법,제가 하루에 한 끼만 하는데 그것도 살려고 먹는 거란말이에요 식욕도 없어서 많이 안 먹음 근데 이대로 가다가 진짜로 죽을 거 같아요,가정의학과
125,간접흡연 때문에 미치겠어요,엄마가 집에서 맨날 전자담배를 피는데 그 냄새때문에 미칠거같아요 몇번 말해보기도 했는데 오히려 화를 내요 건강이 안좋아질것같다고 걱정해도 화내요 그리고 제가 그 냄새를 맡으면 목이 아프고 두통 있고 가래랑 기침이 나오는데 이것도 간접흡연의 영향인가요  간접흡연 된 뒤로 목소리도 낮아지고 가래가 많이 껴요 엄마 대신 제가 부작용이 온건가요 진짜 스트레스받아 미칠거같아요 밥먹을때도 뻑뻑 펴대는데 진짜 미칠거같아요 좋게말해도 다 안받아들이고 무시하고 오히려 화내요 도와주세요,가정의학과
126,코로나 질문,저는 코로나 백신  차 부작용으로 두드러기가 났습니다   그런데 요즘 저의 형이 기침을 하고  열도 조금 있는지 모르겠지만  기운이 없는지 기침 좀 많이 해요  요즘에   아까 몇 시간 전엔 열이 조금 있던 것 같던데요   저는  차 접종자인데 혹시 저의 형이 양성이면 저도 자가격리 해야 하나요  학교 수업은 그럼 어떻게 듣나요   못 들으면 이후 내신  시험  미래에 손실이 생길텐데     코로나 왜 있어 가지고     중국 우한  에서 생겼다고 들었는데요   중국 우한의 첫 원인 제공자 빨리 사라졌으면 좋겠네요 ,가정의학과
127,맥박이 빠르고 숨이 차요 ,산소포화도는      로 정상인데 숨이차고 맥박수도 올라요  평소 맥박         사이인데 숨이 차서 산소포화도 측정기 껴보면         넘어가고    대까지도 올라요  산소농도 정상이어도 맥박수 오르면 숨이 차나요 ,가정의학과
128,수족냉증 다리 올리는 스트레칭,수족냉증이 너무 심해서 유튭에 혈액순환 스트레칭 찾아보니 누워서 벽에 대고 다리를 직각으로 뻗는 게 도움이 된다고 하더라고요 근데 수족냉증은 발에 피가 안 가서 일어나는 거 아닌가요  다리를 반대로 하면 더 피가 안 가는 거 아닐까요  어떻게 이 운동이 수족냉증에 도움이 되는 건지 넘 궁금해요,가정의학과
129,두통과 오심이 있습니다 ,동생과 저랑  식후 에 두통과 오심이 심합니다  어떤 병의 증상일까요    공통 증상 및 특징   동생은  일전부터 식후 두통과 오심이 있고 변이 묽습니다  설사는 아닙니다  저는 어제부터 식후 두통과 오심이 있고 변이 묽습니다    복통  발열  근육통 같은 다른 증상은 전혀 없습니다    둘 다 따로 먹는 처방약은 없고 영양제는 비타민D       iu  정도만 먹고 있습니다    둘 다 코로나 바이러스 완치자  완치 후 최소  주 경과   의학적  임상적 근거 혹은 의료진이시면 경험적 근거에 기반하여 답변해주시면 감사드리겠습니다 ,가정의학과
130,대학병원 외과 분야,대학병원에서 신경섬유종 수술을 받으려고 하는데 외과는 처음 입니다  어느 전문분야 교수님한테 진료 예약을 해야 진료를 볼 수 있는지 답변 부탁드립니다 ,가정의학과
131,손톱 옆에 뭔가가 났는데 이거 사마귀 인가요 ,오른손 약지에 이렇게 사마귀 같은게 있어요  사실 고등학교때부터 있었던 것 같네요    년은 넘은 것 같아요  그전까지 크게 불편함을 못 느껴서 그냥 지내고 있었는데  오늘 정상피부와 해당부위의 경계가 갈라지면서 피도 나오 알콜로 손소독을 했더니  알콜이 침투하면서 찌릿 찌릿 할 정도로 아프네요  이게 어떤 질환인가요   치료는 어떻게 해야할까요 ,가정의학과
132,무슨 병 같은 건가요 ,눈 초점이 흐려요 눈에 힘이 없어요 숨 쉬기도 힘들고 크게 쉼호흡 몇 번 해야 조금 나아져요 잠도 제대로 못 자요 맨날 두 세 번 깨고 잠도 잘 안 와요 편두통도 자주 오고 두통은 맨날 있어요 원랜 잘 안 먹었는데 요즘따라 너무 많이 먹어요 배가 이미 부른데도 더 먹고싶어요 그러다가 하루에 두번씩 토해요 요즘 좀 가정사로 힘든 일이 많이 있었는데 그거 때문일까요  죽고싶다는 생각을 깨어있는 내내 하는거 같아요 우울증 뭐 그런건가요 ,가정의학과
133,삶의 이유   다들 왜   사세요  ,힘들고 지치고 아무리 노력해도 즐겁지가 않고 책임져야할 가족도 없고 너무 이유가 없네요 제 삶엔   님들는 도대 체 왜 사사나요 ,가정의학과
134,머리가 아프고 조금 어지럽고 속이 안좋아요,제가 오늘 아침은 거르고 점심만 먹고  시에 학원을 갔거든요  근데 한  시쯤부터 머리가 아파오기 시작하더니 학원이 끝난   시엔 심해졌어요 원인이 무엇이고 어떻게 해결해야 하나요 ,가정의학과
135,아토피가 심한데 듀피젠트   처방받을 수 있나요 ,엉덩이  골반옆부터 허리  등  목 쪽이 전체적으로 심한데  우연찮게 피검사로 간수치가 높다고 해서요  술도 안하는데 높아서  원래 먹던 아토피 약이 문제인거 같다고 해서 약을 다 끊었는데  너무 심해져서 간수치 안높이는 약을 찾다가 듀피젠트를 봤어요  가격이 너무 쎄서 보험이 되는 수치  그런게 있다고 들었는데  혹시 그런쪽 잘 아는 서울에 병원이나  보험되는 범위같은거 잘 설명좀 부탁드릴게요,가정의학과
136,백신 부작용 관련,백신  차까지 맞았는데  백신부작용으로 계속 엄청 무기력하고 피곤한데      이럴 때  아로나민 골드나 우루사 같은 것들이 도움이 될까요    전문 의사나 약사분만 답 부탁드립니다 ,가정의학과
137,목이아파요,어제 코로나에 걸렸는데 오늘 목이아파오면서 침삼킬때 목이 찢어질 것 같고 음식 삼키기도 너무힘들어요 엄마는 코로나 증세라고 하시는데 저는 목젖  코와 입이 만나는 그 부분이 너무 아프더라구요    진짜 지옥같아요,가정의학과
138,이것도 코로나 의심해봐야 하나요 ,제가 오늘 아침부터 기침이 나고 아까  시반쯤  열이     도가 나오는거예요 그러나가 한시간뒤에     으로 내렸고 지금도     인데 그저께 오빠가 친구를 만났는데 그 친구가 확진이 된거에요 근데 오빠는 아무렇지도 않고 저도 그저께 부모님이랑 잠깐 나갔다온게 다거든요    근데 부모님도 멀쩡하신대 코로나 의심해봐야할까요,가정의학과
139,부모님이 대사증후군인데 도와주세요  ,안녕하세요 전 중학생 여아입니다  제목 그대로 엄마가 대사증후군이에요    정확히는 대사증후군 주의군이라고 써져있었는데 엄마는 알려주지도 않고 숨길려했던것 같아요   우연히 오늘 부모님 방에서 대사증후군 주의 단계라고 써져있는 종이를 보게됬는데 위험 요인중에 높은 혈당 높은중성지방혈증  개를 보유하고있다고 하더라고요     개 보유면 대사증후군이러고해서 좀 찾아봤는데 암 사망률을 이어서 대사증후군우로 인한 사망률이  번째로 높다고하더라고요   어제 부모님이랑 말다툼을해서 그런지 죄책감이 더 많이 들어요   어떡해야될까요  대사증후군 주의군의 원인은 무엇인가요  대사증후군 주의군이면 다시 정상으로 돌아올 수는있나요  이럴 때 어떤게 몸에 좋고 어떤게 안 좋나요  어떤걸 많이 먹고 많이 해야되나요  대사증후군 주의군일 대 어떤걸 조심해야할 지 알려주세요  부탁드립니다  ,가정의학과
140,할머니가  차 백신맞고서부터 계속 아프시더니  지금은 의식이 없으십니다  코로나 백신 부작용 보상 지원,안녕하세요  저희 할머니가  차 백신 맞고나서부터 계속 아프셨습니다  성남중앙병원에서 검사를 했었는데  약만 처방해주셨습니다  그래서 가정의원가서 영양제를 맞으면서 버티셨습니다   근데 지금으로부터 약  주전에 할머니가 새벽에 너무 아프다며    를 불러달라고 전화하셨어요  바로는 못가서 오후에 응급실에 갔습니다  성남시의료원 응급실에서 검사를 했는데  그 뒤로 의식이 없으십니다   성남시의료원에서 병실이 없어서 응급실에서  시간을 대기하고  서울삼성병원에 병실 하나가 나왔다고하여  삼성병원으로 갔습니다  또 바로 못들어가도 한참을 대기하여 중환자실에 겨우겨우 입원을 하셨습니다   여러가지 검사 후  균혈증 페혈증 뇌수막염 요로감염 근육농양 의식저하 콩팥기능저하  그리고 오늘은 대장     괴사되어 대장  소관을 제거했다고 합니다  병원에서는 가망이 없다고 하십니다   병원측에서는 원래 건강하셨던 분 같으신데  왜 이렇게 된 건지 모르겠다고 하십니다  계속 이유를 모르겠다고만 하시고  검사란 검사는 다하고   수술이란 수술은 다 하고 있습니다   지금 뇌에 관도 삽입했고요   온몸에 염증이 가득 차있다고 합니다    저희 아빠가 심적으로도   그리고 금전적으로도 너무 힘들어하십니다  약  주간 병원비만  천만원정도 나왔습니다     이게 백신 부작용일까요  아님 원래 아팠던게 백신을 맞고서야 증상들이 나타난걸까요  또  백신 부작용 보상을 받을 수 있을까요    ,가정의학과
141,코로나 걸리면 학교 며칠 못가나요 ,오늘   일 신속항원검사 양성이 나왔습니다  Pcr검사도 하고 내일 결과 기다리는 중인데 만약 pcr양성 판정이나오면 학교를 못가는데 학교출석에 기록이 될까요  그리고 며칠동안 학교를 못가나요  만약  일만에 나으면 검사하고 바로 등교가능한지요   아님 정해진 일수 격리 후에 등교가능한가요  그냥 궁금해서 여쭈어보아요  ,가정의학과
142,중학교 건강검진 대상,중학교 건강검진 몇학년만 하는건가요  저는 올해 중 고요 중 때 학교에서 건강검진을 했었는데  학년때도 해야하나요 ,가정의학과
143,코로나 격리 질문,언니가 코로나 확진이 됐어요 저희 엄마 아빠께선 접종 완료자시고 자가진단키트에서 음성이 나왔으면 수동감시자로 격리 말고 일상 생활 가능한가요      개학일인데 전 등교중지 말고 정상 등교인가요 ,가정의학과
144,유두 주변에 하얀색에 뭔가가 있습니다,  대 여자입니다 어릴때부터 이런게 있었으며 함몰유두예요 아래 사진처럼 나있습니다 만지면 아프지도 않고 짜보지도 않았어요 아직 부모님한텐 말씀을 안드렸어요  양쪽에 모두 나있고 두쪽다 함몰입니다   대충 비슷하게 그렸어요 ,가정의학과
145,겨드랑이 멍울,생리중인데 갑자기 오른쪽 겨드랑이에 멍울이 작게 생기고 건들이면 아파요 왜 이러죠    ,가정의학과
146,지방흡입 고민중인데요,날씨가 따뜻해져서 살빼는데 옆구리살이 안빠지네요 그래서 지방흡입으로 빼보려고 하는데요  지방흡입으로 빼고 싶은 부위만 뺄수 있나요  효과는 있겠죠  아니면 지방분해주사로 해도 효과는 있을까요  답변 좀 부탁드립니다 ,가정의학과
147,피부과 모공축소 시술 알고 싶어요,코로나에 마스크를 쓰고 다녀서 그런지 아님 나이가 들어서 그런지 모공이 늘어졌다고 해야하나 넒어져서 매번 화장 떡칠   트러블까지 생기네요 모공축소 시술 알아보고 있는데 피부과 모공축소시술은 어떻게 하나요  혹시 모공레이저도 있나요  도움 좀 주세요  ,가정의학과
148,피코슈어레이저 기미잡티제거와 모공축소에 효과가 좋나요 ,기미잡티 때문에 진짜 고민이에요  집 주변에서 포토나와 피코레이저를 받았는데 더 진해진 것 같아요  인터넷으로 검색해보니 피코슈어레이저를 추천하더라구요  아무래도 국산 장비에 비해 효과가 좋을 것 같은데  더 짙어진 기미잡티 때문에 고민이네요  그리고 피코슈어레이저가 모공축소에도 효과적이라고 해서요    대가 가까워서 그런지 모공도 늘어져서   혹시 받아보신 분 있으시면 답변부탁드려요 ,가정의학과
149,머리 박았을 때,  대초반이 머리를 쎄게 박았는데 너무 아프시다고 우시면서 일어나지시도 못하고 너무 아프시다고 하세요 어떻게 하죠     계속 누워만 계시고 오른쪽에 옆에쪽을 박았는데 어떡하죠,가정의학과
150,발 동상인가요  ,좀 간지럽구 빨개지구    무슨증상인가요   ,가정의학과
151,코로나 인가요 ,저희 언니가 어제 새벽에 속이 안좋아서 잠을 제대로 못자다가 기침을 계속 하고 열도 나는데 혹시 코로나인가요  콧물도 좀 있는거같고 근육통도 있는거같은데 어떡하죠    학원에서 며칠전에 확진자가 나왔는데 밀폐된 공간이고 접촉을 안했다고 하는데 코로나인가요  남아있는 가족들은 어떡하죠    엄마 아빠 남동생까지 걸리면 난린데   한번 걸리면 몸 망가진다고 했던가 안좋아진다고 들었는데 어떡해요    치사율이 낮은건 아는데 요즘은 걸려도 집에있잖아요 선별진료소 가서 검사한다고는 하는데 빨리 알고싶어요    곧 개학인데 밖에 못나가는건 아니겠죠    ,가정의학과
152,신속 항원 검사,코로나 신속 항원 검사를 해서 검사 해 봤는데 두 줄이 나왔는데 보건소에 전화해야 하나요 ,가정의학과
153,백신 맞고 코로나 양성,어제 백신을 맞고 밤부터 슬슬 팔이 아프더니 자고 일어났더니 오한 근육통 두통이 있었습니다 팔고 계속 아팠구요 사실 한  일전부터는 목이 살짝 기침이 나올락 말락 했고 그렇개 아프진 않고 지금은 약간 칼칼 하고 기침 나올려고 하눈 강도가 좀 세진거 같지만 완전 기침이 나오지는 않아요 혹시 몰라서 자가키트를 해봤는데  줄 나왔습니다 근데 열은 어제 밤부터 재봐도 지금도     도 근처 왔다리 갔다리 해요 열이 이정도 인데도 코로나 양성 일수도 있나요 ,가정의학과
