title,content,department
백신 접종후 이 약들을 복용해도 되나요 ,백신접종 오늘로  일차 입니다   평소 허리랑 무릎이 좀 아파서 처방받은 약이 있는데 복용 해도 될까요   슈퍼셋정 카민산   mg 레코스타정 레일라정 이모튼캡슐  입니다 ,감염내과
B형감염접종 차       목  코로나백신 차 화이자         금  접종했습니다  코로나백신 차 전에 B형감염접종 해도 될까요  B형감염접,B형감염접종 차       목  코로나백신 차 화이자         금  접종했습니다   코로나백신 차 전에 B형감염접종 해도 될까요   B형감염접종 차 예정        금  코로나백신 차 예정        금 ,감염내과
수면 내시경한 날 백신 접종 가능한가요 ,오전   시에 수면 대장 내시경을 하고  오후  시에 백신 접종이 예약되어 있습니다   나이는 만   세 남자입니다   접종해도 문제 없을까요 ,감염내과
대상포진 항바이러스제    일간 복용,안녕하세요 선생님    살 여자입니다  제가 수험생활을 하고 있어서 급격한 스트레스와 면역력 저하로 인해     일엔 임파선이 부어서 임파선염을 진단 받았었습니다  근데 이쯤부터 목 뒤가 간지럽고 아픈 포진이 생겼었는데 별로 증상이 심하지 않아서 그냥 놔두고 살다가     에 화이자 백신  차를 맞았습니다   근데 백신맞은 당일  이게 대상포진인거 같다는 부모님 말씀에 피부과를 급하게 찾아갔는데 대상포진이 맞는거 같다고 이 상태로 화이자를 맞았으니 약을 함부로 쓸 수 없다고 내과 전문의와 상담하라는 말을 들었습니다   그래서 다음 날      에 백신을 맞은 내과에 찾아가서 피검사를 했는데 대상포진이 맞다고 하시면서 항바이러스제랑 화이자는 상관없다고 항바이러스제를 처방해 주셨습니다  처방받은 사진 첨부하겠습니다   그 날부터 항바이러스제를 어제    까지 먹고 오늘 내과에 다시 내원했는데 갑자기 예방접종 후유증으로 설사하는 사람 많다고 요즘 설사하냐고 물어보시더니 위장약을 처방해주셨습니다   장이 원래 약하긴 하지만 약 먹을 정도는 아닙니다    항바이러스제는 처방을 안 해주시길래 여쭤보니까 항바이러스제는  일만 먹으면 되고 그 이후론 다른 약으로 치료를 한다고 하시더라고요  그러면서 제가 장이랑 대상포진이랑 무슨 상관인지를 여쭤봐도 그냥 그 약을 먹어야 한다고    흉지는거랑 관련이 있다고 그냥 먹으라고 계속 그러셔서 일단 약 받아서 왔습니다   근데 아무리 찾아봐도 장약이랑 대상포진은 아무 관계가 없는거 같아서요    대상포진은 원래 증상이 별로 심하지 않았어서 약 먹은 이후부터 별로 아프지 않고 살짝 가렵기만 하다가 계속 완화되서 지금 딱지 거의 떨어지고 색소침착 있는 정도입니다   여기서 제가 질문하고 싶은것은      화이자 백신과 항바이러스제는 정말 상관이 없나요      대상포진 완치 기준이 뭘까요  현재 증상 없으면 더이상 병원 안 가도 될까요      저 내과에서 처방해준 약  사진 첨부하겠습니다  들이 정말 대상포진 치료와도 관련이 있나요   긴 글 읽어주셔서 정말 감사드립니다    첫번째 사진       부터    까지 복용하던 약  두번째 사진       오늘 처방받은 위장약들 ,감염내과
화이자  차접종후 음주,어제  월 일 에 화이자  차 백신접종을 했습니다   근데 오늘  월 일 중요한 술약속이 있는데 취소하기 힘든 약속인지라 음주를 할꺼같습니다   많이는 아니고 맥주   캔 생각하고 있는데 문제있을까요   급한 질문이라 정확한 답변 부탁드릴께용     주위에서는 뭐 당일도 아니고 하루지난 상태면    캔은 문제없다고 하는데 괜히 찝찝하고 불안해서 질문올려봅니당          ,감염내과
말라리아 클로로퀸 프리마퀸,군복무중 클로로퀸 한 알을 먹고 전역전 휴가를 나가게 되었는데 프로마퀸 안먹어도 되나요   제가 사는 지역에는 판매하는 곳이 없어요,감염내과
파상풍 여부,어제 공에 바람넣는 기계로 바람넣다가 실수로 손잡이부분과 펌프관 사이에 다리가 찡겨서 이런 멍이 생겼는데 이거 파상풍인가요  증상은 없습니다,감염내과
hiv 약 복용하고 있는데요 코로나 백신 어떤걸로 맞아야할까요 ,hiv 이고 약 복용하고 있는데 코로나 백신이랑 상관없다고 맞아도 된다고 알고있습니다  코로나 백신 화이자 나 모더나 아무거나 맞아도 상관없는건가요 ,감염내과
대상포진,옆구리에 물집이 생겼는데 통증은 없어요 대상포진 인가요 ,감염내과
방광염같은데 내일 코로나 백신 맞아도될까요,  대이고 왠지 방광염 의심되는데 당장 내일 모더나  차 맞으러가요  차정도는 별탈없다해서 일단 맞고오고나서 며칠 지나면 병원 갓다올까 생각중인데 괜찮을까요 ,감염내과
대상포진일까요   다리 곳곳에 붉은 반점이 있고 물집이 잡힌곳도 있습니다    일주일전 아스트라제네카 백신을  차접종후  일동안 고열이 났었는데,대상포진일까요   다리 곳곳에 붉은 반점이 있고 물집이 잡힌곳도 있습니다    일주일전 아스트라제네카 백신을  차접종후  일동안 고열이 났었는데    그게 원인일수 있을까요 ,감염내과
자가면역질환 질문이요,대학병원에서 피검사를 했는데 감염  자가면역쪽이 매우 높게나왔더라구요  의사샘은 혹시 류마티스 집안내력이 있냐 물으셨는데  친가쪽 할아버지가 있으시대요   제가 만성건선  아토피가 있고  사마귀가 자주 재발하는데  꼭 류마티스 때문이 아니라 이런것들 때문에 자가면역수치가 높게 나올 수 있나요 ,감염내과
대상포진 인가요 ,저번주 목 금 요일인가허리쪽이 너무아파서 얼핏보니시커멓길래 어디 부디친줄 알았거든요 근데 계속아파서 보니 울퉁불퉁하길래 대상포진인가하고 놀래서 피부과내원했어요 병원에서는 퍼지는 증상이있음 대상포진이라고 지켜봐야한다고하고 등치료하고 먹는약 하루분 해주더라구요 걱정이되서 여기 질문해봐요 오른쪽 등아래부분과 배쪽입니다 배는 오늘생겼어요  대상포진  피부과 피부염,감염내과
파상풍 주사 기간,안녕하세요      년  월경에 파상풍 주사를 맞은걸 잊어버리고 최근에 또 맞았는데 괜찮은지 하여 질문 올립니다    년 간격이여야하는걸로 아는데  년반만에 또 맞아서 괜찮을까요   감사합니다 ,감염내과
코로나 백신 접종 부위가 딱딱해요,모더나 코로나 백신을 접종하고 이틀이 지났는데 접종부위가 빨갛고 만지면 딱딱하고 눌리면 아파요    뭐때문에 그런건가요   ,감염내과
코로나 백신 접종 관련 질문이요 ,화이자 백신으로  차 접종한지  일째인데 알레르기비염이 환절기마다 있어서 발생했는데 코로나백신  일째인데 알레르기약 복용해도 되나요 ,감염내과
항히스타민 백신,혹시 백신 접종 후 항히스타민제를 복용할 경우 항체 형성에 막대한 영향을 끼치나요   아예 항체가 생기지 않게 되나요  ,감염내과
ct 촬영 조영제 부작용  iomeron  아나필락시스 증상 겪은 사람입니다  코로나 백신 맞아도 될까요 ,제목 그대로 입니다 약  년전 조영제 부작용으로 죽을뻔하고 너무 겁나네요 약물명칭은 iomeron  입니다  코로나 백신 맞아도 될까요 ,감염내과
 차 백신맞은 후 가슴통증,걍 으악할정도로 아픈건 아닌데 하루 한두번   미약하게 아팠다가 사라져요 병원갈 정도는 아니져 ,감염내과
코로나 백신 예약 변경 문의,생일이    일 인데요 예약을 해놨는데 변경 하고싶어서요   변경  월    일에할수있나녀    ,감염내과
맘모툼 어제 시술 사랑니뽑고  차 모더나 내공    ,안녕하세요  어제 맘모튬 시술하고 이번주에 매복사랑니 발치 수술이 있는데요  지금 컨디션이 많이 좋지않은 상태에요  구내염 목감기  다음주에 모더나  차 예약이 되어있는데  사랑니 발치를 미루는게 나을까여   항생제 복용이 영향을 미칠까요 ,감염내과
항체검사 결과 좀 알려주세요,A형간염  풍진 홍역 볼거리 수두 항체 다 있는건가요 ,감염내과
오전 수면내시경 오후에 코로나  차 백신 맞아도 될지요 ,안녕하세요  저는   월에 같은날 오전   시  분에 수면 내시경  오후  시에 화이자  차 백신이 잡혔네요  일정 조절이 안되는데 진행해도 될지해서 문의드립니다 ,감염내과
오늘  차백신 화이자  접종하고 왔는데 비타민c 영양제와 산화마그네슘 복용해도 될까요 ,백신맞고 종근당 비타민c     mg 이랑 산화마그네슘 복용해도 문제 없나요 ,감염내과
화이자 백신  차 접종후에 일주일간 운동 안하려하는데  차 접종후에도 일주일정도는 운동안하는게 이로운가요 , 차접종 후에도 지속적인 관리가 필요한가요 ,감염내과
베스티딘정   ppi계통인가요 ,속이 아파서 위산분비억제제 먹고있는데 ppi계통인가요  코로나 감염시 위산분비억제제가 안 좋다고해서요,감염내과
안녕하세요     코로나 확진자인데요,    확진 되었구 십일 격리하다 풀렸엇는데용     일간 많이 아팠구 그 이후로 괜찮다가 퇴소날 기침좀 많이나구 그랬었습니다      백신접종예약 되어 있는데  확진자도 맞아도 되나요  어떤글 보면 맞으면 안된다그러구 보건소에 물어보니 상관없다그러고   그래서요 기준이 있는건가영,감염내과
손목에 포진 같은거 올라왔어요   ,이게 도대체 뭘까요     일단 터트리면 안된다고 해서 안터트리고 있는데        ,감염내과
몸에 수포가 생기고있어요,배와 등쪽에 여드름이아닌 수포같은것이 올라오고있습니다  지난밤에는 얼굴과 목이 붓는증상을 시작으로 고열과 호흡곤란이와서 응급실에서 수액을맞았고  오늘은          도의 미열 이 지속되고있습니다       일전 아스트라제네카  차백신을 접종받았습니다   아직 검사중으로 통증과 열의 원인을 명확히 찾지못했는데  수포는 무엇때문일까요   ,감염내과
B형간염 보균자에게 A형  C형 간염 백신 ,안녕하세요  선생님   현재 B형 간염 보균자  비활동성 입니다  오늘 병원에 간검사를 하러 방문하였는데  의사 선생님께서 A형  C형 항체가 없으면 예방접종 스케줄을 잡도록 하자고 말씀해주셨는데   B형 간염 보균자에게 A형  C형 간염 백신은 필수라고 보면 되나요    B형 간염 비보균자들에 비해서 보균자들은 다른 간염도 걸릴 확률이 높아서 A형  C형 간염 백신도 미리 맞아놓는게 좋은건가요 ,감염내과
폐렴구균 예방접종  프로디악스   ,제가     년  월   일에 프리베나  을 접종했는데요     년  개월 이상 지난 지금 프로디악스  을 접종해도 괜찮을까요    대 후반의 건장한 청년 남성입니다 ,감염내과
b형간염 사후피임약 복용,b형간염과 mmr을 접종해야 하는데 사후피임약을 당일에 복용해도 지장이 없을까요 ,감염내과
구강 내 포진,약간 혐짤일 수 있지만    너무 걱정되어 사진 첨부합니다      다름이 아니라 구강 성교 직후 목    연구개 쪽이 불편하여 입 속을 봐보니 흰색    x   cm  가량의 흰색 포진이 세개 정도 자리잡고 있었습니다   너무 당황스러운 마음에 바로 손톱으로 긁  보니 통증 없이 뜯어졌고 하루가 지나 입 속을 봐보니 사진과 같은 상태입니다   플래쉬 터트리고 찍은 사진입니다  왼쪽 상단 유난히 빨간 부분이 포진 세개 뜯은 자리이고 연구개 부분이 오돌토돌하고 사진상으로 확인해보니 빨간 점 이 응집되어있네요       혹시 HPV에 감염된 것일까요  진료는 산부인과를 가야되는건지 감염내과를 가야되는 건지 궁금합니다    ,감염내과
대상포진인가요 ,아버지 등에 갑자기 이런 게 올라왔는데 대상포진 맞나요 ,감염내과
포진  점  대상포진 증상 ,이거 점인가요   포진인가요   만져도 느낌 없습니다  지난 번에도 생겼다 없어진 것 같은데  ,감염내과
백신 무조건 맞아야 할까요 ,제가   년생이고 나이로보면 고 인데 저는 학교를 안 다니는 상황입니다  근데 제가 걱정도 되고 현재 건강도 좋지않아서 백신을 맞지 않으려고하는데 내년에 대학에 입학했을때 무조건 맞아야하는 상황이 생길까요    나라에서는 의무로 정하지 않아도 대학에서 맞으라고하는 분위기이면 어떻게 해야할지 걱정입니다    우리나라에서 저만 안 맞는건 아니겠지만   대부분이 맞으니까 뭔가 제가 이상한 사람이 되는 것 같고 그러네요 ,감염내과
B형 간염 검사,아빠가 b형간염 보균자에요 저는 아니구요 지금   살이고 주사를 언제 맞았는지 기억이 안 나요 아마 중 때인가 중 때 맞았던거 같은데 제가 오늘 아빠가 먹다남은 치킨을 먹은거 같아요 몰랐구요 혹시 감염이 되나요  검사를 해봐야할까요   검사 시기는 언제쯤이 적당할까요 ,감염내과
B형 간염 보균자인데 먹으면 안 되는 약 있나요 ,B형 간염 보균자 만   세 여자 입니다  분당서울대 병원에서 정기적으로 관찰중인데 두 달 쯤 전에 의사선생님께서 살이 점점 찌고있다고  이러면 간 수치가 올라간게 살이쪄서인지 진짜 높아진거인지 알기 힘들다고 살을 빼라고 하셔서 식이요법과 함께 주  회씩은 땀흘려서 운동도 하는데 살이 절대 안 빠져요  이런 상황에서 디에타민 식욕 억제제 을 먹는 건 간에 안좋을까요  만   세부터는 디에타민을 처방받을 수 있다고 해서 물어봅니다 참고로    cm      kg 이에요,감염내과
대상포진 예방약 접종,코로나예방 접종  차  월  일   차를  월  일 완료헀습니다   월  일  대상포진 예방접종 을 하려하는데 괜찬을까요 ,감염내과
항체검사 결과 질문합니다 mmr a형간염 b형간염 수두,항체검사 결과가 이렇게 나왔는데  mmr a형간염 b형간염 수두  중 어떤 것을 추가 예방 접종 받아야 하나요 ,감염내과
B형 간염 예방 접종,B형 간염 주사 맞기로 했는데 예약 시간이 지나서 못 갔어요 꼭 예약 한 곳에서 맞아야 하는 건가요  다른 곳애서도 맞을 수 있는 건가요 ,감염내과
B형 간염  차 접종,오늘  차 접종일인데 일 때문에 못 맞을 거 같아서요    혹시 얼마 내로 맞아야 하나요 ,감염내과
대상포진인가요  땀띠같은건가요   ,대상포진이 잘 생기는 자리였었는데 지금 너무 더운 날씨라 땀띠인지 헷갈리네요  생긴 자리 주변이 조금 뻐근하고 그럽니다 대상포진인가요  ,감염내과
화이자 부작용 림프절 비대,수요일   일 에 화이자를 맞고 첫 날 약간 열감이 있더니 둘쨋날엔        도까지 왔다갔다 하고 점심쯤에 갑자기 주사 맞은 팔 겨드랑이 림프절이 부었는데요   가만히 있어도 통증이 있는데 어느 병원을 가야되나요    ,감염내과
화이자 백신 맞고 건강검진 해도 되나요 ,어제 화이자  차 맞았구요 내일 건강검진이 예정되어있습니다 시력청력 피검사 엑스레이 자궁경부암 등 기본적인 건강검진인데 백신 맞고 해도 되는 건가요 ,감염내과
b형간염접종 맞고 코로나백신 접종 간격, 주 후에 맞으라고 하던데 제가  월  일 목  B형간염접종  차 주사를 맞았어요 그럼 맞은 당일 날을  일 계산해서   월   일 목 부터 코로나 접종을 맞을 수 있는건가요   아님  월   일 금 요일부터 맞을 수 있는건가요    아님 의사선생님 예진에 따라   일이나   일 둘 중 맞을 수 있는건가요      에 전화해보니 정확히 날짜가 정해진 것이 없다고 해서요,감염내과
백신 접종 후 pcr,코로나 음성일 경우에 백신 접종 후 pcr 검사 받아도 음성나오나요  검사에 영향을 미치진 않나요  ,감염내과
지방흡입 후 백신,제가 팔과 복부에 지방흡입을 하였는데요 정확히  주 뒤에 백신 예약이 되어있거든요   이거 맞아도 되는건가요  백신 취소하고 다시 잡는게 나을까요  또 취소한다면 다시 백신 예약은 어떻게 하는건지 궁금합니다  ,감염내과
이거 대상포진인가요    내공    광고성 답변 안받음 ,한  일 전부터 이래요   가렵진 않았고 통증도 아예 없었는데 지금은 간지러워요     막 긁어버리고싶은데 흉질까봐 주변만 긁었어요 엉덩이 위쪽에도 이렇게 포진이 몇개 나있거든요   대상포진 걸렸던 적이 살면서 한 번도 없었는데 갑자기 이래요  대상포진 맞나요  요즘 스트레스를 좀 받긴 했는데 그것 때문인지  아니면 비타민 D나 바이텍스 같은 영양제를 매일 먹어도 이런 반응이 나올수 있나요 ,감염내과
백신 종류,백신 예약 했는데 첫번째 사진에서는 화이자로 되있고요  두번째는 모더나 아니면 화이자 인데 무슨 백신으로 맞나요    내공    겁니다,감염내과
  대 여자 B형 간염  차 접종 관련 문의,  대 여자입니다  제 코로나 백신  차 접종 시기와 B형 간염  차 접종 시기가   월 말로 비슷한데 코로나 예방 접종은 타 백신과  주 정도 간격을 두라는 말을 들었습니다  그래서   월 말에 코로나  차 접종을 하고  B형 간염  차 접종을 원래 접종 시기에서  주 미뤄서 접종을 해도 상관없나요   주 미뤄서 접종해도 B형 간염 항체가 생기나요 ,감염내과
  년생 B형 간염 예방접종 해야 할까요 ,안녕하세요    년생 성인 남성입니다   최근에 코로나 예방접종 후에 예방접종 내역을 확인했는데  보건복지부 자료에는 홍역 풍진     년 이외에 어렸을때 맞았던 예방 주사 내역이 조회 되지 않네요   작년과 올해에 A형 간염  파상풍 접종을 했었는데    혹시 성인의 B형 간염 예방접종도 권장 되는걸까요  과거에 학교나 신생아때 접종 하지 않았을까 하는데 확신이 없어서요 ,감염내과
간염 차 접종후 백신 접종 가능한가요 ,안녕하세요  만  세 딸이       B형간염  차 접종을 하였습니다 금일     일 백신 예약을 하는데 접종일     해도 될까요   병원 간호사님은    차 접종 후 이상 없었으니 괜찮다고는 하셨습니다   전문의료원님 답변 좀 부탁드립니다 ,감염내과
담즙 정체성 질환이 의심됩니다  담도 폐쇄  원발성 담즙성 담관염 같은 자가면역 질환을 검사하는 과정이 궁금합니다  혈액검사  초음파 검사 검사,담즙 정체성 질환이 의심됩니다  담도 폐쇄  원발성 담즙성 담관염 같은 자가면역 질환을 검사하는 과정이 궁금합니다  혈액검사  초음파 검사 검사 과정을 알려주세요 부탁드립니다 ,감염내과
코로나 백신 접종 화이자 대상자인데 질문드립니다 ,안녕하세요   작년에 독감주사 맞고  일간 몸이 아팠습니다   주사맞고 다음날은 열이 하루종일 났고  다음날은 머리가 깨질듯이 아파서 개보린  개먹고 조금 괜찮아졌습니다  그러고 몇일조금씩 아팠다가 괜찮아졌습니다   이번에 코로나 백신 접종을 해야하는데 조금 걱정이 듭니다   맞아도 될지 아니면 그냥 안맞아도 되는지 답변 부탁드립니다  ,감염내과
백신 접종 후 타이레놀  알,어제 화이자  차 접종 받았고  차 때는 팔만 아프고 멀쩡했는데  차 맞고 열이 많이 나서 아침에 타이레놀 하나 먹었는데요 그래도 열이 안 내려가네요  한 알 더 먹어도 되나요 ,감염내과
화상 감염에대해,안녕하세요  화상을 토요일에 입었는데 계속 치유밴드 붙이고 있었어요 그런데 월요일 아이가 밴드 위를 밟아 물집이 터진거 같더라고요   짓물만 나오는줄알았는데 오늘보니 색도 진해지고    코로나 주사를 맞아서 염증약을 먹을수 없는데 지금 보니 상처가 너무 심해진듯해 혹시 감염이되었는지 알고싶어서요 ,감염내과
화상치료 감염,안녕하세요  화상을 토요일에 입었는데 계속 치유밴드 붙이고 있었어요 그런데 월요일 아이가 밴드 위를 밟아 물집이 터진거 같더라고요   코로나 주사를 맞아서 염증약을 먹을수 없는데 지금 보니 상처가 너무 심해진듯해 혹시 감염이되었는지 알고싶어서요 ,감염내과
전이암환자도 코로나  차 백신 접종을 해야 합니까 ,최근에 전이암이 발생되어 조직 검사를 기다리는  환자도 코로나  차 백신 접종  월 하순에 예약 을 해야 합니까   현재 유방암 치료가 거의 끝나는 시점에서 폐전이가 발생되어  정밀 검사를 받아야 한다고 합니다   코로나 백신 AZ   차  접종을 해야 하는 지 궁금합니다 혹시나  이상이 발생될 우려는 없을까요     차는  월 일날 접종을 했습니다   전문가님들 의견을 부탁드립니다  ,감염내과
손이 부어요   포진이나 수포 같은 것도 생겼어여 ,왼손 손가락이 붓다가 불편했는데 이제는 손 전체   가 부은 느낌입니다 팽팽하니 주먹 쥐고 할때 다 느껴지고   오늘은 사진처럼 수포  포진   생겼어요     왜이럴까요    혹시 어디 병원을 가야할까요 ,감염내과
b형간염 예방접종,코로나 백신을 다음주에 접종하는데 b형간염 예방접종을 받아야합니다  두개를 같은 기간에 맞아도 되나요    b형간염 예방접종은 어떤 병원이든 다 맞을 수 있나요    ,감염내과
대상포진 질문드립니다 ,며칠전에 발등이 간지러워서  긁었더니 오돌도돌   올라왔고 조금뒤 물집처럼  더 심하게 올라오더니 안긁고 그냥 방치하니    일 후 이렇게 됬습니다  혹시  대상포진인가요  대상포진 예방주사는  년전쯤 맞았습니다   ,감염내과
백신 맞아도 될까요  , 월   일에 수두  차랑 Tdap 접종 했는데 오늘이 딱  주되는 날이거든요 잔여백신 신청하려고 하는데 오늘 백신 맞아도 될까요  ,감염내과
A형 간염  차 접종만 하고  년  개월이 지났는데  ,다시  차부터 접종해야하나요   저는 다 맞은 줄 알고 살았는데  건강검진할때 항체가 없다고 해서 예방접종증명서를 확인해보니  차만 맞았더라구요      ,감염내과
수두예방접종,코로나백신주사를  월  일에 맞는데 그때 수두랑 같이 맞아도 되나요  보통 몇주 텀을 갖고 맞나요 ,감염내과
예방접종 후 코로나백신,오늘 코로나 백신 예약을 해야 하는   대 여성입니다 제가  월   일에 수두랑 mmr  차 예방접종을 맞았어요  월   일 쯤  차 예방접종을 맞으려고 하는데 그럼 코로나 백신은 언제부터 맞을 수 있나요 ,감염내과
백신 접종 신청하는거 백신 종류도 신청가능한가요,백신 접종 신청하는거 백신 종류도 신청가능한가요 모더나 맞고싶은데,감염내과
개봉한 화이자 냉장 보관기간,화이자 개봉한 뒤 냉장고에 두면 몇 시간이나 보관이 가능한가요  잔여백신의 경우 그럼 개봉 후 몇 시간싸지 안전한가요 ,감염내과
코로나 예방 접종 부위 가려움,오늘 코로나  차 예방 접종 맞은 부위가 가려운데 어떻게 해야하나여  얼음 찜질 하면 되나여  얼음 찜질 할 때 팔에 수건을 대고 그 위에 얼음을 올려야 하나여 ,감염내과
파상풍주사 염증주사 맞고 화이자 주사 맞아도 되나요  ,제가 어제 다쳐서 파상풍이랑 항생제인가 염증주사 맞았는데   일날 화이자 맞는데 맞아두 되나요  ,감염내과
수박알레르기 백신,수박을 먹으면 입술주위가 가렵고 목에 무슨 느낌이 납니다  항상 그런건 아닌데 종종 그럽니다  비염도 있고 어릴때 천식도 약간 있었는데 백신을 맞아도 될까요 ,감염내과
파상풍인가요 ,녹슨 나사를 밣았는데 상처는 안난거 같은데 그냥 있어도 되나요 ,감염내과
코로나   치료제 접종의 질문입니다 ,렘데시비르와 렉키로나주는 어디에서 접종하나요 ,감염내과
