title,content,department
성인 MMR  차 접종 후 항체,제가   월  일에 MMR  차를 맞을건데 몇주가 지나야 항체가 생길까요     월  일까지 실습관련해서 예방접종을 다 해야하는데 만약에  차 맞고 항체가 생기면  차 안 맞아도 되나요 ,감염내과
에방접종 간격 궁금해요,  일 mmr 수두 예방접종 했는데   일 인플루엔자 tdap 접종해도 될까요 ,감염내과
A B형 간염 예방접종 간격,A형 간염을  월   일 B형  차는  월   일   차는  월   일 이렇게 맞았는데 A형 간염  차랑 B형 간염  차 지금 맞아도 안늦었나요    맞는다고 해도 다음 주에 맞을 수 있는데 지금 맞아도 괜찮을까요     ,감염내과
안녕하세요 헤르페스 관련 문의드려요 ,선생님 안녕하세요  지식인에서 선생님의 성실하고 해박하신 답변을 보고 이렇게 문의 드립니다  바쁘신 중에 죄송하지만  괜찮으시다면 답변 부탁드리겠습니다   저는 헤르페스  형 감염자구요  면역력 안 좋을 때 성기 주변으로 올라옵니다  이제는 올라오는 통증이나 약간의 기미만 있어도 수포 올라오는 것을 판단할 수 있습니다   바이러스가 주변으로 번진다고 하는데    제가 느껴지기엔 바이러스균의 총 양은 같은데 이리저리 이사다니며 올라온다고 생각이 됩니다  증식을 하는 지는 모르겠지만  형태나 수포의 양이나 대부분 비슷하게 올라오기 때문입니다   한 번은 수포가 심하게 올라왔을 때 솜을 사용하여 터뜨려 물집을 제거하고 약을 바른 적이 있습니다  우연일 지 모르지만  이후 헤르페스 올라오는 횟수가 상당히 줄었습니다  물집에 헤르페스 바이러스 균이 상당히 포함되어 있을 것이기 때문에 솜으로 터뜨리고 물집을 제거하면 바이러스 균의 총 양이 줄어드는 것이 아닐까요  완전히 없앨 수는 없어도 이런 식으로 바이러스균의 양을 줄여나갈 수 있는 것이 아닌지 궁금합니다   병원 내원하여 물어보면  의사 선생님들이 터뜨리면 전염된다   차 감염 우려가 있다고 하시는데    사실 바이러스에 기질에 대해 잘 모르시고 말씀하시는 것 같은 느낌을 받습니다  주변에 전염된다고 하는데  어차피 성기 주변 여기 저기서 올라오는 걸 보면  체내에서 바이러스 균이 이동하거나 전이를 시키는 것 같은데 물집이 터져서 주변 부에 묻는 것이나 체내에서 이동하나 동일하지 않겠습니까   즉  증식만 아니라면 터뜨려서 환부 관리 잘 하고 바이러스균 양을 줄이면  점차 증상을 완화시킬 수 있는 것이 아닌가 생각됩니다   바쁘신 중에 장문의 질문 드려 죄송합니다      항상 건승하시고 승승장구 하시길 바라겠습니다  ,감염내과
홍역 항체검사 결과 질문입니다,항체검사를 했는데 홍역 결과치가      이 나왔어요 참고치와 비교하면 너무 높은 결과치인데 이렇게 나올수가 있나요    다른 항체들은 참고치랑 비슷한 수치였거든요 홍역만 저래서요  ,감염내과
코로나 백신  차 인정결석,코로나 백신으로 학교 빠지는게 백신 맞는 당일 포함  일인가요 아님 백신맞고 다음날까지맘 가능인가요  만약에 백신맞고 계속 아프면  일도 쉴수있는데 인정 결석 아니고 질병결석으로 생기부에 찍히나요  찾아봤는데  틀이다  일이다 말이 다 달라서 확실하게 뭔지 알려주세요,감염내과
수두 홍역 볼거리 풍진 예방접종 어떤거 맞아야하는지 알려주세요,검사 결과지인데 뭘 맞아야 하는지 모르겠습니다,감염내과
예방접종 질문,   A형간염  B형간염  MMR주사를 하루에 다 맞아도 되나요      항체 검사 결과 홍역  볼거리 항체가 없고 풍진은 항체가 있는데 mmr맞아도 되나요 ,감염내과
비형간염 변이 바이러스시 검사방법,오늘 병원에 갔더니 비형간염 변이 바이러스에 걸린거 같다고 다른병원에서 검사를 다시 받아보라고 하는데요 내일 종합병원에 가볼 건데요  종합병원에서 어떤 검사를 하면 되나요    그리고 어떤 치료를 받으면 되나요   ,감염내과
청소냔 코로나 백신접종  차 부모님 동의서, 차 맞을때는 동의서 안가져가도 된다는 말도 있고  가져가야 한다는 말고 있는데 뭐가 맞는 말이죠 ,감염내과
B형간염 보균자가 접종했을시  ,저는 비형간염보균자이며 임신   개월차 임산부 입니다  병원 전원시 의사에게 접종을 계속 하는데 항체가 안생긴다고 이야기 하였고 의사는 타병원 결과지는 보지않고 제 이야기만 듣고 보균자라고 생각하지않았기에 임신중임에도 접종을 권유하여  차까지 접종하였습니다   그러던중 제가 보균자임을 알게되었고  저도 의사가 인지하지못한 상태에서 처방을 내린걸 알게되었습니다   여기서 궁금한것은 보균자인 제가 접종을 했다면 그냥 쓸데없는데 돈을 썼다고만 생각하면 되는걸까요    태아와 저에게 아무런 이상이 없을꺼라고 생각하면 되는건지 그게 궁금합니다 ,감염내과
입술 포진은 무조건 헤르페스 인가요 ,남자친구 입술에 갑자기 포진이 났어요 물집도 잡히고 빨갛게 텄는데 헤르페스 아닌가요  이것도 성병 감염 때문에 생기나요 ,감염내과
백신  차 꼭 맞아요 하나요   차 접종 이후 두어달 후에 맞아도 되나요 ,저는  차 접종했을 때도 근육통이 꽤 오래  강하게 있었습니다   몸을 쓰는일을 하고있어서 안맞거나 좀 나중에 일이 안바쁠 시기에 맞으려고 생각중이었는데   차랑  차 접종시기의 텀이 너무 길면 안된다는 말을 들어서 질문합니다     차접종만하고 안맞아도 되는건지      차접종시기가 늦춰지면  차맞은것도 의미가 없어지는것인지 ,감염내과
독감예방접종  일차 열,독감예방접종  일차인데 오후부터 두통이 살짝 있더니 갑자기 열이 나기 시작하고 몸이 춥습니다  뒷 목 어깨까지 근육통도 있는데 예방접종 부작용인가요  접종 후 외출도 아에 하지 않았고 가족들도 다 예방접종을 완료 한 상태입니다 ,감염내과
병원에서 일해야해서 예방접종 확인서를 갖고오라는데요,수두 DTAP A B형 간염을 안맞은 걸로 나오는데 일주일 동안 이거 다 맞을 슈 있나요    ,감염내과
대상포진 질문이요  ,허리쪽에 피부가 가려워서 사진 찍어보니깐 이렇네요    간지러웠던건 몇일전 부터 였습니다 아프진 않고요 대상포진 일수도 있을까요   만약 대상포진이면 내일 바로 병원 방문해야 할까요  ,감염내과
체했을 때 백신 맞아도 되나요 ,오늘 화이자 백신 맞기로 했는데요 일어나 보니까 속이 울렁거려서 토했는데요 화이자 백신 맞아도 될까요   지금은 속 울렁거리지 않고 괜찮은데 몸이 살짝 무거운 느낌은 있어요,감염내과
파상풍,제가  달전쯤 발바닥에 앞정에 찔려서 파상풍 걸릴까봐 병원 가서 치료 받고 왔는데 제가 모기때문에 긁다가 딱지 떨어져서 또 아픈데 병원 가야하나요 ,감염내과
백신  차 맞고 학교가도 되나요 ,백신  차 맞고 등교해도 몸에 무리 안가겠죠 ,감염내과
화이자 언제 맞는게 좋을까요   ,제가 위드전까진 불신하다가 접종률     넘어가는거 보고  일에 잔여백신으로 화이자를 맞았는데 제가 알기론 빠르면  차맞고  주뒤에도 맞을 수 있다고 들었는데   일에 화이자 잔여로 아무병원가서 맞으면 되는건가여  ,감염내과
화이자 모더나 백신 맞고 Tdap 수,화이자 모더나 백신 맞고 어느정도 있다가 Tdap 수두 mmr 접종 맞아도 될까요  ,감염내과
머리아픔 백신,평소에 머리 자주 아픈데 백신 맞아도 되나요,감염내과
매독 hiv검사결과,매독항체는    HIV는 항체 수탁      참고지는매독   이고 HVI는 negative인데 검사결과수치는         인데 무슨뜻인가요    매독 에이즈가 잇다는건가요 ,감염내과
대상포진인가요 ,가렵거나 아프진않은데  혹시나 해서 물어봐요  심각한거같으면 병원가보려고요 ,감염내과
독감  가 예방접종,  월   일에 접종하였는데   월달 안으로 비용없이 맞을 수 있는 기회가 생겨서  차 접종하면 효과가 더 좋고 이점이 커질 지 궁금합니다 ,감염내과
수두 전염성,제가 수두 때문에 몸에 수포가 생기기    일 전 쯤 몸살기운이랑 인후통만 있었는데요     이 상태에도 전염성이 있나요  친구들에게 옮겼을까봐 너무 걱정돼요   그리고   외용제는 얼굴에 발라도 되나요  하루에 몇 번 발라야할까요 ,감염내과
대상포진 약복용 중 계속 심해짐,항암 중 대상포진 진단받고 약 복용한지  일차인데 전혀 안 나아지고 더 퍼지고 아파지는 것 같은데 원래 그런가요 아니면 문제가 있는건가요  약은 항바이러스제  알러지약  진통제 이렇게 세종류 복용 중입니다 ,감염내과
병원 실습때문에 질문이요  ,Tdap  수두  B형간염 예방접종 한번에 할 수 있나요  ,감염내과
Cbc 혈액검사를 한다면 성병유무도 알게 되나요,에이즈  매독 등등의 병 유무도 나오나요 ,감염내과
이거 대상포진인가요  찐한상처 두개는 하루에 하나씩 간지러운거 긁다가 생겼고 며칠후인 어제밤에 갑자기 나머지 여러개가 가려우면서 생겼어요,이거 대상포진인가요  찐한상처 두개는 하루에 하나씩 간지러운거 긁다가 생겼고 며칠후인 어제밤에 갑자기 나머지 여러개가 가려우면서 생겼어요,감염내과
안면 대상포진 재발,한달 반 전에 왼쪽이마에 대상포진이 올라와서 일주일을 고생했는데 오늘 아침에 일어나보니까 저번에 올라왔던 자리에 그대로 붉게 올라왔어요 찌릿하거나 가려운 느낌은 없는데 생긴게 매은 익숙해요    수능  일 남았는데 어떻게 해요  일단 저번에 먹던 항바이러스제 있어서 그거 먹었어요  ,감염내과
단순포진 전염,단순포진  형에 관해 질문합니다 한번 걸리면 평생 갖고 살아야 한다는데 만일 전염이 되면 그 전염된 사람도 평생 갖게 되나요 ,감염내과
중 백신접종,백신 맞으러 가야하는데 부모님이 꼭 동행하셔야 하나요   부모님이 같이 안따라가도 접종 할 수 있나여  ,감염내과
고등학생 감기 걸렸을 때 백신,감기에 걸렸는데 백신 맞아두 될까요 병원에서는 컨디션이 나쁘면 다음에 맞으라는데 컨디션이 좋은지 나쁜지 잘 모르겠고 학교 때문에 미루기도 뭐해서   ,감염내과
 차 백신 맞은후, 차 백신 맞은지 하루지났는데요 윗몸일으키기 같은 팔안쓰는 운동은 해도 되나요 ,감염내과
예방접종 수두 차 맞고,한  달 넘게     주정도 지난 것 같은데 그냥  차 맞아도 되나요  아니면  차부터 다시 맞고 해야하나요 ,감염내과
타지 물갈이 어떡해야하나요,원래살던 곳과 떨어져 기숙사에 살고있어요 주말에 집에만 가면 괜찮은데 기숙사에만 오면 피부가 뒤집어 진다던지 무엇보다 밥만 먹으면 배가 너무 아프고 설사만 계속 해서 힘들어요   이런것도 물갈이에 해당하나요     병원에 가보면 효과가 있을까요  ,감염내과
코로나 백신 맞고 일주일 내에 독감백신 맞아도 되나요 ,코로나 백신 맞고 일주일 내에 독감백신 맞아도 되나요  금요일 자에 맞았는데 목요일날 백신 맞아도 될까요,감염내과
백신 접종 간격 안 지키면 어떻게 돼요 ,코로나 백신     차 접종 간격 안 지키면 어떻게 되나요      부작용이 큰지    인증서 발급 시  쿠브 등  문제가 발생하는 지    정말 급해서 그런데  주 간격을 안 지키고  차를 빨리 맞을 수는 없나요  잔여백신 예약은 되던데요  궁금합니다,감염내과
군대 예방접종,실습때문에 예방접종내역이 필요한데 군대에서 접종한 내역이 접종증명서에 없습니다 어떻게 확인하고 다시 등록할 수 있나요 ,감염내과
b형간염접종후 풍진예방접종 질문입니다 ,b형간염 마지막  차 내일 접종예정인데요   풍진항체도 없어서 풍진예방접종도 맞으려고합니다   혹시 b형간염 맞고 바로 풍진 맞아도 되나요   아니면 며칠 시간을두고 맞아야 하나요 ,감염내과
고 인데요 백신 맞은 후    일 지나서 열 나고 그  일째에 괜찮아졌다가   일 지나서 심장 저릿한 현상 있고 이주 지나니까 지금 점점 괜찮아,고 인데요 백신 맞은 후    일 지나서 열 나고 그  일째에 괜찮아졌다가   일 지나서 심장 저릿한 현상 있고 이주 지나니까 지금 점점 괜찮아지고 있는데 아직 부작용 증상이 다 난 건 아니에요 내일이  차 접종날인데 맞아도 될까여  괜히 무서워서요,감염내과
놀이공원에서 논 뒤 다음날 백신,제가 이번 주 일요일 날에 에버랜드 가기로 했는데 하루종일 놀려고 하거든요 월요일날 화이자 백신 맞아도 될까용    논 다음날 너무 피곤해서 맞고 엄청 아프거나 죽진 않겠죠    ,감염내과
형이 동성애자입니다 에이즈걸린다면,형이 동성애자입니다 만약에 성교하다가 에이즈에 걸렸을 시 가족들에게 간접적으로라도 전파될수있는 가능성이 있습니까 ,감염내과
B형간염 예방접종  개월 후 건강검진에서항체       항원    ,건강검진결과 b형간염 항원     로 다시 대학병원 정밀진단결과 항원      항체없음으로 나와 B형예방접종  개월 후 건강검진에 항원      항체      나왔어요  그런데  년이 지난 올해 건강검진에서 항원      항체    로 보균자라고 해요 제가 b형 간염이라도항체가      로 생길수 있었던 걸까요   그때도     로 항원 항체가 다 나왔지만 그냥 넘어갔었는데 도움 부탁드려요,감염내과
대상포진 수두,저는 수두에 한번도 걸린적이 없습니다  어제 친구가 대상포진 걸렸다길래 안만나려고했는데  다 나았다고 식사를 했는데    짜증나게  장난으로 그 검은색 딱지랑 흉인지 모를 누런 부분으로  제 피부에 닿으면서 안옮아    하고 닿았는데  너무 불안합니다  인터넷 찾아보니 대상포진이 전염은 안되는데  수두로 전염이 된다는데  그럼 제가 수두에 걸릴수도있나요     대 남자입니다  그럼 지금 병원가서 예방주사나 예방약을 먹을필요가있을까요   전염될수있을까요 ,감염내과
화이자  차 예약일 앞당기기,  월   일에 화이자  차를 맞아서  차 예약일이   월   일로 문자가 왔는데  차 날짜 앞당겨서 맞을 수 있나요    잔여백신 있으면   일에 맞고싶은데 가능할까요   ,감염내과
화이자  차접종빨리,  월    에  차 맞았고 원래   월   일이  차접종인데 오늘이나 내일 좀 빨리 맞고싶은데 하루이틀 빨리 맞을수옶나요  병원에 전화해보면 주사놔줄까요 ,감염내과
백신  차 앞당기기, 차 백신을   월  일에 맞고  주뒤인  차 백신이   월   일에 예정되어있는데  차 백신을   일로 하루정도 앞당길수는 없나요 ,감염내과
대산포진 증상,중   여학생인데요  목 정 중앙에 작은 수포같은 게 있어요   월달즘에 대상포진 한번 걸려서 고생한 적도 있어요 근데 제가 알기론 대상포진은 중앙에는 안나고 한 편에서만 난다고 들었거든요   간지럽고 살짝 아파요 난지 꽤 됐어요  대상포진이 맞을까요  ,감염내과
대상포진 발생중에 대상포진 예방주사 맞아도 되나요 ,심하진 않은데  작게 나으면 또 나고 해서  그래도 예방주사 가능한가요 ,감염내과
 차 백신,안녕하세요  차와  차 백신을 모두 화이자 접종했으면  차도 화이자로 맞아야 하죠  답변 부탁드립니다,감염내과
화이자  차  주 지나고 맞아도 되나요,병원에 전화해서 빨리 맞고 싶다고  차 맞고   일 뒤에 되냐고 물어봤는데 된다고 하셔서 그러는데 맞아도 부작용 없는건가요,감염내과
병원 항체검사,간호학과라서 실습 나가기 전에 a b형 간염   mmr   수두 항체검사 받아야하는데 피검사해도 저 항목들 관련된 결과만 나오나요  다른 건강사항같은 건 전혀 안 나오죠 ,감염내과
말라리아 감염된 거 같은데 펜벤다졸이나 다른 구충제들도 효과 있습니까 ,모기에   방 물리고나서 뒤지게 아파서 열이 몇일마다 반복되고  아무래도 말라리아 감염된 거 같은데 펜벤다졸도 효과 있을까요     펜벤다졸도 원충 박멸이라고 하던데  말라리아는 전부      원충이 확실하니 펜벤다졸도 효과는 있는 거겠죠    그리고 말라리아 원충 박멸에 효과적인 또다른 약이 있으면 추천 부탁드립니다   병원 가서 클로로퀸이나 프라지콴텔 처방받을 예정이긴 한데   예전에 말라리아 한 번 감염되고난 뒤에 프라지콴텔 먹었더니 몇일동안 죽다 살아났을 정도로 고통스러웠어서   고통 좀 더 약한 약은 없나 추천 부탁드려봅니다   근데 프라지콴텔이 고통스러운 대신에 효과도 제일 확실한 거겠죠    일단은 응급상황으로 알벤다졸과 이부프로펜부터 한 알 먹은 상황입니다   또 다른 응급처치법이 있으면 알려주시면 감사하겠습니다 ,감염내과
금요일에 백신맞았는데 약 먹어도 되나요,기침이 넘 심해서       백신 맞기 몇시간 전에도 약 먹었구 맞고난 후 지금까지 약 안먹었어요   맞은 곳 꾹 누르지 않는 이상은 전혀 안아픈데 먹어도 괜찮나요 ,감염내과
대상포진 수두 전염,저는 수두에 한번도 걸린적이 없습니다  어제 친구가 대상포진 걸렸다길래 안만나려고했는데  다 나았다고 식사를 했는데    짜증나게  장난으로 그 검은색 딱지랑 흉인지 모를 누런 부분으로  제 피부에 닿으면서 안옮아    하고 닿았는데  너무 불안합니다  인터넷 찾아보니 대상포진이 전염은 안되는데  수두로 전염이 된다는데  그럼 제가 수두에 걸릴수도있나요     대 남자입니다  그럼 지금 병원가서 예방주사나 예방약을 먹을필요가있을까요   전염될수있을까요 ,감염내과
음식 알레르기 화이자 백신 맞아도 되나요,제가 음식 알레르기 땅콩 멜론 등   강아지 알레르기가 있는데 화이자 백신 맞아도 되나요 ,감염내과
저 패혈증인가요 ,저번주 금요일에 피어싱을 뚫었는데요 염증이 심하게 나서 병원에 가서 먹는 약이랑 바르는 약을 처방받았어요 약 먹고 관리하니까 붓기 다 가라앉고 진물도 안 나더라고요 근데 무서워서 그냥 피어싱 뺐습니다 근데 어제부터 몸이 으슬으슬하더니 근육통이 심하고 몸살걸린 느낌이 드네요 패혈증일까요       최근에 옷 얇게 입고 밖에서 운동을 심하게 했는데 그냥 운동 심하게 해서 몸살난 걸까요    ,감염내과
목감기 상태에서 백신 접종,목감기 걸려있는데  내일이 백신 접종일인데 접종을 맞아도 되나요 ,감염내과
감기걸림 상태에서 백신접종가능한가요 ,금요일에 감기에 걸려서 지금은 코도 덜 막히는데 기침을 해요 기침하면 명치쪽이 아픈데 수요일에 백신을 맞는데 그때까지 나으면 맞을수 있나요 혹시 낫지 않으면 못맞나요  ,감염내과
Tdap읽는법,파상풍 디프테리아 백일해인건 알겠는데 그래서 Tdap를 뭐라고 읽나요  티디에이피라고 읽어요 ,감염내과
대상포진일까요 ,왼쪽 가슴골 바로 옆에 이렇게 되었는데요  몇일전에 간지러워서 살짝 긁긴했었는데    왜그럴까요 ,감염내과
대상포진   ,이거 대상포진가요  달전부터뭔가나더니 얼굴에양턱에 엄청나게납니다      그리고 또 온몸에 여기저기 시린칼로베는듯한통 도있구요 외국인데 걱정이됩니다      대상포진인가요 ,감염내과
,,
,,
,,
,,
,,
,,
,,
,,
,,
,,
,,
,,
,,
,,
,,
,,
,,
,,
,,
,,
,,
백신  차 접종,수요일에 백신  차 접종을 하는데요  차 접종할 때도 부모님 동의서랑 예진표  작성해야하나요  고 에요  차 때 동의서 냈으면 안내도 돼요  부모님없이 저 혼자 가요,감염내과
 차 아스트라 제네카  차 모더나 가능한가요 ,원래 아스트라    차였는데   대는 맞지말라 효과 미미하다  해서  차는 화이자떳는데 주변에 화이자있는데가 없고 죄다 모더나인데 모더나 가능한가요 ,감염내과
과민성대장증후군 코로나 백신 접종,제가 과민성대장증후군이 있는데 백신 맞아도 괜찮은가요  진짜 무서운데      년생이라서 화이자 백신 예약은 이미 해놨어요      일   시인데 과민성대장증후군이랑은 상관 없는 건가요     이것도 질병인데   ,감염내과
산책하다 집앞에나무에얼굴스쳣는데,에이즈위험있나요  ,감염내과
대상포진 질문드려요, 틀전에 아무 이유 없이 코옆에 머가 나더니 어제까지는 아프지 않더니 오늘 항생제 연고를 혹시나 몰라서 발랐거든요 그러니 안만져도 따끔따끔 아프네요 혹시 대상 포진일까요 ,감염내과
항체 검사 결과 해석해주세요,항체가 생성된건지 어떤게 접종이 필요한건지 해석부탁드려요 ,감염내과
B형간염 접종기간 중 코로나 백신,B형 간염   월   일날 마지막 접종하는데  듣기로는 접종중에 맞으면 안된다고 하는데    일 간격이면 된다고 하는데  최종 접종하고 나서 인가요   아니면 접종하고 있는 기간중에도 맞아도 되는건가요   이번주에 맞고  코로나    주뒤에 맞고  코로나     월   일날 맞으려고 하는데요   B형간염 ,감염내과
치질증상 궁금합니다,지금 상태가 케겔운동처럼 똥꼬에 힘을 줬을때 이물감이 있는데 치질인가요 ,감염내과
독감예방접종  일차 샤워,제목 그대로요 접종 부위에 물 닿게 샤워해도 완전 괜찮은 거 맞져 ,감염내과
백신 접종 전 헌혈,백신 접종  일 전 헌혈 안돼나요 ,감염내과
정강이에 수포가 생겼어요  혹시 대상포진인가요 ,정강이 근처에 멍과 함께 수포가 생겼어요  만지면 약간 쓰라린데   혹시 대상포진인가요 ,감염내과
고등학생 백신맞고 대상포진 질문,화이자  차 맞고 정확히  일뒤에 골반이 살살 아프더니 수포가 올라오고 오늘이   일차 인데 이제 병원가요 딱봐도 대상포진이라 제가 어릴때 수두바이러스 걸린적이 있는데 백신 부작용 일까요  그리고 학교는 안가는건가요 ,감염내과
DTap 예방접종,아래 사진의 DTap예방접종  백일해  파상풍  디프테리아  저렇게 있던데요 저거 혹시 몇년도에 접종했는지 알수있나요  그리고 저 Dtap가 위 개를 다 포함해서 접종했다는 거죠 ,감염내과
기본적인 피검사에서 알수 있는게 뭔가요  ,제가 돌방성난청때문에 대학병원에서 피검사를 했는데 다 정상으로 나왔거든요  근데 대학병원에서 피검사 하면 기본적으로 어느정도까지 파악이 되는건가요   에이즈 여부도 기본검사 중에 하나인가요  ,감염내과
수두  MMR 접종,수두랑 MMR접종을 실습을 나가기 위해서 맞아야 하는데 MMR이랑 수두  차 까지 맞았는데 성인이랑 소아랑 약이 다른가요    ,감염내과
중학생 백신 맞을때 보호자 필요한가요 ,다음주에 백신을 맞는데 친구가 오늘 백신을 맞을때 보호자랑 같이 가야 한다고 하는데 정말인가요  네이버에서 좀 찾아보니깐 보호자 동의서가 있으면 혼자가도 괜찮다고 하던데 어떤게 맞나요 ,감염내과
식욕억제제 먹고있는데 백신접종 문의,제가 식욕억제제를 먹고 있는데 백신접종해도 상관없을까요 ,감염내과
b형 간염  차 접종 후에 항체검사 언제하나요 ,b형 간염  차 오늘 맞았는데 몇 주 지나고 항체 검사하나요 ,감염내과
화이자 백신 학교,코로나 화이자 백신 받고  일 쉬는 거라는데 맞은 날 포함  일 인가요 아니면 맞은날 포함 일 인가요,감염내과
백신 미접종 급해요,헬스장 다니는데 백신 미접종자라서  운동 못하게 생겨서 얀센 이라도 맞고 방역패스  해야 할 것 같은데 얀센 잔여백신 어디에 문의해야  하나요        ,감염내과
