0,1,2
하비갑개나 비염 검사할려면,Ct가 정확하나요 xray가 정확하나요 mri가 정확하나요  비염이랑 콧살 하비갑게 중비갑게 검사하고싶은데,이비인후과
박동성 이명 관련 문의,안녕하세요    대초반 남성입니다   한 두세달전부터 간헐적으로 귀에서 두근두근 소리가 나기 시작했습니다   특히 하품을 하거나 업무를 할 경우 혹은 침을 삼키거나 하면   귀에서 두두두 진동이 오는 것처럼   때로는 두근두근하는 소리와 함께 귀에서 혈관이 뛰는 것이 느껴집니다   빈도는 약   분에  회에      초정도 지속되는 것 같습니다   인터넷으로 살펴보니 간헐적으로 되어 있기보다는   지속적으로 이명이 나는 분들만 계시는 것 같은데  저 같이 간헐적으로 들리는 경우도  박동성 이명인가요   살짝 거슬리기는 하는데 박동소리가 들리는 시간이 짧아서 그냥  달정도 방치해두고 있었습니다   그리고 원래 술을 잘 마시지도 않고 많이 마셔도 숙취도 없었으나   이 증상이 시작되면서 맥주 조금만 마셔도   두통이 생겨서 박동성이명과 두통이 관련이 있는지도  궁금합니다   병원을 가서 검사를 받아보아야 할까요 ,이비인후과
후비루 증상,제가  일전부터 코가 막히고 콧물이 흐르는게아니라 뒤로 넘어가는것처럼 계속 침삼킬때마다 삼켜지고 지금은 코막히거나 콧물이 흐르려고 하는 증상은 없는데 목 뒤쪽에 콧물이 있는느낌이들고 목도붓고 약간 가래도 끼고 몇번 코를 풀면 투명하고 끈적 거리는듯한 느낌의 콧물이 나오는데 이거 후비루증상 인가요  참고로 전 비염이있습니다,이비인후과
비중격천공 크기가 계속 커지나요 ,코성형 후에 생긴거 같은데 알게된지  년 정도 지났는데 아직 불편한 점은 없어서 그냥 지내고 있는데 천공 크기가 점점 커지는거 같아요  괜찮은건가요 ,이비인후과
비중격만곡증이랑 코성형 같이하는 곳 없나요 ,비중격만곡증이랑 코성형 같이하는 사람들이 있던데 제가 다니는 이비인후과에서는 따로 하라고 하더라구요   그럼 비용도 많이들고 수술도  번 하는거라 같이 하고싶은데 서울에 괜찮은 이비인후과 있으면 추천 부탁드려요 ,이비인후과
코뼈골절인지 아닌지 병원안가고 알 수 없나요 ,옆사람 머리랑 코를 부딪혔는데 코가 아프긴 한데 찜질하면 괜찮아질까요   너무 쌔게 부딪혔다고 병원가보라고 하는데 그 정도는 아닌거 같아서요  혹시 병원 안가고 코뼈골절 된거지 확인할 수 있는 방법은 없을까요 ,이비인후과
비중격천공 때문에 코막힘이 심해져요   ,비중격천공 때문에 코막힘이 심해지는데 수술을 꼭 해야할까요  수술해도 완치가 어렵다고 하던데 수술하지 코막힘을 해결할 수  있는 다른 치료방법은 없을까요 ,이비인후과
메니에르 완치 하는법,메니에르병을     년  월에 독감이 걸리고 그 바이러스가 귀로 가버려서 걸렸습니다    년  월에 이비인후과에서 약먹고 좋아지다가 또 다시 안좋아져서 매년 이비인후과를 들렸습니다  그러다   년  월에 스트레스를 많이 받고 그랬더니 불안하면서 메니에르가 심해졌는지 심하게 어지럽고 머리도 무겁더라구요 그래서 어제 약을 처방받고  일째 먹는데 약 효과가 언제 나올지 싶네요 오늘도 많이 어지러웠습니다    완치 하고 싶네요 공부도 너무 안되고 수업집중도 너무 힘들어요     ,이비인후과
머리를 숙이고 도리도리하면 어지럼증,머리를 아래로 숙이고 도리도리 고개를 오른쪽 왼쪽 돌리면 어지러워요 평소에 한번씩 어지럼증을 느끼긴 하는데 요즘들어서 더 자주 어지러워졌어요  그런데 고개를 숙이고 고개를 돌리면 너무 어지러워요 그냥 앞을보고 있으면 멀쩡한데 숙이기만 하면 어지러운데 왜이런걸까요 ,이비인후과
돌발성 난청일까봐 무서워요,  살 여자입니다  제가 요즘 이명이 자주 들려서 어제 동네 이비인후과에 가서 청력검사를 했는데요  왼쪽은   db  오른쪽은   db이라는 결과가 나왔습니다  그래서 의사쌤이 되게 심각하게 이어폰 많이 껴서 그렇다고 맞음   절대 끼지 말라고 그러셨어요  혈액순환제 처방받아서 그거 먹고 일주일 후에 다시 오라고 하셨어요  정확한 병명은 못들었는데 일단 하라는대로 하면 될까요   돌발성 난청일까봐 너무 무서워요    그리고 제가 주말마다  일동안   시간씩 물류알바를 해서 되게 시끄러운 소리를 많이 듣는데요  근데 알바 안나갈수도 없고  미치겠어요 오늘도 했는데 더 안좋아질거같고  그리고 이어플러그 끼면 그나마 더 낫나요   대학병원은 안가도 될까요   ,이비인후과
귀에 삐 소리가 들려요,요즘따라 귀에 빠 소리가 자주 들리는데 옛날에는  년에 한두번 들릴까 말까인데 요즘은 자주 들리고 크게 들려요 고통스러울정도로 크게 들려요 이거 혹시 많이 안 좋은건가요 ,이비인후과
이비인후과에서 음성인데 양성 흐린줄이   ,내일 보건소가서 검사 받아보려고하는데      양성 일까요   너무 겁나네요     저는 이제 어떻게 해야될까요  만약에 걸렸을때  절차방법좀 알려주세요   주만 격리 하면 되나요   격리끝난뒤 이빈후과가 공짜니깐  이빈후과가서 검사 해보면 될까요   아니면 보건소 ,이비인후과
강아지알러지가 없었는데요 강아지 알러지가 생겼었는데 강아지를 키우고 있어요      ,강아지를 보내야 하나요       강아지 알러지가 분명 없었는데 다시 검사 해보니 생겼네요    하 진짜 마음이 복잡해요   ,이비인후과
키트 양성,키트로 코로나 검사 했는데 두줄나왔거든요 근데 몸이 심하게 아파서  시간동안 pcr 줄 서있으면 죽을거 같은데 어떡하죠 해야하긴할텐데,이비인후과
후비루  축농증  ,후비루증상은 목뒤에 가래나 콧물이 걸쳐 있는 느낌이고 자주 헛기침이 나오는 걸로 알고 있는데  제가 딱 저런 증상을 달고 살고 있거든요  그래서 인지 매번 목 쪽은 답답하고   자주 목이 가라 앉는데요  특히 신경 쓰이는 건 헛기침증상이에요     한번 헛기침이 나오기 시작하면 목이 간지러워서    분 정도는  계속 헛기침이 나와요    꼭 혼자 있을 때는 안 그러고  사람들 많은 곳 전철  공공장소 등등 에서 증상이 나타나요  시국이 시국인지라 더 눈치 보이고 짜증이 납니다   아직 병원에 간 건 아니라 정확히 후비루라고 말하기 그렇지만 제가 알기론 후비루증상이랑 제 증상이랑 비슷한 거 같은데  축농증을 달고 사는 친구한테 말했더니 축농증 증상도 비슷하다고 해서요   후비루일까요  아니면 축농증일까요   도와주세요 ,이비인후과
코막힘병원가면 코막힘 바로 나아질 수 있나요 ,코막힘 때문에 n년째 고통 받고 있는 남자사람입니다     잠자려고 누우면 옆으로 눕던 똑바로 눕던 그냥 어떻게 누워도 꼭 항상 한쪽 코가 막히더라구요    돌아누워서 막힌 거 풀고  그럼 다른 쪽이 막히고   반복하다 잠이 드는데요  코가 막혀서 인지 몰라도 코를 많이 골게 되더라구요   그래서 여자친구가 너무 힘들다며 곧 결혼할 사이입니다    코막힘병원 찾아서 가보라고 할 정도예요    제가 잠자기 전이랑 잠든 후에만 그러는 게 아니라  일하다가도 코가 막혀서 꼭 병원은 가야할 거 같습니다   코막힘병원 가서 치료를 받으려고 하는데   코막힘병원에 방문해 치료를 시작하면 코막힘이 당일이나  그 다음 날에 바로 나아질 수 있나요  아님 시간이 좀 걸릴까요 ,이비인후과
지겨운 겨울 알레르기비염   ,겨울 알레르기비염 진짜 지겨워 죽겠어요     겨울마다 이놈의 알레르기비염 때문에 코는 헐고 조금이라도 먼지가 날리면 바로 재채기가 쉴 틈 없이 나오고 정말 스트레스 받아 죽겠네요      겨울 알레르기비염은 겨울이 지나가길 기다리는 게 답일까요    약국에서 약 타서 먹고는 있는데 차도가 없어요      겨울마다 정말 너무 힘든데 효과 있는 관리 방법이나 치료방법 좀 알려주세요  ,이비인후과
병원 가도 될까요 ,안녕하세요  제가 근  일간 인후통이 너무 심한데 자가진단키트도 할때마다 음성이 나왔고 신속항원검사도 증상 발생 첫날이랑 오늘까지 둘 다 음성이 나왔는데 그냥 병원에 가서 진료를 받아도 될까요  요즘 코로나가 심해서 호흡기질환은 잘 안 봐줄거 같더라구요    참고로 지역은 경주입니다 ,이비인후과
귀가 멍멍    먹먹 해요,자다가 너무 씨끄러워서 손으로 귀를 조금 세게 쳤더니 소리는 잘 들리는데 오른쪽 귀가 멍멍 먹먹 하더라고요 너무 겁나는데 왜 이런거죠  지금은 안그런거 같은데 기분탓 때문에 멍멍한 느낌  고막찢긴건가요    ,이비인후과
비염에 먹는 약 맞나요 ,병원에서 약을 처방받았는데 그 병원이 이비인후과 말고도 이것저것 짬뽕으로 하는 병원이라 영 믿음이 안 가서요 약간 돌팔이st랄까   이거 콧물 나거나 코 막힐 때 먹으면 효과 있는 약 맞을까요 ,이비인후과
자가진단 키트,제가 방금 같이 밥 먹은 친구가 자가진단키트 양성이 떴는데 제가 지금 바로 자가진단카트로 검사해도 되나요  아니면 좀 시간이 지난뒤에 검사 해야 정확도가 높나요 ,이비인후과
코로나 자가격리,현제 가족들은 다  차접종자입니다 형이 회사갔다와서 밤에 자가키트를했는데 양성이나왔는상태인데 가족들 다PCR검사해서 음성일경우 출근해도상관이없나요  내일아침에 출근해도되는상황인가요 ,이비인후과
편도하얀색이요,안녕하세요이런걸올려서창피하지만신경이쓰여서요 제가약을먹고난후목에약이걸렷나해서물을더먹었는데자꾸뭐가걸리는것같아서후래쉬로보니하얀게 개나있어서깜놀해서아는사람한테물어보니면봉으로살살문데보라고해서문데봣더니안없어지더라고요양치질해도부터있고없어질생각은안하고침넘어갈때걸리고면봉으로마니문데서그런가아프기도하고내일이면아픈것도괜찮고하얀것도없어질까요제가흡연을하는데괜찮을까요병원가야할까요걱정이되네요저하얀게뭔지도몰겠고어떡해야할까요,이비인후과
코로나 질문,코로나는 무조건 폐를 망가트리나요   그럼 늙어서 무조건 폐암 걸리는거 아인교 ,이비인후과
자가키트 음성일까요 양성일까요,자가키트 했는데 평소에는 아예 T에 하나도 안보였는데 오늘 자가키트 하니까 선이 보일락 말락하는데 음성일까요 양성일까요   ,이비인후과
알러지 항원 검사,최근에 바나나  시금치 등을 먹을때 혀가 따갑고 붓고 붉게 되는데 알러지인 것 같아서요   혹시 알러지 항원검사는 어디서 해야할까요   ,이비인후과
귀 부스럭소리,몇 달 전부터 계속 귀에서 부스럭부스럭 소리가 났는데요 귀지인줄 알고 계속 파봤는데도 아무것도 안나와요 침 삼킬때나 귀를 만질때 부스럭 소리가 많이 나는 것 같아요  왜 이런 걸까요 ,이비인후과
중이염에대해,귀에 물이 찼는데요 몆일전에 물을 뺏는데요 물을빼도 튜브박는 시술 할수있나요,이비인후과
비인두 점막 건조,비인두 점막이 며칠전부터 건조해요   방금 한 자가키트 음성  cm 넣음  두통 목아픔 미열 설사 구토 없음 피곤하긴 한데 원래도 코로나 전부터  자주 피곤해 했음  바인두점막이 건조한 것도 코로나 증세인가요  Pcr 검사가 비인두점막의 바이러스를 채취해서 음 양성 판단하는 거라는데  불안하네요  자가키트가 음성이긴 하지만 사실      정확은 또 아니잖아요   내일 이비인후과가서 진료받는게 정확하겠지만 혹시 몰라 미리 여쭤보아요 ,이비인후과
코뼈휨수술 질문이요 ,안녕하세요   대중반 남자입니다  군대에서 훈련 받다가 코뼈가 휘었었는데요   전역하자 마자 바로 수술 해야지 해야지 하다가 취업이 돼서 시기를 놓쳤어요      코뼈가 휘어서 인지 코도 자주 막히는데 제일 큰일 인건 제가 코를 너무 많이 곤다는 거예요     지금 취업하는 곳 근처에서 동료들이랑 자취하고 있는데  같이 생활하는 회사분들도 저 때문에 너무 힘들어 하시더라구요    너무 죄송스럽고 저도 생활하는데 불편하기도 해서 코뼈휨수술을 하려고 하는데요    코뼈휨수술을 이비인후과로 가서 검사를 받고 성형외과로 가서 수술을 하는 건지   아니면 그냥 성형외과만 가도 되는 건지     그것도 아니면 이비인후과에서 모두 다 진행이 가능한 건지 모르겠네요    병원은 어디로 가는 게 좋을까요 ,이비인후과
항원검사 ,이거 음성인가요 양성인가요 오른쪽 부분 색이 전체적으로 붉은색  ,이비인후과
PCR검사 병원 알려주세요,저희 아이 얼집에서 코로나 확진자가 떴다고 오늘 쌤한테서 연락을 받았는데요  바로 집으로 데려와서 자가키트 다 했는데  남편은 아직 못했어요  양성이 나왔어요   자가키트는 정확도가 좀 떨어진다는 말이 있긴 한데  양성이라 너무 불안하네요     제대로 검사 받으려고 PCR검사 병원 알아보고 있는데요 PCR검사는 검사 결과가 언제쯤 나오나요   그리고 PCR검사 가능한 병원 정리된 게 따로 있던데  그 URL도 알려주시면 감사하겠습니다   ,이비인후과
코막힘치료 중 수술치료는 어떤 경우에 진행하나요 ,저희 딸아이가 코막힘이 너무 심해져서 병원에 데려가볼까 하는데요 애가 지금 고 이라 안 그래도 예민한데 코까지 막히니까  짜증도 늘고 힘들어 하더라구요   처음에 코 막힌다는 말을 들었을 때 감기 인줄 알았는데 코만 막힌다고 하더라구요    그래서 이번에 이비인후과 데려가려 하는데 가기 전에  코막힘치료에 대해 좀 알고 가고 싶은데요  혹시 수술을 해야 할 수도 있을까요   수술은 무조건 해야 하는 건가요  어떤 경우에 수술을 하는지 좀 알려주세요  ,이비인후과
아침마다 목 잠김,일주일 전 부터 아침마다 목이 잠겨요 가래가 생겨서 큼큼하면서 없애줘야 목소리가 나와요   열이나 두통 같은건 없지만 코로난가 싶어서 키트도 여러번 해봤는데 음성이구요   일어나서 한시간 정도 목이 잠겨있다가 일상생활하면서 풀리고 통증 같은것도 없는데 아침에 말할때 마다 스트레스네요   혹시 코로나일까요  아니면 다른 질환이 생긴걸까요   ,이비인후과
메니에르병과 이석증 차이가 있는 병인가요   ,어머니가 어지러움 때문에 이비인후과에 함께 가달라 하셔서요   어지러움을 검색하니까 메니에르병과 이석증 두 개가 가장 많이 나오는데  그 두 개의 차이를 잘 모르겠네요   같은 병인데 그냥 이름만 다른 건지   특별한 차이점이 있을까요   우선 저희 어머니 증상은    시도 때도 없이 어지러움이 느껴진다고 합니다    귀가 먹먹하고 귀 울림  현상이 있다 하네요    어지러움이 발생하고 나서 귀가 잘 안 들리신다네요   발생한지는 거의 한 달 넘었다고 해요 이런 증상들이 대표적인데  메니에르병 맞을까요   그리고 메니에르병이랑 이석증이랑 같은 건지도 궁금합니다  ,이비인후과
어지러움 검사 받을 때 어지러울 수 있다는 데 진짜예요 ,제가 이석증 때문에 어지러움 검사 관련해서 알아보고 있거든요  근데 검사 받을 때 어지러울 수 있다는데    어지럽게 검사 받는 방법 말고 다른 방법은 따로 없나요   그리고 치료 어지럼증 검사 받은 뒤에 바로 치료도 가능한가요  치료 후에 어지럼증이 곧바로 좋아지는지도 궁금해요  ,이비인후과
이석증 증상 맞는지 확인 부탁드려요 ,원래 기립성 저혈압 때문에 앉았다 일어날 때 어지럼증이 좀 있긴 했거든요  근데 굳이 앉았다 일어나지 않아도 어지럼증이 지속적으로 있어서 증상 검색했는데 이석증 증상 같아요      일단 증상을 정리하자면    따로 움직이지 않아도 일상생활에서 어지러움이 느껴짐    가끔씩 토가 나올 거 같아요  근데 실제 하지는 않습니다     비틀 비틀 거릴 때가 있는데  가끔 그래서 중심을 못 잡아요   이 정도인데  이석증 증상이 맞나요  ,이비인후과
난청검사 방법이 궁금해요    ,평소 일상생활에서 잘 못 듣는다는 이야기를 많이 듣는데요   그냥 대수롭지 않게 여기고 있는데   최근에 주변 사람 말소리를 잘 못 들어서 업무할 때 문제가 된 적이 있어서요      우선 난청검사 받아보려고 하는데 난청검사는 어떻게 진행되는 건가요   그냥 이비인후과에 내원하면 금방 받을 수 있는 검사일까요   한 번 받을 때 이왕이면 자세한 검사를 받고 싶은데 난청 검사도 종류가 따로 있을까요 ,이비인후과
외이도염 증상이 의심되는데 귀 자주 파는 게 영향이 있나요 ,귀에 통증이 심하고  이전보다 안 들리는 상황이 잦은데요   외이도염 증상 같아서 병원에 가보려고 하는데  귀 자주 파는 게 혹시 외이도염 증상에 영향을 미칠까요     따로 이어폰도 잘 안 끼고  수영이나 물놀이를 하는 편도 아닌데  외이도염 증상이 발생한 게 이상해서요    그냥 귀 자주 파는 것만으로도 외이도염에 걸릴 수 있는지 궁금합니다   만약 그렇다면  귀는 평생 파지 않고 두면 되는 건가요   ,이비인후과
불면증 수면다원검사 받으면  치료받고 나아질 수 있나요 ,안녕하세요     년 넘게 불면증으로 제 때 잠에 들지 못하고 있는데요   고질병이라 생각하고 안고 가려 했는데  밤에 잠을 잘 못 자니  업무에도 지장이 생기고 친구들과 만나도 체력이 금방 딸리더라고요    운동도 시작해 봤는데  시작하고나서 잠깐 효과가 있을 뿐이고  여전히 불면증 때문에 미치겠습니다    친구들이 불면증 수면다원검사 해보라고 하는데  이게 좀 생소해서요    불면증 수면다원검사 받으면 불면증 치료가 가능한가요    어떤 방식으로 이루어지는지 궁금합니다  ,이비인후과
수면무호흡증증상 어떻게 나타나는지 알 수 있는 방법이 있을까요 ,제가 혼자 자취를 하는데요     주말에 친구가 놀러왔는데  제가 자다가  컥  하는 소리를 자주 낸다고 하더라고요    별로 대수롭지 않게 여겼는데  어제 엄마가 집에 자고가면서 또 제가  컥 하는 소리를 내면서 몇 초 동안 숨을 안 쉬었다고 말씀하셔서요      수면무호흡증증상인 거 같은데 제가 혼자 수면무호흡증증상을 알 수 있는 방법은 없나요   단순히 친구랑 엄마가 있을 때 피곤해서 잠깐 나타난 건지   아니면 평소에도 계속 증상이 나타났던 건지 알고 싶어서요    ,이비인후과
제 특징  중 수면무호흡증원인이 될 만한 것들이 뭐가 있을까요 ,제가 비염  코골이 등 증상이 조금씩 있는 편인데요  최근 수면무호흡증 증상까지 보인다고 해서 문의드립니다   찾아보니 수면무호흡증을 방치하면 혈압이 높아지고   심하면 혈관이 터져서 뇌졸중  뇌출혈  뇌경색 이런 질환들이 생길 수 있다 해서  갑자기 걱정이 되네요     일단 제 특징을 말하자면     낮에 자고  밤에 일하는 직업입니다      뚱뚱까지는 아닌데 통통한 편에 속합니다      원래부터 비염을 앓고 있습니다   이런 특징들이 있는데  이것들이 수면무호흡증원인이 될 수 있나요    아니면 이 중에서 수면무호흡증원인에 해당되는 것이 뭐뭐 있는지 알려주실 수 있을까요  갑자기 너무 걱정돼요  ,이비인후과
편도선통증이 가라 앉질 않네요   ,이주 전부터 편도선통증이 심해 병원 다녀와서 약 처방받고 있는데요   편도선통증이 가라 앉질 않아요    초반보다는 나아진 부분이 있긴 하지만    완전히 회복되거나  일상생활을 문제없이 할 수 있을 정도는 아니에요     혹시 만성으로 넘어간 걸까요     만성으로 넘어갔을 경우에는 어떻게 하면 좋을까요    ,이비인후과
코 비중격이 휘어진 거 같은데   치료받지 않고 두면 어떻게 되나요 ,  대초반에 술 먹고 넘어진 후로 콧대가 살짝 휘었는데용      생활하는데 크게 문제없을 거 같아서 그냥 그대로 냅두고 살아왔는데 그 때 이후로 숨쉬는 게 좀 불편하더라구요     아무튼 콧대가 살짝 휘어서 숨쉬는 게 불편한 것 같아 알아보니  코 비중격이 휘어진 게 영향이 크다 하는데    치료받지 않고 그냥 두면 지금처럼 코만 막히는 걸까요   아니면 더 큰 질환으로 이어지는 건지    아 그리고 수술은 혹시 성형외과 코수술처럼 진행되는 걸까요  코모양도 수술할 때 원하는 대로 바꿀 수 있는지 궁금합니다  ,이비인후과
편도선염치료는 약물치료랑 절제수술 밖에 없나요    ,안녕하세요    대 후반 남성입니다   편도가 자주 부어서 이비인후과에 거의 살다싶이    하고 있는데요   항상 편도염으로 방문하면 약 처방만 해주시고 별 다른 조치는 안해주시더라고요    다행히    일 정도 약 꾸준히 먹으면 나아지긴 한데  발생빈도가 높은 편이라 다른 편도선염치료를 알아봤더니 편도절제수술만 나와서요     편도선염치료는 약물치료랑 절제하는 방법 두 가지 밖에 없는지 궁금합니다   혹시나 또 효과적인 치료가 있다면 알려주세요   ,이비인후과
비염 심하신 분들 중 비중격수술 받아보신 분 재발하셨나요 ,만성비염으로 고생하고 있는데요  제가 비중격만곡증이 있어서  비염이 심하다고 진단을 받았어요    비중격에 문제가 있는 거라서 몇 년째 항생제도 먹고  병원가서 비염치료도 받아봤는데 괜찮아지질 않더라구요   그래서 이번에 좀 무섭지만 수술을 받아보려고 하는데요    혹시 비중격수술 받으신분들 중에 비염 재발하신 분 있으실까요   수술받고 나서 괜찮아졌다가 다시 재발할 수도 있을 거 같아서    수술이 조금 걱정되기도 하고     비중격수술 받고 난 뒤 재발할 확률이 얼마나 될까요  ,이비인후과
코로나 검사 신속항원검사 병원  PCR검사 ,안녕하세요  코로나 검사하는 방법 중에 궁금한 점이 있는데요 신속항원검사랑 PCR검사랑 다른 게 뭐예요    제가 겁이 많아서 자가키트는 절대 못할 것 같아요      예전에 선별소에서 받았을 때도 너무 아팠던 기억이 있는데 사실 아픈 기억보다 분명 체감상 면봉이 제 코를 지나 눈까지 들어온  느낌이었는데 그걸 제 손으로는 절대로 못할 것 같아요        그래서 받게 된다면 신속항원검사  PCR둘중에 하나 받는 게 나을 거 같은데요 둘의 차이점이 뭐예요  그리고 신속항원검사 병원은 어디어디에 있나요   미리 감사합니다  ,이비인후과
콧물색 건강상태 확인해주세요 ,안녕하세요   대초반 여자입니다  일주일전 감기가 심하게 와서 감기약 먹으면서 좀 괜찮아진다 싶었는데  이틀  전부터 코를 풀면 엄청 덩어리진  그런 느낌의 찐한 노란색 콧물이 나와요     콧물에다가 노란색 물감을 쨍하게 발라놓은 것처럼 색이 정말 노랗습니다   원래 콧물색은 투명색이지 않나요     혹시 건강에 문제가 있는 건가 걱정이 되어서요 콧물색 노랗게 덩어리져서 나오는 게 큰 문제가 될까요   ,이비인후과
