0,1,2
코로나 타지역에서 걸리면,안녕하세요 현재 서울에 있고 집에 내려가기 전 자가진단키트 해봤는데 양성떠서 내일 pcr검사받기 전에 궁금한 점 질문남겨요  요즘은 자가격리 집에서 한다고 하는데 전 서울에서 지낼 곳이 없는데 보통 이럴 경우엔 병원에서 지내나요  그리고 제가 프리랜서로 활동하는 중인데 코로나 지원금은 얼마정도 나오나요 ,이비인후과
자가진단 키트 버릴 때,자가진단 키트에 들어있는 가이드 종이도 비닐 안에 밀봉해서 같이 버려야 되나요 ,이비인후과
귀 뚫은뒤,제가 원래 염증이 있었다가 치료하고 좀있다 다시 뚫었는데 그후 오늘 갑자기 귀가 이렇게 붓고 아픈데 왜이렇고 어떻게 치료할수있나요 ,이비인후과
귀 뚫은 곳 고름 ,귀 뚫은 지 한달 됐어용  이제 바꿔 줄 시기가 됐는데 아프지도 않은데 귀걸이 안에 뭐가 있어요   안에 뭔가여  병원을 가야하나요   ,이비인후과
코로나 오미크론 후유증,오미크론 후유증 얼마나 가나요    진심 걸렸을때보다 후유증이 더 아파서  ,이비인후과
코로나 걸릴 확률,제 친구가 친구 지인이랑   일에 같이 하루 자고   일에 헤어지고   일에 다시 만났고   일에 저랑 한번 만났는데 친구 지인이 코로나 양성이 이틀전쯤에 떳고 제 친구도 지금 코로나 양성 거의 확정인데 제가 걸릴 확률 있을까요,이비인후과
인후염인가요    ,목젖뒤로 인후   에 스크레치가 나있어여   피가 많이 나있는데 이비인후과 선생님    도와주세용,이비인후과
코로나 감기,열은 없는데 목에 이물감이 느껴지는 느낌이 있었는데 저녁되니 심해졌어요 기침도나고 목소리도 쉰느낌   자가키트 했는데 음성 나왔어요 코로난가요  낼 학교가도 되나요 ,이비인후과
귀 빨개지고 열감이 있습니다  질병일까요 ,최근 한달 간 종종 아무일도 없는 상황에서 귀만 빨개지고 화끈화끈하며 열감이 있습니다   당황스럽거나  추운데있다 와서든가 하는 것과 상관없이   화끈거리고 열이 나는것 같은 느낌 외에 아프다거나 하지는 않습니다  특이한 건 귀가 빨개질 때 귓바퀴 윗부분만 빨개지고 귀 아래는 그냥 그대로입니다  사진첨부 항상 이런방식으로 빨개져요   뭔가 문제가 있는 건지 궁금한데 질병일까요  병원을 가야한다면 어디로 가야할까요  ,이비인후과
오미크론 양성,제 친구가 오늘 수업도중에 아버지가 확진이시라는 문자를 받고 조퇴했었거든요  근데 제가 걔랑 친해서 가까이서 대화도 많이 했었단 말이에요   엄청 막 끌어안은 급은 아니고 살짝 툭툭 치긴 했어요  물론 KF   마스크도 철저하게 쓴 상태에서 했고 걔랑 있을때 한번도 마스크는 안벗었어요  자리가 멀어서 대화는 아마 길어봤자 모두 합쳐서      분 정도밖에 안될거예요 그래도 만약에 걔가 확진이라면 저는 감염 확률이 얼마나 있죠 요즘 오미크론 때문에 난리라는데   지금은 아직 하루밖에 안돼서 잠복기가 지나봐야 알겠지만 열도없고 목도 멀쩡해서 증상이 하나도 없어요  혹시 내일도 저는 등교해야 될까요 말아야 될까요   최소  일 정도는 쉬었다 가야할까요 ,이비인후과
코로나 타지역에서 걸리면,안녕하세요 현재 서울에 있고 집에 내려가기 전 자가진단키트 해봤는데 양성떠서 질문남겨요 지낼 곳이 없는데 보통 이럴 경우엔 병원에서 지내나요  그리고 제가 프리랜서로 활동하는 중인데 코로나 지원금은 얼마정도 나오나요 ,이비인후과
입을 크게 벌리면 딱딱 소리가 나요,제목 그대로 입을 하품하듯 크게 벌리면 딱딱 소리가 나고 침삼킬때 마다 귀가 좀 먹먹해요,이비인후과
코로나 증상 ,원래 목에 가래가 약간 꼈을때 피씨알 검사해서 음성받고 한참 지나고 갑자기 아침에 일어났는데 목에 가래가 많이 끼고 목이 부운듯 아팠어요 일주일정도 됐는데 이틀 간격으로 자가키트 두번했는데 정확한 음성이였어요 그냥 감기일까요  말곤 증상 하나도 없습니다 내공   ,이비인후과
코로나 양성인가요 ,하자마자 봤을땐 음성나왔는데     분있다가 보니까 이런데 그냥 번진거겠죠  ,이비인후과
목에 이물감,기침 콧물 가래 증상은 없는데 목에 이물감이들고 침 삼킬때 약간 아프긴한데 이게 무엇인가요   일주일전 몸살 왔을때는 오른쪽처럼 적었는데 시간이 지날수록 점점 더 커져요 약으로 치료가능하면 약도 알려주시면 감사하겠습니다,이비인후과
역류성 식도염 증상,요즘 목이 계속 칼칼하다가 아 그 칼칼하기 전에는 알바하다가 그 쓴물 역류한 적은 있구요    요즘은 숨쉴 때 목 안쪽에 솜이 걸린거처럼 불편하고 계속 기침이 하고싶어저요 신속항원검사는 음성으로 떴는데 아까부터 코도 막히고 불편해요 열도 아예 안나는데 코로나는 아니겠죠     목은 거의 이주 전부터 아팠는데 처음 아파서 검사할 때도 음성이고 월요일에 검사했을 때도 음성나왔어요 그리고 오늘 렌즈를 끼긴 했는데 지금 눈이 너무 아파요 이건 상관없는가겠죠  잘 때도 제가 끙끙 앓았다는데 숨쉴 때 불편해서 그런거같아요 목소리도 잘 안나오는데 이게 역류성식도염일까요  저희 엄마도 역류성식도염이 있고 요즘 패스트푸드집에서 알바해서 햄버거 세트를 자주 먹긴 했어요,이비인후과
코로나 음성인데 의심 증상 결석 인정 되나요 ,열 나고 목 칼칼하고 가래 있는데 계속 검사하면 음성 나와서요  그렇다고 양성인데 아직 음성 뜨는 것일 수도 있고 특히 열이   좀 걸려서 결석을 해야할 것 같은데 인정 되나요  아님 질병결석으로 되나요 ,이비인후과
코로나인가여,오늘 개학해서 kf   마스크 중형 쓰고 학교 갓어요 급식시간 빼고 벗지는 않았는데 약간 떠있는 부분이 있었던 것 같기도 하고    그런데 점심시간 지나고나서부터 머리가 약간 아프고 목소리가 이상해졋다가 목이 간질간질하고 아프더라구요 집와서 자가진단키트 하니까 음성 나오긴 햇어요 근데 제가 잔걱정이 너무 많은 편이라 계속 불안한 느낌이라  약먹으니까 머리아픈거 빼곤 아까보다 나아진 것 같긴 해요 어제 밤부터 좀 춥다고 혼자 뭐라 하기도 했고 아침에도 밥먹다가 추워서 따뜻한 방 가서 먹었거든요 그냥 단순한 감기겠죠   며칠 전에 어디 나간 건 동물병원에서 사람 아무도 없는 진료실 안 대기하는 자리   거기에 혼자 마스크 쓰고 있다가 혼자있을때 몇초정도 벗은것밖에 없어요 그때도 kf   썼어요,이비인후과
자고 일어나면 입안에 너무 건조해요,한 이주일 전부터 입을 벌리고 자는걸 느꼈는데 자고 일어나서 혀를 만졌을때 침이 말라있어요 그리고 침에서 이상한 맛이 나요 그레서 침을 뱉으면 가래처럼 침이 하얗습니다 그리고 멍때리거나 게임을 할때 무의식적으로 입이 벌어집니다 원인은 무엇이고 어떻게 하면 고쳐질까요,이비인후과
 발음 교정,제가 혀가 짧은것도 전혀 아닌데 혀짧은 소리가 난다고 자주 듣고 어눌하다는 소리도 들었어요 다른 발음은 할때는 편하고 잘되는데  발음만 제가 듣기에도 어눌한거같아서 스트레스입니다   설소대가 길지도 않았는데 이거라도 하면 좋아질까해서 설소대수술을 했어요 의사선생님도 굳이 안해도 되는데 할거냐고 하셔서 결국 했거든요 처음엔 기분탓인지 몰라도 수술하고나서 편해진거 같았는데 시간지나니까 똑같더라고요 책을 소리내서 또박또박하게 많이 읽으면 발음 좋아질수있나요   발음 고치는법 알려주세요 부탁드립니다  ,이비인후과
목소리가 자주 쉬어요 ,말을하다가 갑자기 쉰 목소리가 나다가 좀지나면 괜찮아지고하는 일이 하루에  번  번씩 있다가  오늘은 평소보다 오랫동안 목소리가 돌아오지 않고있어요    목에 머가 꽉낀 느낌이 나구요   병원가봐야할까요 ,이비인후과
축농증수술 받아보신 분 계신가요  축농증수술 후기 궁금합니다 ,안녕하세요   대 후반 직장인 여성입니다  제가 어려서부터 축농증증상이 있었는데요   나이가 들면 들수록 증상이 심해져서 코골이도 생기고 입으로 숨을 쉬니까 목도 자주 마르고 일상생활이 너무 불편하더라구요   이제 곧 환절기인데 환절기 때는 너무 힘들어서 짜증도 많이 나고 신경이 너무 날카로운 수준이라  계속 두면 더 심해지고 안 좋아질 것 같아서 축농증수술을 알아보게 됐는데요  제가 정확한 정보가 없어서 그러는데 혹시 축농증수술 하신 분 중에  축농증후기 알려주실 분 계실까요    아니면 축농증 수술에 대해 잘 아시는 분이라도 답변 부탁드립니다     진행 방식  수술 후 통증  관리법 등 자세히 알려주세요   ,이비인후과
아이 소아축농증은 어떻게 해야할까요   , 살 여자아이를 키우고 있는 맘입니다    년전 저희 딸아이가 축농증이 있단 말을 들었는데요  심하지 않아 보여서 신경을 못써줬는데 이게 제일 후회됩니다     요즘 들어서 아이가 자주 큭큭거리면서 콧물을 목으로 삼키는 듯한   소리를 많이 내더라구요    코도 자주 막히고 답답하다고 말하기도 하구요 제가 빨리 조치를 취했어야 했는데 너무 후회되네요   주변 유치원 맘들에게 들어보니 지금이라도 늦지 않았다고 병원에 가보라고 해서 알아보려는데 소아축농증은 치료가 어떻게 되나요   그리고 소아축농증 같은 경우 어른들처럼 이비인후과에 가야 하는게 맞을까요 ,이비인후과
어른축농증 궁금합니다 ,며칠 전 감기에 걸렸는데  코로나 증상이랑 구분이 안 가 일단 자가 격리를 했었는데요  이제 좀 괜찮아 졌나 싶어서 회사에 출근을 했는데 광대뼈 밑이 너무 아프고 코 안쪽도 너무 답답하고 가래 도 끼는 것 같은 느낌이 들어요 가래를 뱉어도 시원하게 나오지도 않고   아 그냥 너무 증상이 답답하더라구요    혹시 이게 코로나  오미크론  뭐 이런 걸 까봐 걱정이었는데 회사 동료 말로는 축농증 증상이라고 하더라구요   원래 축농증 증상이 전혀 없었는데 어른축농증이 갑자기 생길 수도 있는 건가요  제가 축농증에 대해서는 아는 것이 없어서요   만성이 되기 전에 초기에 잡으려고 하는데 어른축농증 같은 경우에는 이비인후과에 가면 약물치료로 금방 나을 수 있나요 ,이비인후과
환절기감기 너무 걱정입니다 치료법좀 알려주세요  ,환절기때마다 감기 때문에 고통받는 직장인입니다    하    제가 얼마나 환절기감기로 고통을 받냐면요   지금 딱 환절기잖아요  주머니  가방에 휴지가 없으면 절대로 안되구요   아예 돌아 다닐 수가 없음   출근길 전철안에서 코가 흐르면 진짜   마스크를 벗어서 풀 수도 없고 너무 짜증나고 고통스러워요    저처럼 환절기감기로 고생하시는 분들 어떻게 하고 다니시나요   치료하신 분은 있나요     치료 하고싶은데 환절기감기 치료법 좀 알려주세요  ,이비인후과
코물혹제거 하신 분 있으신 가요 ,제가 얼마전 병원에 갔다가 코물혹제거 수술을 해야 한다는 말을 들었는데요  평상시보다 코가 더 많이 막힌다고만 생각했지 코물혹은 생각도 안해봤고 코물혹제거 수술하는 것도  아예 생각이 없었거든요     일단 병원에서 말씀해주신 거니  코물혹제거는 해야 한다고 생각은 하는데 제가 살면서 수술을 받아본 적이 없어서 너무 무서워요        코물혹제거 많이 아플까요      수술 후에 관리는 어떻게 하셨어요     일상생활은 바로 할 수 있나요  제가 회사도 가야해서요    답변 부탁 드립니당  ,이비인후과
급성비염인 거 같은데  만성으로 발전하진 않겠죠 ,안녕하세요   대중반 여자입니다  요즘 들어 코가 자주 막히고 콧물이 정말 물처럼  주르륵 흐를 때가 있는데 급성비염일까요    급성비염을 놔두면 만성비염으로 발전된다 하는데  이미 증상이 발생한지 꽤 된 거 같아서 걱정되네요    급성비염은 어떻게 만성비염으로 발전하나요     혹시 제가 이미 만성비염이 된 건지 알 수 있는 방법이 있을까요   답변 부탁드려용   ,이비인후과
어린이비염치료 도와주세요   , 살여자아이를 키우고 있는데요  딸아이가 요즘 계속 코를 훌쩍이고 코막힘 때문에 자주 칭얼 거리더라구요   요즘 코로나 때문에 자가키트도  번 해봤는데 음성이 나왔구요   무엇보다 열이 나지 않기 때문에 코로나는 아닐거라 생각 하는데요   저희 동네 맘카페에서는 이게 어린이비염증상이라고 하더라구요   아직 나이가 어린데 비염이 생겼다니 걱정도 되고   어린이비염으로 치료받으려면 소아과보다는 이비인후과에 가야겠죠   제가 첫아이라 정보가 별로 없네요      어린이비염 치료법 잘 아시는 분 도와주세요   ,이비인후과
비후성비염이 뭔가요 ,비후성비염  만성비염  아직 둘중 뭔지 잘 모르겠는데 제가 작년부터 코도 자주 막히고 재채기도 자주하고 간혹 흘러내리는 콧물 증상도 있는데요  비염증상인 건 알고 있었지만 제가 병원에 잘 안가는 타입이여서   방치를 했는데 더 심해진 것 같아서요   특히 밤에 자려고 하면 거의 코가 제기능을 못할 정도로 막혀서 입으로 숨을 쉬는데 입이 너무 바짝 마르고    잘 때 숨쉬는 게 힘드니까 잠도 많이 설치게 되더라구요   병원에 가려고 했는데 어떤 분은 급성비염이다   또 어떤 분은 비후성비염 일수도 있다는데 도대체 비후성비염이 뭐죠     처음들어보는 비염인데   비후성비염증 이랑 제 증상이랑 비슷한가요     잘 아시는 분 답변 부탁드립니다 ,이비인후과
저 비후코염인걸까요  수술만이 답인가요   ,비염이 정말 많이 심한   대남자입니다  비후성비염 진찰을 받고 유산소운동이 좋다고 들어서  유산소운동도 꾸준히 해주고 코에 스프레이도 뿌리고 해볼 건 다해봤는데요 지겹도록 나아지질 않습니다    여전히 코막힘도 심하고 콧물에    재채기에   좋다는 걸 다해봤는데도 차도가 없는 걸 보면 비후코염인 걸까요  만약 비후코염이라면 수술을 하는게 답일지요    저도 시원하게 코로 숨을 쉬고 싶습니다   ,이비인후과
비염도 유전이 될까요  급해요   ,안녕하세요 두 달 뒤 엄마가 되는   대후반 예비맘입니다   제가 곧 첫아이를 볼생각에 걱정 반 기대 반으로 살고 있는데요 오늘 갑자기 든 생각인데 비염도 유전이 될까요    제가 만성비염이 있는데요     혹시라도 태어날 저희 애기한테 비염이 유전될까 불안해서요   저도 비염 때문에 고생하고 있는데 제 아기만큼은 비염이란 걸 모르고 살았으면 좋겠어요   유전 된다거나 하지 않겠죠   너무 급해요    답변 부탁드려요   ,이비인후과
이비인후과에 가면 편도결석제거가 어떻게 이뤄지나요 ,편도결석이 눈으로는 딱히 보이지 않는데  제가 느끼기에 입냄새가 너무 많이 나는 거 같아서 이비인후과에 다녀오려 합니다    양치질도 자주 하고  축농증이나 비염  이런 것도 없는데 입냄새가 느껴지는 건 편도결석 문제인 거 같아서요   유튜브에 보니까 눈에 보이지 않고 숨어있는  그런 편도결석들도 있는 거 같은데 이비인후과에 가면 어떻게 제거해주나요   흡입 을 하는건지 아니면 면봉으로 꾹 눌러서 빼는건지     사실 면봉으로 꾹 눌러서 빼는 듯한 치료법이면 집에서 하는 거랑 다를 게 없어 보여서요  ,이비인후과
편도수술은 어떨 때 진행하는 건가요  제 증상도 함께 봐주세요 ,어렸을 때부터 목이 자주 붓는 편이라  웬만한 편도염 에는 병원을 잘 안 가거든요  근데 최근 고열을 동반한 편도염이 자주 발생하는데  시국이 이러니 코로나 증상이랑 유사해서 구분도 안되고   걱정도 돼서 편도수술을 알아보고 있어요      저 같은 경우는 최소 두 달에 한 번씩 편도염이 발생하는데  최근에는 발생할 때마다 열도 미친듯이 났어요      그럼  년에 약    번 정도 편도염이 생긴다는 건데   이럴 경우에 편도수술을 진행해도 괜찮나요  어떨 때 진행하는 건지 모르겠어서요    ,이비인후과
편도수술나이는 몇 살부터 가능한지 궁금합니다 ,저희 딸이   개월 정도 되었는데요   최근 열이 자주 올라서 병원에 가니 급성 편도염 진단을 받았습니다    아직 너무 어려서 의사소통이 잘 안 되긴 한데  우는 경우가 많아졌고  찡얼거리거나 기침을 하는 경우도 잦아졌습니다    초반에는 항생제 받아서 먹였는데   항생제도 너무 많이  자주 먹으면 아이한테 안 좋다는 말을 들어서요   그럼 편도수술밖에는 답이 없을 거 같은데  편도수술나이는 몇살부터 가능한가요   저희 애처럼 어린 경우에도 편도수술나이 상관없이 안전하게 받을 수 있을까요  ,이비인후과
편도절제해도 목 기능엔 이상 없나요 ,어머니가 편도절제 수술을 받으신지 일주일 좀 넘으셨는데요   아직 많이 불편해하시고  목 쪽이 아프다고 하시네요      병원에서는 수술 잘 됐다고  문제없다고 하는데  일주일이나 지났는데 아직도 고생하시는 게 마음에 좀 걸려서 글 남겨요    편도절제 했을 때 목에 이상이 생길 가능성이 있나요  있다면 어떤식으로 부작용이 나타나나요    어머니가 저보다 더 힘들고 걱정도 많으실 거 같아서   이렇게라도 전문가들의 도움을 받고 안심시켜드리고 싶습니다    ,이비인후과
소아편도수술 할 때 유의사항은 따로 없을까요 ,아이가 이제 막  살이 되었는데  편도가 비대하다고 해서 소아편도수술 날짜를 잡아놓았습니다    병원에서는 별 다른 말이 없긴 한데  혹시나 하는 마음에 소아편도수술 시 따로 주의해야 하거나  조심해야 할 부분이 있는지 싶어서요  그냥 평소처럼 지내다가 소아편도수술 받으러 가면 될까요  ,이비인후과
만성중이염 증상과 급성중이염 증상은 어떻게 구분하나요 ,제가 며칠째 중이염 때문에 일상생활이 너무 힘든데요   일단 급한대로 약처방 받고 먹고 있는데 나아질 기미가 보이지 않습니다      급성중이염이 심해지면 만성중이염으로 커질 수 있다고 하는데 만성중이염과 급성중이염은 어떻게 구분하나요      지금 제가 만성중이염인 거 같기도 하고     중이염 기간이 일주일 이상 넘으면 그냥 만성으로 치부되나요 ,이비인후과
만성중이염 원인은 어떤 게 있을까요    ,귀에 통증이 심하고  몸에 열도 나서 이비인후과에 갔는데 만성중이염이라는 진단을 받았어요      그냥 중이염도 아니고   만성중이염이라고 해서 좀 놀랬는데  갑자기 만성중이염이 된 까닭이 뭐가 있을까요    제가 감기에 잘 걸리긴 하는데 이게 영향이 있는 건지     만약 감기가 영향이 있다고 하면   감기랑 중이랑 무슨 연관이 있어서 중이염에 걸리는 건지 궁금해요   ,이비인후과
만성중이염 치료를 받으려 합니다  통증 없이 치료가 가능한가요 ,만성중이염 치료 때문에 고민입니다   지금도 건들이기만 하면 아프고  귀에 고름이 나오는데 만성중이염 치료를 받을 때 혹시나 자극이 되어 더 심해지진 않을까 걱정됩니다    약치료는 받고 있고요  약은 꼬박 꼬박 챙겨 먹고 있습니다   다만 만성중이염이여서 그런지  잘 낫지 않는 게 문제입니다    병원에서는 약물치료가 잘 듣지 않으니 수술적 치료를 고려해보자고 말하는데   수술 과정 및 치료 후에 통증 없이 만성중이염 치료가 가능한가요  ,이비인후과
만성중이염 수술 궁금해용   안 하면 어떻게 되나요 ,안녕하세요    대 초반 여자입니당  만성중이염 때문에 수술을 고민하고 있는데요   저는 되도록이면 수술을 안 받고 싶은데  병원에서는 수술받는 쪽이 좋다고 하셔서용     혹시 수술을 받지 않고 일반 치료만 진행하면 만성중이염을  영원히 치료할 수 없는 건가여         제가 또 중요한 시험을 앞두고 있어서     만성중이염 수술 후에 후유증이 있으면 안 되거든요      혹시 만성중이염 수술 안 하면 어떻게 되는지랑 수술 후 후유증이 심한 지  안전한 수술인지 알려주실 수 있나용     ,이비인후과
소아중이염 때문에 아이가 많이 아픈 거 같아요 항생제 관련 문제로 질문 드립니다 ,안녕하세요  저희 아이는  살이고요   아이가 계속 울길래 처음엔 소아과에 데려갔는데 귀에 문제가 심한 거 같다고  이비인후과에 가보라고 하시더라고요    이비인후과에 갔는데 소아중이염 판단을 받고 약물치료 진행하고 있는데   항생제를 아이가 계속 먹어도 문제없을지 걱정이 되어서요   그 외에 다른 약들도 아이 몸에 부담이 가진 않을까 걱정도 되고    여러모로 고민이 참 많습니다    소아중이염은 항생제를 먹어야 나을 수 있는 거지요   계속 복용해도 문제 없을까요   ,이비인후과
이비인후과 진료시 진료기구를 통해서도 코로나가 걸릴수 있나요 ,내과와 달리 이비인후과를 감기 때문에 가게 되면 코 속으로 약도 뿌리고 입속으로도 약도 뿌리고 그럽니다  문제는 앞사람이 코로나 확진자였다면 있다면 후에 진료 보게 되는 사람도      코로나에 걸리나요  한 사람 진료보고 소독하고 이걸 반복하는지는 모르겠지만 여러 사람에게 쓰면 분명 코로나 환자에게 쓴거라면 다음 사람도 걸릴것 같은데요  이비인후과 같은 병원에서는 매 환자마다 소독을 하는지 궁긍한데 이비인후과 진료 후 진료기구는 매번 소독하나요 ,이비인후과
코로나 자가진단 키트,이거 한줄인가요 두줄인가요  반투명한건 원래 있는건가요 ,이비인후과
코로나 증상에 목 아픔이 어떻게 아픈 건가요,오랜많이 말을 많이 해서 목이 아픈 건지 병 때문에 목이 아픈 건지 모르겠어요 기침은 안 나고 침 삼킬 때 이물감은 안 느껴지고 목이 그냥 아픈데 코로나일 수 있나요,이비인후과
비중격만곡증 수술 후 코로나 확진,비중격만곡증이랑 하비갑개절재술 수술한지  달 정도 됐는데 얼마 전 코로나 확진 판정을 받았어요  코가 막히는데 수술 후 아무는 과정에서 막히는건지 코로나때문에 막히는건지 구분이 잘 안가는데 혹시 코로나 때문에 막히는거라면 수술 부위에 지장이 있을까요    ,이비인후과
코로나 음성인가요  급합니다 ,자가키트했는데 c라인 살짝 오른쪽으로 나와서 음성인지 양성인지 오류인지 판단이 안서네요 음성인가요 ,이비인후과
코로나 급속항원검사,에서 양성나오면 학교에다가 어케 보고하나요,이비인후과
