0,1,2
피어싱 염증 지속,몇번 글을 올렸지만 피어싱 염증이 안사라져서 너무 힘들어요  피어싱은 진작 뺐는데 왜 그럴까요   안한귀와 비교하면 귀가 후끈하고 부어 있는것 같아요 한달동안 병원 여러군데 다니면서 약 먹었는데 안나으면 큰 병은 아니겠죠    일상이 우울하면서 너무 힘들어요 정말 안낫진 않겠죠             답변 부탁드립니다 피어싱 왜 했는지 너무 너무 힘들고 후회되요,이비인후과
왜 이럴까요 ,코로나 확진  일째이며 목이 심하게 붓고 후각 미각 상실로 음식은 커녕 물도 삼키기 힘든상태이고 어제 저녁에 힘들게 비대면 진료로 저방받은 약을 먹고 자고 일어났더니 양쪽 겨드랑이랑 가슴쪽에 두더러기인지 뭔지 피부이상반응이 생겼어요     시간 코로나 상담사에게 전화했지만 진료가 밀려 저녁이 되야 한다고 하고  확진 격리중이라 모든게 불안해서 글 올려봐요 현재 열은 없고 코막힘 콧물 기침 두통 어지러움 설사 편두통 심함 체력저하  상태예요,이비인후과
코로나 증상인가요 ,어제 학교 갔다 온 뒤로 저녁에 자고 일어나니까 목이 아프고 침 삼키면 따갑고 그러는데 약 먹으니까 괜찮아졌는데 목소리만 좀 갔는데 이거 코로나 증상인가요   ,이비인후과
저 편도염인가요   ,저 편도염인가요 ,이비인후과
제 귀가 문제있나요  ,어제 귀에서 바스락소리가 조금씩 나길래 귀 파는걸로 긁을려고 했는데 조금 세게 누른걱 같아요 오늘 어떨뗀 귀가 아프고 지금은 뭐 삼킬때 바스락 소리가 나요 왜죠    트림할때도 살짝 아프고 바스락 거려요,이비인후과
양쪽 귀통증,좀 추운날 걸으면 귀속과겉이다아팠는데요 오늘은 별로 춥지도않은데 바람좀 맞으며 십분정도 걸었는데 귀겉과속이 너무 아파서 괴로운상태에요 이비인후과를 가보긴 할테지만 미리알고싶어서요 왜그럴까요,이비인후과
코로나 양성 문자가 안와요,어제   일 오후  시경 항원검사 후 희미하게 두 줄이떠서 그 병원에서 즉시 pcr검사 하고 결과를 기다리고있습니다  양성이면 병원에서 문자 드릴겁니다  하셔서 그러려니했는데 오늘이    절 공휴일이라 병원도 쉬더라구요  그래서 양성이라고 문자가 안오는건가싶고    보건소에도 계속 전화해봤는데 전화를 받지 않네요  오늘 결과가 나와야 내일 대학교 개강을 어떻게 해야할 지 할 수 있는데 넘 답답해서요    원래 이렇게 늦게 나오는건가요  아니면 공휴일에는 문자가 따로 오지 않는건가요    답변 부탁드립니다 ,이비인후과
확진자 학생 동거인 자가격리,누구는 등교해도 된다  등교하면 안 된다 말이 계속 다르길래 헷갈려서 다시 한번 글 올렸습니다  확실한 답변 부탁드려요   오늘 같이 사는 가족 중 한 분이 확진 판정을 받았습니다  저는 내일 개학을 앞둔 고등학교  학년이고  백신은  차까지 맞았습니다   접종 후    일 지남  이럴 때 저도 확진자와 같이 일주일 자가격리 대상인가요   월  일부터 동거인 수동 감시 인 거 아는데 학생 교직원은  월   일부터 해당된다는 기사를 봐서 여쭤봅니다  오늘이 공휴일이고  선생님이 이런 날에 연락 하시는 걸 싫어하셔서 선생님께 말씀드릴 수도 없어요  제발 확실한 답변 부탁드립니다   ,이비인후과
코로나 관련 질문있습니다 ,일요일 외출 후 월요일 점심부터 열이     까지 오르고 몸살 기운에 근육통까지 와서 급하게 이비인후과에서 신속항원검사를 하여 음성이 나왔습니다  혹시나 하는 마음에 확실히 하고자 강북삼성병원에 가서 PCR검사까지 했는데 음성이 나왔습니다   처방받은 약을 먹고 나니 오늘 아침 열은   도로 많이 내렸는데 아직 목이 부은 것 같습니다  열과 인후통 외에 근육통은 없어졌고  기침은 지금까지 한 적이 없습니다   가족 중 확진자는 없고  지인 중에는 확진자가 있었지만 만난 적은 없습니다    혹시 신속항원검사 및 PCR검사에서 음성이 나왔는데도 코로나일까요  증상이 대체로 오미크론 증상과 유사해서 PCR 검사가 음성으로 나와도 불안하네요 ,이비인후과
귀 먹먹함,어제 아침  점심부터 귀가 먹먹했다 안했다를 반복해요  시간에 한  번은 반복하고 누워있으면 더 그래요  그리고 오늘 아침에 일어나보니까 오른쪽귀는 아예 그냥 먹먹해졌더라고요  현재 왼쪽은 먹먹했다 안했다를 반복하고 있어요  이거 왜 이러는걸까요  이 증상에 이름이 있다면 이름이랑 이러는 이유랑 병원을 가야할지 안할지 좀 알려주세요    살 남자입니다,이비인후과
코로나 확진 후 편도염     농양인가요 ,미접종자 경로미상 공기중 감염같은데요 어릴적 독감때나 걸렸던 편도염이 나이  에 걸렸네요  구내염인가요 편도염인가요 하얗게 곪은 부분땜에 연하곤란발생중 아직 격리기간이라 가글 물로 버티는중 통증은 밤 새벽이 끔찍합니다 시작은 발열부터 두통으로 시작했고요 지금은  일정도 지났고요  하얗게 된지는  일정도 됬네요 농양인가요 병원도 못가니 미칠노릇,이비인후과
코로나 확진 가래,목에 가래 낀 느낌이들어서 기침을 계속 했는데 힘들게 가래가 덩어리진것처럼 두번 나왔고 계속 느낌이 사라지지않아 여러번 더 했더니 일반 가래만 나오고 덩어리는 안나오더라구요 계속 더 했다간 목이 안좋아질것같고 쉴것같기도해서 기침을 하고싶진않은데 가래 낀 느낌이 시간이 지나면 괜찮아지나요   왜 해도해도 느낌이 계속나고 사라지지않을까요  ,이비인후과
코로나     가능성   있겠죠   ,미열     C 목 간지러움  기침 약간 나옴    두통 조금씩 있었음 가래 조금 아침마다 한쪽 코 막힘  콧물은 아님  집에 확진자 격리중 본인  저번주 내내 검사 받았을 때마다 음성 뜸     차 맞고   일 안 지남  하필 개학이랑 겹쳐서 죽고싶은데 요새 광주 광역시 중학생들 등교 많이들 쉴까요      ,이비인후과
코로나 자가키트 해봤는데 이거 검사받으러 가야하나요 ,자가키트  개를 했는데 사진이랑 비슷하게 나왔어요 엄청 희미하게 검정색으로 얼룩져서 줄가있는데  이거 PCR검사 받으러 가야할까요 ,이비인후과
코로나  감기 ,제가 오늘 새벽부터 침이 안 삼켜지고 목이 아파서 자꾸 깨다가 아침에 일어나보니깐 목소리가 안나왔어요 그래서 자가키트해보니깐 음성인데 밥먹다가 열나고 머리아프고 어지러워요 저번부터 기침해서 감기였는데 열나고 그러니깐 너무 겁이나요 백신은  차밖에 안맞았어요 코로나 인가요 감기인가요      ,이비인후과
이어폰을 사용하면 외이도염이 자꾸 재발해요 병원 다니면서 이어폰 안쓰면 또 나았다가  한   분 정도 짧게 사용해도 간지러워지기 시작하면서 다음,이어폰을 사용하면 외이도염이 자꾸 재발해요 병원 다니면서 이어폰 안쓰면 또 나았다가  한   분 정도 짧게 사용해도 간지러워지기 시작하면서 다음날 진물나오고  외이도염이 재발합니다  혹시나 이어폰 문제인가 해서  이어폰 종류도 바꿔보고  캡도 바꿔서 사용해봤고요,이비인후과
피곤할때 귀가 먹먹해져요,잠을 많이 못자면 귀가 먹먹해져요 중 때부터 이랬는데 이제 고등학생이라서 잠을 많이 잘 수가 없어요   하품할때 잠시 귀가 먹먹해지잖아요 그 먹먹한 게 계속 유지돼요      막 제 숨소리만 크게 들리고 그래여   이거 이비인후과를 가야하나요 글고 왜 이런 증상이 자꾸 나타나나여 ,이비인후과
귀에서 두두두 소리,재수하고 있는 사람입니다 왼쪽 귀 고막 파열로 인한 고막패치술 했고 고막패치술 한지  개월 됬습니다 그런데 일주일전부터 왼쪽 귀가 아닌 오른쪽귀에서 잠들기전에 귀에서 두두두 고막을 건드리는듯한 두두두 소리가 계속 납니다 병원에 갔더니 그렇게 신경쓰일 정도 아니면 그냥 내비두라고 하는데 지금은 이명 지속 시간이 좀 되고 항상 자기전에만 그러는데 왜 그러는걸까요 정말 궁금합니다    ,이비인후과
PCR 음성확인서랑 신속항원검사 음성확인서 랑 차이점이 뭐죠 ,차이점이 있나요 ,이비인후과
코수술후담배,안녕하세요 제가 코수술한지 년이지났는데 얼마전 집에말티푸라는 털이안날리는 강아지를 키우는데 제가 동물털알레르기가 있다보니 만약알레르기에 감염되면 코모양변형이올수도있을까봐 걱정이됩니다 부디 답변부탁드립니다     코수술 달반차에 흡연을 했었는데 그게 영향을 주어 모양변형이왔을수도있나요   달반정도뒤면 크게 이상이올정도는아니죠  당시코속에상처가조금 있었는데 흡연후에 방문했을때 코속상처가거의다나았었다하더라구요 근데 그사이에 모양변형이생겼을까봐 걱정이됩니다  ,이비인후과
외이도염  병원 또 가긴 이르겠죠 ,외이도염이 재발해서 어제 병원을 다녀왔는데 귀청소도 하고 약도 처방 받았습니다  아무튼 약을 먹으니까 자기전까진 훨씬 괜찮은 기분이얐는데 오늘 자다가 깨보니 어제 아침 그대로 귀 주변에 진물이 살짝 흘러나와이 고 염증이 차서 귀가 물이 들어간걱처럼 꽉 막히고 먹먹하고 귀 주변   작은 두통도 있는데   약은 이틀치 처방 받아서 아직 있거든요   가렵고 답답하긴 해도 일단 약 다 먹고 차도를 보고 다시 가야겠죠   그리고 제가 원래 외이도염이 생긴 방향을 밑으로해서 옆으로 자는 버룻이 있는데 외이도염에 안좋을까요  그리고 혹시나해서 말하자면 그쪽 고막에 작게 구멍도 생겼다고 하셨습니다 ,이비인후과
코세척 통증,알레르기 비염이 있어서 코 세척을 늘 해왔는데  어제부터 코 세척을 할 때 코가 너무 아픕니다   눈물이 줄줄 날 정도로   그리고 하고나면   분 정도  한동안 갑자기 코 안에서 마치 신발 밑창을 태운 것 같은   이상한 냄새가 납니다    왜 갑자기 너무 아프고 이상한 냄새도 날까요   평소에 할 때는 아무렇지 않거나  아프더라도 약간 따가운데  정도입니다   평소보다 콧물이 더 난다거나 이런 추가 증상도 전혀 없는데 왜 이럴까요      ,이비인후과
누우면 귀에서 심장소리가 납니다, 일전부터 자려고 누우면 왼쪽귀에서 심장소리가 납니다 혹시 수술을 해야하나요 ,이비인후과
비중격이 휜건가요 ,코수술을 할 예정인데 원래 코 한쪽으로만 숨을 쉬긴 했지만 큰 불편함을 느끼진 않았어요 콧물도 매운거 먹을 때 빼곤 딱히 안났구요 근데 이게 비염이라고 하더라구요 그래서 코수술 할 때 기능코  미용코 수술 같이 할까하는데 사진상 비중격이 휜거고 비염이 있는건가요 ,이비인후과
비중격 만곡증 수술   ,심한편인가요    수술을 해야할지 궁금해요 하비갑개만 해도될꺼요   ,이비인후과
턱 밑 멍울,안녕하세요  월 일에 턱 밑 멍울로 이비인후과에 내원해서 초음파 검사를 받은   세 남자입니다  당시 의사선생님께서 크기가     정도라 정상범위라 걱정안하셔도 된다고 하셨습니다  그렇다면 저는 초음파 검사를 몇개월에 한 번씩 받아야 하는 건가요  ,이비인후과
코로나인후통,진짜너무아파요죽고싶어요어떡하죠 도      두    ,이비인후과
비대칭교정,어렸을땐 안 그랬는데 성인이 될 무렵부터 시작해서 비대칭이 생겼어요 코가 남들이 알아볼정도로 휘어져가지고 이비인후과가서 수술했지만 비대칭이 너무 심해져서 더 이상은  자로 못 만든다고 하더라구요   그리고 두상이 어른쪽 왼쪽 위치가 좀 달라요 이것도 비대칭에 일부분인가요  구강악안면외과 가면은 안면얼굴이랑 두상 비대칭인것도 잡아주나요  양학 뼈 깍는 수술은 안할겁니다,이비인후과
수술 필요할정도로 비중격만곡증인지 이비인후과 전문의님들의 답변원해요,하비갑개절제만 해도될까요  비중격 만곡증 심한지 봐주세요    ,이비인후과
식염수 코세척,제가 오늘 코세척 했는데 아  소리내면서 양쪽 다하고 휴지로 양쪽코 살짝 흥흥 하고 다햇는데 가끔 코에서 식염수 물이 나오는데 괜찮은건가요 ,이비인후과
제가 목감기에 걸렸어요   ,제가 목감기에 걸린것같거등요    근데 병원을 가기엔 저희집 근처에 사는 친구들이 양성이에요    그래서 나가기 좀 꺼려지는데 그래서 일부로 집 후끈후끈하게 해놓고 땀 흘리는 중인데 이렇게 덥게하구 몸 따듯하게하면 쫌이라도 빨리 낫겟죠  집에잇는 콜대원도 같이 먹구있습니다  ,이비인후과
목 림프선염,목에 림프선염 왜 생기는 건가요  ,이비인후과
코성형  주차 비중격에서 피나는것 같아요   , 주전에 코끝 귀연골    콧대 실리콘    절골   비염수술   비중격만곡증 수술 을 했습니다   비염수술을 한 경우  코 안에 실리콘 부목을 댄다고했고   일차에 병원에서 코 안 실리콘 부목을 제거했습니다  코 안 부목을 제거하고 부목이 있었던 곳인 코 안 비중격   벽을 보았더니 세로줄 형태로 출혈이있더라구요  피 색은 딱 빨간색이였습니다   검븕은색   그리고 코 안쪽과 코 주변이 시리고  정말 점성이 강한 큰 콧물 덩어리 투명한 콧물과 검붉은색 피가 섞인 콧물 들이 나옵니다   눕게 되면 이러한 콧물들이 목구멍으로 자꾸 넘어가요      병원에서 코세척을 자주하라고해서 하루에    번 정도 코세척을 하고 있습니다    이런 증상들은 회복과정이라고 보면 될까요    염증이리도 생길까봐 너무 무서워요    ,이비인후과
급해요 제 목소리  성대가 갑자기 이상해요   ,진짜 삼십 분 전까지만 해도 괜찮았는데 갑자기 말하려고 하니까 노래방에서  시간 열창하고 쉰 목소리 같아요 그때도 이렇게까지 쉬지는 않았는데 어떡해요     마치 초딩 남자애들이 변성기 오기 전 같이 막 갑자기 변했어요 참고로 저 여자입니다 평소에 목소리 낮은 편도 아니에요 어뜩해요   ,이비인후과
목구멍이 건조해서 서로 붙어 숨을 못 쉬는 경우 응급처치,안녕하세용 어머니가 목이 건조 해 목구멍이 달라붙어 숨을 못쉬는 일이 벌어졌습니다  어찌어찌 아버지가 조치를 취해 무사하셨는데 저랑 단 둘이 있을 때 일이 생기면 제가 어떻게 해드려야 할지 모르겠더라구요    도움이 필요힙니다      아주 드물게 일어나지만  저럴 때 마다 숨을 못쉬셔서 정말 공포스럽습니다  ,이비인후과
편도에 구내염 같은게 있다,어제부터 왼쪽 편도가 빨게졌는데 편도에 구내염   이 생겼어요    침 삼킬 때 이물감 들고 조금 따가운데 이거 언제쯤 나아요   ,이비인후과
코털 짧게 자른 후 목아픔,어제 가위로 코털을 좀 짧게 잘랐는데 오늘 아침에 일어나니까 코로 먼지가 많이 들어갔는지 목이 칼칼하고 아파요   내일도 이러면 병원가야될까요 아니면 그냥 집에서도 마스크 쓰면 괜찮아질까요 ,이비인후과
귀 한쪽 먹먹함,제가 에어팟 사용을 많이 하는 편인데 어제 왼쪽 귀가 막힌 듯한 증상이 있었어요 그런데 따로 이명이 들린다던가 제 목소리 타인의 목소리가 울리게 들리지는 않았어요 그리고 오늘 일어나보니 괜찮아진 것 같은데 다시 에어팟 사용해도 괜찮을까요 피곤해서 일시적으로 생긴 증상일까요,이비인후과
코로나 확진 귀 이명,며칠전 확진 판정을 받고 재택치료 중 입니다  기침이 심할뿐 콧물은 없었는데요  자꾸 오른쪽 귀에서 바람소리인지 뭔지 뭔가 고막을 툭 치는 소리    가 반복적으로 들립니다 그리고 왼 오른쪽 귀 둘다 간질간질하고 아플때가 있어요  단순 코로나 증상 중 일부일까요 ,이비인후과
편도 결석,제가 몇 달 전부터 편도 결석이 생겼는데 혼자 이쑤시개로도 해보고 편도결석 제거기도 써보고 핀셋으로도 해봤는데 어렵고 피가 나는 경우도 종종 있고 빼낸다 해도 엄청 힘들게 빼내왔었거든요 기분 탓인지는 모르겠는데 구멍의 크기가 점점 커지는 것 같기도 하고 그대로인 것 같기도 하고 제 편도결석 구멍 크기가 큰 편인가요  상태가 어떤지 궁금해요  ,이비인후과
편도결석제거,편도결석때문에 가만히 있어도 목에 이물감이 너무 심하고 헛구역질까지 나는데 가글하고 기침도 크게해봣는데 안빠져서 면봉으로 뺄려고 하면 헛구역질이 너무 심하게 나는데 병원에 가서 빼는 방법밖에 없나요  그리고 가래가 엄청 심하게 끼는데 편도결석하고 관련이 있나요 ,이비인후과
뺨을 살짝 때렸는데 순간 귀가 먹먹한 느낌이 들었습니다 ,제가 잠을 깨기위해 뺨을 살짝 때렸는데 순간적으로 귀에 아무것도 들리지 않는것 처럼 먹먹한 느낌이 들고 귀 부분 피부 감각도 둔해지는것 같았습니다   몇분뒤 사라지긴 했지만 그림 속 위치의 핏줄이 갑자기 만져지기 시작했습니다  병원에 가봐야 하나요 ,이비인후과
코 안 이물질 청소법,다들 코 안 이물질 어떻게 청소하세요   저는 원래 휴지로 코를 풀거나 했는데 이것때문인가 코 밑쪽에 세균이 감염되서 모낭염이 나네요  ,이비인후과
혀밑에 뭐가 났습니다 사진 징그러울수 있어요 ,이게 뭔가요 호두 아이스크림을 먹다가 뭐가 있어서 호두가 낀줄알고 봤더니 이런게 생겼더라구요 동그라미치고 화살표고 가리킨 부분입니다,이비인후과
하비갑개 축소술 이후 귀 물찬 느낌,오늘 하비갑개 축소술을 하고 현재 침을 삼킬때 수영장에서 귀에 물이 들어간 느낌이 드는데 정상인가요 ,이비인후과
편도절제술 콘택콜드 소코렉신,다음주 월요일에 편도절제술을 하는데 콘택골드 소코렉신 복용해도될까요 ,이비인후과
비염환자 질문,원래 비염을 가지고잇었는데 감기에 걸려서 모노넥스라는 약을 처방받았는데 코에 뿌리니 되게 시원하더라구요 그래서 감기가 나은 후에도 모노넥스 계속 뿌려도 되나요   년  년이렇게,이비인후과
코피가 너무 자주나고 출혈량이 많아 이비인후과에 갔는데 피가날때 와야한다네요 대기실에서 진료대기하다가 코피가 멈췄는데 이럴땐 어디병원으로 가야,코피가 너무 자주나고 출혈량이 많아 이비인후과에 갔는데 피가날때 와야한다네요 대기실에서 진료대기하다가 코피가 멈췄는데 이럴땐 어디병원으로 가야 원인을 알수있을까요 ,이비인후과
코 골절 수술후 재채기,골절수술받은지 하루가 지났습니다  재채기가 계속 나오는데 다시 부러지는게 아닐까 걱정됩니다  재채기를 할때마다 코속이 찡하고 수술후 코에 넣었던 솜이 앞으로 나오는게 느껴집니다  재채기를 막을수도 없고   떻게 관리하면 좋을까요    ,이비인후과
귀지가 자주생겨요,그래서    달에 한번씩 이비인후과에 가는데 항상 귀지가 꽉차있다 하더라구요     정상인가요 이거      달 마다 가야하고 갈때마다 기본  만원씩 나오고 힘드네요  귀 파거나 관리 하는건 하나도 없구요 그냥 평소에 귀에 손 아예 안댑니다  정말 고민이에요  ,이비인후과
코 세척기 사용,자기 전에 보통 진행하는데요  분명 반대 코로 물이 잘 나오고 하는데도 계속 막혀있는 느낌이 나고요 자려고 누우면 갑자기 코피가 나듯이 물이 흘러나와서 그 순간에는 좀 뚫리는 것 같아요 원래 이런 건가요 ,이비인후과
코피가   ,안녕하세요   아침에 샤워하다 코피가 났는데 좀 많이 어지럽던데 어떤 증상이 있을까요 ,이비인후과
콧속이 항상 부어있는데 제거가 가능한 부위일까요 ,코감기 걸리면 콧속이 붓고 콧물로 꽉막혀서 답답해지잖아요 근데 저는 감기가 아닐때도 이렇거든요 이거 왜이러는걸까요 저렇게 부어잇어서 양쪽 살이 맞닿아잇어서 이물감이 항상 느껴지고 재채기가 나오거든요 숨쉬기는 저기서 더 붓거나 하면 저쪽은 막혀서 한쪽으로만 쉬어내는 그런         이거 고칠 수 있나요 ,이비인후과
귀가 아픈데요,제가 밖에서 산책 하는데 한  분 지나니까 귀가 먹먹하고 따끔거리듯이 아프더라구요 이거 왜 그런거죠,이비인후과
비염수술 후 로아큐탄 피지조절제  복용, 월   일에 비염수술을 했습니다  비중격 교정술  하비갑개 절제술  비밸브 재건술을 했는데   주정도 지난 현재 로아큐탄 피지조절제  복용해도 되나요   안된다면 어느 기간정도 복용하지 말아야 할까요 ,이비인후과
편도염   ,안녕하세요 원래 이맘때쯤에 편도염 잘걸리고 그랬었는데    일 지나면 괜찮아졌었거든여 근데 이번에는 약도 꾸준히 챙겨 먹고 했는데도 거의 일주일째 낫기는커녕 더 심해지기만 하고   하 그리고 평소 편도염 걸렸을 때는 하얗게 물집   그런것들 생겼었는데 이번에는 그런것도 없고 왼쪽에만 빨갛게 부어올랐어요    진짜 침삼키는것도 힘들고 밥은 물론이고 양치도 제대로 못하겠고 귀까지 중이염 걸린것처럼 너무 아파요     대체 언제쯤 나을까요      너무 무섭습니다  ,이비인후과
고막에 검은색 무언가가 있어요,고막 사진 첨부합니다 혹시 카메라 문제가 아닐까 반대쪽 귀도 확인했는데 반대쪽은 멀쩡한데 이쪽 귀에 저렇게 검은색 반점    같은게 있네요 저게 뭔지 알 수 있을까요 ,이비인후과
편도 상태 좀 봐주세요,목이 계속 칼칼하고 아프면서 기침이 꽤 심하게 나서 편도 상태가 어떤 지 궁금하네요  오늘 병원 갈 시간이 없어서 여기다 여쭈어봅니다  열심히는 찍었는데 잘 안 나와서 보이실 지는 모르겠지만 답변 남겨주시면 감사하겠습니다 ,이비인후과
외이도염 있는 상태에서 고막에 구멍이 있으면,큰 문제는 없을까요 한쪽 귀 외이도염이 심해져서 병원에 갔는데 귀청소 해주시고 보시더니 구멍이 나있다고 하시더라구요  뭐 외이도염 치료하고 하면 웬만하면 알아서 아물거다고 하시긴 했는데 염증이 고막안으로 들어가서 문제가 되거나 할수도 있나요  그리고 귀 먹먹한건 그대론데 이건 고막에 구멍때문에 그런걸까요 ,이비인후과
비중격만곡증 수술 후 피가래,비중격만곡증 수술과 편도절제 수술을 한 지 두 달 다 되어가는데 아직도 아침마다 코가래를 뱉어보면 이렇게 피가 나옵니다 평상시에는 이정도는 아니고 조금씩 나오긴 하는데  코딱지도 많이생기고 그런데 정상인가요   어디가 잘못된걸까요 ,이비인후과
비중격 만곡증 수술,비염이 심한데요 비중격만곡증 수술도 해야할지 하비갑개 수술만 해야할지 고민이예요 만곡증이 하비갑개 비대의 원인이 될정도로 심해서 수술을 해야할지 봐주시면 감사하겠습니다 그리고 다른분들 시티보다 저는 비중격이 엄청 얇아보이는데 이유가 있는지도 궁금해요,이비인후과
코세척 귀 막힘,오늘이 코세척  일차인데요 코세척 할때는 막 귀로 물이 가거나 막히는 듯한 느낌이 들지는 않는데 하고 나서 코 막고 힘주면 귀 쪽에서 물이 고여있다가 뚫리는듯한  느낌이 드는 건 왜 그런 거죠  코세척을 잘못해서 그런건가요 아니면 원래 처음 할 때는 다 그런건가요,이비인후과
편도선수술했는데  인후염  ,제가 오늘 이비인후과에 다녀왔는데   인후염 이라고  해서 약받아왔는데요 어렸을때 편도선수술을 받았는데   인후염에걸릴수있는건가요  ,이비인후과
하이코 제거,안녕하세요  하이코 부작용으로 필러만 녹였는데 실도 이물감으로 불편해요 실제거를 코안쪽 절개로 하신다는데 제거후 코모양이 변형될까요   흉도 생기는지 궁금해요  ,이비인후과
