0,1,2
만성중이염 원인은 어떤 게 있을까요    ,귀에 통증이 심하고  몸에 열도 나서 이비인후과에 갔는데 만성중이염이라는 진단을 받았어요      그냥 중이염도 아니고   만성중이염이라고 해서 좀 놀랬는데  갑자기 만성중이염이 된 까닭이 뭐가 있을까요    제가 감기에 잘 걸리긴 하는데 이게 영향이 있는 건지     만약 감기가 영향이 있다고 하면   감기랑 중이랑 무슨 연관이 있어서 중이염에 걸리는 건지 궁금해요   ,이비인후과
만성중이염 치료를 받으려 합니다  통증 없이 치료가 가능한가요 ,만성중이염 치료 때문에 고민입니다   지금도 건들이기만 하면 아프고  귀에 고름이 나오는데 만성중이염 치료를 받을 때 혹시나 자극이 되어 더 심해지진 않을까 걱정됩니다    약치료는 받고 있고요  약은 꼬박 꼬박 챙겨 먹고 있습니다   다만 만성중이염이여서 그런지  잘 낫지 않는 게 문제입니다    병원에서는 약물치료가 잘 듣지 않으니 수술적 치료를 고려해보자고 말하는데   수술 과정 및 치료 후에 통증 없이 만성중이염 치료가 가능한가요  ,이비인후과
만성중이염 수술 궁금해용   안 하면 어떻게 되나요 ,안녕하세요    대 초반 여자입니당  만성중이염 때문에 수술을 고민하고 있는데요   저는 되도록이면 수술을 안 받고 싶은데  병원에서는 수술받는 쪽이 좋다고 하셔서용     혹시 수술을 받지 않고 일반 치료만 진행하면 만성중이염을  영원히 치료할 수 없는 건가여         제가 또 중요한 시험을 앞두고 있어서     만성중이염 수술 후에 후유증이 있으면 안 되거든요      혹시 만성중이염 수술 안 하면 어떻게 되는지랑 수술 후 후유증이 심한 지  안전한 수술인지 알려주실 수 있나용     ,이비인후과
소아중이염 때문에 아이가 많이 아픈 거 같아요 항생제 관련 문제로 질문 드립니다 ,안녕하세요  저희 아이는  살이고요   아이가 계속 울길래 처음엔 소아과에 데려갔는데 귀에 문제가 심한 거 같다고  이비인후과에 가보라고 하시더라고요    이비인후과에 갔는데 소아중이염 판단을 받고 약물치료 진행하고 있는데   항생제를 아이가 계속 먹어도 문제없을지 걱정이 되어서요   그 외에 다른 약들도 아이 몸에 부담이 가진 않을까 걱정도 되고    여러모로 고민이 참 많습니다    소아중이염은 항생제를 먹어야 나을 수 있는 거지요   계속 복용해도 문제 없을까요   ,이비인후과
이비인후과 진료시 진료기구를 통해서도 코로나가 걸릴수 있나요 ,내과와 달리 이비인후과를 감기 때문에 가게 되면 코 속으로 약도 뿌리고 입속으로도 약도 뿌리고 그럽니다  문제는 앞사람이 코로나 확진자였다면 있다면 후에 진료 보게 되는 사람도      코로나에 걸리나요  한 사람 진료보고 소독하고 이걸 반복하는지는 모르겠지만 여러 사람에게 쓰면 분명 코로나 환자에게 쓴거라면 다음 사람도 걸릴것 같은데요  이비인후과 같은 병원에서는 매 환자마다 소독을 하는지 궁긍한데 이비인후과 진료 후 진료기구는 매번 소독하나요 ,이비인후과
코로나 자가진단 키트,이거 한줄인가요 두줄인가요  반투명한건 원래 있는건가요 ,이비인후과
코로나 증상에 목 아픔이 어떻게 아픈 건가요,오랜많이 말을 많이 해서 목이 아픈 건지 병 때문에 목이 아픈 건지 모르겠어요 기침은 안 나고 침 삼킬 때 이물감은 안 느껴지고 목이 그냥 아픈데 코로나일 수 있나요,이비인후과
비중격만곡증 수술 후 코로나 확진,비중격만곡증이랑 하비갑개절재술 수술한지  달 정도 됐는데 얼마 전 코로나 확진 판정을 받았어요  코가 막히는데 수술 후 아무는 과정에서 막히는건지 코로나때문에 막히는건지 구분이 잘 안가는데 혹시 코로나 때문에 막히는거라면 수술 부위에 지장이 있을까요    ,이비인후과
코로나 음성인가요  급합니다 ,자가키트했는데 c라인 살짝 오른쪽으로 나와서 음성인지 양성인지 오류인지 판단이 안서네요 음성인가요 ,이비인후과
코로나 급속항원검사,에서 양성나오면 학교에다가 어케 보고하나요,이비인후과
귀지 처리방법,귀에 바스락바스락거리면서 근질근질 딱 귀지 느낌이예요    기분같아선 그냥 당장 파버리고싶은데 건들면 귀에 좋지 않다고 들어서 이도저도 못하겠어요 어쩌죠  ,이비인후과
돌발성 난청 질문,돌발성 난청에 걸리면 고막이 제대로 움직이지 않나요 ,이비인후과
외이도염인가요 ,유튜브 볼때나 소리듣는것에는 문제가없는데 제가 말할때 소리를치거나 크게말할때 왼쪽기가 욱신거리고 음식을 먹을때도 욱신거려요,이비인후과
편도선 부음,어제부터 목이 조금씩 부으면서 아프다가 오늘 학교를 가고나서부터 더 심해졌는데 어떻게 해야하나요  학교를 안가기도 그렇고  학원 때문에 병원갈 시간이 없어요 ,이비인후과
동생이 미결정인데,막내동생이 양성이고 저희 가족 다 했는데 둘째가 미결정 통보 받아서 질문드려요  혹시 저도 등교를 못하나요  둘째는 재검사 하고 나서 결과 받고 나가는게 맞는데 저는 어떨게해야할까요 ,이비인후과
편도제거수술 통증, 일차인데요 진짜 통증이 너무 심해요  저 아픈거 잘참는데 진짜 이건 너무 아파요  귀도 엄청아프고 치통도 있어요  어제부턴 약먹어도 효과가 없어요  목이 너무 아파서 약삼키기도 너무 힘들고요    입술에는 구내염까지 있어서 물같은거 입술에 닿으면 너무 아파요  누가 목을 주먹으로 쎄게친거 같고 귀는 고막을 찢는 기분이에요  동네 이비인후과가서 주사라도 맞으면 괜찮아지나요   이거 어떻게 참아요  밥도 두숟가락먹고 우유 몇모금밖에 못먹어요,이비인후과
비중격만곡증 수술후 부목 빼는 통증,비중격만곡증 수술  일차 입니다  수술 후  일차때 솜을뺐고   일차때 부목을 빼러 갔습니다  뺄려고 하는데 너무 아프고 치아 앞니가 너무 아팠습니다   확 빼면 기절할거 같은느낌   그래서 선생님께 너무 아프다고 말했어요  그럼  일후에 다시 빼자고 말했습니다      원래 부목을 뺄때 치아가 아픈건가요       선생님께 국소마취 하고 빼달라고 하면 해주시나요  ,이비인후과
코골절질뮨,코를 박아서 정형외과를 갔는데 이비인후과랑 별차이없나요  별이상 없어보이는데 아프면 ct찍자하는데 꼭 이비인후과를 갈필요는 없는거죠  ,이비인후과
비중격 만곡증 수술,제 상태는 수술 받아야겠죠     그리고 오른쪽 귀가 먹먹하고 콧물도 나오고 오른쪽 눈만 좀 흐리게 보이는데 축농증인가요    년전에 수술했는데 다시 재발할수있는건가 궁금합니다,이비인후과
축농증 치료,안녕하세요 축농증때문에 고생하다가  년 반 전쯤 축농증 수술을 했습니다  수술 후 어느정도 호전되었으나 요즘에도 코가 막히고 콧물이 나며 특히 식사하면 코가 막혀서 식사 하다가도 화장실 가서 코를 풀고 오는 경우도 있습니다  축농증 완치할 수 있는 방법이 없을까요  그리고 원인과 예방법이 있다면 알려주시면 고맙겠습니다 ,이비인후과
하비갑개절제술  비중격만곡증수술,제가 조만간 하비갑개절제술이랑 비중격만곡증 수술을 받으려합니다  한번할때 제대로 딱하고싶은데 어디가서 하는게 좋을까요  관리 수술실력    비용 이러한것들은 고려해서요  그리고 저  가지 수술을 하면 수술한날 바로 퇴원하나요  입원을 며칠해야하나요  또 비용은 최소 최대 각각의 비용과 수술후 관리는 얼마나 드나요 ,이비인후과
목이 너무 따끔거리고 아파요,파란색으로 표시한 부분이 뭘 삼킬 때 계속 따끔거리고 쪼이는 느낌이 들면서 아파요    따끔거리는 느낌이 들면서 귓구멍 속도 같이 아파요    요즘들어 가래도 자주 뱉어요,이비인후과
한쪽 코가 막혔는데,막혔는데 이 막힌 코 방향에 코에서 목으로 넘어가는 느낌이 계속나요 제가 신경성 역류성 식도염이 있는데 찾아보니 후비루 라네요 지금 식도염약을 따로 먹고있는데 후비루 같은 경우는 어떻게 해야하나요 가습기 트나요    ,이비인후과
역류성 인후염 진단 후 상기도 부음 및 통증,어제 목 아래부분 이 아파서 이비인후과에서 역류성 인후염을 진단받았는데요   의사선생님께서 설명해주실 때 얼굴과 가까운 목 위쪽 통증은 감기나 코로나 증상에서 통증이 있고 붓는 경우가 있지만 아랫부분이 붓는 경우는 역류성 인후염이기 때문에 다행히 코로나는 아니다고 말씀해주셨습니다   그런데 하루 약을 먹고 자고 일어나니 목 윗부분이 부은게 명확히 느껴지면서 침을 삼킬 때 이물감이 있고 기존의 목 아랫부분 통증은 사라졌습니다    이게 치료되어가는 과정인건지 혹은 증상과 병이 달라진건지 궁금합니다  ,이비인후과
청각과민증이 맞나요 ,물건 부딪히는소리 비닐 비비는 소리  사람 말소리가 크게 들리면 귀 안 고막 을 뭔가가 툭 치는 느낌이 나요 그리고 귀가 먹먹합니다 한쪽만 그럴때도 있고 두 쪽 다 그럴때가 있어요 목에 가래 막힌것 같은 느낌이 들어서 침을 심키면 먹먹한 느낌이 더 심해지고 가라앉는데 시간이 걸립니다 침 삼키면 또다시 똑같아져요  후비루도 있어서 침 자주 삼키는데     그리고 귀에 이명이 들리기도 하구요   병원에서 검사했지만 고막과 귀의 압력  청력  코 안쪽도 문제가 없다고 하십니다   직업상 소음에 노출이 자주 되긴합니다만 사람이 크게 말하거나 가끔가다 소리지르는  소리에 노출되긴합니다 이제 청각과민증이 맞는지요  ,이비인후과
자가검사키트 면봉으로 코를 쑤셨을때 피가 조금 묻어나왔는데 그뒤로 갑자기 코가 엄청 막히고 콧물이 계속나와요  코는 멀쩡했었는데 갑자기  너무,자가검사키트 면봉으로 코를 쑤셨을때 피가 조금 묻어나왔는데 그뒤로 갑자기 코가 엄청 막히고 콧물이 계속나와요  코는 멀쩡했었는데 갑자기  너무 답답한데 이거 왜이러죠   ,이비인후과
목에 종이가 걸렸어요,입에 종이를 대고 있었는데 너무 귀여워서 먹어버렸어요   근데 목에 걸린거 같고  이거 어떡해요 물은 먹고 있어요  ,이비인후과
목 통증이 있는데,밥 먹을 때는 전혀 안 아파요  인후통이 아닌 건가요 ,이비인후과
코로나 증상,여자친구가 이틀전부터  목이 아프다고 하는데 오늘 일어나서 목이 따갑다고 했습니다  발열 기침 콧물 두통 이런건 하나도 없고 그냥 목만 엄청 아프다고 하는데 코로나일 가능성이 있을까요 ,이비인후과
자가키트할 때 휴지에 콧물푼걸로 비벼도 되나요 ,굳이 콧구멍에 안넣고 휴지에다가 코 푼다음에 코푼휴지에 자가키트하는 면봉 그거 돌돌 돌려가지고 해도되나요 ,이비인후과
코에서 뽀글뽀글,코막혀서 숨쉴 때 일시적으로 코에서 뽀글뽀글 기포터지는 소리가 날 수 있죠   이건 천식이라던거 그런거 아니죠  ,이비인후과
코로나 확진 후 자가격리해제 전,확진   일에 문자받고 여태 자가격리하다가 내일자정에 해제인데 혹시몰라 자가키트로 검사했는데 양성인데 내일부터 해제인데 나가도 되는거에요      아기도양성 저도양성인데   다른분들은 키트도 음성뜨던데   괜히  걱정되네요,이비인후과
안녕하세요  ,제가 방금 자다가 일어나자마자 바로 귀가 가려워서 심하게 긁은것 같아요     귀가 많이 아프고 물도 나오고요   면봉으로 닦아내도 괜찮을까요  걱정됩니다  ,이비인후과
굳은밥이인두에걸렸는데어떻게해야되나요,굳은밥이인두쪽에걸렸는데어떻게해야되나요,이비인후과
그저께 밤부터 목이 간질간질 하고 모래낀듯한 답답함이랑 코가 매웠는데요 지금도 목에 이물감있어서 답답하고 코가 매워요 코도 막힌 것 같은데  ,그저께 밤부터 목이 간질간질 하고 모래낀듯한 답답함이랑 코가 매웠는데요 지금도 목에 이물감있어서 답답하고 코가 매워요 코도 막힌 것 같은데   불안해서 어제 코로나 신속항원 받았는데 음성 나왔어요  종합감기약 먹고있는데 이비인후과 가야될까요 ,이비인후과
목 안 아파지는 법 좀 알려주세요     ,지금 진짜 목 아파서 뒤질 거 같아요 침 삼킬 때마다 존나 아프고 목소리도 안 나와요 살려주세요 젭발     ,이비인후과
이석증  이명 ,요새 들어 자려고 누울때  그리고 일어날때 핑하고 돌아여   세상이 돌아요   검색해보니 이석증    증상이랑 비슷하더라고요  그리고 근래 이명도 심해요 방안에 조용히 있으면 삐  소리가 크게 나요  그리고 최근에는 설사도 자주하고 두통도 조금 있어요  생리 주기도 한달 이상으로 늘어나고  자도 자도 너무 피곤해요   얼마전에 가게를 오픈해서 몸이 고생해서 그런걸까요    병원에 가기가 왜 무서울까요    이런 증상들이 일어나는 이유는 뭘까요 ,이비인후과
이것도 이명인가요 ,  살인데 귀에서 삐소리는  학년때부터 들렸어요 근데 꾸준히 들리는게 아니고 하루는 한두번 정도 들렸다가 하루는 안들렸다가 그랬거든요 그래서 뭐 괜찮겠지 하며 살았는데  학년으로 올라오니 들리는 날도 늘고 횟수도 늘었어요 아직도 꾸준히 들리지는 않는데 들릴땐 하루에    번 들리는거 같아요 꾸준히 들리지 않아서 의심 안했는데 횟수가 느니 조금 힘든게 없지않아 있어요 일상생활에 지장이 좀 있는거 같아요 수업중에 들리면 애들 말과 삐소리가 섞여서 애들말이 잘 안들릴때가 있거든요  귀막고 있으면 조금 진정은 되는데 이거 심각한건가요    청력에 이상 없겠죠  저 청력 잃으면 어떡해요   ,이비인후과
돌발성 난청은 장비로는 알수가없나요 ,외관상 염증이 안보이고   소리테스트만하고 돌발성난청진단받았어요 신경쪽이라고  처음에 멍하고 담날 이명들리고 잘안들리고해서 약먹고 점점없어졌는데 일주일오늘 또 멍해요  멀쩡하던귀도 멍하고  이어폰을꽃아서그런거같은데  이어폰이 원인이아니래요  제가 이어폰을 끼고 누워서 자는습관이 있는데 왼쪽만주로 그렇게하는데  왼쪽이 비정상이에요  근데 왜 오른쪽도 같이 멍하는지 모르겠어요    이어폰같은데 이어폰이라면 왼쪾만그래야하는데 오른쪾은 잘들리나 가끔멍하고   원래 한쪽귀이상생기면 다른쪽도 조금 영향받는건지 ,이비인후과
돌발성난청인데 일주일지나도 멍해요 ,생기고  일후 검사받고 약먹고 해서 귀멍하고 이명은 줄고 소리도 좀 올라왔는데   주일째 또 멍하네요   ,이비인후과
돌발성 난청으로 될 가능성이 있을까요 ,  일 밤부터 한쪽 귀가 먹먹하고 웅  소리가 계속 들려서 자고 일어났습니다    일 아침에도 계속되고 살짝 어지러워서 이비인후과를 갔고 청력 검사를 했는데 오른쪽  데시벨 왼쪽  데시벨로 둘 다 정상범위이나 왼쪽 청력이 살짝 낮다고 진단을 받았습니다  이 경우엔 돌발성 난청으로 판단하지 않는다고 하셔서 일단 주사와 약만 받아왔구요   현재 증상은 청력 저하는 크게 느껴지지 않고 계속되는 이명과 살짝의 어지러움인데요  이게 청력이 크게 떨어지는 돌발성 난청으로 발전할 가능성이 있나요  아님 일시적인 현상인가요 ,이비인후과
편도 제거수술은 원하면 받을 수 있나요 ,최근 코 뒤랑 편도쪽에서 자꾸 안좋은 냄새도 나고  오래전부터 비염이랑 코 뒤 이물감으로 힘들었습니다  편도비대증 등을 진단받아서 편도를 제거하는 경우는 봤는데  굳이 진단받지 않아도 제가 원하면 편도를 제거할 수 있나요    삶의 질이 너무 떨어집니다,이비인후과
목 안에 있는 구내염 어떻게 해야 하는지    ,진짜 짜증나게    일 전 부터 목 안에 구내염이 있는데 목 없애버리고 싶을 정도로 침도 아파서 못 삼켜 물도 아파서 못 마셔 다른 음식들도 다 못 먹어    일 동안 죽만 먹고 있는데 심지어 죽도 잘 못 먹겠어서 남기고                           제일 고통스러운건 사람의 침은 입안에차기때문에 수시로 삼켜줘야 하잖슴  그게 제일 아파서 죽을 것 같은데   따뜻한 물 마시래서 물만 주구장창 마시고있고  그 삼키는 약 같은 경우엔 매우 고통스러울 거 같단말이지   직접 바르는건 안 보이기 때문에 할 순 없고 그냥 삼키는 약이라도 사서 먹어볼까요 ,이비인후과
목감기 편도결석,목감기 걸릴때마다 목에서 노란 알맹이가 한두개씩 나오는데 이것도 편도결석인가요  편도결석이 원래 목감기랑 같이 오는건가요  그리고 너무 불편하고 거슬리는데 아무리 찾아봐도 거울로 봤을때 보이지가 않을정도로 항상 깊은곳에 생기는데 빼는방법있나요,이비인후과
오미크론 인후통,    일 아침에 일어날 때부터 목이 부은 느낌이 들어서 그날 밤 자가키트 해보니깐 음성나왔습니다  그리고     일 아침에 목이 많이 부은 느낌이 나서 약국가서 약을 사와서 밥먹고 약을 먹으니 몸에 힘이 안들어가는 느낌이 났는데 혹시 오미크론일까요   목만 부은 느낌이고 물이나 음식을 먹을때는 따갑거나 아프지 않아요 열도 없구요   ,이비인후과
목이 쉬었는데 왜 이럴까요 ,목이 부었으면 모르겠는데 목은 하나도 안아프고 코만 막히는데요 목이 쉬었어요 몸살기운이 좀 있는데요 무슨 이유일까요 ,이비인후과
부비동염 치통,전 자동차 히터를 앞유리쪽으로 바람이 나오게 끔 하면 바로 부비동염이 재발하는 케이스 입니다     얼마전 히터를 앞유리쪽으로 틀었더니 또 바로 담날부터 우측 얼굴이 아프고 우측 위 맨끝 어금니 치통도 같이 오네요    어제는 맨끝쪽 잇몸도 같이 부어 음식물 씹는데도 많이 아파요  지금은 목 뺨도 같이 아푸네요  늘 가는 이비인후과가 있는데 거기 오늘 다 마감이 되었다고     그래서 지난번에 처방해준 약이 좀 남아 있는데요  메이액트정 아스타펜정 세로나제정 스토가정 이렇게 있는데 복용하면 좀 잇몸염증 같은게 가라앉을까요  지금 제일 불편한 부분입니다 ,이비인후과
양성 자가격리후  일치 약다먹고 안나아요  ,저같은 경우가 드문가요 좀 애초에 쌔게걸리긴햇는데   살 남자입니다     아침점심저녁 제때제때 일치 약다먹었음에도 뭔가남아있네요   저같은 경우가드믄가요 ,이비인후과
코로나 질문,   증상이 발현되고 몇일까지 다른 사람을 감염시킬수 있나요 대략   ,이비인후과
편도염인가요  사진 ,목에 통증이 있는데 보니까 저렇게 한쪽이 튀어나온건지 부은건지 동그랗게 보이네요 편도염인가요  아님 목이 부은건지 멀쩡한간지 궁금합니다,이비인후과
코로나 자가키트,친구가 확진을 받았는데 그 친구랑 제가 계속 같이 있었어서 자가키트 검사를 했고 음성이 나왔습니다 근데 지금 목도 아프고 콧물도 있고 PCR을 받고 싶은데 자가키트가 음성이면 PCR은 못받는건가요 ,이비인후과
보청기 구입 방법,안녕하십니까  저희 아버지 청각있어 연세   세 오른쪽  급 완쪽  급 장애 있습니다 지금현제 오른쪽 보청기 사용하고 있는데도 잘 못듣고 있어서  고름 흐르 있고 소독하고 하고 있습니다 무슨 보청기 구입해야는데  어떤것 사용하나요,이비인후과
코로나 확진,어머니가 저번주 수요일에 제가 다음날인 목요일에 아버지 형이 오늘 확진 판정을 받았습니다 저는 목요일에 격리가 해제되는데 아버지랑 형은 다음주 화요일에 해제가 되잖아요 그럼 저도 화요일까지 더 격리해야 되나요  금요일에 약속 있는데 만나면 안되나요 ,이비인후과
편도염 코로나  , 일전부터 갑자기 침 삼킬때 목이 너무 아프고 열도나고 두통이 심했는데 코로나 인 줄 알고 너무 무서워요 유튜브 보니까 편도염 인후통 과 비슷한 증상이더라고요   혹시 저 편도염인가요  사진으로 찍어서 잘 보이지는 않은데 차라리 편도염이면 좋겠어요   코로나가 제발 아니였으면 좋겠네요   자가키트로 양성이 나와서      사진에 편도 부은게 잘 안보일 수도 있어요 저 편도염인가요  빠른 답변 부탁드려요 채택 해드립니다  ,이비인후과
치료 해야하는 귀 염증인가요,만지면 아파요,이비인후과
에어팟 프로 사용하다가 귀 염증,에어팟 프로 요즘에 자주 사용하면서 귀에 자극이 되었는지 귀에 딱지 같은 게 앉았는데 저건 그냥 시간 지나면 없어지나요  아니면 병원 내원하는 게 나을까요  만지면 좀 따갑게 아프네용   ,이비인후과
코로나 자가키트 양성 후 병원 진료,코로나 자가키트 양성 나오면 바로 pcr 검사 받으러 가는거 아닌가요  주변인이 자가키트 양성 나왔는데 병원 진료 본 다음 pcr 검사를 받으러 간다네요  무슨 서울대 김윤 교수가 그렇게 하라고 했다면서   양성인거 숨기고 그러면 안되는거죠  오피셜로 나온 답변 부탁 드리겠습니다  내공    걸게요,이비인후과
인후염이란,원인과예방법좀알려주세요 증상도알려주시고요    ,이비인후과
후두   검사    ,오늘 이비인후과에서 후두   검사한다고   카메라달린까만호스같은걸 코로넣어서 목을   봤는데  너무아팠습니다   이제  코로 검사하는거는 트라우마생길거같아요    다음에 또 받으라고하면  두번은 이거못할거같은데   코로하는거말고  다른방법이없을까요     ,이비인후과
일어났는데 귀막힌 느낌,일어나서 씻고 머리빗는데 소리가 귀가 막혀져있고 딴걸로 듣는듯한 느낌이 들면서 소리가 굉장히 작구요 이제는 왼쪽귀에서 바람빠지는 소리나요   이거 뭐죠   ,이비인후과
귀 파다가 귀파개 놓쳐서 귓속으로,말그대로 사진처럼 생긴 쇠파개인데 살짝 무게가 있는 귀파개예요 어제 제가 혼자 판게 아니라 타인이 파주다가 실수로 귀파개를 손에서 놓쳤는데 그게 귓구멍안에 그대로 떨어져서 어디를 찔럿는지는 모르겠지만 아팠어요  막 피가 나거나 그런게 아니라 놀라서 그런지 머리가 아프고 찔러진 부위가 살짝 따가운 느낌이더라구요 자고 일어나면 괜찮아 지겠거니 생각했는데 아침에 자고 일어났을땐 괜찮았는데 낮잠 자고 일어나니 찌름당한쪽 머리만 아프고 반대쪽은 안아프네요   이게 자고 일어나서 머리가 아픈건가요  피가 난것도 아닌데 왜 한쪽머리만 어지러울까요 계속 신경써서 그런가요        ,이비인후과
코로나 밀접접촉자 인가요,친구가 이사를 가게 돠어서 잘 곳이 없어 제 집에서 같이 잤는데요       어제       자가진단 키트로 검사해보니까 양성이 떠서 바로 pcr 검사 받았는데 오늘      양성이라고 떴다고 해요 그럼 저는 밀접 접촉자 인가요 ,이비인후과
귀가 먹먹해요,갑자기 왼쪽 귀가 먹먹해요   살인데 에어팟 자주 끼는 편이고 오늘부터 이랬어요 혹시 이관기능 장애 일까봐 무서워요 내공    줍니다 제발 알려주세요 이관기능장애 이면 어떻게 해야하나요 ,이비인후과
코로나 걸리신분 타액 주세요,제발요 주시면  만원 바로 드릴게요,이비인후과
