0,1,2
귀에서 치지직 소리가 끊임없이 들려요,평소에도 자주 삐이이 하는 이명이 들리는 편이지만 이런 소리는 처음이라 두려운 마음에 질문해봅니다  갑자기 삐이익 하는 이명이 들리길래 평소처럼 귀를 막고 침을 삼켰거든요  그러면 이명이 멈췄던적도 몇번 있어서  근데 갑자기 그 티비 잘못틀었을때 노이즈 화면이랑 같이 들리는 치이이이이이이익 같은 소리가 한쪽 귀에서 계속 들리는거에요   보통 좀 시간이 지나면 멈추는데 이 소리는 계속 들리고 귀를 막아도 들리네요     병원을 가야겠죠   괜찮을까요  ,이비인후과
귀에서 웅웅거리고 이상해요,자고있었는데 갑자기 오른쪽 귀가 웅웅거리고 귀 안에서 파리가 막 장난치듯 들어갔다 나갔다 하는 거 같았어요  웅웅거리는 소리는 오토바이 시동 거는 소리랑 똑같았어요  막 숨도 못 쉴것 같았고 귀도 너무 아팠는데 무의식중에 고개를 흔드니까 괜찮아지더라고요  진짜 파리는 아니었구요  지금은 계속 귀에서 삐소리가 멈추지 않고 들리고 귀도 너무 아파요    오른쪽만 그러더라고요    이거 괜찮은 걸까요 ,이비인후과
코에서 피가 딸기잼처럼,방금 씻다가 코를 풀었는데  피가 섞여서 나오던데 병원을 가봐야 할까요     좀 더러운 얘기지만 불규칙적으로 섞인 게 아닌  완전하게 섞인 듯 아예 딸기잼같이 나오더라구요  몇 주 전부터 환절기라 심한 비염으로 이비인후과를 다니면서 약을 처방받았는데 더 심해지는 느낌이 나더니 열흘 전 쯤 이비인후과 선생님이 급성축농증이라고 하시더라구요 약은  일치 먹고 다시 오라고 하셨는데 다 먹고 개인 사정으로 병원을 못 간지 일주일 정도 됐어요 증상은 제가 느끼기에는 코가 막히는 건 많이 호전됐고 목으로 가래처럼 넘어오는 건 늘었구요  코에 통증은 없는데 주중에는 병원 갈 시간이 없을 듯 해서   빨리 병원을 가야 할까요    아님 돌아오는 주말에 가도 될까요   ,이비인후과
코로나 인후통,현재 코로나 인후통으로 인해 트로이앤텍 스프레이 인 후두염 스프레이 를 사용하는데 사용해서 문재 될 건 없나요  현재 병원에서 주는 약도 먹고 있습니다,이비인후과
혹시 설암인가요    ,저게 지금 한달찌 안낫고 있는데 아프기도 아프고 밥먹을때도 조금 불편한데 설암은 아니겟죠 저번에 이비인후과 갓다왓는데 안나으면 조직검사해봐야된다고 한다던데   ,이비인후과
수면무호흡 코수술 후,저희 아버지가 수면무호흡 때문에 코수술을 하고 오셔서 피가 나는데 누워있어도 되는걸까요  앉아서 고개 숙이고 잇으니 피가 뚝뚝흘러서 지금은 누워계신데   피가 목뒤로 안 넘어가려나요  ,이비인후과
충농증,코속에서 용종이 생겨서 한두달전에 작은 동네 병원에서 수술해서 때워냈는 데 수술후에도 내시경으로 보면 그자리자극이 남나요 ,이비인후과
코 관련에서요    ,코가 빨간고요 붓고 통증있습니다 병원에갈려고하고있는대요 혹시 이비인후과가야하나요,이비인후과
말귀가 어두워요,그래도 한 몇년 전까지만 해도 그럭저럭 잘듣는 편이었는데요  최근    년간  정확한 날짜는 사실 가물가물한데 아무튼 사람이 하는 말을 알아듣기가 힘들어졌습니다   분명 소리 자체는 제대로 들려오고 이명이 들린다거나 하는 것도 없는데  처음과 끝을 제외하곤 그 부분의 기억만 날아간것처럼 희미합니다  이건 귀의 문제일까요  다른 정신적인 문제일까요 ,이비인후과
입술안쪽 검은종기 or 흑종 혈종   ,안녕하세요  입술안쪽에 검은색 반점같은 종기가 발생된것을 어제  인지하였습니다   색깔이 완전 검정색에 가까운데 점이라기보다는 안에 피나 농이 있는거 같습니다   하얀색 입병은 많이 봤어도 입술을 깨문적도 없는데  혈종이 생긴건지 다른 병인지 알고 싶네요   사진 첨부 합니다 ,이비인후과
인후염 스프레이가 목에 상처를 낼 수 있나요 ,인후염 스프레이를 하루 이틀  정도 쓴 거 같은데 오늘 오전에 양치하면서 가래를 끌어뱉었는데 피가 조금 섞여나왔었어요  그리고 저녁에 신속항원검사 후에 코가 얼얼했는데  결과는 음성  피맛이 나더니 가래를 끌어뱉으면 피가 좀 더 나와요  목이 약간 부어있고 피곤한거 말고 몸에 이상이없는데 일시적으로 이럴수 있는건가요  이럴 때는 가래를 끌어서 일부로 뱉으면 안되는건가요  내일까지 이러면 어느 병원에 가봐야할까요 ,이비인후과
귀 이비인후과 약처방없이 귀막힘 귀에샴푸,귀 약 연고 약 처방없이 귀가막혔는지 갑자기 안들리는데요 샴푸물들어가고 면봉 감염인지   연고나 약 좀 도와주세요 알려주세요    ,이비인후과
이비인후과에서 귀지제거 후 귀 먹먹 증상,얼마전에 면봉 이용 후 면봉을 사용핬던 그 귀를 베개쪽으로 해서 잠을 자다가 일어났는데 압박으로 인해 귀가 막혔었던거 같습니다  그래서 한쪽 귀 청력저하 중세가 있었으며  약간의 통증이 있었고  부은 느낌도 있어 한    일 정도 집에 있던 항생제 복용 후  결국 이비인후과 가서 귀지빼고 썩션을 했습니다  그 후 귀 통증도 없고 청력도 다시 돌아와서 다 나은줄 알았습니다  그런데 하루밖에 안되서 약간의 통증 다시 유발되더니 또 먹먹하기 까지 합니다   물론 그 전 같이 심하진 않지만 그래도 비행기 탔을때 느낌 듭니다   귀 염증 생긴쪽 말고 정상이었던 다른 귀도 뭔가 살짝 먹먹해진거 같기도 하고   양 귀가 들리는게 밸런스가 안맞습니다   썩션이 잘못된걸까요  왜 이러는지요   걱정됩니다  ,이비인후과
편도수술 후 음식 ,편도수술 월요일에 했고 내일이면 토요일이니까  일차입니다 특수장비  로 해서 다른사람보다는 통증없이 수술했고 또 잘 참았는지 저는 고통이 적은편같습니다 수술당일 포함 아침에 잠깐 아픈거 제외하고는 거의 안아프며 죽 삼킬때도 목넘김이 힘들다 까지만 있고 아프진않아요 내일 초밥  도전 할려고 하는데 제가 아무리 고통없이 잘 삼킨다해도 목에는 무리가 가니 참는게 나을까요  아니면 먹을 수 있으면 굳이 안 참고 먹어도 될까요  잘게 씹어먹을예정  ,이비인후과
정상 편도,목이 칼칼하고 자꾸 가래끼는데 정상편도인가요  ,이비인후과
음식을 먹다가 트름을 하였는데 음식이 코쪽으로 역류했습이다   매운 음식이였는데 코 위쪽으로까지 역류한,음식을 먹다가 트름을 하였는데 음식이 코쪽으로 역류했습이다    매운 음식이였는데 코 위쪽으로까지 역류한 느낌이였고 순간 뒤통수와 코와 머리가 너무 아팠습니다    지금은 괜찮은데    괜찮은거 맞겔죠   ,이비인후과
