0,1,2
코로나 걸리고 싶음,안녕하세요 저 현재 중학생인데 제친구들 다 걸리고 심지어  년지시 친구놈이 걸렸는데 걔랑 라면도 먹고 서로 한입씩 교환도 했는데 자가키트는 음성이라네요  머리도   지럽고 목소리고 이상한데 열은 안나요 쉬고 싶은데 코로나 걸리는방법 없을까요,이비인후과
편도 사이즈 어떤편이죠   편도수술 ,편도 수술 하려했었는데 개인사정이 생겼어서 못했는데 다시 할까하는데   할만한 정도일까요  사이즈가 어떤가요  편도결석 생겨서 불편해요  ,이비인후과
코로나 증상,잔기침만 며칠째 하고 있는데 코로나일 가능성 있나요  다른 증상은 없고 잔기침만 계속 하는데  ,이비인후과
밥 먹을때마다 재채기하는 이유가 뭔가요 ,밥 먹을때 하루도 빠지지 않고 맨날 재채기를 하는데 이거 이유가 뭔가요  ,이비인후과
목에 이물감,침을 삼키면 속이 울렁거리고 목에 이물감이 느껴져요 침을 뱉으면 거품으로 나오고요    대체 무슨 증세인가요  ,이비인후과
코로나  감염 뒤 후유증으로 목 이물감이 있습니다  대구   대후반 여 코로나   후유증 ,코로나 후유증으로 목과 코 안쪽이 빨갛게 부었어요   목이나 코에 이물감이 있고  콧물이나 가래가 계속 나오는데 어떻게 하면 좋을까요 ,이비인후과
편도염 인가요   ,너무아파요 코로나는 아니겠죠 ,이비인후과
오른쪽 귀가 왼쪽 귀에 비해서 잘 안 들리는거 같아요,소리가 들리긴 하는데 왼쪽 귀에비하면 좀 작게 들려요         자가치료 할 수 잇는 방법 없너요    ,이비인후과
 혐오주의  귀속안에 고막같은거에 하얀색이 붙어있네요,혹시 이상이 있는걸까요  제가 usb 귀이개로 확인해보니 이렇습니다 ,이비인후과
요즘 코가막히는데,잘때나 자고일어낭때 잠깐 막히고 평상시는괜찮은데 가래가 계속 넘어가는데 코안막햑는데 막  는이유가뭔가요 외부충격은 앖었는데 혹시 코가 낮아지거나 휘거나 그래서 그럴수기있나요  비염이나 축농증이 생기면 코가낮아지거나 휘거나 비중격이약해지거나 그럴가능성이있나뇨  그럼저는 코가낮아지거나 휘거나 약해지나요 ,이비인후과
혀가 뭐가 낫는건지 아파요,혀에  일전쯤부터 뭐가 낫는지 보면 뭐가 난건아닌거같은데 살이 들리는건지 너무 아파요   너무 아프니까 큰병은 아닐까 걱정이 되네요 이런적 있으신분 알려주세요,이비인후과
편도결석 제거기 사용시 편도에 상처가 생길 수 있나요 ,성인이 되고 편도염을 많이 겪지는 않지만 워낙 편도 크기가 크고 모양도 울퉁불퉁하여 편도결석이 많이 생깁니다   보니 면봉이나 손으로 눌러 빼는 것은 편도에 상처를 줄 수 있고 그로 인해 구멍이 더 생겨 편도결석이 많이 생긴다고 알고 있어서   검색해보니 아쿠아픽 같이 손펌프로 수압 조절을 하여 물을 쏴서 빼내는 편도결석 제거기들이 많이 있더라구요   해당 제품들중 하나를 사서 사용 중인데 효과는 한 반반인 것 같습니다  잘빠질때도 있고 아닐때도 있고    근데 해당 제거기의 수압 때문에 기본에 존재하던 구멍이 더 커지거나 상처가 생겨 새로운 구멍이 생길 수 있나요    편도가 매우 약한 부위라고 들어 상처 안날라고 하는 행위가 도리어 상처를 입히는 행위인지 걱정되어 질문드립니다   물론 내원해서 의사분들께 결석 제거 받는게 좋겠지만 예전에 한번 했다가 다른 사람보다 유독 구역질 반사가 심해서 거의 진행을 못했었어요  ,이비인후과
샤워하고나서 머리를 쳤는데 오른쪽 귀가 울려요,제목 그대롭니다 샤워하고 나와서 오른쪽 귀가 좀 먹먹한거 같아서 오른쪽 귀 위에 머리를 쳤는데 머리 안에서 북치는 소리가 나요 정확히는 귀 안쪽에서요 귀에 물 들어간것도 아닌것 같은데 어떻게 해야하나요 면봉으로 쑤시고 고개 꺾고 점프도 하고 별 지랄을 다했습니다 도와주십쇼,이비인후과
왼쪽목알맹이  초 여자입니다  의사선생님도와주세요  ,초 여학생인데 왼쪽목과머리카락이연결되는 곳에혹 같은알맹이가만져져요     다른이상은없구 누르면 악   할정도는아닌데 아파요  왜그럴까요      어떻게해야할까요  최근에 월초에오미크론을 앓았었긴한데 그거때문일수도있나요   ,이비인후과
이석증 관련 귀 먹먹함 질문, 일전에 어지러운 현상과 구토 현상 및 왼쪽귀가 먹먹한 현상이 있어 응급실 방문후 오른쪽귀 이석증이라는 병명을 진단받고  일간의 입원치료 끝에 오늘 퇴원을 했습니다  저염식으로 식사를 하였고 충분한 숙면을 위해 안정제와 수액을 맞았으며 이석치환술 치료를 받음  중요한게 어지러움은 어느정도 해결이 되었으나 왼쪽귀가 먹먹한건 돌아오지 않았다는 점입니다  이점이 불안해서 재차 물어봐도 시간이 지나면 돌아올 수 있으니 경과를 지켜보자는 답변뿐이고 별다른 조치를 취해주지는 않았습니다  인터넷 검색을 해보니 귀가 먹먹함은 메니에르병과도 연관이 있다고 하던데 병원에서 제 병명은 단호하게 이석증이라고 합니다  퇴원 후 통원치료로 진행하기로 하였는데 다른 병원으로 옮겨서 재치료를 받아야하는지 정말 시간이 지나면 해결이 되는것인지 여기에 대한 소견 부탁드립니다   통원 치료시 처방받은 약들의 처방서 첨부해드리니 참고 부탁드리겠습니다 ,이비인후과
자가진단 키트,맨 밑에가 첫번째 맨위에가 두번째 중간에 있는게 마지막으로 한건데 두번째한게 희미한게 양성인지 음성인지 헷갈리네요 저거 희미하게 나와서 한번 더 해봤는데 마지막꺼는 완전히 한줄만 떳구요 음성인가요 양성인가요 ,이비인후과
임파선 결절인듯 한데 가장 확률 높은건 어떤걸까요 ,안녕하세요  병원에서 초음파 검사 받은 후 나온 결과인데요  큰병원가서 조직검사 받아야 할 수도 있다네요  현재 결과로 가장 확률 높은건 뭐일까요  물론 확실한건 해봐야 아는건 아는데 그냥 확률상으로요  아직 큰병원 진료가 시간이 남아서 궁금해서 올려요 ,이비인후과
저 평범한 목감기인가요 ,보시다시피 안쪽에 따끔꺼리는 흰색 염증덩어리가 있습니다  보니까 목 안쪽에도 있더라고요   단순한 목감기인가요 ,이비인후과
코뼈 골절 질문드려요,안녕하세요 코 뼈 에 대해 질문드립니다  저번주에 골절되었습니다   의사선생님이 비관혈적 정복술  도수정복술  으로 뼈를 맞추는것도있다고 하시면서 굳이 안해도된다고는 하시더라구요  혹시 비관혈적 정복술 로 해서 뼈를 맞추는것과 아니면 그냥 냅둬서 자연적으로 뼈가 굳는것과 차이점이 무엇이있을까요   어떤게 더 뼈가 더 튼튼해질까요   그리고 각각 장단점 을 답변 해주시면 감사하겠습니다 ,이비인후과
귀가 이상해요,오늘로부터  일전 귀에서 위잉위잉 맥박 뛰는 패턴이랑 같은 소리가 토 일 월  일간 들렸습니다  하지만 오늘 은 들리지 않았고 불안한 마음에 이빈후과에 방문해 진료를 받고 왔습니다   그로고 지금으로부터  시간 전쯤부터 오른쪽 소리가 들리던 귀가 먹먹하고 소리가  개의 음으로나누어져서 들립니다   기다리면 괜찮아 지는것일지  아니면 내일 다시 병원을 방문해야 하는지 궁금합니다 ,이비인후과
귀에서 삐    소리가 들립니다,주변소리가 잘들리다가 귀가 먹먹해지면서 귀에서 삐    소리가 들립니다 짧게는 몇십초에서 길게는 수십분     일주일에 두세번 정도  제 상태가 심각한가요  개선 치료가 가능 한가요 ,이비인후과
처음에 갑자기 속이 울렁거리고 답답하고 눈 앞이 흐려지고 귀  머리  에서 삐  소리가 나고 어지럽고 머리 압이 꽉 찬 느낌이 들고 숨도 안쉬어,처음에 갑자기 속이 울렁거리고 답답하고 눈 앞이 흐려지고 귀  머리  에서 삐  소리가 나고 어지럽고 머리 압이 꽉 찬 느낌이 들고 숨도 안쉬어지다가 눈 앞이 깜깜해 진적이 있는데 두번째 때도 같은 상황에 같은 증상이 있었어요,이비인후과
귀에서 삐소리가 들려요,머리도 약간 아프고 귀가 막히고 삐소리가 들려요  이게 뭐죠 아까 엄청 심하게 들리다가 지금은 좀 작게 들리는데  ,이비인후과
저 편도결석 인가요 ,먼저 혐오스러운 사진 죄송합니다  전문가님들 보시기에 편도가 보이나요 사진에  그렇다면 편도결석 의심해봐야 하는 상태인지 궁금합니다,이비인후과
축구 코 맞음,축구하다가 바로 앞에서 공을 강하게 맞았는데 병원에 가야 되나요    코의 상태는  일된 지금 그렇게 큰 이상은 없고 하루가 지날땎  좀 부어있었다는 것 밖에 없습니다 전문인 대답 원함,이비인후과
약발이 받지 않는 부비동염    , 월초부터 우측 위 끝어금니 치아가 붓고 아파 치과에서 치주인대가 늘어나 염증이 생긴거라며 잇몸치료후 약을 복용    붓기 가라앉고 통증감소    그래도 여진통증이 지속되다가 우측 광대뼈및 우측귀통증이 생겨 지난주초에  시간 거리의 이비인후과에서 엑스레이 검사후 어금니가 잇몸안에서 썩어 있다며  발치는 아직 안해도 된다며 항생제및 진통소염제   일치 처방  치통은 없고 귀통증은 거의 사라짐 근데 안면통은 여전     두통도 동반    콧물은 맑은 콧물이 가끔씩 나고요  코막힘 후각이 좀 감퇴된 느낌입니다  전에는 약 일주일 정도 복용하면 호전이 되었는데 이번엔 약발이 안받죠  직업상 수술은 아직 못할꺼 같고 약으로 치료가 안되나요  CT찍어보면 엑스레이보다 더 현재 상태를 알수가 있을까요  왜 약발이 안듣는지   ,이비인후과
후각에 문제가 있는건가요 ,옛날부터 냄새를 잘 인지하지 못했어요 애들이 급식시간만돼면 맛있는 냄새 난다    나오나보다 하면서 말하는걸 들어도   무슨 냄새가 나나       싶고 무슨 음식인진 어떻게 유추하는건가 싶었어요  집에서 요리를 할때 뭘 태워도 탄내가 나는지도 모르겠고     엄마가 핸드크림을 사주신다는데 좋아하는 향이 있냐고 물으시더라고요 근데 생각해 보니까 딱히 핸드크림을 바르면서 향을 맡아본적이 없는것 같아요 코를 가져다 대도 잘 모르겠고     언제는 학교에서 노는데 애들이 담배냄새 개쩔다고 짜증난다고 다같이 그러면서 창문을 열더라고요    그때가 학교 공사중이었는데 공사 하시는 분들이 아래층에서 담배를 엄청 피는것 같다고     다같이 짜증내는데 전 애들이 말하기 전까지 그런 냄새가 나는지도 몰랐고 듣고 나서도 잘 모르겠었어요    제가 그냥 둔한건지 후각에 문제가 있는지 모르겠어요    냄새란게 음식에 가까이 가서 맡아보려 하면 딱  느껴 지는게 있나요 ,이비인후과
비염 관리 부탁드립니다 ,  대 초반 여성인데 비염이 있습니다  눈 간지러움까지 있어서 봄 가을에 너무 불편해요   비염이 어릴때부터 있던건 아니고 직장이 리모델링을 하면서도 근무를하다가 생기고 심해져서 코피까지 났었습니다  코피가 너무 자주나서 레이저로 지진 후 코피는 안나요   하지만 이제 임신을 하게 되면 약으로 해결하기 어려울 것 같아서 약 말고 관리방법이 없을지 궁금합니다   이비인후과 진료시에 비염이 심한정도는 아니라고 하는데 제 기준엔 힘들어요  ,이비인후과
목안에 상처가난가같아여,안녕하세요 제가목이 요즘목이 불편하고 목안이 답답하고 비나오고 그래서 병원을갓는데 재대로 진료봐주지도않고 코로나검사하고 음성나왔구요 약만 타주고 그래서   목안에 ct를 찍던 내시경 하고싶은데 안해주네요      목이 너무불편합니다   피나오고 이게 한달넘게 가는거같아요  ,이비인후과
메니에르 약,메니에르 진단받고 일주일치 약 받았습니다  현재  일 먹었고 하루 남았는데 약을 더 받아와야 하나요  상태는 노이즈낀 이명 조용할때만 들리는  빼고는 없습니다  참고로 진단받을 당시에는 어지럼증이 못움직일정도로 심했고 노이즈낀 이명과 말할때 머리가 울리는 증상이 있었습니다  질문    약 더 받아올까요     만약 약을 더 먹어야한다면 잠시 일주일정도만 안먹어도 문제없을까요  금요일에 아마 쌍커풀 수술을 할것같아서요,이비인후과
목이 칼칼해요,제가 오징어를 먹다가 오징어가 목에 걸린것같은데 계속 기침이 나오네요 알아서 빠져나오겠죠  도와주세요   ,이비인후과
 이비인후과 상악동염 질문드립니다 ,어머니께서 몇달전부터 통증이 있으셨는데 처음엔 대수롭지 않게 생각하셔서 진통제를 드시고 괜찮아 지겠지하셨는데 시간이 갈수록 점점 통증이 심해져서 대학병원에서 ct 찍은 결과  수술해야한다고 하시더라고요 코옆에 빈공간에 곰팡이균이 퍼져있어서 긁어내야한다고 하시던데 꼭 수술을 해야만 하는 상황인가요  비수술적 방법으로 약물이나 스프레이같은걸로는 치료가 안되는 부분인가요  수술하게되더라도 회복이 오래걸리나요  현재 두통과 치통까지  같이 느끼고 계십니다 진통제를 안드시면 아파하시는 상황이에요 꼭 답변 부탁드립니다  사진이 흐릿해서 죄송합니다 ,이비인후과
메네스에스정 질문,이명이있는데 귀 상태가 더 심해지는날이있고 괜찮은 날이 있어서 쭉 먹진않고 심한날에만 가끔 피디정이랑 메네스에스정을 먹는데 이렇게 띄엄띄엄 먹어도 귀에 부작용같은게 생기진 않나요 ,이비인후과
편도부은 느낌,제가 편도가 엄청 약해서 스트레스를 조금 받아도 편도가 쉽게 붓는 편이었거든요  근데 요즘은 좀 괜찮아졌었는데   주   주  전부터 그냥 하품이 아니라 약간 혀를 꼬아서 입을 벌린다해야하나  그럴때마다 편도인가 목구멍 옆쪽이 땡기듯이 통증이 있었거든요  근데 편도염 약을 그냥 집에 있던 거로 먹었는데 나아지는 건 없었고 시간이 조금 지나니까 왼쪽이 괜찮아졌는데 다시 오른쪽에 통증이 왔고 지금은 왼쪽은 약하고 오른쪽이 좀 많이 통증이 있어요    시국이 이렇다보니 이비인후과 가는것도 두렵고 그래서   어떻게 해야하나요 ,이비인후과
내공    갑상선 세침검사가 성분검사인건가요 , 일전에 오른쪽 아래에  센치 가량의 혹 있다고 했는데 물을 먼저 빼는 배액술을 하고 조직검사를 해야할것 같다고 해서 시술 진행했구요  국소마취 후 나이프로 조금 째서 하시더라구요  끝나고 보니가 주사기로  병정도 땅콩소스 농도의 색은 좀 더 진한 갈색인 액체들이 나왓더라구요 근데 주머니가 쇄골 아래쪽까지 있어서 쇄골뼈에 가려져 조직검사는 못한거 처럼 이야기를 하셨구요  뽑은 액체로 성분검사를 먼저 하고 추후에 필요하면 조직검사나 ct를 찍을 수도 있다 하셨어요  제가 궁금한게     그럼 제가 한 시술은 그냥 배액술인가요  세침검사인가요     저 액체로 성분검사를 하는것도 세침검사라고 하는건가요     보통 물혹에 원래 저런 땅콩소스같은 액체가 나오나요     액체로 성분검사 했을 때 암성분이 안나오면 앞으로 치료방향을 어떻게 잡아야하는건가요   근교 초음파 전문 병원이라고 소개받아서 갔는데 설명은 뭔가 제가 딱 이해하게끔은 안해주셔서  비용도   만원 가까이 나왓는데 이게 맞는건지 다른병원 알아봐야하는지 모르겠어요,이비인후과
비염수술 후,비염수술 한지  년 다되갑니다  수술하고  년뒤에 ct촬영하나요   년 되서 촬영한다던데 수술한 다른사람 말로는 본인은 안했다고 하던데 저도 굳이 왜 해야하는지도 모르겠어요 ,이비인후과
한쪽 귀에서 탁탁 소리,안녕하세요   한 일주일 정도 전부터  오른쪽 귀에서 규칙적인 간격으로 탁탁탁탁 소리가 나다 안나다 해요  심하진 않고 가끔 나긴 하지만 하루에 열번 정도는 들리는 것 같아요  또한 하품을 하거나 트름을 하게 되면 오른쪽 귀에만 살짝 공기가 남아서 못나가는 느낌이랄까    더 막혀있는 기분이 들어요   귀지 때문은 아닌 것 같습니다  규칙적으로 청소합니다     삐 소리 나는 이명은 심하지는 않고 가끔 나긴 합니다  근데 오른쪽이 심하게 났던지는 잘 모르겠어요  외국에 있어서 병원에 가기가 쉽지 않은데  혹시 어떤 이유 때문인지 대략 알 수 있을까요    ,이비인후과
침샘염 의심,가끔씩 사진에 표시된 부분 쪽 근육이 뻐근한 듯한 느낌이 오고  턱뼈 오른쪽 아래쯤 정말 작은 크기의 멍울이 만져지다가 사라졌는데 침샘염 증상과 비슷한것 같아서요   침샘염이 맞을까요  맞다면 음식을 먹은 후 가래가 많이 끼는데 이것도 관련이 있을까요 ,이비인후과
이하선 멍울 양성 구분   ,이하선 방향 맞을까요  그리고 손으로 누르고 멍울을 만지면 약간 물렁  한듯이 왔다갔다 거리는데 양성종양 특징일까요   그리고 엄청 동그랗습니다  약간 반원을 만지는 느낌이고 표면은 매끄럽습니다    양성일가능성이 높겠죠   통증은 없습니다 근데 살짝 그 주위 압박감이 예민해서 그런지 계속 만져서 그런지는 모르겠는데 있는거같아요 ,이비인후과
 이비인후과 상악동염 질문드립니다 ,안녕하세요 다름이 아니라 어머니께서 몇달전부터 통증이 있으셨는데 처음엔 대수롭지 않게 생각하셔서 진통제를 드시고 괜찮아 지겠지하셨는데 시간이 갈수록 점점 통증이 심해져서 대학병원에서 ct 찍은 결과  수술해야한다고 하시더라고요 코옆에 빈공간에 곰팡이균이 퍼져있어서 긁어내야한다고 하시던데 꼭 수술을 해야만 하는 상황인가요  비수술적 방법으로 약물이나 스프레이같은걸로는 치료가 안되는 부분인가요  수술하게되더라도 회복이 오래걸리나요  현재 두통과 치통까지  같이 느끼고 계십니다 진통제를 안드시면 아파하시는 상황이에요 꼭 답변 부탁드립니다  사진이 흐릿해서 죄송합니다 ,이비인후과
다형선종 삼차신경통,귀 앞쪽 이면서 광대 아랫쪽에 다형선종이 있는데 가끔씩 그쪽 턱아래가 삐릿찌릿하듯이 거슬립니다   혹시 신경쪽에 이하선 다형선종이 있으면 삼차신경통이 일어날수도있나요 ,이비인후과
귀 이관쪽 관련 질문입니다 귀 먹먹 현상 ,제 귀가 평소에는 코로 숨을 크게 들이마시면 귀가 먹먹해지듯이 막히고 하품같은 입벌리는 행동을 하면 뚤립니다  딱히 일상생활하면서 불편한 점은 없습니다  근데 감기나 몸살같은 병에 걸리면 귀속이 아프고 수시로 지맘대로 귀가 막히고 먹먹합니다  뚤리지도 않습니다  초등  학년때 처음 느꼈고 고 이 된 지금까지 유지되고있습니다  중딩때 병원가보니 귀와 코사이에 문제가 있다던데 이거 무슨 장애일까요 ,이비인후과
갑자기 귀가 먹먹해요,안녕하세요   제가 갑자기 귀가 먹먹합니다  그냥 뭔가 물속에 있는듯한  그런 느낌이에요   오미크론 증상중에 귀 먹먹 있다해서    일동안 연속 자가키트 했고  어제 신속항원검사 했는데도 음성이라 뜨네요   근데 어제부터 계속 가끔 귀가 먹먹해요  열은 안나요  머리도 그렇게 안어지럽구요  설사랑 기침도 안해요   그냥 단순 귀 먹먹인가요   불안하네요  ,이비인후과
숙이면 어지럽고 메스꺼움,머리를 숙이면 약간 어지럽고 체한거처럼 메스꺼워요 그리고 힘 줬을때도 비슷해요 혹시 안압과 관련이 있을수 있나요    안압을 재본적이 없긴하지만 눈이 좀 안좋아서 걱정돼요,이비인후과
급성편도염,일주일전 급성편도염으로 고생중입니다    약도 잘먹고 물도 잘먹는데 가래 뱉을때마다 역한 피냄새쓴맛나고 피랑 물컹한게 같이 나오네요   항셍제도 잘 복용중인데 그러네요    병원 다시 가봐야하나요 ,이비인후과
모메트 나잘 스프레이를 쓰고 있는데 비중격쪽을 제가 긁어서 피가 약간 났는데 계속 써도 괜찮을까요 ,주의사항에  비강점막에 치료되지 않은 국소감염이 있는 환자 하고 적혀있는데 관련있는건가요     그리고 스프레이를 계속 써도 될까요    ,이비인후과
목에 하얀게 생겼어요,선명하게 하얀색인데 이게 뭘까요   ,이비인후과
입 안에 물집,백신  차 맞은지 하루가 됐는데요 입 안에 물집처럼 작고 동그란 게 만져져요  통증은 전혀 없는데 백신 부작용인가요  ,이비인후과
비중격만곡증 수술,제가 년전에 코성형을 실리콘 mm  귀연골 썻습니다  현재 비중격만곡증이 있어 입으로 숨쉬고 있어싀 수술할려고합니다  비중격 만곡증 수술시 비중격을 연골을 채취해서 똑바로 세워주는거잖아요     비중격 만곡증 수술 후 비중격을 채취하고나니깐 약해진 상태이고 실리콘  연골도 있는데 나중에 혹시 더 휘지 않을까요  보통 한번 제대로 펴주면 괜찮다지만      비중격 만곡증 수술하는데 비중격 연골을 채취 후 비중격이 더 약해지나요      비중격이 휘는거랑 콧대를 높이고 코끝을 연장시키는거랑 직접적인 관계가 있나요  콧대를 높혓거나 코끝을 연장이 비중격에 피해늘 주는지      대학병원 이비인후과 교수님께 코성형 비중격만곡증 받을려고하는데 성형외과  이비인후과 두 곳 코성형에 크게 차이가 있나요    곧 수술이라 부탁드려요  ,이비인후과
목소리 덜덜 떨림,오랜만에 학교에 가서 애들이랑 대화하는데 목소리가 자꾸 염소마냥 덜덜 떨려요 왜 그러는거죠 ,이비인후과
귀 뚫은 곳 멍 몽우리,귀 뚫은 지 이제  일 되었는데 제가 실수로 살짝 건든 귀걸이를  이후로  시간만에 저렇게 됐어요      괜찮을까요      그냥 두면 났나요  고름은 아니겠죠  다시 뚫은거에다 쫄보라 아픈거 너무 싫은데 괜찮겠죠 ,이비인후과
이거 목 부은건가용 ,이거 목 부은건가용     ,이비인후과
후두쪽 질문 드립니다 ,이비인후과에 갔다가 후두내시경을 했는데 이런게 보이네요    먼지 모르겠다고 합니다  혹시 무엇이고  치료 방법은 어떠케 하는건지 궁금 합니다   감사 합니다,이비인후과
편도염 편도비대,코로나 자가격리  일이 지났는데 아직도 낫질않습니다 편도비대와 편도염이 있는거같은데 최대 몇일까지 갈까요 ,이비인후과
귀를 파면 물같은게 나옵니다,말했던 것처럼 귀를 파면 나중에 물이나오고 나중엔 딱지 비슷하게 되는것 같습니다  딱지를 가만히 두어야하나요  ,이비인후과
