0,1,2
코 골절 수술 후 눈 건조 충혈  ,코 골절 수술 후  일짼데 수술은 골절의 정도가 미미해 비관혈적 정복술로 시행하였는데 수술하고나서 부터 눈이 너무 건조해져 인공눈물을 뿌릴때 마다 눈이 따가워 잠시 눈이 충혈되고 제대로 뜨질 못해서 눈에 힘이 많이 들어가는데 잠시 이것이 혹시 코모양에 이상을 줄수도 있을까요 ,이비인후과
코 점막 건조,비염 때문인지 코가 너무 건조한데 점막을 촉촉하게 할 수 있는 뭐가 없을까요     코앤 뿌려도 오래 못 가고 가습기 틀어도 소용 없고 숨 쉴 때마다 쌕쌕 소리가 나요    코 안 쪽에 바세린 같은 거 발라도 되나요  안연고도 발라도 된다는 말이 있던데 둘 중에 뭐가 나을까요  안연고는 안구 건조증용 듀라티얼즈 가지고 있습니당  ,이비인후과
매부리코 생기는 이유 교정,안녕하세요 저는 중  여학생입니다 제가 원래 매부리가 없었는데 초등학교 졸업할 때쯤 매부리가 생겼더라구요 인지하지 못했었는데 중  때 애들하고 얼굴에 관한 얘기를 하다가 제가 매부리라는 것을 알게 되었어요 그때부터 콤플렉스가 되었는데 가족들도 다 제가 왜 매부리가 생겼는지 모르겠다고 하더라고요 저희 가족은 할아버지 할머니 외가 쪽 엄마 아빠 오빠 등등 사촌들 중에서도 매부리가 한 명도 없거든요 근데 선천적인 것도 아니고 심하게 노는 것도 아니라서 저도 왜 매부리가 생겼는지 알수가없네요 점점 나이가 들면서 외적으로 관심이 많아지고 있는데 너무너무 보기가 싫어요   심하지는 않은데 살짝 나온 거 때문에 코 가 너무 낮아 보여요 초등학교 때 합기도를 다녔었는데 엄마가 거기서 맞고 온 거 아니냐고 하더라구요 근데 저는 그런 적이 없고 다니면서 코가 아팠던 적도 없거든요 보정으로 매부리 나온거만 살짝 넣어도 코가 훨씬 이뻐지고 높아보이더라구요     예전에 유튜브에서 봤는데 침으로 교정하는 방법이 있다고 하던데 가능한가요  코뽕도 생각해 봤는데 선 듯 용기가 안 나네요 네이버 지식인에서는 교정 방법이 튀어나온 부분만 제거하고 코 끝을 살짝높이는 수술밖에 안 나오더라구요  지금 제 나이에 할 수 있는지도 모르겠구요   조만간 엄마랑 큰 병원에 가서 상담해보기로 했는데 여기서 한번 여쭈어봅니다 제발 알려주세요  ,이비인후과
편도결석에 대해 궁금합니다,   편도선염인줄 알았는데 알고보니 음식물찌꺼기라고 하더라고요 도대체 무슨 말인가요 음식물찌꺼기가 왜   안 떨어지고 있는건가요      그러면 편도결석인가요  편도결석은 가글하고 하면 알아서 없어지는건가요      편도결석용 가글을 써야하나요  일반 가글 가능한가요  다른 치료법이 있으면 자세하게 알려주세요   ,이비인후과
잘못듣는거,제가 귀가안좋다는말을 많이들어요 그런데 귀가안들리는게아니라 들리는데 뭐라고하는지 몰라요  안들리는경우 그냥 안들린다고 한번더말해달라고하면 되는데 문제는 구분이안갈때 예를들어 어떻게 지내 이렇게물어본다면 어떤 생각해  이런식으로 듣는경우가 종종있어요 이럴경우 엄청부끄럽고 바보같애서 힘듭니다    뇌문제일까요 아니면 어렸을때 한글듣는공부를 너무안해서  구분을못하는건가     좋은방법없을까요   진짜 목소리도 어눌한편인데 귀까지이러니까 사람이 바보같아요        도와주세요,이비인후과
비중격 만곡증 ct 내시경,뭘로 보는게 더 정확한거예요  A병원에서 ct촬영했을땐 잘 모르는 사람이 봐도 완전 휘어있었거든요 근데 B병원에서 내시경으로 보니까 안휘었대요 A는 이비인후과 전문의 있는 성형외과고 B는 이비인후과예요 실비 환급 받으려고 하는거라서요  ct랑 내시경 뭐가 정확한가요  ,이비인후과
부비동염 수술,약 두달전부터 부비동염 치료를 받고있습니다  계속 약을 먹고있는데 완전히 낫지를 않네요  의사 선생님은 수술만이 해결책이라하십니다  수술않고 약으로는 도저히 안되는건가요  또 수술시 입원 기간은 얼마나 해야하며   수술비용은 대략 얼마정도 들어가는지요 ,이비인후과
한 쪽 귀 먹먹한 증상,한 일주일  전부터 자고 일어났을 때 한 쪽 귀가 먹먹한 증상이 있습니다  대부분 한 몇 시간 지나면 자연스럽게 없어지기는 하는데 어떤 때는 하루종일 갈 때도 있습니다  어떨 때는 자기 전에 이불에 누워있으면 먹먹해지기도 하구요     이거 괜찮은 건가요     그리고 추가로 말씀드리자면 오늘은 갑자기 목이 좀 붓고 약간의 미열이 있었습니다    오늘도 귀먹먹 증상은 있었어요 ,이비인후과
코로나 확진,가족이 등본상 같이 사는 걸로 나와있는데 따로 살고 있어요  그래도 밀접접촉자로 분리되나요 ,이비인후과
무증상 Pcr 검사 받을 수 있나요 ,오늘 pcr양성판정받은 확진자와  일전에 접촉이 있었는데 저는 아무런 증상이없습니다  Pcr검사를 받을 수 있나요  자가는 음성나왔어요  안내문자에 동거가족만 기재되어있어서요 ,이비인후과
귀 부었을 때 약 뭐 먹어야 하나요 ,귀는 뚫은지 일주일 정도 됐고 연골인데    저번에도 귓바퀴를 뚫었을 때 이랬거든요    엄청 붓고 계속 욱신 거리게 아파요    저번에는 이비인후과를 다녀왔는데 의사쌤이 관리를 잘 해서 염증은 안 났다고 하셨는데  지금도 비슷한거 같아요  처방 받아서 약을 먹어야 할까요  아니면 처방 없이도 살 수 있는 약으로 먹어도 될까요   ,이비인후과
편도결석이 나왔었는데,편도결석이 나온 적이 있었는데   번 나왔었어요  입 안 쪽에 보니까 이런 붉은색이 있더라고요 편도결석 나오면서 생긴 건가요  그리고 편도결석이 나왔을때는 어떻게 해야 하나요,이비인후과
편도염인가요 ,아픈건 하나도 없고 사랑니 때문에 입 안을 보다가 뭔가 목구멍 쪽에서 흰색 무언가를 발견했는데 무엇인지 궁금하네요,이비인후과
비중격만곡증 하비갑개절제술 후 궁굼      ,비중격만곡증 수술  하비갑개절제술 수술을 받고 수술  달후부터 코를 세게 풀었습니다  병원에선 수술 잘됬다고 하지만  코막힘이나 답답함이 수술초기에 비해서 불편해져서 걱정이되서 올립니다 ,이비인후과
여기서 복통을 유발하는 약이 있나요 ,역류성 식도염 or 역류성 후두염 증상들이 나타나서 이비인후과를 가서 진료를 봤는데요 코랑 목 속을 한번 보시더니 역류성 후두염은 아니고 염증이 생겨서 목이 답답하고 소화가 안될수 있다며 약을 사진과 같이 처방 해주셨는데요     저 약을 먹고 복통이 생긴 느낌입니다  막 찢어질듯 아픈건 아니구요 배가 고픈것과 비슷한 느낌의 복부 불편감  정도가 있습니다 혹시 저 약들이 문제인건가요  낫고 있는 단계인건거요 ,이비인후과
오른쪽 귀가 물먹은것처럼,먹먹하고 귀에 시이이이익 소리같은게 들리네요    둘 다 잘 들리긴 하는데 옆으로 눕고 일어나서부터 이랬어요 되게 거슬리네요   무슨 병 같은걸까요 ,이비인후과
편도결석인가요 ,침 삼킬때마다 따끔 거리는데 편도결석인가요     사진 있음 ,이비인후과
생선가시 같은걸 삼켰는데,삼키면서 긁힌건지 아니면 박힌건지 쪼금 따가워요 길쭉한 가시 말고 약간 작고 평평한 가시 있잖아요 따가운 부분 목을 누르면 아무느낌 안나긴 하는데 침삼킬때 조금 불편하고 따갑네요   따뜻한 물 마시면 나아질까요,이비인후과
비중격만곡증  비밸브협착이 심한가요  비밸브재건술 해야 할지요,이비인후과에서 코 안에 카메라 넣어보시더니 심각한데요   하셔서 ct 찍었는데 많이 심한가요  편위된 비중격  코선반의 비대  알레르기 비염이라고 하셨어요,이비인후과
귀가 아파요,처음엔 목이 아프다가 갑자기 침 삼키니깐 귀도 아파요 그냥 목 아프니깐 귀도 연결 되있어서 아픈가보지 이렇게 생각했는데 목은 괜찮아졌는데 이제 침 삼킬때만 귀가 아파서요   염증 생긴건가요   ,이비인후과
학원가도되나요,목아픔  재채기  가래  콧물 현재진행형이고  아침에 일어나니까 팔이 좀 쑤시고 추웠는데 지금은 좀 안그러긴 한데 학원 가도 되나요   열은 안나요  빠른답장  탁드려요,이비인후과
비중격 천공 수술,안녕하세요   년 전에 비중격 만곡증 수술했습니다  최근에 천공 진단 받았습니다     구멍이 커질 수 있나요     비중격 천공 수술해도 재발될 수 있나요     비중격 만곡증 수술 후에 재발될 수 있나요     수술하게 되면 비염수술이랑 함께 가능할까요  ,이비인후과
Pcr검사 면봉,을 코가 많이 안들어갔나  콕콕 이렇게 진짜 별로 안아팠어요    자가진단 이빈인후과 에서 할땐 되게 깊숙이 했는데   제대로 검사 안될까봐 걱정되네요  신속항원검사 양성 받았는데,이비인후과
귀마개 장시간 사용시 어지러움증,약간 어지러움이 어제부터 있는데 귀마개 장시간 이용하면 귀에 별로 안 좋나요  작년부터 공부중이라 주간에도 사용하고 아주 오래전부터 잘때 항상 귀마개꼈는데 최근  개월동안 생각해보니 엄청 오래꼈더라구요 잘때도 끼고 공부도   시간이상하니까 그때도끼고 가끔 귀가 아파도 걍 꼈는데 귀마개 장시간 사용하면 귀에 안 좋은 건 사실이겠죠 ,이비인후과
귀에서 전자파  같은 소리가 들림,제가 최근에 핸드폰을 바꿔서 새로운 폰으로 데이터를 옮기려고 네이버에 쳐보니까 일단 이렇게이렇게 하세요  라고 나와서 따라하고 있는데 갑자기 데이터가 옮겨지는 순간 전자파 소리가 막 지 지잉지지이지 하고 나와서 아버지한테 소리 들리냐고 귀에 빠짝 붙여서 들려드렸는데 안들린데요         핸드폰을 너무 많이 봐서 그런가요  아니면 스트레스를 많이 받아서 그런가요 ,이비인후과
이석증 안진 질문드립니다,이석증 진단받은 이후 자기전 눈을 감으면 눈동자가 흔들리는 듯한 느낌이 듭니다  이로 인해 불면증이 심하고 가슴이 두근거리고 쿵하는 느낌까지 드네요  불안한 느낌이 들고 목도 뻣뻣해지는 기분입니다   자기전에 유독 이럽니다     평소에는 가까이서 글씨를 쓸때 눈동자가 살짝 흔들리는 느낌을 받는데 이석증으로 이런 증상들이 나타날 수 있나요 ,이비인후과
이명 원인,최근에 누워있으면 가끔 입천장 뒤 에서 와다닥 사탕이 터지는 것 같은 소리가 나요 이게 주변에서 이런소리가 나는 것처럼 느껴지는게 아니라 내 몸에서 나는 소리처럼 느껴지는데 이건 이명도 아니고 대체 뭐죠,이비인후과
이어폰 끼고 귀에 뭐가 난거같아요,이어폰 꽂고 노래 듣는걸 좋아하는데 왼쪽 귀 안에 약간 뽈록한게 나있고 누르면 찌릿 해요  보통 양쪽 귀에 다 끼고 노래를 듣긴하는데 인강 볼 때나 자기 전에 영화 볼때나 왼쪽에만 이어폰을 껴서 왼쪽에 이어폰을 끼는 시간이 더 많긴해요  귀 안에 난걸 눈으로 직접 보지는 못했는데 이어폰 때문일까요  이어폰 때문이라면 이유가 뭔가요  소리가 커서 난건가요 아니면 이어폰 고무의 안좋은 성분 때문에 그런건가요,이비인후과
대학병원 청력검사,일반 동네병원은 청력검사가    만원대고 대학 병원은     만원 정도 든다고 알고 있는데 검사 방법에 차이가 있나요  난청이 있는 것 같아서 알아보려고 검사하려고 합니다,이비인후과
귀에서 소리,침을 삼킬 때  하품을 할 때 등등 귀 안쪽에 조금 자극이 가면 오른쪽 귀에서 부스럭소리가 들리는데 찾아보니 고막쪽에 귓밥이 있어서 그렇다고 하더라고요 병원에 가서 제거하지 않아도 좀 지나면 자연적으로 괜찮아질까요 ,이비인후과
코로나 자가검사키트,자가검사키트로 검사를 해보니 사진속에 제가 칠해둔 검은 선 같은것이 나타나더군요  생기고 몇초후에 다시 사라지긴하였지만 저 선이 무엇인지 궁금합니다  검은 선이 사라져 음성으로 판정이 되긴 했지만 정말 음성이 맞는지도 의문이고요  세로로 두줄 나온 것도 아니고 가로세로로   정확한 답변 부탁드립니다,이비인후과
귀를 팠는데 아파요,귀가 간지러워서 팠거든요 그러고 나서 코 막고 귀에 힘을 주니까 귀에서 이상한 소리가나면서 아프더라구요 그러고 좀 아프다가 괜찮아 졌는데 다시 귀에 힘을 주니까 아파요 왜 이런건가요 병원 가야할까요 ,이비인후과
저주파성 난청시 헤드셋 사용은 문제없나요 ,어제 청력에 문제가 있음을 느끼고 오늘 병원에 내방했더니 급성 저주파성 난청이라고 진단이 나왔습니다 진료받으면서 여쭙는걸 까먹었는데 헤드셋을 끼고 소리를 들어도 괜찮을까요   조금 더 정확히는 이상이 있는쪽의 소리를 안나오게 하고 다른 정상적인 귀 한쪽으로만 소리를 듣는게 문제가 없는지 궁금합니다 ,이비인후과
어지러움원인,아빠가 화장실가다가 어지러워서 쓰러져서 머리가 찢어져서 병원에 가서 꿰메고 혹시 몰라서 씨티 엠알아이를 찍었는데 다 괜찮으셨대요  요몇일 자고일어나면 어지러웠다고 하시더라구요  자고 일어나면 벌떡 일어나서 기립성저혈압이 온건지 고혈압약때문인지 아니면 귀에 문제가 있는건지  귀는 중이염이 심하시구요  엠알아이 씨티상 아무이상이 없으면 머리쪽은 괜찮은걸까요,이비인후과
코로나바이러스,제가 쿠팡 택배가 문 앞에 왔다길래 가지러 나갔는데 당연히 집 바로 앞이니까 마스크를 안 쓰고 갔다왔거든요 근데 어떤 할아버지가 제 택배를 가져가려고 하셨는데 제가 나오니까 다시 돌려주시면서 택배인 줄 몰랐다고 얘기를 하셨는데 그 할아버지가 담배를 피우느라 마스크도 안 끼시고 콧물을 흘리고 계셨어요    저 코로나 걸리면 어떡하죠               진짜 화가 나요,이비인후과
혹시 이게 편도염인가요  ,비흡연자구요  일주일전부터 삼킬때 아프고 따가워요  최근들어 가래도 좀 있고 편도선이 부운건가요  ,이비인후과
외이도염인가요 ,오른쪽 귓구멍 위쪽에 한 달 전 쯤부터 상처가 나서 약 바르고 낫고 다시 상처나고 낫고 반복이었는데 마지막으로 연고 바른 후부터 귓구멍 입구쪽을 누르면 너무 아파요    멍 든 것 같이 작년에도 오른쪽 귀 외이도염으로 고생했었는데 또 외이도염인가요  상처 처음 났을 쯤부터 에어팟은 왼쪽에만 꼈어요,이비인후과
목감기증상,이비인후과를 갔다왔는데 코 목 정상 편도도 안 부었다는데 몸살감기가 올 수 있나요  ,이비인후과
그냥 인후통일까요 코로나일까요  신속항원검사는 그냥 보건소 가서 받으면 되는건가요  ,그저께부터 침삼킬때 계속 목이 지끈지끈하고 뭔가 부은 것 같은 느낌이 있어서 어제 코로나 키트를 해봤는데 음성이 나왔어요 오늘 아침에도 일어났는데 목소리 나가있고 목이 엄청 부은 것 같아서 또 키트 해봤는데 음성 나왔어요   일어난지 세네시간됐는데 아직도 목소리가 안 돌아왔고 목이 지끈지끈해요   엄마는 집 보일러 고장나서 며칠째 계속 춥게자서 그런거라고 그냥 인후통이라고하는데 너무 불안해요   목 아픈거 말고는 따로 증상이 없는데 코로나일까요    신속항원검사 보건소에서 받으려면 돈 얼마나 내야하는건가요   ,이비인후과
갑자기 속이 울렁거리면서 귀에서 삐소리나면서 귀가 안들렸는데 괜찮겠죠  ,제가 일을 공장 쪽에서 일하는데 퇴근하고 버스를 타고 서서 가는데 갑자기 속이 울렁거리면서 귀가 삐 이러더니 귀가 아예안들리더라고요   그래서 바로 아무정거장에 내려서 찬바람 맞고 그랬더니 귀는 괜찮아졌는데 속은 조금 그러네요  아시는분은 답변 부탁드려요 ,이비인후과
왼쪽 귀 안쪽 통증,왼쪽 귀 안쪽에 통증이 너무 심해요  진짜 잠도 못자고 한번 아프면 계속해서 아파요 격리때문에 병원도 못가는데 어떡하죠  ,이비인후과
오른쪽 귀가,귀파고 나서 왼쪽으로 고개를 딱햇는데 바람불면서 막히는 느낌이 들어요 소리는들리는데 귀지로 막히는느낌          건강상에 문제는 없나요  ,이비인후과
목이칼칼해요,집이건조해서 그런지 목이칼칼해요   콧구멍 끝이 말라있는기분이고 따가워요   침삼킬때 목 안따가운데 코로나 증상일까요    ,이비인후과
이거 양성이에요 음성이에요  ,하나가 흐린데   지나가는 중일까요 이제 걸린걸까요  ,이비인후과
목감기 증상,월요일 저녁부터 목이 간질간질 하더니 화요일에 아파서 집에서 자가키트를 했는데 음성이 나왔고요 혹시 몰라 수요일에 병원 가서 의사가 직접 해주는 신속항원검사를 했는데 음성이 나왔습니다 진료를 받았는데 저는 뭔가 목이 불편한데 의사가 내시경  같은 걸로 본 결과 엄청 깨끗하다고 그냥 감기 목감기라고 했습니다  오늘 기숙사를 들어가야하는데 혹시나 들어가서 더 아플까봐  걱정이네요,이비인후과
코성형 자가진피는 결국에 흡수되나요 ,콧대세우는 코성형할때 보형물 좀 봐주세요  차 코성형 자가진피   차는 실리콘으로 코성형 될까요  코성형하는 사람들한테 물어보면 다들 실리콘으로 했다고 하더라구요 처음 코성형하는 친구들은 자가진피로 하는 애들이 없어서 저도 실리콘으로 해야하나 고민하다가 그래도 자가진피가 제 몸에서 나온거니까 부작용도 적을거같고 더 나을거같기도 한 막연한 생각때문에 갈등이 좀 되네요 자가진피는 나중에 흡수되기도한다던데 예를들어 자가진피로 하고  년 후에 흡수되어서 다시 또 코성형을 해야한다면 그때는 실리콘으로도 할 수 있는건가요  실리콘으로 연세유앤미에서 코성형한 친구는 실리콘은 구형구축이나 부작용 생겼을때 빼버리면 간단하게 부작용 없애는게 가능한데 자가진피로 부작용 생겼을때는 재수술할때 더 복잡해진다고 그냥 자기처럼 실리콘으로 하라고해서요,이비인후과
 차 화이자 접종 후 코피, 차   년  월  일   차   년  월   일  차   년  월  일  생전 코피 한 번 안나던 제가  월   일 첫 코피   월   일  번째 코피    일  번째 코피가 터졌습니다  차를 맞은지 한달 후 부작용으로 코피가 나는 경우도 있나요   검사를 받는 다면 무슨 과를 가는게 좋을까요 ,이비인후과
코로나 목아픔,안녕하세여 제가 코로나 양성이 걸렸는데요 목이 너무 아파요 계속 침을 삼킬때마다 목이 너무 따끔하고요   근데 이게 궁금한게 침이나 가래가 나오면 삼키는게 맞을까요 아니면 뱉는게 맞을까요 ,이비인후과
