0,1,2
이거 편도결석인가요,요즘들어 재채기를 하거나 양치할 때 가끔 드물게 나왔는데 오늘은 일어나자마자 이물감이 들어 보니  이렇게 큰게 나왔습니다          이게 편도결석인가요  인터넷 검색 해보니 딱딱하면 편도결석이고 손으로 으깼을 때 으깨지면 아니라는 말이 있는데 헷갈려서요  으깬 사진도 첨부합니다      해결 방법이 뭔가요  양치도 하루에 두번 이상은 하는데 왜 생긴건가요    수술이나 병원치료 해야하는 건가요  가끔 편도결석이 나오는 입은 평소에도 입냄새 심할까요   질문 폭탄 죄송합니다  답변 부탁드리겠습니다 ,이비인후과
코세척 방법,오늘 아침에 처음 코세척을 했는데 왼쪽코에 식염수 뿌렸는데 왼쪽코로 그대로 나와요  상체   도 숙이고 턱 목에 딱 붙이고 아 했는데 왜 더시 그대로 나오나요    코로 숨은 숴지는데 어떻게 해야 하나요 ,이비인후과
금요일에 자고 일어났더니 귀가 먹먹,  살입니다  금요일 아침에 자고 일어났더니 귀가 먹먹해지고 물에 가득 찬 기분이 듭니다 그 상태로 침을 삼키면 귀가 먹먹해지는게 느껴져요 왜 이러나요  보니까 병원 빨리 가야한다던데 제가 월요일 오후  시 이후에 시간이 돼서요      빨리 안 가면 안 좋나요  무슨 증상인가요,이비인후과
편도염 증상,일주일전에 목감기 걸렸는데 살짝 인후통만 있었어요  그러다가 괜찮은듯했는데 이틀전부터 갑자기 목소리 쉰소리나고 식은땀 두통 어지러움 인후통 마른기침 미열 있어서 어제 링겔맞고 약 처방 받아서 그 당일날은 목소리도 좀 돌아오고 괜찮아졌어요 근데 오늘 아침 일어나니 열이 심하고 목 간지럽고 가래낀듯한 목이 목소리며 기침도 나더라구요   코로나는 일주일내 자가키트 번 신속항원  번 핬는데 다 음성이였어요,이비인후과
비염인지 코로나인지,어제부터 콧물도 좀 나오고 재채기를 다소 합니다 목 부근이 침 넘길 때 매우 살짝 거슬려요  거의 증상 없는 수준  열은 재봤는데      정도 나옵니다  이게 감기인지   비염인지    코로난지 모르겠네요  ,이비인후과
귀지만 파러 이비인후과를 가도 되나요 ,귀지가 많이 쌓이는 체질이라 이비인후과에 갈때마다 귀지를 파주시는데 요새 갈일이 없어 고민입니다  전에 오랫동안 안갈때는 너무 많이 쌓여서 귀가 막혀 소리도 잘 못들은적이 있어서 가야할것같은데 귀지만 파러 왔다고 말해도 될까요 ,이비인후과
비염인데 아침에 코막혀서 세게풀면 안되나요 ,코 너무 답답한데 코 세게 풀면 피나와요   이 버릇 어케 개선할수있나요   코는 막히는데 풀면 안되고 다른 방법이 있나요 ,이비인후과
신속 항원 양성 pcr 음성,가족 중에 한 명이 pcr 양성인데 가족들 다 항원 검사 두 줄 떠서 pcr 해 보니까 음성이네요  목은 찢어질 정도로 아픈데 아무리 생각해 봐도 음성인 게 신기하네요 또 pcr 받아야 될까요 ,이비인후과
제가 코를 많이 풀어서 코끝이 부어서 뭉툭해졌는데 나중에 붓기 같은게 다 빠지나요 ,제가 코로나 때문에 코 막힘이 있어서 요즘 하루 종일 코를 푸는데 그러다 보니 코끝이 부어서 뭉툭해졌어요  전체적으로 코가 좀 부은 것 같은데   코로나 다 낫고 코도 안 풀다 보면 다시 가라앉을까요   ,이비인후과
제가 후비루 증상이 있는 건가요 ,기침이 나거나 가래가 끼는 증상은 없는데 계속 입천장 쪽에 있는 코 뒷부분  코와 입이 이어지는 통로 같은 부분에 힘이 계속 들어가고 그 부분에 가래가 끼어있는 것이 느껴집니다  코로 숨을 쉬는 것도 불편하고 계속 구역감이 있어서 밥 먹는 것도 힘든데 후비루가 맞을까요 ,이비인후과
비중격 만곡증 코 건조,비중격 만곡증으로 인해서 코 뒤쪽이랑 편도까지 건조해질 수 있나요 ,이비인후과
목이 한쪽으로 자꾸 기울어져요,전부터 고개가 오른쪽으로 기울어지더니 가만히 있으면 무의식적으로 고개가 오른쪽으로 꺾여있어요   왼쪽으로 최대한 기울면 오른쪽 근육  신경  이 짧아진것처럼 당겨요   사진 찍을 때 고개를 왼쪽으로 기울고  턱 좀 당겨보라는 소리를 자주 듣는데  이거 어떻게 고쳐야 하나요  아픈건 전혀 없어요 ,이비인후과
성대쪽이 너무 불편합니다   ,스트레스를 많이 받으면 성대근처가 붖고 무엇을 삼키는데도 불편합니다  너무 고통스럽습니다  스트레스가 별로 없으면 또 괜찮습니다   원인이 뭔지 정말 궁금합니다  정말 너무 고통스럽습니다   성대근처에 뭔가 굴러다니는 느낌도 들고      ,이비인후과
한 쪽 성대가 안움직입니다    성대마비인가요 ,안녕하세요  현재 대학 재학 중인   살 성인 남성입니다   어렸을 때부터 제 목소리는 얇다고 하기엔 좀 굵고 굵다고 하기엔 좀 얇은 애매한 목소리였습니다   그냥 변성기가 오다 말았나 싶어서 별 생각 없이 살고 있었는데 얼마 전 제 목소리가 녹음 된 통화내역을 듣게 되었습니다   들으면서 정말 충격적이었던게 칼든강도에게 위협당하는 상황인 것 마냥 목소리가 부들부들 떨리면서 막 울먹이는 느낌이더라고요   더욱더 심각한게 뭐냐면 격식적인 전화였기 때문에 저는 정말로 제가 낼 수 있는 최대한 좋은 발성을 썼다는 겁니다   이전에는 유튜브에서 발성과 관련된 영상들을 찾아보며 스스로 고치려 노력했고 뭔가 나아졌다고 느꼈는데 녹음된 제 목소리를 듣자마자 진짜 제 목에 뭔가 문제가 있는 상황인 걸 느껴서 병원을 갔습니다   그래서 이비인후과에 찾아갔고 목에 기다란 막대기를 집어넣어 거기 달린 카메라로 제가 소리지를 때의 성대를 살펴본 결과 오른쪽 성대가 움직이지 않거나 정말 미세하게만 움직인다고 합니다   의사선생님께서는 바로 진료의뢰서를 써줄테니 대학병원에 가서 정밀한 검사를 받아보라고 하셨고 저는 대학병원에 예약을 한 상태로 기다리는 상황입니다   검색을 해보니 성대가 움직이지 않는게 성대마비의 증상이라고 하더라고요   제가 궁금한건 옛날부터 제 목소리는 이런 상태였는데 치료가 가능할까요   어렸을때부터 목소리톤이 이상한게 굉장히 컴플렉스였고 발음을 일정한 크기로 또박또박 내는것도 저에게는 힘듭니다   성인이 되어서는 나름의 방법을 터득해서 어느정도 목소리를 낼 수 있게 되었는데 그마저도 남들과 비교하면 상당히 부자연스러운 목소리네요     정말 치료 받아서 나아지고 싶은데 오래된 증상도 치료가 가능할까요   물론 대학병원 가서 자세하게 검사를 받아봐야 알겠지만 검사하려면 아직 많이 기다려야 하기때문에 너무 궁금합니다   ,이비인후과
귀에 고름 외이도염,제가 몇달전에 귀가 먹먹하고 고름이 나와서 병원을 가서 귀에 넣는약과 먹는약 처방을 받아서 치료를 했었어요  제가 귀를 깁숙하게 벅벅 파는 성격이라 상처가 났었나봐요    근데 이번에도 파다보니까 귀가 먹먹하고 물처럼 연노랑색의 액체가 나오고 몇일째 귓볼을 잡아당기면 아프고 귀속이 부은거같아요     이비인후과는 여기 지역엔 없고   분동안 차타고 가야있는데 이비인후과는 못갈거같아요    그냥 전에 엄청 효과를 봤던 약이 싸이록사신이었던거같은데 그냥 약 없이 이것만 넣어두 될까요  ,이비인후과
성대 결절시 호흡연습,성대 결절이 작게 있는 보컬입니다 발성연습이 아닌  목소리 사용   호흡연습은  목소리 사용 X   해도 괜찮을까요   ,이비인후과
싸대기를 맞고 귀가 먹먹해요,중학생인데 친구랑 장난치면서 저의 귀를 손바닥으로 맞았는데   병원 가봐야 되나요  귀가 먹먹한데 삐소리는 안들리고 가만히 두면 저절로 치유되나요  심각한 상황인가요 ,이비인후과
구개편도 비대칭,편도 비대칭인줄 모르고 살았는데    요즘 한쪽에 편도결석이 가끔씩 생겨서 보는데 한쪽만 좀 더 크더라구요 정상인가요  ,이비인후과
어지러움 울렁거림 질문드립니다 ,요즘 목뒷목이뻐근 하고 얼굴을 조금만 돌려도 어지럽고 약간울렁거리고그러는데    왜그런걸가요      혹시 뇌쪽에문제있어서그런가요   어지러움은 뇌랑관련잇다고하던데     년전 고막이터진적잇는데 제대로 치료를안해서그런걸가요    이석증일지생각도해봤는데 이석증은 누워서일어날떄 어지럽다는데   저는 일어날떈갠찮은데 목이랑얼굴 돌리면 어지럽습니다    걱정되네요 혹시뇌나이쪽에 이상생긴거아닐지  병원을가면 무슨과를가야하나요     그리고 이석증이나 이런게아닌다른원인도있을지   확실히 이러니까 건강이안좋아진기분이드네요 ,이비인후과
어지럽고 메스꺼움,앉아있다가 잠깐 쉬려고 눕는데 갑자기 엄청 어지럽고 멀미한 것 처럼 토할것 같아요   숨도 가쁘고 손발도 저리고 몸도 갑자기 추워지는데 왜이러죠     지금 제대로 걷지도 못하겠어요   나아지려면 어케 해야하죠   어제 좀 이명이 심하긴 했는데 병원 가보는게 좋을까요  쓸데없는 말이나 광고는 신고할게요 ,이비인후과
메니에르병 증상,이퀄라이징 하기전에 귀가 막힌 느낌이고 비행기 이륙할때 느낌  이충만감 증상 발현한지는  년정도 됩니다  이전에는 증상이 나타나면  시간 이내에 정상적으로 돌아왔는데 최근에는 반나절 정도 지속됩니다  명확한 이유도 모르겠습니다 메니에르병은 어지럼증도 동반하는데 어지럽거나 두통이있지는 않습니다  왜이런걸까요   ,이비인후과
소총 사격후 이명 소리가 들리는데 언제까지 들리는지 궁금합니다 , 주일 전쯤 k 소총 사격 시에 이어플러그를 미착용하고   발 정도 사격을 진행 했는데 그 뒤로 좌측 귀에 이명이 들리고 있습니다 점점 회복 되는것 같아서 신경 안쓰고 있었는데  주일이 지난 시점에도 귀에서 삐 하는 이명이 들림과 동시에 조금 먹먹한 기분이 드는데지금 이상태가 가만히 놔둬도 회복이 되는 건지 아니면 병원에 가서 진료를 봐야 하는지 궁금합니다 ,이비인후과
잦은 코피,고시원 들어오고 일주일 정도 지났는데 평소에 나지도 않던 코피가 납니다 어제 아침부터 나더니 간간이 끈적한 피가 나네요 건조해서 그런 걸까요,이비인후과
비염수술 후 코피가 납니다 ,비염수술 한지 거의 한달이 다 되어가는데요   비염수술 후에도 코가 막혀서 식염수 세척을 계속 했는데 어제 좀 세게 하고 그랬는지 새벽에 갑자기 코피가 왈칵 나더라고요  그리고 급하게   분 좀 넘은거 같아요 지혈을 하고 나서 괜찮아져서 자려고 잠시 누웠는데 또 코피가 왈칵 나네요   지혈은 되어 가는거 같은데 혹시 이거 응급실 가봐야 할까요   ,이비인후과
편도결석 입냄새,편도결석이 요새 가끔나옵니다   그래서 가글이랑 양치를 자주해주는대요  저는 제가 입냄새가 난다고 생각한적이 한번도 없어서요  마스크 끼고도 안나고  가족들에게 물어봐도 난적이없다고하네요   편도결석이있으면 무조건 입냄새가나나요   아니면 제가 못느끼는건가요  제가못느끼는대 입냄새가 나고있던걸까요     고민되네요  답변부탁드립니다  ,이비인후과
입 안 점막에도 피딱지가 생기나요 ,궁금합니다,이비인후과
후각장애 치료할수있는 방법이 있나요   ,저희엄마가 태어날때부터그런건지 아니면 어렸을때부터 그런건지 냄새를 못 맡으시는데 막 엄청독한 냄새는 맡을수가 있대요 독한냄새 수준이 독가스 이정도면 약간은 맡을수가 있다고하셨어요 후각장애가 어떤이유때문에 생기는거고 혹시 치료할수있다면 어떤방법으로 치료하나요  엄마도 물론 불편하겠지만 엄마가 냄새못맡아서 저도 불편한점이 많거든요  친절한답변 부탁드립니다,이비인후과
이런 경우도 코로나 걸리나요  ,주변에 코로나 걸린사람 아무도 없고 코로나 걸린사람 만난 적도 없는데 심지어  차까지 다 맞았는데 걸릴 수가 있나요  ,이비인후과
목이 부은건가요  ,둘다 제 목 안쪽인데 많이 부은건가요  ,이비인후과
편도염이라서 의사분꼐 진찰을 받았는데   회사출근 해야하나요 ,편도염인건 육안으로만 봐도 충분히 보이는 정도입니다   건조한 환경에서 있는게 편도에 않좋다고하는데   내일 회사 출근 때문에 질문드립니다  근무환경이 많이 건조하고 습기도 많고 덥고 그런환경인곳이  거의 대부분인데요   가끔 야외에서 일하기도 합니다   내일까지 쉬어서 완전히 나은후 다음주 월요일날 나가는게 나을까요  편도염 회복을위해  아니면 금요일날 출근하긴하되 건조한곳이 없는곳에서 일을하면서 하는게 나을까요    의사분들의 의견이 궁금합니다  ,이비인후과
코로나 양성이면 결과,제가 자가키트  줄떠서 아침에 바로 보건소가서 검사 했는데 지금 결과 기다리고 있는데 언니가 막 양성이면 지금 결과 나왔다고 코로나 아니라면서 방에 막 들어오는거에요   진짜 양성이면 검사가 일찍나오나요 ,이비인후과
혀 밑에 물집,혀 밑에 이렇게 물집처럼 뭐가 생겼는데 이게 뭔가요  ,이비인후과
코막힘에 대해 질문,코가 막혔으면 왜 잔여 콧물이 계속 나오나요 ,이비인후과
목아픔 비염  코막힘 목소리쉼   코로나 ,안녕하세요   며칠전 갑자기 콧물 물처럼 뚝뚝 계속 떨어지고 투명한   이 수시로 나오고 재채기까지 연속적으로 계속 했습니다  몇시간동안 계속 지속             밥먹다가도 물같은게 코에서 떨어졌어요      그리고 그 다음날 목이 뭐가 걸린거처럼 이물감이 있고 아팠어요  열전혀x     도     도   그러고 코가 막혀서 구강호흡이 되더라구요     그 후 목소리가 쉬었어요   코로나자가키트  회 음성  지금도 목소리가 조금 쉰상태고 비염처럼 비염증세가 조금 남아 있어요  목통증까지는 없고 가래가 목에 걸린거같은 느낌이 들어요      여기서 자가키트를  회 더 했는데 또 음성나왔습니다   현재 이상태로    일째인데  주변사람들도 특이 증상은 없는거같아요    집에선 최대한 마스크쓰고 밥도 절대 공유하지 않고 있습니다    이상태인데 혹시 코로나 증상과도 연관성이 있을까요  자가키트를 몇회했지만 음성으로 나와서 다행이긴한데 키트가 정확도가 높진않다고 들어서요      증상한번 보시고 조언좀 부탁드리겠습니다  감사합니다 ,이비인후과
침 삼킬때, 일 전부터 침 삼키면 완쪽 목과 왼쪽 귀가 살짝 통증 이 있어서 검사했더니 음성이였습니다  총  번  타이레놀 먹었는데 오늘은 침 삼키면 칼칼해요   다른 증상은 암것도 없어요 소리를 자주 지르고 집이 건조 해서 그런듯 한데 코로나는 아니겠죠  어떻게 해야 나을 수 있나욤,이비인후과
코로나 밀접접촉자,학생인데요 어제 저희반에서 확진자  명이 나왔고요 학교에 자가기트 일주일동안 하라고 줬어요  어제는 음성  확진자인 친구들이랑 저랑 자리가 거의 붙어있고요 동생 반에도 어제 확진자가  명 나와서 저는 동생 밀접접촉자의 가족 이 되는거고 또 어제 저 친구가 밀접접촉자가 됬다고 하더라고요  그럼 저는 밀접접촉자  명과 연관되어 있잖아요 밥먹고 할거 다했는데 키트 음성 나와도 일상생활 가능한건가요  아버지가 자영업자여서 어디 나가기도 그런데 학교는 오라하고 학원에서도 오라는데 기준이 하도 많이 바뀌다 보니 나가도 되는건가 모르겠습니다,이비인후과
인후통 귀 통증,인후통이심해서 약먹었는데도 며칠째안낫고 있는데 귀가 아픕니다  혹시 인후통땜에 청각을 잃진않겠죠 ,이비인후과
선천성이루공, 개월 아기라서 수술까지 정말 가고 싶지 않네요   지금 이렇게 이루공에 고름이 딱지처럼 생겼는데  면봉으로 제거 해 주어야 할까요  아님 그냥 놔두는 게 좋을까요 ,이비인후과
목구멍 붓기,목구멍이 부은게 이렇게 보일정도면 심각한거 아닌가요   인후두염은 음성임에도 불구하고 진료 자체를 안해주니 정말 힘드네요     ,이비인후과
대학병원 코 수술,대학병원에서 코 수술을 하면 예쁘게 잘 해주실까요   비중격 만곡증이 있어서 한 쪽 코가 완전 막혀있어 이번에 수술을 하기로 했는데 작은 수술은 아니라 대학병원에서 하기로 했습니다   광주사람이라 전남대병원에서 하기로 했는데  이번에 비중격만곡증 수술을 하면서 외관도 예쁘게 하는 게 좋을 것 같더군요   그래서 전남대병원에서 성형외과와 협진을 하게 될 것 같은데 막상 하려니까 모양 예쁘게 잘 해줄지 걱정이네요,이비인후과
목 부었어요,제가  남매 거든요 근데 오늘 셋이 갑자기 목이 다 부었어요  진짜 신기하긴한데 왜이럴까요  코로나 자가진단 키트로 해봤는데 음성이더라구요 왜 부었을까요 글고 타이레놀 먹어도 낫나요 ,이비인후과
코로나 목 상태,월요일에 같이 학교갔던 친구가 월요일에 확진판정 받았는데 친구가 나눠준 포장지없는 사탕 먹고 그랬는데 지금 좀 목이 아픈거같아서 보는데 부은건지 모르겠어요   기분탓일수도 있는데 부은건가요   ,이비인후과
코로나 양성 반응이 나왔습니다 ,저는 어머니랑 둘이 살고있는데  어머니는 회사에 알려지는걸 꺼려하십니다  무급 휴가에 소문 도는게 싫으신가봐요   저는 오늘 새벽에 자가진단키트로 검사했더니 양성 반응이 나왔습니다  저희 엄마도 검사 받으셔야겠죠         둘 다  차까지 맞았습니다,이비인후과
코로나 격리 해제,확진되고 이번주까지 격린데 걍 격리 끝나면 나가도 되는거에요   괜찮아진듯 해서 격리 해제 했다가 다 나은거 아니면요   확진자 되고 PCR은 죽은 바이러스 땜에 양성 나와서 못한다구하는대 그럼 어떻게 보장해요 ,이비인후과
편도암인가요,침삼킬때 아프진 않은데 이게 도대체 어떤 증상인가요  말씀좀 해주세요,이비인후과
코로나 중이염,제가 오늘 양성을 받았는데 증상이 콧물이랑 목따가움 근육통이있어요 근데 제가 만성 중이염이있어서 코감기 걸리면 중이염이 같이 와요     그래서 중이염같이 귀가 멍멍해서 어지러워 죽겠는데 항생제는 병원가서 처방받아야되고   어떡하죠    죽겠습니다 항생제 어떻게 못구하나요 ,이비인후과
코로나 자가격리후,제가 코로나 양성판정을    일에 받아서 격리 기간이    일에 끝나는데 목요일부터 학교를 오래요 그럼 양성이 나와도 가야하는 건가요     그리고 혹시 격리가 이번    일에 끝나고 이번주 일요일 쯤에 친구들이랑 영화관 가는건 좀 오바겠죠     진짜 보고싶은 영화가 개봉해서   좀더 기다렸다 갈까요  ,이비인후과
큰 소리를 들으면 귀가 멍하고 아파요,옆에서 누가 소리를 지르면 귀가 멍하고 아파요 그 뒤로도 귀가 막 피곤하고 그런 느낌이에요,이비인후과
코로나양성,동거인 한 명있는데 코로나 결과는 아직 안 나왔는데 양성이면 동거인도 검사 받고 양성 뜨면 격리 해제 후 다시 pcr검사 의무적으로 받아서 음성인 거 확인 해야하나요   저랑 동거인이랑 격리 해제 후 pcr검사 꼭 받아야하나요  ,이비인후과
코로나 확진 후 인후통이 너무 심해요, 일차인데 사진상으로 인후쪽이 많이 헐어있나요  뭘 삼키는 데도 아프고  기침하면 찢어질 듯이 아프고    종합감기약이랑 진해거담제만 먹고 있는데 전문의약품 처방 받아야될까요 ,이비인후과
비염   비중격만곡증만 있으면 비밸브 수술 가능한가요 ,축농증은 없고 비염   비중격만곡증 있다고 들었는데요  제가 불안장애 때문에 이틀동안이나 거즈 끼고 자는 건 힘들 거 같은데 하루 정도는 참을 수 있을 것 같거든요   비염   비중격만곡증만 있는 경우에는 비밸브 수술이 가능한 건가요 ,이비인후과
편도암일까요  ,왼쪽 편도에 자꾸 이물감이 듭니다   편도암일까요  ,이비인후과
비중격만곡증 후 운동,비중격만곡증 비벨브협착증 수술을  월   일날 받고   일에 안에 고정하는거까지 모두 제거 했습니다  지금 킥복싱학원을 다녀도 되나요   얼굴을 맞거나 하는건 없습니다  그냥 앞뒤좌우로 움직이니깐 얼굴이 흔들리는 정도입니다 ,이비인후과
밀접촉자 기준,친구항원검사양성   일전  일내내 만났고 마스크 벗고 대화도하고 밥도먹음 친구  차까지 백신맞고 저는  차까지 맞았는데 친구 확진판정이 나오면 저는 밀접촉자인건가요   만약 밀접촉자가 아니라해서 항원검사를 받고 음성이 나오면 그냥 일상생활을 해야할지 잠복기 일수도 있으니 출근 하지말고 집에 있어야할지     이걸 어디에 물어봐야할까요    어제밤부터  심한거는 아님  목통증 두통   오늘 몸살기운 이런데   어째야할지  ,이비인후과
코감기이후 냄새가 안나요,코감기 코가 뚫린이유로 코에서 냄새가 안나요     일 전도 됐는데 냄새가 아주 희미하게 나여    이비인후과에도 갔눈데 코에 아무이상 없다고 했는데 왜 그럴까요   그리고 코쪽에 가래가 살짝 껴있는 느낌도 들어요    침삼킬땨 가래가 있는 거 같아요    음성판정 받았습니다    구리고 탄냄새 담배냄새도 살짝 나는 거 같아요    ,이비인후과
청각 장애 정밀 검사,엄마가 한 쪽 귀가 안 들리세요 젊었을 때 갑자기 안 들리기 시작했다고 하셨는데    혹시 이 원인  을 제대로 알아보려면 어느 병원으로 가야하나요  대학병원 이비인후과에 가면 원인을 알 수 있는 정밀검사를 해주시나요 ,이비인후과
워축성 비염 정상으로 돌릴수있나요 ,비염수술 일체 안했습니다   위가 안좋아진 뒤 축농증 한번 걸리더니 그 뒤로 쭉 이어오네요     년째입니다   코 점막은 항상 건조하고 어쩔땐 땡기구요   노란가래와 찐득이는 콧물들이 목 뒤로 항상 넘어옵니다  앞으로는 절대 안나오구요   간혹 재채기하거나 울었을때만 콧물이 앞으로 나옵니다   위축된 코 점막을 살릴 방법은 없을까요   코가래와 악취때문에 너무 힘듭니다      광고글 일체 사절입니다   ,이비인후과
자가진단키트 희미한 두줄,희미한 두줄도 양성 가능성 있나요    분 되기 이전부터 이랬어요   ,이비인후과
비중격만곡증 심하나요  ,최근    년동안 잠잘때 코막힘이 심해서 잠을 잘 못자고 자주 깹니다 코골이도 심하구요  일상생활때는 코막힘 느끼나 심하지는 않습니다   이비인후과에서 비중격만곡증 있으나 심하지는 않고 비후성비염은 심하다 진단받아서  달이상 약물 복용하였으나 슈도에페드린 부작용 가슴두근거림 각성상태 때문에 중단 하고 선생님은 하비갑개만 수술 하자하십니다  약물복용은 그때뿐 중단하면 다시 코가막힘   다른 큰병원에서는 비중격만곡증도 있기 때문에 같이 수술하는것은 어떻겠냐는 의견이구요 선택은 제가하라고하네요   비중격을 같이 진행할지 하비갑개만 수술할지 CT좀 봐주세요,이비인후과
편도결석 냄새,평소에 편도결석이 많이 생기는 편이라 구멍도 많이 커진 상태입니다  근데 요즘 침삼키면 쿱쿱한 냄새가 느껴져서 결석이 생긴 줄 알고 편도를 살펴보면 아무것도 없습니다  침삼키면 너무 불편한 냄새가 진동하는데 정작 제 눈에는 편도 결석이 안보이는데 어떤 문제인지 궁금합니다,이비인후과
