0,1,2
피가래가 나오는데 코로나일까요  내공    ,안녕하세요 얼마 전인  월  일에 미열  코막힘  목 칼칼함 등의 증상으로 인해 이비인후과에서 심한 비염과 약간의 인후염을 진단받고 약을  일분 처방받았습니다  인후염은 항생제를 처방받지 않을 만큼 정말 약한 상태였었고 진해 거담제  헥사메딘 가글약   진통제 등을 처방 받았고 빼먹지 않고 잘 복용했는데 오히려 피가래가 나올 만큼 심해졌습니다  코피가 난 적도 없구요  기침도 없습니다  반에서 확진자가 계속 나와서 코로나가 아닐까 하고 자가키트는 계속 해봤는데 음성 나왔습니다   약을 처방 받고도 인후염이 이렇게 빨리 악화될 수가 있는 건가요     ,이비인후과
코로나 일까요,금요일날 껴안고 하교같이하구 이야기하던 친구가 토요일날 양성 받았어요 아마두 학교에서 확진된거 같다던데 암튼 토요일날  번 자가키트 하고 일요일날  번 했는데 다 음성나왔는데 오늘 아침부터 콧물이 나오며 기침하다가 저녘 부터는 두통이 있어요  pcr받고 싶은데 음성만 나오니깐 못 받고   ,이비인후과
오미크론 증상인가요 ,안녕하세요 몇일전부터 목이 조금씩 간지러워서 자가진단키트 두번 해봤는데 음성이였습니다 그냥 목감기같아서 시간 지나면 괜찮아질줄 알고 약은 안먹었구요 오늘 자고 일어났더니 기침이 좀 더 심해지고 목이 엄청은 아닌데 조금 아파요    그래서 자가진단키트 해봤더니 음성인데 또 검사 했을때 양성으로 바뀔수가 있나요    열은 안나고 콧물 코막힘같은거 없이 목만 간지럽고 기침을 해요   목이 이상한지는 한  일 지났어요,이비인후과
목에서 피맛이 나는데  출혈이 없다네요 ,작년   월에 모더나 부스트 백신을 맞은 뒤로 자꾸 목에서 피맛이 납니다  근데 출혈도 없어서 원인을 못찾고 있어요  림프 혹은 가래도 이렇게 비릿한 맛이 난다고 하는데요  도대체 원인이 무엇이고  어딜 가야 되는걸까요  이비인후과 여기저기 가봐도 답을 못찾네요 ,이비인후과
코피가 너무 많이 나와요,코로나 양성판정 받고나서 코피가 엄청 많이 나와요 어저께도 엄청 나오고 어제도 그렇고 오늘도 그렇네요 어제는 너무 많이 나와서 코를 후지로 막고 있었는데 제 코 길이에 두배가 되는 코피 덩어리가 나왔어요 친구들도 사진보고 빨리 병원가라고 하는데 가야하나요 ,이비인후과
목이 자꾸 아파요,열도 없고 기침이나 가래도 없는데 자꾸 목이 아파요   가만히 숨만 쉬어도 미미한 통증이 있고 뭔갈 삼키거나 하품을 하면 통증이 너무 극심해서 얼굴이 절로 찡그려집니다  처방을 받아 약도 먹어봤지만 전혀 효과가 없어요  일째  아픈 걸 참고 물을 쉴 새 없이 마셔주면 비교적 통증이 좀 안화되지만 원래가    이었다면   정도로  물을 한 십분 정도만 안마셔도 다시 통증이 심해집니다  그러니 자고 일어나면 똑같이 원상복구가 되요  더 심해지지도  그렇다고 나아지지도 않은 채  일째 이 통증에 시달리고 있습니다  처음엔 단순히 목감기려니 했는데 약을 먹어도  뜨거운 물 따뜻한 물 미지근한 물 차가운 물 뭘 마셔도 쉬이 나아지질 않으니 스트레스가 극심합니다  원인조차도 모르겠어요   어떻게 하면 나을 수 있을까요 ,이비인후과
감기 귀먹먹 병원,사흘 전부터 감기 걸린 이후로 귀가 너무 먹먹해요 지금은 우우웅 거리는 것 같은 느낌까지 나는데      어떡하죠  병원가야하나여 ,이비인후과
껌이 목에 붙은 것 같아요,그냥 가만히 붙어만 있는 게 아니라 침 삼키면 내려갔다가 가만 있으면 이게 점점 목구멍 타고 올라오는   것 같은데 물도 마시고 음식도 삼켜봤는데 안 떨어집니다 아픈 건 없지만 신경쓰여서요 이비인후과 가면 빼주시나요 ,이비인후과
임파선염 목 멍울,목 임파선 멍울이 만져진거는 거의   년은 넘은것 같아요  왼쪽 목 멍울이 생겨 동네 이비인후과 가니 임파선염이라고 두달정도 약을 먹어도 멍울은 없어지지 않은채로 있었어요 통증은 없었구요        년뒤 대학병원에서도 임파선염 이라고 약을 주셨고 멍울은 여전히 사라지지 않은채  년이 지났는데도 멍울은 계속 있어요 멍울 사이즈는 작은거 같아서 가끔 멍울이 약간 커질때도 있어요 이비인후과 계통 수술은  번 받았었어요 편도수술  갑상설안낭종 목에 물혹   축농증 비중격 만곡증  현재 비염도 있어요   혹시 관련이 있어서 멍울이 사라지지않은건지   궁금하네요  대학병원 타과 외래가 있어서 가야되긴하지만 진료를 보는게 나은건지 아님 통증이 없으니 괜찮은지 궁금하네요  ,이비인후과
오미크론 증상,확진자와 마스크없이    시간 정도 접촉후 이틀이 지난 후 걱정이되어 아침에 이비인후과까지 가서 신속 검사를 했는데 음성이 나온후 구냥 감기겠거니하고 감기약 복용후  시간정도 잠을 자고 일어났는데 증상이 너무 나타나서요    혹시 그렇게 짧은시간만에 음성에서 양성이 나올 수 있는건가요    ,이비인후과
축농증인가요 ,코 안쪽에서 냄새 나는 것 같고 점성 강한 콧물이 나는데 풀어도 풀어도 코가 계속 막힌 것 같아요 콧물이 목에 잠겨있는 느낌도 들고 가끔 코 풀면 노란색 콧물도 나와요,이비인후과
