0,1,2
성대구증인가요  ,안녕하세요 성인 남성입니다  성대 내시경 사진 첨부하였는데     성대에 질환이 있는지 봐주실 수 있을까요  특히 성대구증인지 아닌지 자세히 봐주시면 감사하겠습니다      사진 기준 오른쪽의 성대가 더 두꺼운  이유가 뭔가요  사진의 각도를 고려해도 뭔가 좀더 두꺼워보여서요      혹시 성대구증이 아니라면 사진 기준 성대위쪽이 안붙는 이유가 뭔가요  발성의 문제인가요  이런거를 두고  성대 뒤가 벌어진 채로 발성한다  라고 하는건가요   발성이 많이 안좋긴합니다    증상을 읊어보자면 말하면서 호흡이 자꾸 새서 숨이 차고 부족합니다  그리고 소리가 웅얼웅얼 거리며 선명하지 않습니다  공명감이 아예 없는 느낌이고 큰 소리를 못냅니다  성대외근을 조입니다  애성 쉰목소리 이 나타나며 초등학생 중학생처럼 앵앵대는 목소리입니다  발음이 많이 부정확합니다  그리고 군대에서 긴장을 너무 많이하여 근긴장성발성장애가 있는 거 같기도 합니다   점점 말하기가 힘들어지네요  사람들이 제 말을 못알아듣는일도 점점 많아지고요   이상입니다  지식인 둘러보면 항상 최혁기 의사선생님이 영상답변으로 상세하게 알려주셔서 한번 여쭤봅니다 ,이비인후과
후두염 약,현재 거의  년가까이 목구멍 조임과 침이 잘안삼켜져 작년부터 병원을 다녔었습니다 목내시경을 해본결과 후두염이라는 판정을 받았습니다 그런데 병원에서는 위산을 억제하는 약 넥시움 케이캡   이런 약들만 처방해주고 다른약들은 처방을 안해주네요 약을 계속먹고 있는데 호전이 없네요 목조임이 괜찮아 질수있는 약없을까요   현재 권렬형 전자담배 아이코스 흡연중입니다    제발 도와주세요   ,이비인후과
편도선 종양,편도에 이런게 생겼는데 큰 문제 있는걸까요 ,이비인후과
편도부은후,자고 일어났는데 편도가 부은듯한 느낌이들어서 가래를 끓  서 뱉었는데 딸기으깬거같은 빨간가래가 나왔는데 왜그러는건가요  가래에 피가 섞여 나온거같은데,이비인후과
편도주위농양 재발,제가  월 일에 편도 주위 농양으로 대형병원에  일간 입원했습니다   월  일 병원 도착 당시 너무 아파서 거의 쓰러지기 직전의 단계였고 목 안에서 고름을 주사기로   cc를 빼냈고 그 뒤로 입원하여 스테로이드와 항생제  진통제 링거를 맞았습니다  퇴원 전 날 염증 수치가 정상으로 돌아왔고 다음 날 퇴원하여 일주일간 먹는 항생제와 진통제를 복용하고 다시 외래진료를 받았고 완전히 괜찮아졌습니다  근데  주 뒤  월 일 아침에 갑자기 목이 다시 아파지기 시작했고  월 일에는 죽을 것 같이 아파져 다시 응급실에 가서 치료를 받고  월 일에 입원실에 자리가 나서 입원했습니다  목 안에 고름은 저번과 마찬가지로 엄청 차 있었고 의사선생님꼐서 이렇게 빨리 심각하게 재발한 환자는 드물다며 이번에는 칼로 고름을 째서 뺴내는 작업을 실시했고 다시 입원하여 스테로이드와 항생제 진통제를 맞았습니다  그리고  월 일에 퇴원을 하고 또 일주일치 먹는 항생제와 진통제를 복용하였습니다  그리고 외래진료를 가서 또 재발할까봐  빠르게 수술 날짜를 잡는 게 좋다고하여  월 일에 수술날짜를 잡았습니다  근데 제가 월요일에 코로나 양성이 떠서 수술날짜를   일로 미룬 상태입니다   근데 오늘 아침에 갑자기 목이 또 아파서 느낌이 이상해서 밥을 먹고 항생제와 진통제를 먹었습니다  의사선생님께서 수술 입원  일 전부터 먹으라고 처방해주신 항생제가 있어 그걸 먹었습니다   그리고 좀 전에 자고 일어났는데 아침보다 목이 더 부은 상태입니다  목 안에 점점 고름이 차고있는 거 같은데 저 어떻게해야 하나요 방법이 없을까요 정말 너무 힘들어요 ,이비인후과
비염병원 실력 좋은 병원 있을까요 ,안녕하세요  제가 평소에 비염 때문에 고생을 많이 하는데요  이제는 치료를 해보려고 비염병원 치료 잘하는 곳으로 찾고 있습니다  비염은 수술 해도 재발도 잘 된다고 해서 막무가내로 수술 받기가 되게 꺼려지네요  비염병원 치료 잘하는 병원 잘 알려주시면 좋겠습니다 ,이비인후과
비중격만곡증 증상 정확하게 알고싶어요 ,안녕하세요  요즘 항상 자고 깨면 한쪽 코가 막혀서 불편하네요  비중격만곡증 증상인가 궁금해서 글 남깁니다  막히던 쪽만 계속 막히거든요   점점 막히는 정도도 심해져서 일상생활 하는데도 여간 불편한 것이 아니네요  비중격만곡증 증상 제대로 잘 알아보고 수술 하고 싶은데 수술 이후에 붓기나 재발 관련해서도 궁금한 점이 많습니다  비중격만곡증 증상 관련해서 잘 아시거나 이비인후과 의사 선생님들께서 정확하게 잘 알려주시면 좋겠습니다 ,이비인후과
가청주파수 범위가 너무 적은데 병원에 가야 하나요 ,중  남자아이인데요  공부 할때 들으라고 유튜브에서 MC스퀘어 음원을 들려줬는데 안 들린다는 거예요  그래서 아래 사이트에서 가청주파수 테스트를 했더니 두 군데 모두 대충   kHz   kHz 정도만 들린데요   https   www ultrasonic ringtones com  https   www arealme com hearing test ko   저는   대 후반인데   Hz   kHz 정도가 들리고  동생은 초 인데   Hz   kHz까지 들린다는데요  어떻게 중 이   Hz가 아니고   kHz이하에서 안들리는지 모르겠네요  지금까지 특별히 불편함을 얘기한 적도 없고 해서 전혀 몰랐습니다  이거 대학병원에 가야되나요  치료는 되는 건가요  만약 치료가 안된다면 살아가는데 어떤 문제가 있을 수 있을까요 ,이비인후과
청각과민증,고등학생 여자입니다  작년     월부터 갑자기 계속 뭘 먹을 때 쩝쩝거리는 소리 그릇들이 서로 마찰하여 나는 큰 소리 이외의 큰 소리들을 들으면 아주 가끔 귀가 아프고 처음에는 자동적으로 귀를 막고 그 이후에는 계속 나면 그냥 귀를 더 세게 막는 행동을 했는데 요즘은 식기구들이 부딪히는 소리가 들리면 여전히 귀를 지동적으로 막고 그 소리가 계속 지속이 되면 화가 나고 가슴이 답답하고 계속 한숨을 푹 쉬어도 답답함이 사라지지 않아 가슴쪽을 주먹으로 몇번 때려야 겨우 답답함이 사라지는 거 같습니다   청각과민증이라고 봐야하나요  만약 아니라면 왜 그런건가요   ,이비인후과
임신 극초기 코앤쿨 사용,제가 비염이 저어엉말 심해요 저희 가족 다 비염인데 저만 유독 심해서 잠자기전이랑 낮에 일할땐 꼭 코앤쿨 뿌리거든요  이번에 임신 첫째주가 되었는데 코가 너무 막혀서 일상 생활이 안돼요   가습기 하루종일 틀어도 별 차이가 없네요 코 세척도 꾸준히 하는데     임신중에 코앤쿨을 써도 될까요  다들 권장하지 않는다는데    일상 생활이 아예 안되니까 너무 힘들어요  ,이비인후과
저음성 돌발성난청 완치 이후,백신 맞고 저음성돌발성난청이 생긴 이후로 병원에 가서    달간 검사를 받고 약 복용도 하고 청각이 원래대로 돌아왔는데 요근래 이명이 자주 들려요    저음성돌발성난청 재발도 하나요  아직   대라 이대로 귀가 멀어질까봐 좀 불안해요 다시 병원에 가야할까요 ,이비인후과
메니에르 병 증상인가요 ,요 근래 왼쪽 귀가 하루종일 먹먹하다가 다음날 괜찮고 또 그 다음날인 오늘 왼쪽귀가 먹먹했는데 저녁에 갑자기 몸이 앞으로 쏠릴려고 하더라구요 어지럽고 누워있어도 어지럽고 몸을 세우면 자꾸 앞으로 넘어질것 같던데 왜 그런걸까요  게다가 오심과 구토 증상도 있었습니다 인터넷에 쳐보니까 이석증이나 메니에르 병같던데 병원에 가봐야할까요    시간 지나니까 귀 먹먹함이 사라지고 오심도 사라지고 현기증도 없어졌는데 그냥 일시적인건지 내원해야할지 고민됩니다    ,이비인후과
귀 막힘 먹먹함,몇 달 전부터 가끔씩 귀가 막혀요 언제 귀를 파고 나서 부터 막혀왔어요 왼쪽 귀만 그런상태에요 왼쪽으로 누우면 막히고 귀를 잡아 당기면 풀려요 그러다 몇초 뒤에 다시 막히고 그러다 몇 분있으면 다시 뚫려요 왜 이러는 걸까요 병원에 가야할까요 ,이비인후과
코수술 했는데 비주 피멍생겼어요,코수술 한지  일차구요 비순각교정   메가덤   연골묶기 했는데  비주 부분이 어제부터 땡땡붓고 아프더니 오늘은 피멍이 생겼네요   염증일까요  괴사일까요    아님 단순히 부운걸까요 도와주세요  ,이비인후과
한쪽 귀 잘 안들림,안녕하세요 고  학생인데 어제 자고 일어났더니 왼쪽귀가 잘 안들렸었어요   그러다 점심 지나고 나니 정상으로 돌아왔는데 요즘 이명같은것도 잠깐잠깐씩 자주 들리고 그런데 왜그런거죠    이어폰 이런것도 잘 안써요  청력이 떨어진 느낌도 없는데 무슨 병이 생긴걸까요 ,이비인후과
귀가 요즘 이상해요,지내다가 삐 소리도 들리고 우웅 거리고 심장이 뛰는 것처럼 쿵퉁거릴때도 있어요 누가 소리 지르면 울린다고 해야하나 그리고 방금은 귀에서 뭔 이이 이  소리가 나서 벌레인가 생각이 들어요     근데 제 귀가 진짜진짜 귀구멍도 진짜 개작아서 벌레가 들어올 수가 있나 싶은데   거의 유치원생 귀구멍정도로 작은데 벌레일까요 이명일까요        ,이비인후과
후비루인가요  약 추천해주세요,어제 저녁부터 약간 가래가 끼면서 코 뒤쪽의 콧물  점액이 자꾸 목으로 넘어가던데 후비루 맞나요  콧물이 앞으로 흐르지는 않고 코는 건조한 상태에요 그냥 뒤쩍 목으로만 흘러갑니다  누워있거나 잘때 더욱 심해집니다   너무 불편한데 후비루에 좋은 약이나 빨리 낫는법 알려주세요 ,이비인후과
경찰공무원 청력,청력기준이 좌우 각각   dB 들을 수 있어야하는데   제가 오늘 신체검사에서 이러한 판정을 받았습니다  기준 미달인가요 ,이비인후과
비염 때문에 두통 올수도 있잖아요,근데 지금 당장 코는 멀쩡한데 머리만 아플수도 있나요 ,이비인후과
귀에 딱지,제가 지난번에 손으로 귀파다가 귀에서 피났는데 오늘 귀 안쪽을 만져보니까 딱지가 져있더라고요 이 딱지 나중에 자기 스스로 떼지나요   이 딱지 어떻게 해야지 좋을까요  ,이비인후과
귀에서 소리,오늘 수영장을 다녀왔는데 귀에 물이 들어가서 뺏어요 근데 그 후로 부터 귀에 힘줄때마다 물들어간 귀에서 부스럭 부스럭 소리가 나요   이거 어떡해야하나요 ,이비인후과
귀가 안 들려요,초   그때부터 귀가 잘 안 들리고 삐  소리 들려서 큰 병원을 갔더니 아무 증상이 없다고 해서 그냥 지내다가 막 시끄러운데 있으면 더 안 들려요 그냥 평소에도 남들보다 상대방 말을 잘 못 들어요 큰 일인가요   아니면 제가 비염이긴 한데 연관이 있나요 ,이비인후과
왼쪽 코구멍이 막혓는데여,완쪽 코구멍이      에서 한      막힌거 같습니다 약을 처방 받아야할따요  코로나 검사를 해서 음성입니다 혹시 약 말구 치료할게 뭐잇나요  막힌지 한    일 댄거 긑아요,이비인후과
가족확진인데 신속항원에서 음성나왔으면 등교해야하나요 ,가족이 오늘 확진되서 저도 오늘 조퇴를 하고 신속항원검사를 받았는데 음성이 나왔어요 그런데 저는 지금 미열 가슴통증 잔기침 콧물 목부음 이물감 침삼킬때통증이 있는 상태라 아직 잠복기인 것 같아서 학교에서 제가 전파시키고 다닐까봐 무서워요 최대한 말 안하고 조용히 있을거긴한데 모둠활동도 잦고 이동수업도 잦다보니   급식도 다 붙어서 먹고   내일 아침에 자가진단키트를 해보긴 할 건데 음성이 나오더라도 학교를 가는 게 맞을까요     혹시 증상이 심해져서 내일 결석을 하게되면 인정 결석 처리되는건가요 ,이비인후과
코로나 자가키트 음성 대학교 출석인정,지금 몸이 너무 안좋아서 자가키트를 하려는데 오늘은 몸이안좋아서 오후수업을 못들어갈거같아요  만약에 자가키트에 음성이 떳지만 몸이 너무 안좋아서 그날 출석을 하지않아도 출석인정이 돼나요  출석인정이 안됀다하면 병원에가서 처방전을 가져와야하나요  ,이비인후과
코수술  주차인데 면봉에 식염수 묻혀서 좀 닦았었는데 괜찮을까요,코안쪽이 찝찝해서 몇번 멸균면봉에 식염수묻혀서 닦았는데 안좋다네요   이거 괜찮을까요 콧물이 과하게 많이 나기는 하는데,이비인후과
축농증일까요  아니면 다른 병이 있는걸까요 ,증상  코막힘 콧속 딱지 피딱지  코피 매우 자주남   코세척 혹은 코풀다가 좌측 코에서만 코피가 자주납니다   두통 두통은 우측에 발생  귀안이 답답함 우측만 그렇습니다  꽉막힌 느낌   자다 깨는데 이유는 양쪽 코를 딱지가 완전 막아버림   콧속에 코털끼리 엉겨붙어서  막같은게 형성되고 딱딱하게 바뀌면서 코를 막는것처럼 보임  코 깊이 안쪽 딱지가 생기는데 피딱지 안쪽을 막아버림 숨쉬기 매우힘듦 딱지를 때면 두통도 없어지고 콧속이 매우 시원합니다   잇몸 통증 우측 하단 어금니 부분  어제부터 부어있음 만지면 아픔  좌측 상단 송곳니 부근 잇몸과 이사이에 구멍 같은게 생김  그안에 공기 같은게 차있음   뒷통수 부근이 가끔 따끔따끔함   먼가 큰병이 생긴건지 축농증때문인건지      미처버릴 노릇입니다    코세척하다가도 코피가터지고   먼가 꽉막힌느낌 이예요   답답하네요   대학병원을 가야할지 동네 비이인후과를 가도 알 수 있는지    이런 증상 격어 보시거나 아시는분 계신지요   입술은 매마른지 오래됫어요      ,이비인후과
코 안에서 이상한게 나왔어요   ,코 수술 한지    년이 지났습니다  근데 오늘 코 에서 뭔가 딱딱한게 느껴져서 코를 한번 풀었는데 이런게 나왔습니다   코딱지는 절대 아닌거 같은데 이게 뭐죠    뭔가 하얗고 구멍이 일정하게 나있는걸로 봐서 절대 자연적인건 아닌거 같아요   병원가봐야 하나요   출장중이어서 걱정이 이만저만이 아니네요       실리콘 넣지않고 비중격연골 사용했는데 애초에 코 안에서 이런게 나올수가 있나요 ,이비인후과
코로나확진인데 코막힘,코로나 확진됬는데 코가막혀요   코막힘이 뚫렸다가 자려고 누웠는데 다시 코막혀서 너무 스트레스 받아요   약을 써봤는데 뚫렸다가 누우면 다시 원상복귀에요   너무 괴로운데 어쩌죠  ,이비인후과
비중격만곡증 수술 후 입천장,비중격만곡증 수술한 후에 윗니 바로 뒤쪽에 입천장쪽이 튀어나온 거같아요 처음에 마취때문에 부은줄 알았는데 그냥 뼈인거 같아요 완전 딱딱한거보니까   조금만 단단한거 먹으면 입천장이 계속 상처나서 너무 아파요 원래 그런가요  해결법은 어떻게 해야될까요,이비인후과
코 골절입니다 ,안녕하세요  저번주 화욜쯤에 코를 다쳤습니다 목욜쯤에 병원을 가서 씨티를 찍어보니 골절이라고 하더라구요 그러면서 붓기 빠지면 코가 휠수도 있다고 하더라구요 그래서 도수정복술을 해야한다고 하던데  코 골절되면 무조건 코가 휘나요  안 휠 수 없나요  그리고 오늘로서 다친지 일주일짼데 아직도 붓기가 안빠졌어요   찾아보니  주면 뼈가 붙는다던데 도수정복술 하려면 다치고   일이내에 무조건 해야한다는데 큰일이네요     아니면 붓기가 아직 덜 빠졌는데 도수정복술 가능할까요 ,이비인후과
가래가 안 밷어져요,중 인데 코로나에 걸려서 막 목에 가래가 생기는데 갑자기 가래가 턱 걸려서 미친듯이 기침을 해대고 그 특유의 목막힘과 함께 목이 드르렁 거리고 물을 미친듯이 마셔내고 미친듯이 기침해대서 겨우 가라앉히고 이걸 계속 반복하는 중이에요    밷으려고 해도 막 목이막혀서 숨이 안쉬어져서 죽을까봐 울고    이거 해결방법 좀 제발 알려주세요   약을 먹어도 낮질 않아요,이비인후과
항생제    일째 먹고 있습니다,델타 중이염 코막힘 오미크론  이렇게 쭉 다 걸려서    일 넘게 항생제 먹고 있습니다    이게 제 몸에 어떤 악영향을 줬을까요 괜찮나요,이비인후과
목에 걸린느낌,오른쪽 목구멍에 무언가 걸린느낌이 자꾸 들고  통증은 없으며 다른 증상은 없는데요  어제 저녁 갑작스럽게 증상이 생겨서 오늘 아침 병원에도 갓는데 대충 진료를 아 해보라고 하시고 보시고 소염제 처방을 받았는데요  먹어도 단시간만 좀 괜찮고 계속 걸린느낌이 들어요   흡연자여서 그런건가요  혹시 다른 병원 재 방문을 해야될까요  병명이 궁금합니다  ,이비인후과
후두내시경 질문,후두내시경을 할때 그냥 목안을 눈으로 보는거보다 내시경토왜 보면 진찰을정확하게 할수있나요   그냥 목만좌도 편도염이다 인후염이다 아는데 후두내시경을 통해 인후염 알수있나요  식도염도 진찰되나요,이비인후과
고막에 귀지 붙은 것 같아요,어제 귀가 좀 멍멍하고 하품하고 밥 먹을 때마다 오른쪽 귀에서 귀지 도르륵 소리가 났는데 오늘은 엄청 멍멍하네요  이거 자연적으로 떼지는 건가요 ,이비인후과
한쪽귀가 먹먹해요,한쪽귀가 먹먹해졌었다가 지금은 괜찮아졌는데 그래도 검사 받아보는게 좋겠죠  이어폰을 평소에 한쪽만 끼고 자주듣는데 그게 영향이 있을까요 ,이비인후과
자꾸 콧물 재채기가 나와요,  대 여성입니다  태어나서 비염같은거 앓아본 적도 없고  남들 먼지 많다고 할때 그런거 하나도 못알아챌정도로 코쪽이 안민감했는데요  한  주전부턴가 코안이 간지럽고 계속 재채기가 나옵니다  콧물은 당연히 나오구요 맑은 콧물과 누런 콧물이     비율쯤으로 나오는데 종종 피도 같이나와요  코피말고  그냥 살짝 혈흔정도   장소는 가리지않고 그냥 간헐적으로 계속 그러고  매번 코를 풀어줘야해서 힘든데 혹시 이게 비염인가요  어떤 병의 증상인지 궁금하네요  ,이비인후과
이비인후과에서 림프종,이비인후과 의사님이 제가 부은 림프절을 만져보시고는 고정되있지 않고 이정도면 잘 움직이고 크기도 새끼손톱만해서 ct촬영이나 조직검사사 필요하지 않다고 하셨는데 제가 만지면 분명      cm정도에 잘 안움직이는데   그냥 의사님 말씀을 믿는게 맞을가요 아니면 다른 병원을 한번 더 가볼가요 ,이비인후과
구내염 임파선염 통증,입에 구내염 두 개가 생기고 난 후 턱과 목사이에서 멍울  같은게 잡히면서 통증이있습니다   보통 푹 쉬면 치료가 된다는데 운동은 해도 될까요 ,이비인후과
설암초기증상일 수 있나요 ,좀 오래되서 얼마나 된지 기억이안나는데 그냥 데여서 그런가보다했거든요 근데 회복이 안되고 계속 저 상태에요 오히려 환부가 점점 넓어지는거 같기도하구요 느낌은 평소에 아픈건 없고 양치하고 혓바닥닦고나면 데였을 때 쓰림이 살짝 있습니다 설암일 수 있나요 ,이비인후과
어지럼증 후 이명, 월에 처음 구토를 동반한 심한 어지럼증이 왔어요  두통은 없었고 이명 충만감은 잘 모르겠어요  코끼리코 돌기랑 비슷한 증상  두시간 정도 지속되고 안정   잘 지내다  주후 같은 증상이 왔어요  다음날 이비인후과 갔는데 평형검사 청력검사 별 문제 없다고  어지러우면 다시 오라고    검사 당시 어지럼증은 없었어요   지금 열흘정도 됐는데 다른 증상은 없고 전자음 같은 소리가 들리네요  이게 이명인듯   질문  혹시 메니에르일가요  어지럼증 멈추고 뒤늦게 이명이 오기도 하나요  신경과 진료가 필요할가요 ,이비인후과
목구멍 간지러움 매번 같은 곳 ,목구멍 혀끝에 옆부분  약간 돌기가 나있는곳  그 부분이 가끔씩 간지러워서 기침이 나요    매일 그런게 아니고 어쩌다 한번씩 잊을만하면 나네요   원인이 뭘까요     코로나는 아닙니다 ,이비인후과
잘 외우는 법 역사  과학 ,안녕하세요 올해 중 라서 곧 한달 뒤에 중간고사를 치는데 과학이랑 역사 쉽게 잘 외우는 법 좀 알려주세요    과학은 진짜 하나도 모르겠어요   ,이비인후과
콧볼 옆쪽 코 밑쪽 통증과 붓기,제가 어제부터 콧볼 옆쪽과 코 밑쪽이 멍든것처럼 뻐근하게 아파요    제가 몇일 전에 코 축소 마사지한다고 꾹꾹 눌렀는데 그래서 그런걸까요  약간 코가 부어서 커진것도 같고요    이거 그냥 냅두면 돌아오겠죠    ,이비인후과
편도결석 질문이요  사진주의 ,안녕하세요 최근 년전부터 분진이 제철소 매우많은 공장 에서 일을 하기시작할때부터 목에 이물감이 들더니 목도 아팟다가 갑자기 그이후로 편도결석이 생겼습니다   이원인이 정확한지는 모르겠습니다 그전까지만해도 편도결석 영상만봤지 한번도 입안에서 저런게 나온적이없어서요 결석을 빼지않으면 목넘김이 가래가 있는것처럼 불편한데 치료법이없나요  편도제거수술 같응걸 하면 낫아질까요 ,이비인후과
콧물이 목구멍으로 넘어가는걸 방치할 경우,작년 이비인후과에 갔을 때 목에 자꾸 이물감이 느껴진다 하니 의사분께서 콧물이 목구멍으로 넘어가서 그렇다 하셨습니다  그 이후로 목구멍에 이물감이 느껴지고 기침을 해도 이물감이 없어지지 않는거 제외하곤 통증이나 불편함이 없어서 그대로 방치하고 있는데 이럴 경우 다른 문제나 질환이 생길 수 있나요   얼른 치료받는게 좋을까요  ,이비인후과
입 안에 뭐가 났어요 점액낭종  ,입안에 뭐가 났는데 찾아보니 점액낭종같아요 자극적인 음식을 먹고나니 커져서 불편합니다 정확히 뭔지  어떻게 없애는지 궁금합니다 ,이비인후과
점액낭종 수술 후 입안에 굳은살 같은게 생겼어요,아랫입술에 점액낭종이 생겨서 이비인후과에 가서 제거를 했습니다  예전에 수술을 했다가 재발해서 이번이 두번째입니다   처음에는 절개했던 부분이 부어서 몰랐는데 시간이 지나고 붓기가 가라 앉으면서 절개했던 부위에 혹처럼 굳은살느낌 덩어리가 잡히더라고요  이전의 점액낭종과는 다르게 물컹하지도 않고 좀 딱딱합니다  수술을 한지는 약  달 다 되어갑니다  수술했던 부위가 꿰멨을 때의 모양이 조금 잡혀있습니다      입안에 생긴게 무엇이고  어떻게 해야 없어지나요     수술 후 입안 말고 입술 바깥에 감각이 느껴지지 않는데 완전히 낫는데에는 보통 얼마정도 걸리나요  의사 선생님이 재발하지 않는게 좋겠다고 엄청 깊이까지 팠냈습니다   자세하고 친절한 답변부탁드립니다 ,이비인후과
혀 밑에 하얀 물집, 주 전에 생겼구요 그땐 점액낭종처럼 투명한 물집이었는데 이게 없어지진 않고  주 전부턴 흰색이 됐어요   투명할땐 커졌다 작아졌다 했었는데 흰색이 된 후로는 계속 저모양 저 크긴데 말할때도 보일 정도라 스트레스 받아요  프로폴리스도 써봤는데 효과 없었구요   구강암일까요     무슨 병인지  어느 병원 가야되는지  수술 해야되는지 알려주세요     술담배 안 해요,이비인후과
편도에 흰점이 보이는데 염증인가요  결석인가요 ,  일 코로나 양성판정받았고 지금 목이 엄청 붓고 침 삼킬 때마다 아파요    사진으로 찍어봤더니 양쪽 편도 에 흰 동그라미가 생겼네요  염증인가요  그리고 목상태가 어떤지 궁금합니다 ,이비인후과
