124,어깨힘줄인대파열 회전근개파열인데요,어깨힘줄인대파열이 맞는 말인가요  힘줄이랑 인대는 다르다고 들었는데 어깨힘줄인대파열을 치면 힘줄에 대해서만 설명해주고 어깨힘줄인대파열이 맞는 말인지 알려주세요 제가 갖고 있는 건 회전근개파열이고 치료를 하면서 어떤 병인지 어떻게 관리해야 하는지 알아보는 중입니다,마취통증의학과
125,어깨수술 빨리해야 한다고 하던데,어깨가 아픈데 오랫동안 MRI도 안 찍고 치료만 받으면서 참아왔거든요  근데 이제는 그냥 일도 못 할 정도로 아파서 검사를 받았고 빨리 어깨수술을 하는게 좋다는 이야기를 들었습니다  힘줄이 파열됐고 빨리 어깨수술을 하는게 수술도 어렵지 않고 결과도 더 좋다고 하는데 이런 이야기를 들으니 빨리 어깨수술을 해야 할 것처럼 조급해 집니다  이게 사실인가요  조언 좀 부탁드려요 ,마취통증의학과
126,슬관절 골관절염 결국은 수술하자고,지난주에 슬관절 골관절염 진단이라고 진단받았고 일단은 치료를 하고 있는데 초기는 아니라고 해서 큰 기대는 하지 않고 있습니다  그래도 다행인건 아직 인공관절을 넣을 정도는 아니라는 건데요  그래도 슬관절 골관절염이라 그런지 수술을 피할 수는 없더라고요   다리 일자로 만들어주는 수술이랑 줄기세포 연골재생수술 하자고 하는데 그럼 슬관절 골관절염 많이 좋아지나요 ,마취통증의학과
127,경골골절수술 빨리 결정해야 하는데,그렇게 높은 곳은 아닌데 떨이지면서 다쳤어  바로 병원에 갔는데 경골골절수술을 해야 한다고 하더라고요  같이 엑스레이 사진을 보면서 경골골절수술을 해야 한다고 하는데 제가 보기엔 부러지긴 했는데 막 수술할 정도인가  싶은거예요  물론 의사선생님이 더 잘 아시니깐 앞에서는 말하지 못했지만 저는 정말 경골골절수술을 할 정도인가 싶어요  부러진 건 눈에 보이는데 깁스하면 괜찮지 않을까  싶습니다   빨리 결정하고 수술하는게 좋다고 하는데 어떻게 할까요  다른 병원이라도 한 번 가볼까요 ,마취통증의학과
128,십자인대 뚝소리 파열이 맞나요 ,십자인대 뚝소리 나면 끊어진거 맞나요  풋살하다가 미끄러지듯 무릎을 다쳤는데 이때 십자인대 뚝소리로 의심되는 소리가 들렸어요  이렇게 다친 후로 무릎이 아파서 꼼짝도 못하고 있고 붓기도 있는 상태입니다  그래서 십자인대 뚝소리라 생각되는 건데요   맞을까요 ,마취통증의학과
129,손가락 깊게 베인후 동네병원에서 두 바늘 꼬메후 약을 처방 받았습니다  로시스정  뮤코라민정  밤에 마취가 풀러서인지 통증이 심하더라구요  집에,손가락 깊게 베인후 동네병원에서 두 바늘 꼬메후 약을 처방 받았습니다  로시스정  뮤코라민정   밤에 마취가 풀러서인지 통증이 심하더라구요  집에 타이레놀이나 부르펜같은 진통제가 있는데 위에 약과 같이 섭취해도 될까요 ,마취통증의학과
130,가슴 밑 통증,갑자기 왼쪽 가슴 밑 갈비뼈쪽이 뜨끔합니다 전에 한번도 이런적이 없어서 좀 당혹스럽내요 일어날려고 하거나 누으려고 할때 뜨끔 하고 마는데 어디가 이상이 생겼는지 병원은 어디로 가야되는지 모르겠네요 갑자기 몸을좀 심하게 움직였는데 그담날부터 그러네요 다른증상은 없어요 뜨끔하기만 해요,마취통증의학과
131,비복근 통증 통증 좀 줄어드는 방법 좀 알려주세요 너무 아파요     ,어제  시간 정도 빡세게 걷고나서 저녁에 씻지도 못하고 잠들었는데 오늘 아침  시부터 지금 현재까지 종아리가 뒤틀리고 쥐어짠듯한 고통이 너무 심해서 올려봅니다     양쪽 다 그렇구요    최근에 격리 한다고 쭉 집에서만 있었어요 밖에는 안나갔구요 일주일정도 거의 누워만 있었습니다    고통이 다리를 좀 높게 들면 그나마 사그라 들지만 내리는 순간 지옥입니다        근데 몇시간 내내 들고있을 수는 없으니 답답해서 질문 남겨봐요    최대한 빠르게 부탁드릴게요  ,마취통증의학과
132,마취주사 통증비교,쌍커풀 수술할때 맞는 마취주사가 아픈가요  갈비뼈 부분에 맞는 마취주사가 아픈가요 ,마취통증의학과
133,허리통증 다리까지 아프고 화장실도 자주가고 싶어요   ,허리가    주째 아파서 수요일에 병원에 갔는데 이상이 없다고 주사를 맞았는데 그 이후에 다리가 계속 아프네요    화장실도 자주 가고 싶고    허리를 숙이거나 화장실 변기에 앉으면 너무아파서 못일어 나겠어요    내일 백신 접종인데 가능한가용  ,마취통증의학과
134,허리통증 ,새벽에 집에서 그냥 걷는데 허리가 갑자기 삐끗하면서 너무 아프더라구요 저가 무리하게 뭘 들은것도 아니고 그냥 거실에서 살짝 걸은건데    지금 통증때문에 움직이지도 못하고 누워만있는데 왜이러는걸까요   ,마취통증의학과
135,이틀전부터 왼쪽등 날개뼈쪽 신경이 누군가 콕콕 찌르는것처럼 통증이 느껴집니다 날개뼈가 아픈게 아닙니다   분 주기로 누군가 한번씩 찌르는 느낌입,이틀전부터 왼쪽등 날개뼈쪽 신경이 누군가 콕콕 찌르는것처럼 통증이 느껴집니다 날개뼈가 아픈게 아닙니다   분 주기로 누군가 한번씩 찌르는 느낌입니다 지금 코로나 확진된 상태인데 코로나랑 연관이 있는건지 아니면 별개인지 별개라면 어떤 증상인지 알고 싶습니다,마취통증의학과
136,왼쪽 겨드랑이 아래 통증,안녕하세요    왼쪽 겨드랑이 아래쪽 통증인데 한  일 정도 된거같아요  와이프가 아프다고 하는데 병원을 통증의학과 갔다왓는데 가도 그냥 신경통이나 염좌 역같은거만 처방해주더라고요    그런식인데 피부에 뭐 돌출되거나 그런 이상한건 없고 가만히 있어도 아프고 누르거나 움직이면 아프다고 하네요   아프기 전까지 격한 운동 한적 없구요 코로나백신 맞은적 없습니다  피부에 이상한 혹같은 것 없습니다  통증이 심할땐 가슴쪽도 아프다고 합니다  엑스레이나 초음파에서 이상없다는 소견 나왓습니다   이런 상황이면 어떤 병원을 가보는게 좋은걸까요  ,마취통증의학과
137,가슴에 통증이 있습니다, 일 전 부터 트림 할 때 가슴에 통증이 있습니다  가슴에 통증이 생기면서 목도 한 번씩 통증이 있고  목 뒤도 아프고  침 넘어갈 때는 괜찮습니다  그리고 소화 안되는 느낌이 듭니다  첫 날 보다는 좋아졌지만 그래도 아직 통증이 있어요  이유가 먼가요  식도염인가요  아님 그냥 잠자리 안맞는건가요 ,마취통증의학과
138,허리를 굽히면 왼쪽 갈비뼈 아래쪽에 심한 통증이    ,영멀이나 신발을 신으려고 허리를 깊이 숙이면 왼쪽 갈비뼈 바로 밑쪽에 심한 통증이 느껴집니다  무슨 원인인가요 ,마취통증의학과
139,사마귀치료,  많이 심한가요     레이저 치료 할려는데 많이 아픈가요    마취주사 얼마나 아프죠      치료하고 회복시간은 얼마나 되요 ,마취통증의학과
140,골반 뚝 소리,왼쪽 골반에서 뚝 소리가 자주 남니다  통증은 없어요  제가 일자허리인데 이것과도 관련 있을까요,마취통증의학과
141,왼쪽 갈비뼈 통증,작년 이맘때쯤 왼쪽 갈비뼈쪽에 뜨끔하면서 통증이 나타나서 내과에 갔는데 신경통인거 같다며 진통제만 처방해줘서 먹고 좀 괜찮아 졌다가 한  일 전부터 다시 왼쪽 오른쪽 번갈아가면서 다시 통증이 발생하고 있어요 하품이나 재채기 할때처럼 숨을 들이마실때 갑자기 뜨끔 콕 하고 통증이 나타나서 병원을 다시 가려고 하는데 검색해보니깐 정형외과 흉부외과 마취통증의학과 이렇게 여러군데가 나와서 어딜 가야할지 모르겠어요  ,마취통증의학과
142,가슴 가운데 뼈 통증  속 답답함,저번부터 가슴 가운데 뼈 통증이 심하더니 지금은 가슴이 답답하고 숨을 내리쉬기 힘들 정도로 자꾸 속이 답답하기만 합니다    소화가 안되는 건가 싶어서 프로바이오틱스등 먹고 있는데 계속 속이 답답하네요    제가 걱정이 너무 많아서 물어봅니다      혹시 이유가 뭘까요  그리고 속이 답답한걸 해결하는 방법이라도 있을까요 ,마취통증의학과
143,옆구리에 검은  ,사진처럼 옆구리에 볼록하게 검은   뭐가 낫는데 점일까요     아님 뭐가 난걸까요  ,마취통증의학과
144,오른쪽 가슴통증,제가 누워있따가 일어나면 오른쪾가슴이 통증이느껴지고 오른쪽가슴위쪽 눌러도 조금씩 통증이느껴지는데 왜그런건가요    코로나는 음성확진떳습니다,마취통증의학과
145,꼬리뼈 안쪽 근육 통증,꼬리뼈 가장 아래 안쪽의 근육 부위 통증이 있어요 사진에 파란색으로 표시한 부분입니다  오랜만에 스쿼트 같은 운동들을 간단하게 했는데 바로 통증이 생겼어요  전혀 무리하지 않고 가볍게만 했습니다  서서 허리를 아래로 숙일때나 요가에서 척추 말았다가 폈다가 하는 캣앤카우 자세 같이 특정 자세에서 더 통증이 느껴져요 예전에도 푹신한 슬리퍼를 신고 오래 서있었던 탓인지 똑같은 통증이 생겨서 병원에 간 적이 있는데 딱히 뚜렷한 말은 못 듣고 소염진통제 처방 받고 괜찮아졌어요 평소에 오래 걷거나 서있을 때마다 종종 이 부분에 통증까지는 아니더라도 약간 자극이 가는 느낌이 들어요 원인이 뭘까요  그리고 병원 갈때마다 웨이트 하지 말고 걷기 같은 가벼운 운동 하라고 하시는데 근육이 너무 없어서 근력운동을 해야하긴 하는데 어떻게 하는게 좋을까요,마취통증의학과
146,여자 왼쪽 아랫배 통증,처음에 장염끼가 있어서 병원을 갔는데 장염인거같다했어요  몇일 지나고 나니 배변은 잘하구 있어요  근데 의자에 앉을때마다 아랫배가 꼬인듯 아프네요 참을만한 고통정도지만 불편하게 아파요 누워있거나 걸을때는 괜찮은데 꼭 어딘가 앉을때 통증이 있네요 앉아있는상태에서도 계속 있어요  옆구리 근처 이런곳이 아니고 아예완전 아랫배 입니다  장염이 이런경우도 있나요   ,마취통증의학과
147,가슴 오른쪽 아래 갈비뼈 속이 콕콕 찌르듯이 아픕니다, 년넘게 담배를 안피다가 요즘 담배를 다시 피고있는데 담배를 피기시작하면서부터 통증이 생긴것 같은데요  혹시 폐암일까요  이런 통증은 어딜가서 진단을 받는게 좋나요 ,마취통증의학과
148,갈비뼈 맨 아래 미미한 통증,콕콕 쑤시는 느낌이고 완전 누울만큼 아프진 않구요 걸으면서 버틸수 있습니다 배에는 가스 찼구요 역류성 식도염이 있는거 같습니다 왼쪽은 통증이 더 적습니다 지금은 갈비뼈 중간부분에서 옆구리에 똑같은 통증이 있습니다,마취통증의학과
149,유방초음파,두달 전부터 오른쪽가슴 통증이있고 참을만한  크기도 왼쪽보다 딱봐도크고 겨드랑이에 멍울도 생겨서 오늘 유방외과가서 초음파후 조직검사를 했는데 의사선생님이 몇개멍울이있고 그중하나가 모양이 안좋다고 하시면서 암이 의심스럽다고 말씀하신것도 아니고 암같다고 가족들과 치료할 병원상의하라고   암일까요 지인들은 왜 조직검사 결과도 안나와는데 그렇게 말하냐고 답답합니다 참고로   세이고  년전에 폐경되구요,마취통증의학과
150,아킬레스건 발목  찌릿한 통증,통증이라고 하기에도 뭐한데   특정 자세나 행동에서 느껴지는 통증이 아니라 가만히 있을 때 한번씩 찌릿 하는 통증이 있습니다  걷거나 뛴다고 해서 더 느껴지는건 없구요  발목을 삔 적도 무리가 간 적도 없습니다  굳이 찾아보자면 아기를 안은 채로 어디선가 내려오면서 바닥을 좀 쎄게 딛은 정도는 있을 수 있습니다  혹시 이 증상과 관련된게 있을까요  발목에 염좌가 생긴걸까요  이틀째 증상이 있네요  증상이 너무 경미해서 아킬레스건염이나 족저근막염은 아닌거같은데 모르겠네요   병원에 가보기 전에 궁금해서 질문합니다  병원가서 진료받아보라는 답변은 사양할게요 ,마취통증의학과
151,고개를 오른쪽으로 젖히고 침삼킬때 전기통증,고개를 오른쪽으로 젖히고 침삼킬때 오른쪽 승모근   목오른쪽 이 전기가 팍온것처럼 찌릿거리는 통증이 오는데 이건뭐죠 심각한건가요,마취통증의학과
152,오른쪽 눈 통증,그 엄청 찌릿찌릿  하면서 아파요   ,마취통증의학과
153,손가락 끝 감각이 이상해요, 일 전에 친구한테 검지손가락 끝을 물렸는데 이후로 검지 끝부분만 감각이 이상하고 어디에 닿으면 딩딩한 느낌  여튼 느낌이 이상해요  피나거나 파인 건 아니고 겉모습은 멀쩡합니다  또 생활할 때 막 불편한 건 아닌데 신경 쓰면 거슬리는 정도네요 마취토증학과 같은 곳을 가볼까요  아니면 자연적으로 사라질까요   ,마취통증의학과
154,어깨 근육이 따가워요,어깨 근육이 말그대로 너무 따갑습니다 그냥 욱신거리는게 아니라 근육이 콕콕 쑤시듯이 아프고 따가운 느낌이에요 어깨 아픈지는  주에서  주 되어가는것같고 가슴쪽으로 어깨를 오무리면 통증이 더 심해집니다 스트레칭 할때도 시원한 느낌은 없고 너무 뻐근합니다 팔을 머리 쪽으로 들어올릴때도 통증이 있습니다 왜 이러는건가요,마취통증의학과
155,재채기할때 근육통증,안녕하세요    재채기할때마다 근육통증이 있어서 문의드립니다   재채기를 하면 팔근육이며 등근육이며 가슴근육이며 통증이 느껴집니다   왜 그런걸까요   만약 진료받게되면 어디 병원을 가야하나요 ,마취통증의학과
156,종아리 통증,제가 한  일전 잠을자고 일어났는데 갑자기 오른쪽 종아리가  땡기면서 아퍼서 잠깐 지나면 괜찮겠지 하고 있었는데 날이  지나면 지날수록 통증 쑤심 이 심하더라고요   손으로 종아리 누르면 너무 아퍼서 한의원에 가서  일동안  매일 침 을 맞았는데도 증상이 호전되지가 않네요   병원을 가고 싶은데 어느과병원으로 가야할까요  너무아파서 걸을때도 절룩 거리면서 걷습니다  도와주세요 ,마취통증의학과
157,목 톡증 이유,목이 토하고 나서 아픈 것처럼 통증이 있어요 어제부터 계속 그런데 왜 그럴까요   실제로 토할 것 같은 느낌도 들었구여  ,마취통증의학과
158,밖에서 배가 너무 아파요,방금 치과가서 불소도포하고 백화점 왔는데 불소 냄새때문에 안 그래도 배가 계속 아팠는데 속도 안 좋고    딱히 체할만한거 먹은건 없어요 닭볶음탕에 파전에 밥정도  왜 그럴까요   지금 반설사  약간 설사도 했어요,마취통증의학과
159,허리통증 여쭈어봅니다 ,평상기는 괜찮다가 물건을 줍거나 하려구 허리를 굽히고 펴면 아픞니다 주로 한쪽 측면 골반바로위가 아프고 반나절이나 하루가 지나면 괜찮아집니다   참고로 허리를 굽히고 오래있지를 못합니다  허리를 굽히고 좀있으면 허리가 무거워지는 느낌이 듭니다 ,마취통증의학과
160,왼쪽 턱밑 통증,왼쪽 턱살 있는 부분이 너무 아파요 고개 왼쪽으로 돌릴때 아프던데 아까 좀 딱딱한 젤리를 한 쪽으로만 씹은 것 같기도 하고    단순 젤리때문에 통증이 있는 걸까요   이거 왜아픈 거예요 ,마취통증의학과
161,팔꿈치를 괴고나서 통증이 있어요   ,스트레칭으로 쭈욱 펴주면 관절 찌걱하는소리랑 통증 살짝오면서 풀리긴 하는데 하루 쉬면 보통 낫긴 하거든요   병원이란곳을 잘 안가는 버릇이 있어서 그런데 가봐야 할까요   ,마취통증의학과
162,오른쪽 어깨 뚜둣소리  통증,오른쪽 팔을 옆으로 쭉 핀다음에 손바닥이 아래를 보게 하다가 위로 보게 하게 돌리면 어깨에 작게 뚝소리가 나면서 통증이 나요  운동할 때 뚝소리 나는 거 무시하고 그냥 했는데 어깨 뭐가 문제인지 알려주세 ,마취통증의학과
163,등 부위에 통증, 년전에 줄넘기 하다가 잘못 뛰어서 착지를 잘못했는데 그때 몸안에 있는 내장같은게 내려온 느낌이 들면서 등쪽 부위에 통증이 몸안쪽 내장에 통증이 느껴지고 한 초 정도 힘을주고 숨을 못쉬었어요 그러고 나서  시간 정도 지나니 통증은 없었지만 뛰거나 점프하면 통증이 있었어요 그리고  년동안 괜찮았는데 며칠 전에 또 쿵 하고 착지를 잘못해서 또 전 처럼 아픈거에요 그래서 아 또 며칠 지나면 괜찮아 지겠지 하고 그냥 있었는데 괜찮아 지지가 않아서 무슨 상태인지 질문 드려요,마취통증의학과
164,허리디스크수술 고집 어떻게 설득하죠 ,큰 누님이 허리디스크수술을 하겠다고 하는데 저는 치료만으로 좋아질 수도 있다고 치료를 권하고 있는 상태입니다  큰 누님이 다니고 있는 병원 선생님도 아직 허리디스크수술을 할 단계는 아니라고 하는데 가게에서 일을 하는데 힘들다고 내가 힘든데 왜 그러냐고 그냥 허리디스크수술을 할 거라고 고집 부리는데 어떻게 설득해야 할까요 ,마취통증의학과
165,발바닥 아치 통증 만지면 평발은 아닌데,발바닥 아치 통증이 있어서 만져봤는데 만졌을 때 평발은 아니거든요  근데 계속해서 발바닥 아치 통증이 있어요  어떤 이유로 이런 증상이 생길 수 있나요  걸을 때마다 발바닥 아치 통증이 있어서 너무 힘듭니다  ,마취통증의학과
166,종아리 통증 여전히 진행중,전에도 동아리 통증 관련해서 질문 올린 적이 있는데 나아지지 않아 또 종아리 통증에 대해 올립니다  전에 러닝한 후로 알이 베긴듯 한 종아리 통증이 생긴 후 아직까지도 있어요  그 요가링도 사서 껴 봤고 스트레칭도 해봤는데 여전합니다  이제 뭘 해보죠 ,마취통증의학과
167,발목수술 연골 줄기세포 수술 ,엄마가 연골손상으로 발목수술을 받으시는데 과정이 궁금해서요  일이 있어 함께 병원에 가지 못해 제대로 알고 있지 못한 상황인데요  어려운 발목수술 아니고 자기  골수 줄기세포 수술이라던데   병원 홈페이지 발목수술에는 나와 있지 않아서요  설명 부탁드립니다 ,마취통증의학과
168,손목골절 수술 잘 될까요 ,저 내일 손목골절 수술 받는데요 살면서 수술을 받아 본 적 없는데 넘어지면서 손목골절 수술을 받게 되었네요    이런 저런 생각에 심란해서 글을 올려요  손목골절 수술한다고 생명이 지장이 있지는 않겠지만 그냥 걱정되서요  저 잘 되겠죠 ,마취통증의학과
169,손목이 아파요 이유는 모르겠어요  ,저 지금 손목이 아파요 근데 이유는 모르겠어요  정확한 위치를 짚어 여기 손목이 아파요라고 말하기는 힘든데 확실히 통증이 있거든요  집에 있는 온찜질기도 해줬는데도 계속 손목이 아파요 뭘 더 해보죠      ,마취통증의학과
170,손목 통증 친구랑 비슷한 증상,저는 가정주부인데요  최근에 손목 통증이 생겼고 자연스럽게 친구랑 통화할 때 이런 손목 통증이 있다고 하니 너도 터널증후군 아니냐고 하네요  전화를 끊은 후 터널증후군을 검색하니 제가 겪고 있는 손목 통증과 증상이 비슷해 보이긴 하는데 저 아직 심하게 아프진 않거든요  지금 조심하면 저절로 좋아지지 않을까요 ,마취통증의학과
171,무릎 물빼기 또 또 생김,무릎 물빼기 위해서 처음 병원에 갔던 건 작년인데 벌써 이번이  번째입니다  병원에서 무릎 물빼기는 어렵지 않은데 계속 이러면 연골이나 관절에 이상이 생긴 걸 수도 있다고 MRI를 찍자고 하는데 사실일까요  또 무릎 물빼기 싫은데 검사하고 문제 찾아 치료하면 좋아질 수 있나요 ,마취통증의학과
172,체외충격파치료 슬개건염 통증있을 때,지난 번에 슬개건염이 있어서 체외충격파치료 받았거든요  몰랐는데 후기 보니깐 엄청 아파서 체외충격파치료 다시 못 받는 분들도 계시더라고요  근데 저는 참을만해서 체외충격파치료 또 받으려고 하는데 이거 얼마나 받아야 효과가 있을까요 ,마취통증의학과
173,무릎 안쪽 통증 물리치료 받아도 여전히,엄마가 무릎 안쪽 통증이 있다고 하셔서 그럼 참지말고 근처 병원에 가서 물리치료라도 받아 보라고 했는데 이번에 다시 전화가 왔어요  물리치료를 받았는데도 무릎 안쪽 통증이 있다고 그래서 여쭈어 봅니다  저희 엄마는   대 후반이시고 무릎 안쪽 통증이 생긴 지는 오래되었다고 해요  전에는 심하지 않았는데 요즘 부쩍 심해진  무릎통증에 좋은 치료 뭐가 있을까요 ,마취통증의학과
174,프롤로주사 색 질문,프롤로주사는 무슨색 인가요    병원 두곳을 가서 프롤로주사를 맞았는데 두곳 프롤로주사 약물 색이 다르네요  ,마취통증의학과
175,수술 마취 기억상실,저 지인이 수술했다고 사촌오빠가 대신 톡하면서 막 마취가 쎄서 기억을 잃었다고 그러는데 존댓말 쓸정도로 기억 잘 못하고 제 이름대면서 기억나냐고 하니까 조금 난다고 하고 근데 수술하고 마취약이 쎄면 진짜 저정도로 기억을 잃나요 ,마취통증의학과
176,엄지발가락 마디가 너무 아파요,인터넷에 검색해보니 무지외반증 통풍 이런거는 아닌거 같은데 너무 갑자기 아프기도 하고 붓거나 하지도 않아서 근데 이상하게 발 안쪽을 누르고 꼼지락대면 안아픈데 어떤 증상인지 알 수 있을까요  ,마취통증의학과
177,왼쪽 팔뚝 통증,올해   살 여학생입니다 어제 밤   시 에 누웠는데 갑자기 팔이 아프더라고요 지금까지 계속 아픈데 아픈 부분이 팔꿈치 위로는 전혀 안 아프고 팔꿈치 밑으로 손목까지 아파 손도 가끔씩 저리고 힘이 빠지는데 왜 이러는 건가요 ,마취통증의학과
178,샌드백 손목 통증,어제 제가 좀 딱딱한 샌드백을 치다가 엄청 쎄게 몇번 쳤는데 마지막에 치니까 순간 전기가 통하는거같이 아팠습니다 꺽인건 아니구요 그래서 오늘 아침에 보니깐 부어있네요 뼈에 문제 없겠죠 ,마취통증의학과
179,코로나 백신 화이자  차 부작용,화이자 백신  차와  차를 맞고 나서는 백신 맞은 팔이 아픈거 말고는 딱히 증상이 없었습니다 근데 화요일  차를 맞고 하루정도가 지나서 수요일에 머리가 너무 아프기 시작했습니다 밤에는 오한까지 있었습니다  그리고 지금 목요일 아침에는 조금 춥고 두통도 계속 있습니다 두통과 더불어 어깨 통증까지 있습니다   차와  차때는 멀쩡했었어서 조금 겁이 납니다 바로 병원을 가야할까요 ,마취통증의학과
180,기침할때 뒷목 통증 승모근 통증,안녕하세요   살 여학생 인데요  주간 임파선염을 앓고 있는데 열나는거도 멈췄고 목도 많이 가라앉았습니다  일동안 기침이 심했는데 지금은 많이 좋아졌습니다 어쩌다 한번씩 기침하는데 할때마다 뒷목이랑 어깨랑 승모근이랑 등쪽이 너무 아파요 근육이 아픈거같아요 그리고 요즘 자꾸 심장이 빨리 뛰고 머리도 약간 울리면서 몽롱하고 어지러워요 왜 그런건지 설명 부탁해요    ,마취통증의학과
181,왼쪽 얼굴 통증,어제는 괜찮았는데 오늘 일어나서부터 왼쪽 얼굴에 통증이 있어요 눈물이 나고 광대뼈가 짖누르듯이 아프고 눈알도 살짝 짖누르는 느낌이 있어요 왜 그런건가요 ,마취통증의학과
182,,,
183,,,
184,,,
185,,,
186,,,
187,,,
188,,,
189,,,
