67,손목 통증,제가 너머져서 손 목 인대가 늘어나 병원도 기고 물리치료도 받고 있는대 게임할 때마다 손 목이 아픕니다 게임을 줄이는게 좋겟죠   그러면 몇 일 정도 쉬면 될 까요 ,마취통증의학과
68,백신  차 화이자 통증,어제 백신 맞았는데 조금의 목 아픔과 두통이 좀 있는거 같은데 괜찮은건가요  ,마취통증의학과
69,손바닥 통증,사진에 동그라미 되어 있는 부분이 가끔씩 커터칼 같은게 손에 찍혀서 계속 파고 드는 느낌  이 들어요  가시나 그런 거 박힌 것은 전혀 없구요  혹시 병 같은 건가요 ,마취통증의학과
70,여자 왼쪽 아랫배,  대 여자구요 왼쪽 아랫배에 조금씩 통증이 있는데 극심하게 통증을 느끼는 수준은 아니고 찌릿한게 계속 신경이 쓰여요  이런지도  년이 넘었는데 주기성을 띄는 건 아니고 수시로 이럽니다  그동안 종합검진  대장내시경도 해보고 산부인과도 갔는데 이상이 없다고 하더라구요  근데 요근래에 좀 더 콕콕 하는 느낌이 더 자주 있는 것 같아서 따로 검사를 더 해봐야 할 부분이 있을까요    ,마취통증의학과
71,옆구리 살 통증   ,옆구리 통증이 오래됬는데 병원을 가보니 다 옆구리 부근에 있는 장기나 뼈  모두 문제가 아니랍니다  그래서 유심히 아픈곳을 만져보니 살이 아픈거였어요   옆구리의 살을 끌어당겨서 그 끌어당긴 그 살 부분을 누르니 그 딱 아픈부분이더라구요    왜 살이 아픈걸까요   이게 살이 아픈건데 근육통이 맞나요  혹시 살쪽에 문제가 있는건지 살에 염증이 있어서 아픈걸까요    ,마취통증의학과
72,어깨 통증,제가  일전에 헬스를 하다가 어깨에서 찢어지는 소리가 들리고 통증이 계속 되었는데 좀 통증이 완화 되어서 푸쉬업을 하였는데 이제 팔을 움직일 때마다 관절 움직이는 소리와 결리는 소리 가 납니다 지금 당장 병원을 가지 못하는 상황이서 그러는데 어깨회전근개파열을 아니겠죠  통증은 아직도 있습니다,마취통증의학과
73,손다치고 저린느낌,청소하다가 손바닥에 유리가 박혔는데 찔릴때 엄지손가락이 찌릿거렸는데 병원에서는 아무이상이 없다고 하셨는데 일주일이 지나도 아직 쥐난거처럼 저린느낌이 있고 누르면 좀아파요 지금은 꼬맨상태입니다 좀부었어요,마취통증의학과
74,오른쪽 가슴부터 팔까지 통증,제가 자다가 새벽에 오른쪽 가슴 안쪽부터 팔쪽까지 너무 아파서 깼어요   어제 담배 필 때부터 좀 느낌이 있긴 했던 거 같은데 왜 이러는 거죠     진짜 아파 죽을 거 같은데     불러야 하나요 ,마취통증의학과
75,오른쪽갈비뼈 아래통증,안녕하세요   살 남자입니다 어쩔때마다 종종 갈비뼈 아래가 찔리는 느낌이 들어서요 어디병원을 가야하죠 ,마취통증의학과
76,왼쪽 어깨 찌릿한 통증,이제 중 인 학생인데요   요즘 들어 가끔씩 왼쪽 팔을 위쪽으로 움직일 때마다 찌릿한 통증을 잠시 느낍니다  대체 왜 이런 걸까요        옛날부터 목을 돌리면 항상 뒷목 쪽에서 뚜두둑 소리가 났었는데 이거랑 관련이 있는 걸까요      이런 찌릿한 느낌은  온 냉 찜질 같은 걸로 예방이 될까요      찾아보니 석회화건염  어깨충돌증후군 이런 병들이 있던데   이런 병들일 가능성이 있는 건가요      만약  번과 같은 병이 발병 될 수 있다면 위 병들은 위급한 건가요   질문이 많아서 죄송합니다  ,마취통증의학과
77,한 일이주전부터 발바닥이 멍든줄 알았는데 점점 커지고 안에 멍울 같은게 있는데 병원 가봐야 할까요     통증도 있구용,한 일이주전부터 발바닥이 멍든줄 알았는데 점점 커지고 안에 멍울 같은게 있는데 병원 가봐야 할까요     통증도 있구용,마취통증의학과
78,왼쪽 가슴 통증,밥 먹다가 왼쪽 가슴 통증을 살짝 느꼈는데요 한   분뒤에 왼쪽으로 누웠더니 가슴 통증이 또    왼쪽 가슴쪽을 압박하면 통증이 있더라고요 숨을 깊게 들이마시고 내쉬면 통증이 있고요 늑연골염인가요   이런 적은 처음인데 정형외과를 가봐야하나요  모레 백신맞아야되는데 맞아도 되는지      자연스럽게 사라지는 경우도 있다고 하는데 며칠 지나야하는지 궁금해요,마취통증의학과
79,왼쪽 갈비뼈 통증,운동을 하거나 무리하게 움직이거나 부딫히지 않았는데 왼쪽 갈비뼈가 너무 아파요  통증이 벌써 일주일이 되가고요  내과 정형외과 가서 X ray  CT 찍었는데 이상이 없다고 하네요  앉아있지 못 할 만큼 통증이 심하고  오래 걷지도 못해요  그런데 누워있으면 그나마 통증이 없어요  왜 그런걸까요   처방 받은 약을 먹고 있는데 똑같아요  어디 병원을 또 가봐야 할까요   정말 짐작도 안가서 답답합니다   ,마취통증의학과
80,발가락 증상 좀 봐주세요,무슨 질환일까요   가려움 열감 정도 있습니다,마취통증의학과
81,대원근 통증,제가 턱걸이시도 원래 못함 하려다가 봉에 매달려서 내려오는 운동할려고 올라가서 내려오자마자 뚜뚜둑 소리나면서 왼쪽 대원근   인지 정확하게는 모르겠지만 겨드랑이 약간 뒷쪽이 아파요 참고 그냥 운동 할까요  혹시 해결방법이나 병원을 가야할까요 대충 답변하지말아주시고 진지하게 부탁드립니다 내공   걸어요    ,마취통증의학과
82,무릎 통증,걷거나 무리한 동작을 취하지 않으면 통증이 별로없는데 자고일어나면 무릎이 아프고 조금 있으면 괜찮아집니다  예전에 반월상연골파열 진단을 받았었는데 찢어진부위가 크지않아 소염제랑 진통제 먹으면서 호전되었었습니다  그 이후로 아프지 않다가 군대오기전 통증이 좀 심했었는데 격리기간동안 아무것도 하지않으니 조금 괜찮아졌다가 훈련을 받으니 또 다시 아픕니다   아팠다가 안아팠다가하는데 무리하면 무릎에 자물쇠를 걸어놓은거마냥 뻐근하고 움직이기가 힘듭니다   통증이 지금 몇달간 지속되는데 죽을정도는 아니라서 그냥 참고있기는한데 어떻게해야할까요    현재 군인이라 어떻게 해야할지 모르겠습니다  ,마취통증의학과
83,전신마취 수술시 전신마취 주기는 어떻게 해야하나요 ,전신마취 수술을 두 번 정도 할 예정인데 주기는 어떤식으로 해야 할까요  어디서는 최소  개월이라고 하고 어떤 곳은  년이라하고 어느 정도 주기여야 하나요,마취통증의학과
84,엄지발가락 밑 아래쪽 뼈 통증,몇 달 전부터 신발 신고 걸을 때마다 엄지발가락 및 아래쪽 뼈가 아파서 병원에 갔었는데 딱히 문제가 없다고 하셨어요  근데 나아지지않고 계속 통증이 있는데 왜 이러는 걸까요   사진처럼 빨개지긴 했는데 염증이 생긴건지 저쪽에 자극이 가는건지    ,마취통증의학과
85,오른쪽 부랄 통증,어제부터 오른쪽 부랄이 불편하더라고요 아프고 엄청 아프진 않아서 무시하고 하루를 보냈는데 자고일어났더니 엄청 아프네요   만지기만해도 멍들은 곳을 때리는 통증이 느껴집니다   살인데   부랄 옆 살이 살짝 부엇어요 모기한테 처음 물린거처럼 아플때가잇고 괜찮아질때가 있어요   그리고 배아래 부분도 좀 아파요 어떻게해야돼나요,마취통증의학과
86,눈썹부분 통증,눈을 위로 쳐다봤는데 눈썹뼈 바로밑 부분이 양쪽으로 갑자기 누가 누르는것처럼 엄청아파요  처음엔 너무 놀랐는데 지금은 한번씩 욱신거리는 정도입니다   태어나서 처음 느껴보는 형태의 통증입니다   이전엔 눈을 치켜떠도 그런적이 없었는데  혹시 눈썹뼈주위 근육도 순간 쥐가 날 수 있는건가요   아니면 혹시 다른 질병의 초기증상인가요 ,마취통증의학과
87,허리통증 질문이요  뻐근함 ,한 달 전에 운동하다가 허리찌릿하는 느낌을 받고 병원다녔는데요 허리 mri 찍어보니깐 디스크는 아니라고 있더라도 극초기라고 하더군요 근데 이게  달이 지난 지금도 낫지를 않아요 허리를 숙이면 빨간 동그라미 친 부분이 뻐근하면서 땡기는 느낌이 듭니다 오래하고 있으면 통증이 심해져서 못견디겠어요 엄청 뻐근하고 땅기는 느낌 뭘까요 이거  ,마취통증의학과
88,목을 옆으로 기울이면 등윗쪽에 통증이 있습니다,원인이 무엇인가요 ,마취통증의학과
89,수면마취 후 자기호흡으로 안돌아오는 이유 ,저희 아버지가 다음주 월요일 약    시간 예상되는 수술을 하시는데 뇌종양으로 뇌수막종이라고 하셨고 운동신경쪽 눌려서 현재 다리 한쪽만 마비증상이 있습니다  하지만 만성폐쇄성폐질환을 앓고있어 폐가 많이 좋지않다고 자가호흡으로 돌아올때까지 오래걸릴 것 같다며 입원 기간이 길어질수도 있다고 하였습니다   자가호흡으로 안돌아올 경우 그 이유가 긍금합니다 ,마취통증의학과
90,발가락 붓고 통증이 있는데,며칠전에 발가락이 꺾였는데요  금방 낫겠지 했는데 며칠째 통증이 지속되고 살짝 부었는데 이거 괜찮은건가요  병원에 가야한다면 어느병원에 가야하나요,마취통증의학과
91,오미크론 증상인가요,최근에 확진자와 접촉했던 친구와 놀았는데 오늘 아침 일어나보니까 열은 조금 있는 거 같고 목이 심하진 않지만 조금 붓고 아픕니다 근육통은 이틀전이랑 어제 볼링을 좀 많이 쳐서 근육통 있는 거 같긴한데 아무튼 근육통이 조금 있구요   어제 세수하고 나왔는데 눈 밑에 이상한 작은 두드러기가 발현 됐다가   분뒤에 사라졌습니다 이거 오미크론 증상과 같은 건가요,마취통증의학과
92,허리교정 받아면 좋아질까요 ,안녕하세요 제가 허리가 좀 안 좋거든요 한쪽만 유난히 아픈데 디스크도 아니래요 주변에서 허리교정 받아보라고 하는데 의사선생님도 허리교정 얘기도 했어요 그래서 허리교정 받아볼까 하는데 아픈게 좀 나아질 수 있을까요 ,마취통증의학과
93,허리가 아파요 찜질중인데  ,어제부터 허리가 아파요   그제 밤에 허리를 삐끗했더니 어제 아침에 일어났을 때부터 허리가 아파요     어제 밤에 찜질을 했는데 효과가 있는건지 모르겠어요 오늘도 계속 허리가 아파요    병원 갈 정도는 아닌거 같은데 어떻게 하면 좋을까요 ,마취통증의학과
94,무릎통증 있는데   ,어제 처음으로 운동을 했는데 시작한지 얼마안되서 넘어졌어요 그만두기도 좀 그렇고 해서 무릎통증이 살짝 있었는데 그냥 운동 계속했거든요 어제 내내 무릎통증은 조금 있었는데 오늘 아침에 일어나니까 무릎통증이 좀 더 심해져서요 괜찮은걸까요  병원 가야할까요 ,마취통증의학과
95,전방십자인대재활운동 꼭해야하나요 ,전방십자인대재활운동 꼭해야하나요  제가 다음주에 수술받는데 전방십자인대재활운동 열심히 하라고 했거든요 근데 병원에서는 못하고 제가 알아서 해야한대요 어떻게 하는지도 모르는데 전방십자인대재활운동 꼭 해야하는건가 해서요,마취통증의학과
96,고  걱정되는 통증 질문,이제 고 되는 학생인데요  몸 아픈거에 관한 질문이 있습니다  그런데 아프다고 해도 절대 큰건 아니고 통증이라고도 뭣한 증상이라 크게 걱정하진 않고 있어요   가지있는데 하나는  일전쯤부터 가슴이랑 아랫배 사이의 윗배부분이 조금 딱딱한거같은데 손가락으로 세게누르면 멍든거같이 좀 아프고 소화안되는 느낌  그렇다고 체한거같진않고 소화됐을 때 하는 트름을 조금 하고나면 눌러도 덜 아픈거같아요  단순히 소화불량인것 같다고 생각하고요   번째는 좀 걱정이되는데 미리 말씀드리자면 통증축에는 끼지않고요  가슴 왼쪽부분이 미세하게 찌릿찌릿 해서요  이틀전쯤인가 어젠가 짧게 있었고 아까도 찌릿 했어요  아픈건 전혀아니고 이게 뭔가싶어서 글 올려요  제가 살쪄서 그런건지 모르겠는데 고 남학생 키    몸무게  로 살찐 편입니다    가슴아픈건 오른쪽은 아니고 확실히 왼쪽이 맞고 아프다기보단 미세하게 전기흐르는 느낌이었어요  걱정되서 물어봅니다   ,마취통증의학과
97,꼬리뼈 통증,고등학생인데 중 때부터 꼬리뼈가 자주 아팠다가 조심하면 괜찮아 지고 그랬는데 이번에 자주 앉아있게 되면서 꼬리뼈에 염증이 생긴거 같은데 이거 병원 꼭 가야되나요   집에서 치료하는 방법은 없을까요 ,마취통증의학과
98,갑자기 오른쪽 상복부  근처가 아파요,잠을 취할려고 누웠는데 호흡을 하다가  갑자기 오른쪽 옆구리   근처 상복부쪽에 극심한 통증이  느껴졌습니다  그리고 움직일때도 약간씩  통증이 느껴집니다  무엇 때문인지    병원에 가야할지가 궁금해요  ,마취통증의학과
99,허벅지 뒷쪽 통증,  살 남성이구요 며칠 전 부터 오른쪽 엉덩이 아래 허벅지 위쪽 부분 뒷쪽부분에 특정부분만  통증 옵니다  관절이나 뼈가 아프다는 느낌은 없구요 간헐적으로 한 곳만 계속 찌릿찌릿 하면서 통증이 옵니다   무슨 증상일까요  ,마취통증의학과
100,무릎 통증,새벽에 무릎 통증이 너무 심해서 잠에서 깼어요   진짜 못 움직일 정도로 아팠는데 지금은 괜찮습니다 병원 가는 게 나을까요  진짜 급 불안해지네요  ,마취통증의학과
101,발목 발목주위통증,  살이고 아무것도 안하고 앉아만 있었는데 갑자기 아프더니 발목과 발목 앞쪽주위 그쪽이 같이 아프면서 점점 심해져요 이럴땐 어떻게 해야하나요   오늘 처음 지식인을 써봐서 다  인거 양해부탁드려요 ,마취통증의학과
102,엄지발가락 통증,며칠 전부터 엄지발가락에 통증이 느껴져요  엄청 이픈건 아닌데 누가 위에서 제 엄지발가락을 잡아 당기는 느낌이라서 너무 불편해요  저번에도 이런 적이 있었는데 또 금방 괜찮아졋 ,마취통증의학과
103,왼쪽 허리 통증, 일  전부터 왼쪽 허리에 통증이 심해요 밖에 계속 안 나가다가  일정도 많이 걷다 보니까 무리가 간 건가 싶기도 하고 요즘 변을 누기는 하는데 잔변감이 심했거든요 그래서 그런 건가 싶기도 하고요 걸을 때 허리만 아픈 게 아니고 통증이 다리를 타고 내려와요   뭐 때문인 걸까요  ,마취통증의학과
104,척추협착증          수술하려고  합니다,현재 병원에서 협착증이  에서   으로 볼때 거의    에 해당되어 수술을 해야된다고합니다  아픈 증상은 잠잘때 오른쪽 종아리 저림 왼쪽은 복숭아뼈  위쪽에 감각이 무덤덤 할때가 많고 왼쪽 다리는 걸을때 조금 절고 걷습니다  서있을때 엉치 아픔을 느낍니다  수술시 협착이 되어 있는곳을 제거후 그곳에 허리를 지땡할수 있는 보조기구를 넣는다고 하는데 넣는거와 넣지 않는 차이는 어떤는지 알고 싶어요 ,마취통증의학과
105,편도염 통증 관련,원래 이렇게 아픈게 맞나요  뭔가 잘못된건 아니겠죠  병원에 가서 항생제랑 소염제도 처방받았고 먹고 있는데 물은 커녕 침을 도저히 못삼킬정도로 목이 아픈데 원래 이렇게 아픈건가요  그렇다면 약을 꾸준히 얼마나 먹어야 통증이 줄어드나요 통증 완화에 좋은 방법은 없을까요,마취통증의학과
106,운동 중 등 통증,제가 덤벨 운동을 하다가  갑자기 날개뼈 가운데 등뼈에 급 통증을 느꼈는데요  주먹으로 쎄게 한 대 맞은 느낌이었고  한 번 자고 일어났는데도 아픕니다  이거 디스크인가요   ,마취통증의학과
107,화이자  차백신맞고 허리통증이 있습니다,  L  L  통증입니다   뼈가 삐끗하는 통증입니다   옆으로 눕거나 자세를 바꾸면 아픕니다   자세를 바꿀시 허리에서 뼈소리가 납니다   디스크 자가검사를 해봤는데 음성입니다  괜찮은 건가요    ,마취통증의학과
108,꼬리뼈 통증,실기 운동 하던 도중 저 자세로 연속해서  번 정도 기록측정 했습니다  근데 직후 엉덩이골  cm정도 위 꼬리뼈쪽이 너무 아프고 현재는 숙이는 자세가 불가합니다  한  분정도는 허리가 너무 아파 걷지 못하고 계속 서있었고요  이전에 허리가 아팠던적은 없습니다  근육이 놀란걸까요 그래서 정형외과 가서 물리치료 받고 왔는데  일정도 쉰 후 만약 통증이 좀 호전 된다면 다시 운동 해도 될까요  시험종목이 대부분 다 허리를 사용하는 종목입니다 ,마취통증의학과
109,꼬리뼈가 아파요  ,오늘  시에 실수로 발차기를 하다가 균형을 못잡아서 엉덩방아를 크게 찧었거든요   눈물이 날정도로 아프다가 나중에 통증이 사라지겠지 하면서 바로 나가서 걷다가 들어왔어요  손으로 꼬리뼈를 누를때는 통증이 별로 안느껴지는데 앉으려고 하거나  일어날때 조금 아프고 움직일때 좀 많이 아파요  손으로 꼬리뼈를 누를때 통증이 느껴지지 않으면 금간거는 아니라고 하던데 맞나요    시   분부터 영어수업이라 앉아있는데 장시간 앉아서 그런지 많이 아파요     진짜 너무 걱정되요    병원가기도 좀 그렇고     네이버에다가 엄청 찾아봤는데 저하고 비슷한 경우가 없어 쉬는시간에 이렇게 올려보네요     지금도 아프고요    못견딜정도로 아픈건 아닌데 계속 신경쓰여요  보통 아프면 조금 이따가 통증이 사라져야할텐데 계속 아프니까 더 걱정되고 이대로 계속 아프면 어떻하지 라는 생각이 들어요     꼬리뼈하고 그 주변이 아파요 특히 오래 앉아있을때 더 아프고 일어날떄랑 앉으려고 할때는 통증은 거의 안느껴지고 걸을때는 방향을 틀거나 그럴때 한번씩 아파요 그냥 일자로 걸을때는 약간 아프긴 하지만 그렇게 아프지 않아요  지금은 미칠거같고요     제발 도와주세요      혹시 금가거나 그런걸까요      오히려 마사지를 하려고 만질때마다 통증이 더 느껴지는거같아요   주변도 조금 아프지만 제일 아픈곳이 꼬리뼈고 지금 몇시간째 아픔이 유지되고있어요   앉아있을때 통증이 장난아니에요    ,마취통증의학과
110,한쪽팔로 매달리기 한 후 팔 통증,왼쪽 팔 하나로 매달리기를 한  초 하고 내려왔는데 어깨 아래 팔부터 손목까지 군대 군대 약한 통증이 있습니다   병원에 가봐야할까요 ,마취통증의학과
111,관자놀이  머리옆쪽 통증,관자놀이 쪽이긴 한데 관자놀이보다는 좀더 윗쪽이거 그냥 머리 옆쪽인데 좀 앞쪽 이라 해야하나 하여튼 그쪽에 통증이 있는데 가만히 있을때 있는 통증이 아니라 그쪽을 꾹꾹 누르면 시원하면서도 뭔가 아픔이 느껴져요 반대쪽은 그냥 아무느낌 없이 아프기만한데 한쪽을 눌렀을때 통증이랑 시원함이 같이 있다해야하나      사진처럼 딱 저쪽을 주먹으로 꾹꾹 눌렀을때 그런느낌이나요  시원한데 아프고 뭔가 그런데용 ,마취통증의학과
112,수면마취에 관련 질문드립니다,알콜내성으로 인해 수면마취 효과가 없을 수 있는가요 있다면 기타 어떤 원인들이 있을 수 있는지 궁금합니다,마취통증의학과
113,허리통증   ,허리통증예방법좀요,마취통증의학과
114,종아리통증  온몸의 피로감이 같이 왔습니다 ,안녕하세요  몇일전 일어나자 마다 종아리에 가벼운 통증이 시작되었구요  온몸에 피로감이 몰려왔습니다  몇일이 지나도 종아리 통증과 온몹의 피로감이 그대로네요  혹시나해서 종아리를 자세하게 보았는데 혈관이 밖으로 보이지도 않고  멍도 없이 깨끗한 상태입니다 종아리 통증은 견딜만 한데 피곤함은 정말 힘드네요  큰병이 아닐까 걱정도 되고요   주전에 피검사에서는 정상이었습니다 ,마취통증의학과
115,화이자 차 부작용 등결림현상,화이자  차를   월 초에 맞았습니다  맞고난뒤에 왼팔 접종부위에 통증이 있었고 한 일주일 뒤부터 이 통증이 왼쪽등결림현상으로 바뀌었습니다  정확한 부위는 날개뼈에 붙어있는 근육입니다  하루에 한번은 쥐가 난 것마냥 근육을 쥐어짜는 느낌이납니다  금방 사라지겠거니 하고 참아왔습니다  지금 현재  개월이 지났는데 아직도 등결림현상이 지속되고 최근에는 통증이 더 심해지고있어서 어디에 연락해서 치료를 받아야 하며  신고를 할 수 있다면 어디에 신고해야하는건지 도움 부탁드립니다    ,마취통증의학과
116,가슴통증이 심해요,가슴부분 명치 위쪽이 웃을때나 가슴을 오므릴때 통증이 너무 심합니다  시간째 계속 아파요  왜그런걸까요 ,마취통증의학과
117,허리삠 허리디스크 증상,얼마전에 편의점 문을 열다가 허리를 삐었는데 허리가 계속 아파요 지금은  일째 됐는데 아직도 아파요   이젠 좀 저릿한것 같아서 혹시 허리삔게 허리디스크까지 갈 수 있나요 병원을 가볼까여 한의원을 갈까요 정형외과를 갈까요,마취통증의학과
118,목뒤 근육 자주 뭉침,제가 요즘 머리가 너무 자주 아픈데요 진짜 오랜 시간 심하게 아파요 미열도 살짝 날 정도  머리가 아픈거랑 관련이 있는 지는 모르겠지만 그때마다 목이랑 어깨 쪽 근육이 많이 뭉친 기분이 들고 불편해요  제가 진짜 옛날에 일자목 진단을 받은 적이 있는데 이거랑 관련 있는 걸까요   그리고 일자목 혹은 거북목 치료를 받으려면 어느 병원을 가야하나요  집에서 교정  할 수 있는 방법은 없나요 ,마취통증의학과
119,엄지손가락 손바닥 부분이 길게 부어있고 누르면 통증이 심합니다   주름 같이 굵게 보이는 부분이 주름은 아니고 저 모양으로 부어있습니다  열감도,엄지손가락 손바닥 부분이 길게 부어있고 누르면 통증이 심합니다   주름 같이 굵게 보이는 부분이 주름은 아니고 저 모양으로 부어있습니다  열감도 느껴지고 손가락 움직임이 조금 둔한데 어느 병원을 가야 할까요 ,마취통증의학과
120,꼬리뼈 골절 환자 어떻게 케어하죠 ,엄마가 꼬리뼈 골절이 되서 병원에 있다가 퇴원을 했는데요  완전히 나은 건 아니래요  그리고 엄마는 나이가 있어서 꼬리뼈 골절이 완전히 붙는데 시간이 걸리고 주변에서 잘 케어해줘야 한다고 하더라고요 우선은 엄마를 모시고 집에 오긴 했는데 꼬리뼈 골절 환자를 어 떻게 돌보아야 할지 모르겠습니다 도와주세요  ,마취통증의학과
121,햄스트링부상 치료 이번이 몇 번째인지,이번이 몇 번째인지    염좌로 햄스트링부상 치료 또 받아요  제가 운동을 좋아해서 부상이 잦은 건 알겠는데 아니 햄스트링부상 치료는 너무 잦아요  이번이  번째인가 그래요  파열까진 아니라 좀 다행이다 싶은데 계속 햄스트링부상 치료를 받아야 하니 그것도 스트레스입니다  왜 저 계속 햄스트링을 다칠까요 ,마취통증의학과
122,발목인대부분파열 수술과 치료 중 고민중이요,제가 발목인대부분파열이라는 결과를 들었는데요  그럼 치료를 하는게 좋을까요 수술을 하는게 좋을까요 발목인대부분파열이 처음이라 어떻게 해야 할지 모르겠어요  병원에서는 수술을 하자고 하는데요 차라리 발목인대부분파열이 아니라 완전 파열이면 이렇게 고민도 안할텐데 싶어요  ,마취통증의학과
123,발목 통증 뼈가 하나 더 있다고,작년에 삐끗해서 발목 통증이 생긴 후로 약하지만 발목 통증이 계속 있었어요  근데 요즘들어 발을 더 자주 접지르고 발목 통증이 심해져서 병원에 가니 뼈가 하나 더 있다고 해요  이게 태어날 때부터 있던 건데 발을 삐끗해서 떨어진거라고 하는데   이 병에 대해서 알려주실래요 ,마취통증의학과
