138,족저근막염 치료 추천바랍니다,족저근막염 치료 추천 좀 부탁드려요  남편이 이번에 족저근막염 치료를 시작했는데 빨리 낫지 않아 힘들어하고 주말에 외출도 안합니다   혹시 얼마나 족저근막염 치료를 받아야 효과가 생길까요  조심해야 하는 점 있을까요 ,마취통증의학과
139,어깨 인대 늘어났을까요 ,엄마가  살짜리 아들을 돌봐주다가 장난으로 엄마 팔에 매달렸다고 해요  그 후로 어깨가 아픈게   어깨 인대가 늘어난 것 같다고 하는데 병원에 가봐야 겠죠  동네 병원에 가서 그냥 어깨가 아프니깐 물리치료 해달라고 했대요   근데 제 생각엔 많이 아프면 어깨 인대 MRI도 찍어보고 그래야 할 것 같은데 엄마는 안 가겠다고만 하네요     어깨인대 다친거 방치하면 어떻게 되나요 ,마취통증의학과
140,충돌증후군 어깨에서 소리나는 원인,어깨에서 소리나는 원인인가  이렇게 검색을 하니깐 충돌증후군이 나오더라고요  저는 통증은 없는데 운동할 때마다 뚝뚝하는 소리가 나서 신경쓰입니다  충돌증후군이면 어떡하죠  근데 소리만 나는 거면 신경 쓸 필요없다는 글도 봐서 어떻게 해야 할지 모르겠네요   ,마취통증의학과
141,어깨통증 심하진 않음,어깨통증이 있는데요  이게 묘하게 아파요  제가 처음 어깨통증을 겪어봐서 그런 걸까요  병원에 가볼까 하는데 치료받으면 나을 수 있는 어깨통증이겠죠  심한 건 아니니깐요  ,마취통증의학과
142,무릎 절골술 과정 알고싶어요,무릎통증때문에 병원에 가니깐 무릎 절골술을 고민해 보라고 하는데   처음에는 통증치료만 받자 생각하고 무시했는데 집에 돌아와 찾아보니 지금 무릎 절골술하지 않으면 나중에 빨리 관절염에 걸릴 수 있고 결국 나중에 아프고 나서야 무릎 절골술 해야 한다는 글을 보고 고민중입니다    쉽게 결정할 수 있는 부분이 아니라서요  이런 오다리 수술과정에 대해 알려주세요 아 그리고 평범한 일상생활 가능하죠            ,마취통증의학과
143,무릎연골판찢어짐 운동하다 다침,지난 주에 아들이 무릎연골판찢어짐 진단을 받은 이후로 너무 스트레스입니다  제가 분명 전부터 운동하면 무릎이 아프다고 해서 나을 동안 쉬라고 했더니 그 사이에 나가서 또 축구하더니 병원이라는 전화가 와서 놀랐어요  그리고 MRI를 찍어보자는 이야기에 또 놀라고 무릎연골판찢어짐이라는 진단에 아주 화가 났어요  이번엔 수술까지 해야 한다고 하던데   얘가 또 나을 때까지 충분히 조심하지 않고 운동하거나 그럼 큰일난다고 하는데 무릎연골판찢어짐은 잘 회복할 수 있을지 걱정이네요 ,마취통증의학과
144,몸에 열감이 계속 있는데,몇일전부터 열감에 몸살감기처럼 증상이 있고 감기약 먹고 있는데 효과가 없고 식욕도 없는데 피부에 오늘보니 오른쪽 가슴이 트러블이 났어요 사타구니랑 겨드랑이뒤쪽은 트러블이 없어지고 사타구니쪽 보니 붉게 올라오더니 허물이 벗겨지고 있어요 감기가 아니고 대상포진일까요 ,마취통증의학과
145,손바닥 손등  무릎위  손목에 수포가 생기고 있습니다   대상포진일까요  아니면 왜 그러는 걸까요  통증이 있습니다  ,손바닥 손등  팔꿈치 주변  손목에 수포가 생기고 있습니다   대상포진일까요  아니면 왜 그러는 걸까요  통증이 있습니다  ,마취통증의학과
146,포경수 술,마취 끝나면 아프나요 ,마취통증의학과
147,손가락이 이상해요  ,밖에서 손시려워 춥거나 평소에 갑자기 가운데 손가락이 사진처럼 부을때가 있어요  아프지는 않고 부은 느낌이 들고 주먹을 쥘때 부어서 살짝 불편한 느낌이 있어요 왜 이런걸까요    ,마취통증의학과
148,발 삐끗 복숭아뼈 통증, 일 전에 지쿠터를 잘 못 타서 발목을 조금 크게 삐끗했었어요 그 자리에서  분 정도 서있고 얼음찜질도 계속 해주었더니 통증이 많이 줄었어요 복숭아뼈 쪽이 누르면 아프긴한데 멍든 부위 누르는 정도의 아픔이어서 병원을 가야할까요 하루이틀 더 쉬면 괜찮을까요 ,마취통증의학과
149,전신마취 후유증,저희 아버지께서 맹장수술을 하셨는데수술한지 주일정도 되섰는데 전신마취를 하셨는데 계단올라가는것도 숨이차고 물건드는것도 힘이찬다고 하시는데 어떡하죠  수술하시기전까지는 아무렇지도 않으셨는데 아무래도 후유증때문인가요 ,마취통증의학과
150,허리에서 골반으로 통증,제가 허리가 안 좋았는데 거기에 무거운 거 들다가 허리를 빼끗해서 아팠는데 이틀째날부터 왼쪽 엉덩이쪽으로 내려와서 걸을 때마다 아픕니다    디스큰가요,마취통증의학과
151,발목 뒤쪽 통증,발을 디딜때마다 발목 뒤쪽이 시큰거리는 느낌  시린 느낌이 듭니다      의심되는 병명이 있을지     그러면 어느 과의 병원을 내원을 해야할지 ,마취통증의학과
152,오래 걸으면 통증,오래 걸으면 사타구니  팬티라인 그쪽이 아픈데 왜 그런걸까요 ,마취통증의학과
153,통증의학과,마취통증의학과는 같은과인가요  오래됐는데 정형  내과문제는없는데 오른쪽등 가슴위치 등에가끔 쿡쿡쑤시는 통증이 한번씩와서 통증의학과로 가볼려구요,마취통증의학과
154,가운데 배 통증 장염,며칠 째 가운데 배 배꼽 근처 여러 부분이 따끔거리면서 통증이 있어요 가스도 자주차고 가스가 안차도 따끔거려요   설사는 안하는데 장염 증상 인가요   ,마취통증의학과
155,발바닥고관절허리 통증,  대 여성 발바닥 고관절 허리 통증이 심합니다  특히 걸어갈때 고관절 왼쪽다리 통증 있습니다  운동을해서 살을 빼고 있는데 통증없애는 방법 알려주세요,마취통증의학과
156, 시간 워킹후 허리통증, 시간 워킹후 허리 통증이 옵니다  자주는 아니고 몇달전에 걸을때 이런게 전혀 없었고 몸이 가벼웠습니다  지금 등부터 허리가 아픈데 왜 그런걸까요 ,마취통증의학과
157,발 안쪽과 엄지 발가락 아래 통증,안녕하세요  발 통증 때문에 걱정돼서 질문 남겨요   사진의 두 곳을 손가락으로 짚은 곳을 손으로 꾹꾹 눌러주는게 습관인데요   아프면서 시원합니다    혹시 해당 부위들의 명칭을 알거나 이러한 증상이 문제 사항이 있는 지 알 수 있을까요   일상생활에서 통증을 느끼다가도 안느끼고 그러니 병원을 안찾게되네요  ,마취통증의학과
158,발뒤꿈치가 찌릿 거려요,여기 점 찍은 부분이 발뒤꿈치를 들어 올리거나 달릴 때 찌릿한 통증이 있는데 원인이랑 테이핑 방법 등을 알 수 있을까요,마취통증의학과
159,네번째 발가락 부음,일주일 전부터 네번째 발가락이 붓고 통증이 있어서 병원을 갔는데 morton s neuroma 지간신경종 이라고 말씀하시더라고요 지간신경종은 세번째 네번째 발가락 사이 신경에 발생하는걸로 알고있는데 네번째 발가락만 붓고 아플 수 있나요   세번째 발가락은 붓지도 통증이 있지도 않아요,마취통증의학과
160,무지외반증 이거 무지외반증인가요 ,오른쪽 발보다 왼쪽 발이 더 아파요,마취통증의학과
161,손가락 마디 통증,  살이고요 갑자기 왼쪽    번째 손가락을 쭉 피거나 구부리면 마디에서 통증이 느껴집니다 왜 이러는 걸까요 ,마취통증의학과
162,코수술 수면마취,코수술하는데 꼭 수면마취해야하나요  그거말고 다른 마취는 없나요 ,마취통증의학과
163,팔 접히는 부분 통증,팔 접히는 부분이 바늘 들어가있는 느낌이 들면서 통증이 있어요 그 부분을 눌러도 아프고 가만히 있으면 더 아파요   왜 그럴까요  그리고 계속 그런다면 어느 병원을 가야할까요 ,마취통증의학과
164,극소마취제 질문,효능이 어느정도인가요 겉에만 마취되는 건가요 속에는 마취 안되나요,마취통증의학과
165,왼쪽발 발뒤꿈치 바깥쪽 통증,무릎을 펴고 dorsiflexion을 하면 왼쪽발 왼쪽 복숭아뼈 아래 바깥 뒤꿈치 부근에서 통증이 있는데 왜 그런걸까요 ,마취통증의학과
166,새끼 발가락 깨짐,새끼 발가락이 깨져서 사진 처럼 됐습니다  깨진 쪽이 살짝 들리는데  그냥 나둬도 되나요 ,마취통증의학과
167,허리 통증주사맞았는데 얼마나가나요 ,지속시간이 얼마나가죠    주전에 맞았는데 다시 허리가 좀아파서 고민됩니다   지속시간이  주가는건가요 ,마취통증의학과
168,어깨 통증,하품할 때나 숨을 크게 들이마실 때 어깨 통증이 심해요 원인이 뭘까요,마취통증의학과
169,영화관에서영화보는데 어게가 양쪽으로아영화관에서영화보는데 어게가 양쪽으로아프다안아프다그러고 집에서 누워서 팔베게하고있는데 양쪽어게가아파요 내일백신,영화관에서영화보는데 어게가 양쪽으로아프다안아프다그러고 음식을머꼬 집으로갓어요 집에서 누워서 팔베게하고있는데 양쪽어게가아파요그리고팔을니은자로하고누워서폰하는데어게가아파요손으로어게주므름 이쪽어게만 왜그런건가요   내일백신 찬데 괞찬을까요 ,마취통증의학과
170,가슴통증이 있어요,몇 시간 전부터 가슴 쪽이 답답하고 힘을 조금만 줘도 너무 아픕니다  정자세로 누우면 눌리는 듯한 통증이 더 심해지고 목 쪽도 압박돼서 너무 아파요 그렇다고 앉아 있으면 턱 쪽으로 시작해서 가슴 중앙까지 답답하고 아픈데 혹시 기흉 같은 거일까요  어떤 충격도 가해지지 않았고 체한 느낌도 아닙니다   ,마취통증의학과
171,마취 주사를 넣으면 다른 건 다 안 아픈데 레이저만 느껴지는 사람도 있나요 ,제목 그대로인데 부분마취를 하면 살을 자르던 뭘 하던 다 안 느껴지는데 레이저로 지지면 그건 진짜 아파요 그냥 진짜 지져지는 것 같아요 이게 뭘까요    저같은 사람이 또 있나요 ,마취통증의학과
172,발가락 물집  헐음 ,새끼발가락이 한  주정도 종종 부어있고 가려웠는데 오늘 다시보니 헐은 것같기도 하고 물집이 잡힌 것 같기도 하고 저러네요     나아가는 중인건가요  평소에도 큰 가려움이나 통증은 못느꼈습니다  건드리면 주위 피부가 연해진 느낌은 듭니다 ,마취통증의학과
173,교통사고로 정강이 뼈 가 부러져서 수술 받아야 된다는데   ,전신마취로 한다는데     수술 받다가 잘못 되거나 이대로 못 수술후 못 깨어날수도 있나요       정형외과 수술 받습니다  ,마취통증의학과
174,,,
175,,,
176,,,
177,,,
178,,,
179,,,
180,,,
181,,,
182,,,
183,,,
184,,,
185,,,
186,,,
187,,,
188,,,
189,,,
