0,1,2
귀 뒤 통증 광대뼈 주위 눈 주위 손 저림,곧 고딩 되는 여학생인데요  귀 뒤 통증은 한  개월 정도 되었고 점점 눈  광대뼈 주위  가 만져야 시원해지는 느낌이 들고 손가락 마디가 쑤셔서요  어느 병원을 가야 원인을 알 수 있을까요  일단 선천적으로 턱 뼈가 작아서 성장통같은 건가요  치과에 갔었는데 근육통이라고 해요  한  달에   번 이상 가끔 그러는 데 이게 막 쑤시는 것도 저린 것도 아닌 뭔가 불편하다   이예요  얼음빽 같은 거 대고 있으면 괜찮아져요 ,신경외과
왼쪽 무릎 통증,뼈 부분이 아니라 살부분인데 침을 맞으러 다니고 있기는 합니다  줄넘기 하다가 다친거 같은데   예전에는 침대에 올라갈 때 무릎이 닿앗을 때도 그 살부분이 아팟는데 지금은 그 정도는 아니고   나앗다가 다시 욱신    통증이 느껴지기는 합니다  아빠다리 하거나  등등 할 때요   이건   어디가 잘못된건가요    물이 찬건가요    검사 해봣을 때는 보이는게 없다고 하였었습니다 ,신경외과
기립성 저혈압 증세가 최근 좀 있었는데 어제 갑자기    초정도 실신해서 쓰러졌습니다 일어나서 어라  하고 정신차려보니 땅에서 구르고있었습니다 ,기립성 저혈압 증세가 최근 좀 있었는데 어제 갑자기    초정도 실신해서 쓰러졌습니다 일어나서 어라  하고 정신차려보니 땅에서 구르고있었습니다  평소에 조심하는게 중요한건 알지만  곧 병역판정검사인데 병원에 가서 검사를 받아봐야할까요  기립성 저혈압이  급 요인인가요 ,신경외과
근전도검사로 장애진단 가능여부,근전도검사만으로도  신경이상등으로  장애진단이 가능한지 궁금해서 글올려요  상세블명의 신경병증    개월전하고 오늘검사했는데 이상소견이 있거든요  결과지는 다음주에 발급받아 올릴수 있을듯하구요 ,신경외과
뇌출혈 인가요 ,몇일째 경미한 두동과 어지러움이 있어서 질문합니다 일단 경미한 두통 어지러움은 엄마약 먹으니까 낫긴 하던데  자고일어나면 속이 메스껍고 밤 새벽이 되면 식욕이 늡니다 몇일전 뇌ct를 찍었으나 별 이상 없다는데요  뇌출혈 일수있나요  오진 하신걸수도 있나요   중심잡기도 잘 되고 발음도 잘 나오고 몸도 잘 움직이긴 하는데 겁나네요   ,신경외과
허리 디스크 뼈주사,아주 오래전부터 허리통증으로 고생하고있는   대 후반 남성입니다 그런데  년반쯤전에 계단을 급하게 오르다가 그대로 주저앉아서    에 의해 응급실에 간 적이 있습니다  다행히도 뼈에는 이상이 없다고 하고요 그 이후로 몇 달 동안 침도 맞고 정형외과에서 물리치료도 받았습니다 가끔씩 X RAY 촬영을 해도 수술할 정도는 아니라고 하네요 지금까지도 시간만 나면 하루  시간 정도 걷는 운동도 하는데 그다지 나아질 기미가 없네요    무엇보다 응급실 간 이후 제 스스로가 허리가 그전보다 많이 약해졌다는 걸 느낍니다 이런 상태라면 뼈주사 맞는 게 허리 강화에 도움이 될까요  ,신경외과
오른쪽 네번째 발가락 저림 검푸른색,작년에 허리디스크로 시술을 하긴 했는데 그것과 연관이 있는지는 모르겠구요    오른쪽 네번째 발가락 유독 저리고 피가 잘 안 통하는 느낌입니다  수시로 확인해보면 네번째 발가락만 색깔이 검푸르구요  어떤 질병이 의심되는지 어느 과 진료를 봐야하는지 답변해주시면 감사하겠습니다 ,신경외과
MRI 판독 부탁드립니다 ,금일 병원에서 척추 허리통증  MRI촬영을 하였습니다  결과 듣고 주사치료받고 왔는데 병원에서 설명해주신 내용이 전부 기억이 안나네요  심각한 상황은 아니라고 하셨고    번이 최근에 상처난 부위라고 하시는데 다른 전문가 분들의 의견도 들어보고 싶습니다   사진은 한장밖에 없어서 보이는만큼에 대해서만이라도 판독 부탁드려봅니다 ,신경외과
운동하는데 똥마려우면 어떻게해요 ,저는 똥싸고나면 몸이 풀려서 운동할맛이 안나고 참고 했는데요 싸면 안하게 됨  어떻게 해야 하죠 ,신경외과
압박스타킹 착용 후 종아리 근육경련 떨림,압박스타킹을 오늘 처음 착용해봤는데 착용  시간 후 누우니까 종아리에서 근육경련  떨림   약간 하지정맥류처럼 떨리더라구요 계속 착용해도 괜찮은 거 맞나요  ,신경외과
유도하다가 손톱이 재껴졌는데,손톱에 멍이 들었습니다  이게 통증이 없어지고 자연스레 빠진다고 하던데 얼마나 걸릴까요 ,신경외과
두통 질문,전문가 분만 답변해주셨으면 좋겠습니다 제가 며칠 전부터 두통이 있는데요 계속 아픈건 아니고 머리 뒷부분이랑 뒷 목 사이 부분 중에 약간 오른쪽이 몇 분에 한번씩 아파요 단순히 뭐 베개를 바꾸거나 요즘 갑자기 운동을 했거나 한 건 아니에요 왜 이런 걸까요  요즘 살도 많이 쪘고 가족 중에 고혈압이 있다보니까 고혈압도 약간 걱정되는데 혹시 고혈압일 가능성도 있을까요 ,신경외과
발 옆 통증,L자다리 하면 동그라미 친 발 옆 안쪽에서 뭔가 땡기는듯이 통증이 와요 왼발만 그러는데 왜그런 걸까요,신경외과
손가락의 이유모를 통증,왼쪽의 검지의 바깥쪽 부분의 핏줄이 오른쪽과 다르고 그부분의 끝이 마치 벤거처럼 건들때마다  스칠때마다 따끔거려요 한 몇달전부터 가끔씩 그랬는데 이유를 모르겠네요 신경적으로 문제가 있는건 아니겠죠 ,신경외과
손목통증 손목보호대,손을 쓸 때 손목에 힘을 주곤 하는데 요새 점점 손목에 통증이 오더니 손목이 시큰거리고 손목을 돌리면 뚜둑 소리가 나곤 하네요    칼 쓰는 직업을 갖는지라 손목 통증이 신경쓰이는데 이게 칼을 안 쓰는 평소에는 손목 보호대 착용으로 괜찮을까요  손목 보호대도 종류가 많더라구요    손가락과 연결된 거 같다기보단 손목 전체에 통증이 있네요,신경외과
콕콕 찌르는 것 같은 통증,처음엔 목이 조금 불편하다 싶었는데 오른쪽 뒷골이 땡기다가 오른쪽 뒷통수나 귀에 가까운 쪽이 누가 찌르는 듯이 아파요 콕콕 찔리는 느낌이 납니다 관자놀이가 아플 때도 있고요    처음엔 디스큰가 했는데 손등도 콕콕 찌르는 느낌이 날 때도 있고 지금은 목 바로 위에 머리 뒷통수 오른쪽 가 계속 아프네요      목 디스크 때문에 그런건가요  너무 신경쓰이게 아파서    어디 병원을 가야할지 모르겠습니다,신경외과
신경이 예민하면 어떤증상이 나타날수있나요,자기전 시에 뇌전증약만 먹으면 소변이 자주마려워서 불안하고 잠도안와서 억지로 새벽  시넘어서 자는데 신경이 예민해서그런가요 제가 잘때는 빔스크정  mg 파이콤파정 mg 케프라정    먹습니다 만약에 이약을 안먹으면 방광이 튼튼해질수 있을까요,신경외과
허리 MRi 판독 부탁드립니다,교통사고후 종아리쪽이 계속 부어있는것을 확인하고 한방병원에서  주가랑 입원후 통원을 하였으나 계속 치료가 안되어 정형외가로 가서 검진한 결과 허리쪽디스크 문제가 있다고 하셔서 MRI 를 촬영을 하였습니다 촬영후 판톡지인데 무슨내용인지 해석 부탁드립니다  ,신경외과
학생인데 이거 무슨 증상이에요 , 주 전 부터 두통이 심하고 월요일부터는 콧대가 찡 해요 열은 안 나고 토할뻔한적도 없어요 위장장애만 백신맞고 두달넘게 지금까지 현재진행형이긴 한데   무슨 증상인거죠  비염  축농증  뇌수막염  뭐죠   무섭네요,신경외과
긴장성 두통,요즘 시험과 입시면접 등 신경 쓸게 많아서 그런지 두통이 계속 생겨요  약을 먹어도 잠시 뿐이지 다시 두통이 생깁니다  머리를 누가 빙글빙글 돌리는것 같아서 어지러운 느낌과 머리를 쥐었다폈다 압력을 주는 느낌이 듭니다  원인이 단순한 스트레스 때문인가요 ,신경외과
몸이 이상해요,제가 어느순간 부터 가만히있다 움직이거나 갑자기 달리면 왼쪽 팔 다리 아니면 오른쪽 팔 다리 힘이 풀리면서 케어가 불가능하고 안면근육도 저절로 움직이고 척추가 뒤쪽으로 제가 안움직여도 혼자 꺾여요  나이는 올해   살 입니다 ,신경외과
몇년전 부터 증상 있다가 이제 질문 합니다   ,제가 어느순간 부터 가만히있다 움직이거나 갑자기 달리면 왼쪽 팔 다리 아니면 오른쪽 팔 다리 힘이 풀리면서 케어가 불가능하고 안면근육도 저절로 움직이고 척추가 뒤쪽으로 제가 안움직여도 혼자 꺾여요 올해   살 남자 입니다 ,신경외과
좌반신이 더 둔감해여,  대 초반 남성이에요   술은 잘 안마시고 흡연은   년째 하고있어요      년도 넘은거같은데 좌반신이 조금 더 둔감해요   운동능력도 미세하게 떨어지는 느낌이구요   오른손잡이여서가 아니라 얼굴 근육도  왼쪽이 조금 더 둔한 느낌입니다   통각은 차이를 모르겠네요   일상생활에 지장은 전혀 없고  주변사람들과 가족들도 모를정도로  티도 안나고 차이도 미세해요     제 오래된 기억에는 어릴때 경기를 일으키고 난 후로  이 미묘한 증상이 있던걸로 기억하는데 추측     년동안 이상없이 지내다가  요 며칠간 그 차이가 약간 더 느껴지네요   좌반신이 더 힘이 약간 빠지는 느낌이고 잠이 좀 덜깬 느낌이 미세하게 듭니다 더 뻐근하기도 하구요   걱정해야 할 정도인가요    가족내력에 뇌동맥질환이 있긴 합니다  ,신경외과
술 가슴 통증,며칠 전에 평소보다 술을 빨리 많이 마셨는데 그때 한번 마시다가 살짝 올라온 적이 있었는데 토는 안했어요  원래 숙취가 없었는데 다음날 속도 안 좋고 힘들더라구요  어제는 술을 평소보다 조금 마셨는데도 그때처럼 올라오더라고요    그냥 집와서 씻고 잤는데 일어났더니 가슴 사이가 답답하고 통증이 너무 심해요    다리 저림,신경외과
질병인가요 ,의사 선생님 분들 중에서 끝까지 다 읽어주실 분들만 답변 달아주시면 정말 정말 감사하겠습니다  정형외과  신경과 등에서 이렇게 길게 말을 하면 다른 환자분들이 기다시려서 불편해하시는 기색 의사 선생님 표정에서 들어나서 어쩔 수 없이 부득이하게 여기다 이렇게 길게 적게 되었습니다   중학교   살 때부터 오래 서있으면 허리가 아파서 빨리 앉거나 눕고 싶은 현상이 발생 하였습니다  그러다   살 때부터는 허리를 숙이는 행동을 자주 하면 허리가 묵직하게 아파 오게 되었고요     살 때에는 신발끈을 풀지 않으면 발목 앞 쪽이 고무줄로 꽉 묶어 놓은 것처럼 통증을 느끼게 되었습니다  저린 감각보다는 그냥 정말 고무줄로 꽉 묵었을 때 느끼는 그 통증입니다  널널한 양말과 신발끈을 살짝 묶어도 아프더라고요     살 때에는 어느 순간부터 누워도 목이 아파오게 되었습니다  너무 아파서 잠도 못잘 정도의 통증을 약  주간 겪다가 점점 통증이 만성화 되면서 약한 통증을 계속 느끼게 되는 단계로 접어들게 되었습니다  조금이라도 목을 사용하면 뒷목이 당기면서 뻐근하고  어깨가 무겁고  목빗근이 땡기고  후두부 쪽에 누군가 누르고 있는 것처럼 짓눌러오는 통증이 생기게 되었고요     살 쯤에는 표준체중인   kg인데도 계단  층 오르는 것만으로도 주저 앉아서 쉬고 싶을 정도로 힘이 딸리게 되었습니다  대학교 계단이나  아주 긴 지하철 에스컬레이터를 오를 때 여자 동생들이나 다른 여자 승객 분들도 안 지쳐 보이시는데 저만 유독 너무 힘들게 느껴졌습니다   당시 인바디 측정 기록보면 골격근량과 신체균형 부분이 표준 이하와 표준 사이 정도에 아슬 아슬하게 걸쳐 있는 상태로 모두  균형  으로 떠져 있습니다       살 때 쯤부터는 팔을 올려 양치를 하거나  팔을 올려 머리를 감을 때 팔 힘이 딸려서 한 두 번 쉬어야 할 정도로 힘이 들게 되었습니다  평생을 살면서 양치나 머리 감을 때 팔 힘이 딸리는 느낌이 한 번도 없었는데  팔을 내리지 않으면 어릴 때  간접 체벌 방식   팔 들고 서있어   를 한  분 동안 하고 있던 것 마냥 힘이 듭니다     살 때에는 휴대폰을 잠깐 들고 있는 것만으로도 손목에 묵직한 느낌과 함께 힘이 딸려서 들고 있기 힘들게 되었습니다  알바 할 때 여자 애들도 덜 무거워 하는 것들도 저에겐 많이 무겁게 느껴져서 힘들었고 체력도 많이 줄어든 느낌이 들게 되었습니다     살 때에는 왼쪽 무릎에 힘을 주거나 양반 다리  다리를 쭉 펴고 누워 있거나 하면 무릎이 아파오게 되었습니다  통증 양상은 무릎이 무릎 바깥 쪽으로 나올 것 같이 땡기는 느낌과 멍 든 곳을 누르는 것과 같은 얼얼한 느낌의 통증이고요  그리고 천장을 바라 본 자세로 누워 있게 되면 왼쪽 발 뒤꿈치가 무릎과 같이 아프고  왼쪽 발끝에 땡김이 있게 되었습니다    제 증상들이 하나의 질병으로 진단 내릴 수 있을까요  아니면 다 제 각각의 증상과 질병일까요    긴 글 읽어주셔서 정말 감사하며 쭉 행복한 나날이 되시길 바랍니다 ,신경외과
한쪽 얼굴이 찌릿해요,  대 중반 여자입니다  자고 일어나니 오른쪽 눈은 깜박일때마다 아프고 웃으면 오른쪽얼굴이 찌릿찌릿 하고 아파오는데   그냥 단순히 피로때문에 그런거 일까요    아니면 병원을 찾아가야할까요   ,신경외과
시상하부 양성뇌종양  년 무변화   갑작스런 증상이 나왔을때 뭔가 나빠졌다는신호일까요 ,저희 부모님인데    년전 뇌종양 진단 받고  위치는 시상하부 신경교종 으로  센치 정도이고   악성은 아니고 양성 뇌종양으로 확인되었어요  근데 정확한 검사를 하려면 조직검사인가 그걸 해야되는데   그걸하게되면 위치가 워낙위험한 부위라   생명에 위험이있을수있고   식물인간  뭐 이런 저런 위험성이있다보니   검사랑 수술 둘다 안하고  그냥 몇달 지켜보고 MRI 찍어서 변화가있는지 확인을 쭉해왔었어요    개월에 한번씩하다가 계속 변화가없어서  년주기로 늘렸고요  년동안 변화가 없다고 했어요   아무런 증상도 없었고요     그런데  개월 전부터 조금 무기력해 진거같은데 그당시에는 잘못느꼇는데    같이 일을 하는데   매일 같이 일상적으로 총명하게 잘하시던분이   갑자기   매일 하던일상적인거를 기억을 못하고  자꾸깜빡깜빡 하시고  또 TV프로그램 매일보던것도 그 이름을 말했는데 기억을못하다가 한 몇분후에 기억이나고   이런식으로 자꾸 까먹구요   운전도 평소에 진짜 잘하시는데     깜빡이도 까먹고 들어가서 위험한 상황도 있었어요   그리고 가장 중요한거는 평소에는 길게 말씀을 아주잘하시는데   요즘은 어려운단어나 길게 말을 하는것을 잘못하고   단답 쉬운대답만 하시고   뭔가 어려운거 설명을 거의 잘못하시고 어려운단어같은걸 떠올리지를 못하세요   언어랑 기억장애 같은게 나타난거같아요     년동안 아무런 증상도 없다가 갑자기 이런증상이 나타난 이유가뭘까요   잠을못자거나 두통이있거나 구토를 하거나 이런거는 전혀없습니다   단지 평소보다 좀 피곤해 하는거는 있어요  잠을 충분히 잔거같은데도    좀 평소보다 피곤해 하는거같고    확실히 업무능력이 많이 떨어진거는 느껴져요 매일같이일을해왔기때문에 아는데  반응속도가 확실히 느려지고 실수를 많이하고 기억을 잘못해요   근데 이게 근  개월 안에 변화된거같아요   한가지 걸리는거는 최근에 백신   차   차  차까지 접종을 했죠   혹시 백신에영향이있었을지 너무후회됩니다      갑작스런 이변화가 너무걱정됩니다  제가 해외라 병원은 갔지만 조금 기다려야 검사를 받을수있는데 걱정됩니다  너무   의사분들 이 상황을 받을때 혹시 악성으로 변화됬을 그런 가능성도있나요   그리고 백신이 영향을 줬을수도있나요 ,신경외과
뇌농양수술후,개두술로 농양 수술후 항생제치료끝나고 신경과신경외과두분이서 협진해서 수술은외과에서하고 주치의는 신경과입니다   두달만에퇴원했는데 퇴원 틀전부터 발가락이 꼬집어도감각이없고 바늘로 쑤시는것같을때도있고 퇴원 주째인데 계속그러네요 담당과 신경과담당교수님은 시간지나면 괜찮다고신경은 이상없다고 하는데진짜 너무아픕니다 따로 진료를보구싶은데 어느과를가야되나요 허리통증같은건없고 그냥동상걸렸다가 풀릴때 느낌처럼 그럴때있고 바늘로쑤시는거같은때있고 너무아프네요 당당교수님은 괜찮다고만하고 다른곳에가보구싶은데어느과로 가야될까요,신경외과
엠알아이판독결과,건협에서 받은결과지는  L  s 에 신경눌림있다고하고 그외는탈출된거없다고하던데  병원에서 의사는 L  L 오른쪽 약간 L   L  L  s 조금   L  L  디스크탈출이 양쪽으로 되었는데 왼쪽이 조금더 심하다고하네요  지금 증상은 양쪽 엉덩이랑 허벅지저림이있고 완쪽은 발바닥 가운데가 쥐나는거같고 오른쪽발가락이 저리고 피안통하는거같아요  오른쪽 허벅지 앞쪽 무릎위쪽이 얼얼한 느낌들고 가끔근육통처럼아프기도해요  건협에서 받은결과지와 병원에서 판독한게 조금다른데 병원에서 판독해준결과가 제 증상과비슷하다면 병원판독이 맞는거겠죠   아니면 다른병원 몇군데 더 가보는게나을까요  옮겨도 치료는 비슷할거같긴한데 어떻게하는게 좋을까요,신경외과
목 뒤 뼈,   초반 여자입니다   며칠전 극심한 목 허리 통증으로 외과에 다녀왔어요 목은 역 C자라 하셨고 허리도 측만이 심하다 하셨어요  다리 저리고 시리고 손이 붓고 귀거 심하게 울리고 눈이 심하게 건조하고 찌르는듯 아프고 두통까지 심햇어요    당일에 도수 치료받은 후부터 그나마 허리는 호전된듯했으나 목 통증이 극심해졌습니다  최근에는 얼굴까지 쥐가 납니다   Mri는 안해봤는데 이거 목디스크인가요   목뒤에 튀어나온 뼈 통증이 십합니다    질문  지금 목뒤를 손으로 만졌을때 전엔 느껴지지도 않았던 목 뒤에 뼈가 너무 튀어나와있어요   진짜 충격먹었어요   진짜 전엔 만져지지도 않았던게 갑자기 툭 튀어나와있어요   이거 어떻게 다시 되돌리죠 오래 걸릴까요   당장 도수치료를 받을 수가 없는 상황이에요 보험이 안되어서     플랭크나 벽에 허리 머리 일자로 대고있기 말고 방법이 뭐가있을까요  ,신경외과
목디스크 심한편인가요 ,병원에선 디스크 세개라고 하는데 다른 전문가 의견도 궁금해요,신경외과
시야흐릿하며 뿌한느낌 멀리있는게 초점이 안맞고 복시 ,제목처럼 시야가흐릿하며 뿌한느낌이며 멀리있는게 초점이 잘안맞고 어지럼증도 생기며 가끔씩 복시도 발생하구요 안과검사및 신경MRi검사 혈관및 뇌에는 이상없다고 합니다  뒷목근육이랑 등근육쪽이 계속 뻐근하구요  눈은 살짝 충혈되고 뻑뻑합니다  왜이러는걸까요   제발제발 광고성댓글 아이테라피 프리즘안경 이딴 댓글 제발 달아주시지마시고  복사해서 붙여넣기 답변도 제발 하지말아주세요  질문자는 심각한대 그딴댓글 달면 기분 안좋습니다 ,신경외과
요즘 등이 너무 따가워요,그냥 앉아있을 때도 그렇고 일어서있을 때도 그렇고 거의     시간에 한번씩 등이랑 팔뚝이랑 뒷벅지  엉덩이가 완전 찌릿찌릿합니다 근데 이게 약간 땀같은 것도 나고 그리고 살짝살짝 찌릿 한 게 아니라 완전 너무 아파요 요새 더 따가워졌습니다 왜 이런 건가요   여자 학생입니다  ,신경외과
이마 부르르,안녕하세요   살 남자입니다 며칠전부터 왼쪽 이마가 자꾸 신경쓰이게 핏줄이 올라왔다 안올라왔다 느낌이랄까 자꾸 부르르 떨리는데 통증은없고 자꾸 신경쓰여서 미치겠네요 뭘까요  ,신경외과
부스터샷후 두통,부스터샷을 맞은뒤 하루가 지났는데요 오른쪽 귀에서  마디 위쪽 머리부분에서 계속 찌릿하고 아픕니다 아픈부위를 긁거나 약간 건드렸을때 아픔이 느껴지고  주사를 맞은 팔방향의 목이 약간 뻐근합니다 어떤 증상인지 알수 있나요 ,신경외과
마취통증의학과 에서 목주사   맞고 통증  ,일자목에 퇴행성도 있고 근육이 많이 뭉쳐서 목이랑 승모근 날개뼈쪽에 주사를 맞았습니다 지난주에 맞았을때 통증이 많이 줄어서 일주일 후인 오늘 한번더 주사를 맞았어요 맞고나서 괜찮았는데 집오고 나니 승모근에서 부터 맞은쪽 볼까지 마취되서 얼얼한 느낌  이 심하게 나는데 괜찮은가요      병원문이 닫아서 전화해서 물어볼수없어 지식인에 올려봅니다,신경외과
이거 신경에 문제있는건가요 ,중  학생입니다  제가 초등학교  학년때부터 갑자기 뛰면 오른쪽 팔다리에 힘이들어가서 잘 안뛰어지는 증상이 있었는데요  중 때부터는 갑자기 뛰는거 뿐만 아니라 의자에서 갑자기 일어나거나 신호등 건너려고 멈추었다가 다시 걸을때 오른쪽 팔다리에 힘이 들어가면서 약간 이상하게 걸어지는것 같아요  어느날은 하루에    번정도 이러고 또 어떤날은 하루에   번정도 이러는것 같아요  최근에는 가끔 왼쪽 팔다리도 증상이 있는것 같아서 너무 힘들어요  이거 왜 이러는걸까요  또 어떻게 치료할 수 있을까요  아직 부모님께 말하지도 않았는데 어떻게 말씀드려야 할까요  또 어디 병원에 가서 의사선생님께 증상을 어떻게 설명드려야 할까요 ,신경외과
청신경초종,안녕하세요    센치 왼쪽 삼킴 및 목소리나오는 부분에 그리고 가까운곳도 소뇌  연수쪽  종양이있다고해서 감마나이프수술을받았어요  그리고  개월이되어 엠알아이를찍었는데 모양변화없이 줄어들지도  커지지도않았다고해요   그래서 그럼 어떻게해야하냐고물어보니 후유증없이 안면마비  삼키는게힘들지않으면 괜찮다고    지금 이상태면 괜찮다는거예요   저는 왼쪽 귀쪽부터 그쪽 라인이아프고 두통 어지럼증  멍함이 심한데요   그래서 아직아프다니 통증에 대한이야기는해주지않고 타이레놀 및 안정제 데파스정   미리  를 줄여보라고하네요   어쩌면좋을까요   통증때문에 힘들어요  ,신경외과
턱 부딪혔을때,안녕하세요 제가 계단을 올라가다가 넘어져서 턱을 부딪혔는데요 살짝 까지고 부어서 일단은 냉찜질을 하고있는데 괜찮은건지 잘 모르겠어요   말하거나 입을 벌리면 살짝 아파요     병원에 가보는게 좋을지 모르겠네요    부어서 그런지 좀 땡기는 느낌이 들어요  ,신경외과
코로나검사 친구 접촉,친구가 저를 만났을때 코로나가 걱정된다고 같이 병원에 신속 항원 검사를 받으러 따라가달라고 해서 갔었는데 음성이 나왔었거든요 그뒤로 헤어지고  일이 지난 오늘 또 검사를 받으러 갔다는데 양성이 떴다고 했습니다 그럼 저도 검사를 받아야 하는건가요  아니면 저와 있을땐 음성이 나왔던 상태니 상관이 없을까요  ,신경외과
손가락 힘 균형이 안 맞아요,안녕하세요 제가 첼로 전공을 하고 있는데  요새 활을 잡을때 오른손의 검지와 엄지에 비해 나머지 손가락이 힘이 안 들어가는 것 같은 느낌을 받아 상당히 활을 잡는데 불편합니다  손가락을 쫙 폈을때 중지 약지 새끼손가락은 힘이 힘줄에 힘이 안 들어가는 느낌이 들고 이것때문에 균형이 안 맞는거 같아요  주먹도 쥐어보고 여러가지를 했는데 개선되는 느낌이 들지 않네요 어떡해야하나요  ,신경외과
