0,1,2
머리에서 박동,최근 앉아서 전자기기를 많이 만지기도 했고 운동을 스트레칭을 별로 안하고 해서 그런지 항상 어께근육이 뭉쳐있었구요 살이  개월에   키로가 쪄서 혈압도    정도로 나옵니다  한달전 역류성식도염에 의한 호흡곤란이 생겨 건강에 매우 예민해져 심장초음파  홀터검사등 모두 받아서 정상으로 나왔구요 모두 정상으로 결론 나고  일전 술을 먹고  일전 병원에가서 혈압을 잿는데    이 나오더라구요 지금은 다시    정도로 떨어진 상태이구요 다이어트를 하는 중이라 혈압은 곧 떨어질거라 예상됩니다  하지만  일 전부터 갑자기 후두부에서 박동뛰는 느낌이 느껴지고 목근육이 아파요 두통은 없구요 걱정되는 마음에 뇌졸증 증상도 검색해서 알아보았으나 비슷한 증상은 하나도 없네요 일상생활 할때 문제없고 시야도 잘보이고 운동도 정상적으로 할 수 있습니다  운동할때 좀더 박동이 잘 느껴지는 것 같구요 제가 사진 올린거에서 파란색으로 동그라미 칠한 부분만 박동이 느껴지는 것처럼 느껴지고 저리거나 누르는 것처럼 느껴집니다  한의원에 갔더니 그냥 긴장성 근육통이라 하는데 박동도 느껴지고 두통도 딱히 없어서 걱정이 됩니다  조금 진지하게 답변 부탁드립니다  ,신경외과
왼쪽 가슴 옆 통증,화요일날 부터 아팠고요  오후  시 부터 해서 밤  시 까지 들숨 날숨에 계속 아파 통증 부위를 붙잡고 걷지도 못하고 고개를 숙여도 세워도 계속 통증이 심해져서 길에 주저 앉기를 반복 했을 정도여서 모르는 사람들이 부축을 해줄 정도 였거든요   그리고 수요일날은 새벽에 조금씩 아프다가 그 후에 자고 일어나니 괜찮아져서 병원 안가고 오후 시 쯤에 너무 아파서 주변사람이 구급차를 불러준다 할 정도로 통증이 너무 심했는데 바늘로 찌르는 느낌을 받으면서 부위에 통증을 칼로 누가 찌르는 듯한 고통이 있었어요 들숨 날숨을 못할 때 심장을 누가 쥐었다 폈다 하는 것 같이 아파요  근데 어제 병원을 가니까 대상 포진 같다고 약 처방을 받았는데 통증은 계속 똑같고 수포 일어난게 있는지 보니까 아무것도 없고 날개뼈 밑쪽에서 통증이 심하더니 통증 부위랑 이어지게 같이 아프더라고요   숨을 깊게 들이마시고 내뱉을 때 통증 부위가 욕 나오게 아파요    근육통일까요  흉부 x ray 찍었는데 아무 이상 없다고 하긴 하는데    오늘 날짜로 통증 생긴게  일 째인데 오늘 내일 하는데    알려주세요    ,신경외과
 차 백신 맞도 머리에서 좀 이상하네요,뒷머리 부근이고 귀 위에 쪽 부근인데요 백신맞고 일주일정도 됐고요 이런지는  일정됐는데 자꾸 한쪽 핏줄 지나가는느낌 들고 묵직하고 뭉친느낌 나고 이 부근만 꿀렁꿀렁 거리면서 반대편만져보면 핏줄있다 이런느낌은없는대 이부위만 핏줄있는거 같고 핏줄같은거 만지면 꿀렁꿀렁거리고 좀 애매하네요 이뭐 뭘까요  제가 예민해서그런건가 아 그리고 이거 백신맞고나서 다음날에 자다가 두개골 오른쪽 눈뒤쪽인가 머리 두개골 중간 인가 뭔가 순간 시원해지는 느낌들다가 그다음날부터 이증상 있었네요,신경외과
정수리 두통,평소 두통을 자주 앓고 있는데 가끔씩 정수리 두통이 와요 가만히 있을 때는 아무렇지 않은데 고개를 숙이거나 목을 돌리거나 기침을 하는 등 어떤 행동을 할 때마다 지끈거리고 피가 쏠리는 느낌 이 강하게 들어요 어지럽고 붕붕 떠있는 것 같은 느낌도 들고요  왜 이런 거죠        약 먹고 자고 일어났는데도 나아지질 않아요,신경외과
코로나일까요   , 일째 목에 가래가 끼고 기침이 나오고 침 삼킬때도 아파요 코로나 밀접접촉자라 검사  번 했지만 다 음성이구요  ,신경외과
수전증약질문,수전증약 타이레놀 같이 먹어도 될까요  ,신경외과
 시방향  시방향 햇갈리는데 뭐가 문제일까요 ,정확히는   시 와  시    시와  시    시와  시 이렇게 왼쪽 오른쪽을 시계방향으로 말해줄때 햇갈리는 경우가 대다수입니다   특히 게임할때 미니맵을 시계방향으로 말해주는 경우가 많은데 한번 더 생각해야하는 경우가 많고 무의식적으로 말하면 반대로 말합니다  ex   시 방향으로 모이라고 하고 정작 저는  시로 가고있거나   등등   실제 시계를 볼 때는 문제가 없고 그냥 저만 햇갈려해서 왜 그런지 궁금하네요   ,신경외과
이틀전부터,이틀전부터 왼쪾 검지 손가락 지문에 손가락 끝은 아니고 가운데 위에서 살짝 왼쪽에 종이에 베인 것 같은 통증이 생겼는데 가만히 있으면 안아프고 겉으로 봤을 때 이상한 점도 없는데 누르면 살짝 아파서 한번도 이런 적이 없는데 갑자기 생겨서요  많이 아픈건 아니고 살짝 아픈느낌인데 괜찮은거죠 ,신경외과
편두통 증상인지 궁금합니다,예전부터 주기적으로 머리가 아팠었지만 자고나면 괜찮아지길래 따로 약을 먹지는 않았는데  지금은 한 달에 한 번 심하면 두 번 정도 머리가 꾸준히 아파오길래 혹시 편두통이 아닐까 의심돼요  눈이 뻐근해지면서 아프기 시작하다가 관자놀이까지 퍼져가고요 거기서 더 심해지면 머리의 옆쪽  앞목  뒤쪽까지도 뻐근해지면서 조여오는 느낌이 더 심해집니다  소리에도 예민해져서 조그만 소리에도 징징 울리는 듯한 느낌이 들어요  오늘은 이명도 약간 들리는 것 같았어요  빛에는 예민하지 않다고 생각했는데  밝은 빛이 눈에 피로를 주니까 자꾸 어두운 곳을 선호하게 되더라구요   편두통 증상 맞나요 ,신경외과
전방십대인대파열 수술후  ,전방십대인대파열 수술을 한지 일주일되었습니다  실밥제거는아직안한상태에 퇴원을 했습니다  보조기차고 퇴원했구요  혹시 잘때도 차고자야되나요  지금차고잇는데 먼가 쪼이는 느낌이 들어서 좀 불편한감이 있어서요  안차고자면 자다가 몸부림으로 힘들거갓고    차고자야되나요  그냥자도되나요 ,신경외과
손가락 마비,엄지손가락을 중심으로 오른손 손가락이 다 불편해요  왜 이러죠  어떻게 해야 하죠 ,신경외과
머리 통증,어제부터 머리가 어지러웠는데 갑자기 머리가 붕 뜨는 통증이 느껴지고 코가 맹한 느낌이에요 왜 이런가요 ,신경외과
눈앞쪽 코위쪽 통증, 시간전부터 눈앞 아랫부분이 욱신욱신하고 누르면 통증이있습니다 안과를 가봐야될지 이비인후과를 가봐야할지 모르겠습니다 눈도 아프고 코 위쪽도 욱신거리는데 무슨문제일까요 눈앞 빨간부분도 부어서 눈쪽으로 나와있는모습입니다 파란동그라미 부분이 통증이있어요,신경외과
급해요 열이 안 나는데 두통이 있어요,안녕하세요 이제 고 이 되는 학생인데 어제부터 머리의 오른쪽 부분이 두통이 심하지는 않고 조금씩 아파오는데 뇌출혈  뇌경색  뇌졸증과 관련이 있나요  너무 무섭고 불안해서요  저 괜찮은건가요  열은 안 나요  ,신경외과
뒷쪽옆구리부터 오른쪽 다리까지 계속 쑤시네요,설 명절 끝나고나서부터 시작됬는데 옆구리가 너무 쑤시고 오른쪽다리가 쑤시듯이 아프네요 병원에서는 디스크 초기증상일수도 있다면서 약을 먹고도 아프면 진찰을 받으라면서 일주일치 약을 줬습니다  약을 먹으니까 조금 낫는것같긴한데 몇시간뒤에 다시 통증이 느껴지네요  혹시 무슨 큰병걸린건 아니겠죠 ,신경외과
좌골신경통이 심하여 MRI 촬영하였는데 정확한 병명과 치료 방법에 관하여 문의드립니다,최근 왼쪽다리를 폈을때 왼쪽발 뒤꿈치 바깥쪽 찢어지는듯한 통증으로  서있기도 앉아있기도 힘든 상황이되어 MRI를 촬영하였습니다  현재 주사와 약물치료중으로 찢어지는듯한 통증은 찌릿한 통증 정도로   바뀌었으며 간헐적으로 발바닥의 찌릿함도 있습니다  위 치료 외 요추전만 동작도 꾸준히 실시하여 조금씩 호전되고 있으나  아직   분 이상 서있거나 걷기 힘든 상황으로 다른 선생님들께도  조언을 듣고자 문의드립니다 ,신경외과
일주일 전에 입술 수포가 올라오면서 수포 생긴쪽에 뒤통수가 아프기 시작했는데 수포가 딱지 지고 나아가는데도 두통은 가라앉질 않는데 왜 그런걸까요,일주일 전에 입술 수포가 올라오면서 수포 생긴쪽에 뒤통수가 아프기 시작했는데 수포가 딱지 지고 나아가는데도 두통은 가라앉질 않는데 왜 그런걸까요  이런경우 병원 무슨과를 가야 하나요 ,신경외과
금연 중 궁금한 것이 있어 질문드립니다,방금 인터넷에서 공부한 내용을 말씀드리자면 우리 뇌는 자극을 받아서 쾌락을 느낄경우 그 자극을 받은 부위의 활동량이 줄어든다 그러니까 식욕  성욕 등 욕구가 줄어든다 ex  포만감   섹스 후 현자타임 즉 우리 뇌는 필요한 만큼 움직인다 ex  환경호르몬 외부자극에 적응하고 필요한 만큼 움직이기 위해서다 외부자극에 완벽히 지배 당하고 그 자극의 공급이 중단됐을 때 오랫동안 자극받아 오면서 구축된 중추신경의 회로가 비상이 걸려 불안  스트레스  우울  울화   섬망   구토  발작 등 몸이 견디지 못하게 된다 이것이 바로 중독이다  니코틴은 니코틴 수용체에 달라붙어서 도파민을 과다분비 시킨다고 들었는데요 그래서 궁금증이 생긴게 금연중에 도파민 분비를 촉진 시킬만한 일들이나 음식을 섭취하면 금단증상 완화에 도움이 될까요 ,신경외과
얼굴경련과 눈이 겹쳐서보여요,몇년전에 영화관에서 눈 밑이 떨리는정도가 아니라 주체가 안될정도로 심하게 경련이 잠깐왔었고  얼마전에 영화관에서 영화를 보는데 갑자기 조금씩 어지러워 지면서 모든게 겹쳐서 보였어요 잠깐 밖에나와서 진정시키니까 괜찮아졌는데요 머리 뒤쪽 두통은 조금씩 계속 느껴지네요  원인을 알 수 있을까요 ,신경외과
왼쪽 가슴 근육 통증  뭉침 ,안녕하세요  한    개월 전부터 평소엔 괜찮다가도 일어서서 상체를 왼쪽으로 살짝 스트레칭하는 것처럼 돌리면 사진처럼 왼쪽 부분이 뭔가 근육이 뭉쳤다가 펴지는 것 처럼 느껴집니다  뭔가 근육 뭉쳤던걸 쥐어짜서 다시 이완시키는 느낌     통증은 거의 없는 편인데 뻐근한정도에요  이런 증상 원인이 있을까요  그리고 병원을 간다면 어디 과로 가는게 맞을까요  고수님들의 답변 기다립니다 ,신경외과
증식치료가 주사인가요 ,무릎통증 때문에 정형외과 가서 진료를 받았는데 무릎 엑스레이 찍고 무릎 초음파 보고 무릎뼈가 닿을려고 하는 거라 조심하는 수 밖에 없다며 약 처방도 없고 다시 오란 말도 없고 그냥 왔거든요  근데 실비보험 청구하려고 진료비 세부내역서를 보니까 처치 및 수술 항목에 비급여  만원 청구된 게 있는데 증식치료    Prolotherapy    사지관절부위 이렇게 적혀있어요  증식치료를 찾아보니 포도당 주사치료라는데 저는 주사고 뭐고 아무 치료를 받은 적이 없거든요  말로 설명만 좀 듣고 나온 게 전부인데 가서 확인하고 따져야 하는 게 맞는 건지 궁금하네요 ,신경외과
전신마비 안면마비,  전신마비와 안면마비가 같이 오는 경우도 있을까요    그 경우 어디를 다쳤을때 전신마비와 안면마비가 오나요     전신마비가 왔을때 자의적느로는 움직이지 못하지만 다른 누군가가 팔 다리를 잡아서 움직이게 할 순 있죠 ,신경외과
사람에게 물렸어요,어제 친구랑 장난을 치는데 친구가 제 오른쪽 손목 윗쪽 안쪽 뼈 있는 부위를 깨물었는데 조금 쎄게 물어서인지 물렸을 때 부터 손가락이 조금 저리더라고요 지금 하루가 지났는데도 엄지 검지 손가락이 좀 저려요 이건 병원을 가봐야 할까요   일상생활 하는데 자꾸 손이 저려서 불편하네요  ,신경외과
오른쪽 턱에서만 소리가 나요,입을 살짝 벌릴때 항상 오른쪽 턱에서만 탁  소리가 납니다  탁 소리가 난다음에는 모레가 자글자글하는 소리가 나다가 없어져요  통증이 있거나 턱이 빠진적은 한번도 없는데 자꾸 한쪽에서만 소리가 나요 ,신경외과
팔 다리 저리는 듯한 근육통증,스무살 여자입니다 원래 운동을 하는 사람으로서 단순한 근육통이라고 생각하는 사람 중 한 명입니당 원래 허리가 안 좋아서 허리 디스크까지는 아니여도 운동하면서 움직이지도 못 할 정도로 아팠던 적이 많았어요 부정맥도 있습니당    또한 초등학생 때부터 운동을 해왔던지라 남들보다 근육통이 심해서 매일 달고 살았고 울면서 참고 잠들고 그랬던 적이 대부분인데 고등학교 들어와서부터 더 심해진 것 같아요 허리는 입시 하면서 무리하게 써서 그런가 싶다가도 운동 며칠 쉬면 괜찮아지고 그랬어요    근육통은 운동하는 날   안 하는 날에도 아팠다가 안 아팠다가 종아리만 아팠다가 허벅지만 아팠다가 팔만 아팠다가 전체 다 아팠다가 하면서 말썽이었는데 거의 저녁부터 밤 새벽 아침까지 통증이 계속 됐던 것 같아요 힘을 빼고 자보려고해도 힘 준 것 같은 통증과 너무 아프고 신경이 너무 쓰여서 잠이 안 와요 요즘은 두통도 심해졌어요 몸에 어떤 이상이 있는 건지 궁금하고 걱정됩니다    너무 진지하고 사람 생명이 달린 질문입니다 정성껏 답변해주시면 감사하겠습니다   ,신경외과
어깨에서 끼긱끼긱 소리,제가 오른쪽 왼쪽 두 어깨 모두 습관성 어깨탈골이 있는데 그냥 평소에 어깨나 팔을 움직이면 끼긱끼익 소리가 나요    원래이랬는디 갑자기 궁금해져서 질문해봅니다,신경외과
동상 인가요,추운날 요새 밖에 발 시릴때까지 있던 날이 많아서 그런건지 모르겠는데 약간 새끼발가락 중간에 통증이 좀 있어요 병원 어디 가야되나요,신경외과
허리디스크 증상,제가  달전에 무거운걸 순간적으로 힘을 줘서 들다가 왼쪽 허리에 무리가 가해졌습니다  그날 하루정도는 많이 아팠는데 그 다음날이 되니까 괜찮더니  주일 전부터 왼쪽 허리 부터 다리 뒷쪽 종아리 까지 많이 당깁니다  허리디스크 인가요      추가내공 걸게요,신경외과
발등 찍혓엇는데 발가락이 아픕니다,발등에    kg 정도되는 물건 떨어져서 병원갓다온후   붓기가 나으면서 찍힌곳 주변은 이제 눌러도 안아픈데  발가락이랑 발등 연결   되는부위쪽이 아프네요    원래는 안 아팟는데 붓기가 많이 빠지면서 갑자기 아프네요     걷는것 정도는 괜찮은데   발가락 굽히거나 하면 좀 아프네요    원래 그런건지 궁금합니다         발등 붓기는 아직 조금 남아있습니다 ,신경외과
가슴통증 및 뒷통수가 당기는 증상,왼쪽 가슴  심장쪽  이 뻐 근한 느낌이 들면서 머리까지 이어져 오른쪽 뒤통수 쪽이 땡기는  통증이 한달에 한 두번 주기적으로 있거든요  한번 오면 약   분 정도 지속되다가 사그라 듭니다      혹시 어떤 증상인지 예상되시는 분 계신가요     또  병원을 간다면 어디과로 가봐야할까요   아시는 분 답변 부탁드립니다  감사합니다  내공    ,신경외과
귀 뒤에 있는 두피 핏줄 힘줄 부분이 아파요,귀 뒤에 있는 두피 힘줄같이 약간 튀어나온데가 있는데 그 곳 양쪽이 다 아파요 가만히 있으면 괜찮은데 귀를 뒤로 힘을줘서 움직이면 툭 튀어나온 힘줄같은 부분이 아파요  한  일정도 전부터 아팠는데 오늘은 양쪽이 아프네요     병원 가봐야되는건갸요 ,신경외과
화이자 백신  차 맞고 두통이 생겼어요  ,안녕하세요 현재   살 학생입니다 화이자  차 접종을 한 지  주가 지났는데 한    일 전부터 편두통과 머리 뒤쪽 통증이 계속 지속되는 상태입니다   이것도 백신 부작용일까요   병원을 가봐야할까요    ,신경외과
엉덩이밑사타구니쪽  고름 큰종기,이게뭔지    삼일전쯤생겻는데 지금 터져서 피랑 고름 같이나오고 있습니다 어떻게 해야할가요    병원갈 상황은아니고 혼자 치료하고싶습니다 병 이름은뭔가요,신경외과
허벅지 장요근 통증,사진처럼 저 부위가  년전부터 간헐적으로 지끈지끈 아프기 시작했습니다  통증 강도는 아프기 시작하면 잠도 못 잘정도로 지끈거리고 최근들어서는 자주 아프기시작합니다  병원을 가보려고해도 이건 어느과 가야될지 모르겟네요 뭐때문에 그런걸까요 ,신경외과
환추 후두관절 탈구,고개를 움직이거나 특히 뒤로 재낄때 아예 빠진다고 하더라구요 옆으로도 빠지고 상하좌우 걍추    번쪽에 문제가 다 있다고 하더라구요 그래서 너무 어지러워서 일상생활을 못하고 있구요 지금은 이제 막 알려주신 운동치료 하고있긴한데 찾아보니 수술을 꼭 해야한다고 하는데 수술을 빨리 진행해야할까요 ,신경외과
이미다치고 눈까지 퍼렇게 생긴 증상,아침에 핸드카에 이마부분을 찧어서  고대안암병원에서 바늘로 꿰맨후 CT  XRay등 받아 이상소견이없어   퇴원했습니다    근데 시간이지나 지금 이마에 있는멍이 눈까지내려왔는데   어머니가 주변사람들한테물어보니 원래 내려온다고 하는데   검색해보니 라쿤증후군이라고 하는데요   뇌출혈증세가없어도 눈이 퍼렇게 되기도 하나요    멍이 든다는건 피가 출혈되어있다는건데      급하게 질문 남겨봅니다    바로 응급실을 가야할까요     이전에도 뇌출혈 증세로  일 참다가가서 큰 수술을 받아서 시력을 조금 잃었는데요    어머니가 자꾸 괜찮다고 안가려고 하십니다  ,신경외과
아랫입술경련 뇌신경외과질문 ,   일에 처음으로 떨리시기작했고      일인 지금은 심해져서 튕기듯이 떨립니다  침도 계속 흐르고요  대학병원 신경외과 진료봤는데 뇌에 안면신경 을 담당하는 기능에 이상이 생겼을때 이런증상이 일어날수있다던데  혹시 저런 뇌에 안면신경장애가 발생했을때  제증상을 보셨을때 혹시 비슷한 진단명이라도 알수있을까요  근전도검사랑 뇌엠알아이 예약은 해둔상태입니다  불안해미치겠습니다  할아버지가 선천적 뇌동맥류 있으셔서 저희도 뇌를 조심해야된다고 했는데     Loading                  화질 선택 옵션,신경외과
진주에서 심혈관 뇌혈관 진료 치료 잘하는 곳은 ,진주에서 심혈관 뇌혈관 진료 치료  잘하는 곳은 어디인지 알려주세요,신경외과
쇠골뼈 철심 제거수술 회복 기간,나이 먹고 직장 어렵게 구하여 일하는  호선 중후반의 가장입니다   작년초 쇠골뼈 골절로 철심을 박았습니다  올 여름에 제거 수눌을 받을려고 하는데 보통 회복 기간이 어찌되는지요  올 여름 휴가는   일 정도 입니다  진짜 어렵게구한 직장이라 수술   이면 정상 생활 가능할련지요 ,신경외과
요추 엑스레이 찍을때 척추분리증 안걸리는법 있나요,말그대료 요추 엑스레이 찍을때 척추분리증 안걸리는 방법이 있을까요 힘을 준다던가 제가 선천적 척추분리증있습니다 선천적이다 보니 일상생활이나 무거운러 들어도 아무지장 없는데 취업때문에 걱정이라 요추엑스레이 찍으면 안걸리고 싶은데 전에 란번 보니 금이 간것처럼 조이더라고요 그래서 최대한 안걸리는 법이 있을까요,신경외과
척추관협착증  ,증상을 말해보자면   오래서있을때 발바닥통증이있음 한때 잠깐동안 아킬레스건통증도 동반되었음    허리를 곧게 펴고 서있으면 통증이 점점심해짐 허리를 구부리면 통증이 덜하여짐     내가 허리를 잘못쓰는건지 모르겠는데  허리를 많이 쓰지않는 일을 해도 허리가 아픔 이정도인데 척추관협착증이맞나요    아니면 무엇떄문에 일까요  ,신경외과
하지정맥류 ,오후만 되면 허벅지 뒤쪽 찌릿찌릿하고 종아리도 살짝 찌릿해요 제가 잡고있는 부분도 아파요 잠잘땐 아프진 않아요 제가 복무를 요양원에서 해서 일어서 있을일이 많아요   또 제가 꽉끼는 운동화 신고 오래걸어요  번쩨꺼는 빛때문에 나온거 같아요 검은건 점입니다,신경외과
대전 신경외과 추천,저는   살인데 뇌진탕 때메 병원가려고하는데 어디 신경외과가 좋을까요    추천해주세요  ,신경외과
급  인공디스크수술 해야할까요 ,인공디스크수술 해야할까요  년반전에      번사이 내시경으로 시술같은 디스크 수술했었는데 방사통왔는데 몇일걸려수술하는 바람에 신경변형으로 왼다리 종아리 방사통이 자주있습니다  얼마전 골반엉덩이쪽으로 미친듯이 아파서 기침도못하겠고 움직일수없어 죽을뻔하다 좀 지나병원가서 사진찍었어요  수술했던곳은 오히려 그리문제가 안되는데    번밑으로천추  번이 디스크에 전체적으로 무너져서 퇴행성척추질환과 같이동반했다고 하네요 문제는 제가 천추 번 뼈가 부러져있었어서 재발가능성이나 많이 위험하다했는데 지금 딱 그 부분이 디스크터지고 간격이 너무좁아져 시술로는 얼마못가 통증동반해서 또 오게될거라고 인공디스크를 말씀하시는데 언젠가는하게 될거라 하면 지금하는게 맞다생각하고 아니면 이런상태일때 어떤결정이 좋은지의견여쭈고 싶어 글올려봅니다  사진은 왼쪽이  년반에 오른쪽이 현재 mri찍은사진입니다,신경외과
오른쪽 눈 두통 턱 치아 통증 질문드려요 내공  ,경추 문제인 거 같기도 하고  일연속 아프다  일 동안 문제 없다가 또다시 시작됐네요 장시간 컴퓨터를 하다보니 목이랑 어깨사이 통증이 자주있습니다 잠 잘때도 목이 아파서 잘 못자구요  병원을 어디로 가야되나요 정형외과를 가야되나요  그리고 치료비가 실비보험에 적용되는지 궁금합니다,신경외과
정형외과 허리 주사 비용,작년  월에 엑스레이 찍고 별로 심하지않다고 통증 줄여주는 주사  만원이라고 맞으라해서 안맞고 나오고 오늘 간 곳은 Ct찍고    번 디스크가 터졌다고 하더라구요  주사비용이   만원이라고해서 안맞고 약만 타서 왔는데   가격차이가 심해서요  두번째 간 병원은  번   번 주사를  번 놔주는거여서 그럴까요  실비도 이제 막 들어서 아직 보장기간이 아니라 금액이 부담돼요   지금 아픈지  개월 정도 됐는데   다른 병원을 또 가서 주사를 맞을지   개월 더 참고 맞아도 될런지   디스크 탈출은  단계라고 하시던데 어떻게해야할까요  ,신경외과
