0,1,2
왼쪽 팔다리 저림 증상,안녕하세요 어제 저녁에 체감 온도가영하   도에 바람이 많이 불었는데  배달 알바를    시간 정도 하고 집에왔는데  양팔이 저리고  호흡이 살짝 찗아져서 인터넷 찻다보니깐   동상이르 인한 말초신경으로 인해 저리는 증상과 자율신결이상으로 호흡관련 증상이 발생핤 있다고 되잇어서  동상 치료방법으로 나와있는 따뜻한물에   에서   도정도에 온수네 몸을   분정도 담그고 나와서 회복이 되었습니다  그고 숙면을 취하고 일어났는데  왼쪽 팔돠 다리만 약간씩 저린 증강이 있네요   인터넷에 검색하니깐 한쪽에만 저림 증상은 뇌졸증이 많이 검색되던데  빨리 병원가야된다던데  저는 어제 저녁 부터 증상이 있었던걸로 보면 놔졸증은 아닌건지  궁금합니다  나이는   중반이고  평소 목디스크는 아닌데  목어깨가 잘 뭉치고 통증이잇었습니다  그리고 최근 일이 많아서 신경도 많이쓰고 과로도 좀 한거같아요  이것돠 관련이 잇을가요   도움 부탁드립니다  ,신경외과
허리디스크 병무용 진단서,           에 촬영한 mri입니다   요추    번 사이 수핵이 거의 없는데 이정도로 병무용 진단서 가능할까요  수술시술 안했고  개월간에 통원치료 한다는 가정하에요     이때 통원치료가 물리치료로 가능한가요    정형외과 전문의만 만나 상당한 상태인데  병무청지정병원 신경외과 교수님을 뵙고 올까요   잠재적인 위험을 가지고 입대를 하기에 너무 무섭습니다 ,신경외과
넘어진후 두통,오늘 스케이트를 타고 뒤로 엉덩이부터 꽈당하고 넘어졌는데 머리가 너무 아프네요 골이 울리면 너무 아픕니다 뒷골도 땡기고 방지턱이나 머리에 충격이 오면 머리가 너무 아파요 어떻게 해야 할까요 빠른 답변 부탁드립니다     제발요    ,신경외과
링겔 주사 손목 주사 후 저림,얼마 전에 수술 할 일이 있어 바늘을 꽂는데 왼쪽 손목에 꽂았다가 간호사가 핏줄을 못 찾는다며 조금 쑤셨는데요  왼손 엄지와 검지가 순간적으로 뜨겁게 확 저렸습니다   그 후 계속 엄지랑 검지가 저린데 신경을 건든걸까요 ,신경외과
뒷목부터 머리 당김 코피,안녕하세요  어쩌다 가끔 한 달에 일주일 정도  뒷목부터 윗머리까지 가끔 땡땡 당길 때가 있는데 이게 꼭 자기 전에만 이래요   자세때문인거 같긴한데 이것 때문에 너무 불편해서 잠에 드는게 너무 힘들어요   그리고 이런 느낌이 들면 전체적으로 피가 안 통하는 기분이 들어서 더 잠이 안온다고 해야 되나  어제 아침엔 코피도 났더라고요 방금도 누웠는데 다시 압력 가해지면서 코피나고   어떻게 하면 좋을까요   진짜 너무 자고 싶은데    계속 당기고 불편해서 못자겠어요 한의원 가서 침만 맞아도 될까요,신경외과
허리방사통 시리고 시큰거림,방사통으로 시리고시큰거리고 아플땐 따뜻하게해주는게 좋지않나요   더위 많이타는체질이긴한데 한겨울에 방보일러는 틀어놨지만 시리고 아프다면서 반바지입고 다니는데 그럼 더 시리지않나요    ,신경외과
키우던 새한테 물리고  일 지났는데 마취주사맞은것처럼 저려요,키우던 새한테 검지손가락을 물렸어요 중형 앵무새라 조금 힘이 좋은 친구인데 금방 약 발랐고 지금  일 지났는데 상처 주변 부위가 저려요  어떤 느낌이냐면 치과에서 마취주사 맞고 저릿저릿한 느낌 들 때의 그런 감각이에요  잠시만 이러다 마는 걸까요 아니면 병원에 들러야할까요  들러야 한다면 어떤 병원에 가야할까요 ,신경외과
일자목 교정,오늘 신경외과 갔는데 일자목이 심하다 해서 도수치료 받고 왔습니다 엑스레이는 목이 일자라는 것만 나오는데 혹시 디스크는 아니겠죠       그리고 도수치료도 계속 다녀야 하는지 궁금합니다,신경외과
경추 신경주사 시술 관련 질문 드려요  ,안녕 하세요   근래에 목통증과 팔쪽이 불편해 재활의학과와 통증의학과에서 경추신경주사 시술을 받았습니다  궁금한점은 재활의학과에서는 목옆으로 주사 바늘을 넣어서 시술을 했고 처음 바늘 들어갈떄 따끔함 빼고는 큰 통증이 없었고 통증의학과에서는 목뒤에서 바늘을 넣어서 시술을 한것 같은데 주사 약을 주입할때 팔전체가  우리하고 타는듯한 통증이 왔어요   같은 신경주사 같은데 주입 방향이 틀리고 맞는 느낌도 너무 틀려서 어느 주사 방법이 좋은건지   효과가 더 큰건지 궁금 합니다  답변 부탁 드립니다  감사 합니다 ,신경외과
경추때문에 하체에 통증이 심한 경우도,경추때문에 하체에 통증이 심한 경우도 있나요   발바닥 장딴지  심지어 허리까지 경추때문에 아플 수 있나요 ,신경외과
소뇌출혈 질문드립니다,    년  월  년  개월 정도 지남    살의 나이로 뇌동정맥기형으로 소뇌에 출혈이 있었습니다  뇌척수액이 지나는 관을 출혈된 혈관에서 나온 피들이 막았고  연수에도 조금 영향을 주었다고 들었습니다   전조증상은 없었고 당시에 같이 있었던 형의 말로는 의식은 있었다고 합니다  보호자 핸드폰 번호와 제 핸드폰의 패턴도 제가 직접 풀었다고 합니다  그  이후 편마비  안면마비와 평행능력 장애  언어장애 를 가지게 되었습니다  다행히 출혈양은 적어서 일상생활 정도나 사무보조의 일정도는 수행할수 있습니다  그러나 후유증으로 안면마비  편마비는 겉으로 보기엔 회복 했으나 감각적 문제와 오른쪽과 비교 되게 수행 능력이 떨어집니다  언어장애도 속도를 줄여서 말하면 의사소통은 거의 다 되는 부분까지는 회복 했습니다  제일 문제가 되는 것은 걷는 것 입니다  평행장애를 가지고 있으니 걷거나 서 있을 때  자주 휘청 거립니다  그러다 보니 몸에 힘을 많이 주게되어 피로감을 다른 일반인 보다 많이 느끼는 편입니다       편마비중 감각적인 능력은 돌아 오기 힘든 부분이라고 알고있습니다  꾸준한 재활을 통해서 완전한 팔  다리 감각보다는 아니지만 진전이 가능 할까요      대구에 위치하고 있는 병원에서 한 교수님께만 진단받고  치료받았었는데 경과가 좋은편이라고는 하지만 후유증이 심하다고 생각합니다  보통 다른 뇌졸증 환자들도 저처럼 많은 후유증을 가지고 있나요     지금 현재도 내원을 해서 주기적으로 진료를 받고 있는 상태입니다   차적 혈관조영술은     년에 했고  올해  월  차 조영술을 예정하고 있는 상태입니다  완치 판정만이 남은 상태인데 병원을 바꾸는 판단은 어떤가요     보통의 뇌졸증 환자들은 출혈전 전조증상을 겪는다고 들었는데 저는 없었습니다  그게 가능한가요 ,신경외과
뇌진탕 기억상싷,친구가 스키를 타다가 뒤로 넘어져서 머리를 박은거 같은데 기절같은건 안하고 바로 일어나고 그때 얼굴이 빨간색이었습니다 그리고 그때 한  초정도 아무것도 안보였다고 그리고 내려가서 뭐 아침에 밥 먹은거랑 말해주면 한  분  뒤에 다시 물어보고 까먹고 물어보고 이러는데 심한건가요 ,신경외과
현관문 모서리에 왼쪽 이마 부딪히고 한  시간정도지나니까 왼쪽 눈쪽이 아파요,아까 나갈때 현관문 모서리에 왼쪽이마가 쾅 소리가 날만큼 좀 세게 부딪혔었는데 한   초정도  아팠었고 바로 통증 가라앉아가지고 괜찮아진줄 알았는데  시간정도 지나니까 왼쪽 이마에 부딪힌게 멍이 들고 왼쪽 눈이 아프더라구여 지금도 눈 감다 뜨면 오른쪽 눈은 괜찮고 왼쪽눈만 아픈데 시간 지나면 괜찮아질까요 ,신경외과
혈전으로 뇌경색 이후 뇌부종 약물치료,안녕하세요 아버지께서 혈전 때문에 뇌경색 발생하시고 바로 병원가서 약물치료 하면서 수술해야 하나 말아야 하나 하다가 약물치료가 잘 되어서 혈전은 없어진걸로 확인하고 수술을 안하고 경과 지켜보고있습니다 의식도 있으시고 대화도 어느정도 되고 팔다리도 잘 움직이신다고 하는데 뇌부종이 생기셨고 어제보다 오늘 좀 더 커져서 약물치료 하면서 경과 보고 필요하면 시술이나 수술을 해야할것 같다 하다가 다른 의사분이 보시더니 바로 좀 수술을 해야할 것 같다고 하네요 부종이 fluid가 나가는걸 막고 이대로면 뇌압이 계속 오를것 같다 하는데 인도에 계셔서 인도 의사랑 얘기하다보니 의사소통이 잘 안되네요 어떤걸 물어봐야 하는지 의학용어랑 좀 알려주실 수 있을까요  ,신경외과
이지은 허벅지 돌려깎기 고관절 통증,고관절  바깥쪽 골반이 너무 욱씬거려요 가만히 누워있는데도 욱씬욱씬 거리고 다리를 좀만 움직여도 너무 아파요 왜이러죠 ,신경외과
수두증 두통 질문드립니다 ,  년  월에 입대를 하고 군에서  월  월   월에 각각 화이자 백신        차를 맞았습니다   차 맞은 이후부터 두통이 잦게 있다가  차백신을 맞은 후부터  일간 머리가 붕뜬 느낌의 두통  머리가 조이는 듯한 두통이 계속 되다가  월  일   시   분에     도의 고열로 응급외진을 가서 머리 mri찍었더니 수두증이 발견되었습니다  오른쪽 뇌실에 뇌척수액이 찼다고하고 크기는     mm정도 입니다  국군수도병원과 아산병원에서는 열과 두통이 수두증과 관련이 없다고 하고 구토증상이랑 극심한 두통이 있을 경우 수술하면된다고 했습니다   차 백신 이후에 거의 매일 괜찮으면    일에 한번 두통이 계속 있습니다     정말 수두증이랑 매일 계속되는 두통이랑 관련이 없는지 궁금합니다     관련이 없다면 계속 되는 두통은 어떤검사를 해야하는지 궁금합니다   내일모레 훈련이라 채택은 다음주 주말쯤에 하겠습니다 ,신경외과
안녕하세요 귀 뒤쪽에 멍울이 생긴뒤로 뒷골이 찌릿찌릿하는데,멍울 생긴지는  주정도 되었습니다 최근들어서는 저멍울부분 뒷골이 찌릿하면서 타고올라와서 뒷골두통까지 오는데 신경과쪽으로 가야할까요 일반외과로가야할까요 ,신경외과
갑자기 사타구니 옆 통증이 심해요,갑자기 사타구니 왼쪽 통증이 심해졌어요  어떻게 해약하죠  자꾸 혈관뛰드시 근육이 움직이는것 갔고 움직이질 못하겠어요 아팠다 안아팠다 하는데 어떻게 해야하죠 선착순 채택이요 ,신경외과
좌골신경통,갑자기 몇일전부터 누워있을때 종아리랑 엉덩이이 알뭉친느낌나면서 뻐근하더니 어제갑자기 허리랑 오른쪽 다리 한쪽이 뻐근하고 좀 이상한느낌이들어서 병원갔더니 좌골신경통이거나 근육이 긴장해서 그런걸수도있다해서 물리치료 받고왔는데 나아지는것같다가 사타구니도 쓰라린데 혹시 복합부위통증증후군은 아니겠죠      건강염려증때문에 진짜 정신병 걸릴것같고 더아픈것같습니다 갑자기 좌골신경통이 생길수있나요 서있을때 허리아픈적은 많았고 아무런외상없이 좌골신경통이 발생할수있나요   그리고 물리치료랑 약물치료로 완치될수있나요    완치기간은 얼마나될까요 지금 증상은 사타구니쓰라림   누르면 멍든것같은 통증   다리에 힘이잘안들어가고 다른통증은 없습니다,신경외과
루게릭병에 걸리면 어디 병원에 가야되나요 ,루게릭병에 걸리면 어디 병원에 가야되나여   ,신경외과
속 더부룩 두통 수면마취 부작용,안녕하세요 제발 의사분들 답변해주세요           목요일에 수면마취로 위내시경을 했습니다 그것으로 십이지장궤양을 발견했습니다 하지만 집에돌아온후 오른쪽머리와 때로는 왼쪽부위도 저릿저릿하며 두통이 있습니다 또 내시경전에는 궤양이 있는걸 몰랐을 때는 소화도 아무이상 없었는데 하고난후 밥을 먹고난후 평소보다 더 허기진거같고 또 음식을먹으면 속이 더부룩해집니다 이거 왜이러는걸까요  제발 알려주세요                 ,신경외과
두통 증상 원인,머리가 두근두근 뛰는 거 같고 너무 아프고 침을 삼킬 때마다 목뼈가 움직이는거 같고 뛸때마다 목과 머리 사이가 너무 아파요 왜 그런 걸까요 그리고 뛸때마다 숨차면 맥박이 너무 잘 느껴져요  거북목이 있긴한데 거북목으로 인한 통증인가요 ,신경외과
뒷목 편두통,가만히 있으면 뒷통수가 두근두근 거리는느낌  이고 한곳을 보면 초점 맞추기 힘들어요 뒷통수에서 두근두근거려서   그리고 편두통은 아닌데 머리가 압이 차있는느낌  맑지가않고 탁한느낌이고 오른쪽 왼쪽 머리가 조금씩 찌릿하고 이명도 조금 있어요   커피술 안마시고 아직   살인데 왜그럴까요 ,신경외과
허벅지 앞쪽 불편,허벅지 불편  자기 전에 허벅지 앞쪽이 뭔가모르게 불편해서 계속 때리게 됩니다  약간 근육이 흐물    해진달까 뭐랄까 그냥 뭔가 통증으로 덮어줘야지 좀 안정이 되어서 주먹으로 세게  대 정도씩 때려주면 한  분정도는 괜찮아요  근데 또 그 통증이 사라지면 다시 불편해서 다시 때려주구요   잘 때마다 이러는데 아주 어릴적부터 그랬어요  이건 왜 그런건가요     저러다가 잠듭니다 ,신경외과
뒷목 뻐근 어지러움,제가 고 때부터 이런 거 같은데 무언가 집중할때 주로 학원 수업을 듣거나 공부할 때 뒷목이 뻐근하면서 토할거 같아요  생각해보니깐 항상 앉아 있을 때 이래요  어지럽다기 보단 멀미   토할 거 같다고 해야 하나  구래요    첨엔 제가 공부를 하기 싫어서 그런가 보다 했는데 좋아하는 공부할때도 그래서 이건 또 아닌 거 같고 뒷목이 뻐근하면서 멀미 나는 느낌이 날 때 고개를 뒤로 젖혀서 돌리거든요  그럼 뒷목에 소리 나는데  할 때는 또 나아지면서 시원한데 시간이 지나면 거의 바로 또 다시 토할거 같아요  더 심해지기도 해요    습관적으로 이럴 때마다 뒷못을 주무르는데   이게 뭔가 집중 해야 할 때 너무 방해가 돼서 왜 이런 걸까요 ,신경외과
오른쪽 턱 통증,월요일 밤부터 오른쪽 턱 통증이 시작됐습니다    귀 밑 광대부터 턱까지 아프면서 이빨도 아픈 것 같습니다  자고 일어나선 안아픈데 한 오후가 되면 아파지기 시작합니다      턱이 아프면서 이빨도 아픈데 턱이 문제인가요 아님 이빨이 문제인건가요     턱에서 원래 딱딱 소리가 딱딱하고 질긴 음식을 먹을 때 났었는데 턱관절장애인가요     턱관절장애는 일어났을 때 입이 벌어지지 않고 아프다했는데 전 일어났을 땐 전혀 아프지 않습니다  오후가 되면 점점 아파지는데 턱관절장애가 맞을까요     대학병원에 가서 검사를 받을 예정인데 혹시 치료를 해야 한다면 어떤 치료를 받게 될까요  신경치료나 수술까진 가지 않겠죠         입을 다물었을 때 오른쪽 위아래 치아가 닿는 느낌이랑 왼쪽이랑 다릅니다  오른쪽 치아가 좀 더 많이  빨리  닿는 느낌이 들어요  뭔가 턱이 삐뚤어진건지 이빨이 내려온건지 모르겠어요  이것도 턱관절장애의 증상인가요        턱 통증에서 약한 두통까지 나타나는데 심각한 수준인가요   정성스럽게 답변 부탁드립니다   ,신경외과
어깨 조영제 많이 아픈가요 ,월요일에 어깨에 조영제를 맞고 MRI를 찍는데요 주사 공포증이 있어서      그냥 혈관주사 조영제면 헌혈과 비슷한 느낌이라고 해서 그나마라도 괜찮을거같은데 국소마취 후에 어깨쪽 관절강내주사 로 조영제를 직접 주입한다고 합니다   공포증때문에 뼈주사도 맞다가 혼절할뻔했는데    어깨 관절조영술 주사 많이 아플까요          평균적으로 엄청나게 아프다고하면 공포증때문에 신경마취같은거 가능한지 여쭤보려고합니다  ,신경외과
헌혈 후 통증, 일 전 헌혈을 하였는데 이 때까진 없었던 통증이 있습니다 당시 헌혈을 할 때도 전에 했던 것 보다 바늘이 아픈 기분이었습니다  일상생활을 하는데 크게 지장이 있는 지속적인 통증은 아니지만  헌혈 부위를 지그시 눌렀을 때 부위 위  아래를 눌렀을 때는 통증이 없습니다  아래팔 부분 팔꿈치에서 손목 사이 안쪽팔 이 혈관을 따라 찌릿하고 쑤시는 통증이 있습니다   시간이 지나면 낫는 것인지 따로 병원을 찾아야 하는 지 궁금합니다,신경외과
병원 퇴원문의,교통사고로 다리골절 및 사람이 서있을때 중심을 잡아주는 신경이 손상되었다고 처음에는  주정도 입원을 해야한다고 안내를 받았습니다 그런데 수술을 받고 다음날 갑자기 수술경과가 좋으니 퇴원을해서 통원치료를 하란식으로 안내를 받았습니다  현재 다리는 부어있는 상태로 무통주사를 없이는 통증이있어 잠을 자지못하고 있어 의사에게 이런상태와 혼자서 돌아다니기 힘든 상태인걸 말해도 그냥 수술경과가 좋아서 퇴원하란 식으로말하는데 퇴원해도 되는건가요  ,신경외과
뇌종양인지  귀 안쪽이 문제인지  살려주세요    ,한  개월정도 증상이있는데 얼굴전체가  특히 뇌 쪽이 자꾸 약간씩   시간 내내 흔들리는 느낌이에요빙빙도는듯한 느낌도 있는데 뇌종양일까요  저는 다른분처럼 시야가 안보인다던지 두통이 있다던지 잠에서 깬다던지 어디가 전혀 이상한데도없고 두통도  도없는데 단순히 뇌쪽이 흔들거리고 빙빙도는듯한 느낌으로만 뇌종양 일수있나요  병원가보니까 이석증도 아니라고 하고 메니에르 약도먹어봤지만 소용없었습니다  조금더 구체적으로는 얼굴 부위를 흔들거나 뇌에 약간의 충격을 주면 아주짧은 시간   초  초  정도 흔들림이 멈춤니다  그리고 또 걷거나  다른일을 하고있을때는 증상이 살짝없어지는데  잠을 자기위해 눕거나 가만히있을때는 계속 뇌쪽이 빙빙돌거나 흔들려서 구역질을 하루에  번정도합니다   제가 두통이있거나  뇌안에서 어지러움을 느끼는게아니라  단순이 뇌쪽이 물리적으로 흔들리는 느낌을 받습니다  도와주십쇼  ,신경외과
허리 통증,제가 주말마다  시간씩 서서 일하는데 처음에는 습관이 안되서 아픈 줄 알았는데 일하고 집에 올때 허리를 숙이면 소리 지를 정도로 통증이 있을정도고 숙이도 못하고를 반복하다가 오늘은 등위까지 아픈건데 이거 디스트로 이어지는 건가요  누우고 일어날때 담 걸린 거 처럼 찌릿하게 너무 아파요,신경외과
치골 통증  고관절 통증,일주일 정도 전부터 갑자기 고관절 쪽이 아팠어요  헬스장에서 가끔 하체 운동 스미스머신 스쿼트 레그프레스 등  을 해주긴 했는데 고강도로 하지도 않았는데 갑자기 아프기 시작하더라고요  처음엔 앞쪽 고관절만 아프다가 이제는 대전자 쪽 허리 뒤도 아프고 음부 뼈라고 해야될까요 치골  그림에 빨간 점으로 표시해둔 곳이 아파요   이건 부인과 별개 문젤까요  하혈이나 분비물이 많이 나온다거나 그런 증상은 없었습니다  그냥 평소에 다리 자세가 안좋은 편이에요  최근 들어 갑자기 아프기 시작했고요,신경외과
이비인후과 이석증 치료비,얼마전 어머니께서 머리가 어지러워 이비인후과에  내원하셔서 진료받으시고  진료결과는 이석증이라고 판명나고  다음날 검사와치료 하신다길래 다음닐 내원하여 검사와치료 하셨는대 검사와 치료황목이    비디오 안진검사   분   두부충동검사   분   자율신경검사   분   순응청력검사 어음분별검사   분 합  시간  분 걸리였는대 검사와 치료비가 첫날 진료비      원  일째        원 나왔는대 왜이리 비싼지 모르겠내요 병원측에 물어보니 비급여항목이 있다고 하던대 어느 항목이 비급여 인지요 그리고 황당한건  치료받고나서   어지러움증더 더 심하다는 것이 이해가 안가요 다음주 또 여약  잡아놓았는대 치료비도 문재지만  치료후 더 악화되어서 문재입니다 병원을 다른곳으로 가야되는지도 궁금하고요 혹시 이석 치료히신분  저히어머니처럼 검사치료황목 받으신분들중에 치료비가 이정도 나오는지 모르겠네요  겸험하신분 답변주시면 고맙게습니다    ,신경외과
무릎 증상,십자인대 파열 증상 일주일 정도 지나면 통증이 없어지나요 ,신경외과
오른쪽 허리가 찌릿찌릿 아픈데요,일주일전부터  오른쪽 허리쪽  엉덩이가 찌릿찌릿 아프더니  오른쪽종아리도 알베긴거마냥  아프고 그런데   왜그런가요     전반적으로 오른쪽이 아프네요 ,신경외과
오른쪽 갈비뼈 아래 통증,  살 입니다 평소엔 안그러더니 어느날 소주  잔 정도 마시고 누웠더니 오른쪽 아래 갈비뼈 부분에 실짝 통증이 있습니다 원인과 해결책을 알고싶습니다,신경외과
두통  눈 부음,요즘들어 거의 매일 두통에 시달리고 있습니다  코로나로 밖에 나가지 않아 집에서 거의 자거나 아님 티비  핸드폰을 하는데  시력이 점점 더 나빠지고 있다는 것이 느껴집니다   지금도 시력이 마이너스라 안경을 착용하고 있습니다  두통이 처음에는 뒷통수부터 골이 흔들리는 것처럼 아팠는데 걸을때마다 골이 흔들리고 웃을 때도 흔들리는 걸 느낍니다  좀 누워있으면 괜찮아지겠지 했는데 나아지지 않고 점점 이마쪽부터 눈으로 두통이 퍼지더라구요  그리고 눈 자체가 부러오르는 느낌이 들면서 눈이 크게 떠지지 않아 졸린 사람처럼 반 감긴 눈으로 있습니다  두통부터 사작해서 눈까지 아프니까 너무 힘들더라구요  잠도 오지 않고   그래서 수면 유도제도 먹고 두통약도 먹었는데 나아지는 것 같지도 않거  그리고 요즘 불빛만 보면 눈이 자꾸 부셔서    아파서  집에서도 불을 끄고 있는 편입니다   티비나 폰 볼때는 무드등이라도 키고 있어 어두운 곳에서 하진 않습니다  근데 동생이 불을 킬때마다 또 머리가 아파지고 신경이 날카로워지더라구요      요즘 맨날 이 증상을 겪고 있는데 이건 안과를 가서 눈 검사를 받아야 할까요      아님 신경외가를 가서 두통이 심하다고 진료를 받아야할까요   두통은 약국에서 약만 타서 먹어서 병원에 가는 것이처음이라 잘 모르깄네요     검사 같은 거 하면 진료비가 많이 나오는 건 아니죠      아님 사람들 모두 두통을 달고 사는 것 같은데 그냥 약만 먹고 괜찮아지길 기다리는 것이 좋을까요    채택    내공     그런거 잘 몰라서 점수가 낫다고 들었는데 네이버에 쳐보고 도움 주신 분께 꼭 해드리겠습니다,신경외과
피부에 뭔가 눌린듯한  느낌,안녕하세요   주 전부터 피부 인중 부분에 뭔가 눌린듯한  앉아있는 느낌이 듭니다  아프거나 하진 않고 피부에서 인중 약  cm 둘레  부분만 그런 느낌이 들어요 아주 미세하게 그런 느낌이 드는데  문제는 그 미세한 느낌이 너무 신경쓰이고 불편해서 검사를 받아보고 싶은데요   원인 찾을 수 있는 방법이 어떤게 있는지 궁금합니다 외적으로 보기엔 주변 피부와 다를게 없어 보이긴 합니다  ,신경외과
