0,1,2
뇌전증이 재발했습니다,중 일 때 간질로 쓰러졌다가  정기적으로 병원을 다니기도 하고 약을 매일 복용하면서 작년까지 괜찮았습니다  지금 나이가   인데 작년 말에   년만에 간질로 쓰러졌습니다  직업은 집에서 컴퓨터로 일하는데요  평균 수면시간은    시간입니다  당시에 사소한 일로도 어머니가 화내시고 그러셔서 스트레스가 꽤 쌓였습니다  간질로 쓰러질 때도 어머니가 전화로 저를 혼내시다가 쓰러졌습니다  이게 원인일까요  그리고 정기적으로 가는 병원이  월달로 예약이 되어있었으나  간질을 일으킨 탓에  월달로 잡았습니다  작년 말에 한번 하고 지금까지 간질은 없었구요  코로나 시국이기도 하고  집이 인천인데 가야하는 병원은 서울대병원입니다  간질로 쓰러진 거 때문에  월달에 꼭 가야 할까요  아니면  월 달에 가도 될까요 ,신경외과
발등 답답함,마치 뭔가 발등에 핏줄을 누가 누르고 있는것처럼 발등이 답답한데요  아프진않고 좀쑤시는것처럼 너무 신경쓰입니다  왜 그런걸까요    이것때문에 신경쓰여서 잠잘때 불편합니다 ,신경외과
허리통증 전문과,안녕하세요 최근들어 허리가 시큼시큼거리는데 어느 과가 맞는지요  정형외과  신경외과  통증의학과 비슷비슷해서 횃갈리네요 ,신경외과
복합적통증, 주전부터 코막힘이 일어나서 병원가서 항생제 먹었는데 효과가 없어 지금까지 양쪽이 코막힘이 번갈아가면서 심해지는 것 같습니다 특히 잘때가 별별 생각이 들만큼 너무 힘듭니다 목 뻐근함과 어깨 결림도 너무 심한 것 같아요 또 하나 몸에서 뚜둑소리가 계속 납니다 정자세로는 못자고 옆으로 자면 팔이 힘이 빠지고 혈액순환이 안되는 것 같습니다 병원에서는 단순코막힘으로 보아서 약을 먹는데 나아지지 않습니다 저는 일상생활이 정말 힘듭니다 아직   대밖에 안됬는데 왜 그럴까요    지금 새벽에 글을 올리는 것도 코막힘과 어깨결림으로 너무 힘든 하루를 보내고 있습니다 원인을 몰라 매일 울고요 정말 긴글 읽어주셔서 감사하고 도와주세요  ,신경외과
뉴로스캡슐 발저림에도 효과가 있나요 ,최근 디스크 때문에 종아리 통증과 발 저림 증상이 있어서 치료 중인데 오늘 뉴로스 라는 신경통 약이 추가 됐습니다 제가 통증은 심하지 않는데 발이 저리면서 감각이 좀 둔한 상태입니다 이런 경우에도 뉴로스 효과가 있는건가요  한번 먹어서 그런건지    아직까지 별다른 효과가 없는것 같아서요,신경외과
뇌졸중 이력 환자 코로나 확진시 대처 어떻게 하나요 ,   중반에 뇌졸중을 잠시 앓고 현재 혈액 항응고제를 먹고있는   대 후반의 남자입니다  뇌졸중 환자의 경우 코로나가 특히 더 치명적일 수 있다는 말을 들었습니다  만일 코로나나 오미크론에 감염될 경우 그냥 일반적인 치료 방법을 따르면 되나요  아니면 제가 뇌졸중 이력이 있음을 적극적으로 알리고 따로 조치를 취해야 하나요 ,신경외과
뇌출혈 증상 인가요 ,월요일날 출장을 다니면서 목을 들어 한가지 동작을 했는데 그때 순간적으로 뒷머리 속에서 쥐가 심하게 놨다가 사라졌습니다  그날 저녁부터 오른쪽 머리 앞쪽에 쥐가 저림  나는거 같아 신경이 쓰여서 잠을 설치고 있었는데 집에 남아있던 신경안정제 처방 받은게 있어서 그걸 먹으니 좀 괜찮아져서 잠을 잤습니다  다음날도 같은 증상이 보이며 순간적인 두퉁이 있어 병원을 두군데 갔더니 목 근육이 문제가 있어서 머리가 저릴수도 있다면서 근육 이완제를 처방해 주셨습니다  한 병원애서는 목 액스레이를 찍어보았더니 목이 거의 일자로 되어 있다고 하더라고요     약을  틀먹고 목마사지를 하니 처음보단 느낌은 덜 한거 같은데 가만히 있거나 하면 오른쪽 앞쪽 머리에 순간적인 통증과 쥐가 나는거 같은 느낌이 듭니다    증상을 보인지는  일정도되었고요   머리가 쥐 저림  순간 통증과 함께 이마쪽이 쪼이는  증상이 나타나네요  심한통증  어지러움  마비  언어장애  등등 그런 증상은 없습니다  단지 오른쪽머리 앞쪽이 쪼이는 느낌과 쥐 가는 느낌만 납니다  혹시 뇌출혈이나 지주막하출형은 아니겠죠 ,신경외과
인공관절수수에 관해서,안녕하십니까  금년  세의 남성입니다      년 월 일 기상하니 우측어께에 통증이 심해서 종합병원 정형외과에 진료 X RAY  MRI 를 받고  담당의사가 인공관절로 수술을 받아야 하니 입원해서 수술해야한다고 하여서 입원수속을 거치고 귀가하여 다음날 기상해서 입원준비를 하려했는데 팔의 통증이 없어서 팔을 좌우  상하     도 회전을 해도 평상시처럼 아무런 통증 없이 생활 할 수 있어서 담당의를 찾아가서 의사가 보는 현장에서 팔을    도 회전하면서 아무런 이상이 없는데 어떻게 합니까  라며 이의를 제기하자 약물처방만하고 입원절차를 취소하고  일상생활을 잘해 왔습니다  그러다가     년 월  일 아침 기상시 통증이 있어서  병원진료 토요일 가 없어서 동내 통증신경외과에서 초음파  X RAY 검사후 정형외과 전문의에게 진료를 받을 것을 권고하기에 통증완화 주사를 맞고 귀가했고  월   일 종전에 진료받던 정형외과에 진료를 받으니 약물 처방만해주는데 이런 상태로 삶을 유지해도 되는지요   ,신경외과
백신  차접종 후 부작용,맞은지  달된것같은데 팔이 게속 저리고 아픕니다   잠자다가 아파서 깨는것같아요 팔을 들어올리면 너무 아파요 어떡해야할까요   지방이라서 어떤 병원을 가도 똑같은 이야기만 해서 구체적으로 어떻게 검사를 하고 치료를 해야될까요,신경외과
한 번씩 피곤하거나 하면,한 번씩 피곤하거나 스트레스받으면 턱아래가 욱씬 할 때도 있고 고막이 욱씬욱씬 아플 때도 있는데 갑자기 궁금해서 질문합니다   무슨 병이나 그런건 아니겠져    ,신경외과
근육떨림 근위축 증상 치료법,제가 헬스시작하고부터 근육경련이랑 근위축이 일어났습니다 운동을 하고근육을 사용할수록 근육이 늘긴늘으는데 계속 줄어들더라구요 그러다 발음도뭉개지고 근육이 통통튀고 핸드폰이 무겁게느껴지고 휴대폰 드는것도 무겁더라구요 여러 증상이 나타나다  주정도 운동을 쉬고 근육을 쉬게해주니 몸이 정상으로 돌아오는데 근육이 덜덜떨리는 경련은  년째 지속되네요 전 헬스를해서 근육을 키우고싶고   대입니다 중증근무력증이 의심되는데 치료법이나 뭐 어떻게해야될까요  운동으로 근육을 키우고싶은데 어떻게해야될까요 ,신경외과
피부에 뭔가 눌린듯한  느낌,안녕하세요   주 전부터 피부 인중 부분에 뭔가 눌린듯한  앉아있는 느낌이 듭니다  아프거나 하진 않고 피부에서 인중 약  cm 둘레  부분만 그런 느낌이 들어요 아주 미세하게 그런 느낌이 드는데  문제는 그 미세한 느낌이 너무 신경쓰이고 불편해서 검사를 받아보고 싶은데요   원인 찾을 수 있는 방법이 어떤게 있는지 궁금합니다 외적으로 보기엔 주변 피부와 다를게 없어 보이긴 합니다  ,신경외과
얼굴 뼈 붓기,오른쪽 얼굴 광대뼈와 귀 사이가 왼쪽 얼굴에 비해 돌출되어있어 손바닥으로 강하게  수차례 눌렀습니다  목 힘으로 버티기 힘들어 왼손으로 받치고 있을만큼 강하게 눌렀습니다     누를때마다 눌리는 느낌이 나고 왼쪽얼굴도 움찔움찔하면서 튀어나오는데  뼈가 원래 이렇게 움직이나요     오늘 일어나서 보니 부어있습니다  복구가 될까요  안되는 최악의 경우는 어떤경우일까요  통증은 미약하게 욱신욱신 정도입니다 ,신경외과
종아리에 힘을 줘서 근육이 나오게 최대한 하면 금방 풀리려고 하면서 다발로 움직이는데 좀 봐주세요, 주 전부터 몸에 힘이 풀리고 다리 힘 빠짐이 심하고 힘을 주려고 해도 자극을 못 주는 느낌을 받아서 근전도 검사를 종합병원에서 검사 날짜 잡고 기다리는 중입니다  당분간 운동도 안하고 가만히 있는데 갑자기 왼쪽 갈비가 숨을 들이 쉴 때 마다 아파서 혈압도 높고 너무 안 움직여서 그런가 보고 힘도 안 들어오는데 최대한 거실을 왔다갔다 잠시 걷고 나서 다리가 더 뭉뚱한 느낌이 들고 발가락 말고 더 힘주기가 어려워지는거 같아서 종아리 근육을 힘을 억지로 줘서 최대한 튀어 나오게 하는데 그 상태로 유지는 계속 되었던게 순간 금방 풀려서 힘을 주고 있는데도 가라앉고 동영상처럼 조금 더 시간이 지나 힘을 주니 계속 힘을 주려고 하는데 다발처럼 근육이 움직이면서 가라앉는게 보입니다  이거 어떤 문제가 있는건가요  걱정됩니다    Loading                  화질 선택 옵션,신경외과
청주 한의원,아빠가 결핵약 부작용으로 발이랑 손에 통증이 있으신데요 증상만으로봐서는 말초신경염인거같고 지금은 그 약을 다른 약으로 대체했고 다른결핵약들이랑 진통제만 복용중이세요 발감각도 없고 남의살같다 라고 자주 말하시고 걷는것도 힘들어하셔서 집밖으로 못나간지  개월이넘으셨어요 청주 충대병원 신경외과에서 근전도검사 했었고 이상없다는 진단받앗으며 그이후에 더 심해지시는 중입니다 완화방법이나 신경외과나 한의원 추천좀해주세요,신경외과
할머니께서 연세가 좀 있으신데 자꾸 저 검은 선으로 표시해놓은 부분이 아프시대요  근데 아무리 검색해봐도 저런 부분을 딱 명칭할 통증을 못 찾겠,할머니께서 연세가 좀 있으신데 자꾸 저 검은 선으로 표시해놓은 부분이 아프시대요  근데 아무리 검색해봐도 저런 부분을 딱 명칭할 통증을 못 찾겠어서 긴장성두통인가 싶은데 이마 전체는 안 아프신 것 같아서요  어떤 원인으로 인해서 저 부분에 통증이 생기는 걸까요 ,신경외과
현역 복무중인 디스크 환자입니다 도움 절실합니다 ,안녕하십니까  현재 현역으로 복무중인   세 남성 추간판 탈출증 환자입니다  판정은 훈련소 기간중 지구병원에서 ct 결과로  현 자대배치 이후국군병원에서 mri 검사를 통해 알게 되었습니다  mri검사 결과로는 추간판이  곳이 돌출되어있고 하나는 초기  다른 하나는 신경을 누르고 있다고 하셨습니다  우선은 물리치료부터 받아보자 하셨지만  보직이 취사병인지라 스케쥴때문에  주째 물리치료를 진행하고있지 못하고 있고  그때보다 더 아파진것 같습니다  최근에는 허리가 자주 쑤시고 다리저림이 더 잦고  심해져서 숨이 턱 막히는 느낌입니다  군대와서 몸은 자기가 지키는 것이라 했지만 아직 입대하고 전입한지 얼마 되지않아 무얼 어떻게 해야 할지 모르겠습니다  디스크 환자가 잘못되면 하반신 마비까지 올 수 있다하니까 더 두렵습니다  지금 이상태로 현역 복무가 가능한지  불가능하다면 어떤조취를 취해야 할지 알고싶습니다 ,신경외과
팔에 힘주면 떨리는데 이거 병인가요 ,옛날부터 팔에 힘을 주면 떨리길래 그냥 다른사람들도 당여히 힘주면 다 떨리는줄 알았는데 살다보니까 그냥 제가 이상한거더라구요 근데 이걸 치료   하고싶은데 이게 병이에요  무슨 병이죠  힘을 엄청 쎄게 쥔것도 아닌데 팔에 힘주면 손이 떨려요,신경외과
살가죽이 편두통처럼 찌릿찌릿한 이유,가끔씩 살가죽이 편두통처럼 찌릿찌릿  시큰시큰  지끈  합니다 하루정도 지나면 괜찮아지구여  손가락 또는 손바닥 살 또는 팔꿈치 가죽 지금은 겨드랑이 뒤쪽 살가죽이 불규칙적으로 찌릿찌릿해요 아파서 낮잠자다 일어났어요     시리는 부분에 입으로 후 불면 아프기도하구요 이유가 뭘까요  초딩때부터 그랬어요,신경외과
멍때문에 아픈건지  ,요번주 월요일날 넘어져서 왼쪽 엉덩이가 심하게 멍이 들었어요    지금  일째 됐는데 완전 어둡고심해요    살짝 보라색 멍도 보이고   멍이 빠질 생각을 안하네요    누워 있으면서 왼쪽 엉덩이 안눌리게 누워 있는데 시리기도 하고 통증이 있는데 뼈에 이상이 있는걸 까요   근데 뼈에 이상 있다면 잘 못걷지 않을 까요    ,신경외과
백신 손목 저림,제가 화이자 백신 맞고 한달 넘게 미열이         정도 나서 병원을 갔다왔다는데 병원에서는 피검사 할 정도로 문제되는게 없다고 약 먹으면서 지켜보라했어요  근데 오늘은 갑자기 왼쪽 손목이 찌릿찌릿 한 느낌이 드면서 저려요  손목 저린것도 부작용인가요 ,신경외과
발가락 찌릿,한 이 주 전에 뒤꿈치를 들다가 삔건지 갑자기 오른쪽 발목이 찌릿찌릿 아프기 시작했는데 한    일 정도 지나니까 괜찮아지더라구요  그러고는 갑자기 왼쪽 발을 포인 발을 꺾어서 종아리부터 일자로 만들기  하려고 하면 발목부터 둘째발가락이 찌릿하고 특히 둘째 발가락이 좀 많이 아파졌어요  지금 위장장애 같은게 있어서 항생제 같은 거 먹으면 속이 많이 쓰리고 안좋던데 그래도 신경외과를 가보는게 맞을까용       뭐땜에 아픈건지 혹시 아시는 분    ,신경외과
이것도 병인가요,제가 무슨 조그만 일에 집중하다가   초 이상으로 그 일이 안돼면 심장이 진짜 이상하게 너무 두근두근 정말  초에 한   번정도 꼴로 그러고 토할거 같고 그래요 조그만 일이라는 건 진짜 웃길 수 있지만 뭐 딱지 때는 일이나 강아지 눈꼽 때주기 뭐 바늘에 실 끼워넣기 등등 이런 일을 하다가 몇초가 지나면 진짜 이상해져요 이 느낌이 너무 싫고 이상한데 이것도 문제가 있는 건가요 ,신경외과
왼쪽 배가 아파요 한달에    번 정도 통증이오고 가끔 헛구역질이 납니다 누우면 통증이 사라지고요 무슨 문제일까요 ,왼쪽 배가 아파요 한달에    번 정도 통증이오고 가끔 헛구역질이 납니다 누우면 통증이 사라지고요 무슨 문제일까요 ,신경외과
팔꿈치 통증,샌드백을 치다가 팔꿈치로 잘못 때렸거든요 근데 팔꿈치를 접었다 폈다 하면 약간 전기 오듯이 저려요 근데 가만히 있을때는 안 아프고 꼭 접었다 펴다하면 아파요 팔꿈치에 있는 근육이 놀란건가요 ,신경외과
양쪽 아래턱 통증 코 통증 어디 병원 가야하나요 ,양쪽 턱 통증 있고요 코 통증도 있어요 최근에 부비동염있었는데 다 나앗어요 그림 처럼 저기가 아파요 다친적 없어요,신경외과
편두통인데 뇌종양인가요 ,편두통이 있습니다  달전 부터 아팠어요 뇌종양 아닐까요 ,신경외과
기침할때 두통,한 일전 갑자기 목오른쪽앞부분이 조금 부어오르더니 기침을 할때마다 정말 머리가 깨질듯이 두통이 심합니다  지금은 목부분은 거의다 가라 앉었는데 현재도 여전히 기침할때 머리가 깨질려고 하는 건 심하네요 아니 오히려 더 심하게 아프네요 무슨 문제가 있을까요  기침이 나오려고하면 무서울정도네요 코로나검사는 바로 해 봤는데 다행히 음성입니다  번 정말 기침을 하면 머리를 막 때리고 싶을정도로 두통이 심합니다  열은 하나도 없고 감기증상도 하나도 없습니다 몸에 어디가 심하게 안좋은걸까요    무섭습니다    ,신경외과
목디스크 수술,살짝손에 마비가왔는데 수술 안할수도있나요  수술하면 몇일 병원에 있어야되요 ,신경외과
의사선생님들 도와주세요   급해요  ,엄마가 뇌동맥류 진단 받고부터 가끔씩 머리가 아프다고 하세요 저번에는 갑자기 머리 아파서 밥 먹다가 옆으로 누우셨고 요즘도 갑자기 머리가 아프다고 뒷쪽 머리가 아프대요 엄마 진짜 오래 사셨으면 좋겠는데 왜 머리가 아픈걸까요   수술이나 시술은 받지 않으셨습니다 엄마 진짜 저희 옆에 오래오래 사셨으면 좋겠어요 엄마 없는 삶은 생각할 수 없는데 진짜 제발 도와주세요,신경외과
딸아이 머리뼈골절이고 미세출혈도 있다합니다 ,하노이에 비행기를 타고 공항에 도착했습니다  딸아이    가 하루종일 피곤해서인지 어지러움에 정신을 잃으며 뒤로 쓰러지면서 대리석바닥에 뒷머리를 심하게 부딪혔습니다  그날은 격리호텔로 돌아와 밥도 못먹고 토를하고 잠들었습니다  다음날에도 머리통증과 울렁거림으로  번더 토를하고 안되겠다 싶어서 병원에 갔습니다   CT를 찍었는데 뒷머리에 작은금이 생겼으며 미세출혈도 있다합니다  하지만 신경외과 전문의가 아니라 앞으로 어떻게 치료할지는 전문의를 만나서 얘기해야 한다네요   금이  mm   mm   mm라고하며 작은 금이라하고 미세출혈이있다합니다  당장 격리중이라 또 내일은 토요일이라 전문의를 만날방법이 없네요  월요일에는 다낭으로 비행기를 타야하는데 전문의가 보고 확인을 받으라 합니다   하노이라 잘 알지도 못하고 지금은 잠들었는데 병원에서 준 진통제와 해열제를 먹고 잠들었네요  몸이 약해서 이래저래 걱정입니다    제일궁금한건 이럴경우 약  시간  분 비행이 어려울까요  정확한 CT사진을 못올려서 답변하시기 힘드시겠지만 앞머리가 가끔지끈거리고 울렁거림 이거는 머리의 금이발생해서 그렇다네요 이 계속 있는데 지금은 많이 없어졌나봅니다   이런경우 치료는 어떤식으로 하는지요  그리고 비행기는 탈수 있을까요  일반적인 답변을 부탁드립니다  정확한 영상이 없기에 답변하시기 어렵겠지만 지금은 여기답변만 보고 있습니다  부탁드리고 다른 궁금한사항 있으시면 적어주시면 다시 말씀드리겠습니다 ,신경외과
발에 감각이 둔해졌어요,한쪽발이 감각이 둔해졌어요 완전히 다 그런건아니고 발등쪽인데요 딱 쥐났을때처럼 겉을 비비면 속이 좀 아픈   땡땡한 느낌이고 감각이 진짜 마취했을때처럼 느껴져요    뭘까요  몇일 됐는데,신경외과
아킬레스건 통증,아킬레스건을 손가락으로 튕기듯이 위 아래로 움직이면서 아킬레스건을 건들면 아킬레스건이 아픈데 원래 이런식으로 건드리면 아픈가요  양쪽 발목 둘다 그렇습니다 그리고 발목을 돌리면 늘 뚜둑 거리는 소리도 나요  조금 아프기도 하고요 이건 왜 그런가요  이것도 양쪽 발목 둘 다 소리가 납니다,신경외과
목 아픔 코로나 증상인지 아닌지 모르겠어요,어제 밤부터 시작한 통증이 지금 좀 심해져서 너무 걱정이 됩니다  열이 난 적은 없고 콧물이나 다른 증상은 아무 것도 없는데 오직 목이 진짜 아파요  혹시나해서 침도 계속 삼켜보는데 보통 목감기에 걸리면 침 삼킬 때 따끔따금한 것도 없었고 진짜 목이 타는 듯이 아파요  목 중앙  살짝 밑에가 불에 타듯이 아픈데 왜 이런거죠  전에도 비슷한 통증을 느낀 적이 있는데 둘의 공통점이 늦게 자고 일찍 일어난 날에 아픈 것 이에요  그때 자가진단 키트로 검사한 후 음성이 나왔는데 혹시 피곤할 때 목이 붓기도 하나요 ,신경외과
내공    유능한 의사님들 도와주세요  발등 문에 찍히고나서 종아리통증,자다가 깼는데 어제 저녁에 방화문처럼 두꺼운 문 모서리에 발등이 살짝 찍혔거든요  엄지발가락 윗부분 엄지발가락아님    대수롭지않게 넘어갔는데 시간 조금 흐르고 종아리 뒷부분이 아프더니 지금 자다깼는데 허벅지 뒷부분까지 아픈거 같아요 이삿짐 옮기고 그래서 안그래도 발이 좀 피로했는데 왼쪽만 유독 이러니 찍힌거때문에 그런거같고     종아리 뒷부분은 오른쪽에 비해 부운거같기도한데 이건 기분탓일수도있고     단순 타박상일 가능성이 높나요  아니면 병원 가보는게 좋을거같나요       어디를 눌러보고나서 통증이 심하면 병원가보셔야겠다 이런 팁 있으시면 알려주세요     명칭만 알려주시면 검색은 제가 해볼게요    아직 왼쪽 발등은 누를때 통증이 있어요   시간도 안됐어요 걸을 때 아프진않아요 근데 왼쪽 다리만 전체적으로 뻐근  쿡쿡 찌르는느낌 은 있어요,신경외과
손가락 지문쪽 울퉁불퉁 통증,모든 손가락 지문있는 쪽이 따가워요 왜 이런 거에요  ,신경외과
감정은 어케 만들어지나요,민망하거나 화난 감정은 어떻게 만들어지죠 왜 물리적으로도 감정이 느껴지는 것 같죠 피부가 짜릿하고 뜨거워지고 그런데,신경외과
머리 제대로 안걸리면 피부염같은게 걸릴 수 있나요 ,최근에 머리를 잘 안감았는데  장기간 몇개월     주에 한두번 머리 감았습니다   사정상    두피 일부지역만 누르면 조금 통증이 느껴지네요 탈모는 아닌거같은데 깨끗하게 다시 씻으면 개선되는지 궁금합니다   머리 뒤통수 부분    원만한 공간이 아프고 누르면 약간 긴장됩니다 ,신경외과
제가 신경염 같은데요    ,사진에 보듯이 빨간색 동그라미 친부분이 아프고 약간 저릿한 느낌들다가 사라지고 하거든요 이틀전에는 네번째 손가락이 아팠다가 소염제 먹으니깐 손가락은 안아프더라구요 그래서 지금 소염제 먹구있는데  저기에 온찜질해두되나요   그리고 파스 붙이면 효과가 있나요   ,신경외과
과거의 일을 꿈처럼 기억,오늘 어머니가 잠에서 깨서 느낌이 이상하다고 하십니다  당장 어제의 일도 어렴풋이 꿈처럼 기억난다 하시고 몇 일 전의 일은 기억도 못하십니다  몇 년 전 이런일이 있어서 뇌 MRI도 찍어 보았으나 이상은 없다고 했습니다  그 당시에 병원에서 수액맞고 자고 일어나셔서는 괜찮아 지셨는데 오늘 또 이렇게 기억을 못하시니 너무 걱정이 되네요  무슨 문제라도 있는걸까요  어떤 검사를 해봐야 할까요 ,신경외과
손가락 통증,지난달에 검지손가락이 고리에 걸려 꺽이면서 삐끗했습니다  당시에는 손가락을 접기는 커녕 가만히 있어도 큰 통증과 약간의 부어오름이 있었습니다  시간이 지나면서 외관상 평소와 같이 이상이 없고 통증도 없어져 병원에 가진 않았습니다   그러나 검지손가락 측면으로 지지하면서 무거운 것을 들때 그 손가락만 힘이 빠지면서 통증이 잠깐 느껴지다 사라집니다  이외에 손가락을 접었다 필때만 약간의 통증이 있었는데 최근들어 가끔 그 손가락이 아파서 파스를 붙여 달래곤합니다   외관상 똑같고 병원에 갈정도로 통증이 심하지 않은데 손가락에 이상이 있는걸까요  혹 이상이 있다면 정형외과 또는 신경외과 중 어디로 가야할까요 ,신경외과
림프절 통증,얼마전부터 자고 일어나면 빗장아래 림프절이라고 하는 저 곳에 근육통 같은 통증이 발생하는데 병원에 가봐야할까요  가봐야한다면 어떤 과로 가야하는지 알려주세요   제가 옆으로 누워서 자는데 전엔 안그랬는데 최근에 통증이 있어요  성별은 여성입니다 ,신경외과
공익근무 전환 가능한가요 허리디스크 ,mri상으로 추간판탈출증 총  군데 발생하였습니다   번 요추부터 전추까지요 반장이 공익가라는데  급이 나올 수 있나요,신경외과
목뒤가 찌릿한 증상,오늘 갑자기 그러네요 처음이에요 오늘 처음으로    번 그러더라구요 찌릿 거리다가 사라져요    다른 통증은 없고 찌릿한 증상만 있습니다     디스크일까요   ,신경외과
