0,1,2
거북목 두통  머리 열감,거북목 긴장성으로 두통을 매일 달고 삽니다  스트레스 받거나 근육 뭉친 게 느껴지면 바로 뒷목이 당기고 뒤통수를 타고 올라와 정수리까지 뭔가 꽉 막힌 통증이 옵니다  한 번 생기면 잘 가라앉지 않아서 초기에 약을 먹어야만 사라져요   이럴 때마다 뭔가 몸 안에서 열이 나는 것 같은데 연관이 있는 문제인가요   비접촉 체온계로 측정해보면 정상보다 낮게 나오는데 이마나 손을 만졌을 때는 열감이 느껴져서 아리송하네요   평소에 열이 많은 체질이기도 하고 더위와 추위를 쉽게 탑니다  ,신경외과
계단에서 내려갈때 다리가 떨려요 ,계단에서 내려갈때 한쪽다리로 지탱하고 있는순간이 있잖아요 그럴때 그 지탱하고 있는다리가 덜덜떨려요 반바지입으면 떨리는게 보일정도  제가 다리가 심하게 얇은것도 아니고 상체가 심하게 뚱뚱한것도 아니에요 그냥 딱 정상체중이예요 마름도 아니고 통통아닌 중간   근데 대체 왜 자꾸 다리가 덜덜 떨리는건가요    해결할 방법은 없나요  계단 내려가기 힘들어요 근데 올라갈때는 안그래요 그래서 전 오히려 내려가는것보다 올라가는게 더 편해요   아 그리고 나이는 이제 고 올라가오,신경외과
소변 후 옆구리 통증,고 인데요 소변 보고 나면 오른쪽 옆구리가 진심 개아파요 옆구리 잡고 떼굴떼굴 구를 정도로  아팠다가 또 괜찮아지고 이러기를  년  정도 반복했는데 오늘 의사선생님한테 말씀 드리니까  년동안 멀쩡했으면 큰일은 아니니까 걱정하지 말라고 하셨는데  이거 왜 이러는 건가요 ,신경외과
거북목 목 뻐근 증상전에 손 힘빠짐 증상이 있을수도 있나요 ,작년 초부터 젓가락질하면 많이 힘들었어요 그러다가 이번에   월달에 목이뻐근해서 정형외과 갔다가 거북목 판정받았는데  이럴수도 있나요   최근에 근육이 떨려서 루게릭이라는 병에 너무 꽂혔어요 진짜 미칠거같아요 제가 목이 뻐근해서 극도록 불안해서 근육떨림이 생겼을 수도 있다고 의사선생님이 그러시더라구요   진짜 미쳐요    ,신경외과
허리디스크 군 문제,국군병원 진단상으로 추간판탈출증 요추           전추 이고 mri결과 써진걸 보면 mild한 정도의 Extrusion 라고 명시되어있는데  급 대상이 될까요 ,신경외과
상하차 허리디스크 ,상하차를 하고  주일 정도가 지났습니다  상하차를 한 번 했는데 허리 통증이 아직 있습니다  제가 다음주에 군대 신체검사를 받으러 가는데 지장이 있을까요  병원을 가보는게 좋을까요 ,신경외과
신경 안정,신경을 많이써서 자꾸 잠에서깨요 신경안정될수있는방법좀알려주세요   ,신경외과
등 저림  다리 통증,왼쪽 날개 쪽이 저리고 왼쪽 다리가 갑자기 찌릿한 통증이 계속 와서 걷다가 갑자기 멈추게 됩니다 오늘은 하루종일 다리가 짜릿함은 현상이 있는대요   다리가 저리기 보다는 찌릿한 통증 입니다   제가 골반이 많이 삐뚤어져 있는데 혹 이것때문에 다리와 등 어린이 있는지 ,신경외과
허리디스크수숳,  살에디스크수술 받으라고하는데 어찌할지 모르겠어요  대소변볼때 힘조절이 예전같이 않고  월  일날 발생한 통증은 입원해서 주사 번 맞고 많이 좋아졌지만 엉덩이 허벅지뒷쪽 음부쪽의 감각이 둔합니다  내시경현미경수술은 뼈를 건드리는 수술인데 겁이납니다  어떻게 해야할지 감각이 안돌아와서 겁도 나고 수울을 해야한다니 그것도 겁이나고,신경외과
목 어깨 날개뼈 만성통증을 앓고 있어요,목 어깨 날개뼈 만성통증을 앓고 있어요 정형외과  한의원 가볼수 있을만한곳은 가봤는데     엑스레이 찍어보면 다들    목이 안좋아서 그런거라고 하더라구요 일자목이라고 하는데 디스크 까지는  아직 아니라고했어요 목을 뒤로 젖히거나 돌릴때 날개뼈쪽이 찌르는듯한 통증이 있어요 정형외과에서 도수치료도 받아보고 주사도 맞아보고 한의원에가서는 침도 맞아보고 추나치료도 받아봤는데 크게 효과를 못보는데 이럴때는 어떡해야 할까요,신경외과
오른쪽 다리 발목에 힘이안들어가요,운전하는데 브레이크랑 엑셀도 못밟겠고 밟으면 발이랑 다리가 심하게 덜덜덜덜 대면서 떨리고 힘을 못쓰겠는데 왜이러는 건가요    심각해요    ,신경외과
우측 무릎 다쳤고 오른쪽 종아리 땐땐한데 자꾸 풀어주면 나지까요 ,하지정맥류도 조금 의심되고 자다 다리 쥐 많이 낫었어요 요즘 물좀 마셔 나지기도 했어도 간혹 그러고 허리 목 디스크 있어오 ,신경외과
두통  코로나 검사 ,코로나 검사 이후 때문인지 두통이 조금 심한데 코로나 음성이여도 두통이 오나요  빈맥이 있긴해요   해결방법도  ,신경외과
갑작스러운 허리통증 신경통,안녕하세요   대 중후반 여성입니다  어려서부터 자세가 좋지 않아서 학생때부터 허리통증이 빈번하게 있었는데 요즘은 잦아져서 질문드립니다   허리통증이 근육이 아픈 그런느낌이 아니라 아무 통증이 없다가 정말 어느순간 갑자기 억 소리나면서 숨막히게 엄청 아파요  고양이자세  앉는거 눕는거 다 소용없고 등허리 아픈 곳을 만져보려해도 아여기다 하고 집히는 부분없이 뭔가 깊숙히  가 아파요  아픈 곳이 만져지지 않고 정확히 어느 부분인지도 모르겠어요  그래서 마사지나 그런걸론 풀어지지도 않아요  근데 또 이상하게 아플 땐 신음소리가 저절로 나오다가도  분 정도 안에 또 언제 아팠냐는듯 아무 통증없이 사라집니다  검색을 해봐도 저랑 비슷한 건 없는 것 같아서 질문 드려요  엉덩이골반다리는 전혀 통증 없습니다   쉬는 날 병원 내원은 해보겠지만 혹시 어떤 질병의 증상인가 싶어서 문의드립니다  감사합니다 ,신경외과
 번 디스크가 튀어나왔어요,심한건 아니지만 약간 튀어나왔습니다 초기단계라고 하는데 약먹고 걷기운동 열심히 하고있는데 매일 쉬지않는게 문제인걸까요  공부한다고 오래 앉아있다가 생긴건데 서서 공부해도 아프더라고요 이 기간동안에는 공부를 끊어야되는것인지   통증생긴지  개월 넘었습니다 글고 신경차단술이나 신경성형술 받으면 튀어나온 디스크 들어가나요  디스크 들어가게 하고싶은데 어떻게해야하나요 ,신경외과
  대 초반인데 퇴행성 관절염일까요 ,제가 한동안 중장거리 육상 연습을 많이 한 영향인 것 같은데요   어느 순간부터인가 운동을 하면 무릎에 통증과 떨림이 생길 때가 있는데 퇴행성관절염을 의심해봐야 될까요  제가 일반인들과 비교할 때는 확실히 하체근육이 좀 있어서 통증을 더 못 느끼는 건 아닐까 해서요   아니면 아직 퇴행성관절염은 아니나  무릎 관리에 더 신경을 쓰면서 의사와 상담은 해봐야 할 정도일까요 ,신경외과
저는 작년   월에 물리치료랑 약을 먹고  개월 버티다 오늘 다시 새움병원에서 진료를 받았습니다  허리랑 허리 밑 엉덩이 부분이 통증이 있고 발,저는 작년   월에 물리치료랑 약을 먹고  개월 버티다 오늘 다시 새움병원에서 진료를 받았습니다  허리랑 허리 밑 엉덩이 부분이 통증이 있고 발있는쪽까지 저려서   월 당시 엑스레이 촬영까지 했는데 아무 이상이 없었습니다  그래서 이제 남은것은 MRI 검사 밖에는 없는데 의사 선생님께서 디스크 초기 일지 모른다는데 어떻게 관리해야 하며 만약 디스크 초기일때는 수술 말고는 방법이 없습니까   ,신경외과
가슴 오른쪽 위 통증,가슴 오른쪽 위랑 가끔씩 등쪽이 찌릿한 통증이 오면서 트림을 같이 하는데 약간 소화불량 느낌인 것 같은데     소화제 먹으면 괜찮아질까요     병원을 가야할까요 아마 요근래 먹는 양을 확 줄였다가 다시 엄청 먹기 시작해서     그런 것 같기도한데       일 정도 계속 통증이 옵니다    지금도요   ,신경외과
손가락 통증   신경과 vs  정형외과 어디로 가야하나요 ,   에  차 백신 접종 후 근육통을 심하게 앓았는데 특히 허리와 양팔 근육통이 심했었습니다  허리는 시간이 지나면서 괜찮아 졌는데  팔 부분에 손가락 움직일 때 통증이 지속되고 있습니다   지난주까지만 해도 양손에 힘이없어서 주먹을 꼭 쥐거나 병뚜껑을 열지 못했는데  이번주 들어서 손에 힘은 어느정도 돌아왔지만 무거운걸 들거나 손가락 반복운동 가위질  양치질  타이핑 등  시 오른손 중지  약지  손바닥  손목 통증이 있고  계속 움직이면 통증이 팔꿈치까지 올라옵니다  통증은 보통 아침에 제일 심했다가 점심 때 조금 덜 신경쓰이고  저녁이되면 살짝 마비가 온듯 우리우리한 느낌이 듭니다 가만히 있을 때 기준   왼손은 통증은 없지만 손가락을 움직일 때 두번째 마디 부분이 당기는 느낌이 있습니다   월요일   일 에 신경과 방문했었는데  만세하기  손이나 팔을 밀고 당기는 진료결과 큰 문제는  없어보이나  세부적으로 살펴보려면 머리 MRI 촬영이 필요하다고 진단받았습니다 MRI 찍지는 않았습니다    통증이 지속되거나 심해지면 병원을 다시 가 봐야 할 것 같은데 신경과에서 MRI찍는게 맞는건지  정형외과를 방문하는게 맞는건지 궁금해서 문의드립니다 ,신경외과
허리 디스크 진단,요주 mri인가 찍어봤는데 정상소견이나      번 요추 추간판 팽윤주의라고 결과가 나왔는데요 따로 검사받을 필요없죠 ct나 xray같은거,신경외과
mri영상판독지 신경근전도검사 결과지 해석,Mri영상과 신경근전도 검사 결과지 해석좀 부탁드립니다 ,신경외과
머리  뇌에 그냥 긴장이 없는거같아요,생각은 뭐 잘 하는거같은데 잠잘때처럼 머리에 아무 긴장이 없어요  하루종일 티비본 사람처럼 뇌가 텅 빈 느낌인데 이게 정상인가요 ,신경외과
능형근   날개뼈 안쪽  화끈거리게 콕콕쑤시는 만성통증,대충 읽지마시고 하나하나 집중해서 읽어주셨으면 좋겠습니다   절실합니다    살먹은 청년입니다  제가 고등학교때 이증상으로 잠깐 아팠다가  년전부터 다시 오른쪽 능형근이 화끈거리게 거슬리는 콕콕 쑤심이 있어서 목디스크 시술과 흉추디스크 시술을 하였습니다  정형외과도 이상없고 통증의학과에서 능형근쪽으로 주사도 많이 맞았구요 그런대도 호전은 보이지 않았습니다 답답합니다  누워 있거나 움직이는 활동을 할때는 그나마 쑤심이 덜하긴한대 아무런 움직임 없이 가만히 앉아있거나 서있을때 휴식을 취할때 화끈거리는 쑤심이 점점 오면서 심해집니다  그래서 오래 앉아 있지도 못합니다  기분나쁜 쑤심이라 일부러 능형근쪽을 자극을줘서 통증으로 통증을 이겨낼려고 강하게 누르기도 합니다  누르거나 움직일때 아픈게 아니라 점점 오는 그런 쑤심 입니다   참고로 폐   위   담낭 이런쪽도 검사했는데 이상이없었습니다   근력에 제한이있거나 목움직임에 제한도 없습니다  압통도 없습니다  마지막으로 누워있거나 움직이는 활동을 할때는 그나마 쑤심이 덜하다고 했는데 왜 이럴때만 통증이 덜 한건가요  이것만으론 원인을 찾을수없는건가요 ,신경외과
발바닥 저림,풋롤러로 발바닥을 지압하다보면 사진에 표시된 곳이 찌릿찌릿합니다  혈액순환이 안되서 그런가해서 저곳을 집중적으로 마사지하고 나면 저기랑 발가락이 저립니다  시간이 지나면 저린느낌이 사라지는데 유독 저곳만 왜 찌릿찌릿한 느낌이 날까요   ,신경외과
허리디스크 신경통약중에,뉴론틴   밀리하루두번먹는것과프로가발린  밀리 번먹는것중  신경통에어느게 더 잘 듣나요 ,신경외과
허리피면 다리저림,제가 평소에 허리 구부리고 다녔어서 이제는 일어설때 허리 완전히 피고 다니는데 앉아서는 맨날 구부리고생활해가지고 앉아있을때 허리를 피려고하면 다리가저려요   살입니다,신경외과
새끼손가락 다쳤는데 찌릿해요,칼질을 하다가 새끼손가락 손톱 옆쪽을 칼 끝으로 깊게 베였는데요 지금  시간정도 지났는데 새끼손가락에 연결된 손바닥 쪽이 찌릿찌릿해요 신경에 이상이 생긴건가요  움직이는건 문제없습니다 ,신경외과
몸 반쪽 저림 증상,귓불에 주름이 접히고 몸 반쪽에만 팔  다리  저림 증상이 나타나는데 어떤 검사를 받아봐야 할까요 ,신경외과
팔 신경문제 ,몇 시간째 팔꿈치 아래 팔 바깥쪽  새끼손가락에서 쭉 올라오는 방향 에 순간적으로 이상한 느낌이 들며 힘이 풀려요  그 상태가 오래 지속되진 않는데 빈도가 잦아요  정확히 무슨 문제인가요 ,신경외과
할머님이 오른쪽발톱은 저렇게 하얗게 변하면서 누르면 아프고  왼쪽발톱은 누르면 아팠었는데 저렇게 검게변하면서 아프진 않으시대요   이유가 뭘까요,할머님이 오른쪽발톱은 저렇게 하얗게 변하면서 누르면 아프고  왼쪽발톱은 누르면 아팠었는데 저렇게 검게변하면서 아프진 않으시대요   이유가 뭘까요     병원은 어디로가야하나요   ,신경외과
손 팔에 힘이 안들어가는 초기증상,저는 이제   살이 된 곧 군대를 가는  급 남자이구요 엄청 건강하나 최근 무리하게 공부를하는바람에 대상포진에 걸렸었습니다  잘 회복을 하긴 했으나 부위가 목 뒷머리쪽이였는데 어제부터 가운데손가락을 움켜쥐는 동작부터 손가락을 움켜쥐는 힘이 잘 안들어가고 팔이 아픕니다  힘줄이 아파요 나중에 뇌졸증이나 이런병 걸리고 그때 초기증상일때 미리미리하지 이럴까봐 미리 여쭤봅니다  갑자기 손가락과 손목에 힘이 잘 들어가지 않습니다  어떤 초기증상인가요,신경외과
정수리 통증,몇일전부터 정수리 부근 열감 통증이있는데요 머리카락도 많이 빠지고요 정수리쪽      왜이런걸까요   ,신경외과
가슴 저림 혹은 답답,양쪽 갈비뼈 아래쪽 부분 가슴이 뭔가 답답합니다  아프거나 통증은 없는데 뭔가 꽉 막혀있는듯한 느낌이 들고 허리를 펴면 조금 괜찮은데 허리를 펴게되면 등이 조금 불편합니다  절대 아프거나 하는것은 없지만 굉장히 거슬리고 불편한 느낌이 듭니다  어떤 증상일까요 ,신경외과
말초신경장애로 발가락저림 ,발가락이 가끔 까매지고 지글지글한느낌  말초신경 이상인경우혈액순환제먹으면 나아지나요  허리디스크로 인한 발저림은 혈액순환제 먹어도 효과없는건가요,신경외과
두통 후 피로,가끔 편두통이 있었는데    개월 정도 안오다가  틀 전에 머리에 공기가 가득 찬 듯이 두통이 심하게 와서 약을 먹어도 나아지질 않아서 응급실가서 링거를 맞았는데 그 후로 살짝 씩 자기 전에 잔두통이 오다 말다 하고 전보다 피로가 좀 있는데 병원에가서 머리 사진을 찍어보는게 좋을까요    거북목이 좀 있고 허리도 일자허리입니다 ,신경외과
지주막하 줄혈 증상인가요 ,월요일날 출장을 다니면서 목을 들어 한가지 동작을 했는데 그때 순간적으로 뒷머리 속에서 쥐가 심하게 놨다가 사라졌습니다  그날 저녁부터 오른쪽 머리 앞쪽에 쥐가 저림  나는거 같아 신경이 쓰여서 잠을 설치고 있었는데 집에 남아있던 신경안정제 처방 받은게 있어서 그걸 먹으니 좀 괜찮아져서 잠을 잤습니다  다음날도 같은 증상이 보이며 순간적인 두퉁이 있어 병원을 두군데 갔더니 목 근육이 문제가 있어서 머리가 저릴수도 있다면서 근육 이완제를 처방해 주셨습니다  한 병원애서는 목 액스레이를 찍어보았더니 목이 거의 일자로 되어 있다고 하더라고요     약을  틀먹고 목마사지를 하니 처음보단 느낌은 덜 한거 같은데 가만히 있거나 하면 오른쪽 앞쪽 머리에 순간적인 통증과 쥐가 나는거 같은 느낌이 듭니다    증상을 보인지는  일정도되었고요   머리가 쥐 저림  순간 통증만 빼면  증상 나타나기전이랑 똑같습니다  혹시 뇌출혈이나 뇌경맥은 아니겠죠    ,신경외과
뇌 손상에 따른 호르몬 질문이요  , 살 적에 자전거 사고로 머리를 다쳣다 그로인해 성인이 되가는 과정에서 키는 정상적으로 발달을 했는데 이목구비가 정상적으로 발달을 못햇다던지 아니면 손이 미발달이 된다던지 할수있나요 ,신경외과
화이자  차 맞고 머리 부딪힘 뇌출혈,저 어제  차 맞고 지금 오한 장난아니고 머리 뒤통수 왼쪽 오른쪽 번갈아서 따끔 한번 아팠던 상태에서 실수로 벽에 머리 살짝 부딪혓는데 뭐 뇌출혈 이런거 업겟죠      화이자 맞고 뇌출혈 온 사람들 잇다햇는데 두통도 있었는데 머리까지 부딪혀서 걱정      흑,신경외과
경추가 틀어진 걸까요 ,아래턱을 뒤로 당기고 있다가 목에서 뚝 소리가 난 후 아래턱이 고정이 안됩니다  왼쪽턱이 힘이 안 들어가고 오른쪽 턱에비해 움직이는 범위가 넓어진 느낌입니다  잘때는 턱이 뒤쪽으로 당겨지고 틀어져 얼굴이 당겨지고 불편해 잠을 잘 못 잡니다  양쪽 턱이 비슷한 느낌이 날려면 고개를 왼쪽으로 돌리거나 오른쪽 어깨를 뒤로 해야 합니다  일상생활중 자세를 정면으로 향하면 목 오른쪽과 오른쪽 승모근이 단단하게 뭉치면서 아래턱이 앞으로 쏠리면서 틀어집니다  왜이런까요  전보다 몸에 힘이 빠진것 같기도 하고  많이 힙듭니다  어느 병원에서 어떤 치료를 받아야할지 답변 부탁합니다 ,신경외과
흉추측만증관련,몇도 휜건가요 아래 척추는 정상인처럼 곧은데 흉추만 휘어서 어깨 높이가 다르고 주변 근육이 경직되어있나서 골반에 실리는 하중이 달라지고 통증이 한쪽에만 있고 발이 밀려서 평발화가 되어가는 중입니다 몇도 휜건지 알려주시고 해결방안도 알려주시면 감사하겠습니다  광고 다는 분들은 달지마시고 지나가주세요 내공     ,신경외과
목이랑 머리가 찌릿찌릿거려요,어제부터 갑자기   몇분간격으로 왼쪽 목 안쪽이 찌릿찌릿 거립니다      그리고 정수리에서 살짝 왼쪽을 누르면 거기도 목안 찌릿찌릿거리는것처럼 아파요 왜이러는걸까요    자고일어나면 괜찮아지겠지 했는데 그대로네요   그리고 왼쪽 어깨도 좀 결립니다   어깨에서 딱 특정한 위치를 꾹 누르면 거기도 좀 찌릿거리면서 왼쪽 귀까지 타고가요   만약에 병원을 간다 치면 어느병원을 가야하는걸까요      ,신경외과
허리디스크 신경차단술 vs  신경소염주사,안녕하세요  약   년 정도 전 즈음에 처음으로 추간판 탈출증 진단을 받았고   번  번으로 기억합니다   다리에 방사통 까지 있어서  년정도에 걸쳐 약  회정도 신경차단시술을 받았습니다   이후 관리를 비교적 잘 해서  년 정도 잘 살아오다가 최근에 증상이 조금 재발한 거 같네요  대퇴부 쪽에 방사통인지 근육통인지 좀 애매하지만 통증이 있는데 일단 디스크 증상이 재발했다는  전제 하에 질문 드립니다      신경 차단술과 신경 소염주사가 구체적으로 어떻게 다른 건가요  제가 이해한 바로는 전자는 MRI검사가 필요한데 후자는 MRI 검사 없이 진행이 가능하다고 하네요      물론 구체적인 진단자료 없이 판단을 내리긴 어려우시겠지만 방사통이 있는 상태에서도 후자로 증상을 완화해 축구 같은 운동을 무리 없이 하는 게 가능할까요 ,신경외과
갑자기 허리가 너무 아파요   ,이틀전 간만에 얻는 휴무라 집에서 쉬다 샤워후 밖으로 나오자마자 조금씩 통증이 느껴지더니    너무 아파서 잠깐 그러다 말겠지 했는데   통증은 더욱 심해져 어제 한의원을 가서 물리치료와 침을  맞았는데도 통증은 가시질 않습니다  지금은 허리도 허리지만 다리에 통증이 욱신욱신 하면서 느껴 집니다  통증 부위는 엉덩뼈 바로 위 왼쪽이었는데 지금은 그냥 엉덩뼈 바로위 전체가 아프고 왼쪽 다리가 아팠었는데   지금은 오른쪽 다리로 전이 된듯 합니다   의사 선생님 말씀으로는 염좌일 가능성이 많다고 하는데    너무 아프네요   다른분들은 디스크 의심 된다고 하고요    과연 뭐가 맞나요   ,신경외과
대상포진일까요  ,오른쪽 사타구니 위쪽부터 해서 엉덩이 라인까지 바늘록 콕콕콕 찌르는 느낌이 들고  찬물 닿았을땐 소리질렀어요    근육통  신경통  느낌이고 가렵진 않습니다  기분 나쁘고 불편해요  제가 어릴때 가슴 밑쪽에 대상포진 난 적이 있는데 그때랑 통증이 비슷해요  근데 아직 발진은 없어서 어떤 병원을 가야할지 모르겠습니다    어떤 과를 내원해야 좋을까요 ,신경외과
발가락 염증 썩음  ,안녕하세요  저는 스트레스 받으면 발톱을 뜯는 안좋은 습관이 있습니다 제가 두번째 발가락에 윗쪽으로 발톱이 뜩겨진게 거슬려서 뜯어버렸더니 뜯을때도 아팠습니다  근데 지금 그쪽이 유달리 빨갛고 엄청 아파요   근데 제가 자꾸 신경이 쓰이니까 신발안에서 계속 저쪽 발가락을 움직이긴했어요 마찰이 되서 빨갛게 된건가요    염증 생긴건가요   썩은건 아니겠죠      후시딘 바르고 밴드 붙이는게 나을까요 아니면 그냥 두는게 나을까요      예쁘지도 않은 발 사진은 너무 죄송합니다  ,신경외과
견갑골 통증 질문,제가 등운동할때 특히 로우운동  견갑골이 너무 아픕니다   수축할때 견갑 통증이 심해요 평소에도 견갑통증이 있는데 이건 어떻게 고쳐야할까요  ,신경외과
대뇌 혈관 수축 증후근,제가 머리가 너무 아파서 대뇌 혈관 수축 증후근이라는 결과가 나왔습니다      몸에 기운이 없고 힘빠짐이 없어서 잘때 잠도 깰 정도입니다 이 증상도 이 대뇌혈관수축증후근때문일까요   신경검사에 반응은 이상이 없다고 나옵니다     mulex 랑 carol f 을 처방받았는데 먹으면 회복이 될 수 있는 치료제인가요       운동을 해서 치료하고싶은데 도움되는 운동은 무엇이 있을까요   ,신경외과
목디스크 증상인가요 ,저희 누나   살  만   세 가 얼마 전부터 어깨 주위가 아프다고 주물러달라 한 적이 있는데  어깨 통증이 점점 위 아래로 퍼진 것 같다며 매일매일 통증이 달라지는데요   오늘 증상만 말씀드려보면    오늘은 어깨 쪽을 주물러도 아프다고 하고   팔도 살짝 저린다고 하더라고요  어제보단 많이 힘들어하는 것 같기도 해요     월 사이의 누나의 상황 말해보면   졸업 이후로 휴식을 즐겼어요  대학 합격 이후부터    월에 코로나     차 부스터샷을 맞고   코로나   확진되지도 않았어요  침대에 오래 누워있긴 한적이 있었는데   최근에 어떤 일 땜에 자주 어깨에 무리가게 한적은 있지만 그때는 하루 뒤에 사라졌어요  혹시 이런 증상이 목디스크 증상혹은 거북목 증후군 현상인가요  궁금합니다   오늘 타이레놀 먹었고 파스도 뿌렸어요 ,신경외과
왼쪽 뒷머리 통증 이유 알려주세요,잠을 잘 못 자도 신경성 두통이 생기나요 ,신경외과
이명약과 가바 영양제 질문,이명 때문에 가바 영양제를 먹으려고 하는데 현재 다음 약들을 복용중입니다 괜찮을까요 ,신경외과
