0,1,2
무릎 주사 후 통증에 관한 질문,서있거나 걷거나 하면 앞허벅지로 통증이있어 정형외과진료를 갔습니다   주전 MRI촬영한 것이 있어 판독하니 허벅지 앞쪽과 힘줄이 부어있다고 하여 트림암 리도카인 명문염산부피파카인헤비주사     말린다주 히알우로니다제  주사를 맞았습니다  보통 초음파을 보고 주사를 놓는다고 하는데 해당 병원은 의사의 감으로 놨습니다   중요한건 맞은 직후 통증이 이전보다 더 심해졌고 일어서 있기 당기고 무릎 앞이  뭔가 가득 차있는듯한 느낌으로 아프네요  진통제는 위가 안좋아 먹고 있지 않으나 원래 무릎 주사 후 며칠은 안픈가요  이제  일차 됐는데 너무 이전보다 더 아파서 걱정이네요  해당 병원 의사는 원래 주사 맞으면 며칠은 그럴수 있다라고 하는데     제가 너무 간절했었기에 주사를 맞았는데 너무 걱정 스럽네요    정성스러운 답변 부탁드리고  그 이상한 신발 광고 답변은 달지 말아주세요   ,신경외과
앞발바닥 통증,제가 운동을 하고있는데요  요즘 들어 앞발바닥에 통증을 느끼고 있습니다  통증이 앞발바닥 가운데부터 시작해 검지발가락까지 아프고  검지발가락에 붓기가 좀 있는 거 같은 지 구부리는 것도 잘 되지 않습니다  별 거 아닌거 같아서 신경 쓰고 있지 않았지만 너무 아파서요  병원에 가긴 할껀데 금방 나으면 참아보려구요  이렇게 되는건 무슨 원인 때문에 이러는 걸까요 ,신경외과
체함 두통,제가 체해서 두통이있는건지는 잘 모르겠는데  달이나 달에 한번씩 꼭 두통이 엄청 심하게 옵니다  이마쪽머리부터 정수리  밑모리쪽은 안아프고 윗머리랑 뇌  안쪽이 너무 아파요 체해서 그런걸까요   무슨 문제 있는건 아니겠죠    ,신경외과
오른쪽 등이 불편합니다 도와주세요, 주 전부터 서 있으면 오른쪽 날개뼈 아래가 저려오더니 다시 누우면 괜찮아집니다  그리고 등이 저릴때 등을 만지면 뭐가 만져지지만 통증도 없고 딱딱하지도 않습니다  이 증상을 보시고 의심가는 병명 있으시면 알려주세요 그리고 어디 병원에 가야하는지 알려주세요,신경외과
아버지께서 음식씹는게 불편하십니다,음식드실때마다 손으로 턱을 밀어서 씹는것을 보조하고있습니다 치과문제인가해서 치아 치료 도하시고 ct도찍으셨는 이상없는걸로나와서 신경과로가서 머리 mri 혈액검사  안면전기자극검사했는데 연세에비해너무건강하다고 나오셨고 한의원에서침치료도해봤습니다 연세는  이신데 복용하시는약은 없습니다 나름 건강하신편이였는데 반년가까이 잘못씹으시니      대학병원도 소용없네요   조언좀해주세요,신경외과
뇌압이 오르면 얼굴도 아픈가요 ,세달전부터 이유모를 두통  눈통증  얼굴통증이 있어서 근처 상급병원에서 mrl도 찍어보고 대학병원가서 뇌수막염 검사도 해보고 했는데 아무 이상이 없어서 약만 먹다가    일상생활에 너무 지장을 주니까 다른 대학병원가서 진료보니 뇌압상승이 의심된다고는 했습니다  혹시 몰라 안과 진료도 받았는데 안압이 높긴하나 두통이 생길정도는 아니라는 진단을 받아서 다음 진료때 뇌압측정 검사를 할것같은데요    뇌압상승 증상을 아무리 찾아봐도 눈 통증은 있어도 얼굴통증은 없더라고요  저는 두통이 생기면 눈두덩이랑 눈썹뼈  광대뼈 통증이 함께 생기는데요 뇌압이 오르면 얼굴도 아픈게 맞는건가요  아니면 뇌압상승과 관련없는 통증인걸까요  ,신경외과
학생 두통 너무 심함,제가 일주일에 한 두번    정도는 두통이 너무 심해요  진짜 머리가 너무 무겁고 지끈지끈하면서 아파요  비염이 있긴한데 비염때문에 그런지 그냥 편두통인지 모르겠어요 ,신경외과
허리디스크 수술후 발등이 아파요,저희 어머니가 허리가 아파 다리 저려서 월요일에 허리디스크 수술을 했습니다 디스크 터진거 제거 하는 수술을 했습니다 월요일에 수술하고 화요일에 퇴근 했습니다 간단한 수술인거 같은데 금요일부터 발등이랑 다리가 아프다고 하는데 발등이 엄청 아프다고 하네요 이불만 스쳐도 아픈정도라고   수술 후 괜찮았는데 갑자기 금요일부터 수술후 일부터  아프다고 하네요 그전에는 발등이 안아팠는데 왜 그러는 걸까요  일시적으로 아픈 건가요  아플때 먹는 약도 계속 먹고 있는데도 엄청 아파해요,신경외과
전신마취 수술 후 몸이 발작하듯 엄청 추운듯 떨었어요,전신마취 수술후 회복실로 옮겨졌어요 몸이 발작하듯 엄청 춥고 덜덜덜 떨었어요  원래 그런건가요  마취깰려고 떠는거라고 하던데 정말 그런가요   엄청 덜덜 떨리더라구요,신경외과
다리 접히는 부분이 아파요,다리 접히는 부분 아래쪽 장딴지 위쪽  이 아파요,신경외과
왼쪽 손목 안쪽에 툭튀어나왔습니다,자해후 봉합하고 실밥풀었는데 왼쪽 손목 안쪽에 사진과 같은 혹  이 생겼습니다 누르면 아프지는않은데 딱딱합니다 실제로는 사진보다 동그랗게 툭 튀어나와있어요,신경외과
발등 수술후 철심제거기간,엄마가 복숭아뼈 쪽에 금이가서 척추마취후 수술을 받으셨는데  개월 후에 철심제거 수술을 또 받으셔야해서요 그렇게 오랜기간 걸리나요  연세가   세에 고혈압도 있으셔서 또 척추마취하시는 것도 걱정되고 발등도 현재 쑤시고 아프다고 시니 어떻게 해야 할지 모르겠어요,신경외과
 년전 신경재접합 수술을 하고  ,신경재접합 수술을 하고 회복후에 별 다른 증상없이 지내다  년지난 지금 수술 부위가 붓고 통증이 심해요 부위가 손가락검지 첫 마디 관절 부분인데 구부러 지지 않을 정도로 많이 부웠습니다 가만히 있어도 통증이 있습니다 왜 이런 건가요  ,신경외과
요즘 잠이 너무 안와요,약  개월전 누우면 허리가 땡기거나 약간 불편한 느낌이 있었는데 요즘 다시 똑같은 증상이 생겼어여  그래서 새벽까지 잠이 안오고 그리고 또 누우면 계속 다리를 꼬고 있게끔 되네요     대체 뭐 때문일까요 아니면 해결법점여,신경외과
감기 엉덩이 주사 후 꼬리뼈 통증, 일정도 감기 증상으로 고생하다가 병원 약으로 잘 안나아서 병원에서 엉덩이 주사 맞고 왔는데 주사 맞고 병원 대기실에서 수납 이름 불릴때까지 한  분 앉아있다 수납 이름 불리길래  분 정도 뒤에 일어나자 마자 뭔가 꼬리뼈가 욱신 했는데 그냥 별거 아니겠지하고 넘겼는데 수납 다 하고 밖에 나가서 걷는데 계속 꼬리뼈가 아파서 찜찜했지만 금방 돌아오겠지 했어요   근데   시간 넘은 지금도 아픈데 어떻게 된걸까요   마치 엉덩방아 찐것처럼 아프네요      주사 맞은 병원 이비인후과  가서 물어보는게 맞을까요  아니면 신경외과를 가는게 맞나요       참고로 주사는 누워서 안맞고 침대에 기대서 맞았습니다  주사 때문에 그런것 같기는 한데 뭐가 도대체 문제인지 모르겠네요,신경외과
운동 후 이두근육통과 두통,헬스장을 다녀온 다음날 잠에서 깨니까 이두근  팔꿈치부터 어깨쪽 이두까지   왼쪽 오른 쪽 다 아프고 왼쪽 목 근육 까지 너무 아프더라고요 팔 양쪽을 필 수 없을 만큼 아프고 피려고 하면 찢어질듯 아프고요 두통이랑 미열까지 나는거같아서 쉬면 괜찮을까요   조치 법도 알려주세요,신경외과
버거씨병     일지   의사 선생님들 한번만 읽어주세요  ,안녕하세요   저희 아버지께서 약   년 전쯤에 오토바이를 타시다 교통사고를 당하셨습니다    어느정도 였나면    다리 뼈가 튀어나와 보일 정도셨다고 하셨습니다   일주일간은 혼수상태에 빠지셨고 다행히 의식이 돌아오셨습니다   저는 너무 어렸어서 아무것도 몰랐지만       당시 삼성병원  담당 의사분께서 말씀하시길 보통 사람이였으면 걷는거 조차 힘들거라고 하셨다는데    아버지가 워낙 건장한 체격이셨고 젊으셨으니 그나마 다행인 것 같습니다   그 때 당시 의사분 께서 그런 말씀을 하시면서 수술한지 얼마 안됐는데 벌써 걸어 다니신다고   그랬던 이야기를 전해 들었습니다   여기까지가 제가 어렸을 때 들은 이야기 입니다       지금은 어른이 되어 아버지가 아프시다는 것을 생각해 보면        평소에 아버지가 양반다리 하시면 굉장히 불편해 하셔서 최대한 피하시는 편이시고    저리다고 하십니다      평소에 아버지가 다리가 차갑고 감각이 둔하다고 말씀하시고        약주를 자주 하시는데 그럴때 마다 다리에 힘이 잘 안들어 가시는 것 같습니다    수술 당시 담당 의사 선생님께서 인공관절을 하셔야 한다고 하셨더랍니다    이게 힌트가 될진 모르겠지만     유튜브를 보다보니 대강 비슷한 병이 버거씨병 이라고 하나 들었습니다    저는 무릎이 아프고 그러니 인공관절 이란걸 해드리면 괜찮을 줄 알았는데  평소 다리가 차고 감각이 없어진거같다고 말씀하시고    주물러달라고 하시니     인공관절으로는 해결이 되지않지 않나    싶습니다     의사 선생님들이 보시기엔 어떠신지   고견 한번만 들려주세요    아버지의 아들로써 부탁드립니다   ,신경외과
질 안에 몽우리같은게 있어요,  를 거의 안하다가 정말 오랜만에 했는데 다음날 확인한깐 누르면서 계속자극을 줬던 부위   가 몽우리처럼 동글동글하게 다른쪽에 비해서 부어오르고 좀딱딱해졌어요   계속 그 부위를건들여서 단순히 부은걸까요      아님 문제라도 생긴걸까요       부작용같은 것도 있나요   이런적은처음이라 겁나네요  ,신경외과
제가 숨이 안쉬어져 답답할때 하품을 너무많이해요,숨이 너무 답답하고 호흡을 해도 뭐가 꽉 막힌 느낌  이럴 때 숨을 쉬다가 자연스럽게 하품으로 이어지는데 왜그러죠 ,신경외과
밤되면 왼눈이랑 왼쪽 편두통이 있어요 왜그런거죠 ,안녕하세요 몇주 정도 두통이 있는데 종일 아프진 않구요 보통 새벽쯤 되면 그래요 왼쪽 눈알이라하나 그부분이랑 그 근처 머리가 아픈데여 좀 세게 누르는 듯 욱신거리는 두통이에요 못견딜정도는 아닌데 좀 불편하고 짜증나는 정도입니다 왜이런건가요,신경외과
손에 힘빠짐,고 여고생인대요 원래 일년에 한두번씩 오른손으로 글씨 쓰다가 힘이 빠져서 연필도 제대로 못 잡는 경우가있었거든요 그땐 한번 그러고 손목 스트레칭 해주거나 시간이 지나면 괜찮아져서 신경 안썼는데 몇일전부터 연필 잡을 때마다 계속 그래서 글씨를 도저히 쓸 수가 없어요    제가 오른손잡이라 왼손은 잘 모르겟고     아무튼 그래요 왜 그런걸까요  근데 지금은 또 가만히 냅둬도 양손다 저린다는 느낌이 확 들어요  만약 병원을 가면 정형외과를 가야할까요 신경외과를 가야할까요  ,신경외과
코로나 증상으로 얼굴 왼쪽 특히 두통이 좀 지속되는데요  ,현재 집에서 격리중인 상태인데요  고열  근육통  오한 이런 부분은 괜찮아졌는데 얼굴 왼쪽라인에만 문제가 있습니다  목도 왼쪽 편도부분이 좀 아프고  왼쪽 눈두덩이하고 코밑에 발진도 생겼는데 약간 부은 느낌도 들어요  지금 가장 불편한건 왼쪽 눈썹 위 이마부분하고 좌측 이마쪽 부분 미세한 두통이 계속되는데요   특정 부분을 지긋이 누르면 약간의 통증이 느껴집니다  꼭 어디에 부딪힌 것처럼 누르면 아파요    경증의 경우 별다른 치료를 하지 않는걸로 아는데 이런 두통은 어떤 부분이 문제가 생겨서 아픈건지요    그리고 신경외과나 이런 곳에서 진료를 받을 수 있나요   생활을 수행할 수 없을 정도의 통증은 아니지만  계속해서 지끈지끈한게 머리가 무겁고 신경이 쓰여요 ,신경외과
근육떨림 제발 읽 어주세요   ,저 예비 중삼인데 작년이맘때부터 발가락이 조금 떨리기 시작하더니 온몸으로 퍼져서 지금 전신근육 꿀렁이고 부위는 배 머리 발 다리 팔 허벅지 종아리 발가락 엉덩이 손가락 등 눈 등 전신 떨려요 그리고 제가 건강염려증이 진짜로 심한데 진심으로 너무 힘들고 스트레스를 많이 받아서 지금 몇일 째 잠도 못자고 있어요 지금도 새벽 시네요   진짜 너무 우울해요     솔직히 작년에도 스트레스 정말로 여러가지 일 때문에 정말로 매일 미친듯이 받았었고  년째 행복하지가 않아요 제발 정성스럽게 답변해주실수있을까요    귀찮고 힘드신거 아는데 저한테는 진짜 너무 심각한 일이라서요       이런 증상이 루게릭이나 파킨슨 병 외에도 이런 증상이 나타날수있나요  마그네슘도 먹어보고 비타민 d도 먹고 그냥 영양제 다 먹어봤는데도 이래요  년째 떨리는건 영양제 문제가 아닌 것 같고 제가 피검사 했을때도 다 정상으로 나왔었는데 진짜 너무 불안해요    그리고 근전도 검사를 했을때 부작용도 있다는데 부작용은 어떤 부작용이 있나요  근전도 해서 더 안좋아질수도있나요  진짜 저 최대한 제 선에서 정보를 엄청 찾아보는데  제대로 된 정보가 하나도 옶네요     한번만 정성으로 답변 부탁드려요          ,신경외과
하지정맥류 의심,일단 제 다리가 이상해진지  년 가까이 된 것 같습니다  처음엔 뭉친 느낌이 들고 저리고 그래서 어 며칠 지나면 사라지겠지 했는데 계속 이어지네요   대표적으로 일단 다리가 너무 뭉친 것 같고 그냥 저려요 허벅지에 피가 다 쏠린 것 같아요  그래서 기지개를 피면 개운한 느낌은 드는데 개운한 느낌만 들고 상태는 여전히 뭉친 느낌이에요 그리고 앉아있을때 심해지는데 몇분 앉아있으면 엄청 불편하고 다리를 피고 싶고 답답해요 앉았다가 일어나면 뭉친게 더 심해집니다  양쪽 다리 다 심하고 허벅지만 붓습니다 앉아있을때 허리 통증도 조금 있습니다 누워서 다리를 들면 개운해지는 느낌이 있지만 내리면 돌아옵니다   이게 하지정맥류 인가    생각했는데 밖으로 혈관 돌출같은 형태는 보이지 않아 병원에 갈까 고민하다가 여기 남깁니다  어떤 느낌이냐면 허벅지에 피가 잔뜩 쏠린 느낌  엄청 뭉친 것 같고 걸어다니는 것도 귀찮을 정도로 피로를 느낍니다  허벅지에 피가 뭉친 것 같아 종아리를 만져보면 뭔가 감각도 둔해진 것 같고 종아리가 엄청 맨들맨들해요 내 다리가 아닌것 같이  평소 종아리는 그대론데 허벅지만 많이 붓는 편이고 발바닥 발목 발등 쥐가 많이 납니다   더 질문하실거 있으시면 하셔도 됩니다  병원에 가야 한다면 바로 가보겠습니다  키     몸무게      살 학생입니다,신경외과
목 경추  염좌 소염진통제 복용 관련 질문,얼마 전에 고개를 잘못 젖히면서 뚜둑 소리가 나더니 그 담날부터 뻐근함과 함께 약간의 통증이 심하여 통원하면서 물리치료와 소염진통제  일치 를 처방받았습니다   그런데 혹시 디스크나 다른 문제가 걱정되어 타 병원에 엑스레이 촬영 겸 추가로 처방은 더 받았는데요  엑스레이 상에는 특이사항은 없다고 진단은 받았습니다만  필요시 정밀검사 받아보라고 권장은 하시더라구요  지금 첫 병원에서 받는 약은  일째 복용중인데 딱히 호전이 보이지는 않아서 그런데  추가로 처방받은  일치를 더 복용을 해도 문제가 없는지 걱정돼서 질문드립니다 약종류는 당연히 다릅니다만 두번째 병원에서는 근육이완제를 추가로 처방해서 주셨습니다  그리고 다친 정도에 따라 경중은 다르겠지만 회복이 많이 오래 걸릴수도 있나요   일째긴 한데 전혀 호전이 안되네요 ,신경외과
거북목 디스크 신경압박 장애,거북목이랑 디스크 신경압박 장애에 좋은 스트레칭이나 운동 알려주세요,신경외과
근육통인지 신경통인지 잘모르겠네요,안녕하세요 공부하는 학생인데요 어제 평소보다 글을 많이 쓰는 공부를 했는데 빨리끝내야겠다는 생각에 긴장을 하면서 글씨를 썼는지 어젯밤부터 어깨에서부터 손목까지 아픈데 어깨에서 손목으로 갈수록 통증이 심하고 팔 접히는 부분도 많이 아프네요  전체적으로 팔에 피가 쏠려있는 느낌인데 손에 힘도 잘 안들어가고 고생입니다  어떻게 해결해야될까요   내공    이요    ,신경외과
목디스크 군대,제가 병원에서 mri를 찍고 목디스크 판정을 받았는데요 목디스크 일자목이라고 말씀을 해주시더라구요 거기다가 신경이 눌려서    왼쪽 검지손가락과 엄지손가락이 마비가 왔다고 말씀하셨습니다 확실히 다른 손가락에 비해 힘이 없구요 추워서 손이 얼었을때는 손가락을 거의 움직이질 못합니다 제대로 누르지도 못함  이게 검지랑 엄지가 심하긴 한데 왼손 다른 손가락들도 힘이 없긴 하더라구요 잠을 잘때도 왼쪽 날개뼈쪽과 목이 너무 불편해서 통증을     분간 호소하며 뚝 소리를 계속해서 내다가 겨우 잠듭니다 계속해서 목을 움직이고 날개뼈에 무리를 주는 느낌  군대가서도 너무 불편할까봐 걱정인데 혹시 이런 증상으로 공익판정을 받을 수 있는지 궁금합니다 ,신경외과
잠을 잘때 견갑골  골반이 아파요, 개월 전에 어느 순간 자고 일어났는데 내가 느끼기에 등이 무너진것 같은 느낌이 있었어요     그후 부터는 누워잘때 보통은 허리가 아치 모양으로 손이 들어갈 여유가 있는데      저는 누우면 어깨  등  허리  엉덩이가 다 바닥에 붙어 있고 그러다  보니 견갑골 부분이      불편함을 느껴 잠을 잘수가 없어서 몇시간씩 뒤척이다 지치면 잠듭니다      누우면 어깨  등  허리 엉덩이가 바닥에 딱 붙으니 견갑골 이 변형이 된것 같으면서 자고     일어나면 양팔꿈치도 압박을 조금 받고 특히 양손은 아침이 되면 마비된것 처럼 굳어있습니다      일어나서 일상생활하면 자연스럽게 풀립니다      누우면 어깨  등  허리 엉덩이가 바닥에 딱 붙으니 허리 아래 엉치 또는 골반이 신경이 눌린다는      느낌으로 잠을  못잡니다   처음에는 견갑골 통증을 많이 느꼈는데 지금은 골반까지 통증을 느끼고 가끔 자고나면   무릅통증도 느끼는데 일상생활을 하면 무릅통증은 없어집니다   자고 일어나면 엉덩이 골반  손마디도 다 괜찮아 지는데 견갑골은 여전히 통증을 느낍니다   목에서 꼬리뼈 까지 척추 엑스레이를 찍었는데 특별한 문제는 없습니다   전체적인 몸상태는 현재 헬스를 하고 있는데 몸은 유연해서 무리없이 하고 있는데 아무래도  견갑골 문제 인것 같은데 무슨 검사를 받고 어떻게 하는게 좋을까요     나이는   대 초반 입니다  ,신경외과
근육 튐  근육 떨림  동영상첨부 ,동영상에 희미하게 보이듯이 말그대로 근육이 떨 려요    허벅지  발  손  엉덩이부근 등등 전신에 근육이 조금씩 떨려요 긴장 많이하면 눈 밑이나 눈 위 근육도 떨리구요  빈도가 아주 심한건아니구 가끔씩 어떤날은 왼쪽엉덩이 근육이 두근두근  떨리는게 느껴지고 어떤날은 허벅지쪽이 그러거든요 그것도 딱 몇초만요   무슨 병이 있는건가요  신경과 가봐야되나요    대 후반 여자입니다  Loading                  화질 선택 옵션,신경외과
왼쪽 옆구리가 시려요,  세 주부입니다 왼쪽 옆구리가 시려요 심하면 왼쪽 등으로도 시림이 올라가요 무슨 병이며 무슨 과에 진료를 받아야하나요,신경외과
흉추 MRI 판독좀 부탁드립니다,몇년전에 찍은 MRI사진상 흉추에 검은색으로 나타나는 부분이 의심돼서요 뭔지는 모르겠는데 그당시 의사선생님은 불편함이없으면 그냥 살라고 하셨는데 요즘들어 가슴 명치부위 목 바로밑 등통증및 복부부위 통증이있고 숨쉴때도 명치부위 갈비뼈가 아픕니다 혐심증으로 작년에 스텐트시술을 해서 약물을 복용중이고 시술한부분을 재검사했는데 시술은 잘됐다고 합니다 통증이 계속되는것은 아니고 협심증처럼 참기가 힘들고 겨드랑이 땀도 흥건할정도로 날때도있고 양팔을들어 일을할때 심장이 덜컹하듯이 숨쉬기가 힘들었으며 목을 좌우로    cm 흔들면 약간어지럽습니다 통증이있을때 명치부위 뼈늘 누르면 아픕니다 목을 한쪽으로 젖히면 등에서 인대가 끊어지는듯한 뚜두드득 소리가 납니다,신경외과
자가격리 기준, 차    일 정도 된 상태에서 확진자와 밀접접촉한 후에  차를 맞고 확진자가 확진판정이 난 경우 자가격리 면제인가요 현재  차를 맞은사람들과 마찬가지로  주일 격리인가요   이해하시기 쉽게 타임라인을 그려보자면   지인 과 밥먹음     차를 맞음    지인 이 확진 판정이남,신경외과
자폐증 기절,자폐증 있으면 소음 때문에 시끄러워서 기절할 수도 있나요,신경외과
 시  분쯤인가 누워게임하는데잎술밎 옆쪽턱에서 쥐난다고해야하나그런느김이나고그레요 왜그런거죠 , 시  분쯤인가 누워게임하는데 잎술밎 옆쪽턱에서 쥐난다고해야하나그런느김이나고그레요 왜그런거죠  그리고 시 분쯤에 누워서있고억게랑목뒤 뒷통수가벽에대고있고 움직엿는데 턱 머리에서쥐나는느김인고그레요,신경외과
손바닥 혈관이 부은것같은데요,위치는 엄지손가락 연결된부분 손바닥쪽이에요 육안으로도 부은게보이고요   통증이있어요   왜이런걸까요 ,신경외과
머리 뒤에 혹이 났는데   증상 확인 부탁드려요,머리 왼쪽 뒤에 혹이 있어요  언제 생겼는지는 모르고  오늘 머리를 감다가 발견했어요  궁금해서 동생한테도 물어봤는데 오늘 아침에 머리를 감다가 자신도 그 사실을 알게 되었다고 하네요  혹이 아니라면 아닌거지만  너무 아픈걸요    누를 때만  무슨 증상인지 아시는분   ,신경외과
무거운 짐 들었을때 손 찌릿,  중반 저희 어머니 얘기입니다  무거운것을 많이 나르고 손을 많이쓰는 자동차 생산공장에서 일하시는데 무거운걸 들다가 오른손이 찌릿하더니 힘이 죽 빠졌다고 하시더라고요   파스같은걸 붙이긴하셨는데 어떤병원을 가야할지  어떤 질병이 예상되는지 의사선생님의 의견을 듣고싶습니다  ,신경외과
코로나인지 편도염인지 궁금합니다,밀접접촉자입니다  그저께부터 침삼킬 때 목이 너무 아픕니다  코도 조금씩 막히는 거 같습니다      오후 자가진단 키트 음성     PCR 검사      오전 PCR 음성      오후 자가진단 키트 음성      오후 자가진단 키트 음성  떴는데도 오미크론 의심해봐야될까요    주변에 확진자가  명이 생겨서,신경외과
