0,1,2
발등부음 통증,동그라미 친 부분 발등이 엄청 붓고 걸을때 통증이 심해요    매일 헬스 런닝머신         빠른걸음  시간  분 하는데 그게 문제일까요 뼈에 금가거나 다친적은 없어요 병원가봐야되나요    ,신경외과
제가 지금 현역군인인데 사고난뒤 수술했는데 팔길이가 다르고 통증이계속 지속되고 팔이 계속 저리고 아픕니다 일상생활하는데 많이 불편해서 다시 재검,제가 지금 현역군인인데 사고난뒤 수술했는데 팔길이가 다르고 통증이계속 지속되고 팔이 계속 저리고 아픕니다 일상생활하는데 많이 불편해서 다시 재검을 받으면 공익으로대체할수있는지 궁금해서 올려봅니다 그리고 장애판정을 받을 수 있습니까 ,신경외과
모더나  차 맞고 소염 진통제,오늘 모더나  차를 맞았습니다 근데 제가 손목관절염 adhd 우울증때문에 휴로펜정   뮤코라민정  스트라테라캡슐  mg 푸록틴캅셀  mg 명인염산부스피론정을 먹어야하는데 백신 맞고 이 약들을 먹어도 상관 없을까요  ,신경외과
신경외과 약 질문,제가 신경외과 진료 받고 약을 먹었는데 두통이나 어지럼증이 있는데 원래 이런가요 ,신경외과
머리가 아픈데,요새 어깨가 많이 아프고 학원 나 공부하면 고개 숙이니까 더 아팠는데 오늘은 두통까지 오더라고요 지금 아빠나 오빠가 안마해줘서 조금은 나아졋는데 다시 고개 숙이고 하면 아파질거같은데 어떻게 해야하나요 보호대 같은거를 차야하나요  ,신경외과
이상근 증후군  좌골 신경통  질문 드려요,오른쪽 다리 통증 관련 질문 드립니다   통증이 있는지는 사실 꽤 오래 됐는데 최근에 통증이 심해져서 질문 드려요   우선 거의 매일 있는 통증은 종아리가 전반적으로 당기는 느낌이 있고 발목 바깥   복숭아뼈 아래쪽 이 항상 아픕니다  그리고 조금 무리해서 걸었다 싶으면 엉덩이 바깥쪽에 심하게 통증이 있고 앉았다 일어날때 고통스러운 순간들이 있습니다   원인이 무엇일까요    그리고 정형외과에 가야하나요  신경외과에 가야하나요  보통 치료는 어떻게 이루어지는지도 궁금합니다 ,신경외과
허리디스크 신경차단주사 맥주,허리디스크 신경찬단술 을 받고 하루정도 지났는데 맥주반병을 마셨습니다 맥주마신게 독이될까 걱정입니다 맥주마신게 큰 영향을 줄까요   ,신경외과
왼손 엄지손가락이 저려요,    금  백신  차 접종을 했는데요  백신  차 접종 이전에 왼쪽 목과 어깨 근육통의 느낌이 조금 있긴 했습니다   차 접종 이후     토  몸살기운과 무기력증 때문에 좀 오래 누워있었는데요  그 후     일  몸살은 사라졌고 어깨 근육통이 남아있길래 주말에 하는 한의원을 찾아서 침을 맞았습니다  전날 오래 누워있다보니 허리도 뻐근해서 왼쪽 허리와 왼쪽 목  어깨로 연결되는 부위까지 침을 맞았는데요  침을 맞고나서 다음날     월 이 되니 고개를 왼쪽으로 숙이면 왼쪽 팔꿈치와 어깨 사이의 근육을 찌르는 듯한 고통이 느껴졌습니다  하룻밤 자면 괜찮아지겠지 했는데 다음날     화  여전히 아파서 오전에 반차내고 정형외과로 갔습니다  정형외과에 갔더니 경추     사이 디스크가 많이 눌려있다고 하더라구요  그런데 제가     년에 찍었던 엑스레이와 비교를 해봤는데요  제가 보기엔 큰 차이가 없어 보입니다  사진을 확인해주세요    왼쪽     년  오른쪽     년  그 후 정형외과 선생님께선 디스크 눌림에 의한 통증으로 판단하셨는지 제 왼쪽 목에 구멍  개를 뚫으시고 신경 주사를 넣어주셨습니다  그리고 전기 물리치료를 하고 다음날      수  왼손 엄지 손가락 저림이 생기기 시작했습니다  시작은 그냥 살짝 저린 정도였는데 시간이 지날수록 마비가 오는 듯이 저림이 강하게 느껴집니다       목  정형외과에 다시 방문해서 엄지 손가락이 저린것을 말씀드렸는데 좋아져야 하는데 이상하네요   라는 말과 함께 지난번 치료와 똑같은 치료를 받았습니다  그 후에도 낫지 않으면 다음주      월 에 재방문해달라고 하는데요   이거 이렇게 나을 수 있는건지 모르겠습니다   정확한 병명을 찾기가 당연히 힘든건 알고 있는데요   차 접종에 의한 이상 반응인지   목 디스크 눌림에 의한 문제인지  단순 근육통 또는 잠버릇이 잘못되어 발생되는 문제인지 베개도 바꿔보고  스트레칭  운동도 많이 해봐도 잘 안낫습니다   이 문제로 누워서 잠 들기가 무섭습니다  베개를 바꿔도 잘때 턱이 가끔씩 당겨져서 근육통이 생기거든요     어떻게 해결할 방법이 없을까요 ,신경외과
요즘 낮잠을 자면 꿈에서 정신을 잃고 가위에 눌린다거나 갑자기 삐 소리가 나면서 두통이 생기는데 왜그런지 알 수 있을까요 ,요즘 낮잠을 자면 꿈에서 정신을 잃고 가위에 눌린다거나 갑자기 삐 소리가 나면서 두통이 생기는데 왜그런지 알 수 있을까요 ,신경외과
과음후  틀후 근육통,과음하고  틀뒤에 근육통이 심합니다  한  년정도 된것같고 술먹고 다음날은 회복하느라 괜찮고 다음날은 멀쩡한데 저녁정도부터 극심한 근육통에 시달립니다 관절마디마디가 아프고 손을 들기 힘들정도로 아픕니다 일어나는거 조차 관절이 아프고 손가락 마디마디까지 아픕니다  왜 이런증상이 계속 발병하며  어떻게 어디가서 치료받아야 하는지  왜 그런건지 궁굼합니다,신경외과
오른쪽 팔 통증  ,오른쪽 팔을 일어나서 피면 찌릿찌릿한 통증이 와서 미치겠습니다   ,신경외과
며칠전부터 오른쪽 종아리 알부분이 눈주변 경련 일어나듯이 자꾸 팔딱팔딱 뛰어요 몇초간 그러다가 멈추고 또 그러다가 멈추고 떨리는 횟수가 날이 갈,며칠전부터 오른쪽 종아리 알부분이 눈주변 경련 일어나듯이 자꾸 팔딱팔딱 뛰어요 몇초간 그러다가 멈추고 또 그러다가 멈추고 떨리는 횟수가 날이 갈수록 더 잦아지고 있어요 별 다른 증상은 없는데 왜 그럴까요 ,신경외과
얼굴이나 몸을 긁는데 시원함이 안 느껴짐 남을 긁는 느낌,얼굴이나 몸을 긁는데 시원함이 안 느껴져요 약간 남을 긁는 느낌이랄까   왜 그런걸까요     척추측만증이 있는데 그거랑 관련이 있을까요,신경외과
새끼발가락 통증, 월  일쯤에 새끼 발가락을 나무 선반에 박았는데 아직도 통증이 지속됩니다   멍이랑 부기는 없는 것 같고 통증만 있는데  병원은 안가도 될까요 ,신경외과
발등과 발목 사이인데 뼈조각이 제거해야되나요,발목 보다는 발등에 조금가까운위치라고 하는데  오른쪽 동그라미 입니다  X레이를 찍었는데 뼈조각이 있습니다  이거꼭 제거해야되나요   심하게운동하거나 다치거나한적은없고  다리가 자주 삐거나하고 했습니다  최근 일주일전부터 발목이 시리고 해서 별문제없을것같았는데 이젠 침대에서 첫발디딜때 아니면걸을때 통증이 옵니다  소염제 등을 타서오긴했습니다  나두게되면 큰문제생기나요   그리고 왼쪽동그라미는 활동하면 계속 쌓이고 뼈제거할때 저부분을깍으면 발이 좀더 잘돌아간다고했습니다 ,신경외과
간지러워요,안녕하세요 뭐에 물린거 같아요  택배 뜯은 이후로 발등  발목 부위가 엄청 따갑더니 간지러워요 전체가 그런건 아니고 사진 속 부위와 발등 한 부위만 그래요 사진에는 간지러워서 긁었더니 저렇게 되었고   어제사진이며 증상느낀지  일 정도 되었습니다 발등에는 파인거처럼 작게 되어있고 주변에 붉게 부어올라있어요 처음에는 작게 물집 잡혀있고,신경외과
처방받은약 약명을 알수있을까요 ,다이어트약을 이번에 처방받았는데 약명은 안써있고 효과만 써있어서 그러는데 약명을 혹시 그림만 보고 알수있을까요 저 근데 저렇게 먹는게 무리인가요 한달에서 두달정도 먹으려고하는데  다이어트약부작용도 심하다고하고 치매전단계까지 갔다는분도 계시고 사망했다는 기사도 보아서요     달 정도는 괜찮을까요 ,신경외과
다리통증     ,안녕하세요  진료문의 드려요  제가 작년   월 말부터 현재까지 왼쪽 다리가 뻣뻣해지고 땡겨서 구부릴 때 통증이 있고  쪼그려앉는 동작은 아예 안 돼요    처음에는 그냥 피곤한가보다 하고 지냈고 한달이 지나도 똑같아서 집 근처 정형외과에 방문했는데 허리  무릎  다리 다 괜찮다고 하셨고 근이완제랑 진통제만 먹었고 호전은 되지 않았습니다  그러다가 혹시 하지정맥류인가 하는 의심이 들어서 하루종일 서서 일하는 직업입니다  하지정맥 전문으로 하는 병원에 갔는데 하지정맥 증상이 아니라고  혈관초음파 안해봐도 된다고 해서 안했음  마취통증의학과를 추천해서 진료를 보러 갔고 거기서도 엑스레이를 많이 찍었는데 아무 이상 없다고 근이완제랑 진통제를 줬어요  현재 증상은 전혀 호전되지 않았어요   참고로 왼쪽 다리는 누워있거나 좌식 의자에 앉아서 다리를 쭉 펴주면 훨씬 나아져요  일 시작하고 한시간쯤 지나면 다시 통나무처럼 변하구요    어느과  어떤검사가 필요한지 좀 알려주세요  거의  개월 가까이 이러니까 큰병일까봐 너무 무섭네요      ,신경외과
팔베개한 후,제가 팔베게 몇분했는데 빼보니깐 저린느낌이 아주 살짝 있고 차가운느낌  아무튼 그 느낌이 나요 지금은 아까보다 덜 해요,신경외과
꼬리뼈 고관절 요추 둔근 통증,현재 군 복무를 하고 있는데  년 전부터 통증이 시작됐습니다  처음에는 꼬리뼈가 앉을 때 일어날 때 통증이 기침할 때 통증이 심해서 도수치료를 받고 조금 나아진 상태였는데 군 복무를 하는 도중에 더 증상이 악화가 되면서 다리를 안 쪽이나 바깥쪽으로 벌리면 관절에서 소리가 나면서 통증이 생기고 오래 앉아있으면 꼬리뼈 요추 통증이 생깁니다 그리고 엉덩이가 쉽게 뻐근하고 저려오고 요추나 옆구리 쪽이 저립니다 무슨 증상인지 알 수 있을까요   허벅지는 가끔 저립니다,신경외과
코로나 화이자 백신  차맞았습니다   ,지금 정확히 화이자  차를 맞은지 일주일 정도가 지났는데 아직도 아파죽겠네요 외부적으로 몸에 다른 이상은 없는데 몸전체에서 열이나고 어지럽고 머리는 계속 아프고 목도 엄청 붓고 식은땀도 엄청나고 팔은 한번도 안아팟는데요 백신맞고 일차는 아무이상없다가    일차까지가 너뮤 힘드네요    왜이럴까요,신경외과
눈통증 시야혼탁 후 머리가 터질듯한 통증,최근   월부터  월까지 거의 매일 야근을 해서  아침  저녁 시반까지  금요일은 새벽퇴근을 하면서  연말 연초에 바쁜일을 처리하느라 피곤하고 스트레스 받긴했지만 그 정도일 거라 생각했는데   몇일전 금요일      분 새벽퇴근하고 토욜날 아침 시에 회사전화와서 받앗다가 깨서  폰을 보다가 새로 시작하는 드라마 연예인 포스터가 떠서 단체사진 중 한 사람 얼굴 잘 안보여서  확대를 해도 또렷하게 안보여서 이상하다카고 다시 자자하고 자고 일어 났는데  갑자기 눈알 뒤가 너무 떙기고 아프고 무거워서 따땃한 물로 샤워를 했습니다   보통은 샤워하고 나면 좀 통증이 사라져서요    그런데도 뒷목땡기고 두통도잇고 머리속이 막히거나 피흐르는 것 같은  갑갑하고 답답한 느낌 느낌입니다   이들어서  그래서 토욜날 한의원 안과갔는데   한의원에서는 야근으로 인해 눈을 너무 많이쓰고 안 쉬어줘서 그런 것 같다  안과에서는 다양한 검사와 사진을 찍고 의사선생님 진료 후 시신경검사까지 했는데 둘다 이상이 없다고 그랬습니다  그리고 밖을 좀 돌아다녔더니 괜찮아져서 집에와서 다시 폰 노트북영상을 엄청보다가  일욜밤에는  전날 토요일보다 더 큰 부분이  눈에 안개낀듯이 뿌애서 더 안 보여서 그래서 어떻게 뭘 할수없어서 억지로 잘라고 누웠는데 잠이안와서 그래도 자야지 낫겠다싶어서 불끄고 눈감고 버티다가 머리진짜 터질듯이 아팠습니다   그런데 버티다보니 잠들어서 중간에 다시깼는데 너무 아파서  머리가 터질거같다 미쳤다 어떡하지    불러야되나 아 어떻게 하지   하고 눈 감고 버티다 잠들었는지 아침에는 미세한 머리 윗쪽 두통만 있고 괜찮습니다  앞으로 또 이런일이 생길까봐 두려운데 어떻게 해야될까요  안과에 이상없다고 하면 신경과  중풍전문병원  그런 곳을 가야할까요      어떤 병원에가서 어떤 진료 검사를 받아야 할까요     왜 이러는 걸까요  ,신경외과
여자도 목뼈 튀어나오나요 ,제가 여잔데 남자처럼 목 가운데에 뼈가 튀어나와있어요 정상인가요  ,신경외과
뇌진탕 증상인건가요 ,전동 킥보드를 타다가 급브레이크를 밟아서 넘어지게 되면서 뒤통수를 바닥에 박았는데 혹이 좀 나고 누워있을때 고개를 왼쪽으로 돌리면 정말 심각하게 어지럽습니다,신경외과
뒷통수 통증 뇌mri   경추ct  ,뒷통수쪽이아파서 조영제넣고 뇌ct촬영시 특이소견없고 목디스크가 관찰된다는데 그럼 뇌mri보다 경추ct를 찍어보는게 좋겠죠  아니면 건강검진목적인데 두통아니더라도 뇌는 한번 더 찍어보는게 좋을까요      번중에 어떤게 좋을까요   경추ct  경동맥초음파  관상동맥mdct  동맥경화검사   뇌mri나mra  나머지는 동일,신경외과
오른쪽 귀 통증 뒷통수 통증,안녕하세요 저희 엄마가 올해   세신데 요즘들어 갑자기   침 삼킬 때 오른쪽 귀 속이 같이 뜨끔뜨끔 거리며 아픔    오른쪽 뒤통수가 아픔 이렇게 두 증상이 나타나신다고 하시네요 왜 그러시는걸까요 ,신경외과
수전증 뇌심부 자극술 관하여,안녕하세요   저희 어머니 연세가 올해   인데 수전증으로 몇년 동안 약 드셔도 안되서 뇌심부 자극술로 수술하려고 합니다      연세가   이신데 수술 위험하지 않을까요     수술 비용은 의료 보험이 적용되는지요  된다면 얼마나 나오나요     뇌심부 자극술 부작용은 없나요     어느 병원이 잘 하는지 추천 부탁드려요  참고로 인천에 살고 있습니다      기타 필요한 조언 부탁드려요   감사합니다,신경외과
인대골화증 과 파킨슨병 질문 합니다 ,저희 아버님이  년전에 파킨슨병 진단을 받았습니다 걸음걸이가 이상해지고 자주 넘어지셔서 검사를 받았는데 파킨슨병이라 진단을 받고 약을 복용하고 계십니다  그러던 중 지난주에 걸음걸이가 더이상하다고 mri를 찍었습니다 병명은 인대골화증 이라고 합니다   그럼 이게 파킨슨병이 아니고 인대골화증인데 그쪽 병원에서 파킨슨병이라고 한게 아닌지 의심이 되는 상황 입니다 병원은 종합병원 입니다   이런경우도 있을까요  답변 부탁 드립니다 내공     겁니다,신경외과
오른쪽귀뒤통증,오늘낮에 목잠김과 귀뒤쪽이 욱씬거리고 너무아파서 병원가서 진료후 처방받은 약도 먹었는데 지금도 너무 아픕니다   진통제도 들어 있다고 했는데 먹어도 너무아픈경우 집에있는 진통제를 추가로 더 먹어도 될까요  너무 아파서요 ,신경외과
어지럽고 온몸이 떨리고 토할거 같아요,갑자기 몇시간 전부터 토할꺼 같았는데 갑자기 온몸이 떨리는 거에요 수전증 처럼 일어날때마다 어지 럽고 토할거 같은데 이게 갑자기 뭔 증상이죠  ,신경외과
코로나 백신 증상 손가락 마비,제가 어제  시에 화이자  차를 맞았거든요 그런데 어제는 하나도 안 아프고 오늘 아침에 일어나니까 머리도 아프고 열 나고 그래서 몇 시간 동안 누워서 티비 보고 자고 티비 보고 했는데 방금 일어났거든요    그런데 엄마 아빠 소리 듣고 일어난 거였는데 백신 맞은 쪽 네 번째랑 다섯번째 손가락이 안 움직이는 거예요    만져봐도 오른손만 느낌 있고    그래서 손 계속 움켰다 풀었다 하니까 지금은 조금 새끼 손가락만 아파요    아침에 왼쪽 손이 좀 파랗기도 했어요    괜찮은 거 맞나요    ,신경외과
밥먹고 바로 눕기,안녕하세요 밥 먹고 바로 누웠다가 일어났더니 배가 너무 아팠어요 근데 다시 누우면 안 아파져요 어떠한 증상일까요 ,신경외과
항히스타민제 어지러움 멍함 머리 무거움,요 며칠 사이에 머리가 무거우며 멍하고 뒷목이 뻐근하며 뭔가 붕 떠 있는 느낌  사고력과 기억력이 떨어지는 느낌이 지속되고 있습니다 찾아보니 브레인포그 증상과 비슷하더라구요  대상포진 때문에 항히스타민제를 일주일 정도간 복용했는데 이게 원인일 수 있나요   아니면 최근 들어 비오틴 비타민b 엽산 영양제 비타민 d 비타민 c 홍삼 유산균 을 챙겨 먹기 시작했는데 이 중에 원인이 있을까요   만약 항히스타민제나 복용 중인 건강보조식품이 원인이라면 복용을 중단하면 증상이 회복될까요 ,신경외과
응급실 뇌졸중 뇌경색 골든타임 재활치료,아버지께서 뇌경색 초기 증상으로 골든타임 지켜 응급실 방문하였는데 한 시간이 넘었다면서 혈관을 녹이는 주사는 급여하지 않고 Ct 및 mr 필요 촬영 다하시고 괜찮으시다고 약 처방받고 돌아왔다가 자고 일어났는데 아침에 너무 증상이 심해진듯하여  다시 응급실 방문 후 한 시간 정도 대기하다가 다른 MR 을 찍으시고 뇌경색 관리 병동으로 입원하셨습니다 주말 및 코로나 여파 때문에 응급실에서 대기하는 시간이 많아 두발만 동동 굴렀네요     지금은 말씀이 어눌하시고 두손벌려 다리벌려 다리들고 버티기 왼발 및오른발로 교체하면서 뒷굼치 로 정강이 쓸어 올리기 등 문제없이하십니다   다만 오른팔 왼팔 들어주세요 할떄  손을 들지않고 다리를 들어서 걱정이 큽니다      응급실에서 대기를 오래해서 그런건지 걱정 이되네요     이후 뇌경색 병실이 입원을 하셔서 월요일 담당 교수 회진만 기다리고 있습니다 그동안 저는 사진 쓸 수 있는 노트 쥐었다 폈다 할 수 있는 공을 드리고 종종 시간별로 전화 하여 통화는하는데 말씀이어눌하셔서 마음이 아픕니다    이렇게 문의 글 남겨요      지금부터 재활치료병원을 알아보고 예약을해야하는지  기존대학병원에서 더큰병원으로 옴겨 더 입원을 하셔야하는지      의사분들 판단이 저희 보호자들보다 당연한 정답이겠지만 보호자 입장에서는 응급실 가니 당직 인분들이 있는 건지 죄다 인턴분들만 있는 거 같고 소리치고 난리 쳐야 그때서야 와서 좀 봐주는 거 같고 제가 멍청해서 더 안 좋아지신 거 아닌가 뇌졸중 전문 병원에 빨리 전화해서 시술 준비를 해놓고 그런 병원에 갔어야 하나 하고    죽겠습니다 꼭 좀 도와주세요 좋은 음식이나 아니면 앞으로 나아가야 할 방향을    ,신경외과
허리가 아파요,안녕하세요 저는 전에도 가끔 집 시람과 잠자리 한후 허리 왼쪽 신장부위가 아프더라고요 근데 요즘 이틀전에 허리가 앉으나 서나 너무 아파서 병원 가서 사진도 찍고 CT도 찍은후 의사 선생니이 말씀하시기를 디스크는 괜찮다고 하시면서 소염진통제를 처방해주시더라고요 이틀 약을 복용후 진통은 많이 사라졌는대 아직도 신장부위쪽에 가끔씩 진통과 꾹 꾹 찌르는 느낌이 드러요 왜서 그런지 궁금하네요 답변 부탁 드립니다    ,신경외과
팔에 힘이 안들어갈때,팔에 힘이 안들어가는데 신경외과로 가야되나요 ,신경외과
척수mri 에 이상한 종,등통증 근육통으로 mri입니다 등척수가 이상한것같아서 전북대는 이상없다고하시고 전주우리들에선 서울로가보라고했는데 봐주세요  ,신경외과
MRI CT꼭 찍어야 하나요  , 개월 전에 공용벤치프레스하다가 어깨 앞쪽이 다쳐서 병원 갔었는데 엑스레이 초음파 검사를 받았는데 정확히 어디부분 어떤문제로 다쳤다 뭐 이런 식이라니라  앞쪽에 미세염증이 있다고 하여 주사치료히고 물리치료 받았고    주 쉬고 다시 운동시작했는데 통증은 없고 앞쪽 어깨에서 충돌소리가 나서 거의 다 나았나 싶었는데 한두달지나도 소리는 계속 나길래 불안하고 계속 이렇게 운동을하거나 할때 걸리적거리고 더 심각해질까봐 고민은 되는데 영상찾아보면서 재활운동하고 있는데 이게 회전근개인지 쇄골하근인지 정확히 어디가 문제인지 몰라서 계속 이렇게 하고 있는데 맞나싶어서 정확히 검사를 받아보곤 싶은데 MRI나CT검사같은 경우는 형편상 비용이 너무 부담이 되서 못하는데 그럼 방법이 없는건가요    엑스레이나 초음파로는 충분히 검사받을 순 없는건가요       월달에 신검받는데 머지않아 군생활하다 어깨가 심해져서 고생할까봐 걱정이에요  ,신경외과
수전증을 전문적으로 치료하는 병원이 있나요 ,안녕하세요   세 남성입니다   대 초반에 간헐적으로 수전증이 있었는데  중후반때부터 수전증 발생 빈도가 잦아들더니 지금은 만성으로 수전증이 생겨 버렸습니다  음식을 먹으려고 숟가락을 들때  물 따를때  업무를 볼때 등 일상 생활에 지장이 생길 정도로 수전증이 너무 심해져서 치료 받으려고 하는데  수전증만 전문으로 치료 하는 병원이 있나요  만약 없다면 신경과로 가야하는건가요 ,신경외과
두통이 왜 이런 건가요    ,머리가 몸보다 떨어지거나 머리에 힘이 많이 가거나 하면 두통이 진짜 오래 가요     그냥 두통도 아니고 완전 지끈 지끈 합니다 코로나  차 백신 맞았구 백신 전에도 그랬어요 그냥 단순히 피가 안 통해서 그런 건가요  아니면 무슨 문제가 있을까요    일상 생활은 괜찮습니다 ,신경외과
가슴 아래 명치 근처 통증,안녕하세요   대 남잔데요 어느날부터 갑자기 상체를 움직이면 가슴 아래쪽 명치 근처에 통증이 있더라구요  지금보니까 그쪽에 몽우리  근육뭉침  아니면 벌레 물린거 처럼 손으로 만져지고 만지면 아프고 움직이면 늘어나서인지 통증이 있더라구요     그리고 이게 원인인지 모르겠지만 가슴쪽에 알 수 없는 멍들이 조금씩 생겼구요  혹시 이게 뭔지 알 수 있을까요  병원은 어느과를 가야할까요  움직일때마다 통증이 심해져서 걱정이 되네요   ,신경외과
얼굴 입가 주변 근육 굳음,저희 외할머니께서 지난 추석에 입가 주변 근육이 아예 굳으셨습니다  입이 살짝 돌아간상태셨고요  근데 하필 추석이라 병원에 가질 못하셨습니다  근데 지난번 설날때 말씀하시는거 들어보니 할머니 친척분  할머니 가족분들중에도 이런 증상을 가진 분들이 종종 계시던데 혹시 유전일까요 ,신경외과
