0,1,2
안면마비  주차인데 차도가 없어요  두달동안 계속 한방병원에서 치료받았는데     살 남아 신촌세브란스 종합병원 신경과 를 지금 가면 늦은걸까요,안면마비  주차인데 차도가 없어요  두달동안 계속 한방병원에서 치료받았는데     살 남아 신촌세브란스 종합병원 신경과 를 지금 가면 늦은걸까요 ,신경과
두통으로 인한 여러 증상이 있습니다  조언을 구합니다 ,약  년전 가을쯤에 자다가 왼쪽눈이 너무 아파서 구토까지 하고  응급실에 가서 진통제 주사를 맞는 일이 있었습니다   그 이후로  년에 짧게는 한달에 두번  길게는 반년 정도 텀으로 한쪽눈이 아프면서 두통이 오는 증상이 있었습니다   다만 이때는 처음처럼 통증이 심하지는 않았습니다   그때마다 타이레놀 두알먹고 잠자고 난 뒤에는 깔끔하게 나았습니다   그런데 지지난주에도 그러길래 똑같이 타이레놀 먹고 잠들었는데 눈의 통증은 사라졋으나 두통이 사라지지 않았습니다   그래서  일차인 지난주 목요일에 병원을 가서 약을 처방받아서 먹고 있는데 두통에서 통증은 많이 나아졌으나 이번에는 좀 어질어질하고 뒷골이 살짝 땡기는 느낌을 받습니다    제가 처방받은 약인데   오페나딘서방정 부루펜정 환인그란닥신정 레바마정  이렇게  개의 약을 처방 받아서  일  번 점심때 오페나딘은 제외하고 먹고있습니다   혹시 이게 약 때문에 어질어질한건지 아님 두통 증상중의 하나인지 잘 모르겠습니다    참고로 살면서 이유없는 어지럼증은 겪어본적 없습니다 ,신경과
뒷목이 두근거리고 불안합니다, 차 백신을 맞고서였나 그외에도 증상이 있는데 발가락이 멋대로움직이거나 몸이 꿈틀거렸는데 이런건 사라지고 왼쪽 발 저림 제목에서 말한 목의 증상이 남아있습니다 백신 맞은지   일이 다되가는데 어디에도 제 증상은 명확히 알 수없더군요 교감신경 항진이라해서 이것땜에 목이 그런가싶기도하고 제 증상은 대체 뭐일까요 주로 목이 그러는데 가끔 심장 어제는 머리가 좀 두근거렸습니다 너무 불안하네요 코로나 광고는 하지말고 의사분들이 답변 해주시면 좋겠습니다,신경과
스트레스 받으면 좌측 눈과 머리가 너무 아파요 편두통인가요  아니면 어디 몸에 문제가 있어가지고 아픈건가요   만약 병원에 간다면 안과를 가야하,스트레스 받으면 좌측 눈과 머리가 너무 아파요 편두통인가요  아니면 어디 몸에 문제가 있어가지고 아픈건가요   만약 병원에 간다면 안과를 가야하나요   어딜가야하나요    머리가 아프기전에 냄새에 예민해진다해야하나   항상 머리 아프기전에 숨쉬면 철냄새  같은거 나고 머리아프면 헛구역질이랑 냄새에 예민해져요 타이레놀 먹어도 나아지는게 없는거같아요  ,신경과
아침에 자거나 누우면 머리가 아픔,안녕하세요 중  학생입니다  제가 고등학교 입시 때문에 요새 생활 패턴이 엉망이어서 아침에 잘 때도 있고 밤에 잘 때도 있고 한데 유독 아침에 졸거나 자면 다시 잠을 잘 때 까지 머리가 너무 아파요  머리에서 누가 북을 두드리고 있는 거 같아요  방금도 자다 일어났는데 너무 아파요    생활 패턴을 바꾸면 괜찮아질까요    만약 머리가 아프면 무슨 약을 먹어야 할까요 ,신경과
루게릭병 의심됩니다,  세 남성입니다  어느 순간 누워 있던 서 있던 온 몸의 근육이 튀어오르고  목소리가 갑자기 잠기기 시작해서 발음이 코로 새고 있습니다  젓가락도 집다가 떨구고        하지만 운동능력의 전반적인 감소는 보이질 않는데 온 몸의 근육이 긴장이 많이 되어있는 느낌입니다  왜 이럴까요    루게릭 병일까요      너무 불안합니다        ,신경과
자율신경계 신경과 불균형,제가 미간쪽이 아픈뒤로 몸이 이상해졋습니다 최근 년동안 몸이 이유없이 안좋아지는 느낌을 받고 다리근육통도 잇고 잠도 깊게 못자는 증세가 잇어 병원을 다녓는데 큰 원인이 나오지않아 찾다 찾다 자율신경 검사를 하게됫는데 매우 불균형 하게 나왓습니다 제가 평소에 눈주위가 좀 아프고 미간쪽이 가끔 아픈데 연관이 잇을까요 자율신경계가 왜 불균형하게 됫을까요 원인이 뭔지 모르겟습니다 스트레스나 화병이 많아서 그렇다는데 그것땜에 그런게 맞나요  어디병원을 가야하고 치료가 가능할까요 너무 힘들어서 일상생활에 무리가옵니다   이제  살인데 너무 힘드네요,신경과
얼굴 왼쪽이 쫌 미세저림 질문드려요,얼굴 왼쪽이 쫌 미세하게 저리고요 심할때 오른쪽도 저림이 느껴지기도 합니다 그리고 손바닥 발바닥 양쪽 다 약간에 근육  연골같은곳 뼈말고요 살있고 인대쪽 있는곳 약간에 통증이 있습니다 신경과랑 가정의학과에서 조영제없는 ct검사 정상 나왔고 혈액검사 심전도검사 소변검사상 모두 정상이였습니다   얼굴저림 뇌나 심장 질환인지 더 검사가 필요한상황인지 손바닥 발바닥 간혼 어깨나 팔근육통 류마티스나 통풍이 가능성있는지 더 감사가 필요한지 알려주세요,신경과
잘때 생기는 두통이 너무 힘들어요,자려고 누우면 이마  머리가 욱신욱신 거리면서 아프고 이마는 차갑게 식어있어요   수면제 먹고 자지 않는 이상 잠을 못잘정도로 아픔  어찌저찌 잠을 자도 중간에 무조건 한번은 깸  잠을 자려해도 몸은 피곤한데 뇌가 깨어있는 느낌이 들고 자다가 중간에 깨면 진짜 머리가 너무 울리고 아프고 너무너무 고통스러워요  이상한게 눈을 뜨고있을땐 안아프다가 눈만 감으면 두통이 심해지더라구요     이게 대체 왜 이런걸까요     ,신경과
너무 많이 자는 것 같습니다, 제목 그대로입니다  너무 많이 자는 것 같습니다  남들처럼  시에 출근하고   시에 퇴근하는 직장인이 아닌 비규칙적인  교대를 하는 직장인입니다  평균 수면    시간씩 자고 싶어도 퇴근하자마자 바로 누워서 잠들고 일어나면  시간   시간씩 지나가져 있습니다  휴무날에는 일어나도 바로 일어나지 않고 다시 잠 들어   시간씩    시간씩   은 자는 것 같습니다  나도 다른 사람들처럼  시간씩만 자면 좋을 텐데    체력이 없어서 그러는 걸까요  그렇다기엔 꾸준히 유산소 운동도 하고 있습니다    그제는      시에 잠들어   시에 일어났다가 다시 잠들어 새벽  시에 일어났고  오늘은 새벽  시부터  시까지 뒤척이다가 어제   시에 일어났습니다  어떻게 하면 고칠 수 있을까요      저희 엄마는 제 의지가 부족한 거라고 하는데 의지가 부족한 걸까요  아무리 유투브에 일찍 일어나는 법을 찾아 보아도 해답을 구할 수가 없습니다 ,신경과
팔다리힘빠짐,삼주 정도 전부터 팔 다리에 힘빠짐 증상이 있습니다  근육이 빠지는 느낌 실제로 체중감소도 있고 얼굴부터 다리까지 근육이 떨리고 튀는 중상도 있습니다  루게릭병을 의심해볼 수 있나요,신경과
편두통 예방약을 끊고 싶은데 바로 끊어도 될까요 ,지금 신경과에서 편두통 예방약으로 토파멕스 아침저녁으로   mg씩 나누어 먹고 저녁에 에나폰  mg 같이 먹고 있어요  먹은지는  달정도 되었는데 이것 말고도 이것저것 먹는약이 많아서 편두통 예방약을 안먹고싶어서요  약을 점차 줄여야 하는 건지 아니면 그냥 중단해도 되는건지 여쭈어 봅니다  만약 점차 줄여나가야 한다면 며칠마다 얼마씩 줄여야 하는지도 알려주시면 감사하겠습니다 ,신경과
왼쪽 이미의 이상 감각,의사 선생님께 여쭙니다  저는   대입니다 왼쪽 뒷목이 기끔식 저릿한 현상이 있는 사람입니다   년에 한 두번 뒷목에서 뭔가 올라오는 듯  혈류인것 같아요 끼루룩 휙 하고 깜작 놀란 적도 잇어요 CT에서는 목부분이 좁아진듯 하지만 별문제 없다고 했습니다  그런데  월부터 뒷목부터 왼쪽머리쪽으로 해서 왼쪽 이마부분의 저릿한 느낌은 있었지만  만져보면 괜찮더라구요    근네 문제는 왼쪽 이마에서 눈쪽으로 무디고 감각이 둔해 너무도 불편합니다 일자목이 원인인가  자세도 바르게 하려고 노력하고 섭생도 신경쓰고 있으나 나아지질 않습니다  뭔가문제인지도 모르고 불편하고 우울하고 집중적이 저도 모르게 떨어집니다  선생님들의 고견을 듣고 싶습니다    월   일 신경과 예약이 잡히긴 했으나 맘이 급합니다  도와주십시요,신경과
추운날밖에나가면 귀 안쪽 머리가 미친듯이 아파요,작년에도 이랬는데 설마 올해도 이럴 줄은 몰랐네요 밖에 나가기가 무서워요 왜 이런 건가요 ,신경과
이명 뇌손상,제가 이명이 있는데 대학병원이랑 한의원 이비인후과 다 가봤는데 이상 없다해서 그냥 계속 이명 가진상태로 지냈는데 최근에 갑자기 큰 삐소리가  분동안 나면서 소리가 잘 안들리고 그런게 가끔 있어서 봤는데 지인들이 이게 뇌 에 문제가 있을수도 있다해서요   진짜 그럴수도있는건가요    ,신경과
귀가 웅웅거려요,제가 잠을 이틀간 잘 못 잤는데요 그 이후로 귀가 살짝 웅웅거리고 눈을 세게 감았다 뜨면 어지러워요 걸을 때도 어지럽고요    그냥 순간적인 걸까요 ,신경과
머리를 흔들면 뒤통수가 아파요,어제는 자고 일어나는데 머리가 깨질듯 아파서 진통제 맞고 약먹고 자니까 오늘은 흔들면 아파요 어떡하면 낫나요,신경과
벼락 두통 질문,  살 수험생 입니다  제가 올해  월 정도부터 우발적으로  분 이내에 엄청 강한 두통이 발생하는 증상을 겪고 있습니다 주로 뒷통수에 발생하고 짧은 순간 동안 엄청나게 아팠다가 금방 괜찮아 집니다 평소에도 편두통이 심해 스트레스 때문인가 하고 넘겼는데 최근에는 빈도가 점점 심해져서 찾아보니 벼락두통이라며 위험한 두통이라고 하던데 좀 무서워서 질문드립니다    벼락두통이 만성적으로 발생할 수 있나요    감각이상이나 마비증상은 없고 벼락두통만 있는데 이것도 심각한 뇌질환에 관련된 증상인가요    벼락두통이 뇌질환 말고 다른 병때문에 나타날 수도 있나요 ,신경과
왼쪽머리가 찌릿하면서 아파요,누워있다가 일어날때  앉아다가 일어날때  고개숙이고있다가 다시 들때마다 왼쪽머리가 찌릿해요 원래 전부터 어지럽긴 했는데  일전부터 찌릿하면서 아프내요   오늘은 더 심하고요  이유가 뭘까요  ,신경과
비올때마다 아파요,언제부터인지 잘은 모르겠지만  비가오거나 낮은기온에 습해지거나 할때마다 두통이 옵니다  머리를 다친적도 특별한 일이 있던적도 없는걸로 기억하는데 뭐때문에 아픈지 모르겠네요  이러한 두통이   년도 더 전부터 그래와서 타이레놀등을 평상시에도 가지고 다니면서 아플때마다 복용하고있어요  혹시 이유라던지 그러한 사례가있는지 궁금합니다 ,신경과
조금만 압박해도 피안통해서 저림현상이 와요,사지부분은 조금만 압박해도 피가 안통해서 저려요  어느정도수준 이냐면 머리 말리려고 아빠다리하고 고개숙여서말리리다보면  맨밑에깔려있던 발이  분이면 저리기 시작합니다  이게 쪼끔 걱정이된다 생각하는게  자다가 뒤척이다 압박이 되면 저려서 깨야잖아요   근데  분이면 저리게되다보니  분 이상이되면  저림현상 이상으로 차갑게 식어서 전혀 감각없는 상태가되서  잠에서 깨요   꼬집어도 아무느낌 안들정도로 저려요  한번은 아빠다리하고 한참있었는데 종아리밑으로 다 감각이상이와서 일어서질 못했어요  다리에 전혀힘이 안들어가고 꼬집어도 아무느낌도 없었습니다  진짜 그냥 나무토막이 붙어 있는느낌 이더라구요  팔다리 전부 어디든 압박이 조금만와도 저립니다  올해초 빈혈검사때는 보통이였고 오메가 영양제도 꾸준히먹고있습니다  혈액순환이 안되는걸까요  어느병원에 가서 진료를 받아야할까요 ,신경과
살 안쪽 근육 이 타는듯한 느낌이 들어요,밖에 외상은 없는데 가만히 있어도 따끔거리고 팔을 움직여서 근육을 움직이면 더 느낌이 심하게 옵니다  뭐가 문제 일까요 ,신경과
새벽  시만 되면 잠에서 깨요   ,그날 하루 피곤했든 피곤하지 않았든 상관없이 새벽  시만 되면 잠에서 깹니다    그리고 잠에서 깨고 나면 다시 잠드는데까지  시간 이상은 걸려서 너무 힘들어요   아예 다시 못 잔 적도 많구요    또 자꾸 새벽에 깨다보니까 하루 일과를 정상적으로 마치지 못한 적도 많아요  불면증인 것 같은데 어떻게 하면 개선할 수 있을까요  깨지 않고 깊은 잠 좀 자보고 싶습니다    수면제라도 먹어야 하는 건가요   운동을 해야 한다는 둥의 누구나 아는 이야기 말고 진짜 도움을 구하고 싶습니다  불면증 개선한 경험이 있으시다면 노하우를 듣고 싶습니다     ,신경과
이거 뇌진탕일까요 , 주일인가  주일전 철봉같은 곳에 머리를 쎄게 박았는데요 그 이후로 자꾸 하려던걸 까먹고 어휘력이 딸리는듯한 느낌이 납니다   왜그러는건가요 ,신경과
뇌병변중증장애인한정신병발생가능성,재가뇌병변중증장애인인데뇌병변중증장애에의한정신병발생가능성있나요,신경과
수두증 의증,제가 두통에 진짜 거의 없다고 할 정도로 있습니다  조금이나마 이상한 점이 머리 전체가 두통이 있는 것이 아니라 좌측 또는 우측 머리 두통이 있습니다 그러나 여기서도 제가 한번도 느껴보지 못해던 점이 만약 좌측에 두통이 있다고 한다면 죄측 특정 부위가 아픕니다 그리고 특정 부위도 매번 달라집니다  보통의 경우 머리 전체가 아파야 하는데 한쪽만 아프면서 특정 부위만 두통이 있습니다  두통의 통증 수치는 정말 미약합니다 그래서 정상뇌압수두증인지가 의심이 되어서요  ,신경과
대뇌동맥 폐쇄및 협착 두통 어지러움증,대뇌동맥폐쇄및협착   월초에 발견해서 약 복용중입니다  문제는 계속되는 두통과 어지러움증 인데 대뇌동맥 폐쇄및 협착 으로 어지러움증과 두통이 계속지속 될수 있나요  약을 복용하고    시간은 괜찮은듯 하다가 이후에는 어지러움증 두통등이 발생하네요  아침약 먹고 오전지나고 오후    시경 부터는 어지러움증 두통이 발병하는데  약 처방은 아침 저녁만 받아서 점심약은 없어요   제발 이 고통에서 벗어나고 싶습니다  ,신경과
머리안 귀안 목안이 막혀있는듯 답답합니다,맨처음 눈초점안맞는느낌들고 휘청휘청어지러운것같은느낌들다가 며칠뒤 오른쪽귀에서 삐소리잠깐나더니 왼쪽귀가막혀짐 눈초전 어지러운느낌은 없어짐 병원서 저음난청같다며 스테로이드 뇌혈관확장 이뇨제처방받아먹음었지만 왼쪽귀막힘은 여전한데 오른쪽귀 특정소리에 귀딸깍 고막움직임증상생김 약먹기전에 있던건지 약먹고생긴건지 모름  양쪽귀 침삼킬때 찌지직 찌걱거림 이비인후과여러군데 다녔지만 청력에이상없고 메니에르아니고 찌직찌걱은 이관장애같다고함 이관약으로 비염약을 꽤먹었는데 호전안됨 두달지난뒤 갑자기 일어났다가 현기증같은게 오더니 머리에서 크게 찌잉소리울리더니 물에잠긴것같이 머리와귀가 먹먹해지고 오른쪽귀도막힌느낌 오른쪽보다 왼쪽증상이 너무심함 왼쪽 머리안 귀안이 막혔으며 왼쪽 얼굴당김 왼쪽턱무거운느낌 왼쪽목안이 침이잘안넘어가고 뭐가걸린느낌 목뒤저린느낌  왼쪽 목앞뒤부터 머리까지 막힌느낌  목앞부터머리까지 압력감이듬 이증상이   시간  개월넘게있음 이빈후과에선 이상없다하고 신경과에서 뇌mri찍었는데 이상없음 목엑스레이 찍었는데 별이상은없음  머리인지귀인지 작게 소라껍데기바람소리남 처음엔 귀만막힌줄알았는데 점점 증상들이 늘어가는겁니 귀문제만아닐수있다 생각이듭니다 자고일어나면 머리안과 귀안 얼굴전체가 더 꽉 막아진느낌이며 감각이없어지고 차단된 느낌입니다,신경과
안녕하세요    너무 불안해서 남겨요   ,제가    요즘 너무 불안해서 속도 아프고    머리 뒤통수가 찌릿 하게 아프고 힘들어요    제가 너무 많이 불안해했는지    이제 구게 터져서    속도 아프고    머리도 굉장히 아파요     ,신경과
덥고 어지러운 증상 뭘까요 ,제가 만성 어지럼증으로    년 결과 선생님은 전정편두통이나 메니에르일거라고 추측   여러 증상이 생겼는데   그중 몸이 힘이 빠지고 손발은 엄청 차가워서 찬기를 느끼는데 몸 안에서 열이 나서 더워서 더 어지럽거든요   어지러워서 더운건지  더워서 어지러운건지 헷갈립니다   식은땀이라고 보기엔 어렵구요   뭔가 사우나에서 너무 더워서 어지러운 딱 그런 느낌입니다   이게 어지럼증 증상 중 하나인지 아님 내과적으로 문제가 있을까 싶어서요   일단 소변검사랑 혈액검사는 해놨느데    증상 때문에 일상생활이 힘들어 어디서 어케 진료를 받아 약을 먹어야할지 고민입니다 ,신경과
귀 한쪽이 아파요,제가 요즘 귀 한쪽이 너무 간지러워서 귀이개로 계속 긁어냈더니 오늘 귀가 아프네요   귀 안쪽이 아픈건지는 모르겠는데 사진처럼 새끼손가락 있는 곳 주변이 아파요  누르면  살짝 밑에부분이 아픈데  그냥 금방 낫겠죠   그냥 제가 건드려야 욱신거리고 꾹 누르면서 문지르면 아파요   ,신경과
저희 어머니께서 머리가 어지러우시고,안녕하세요 저희 어머니는   세 이신데요  오늘 낮   시부터 지금까지 계속 머리가 갑자기 어지러우셔서 손으로 머리를 만지시다가 머리에 핏줄  힘줄 이라고 하나요 그런게 튀어나와 있는걸 발견하셨습니다  저도 봤는데 손에 힘줄 튀어나온 것처럼 그렇게 머리에 튀어나오셨더라구요  아직도 계속 어지럼증을 호소하고 계시고요  혹시 이게 뭔지 알려주실 수 있을까요  큰 병인가요  너무 걱정 됩니다  ,신경과
손저림 시야흐림,가끔가다가 자다가 일어날따 손저림 증상이 있고 요새 시력이 점점 안좋아 지는거 같습니다 컴퓨터 볼때 흐릿하게 보임  병원진료를 받아봐야할까요  ,신경과
약을 안 먹으면 머리가 아파요,제가  년 반 정도 정신과에서 약을 처방받고 있습니다   하루라도 약을 먹지 않으면 몸살처럼 온몸이 아프고 열은 안 나는데 머리가 아파서 일상생활이 힘들 정도예요  약을 오랫동안 먹다 보니 이 약을 끊을 수 있긴 한 건가 싶기도 하고 걱정이 돼요   제가 먹고 있는 약은 파록쓰씨알정    자나팜정 밀리그람 이렇게 매일 먹습니다  검색해 보니 공황 장애 약의 부작용일 수 있다고 하는데 무엇이 문제일까요 ,신경과
무슨 증상인가요 ,최근 들어 자도자도 피곤하고 뇌가 자는 느낌이 들고 집중도 잘 안됩니다  말도 약간 더듬는거 같고요  가끔 어지럽기도 합니다 무슨 증상인가요 ,신경과
진짜 짜증나는 두통,스트레스를 많이 받으면 두통이 엄청 아프게 와요  진짜 객관적으로 생각해봐도 저의 두통을 불러일으키는 극심한 스트레스는 남들에 비해 큰 건 아니에요   근데 스트레스 받거나 근심 걱정 가드한 부정적인 생각을 길고 깊게 하면 두통이 와요    살쯤  부터 현  살까지  년 동안 극심한 스트레스를 받을 때랑 부정적인 생각을 깊게 할 때 마다 이럽니다     타이레놀이나 이지엔 먹으면 어느정도 괜찮아지긴 하는데 주변사람은 안그러고 저만 이러니까 이젠 너무 짜증나고 지긋지긋합니다    왜 그런거에요    제 주변엔 저랑 똑같은 상황에 놓인 사람도  더 힘든 사람들도 안 아픈데      진짜 지긋지긋   스트레스 한 번 받으면 머리에 또 하나의 심장이 있는 것 마냥 쿵쿵 대는 느낌이고 눈가가 뜨거워 지고 머리가 한 번 아플 때 너무 아프니까 약 없으면 잠도 못자고 뭘 하지를 못하고 미치겠어요     안그래도 스트레스 받으면 심란한데 두통 때문에 더 짜증나고     제가 엄청 불행한 사람도 아닌데 왜 극심한 스트레스를 받을 때 힘든 두통이 오는지        ,신경과
신경쪽에 문제가 생긴건가요 ,생각이랑 말이 다르게 나와요  제 머릿속에서는 분명히  를 말하라고 시키는데 쌩뚱맞게  이 말로 튀어나와요  외에도 눈깜빡임 의식  자주 다니던 동네에서 길을 헤멤 등등이 있는데 저 진짜 신경쪽에 문제라도 생긴걸까요    몇년전까지는 안그랬는데 요즘 스트레스를 받아서 그런건지 집중력저하도 생긴것 같고 우울감도 늘어난 것 같은데 이럴 경우에는 어떤 병원을 방문해야하나요  아직 학생이어서 뇌쪽에 문제가 생긴 것 같진않은데 혹시 adhd 이런 증상도 의심해봐야 하나요 ,신경과
손이 힘빠짐,안녕하세요 중학생 여자입니다 몇 달 전부터 오른손에 글씨 쓸 때 힘이 빠지는 증상이 가끔씩 생겨서 신경과를 방문했습니다 근육 튐 느낌도 있는 것 같고요 병원에서 뇌 CT  신경전도검사  혈액검사를 진행했고요 뇌 CT  신경전도검사 모두 정상이라고 하셨고 혈액검사는 결과가 아직 안 나왔습니다  의사 선생님 말씀대로는 제가 펜을 잡는 습관도 안 좋고 그 상태로 많이 쓰다보니 그렇다고 하시는데 정말 괜찮을까요 그리고 손목도 얇고 손도 작아서 그렇다고 하셨어요 원래 좀 예민하기도 합니다 밥도 제대로 안 먹고 잠도 제대로 안 자서 근육 튐이 있는 거라고 하셨는데 더 이상 걱정 안 해도 될까요  루게릭병일 확률은 없는 건가요  최대한 빨리 부탁드립니다  제가 원래 걱정이 좀 많은 편입니다  ,신경과
왼쪽 눈썹위 머리 통증,어렸을때부터 머리가 자주아팠고 늘 타이레놀 개씩 먹었습니다 근데 작년부터 머리가 심하게 아파왔고 심할땐  개까지 약을 먹어도 진정도 안되고요 근데 최근들어서 머리아픈일이 잦아 지고 항상 왼쪽 눈썹 위에 머리만 아파요 심할땐 토도 하고요   너무 아파서 응급실도 다녀왔었는데 아무것도 해줄게없다하셨어요 초딩때 MRI검사 했었는데 머리에 작은 혹같은게 있는데 이거때문에 아픈건 아니라고 했었어요 저 어떡하죠 살려주세요 아픈 원인좀 제발 알려주세요 진짜 죽을거같아요,신경과
귀 밑 통증,귀 밑 통증이 나타난지  주가 되었습니다   주전에 한번 찌릿찌릿 거리면서 심한 통증이 있고 나서 좀 지나고 나니까 괜찮아 지고서 한 열흘 지나고 나서 다시 나타났습니다  그래서 나아 질 가 싶다가 안 나아져서 이틀 후에 이비인후과에 가서 진료를 봤는데 귓속 염증은 없다고 하셨는데 목 근육이 뭉쳐서 통증이 있을 수 있다고 하셔서 신경통  소염진통제  위보호제약을 처방해 주셨습니다  이 약을 하루에 한번만 먹으라 지어주셔서 이틀 먹었는데도 먹고 한  시간 정도만 통증의 정도만 약해지고 증상이 나타나더라고요  그리고 시간이 더 지나 날 수록 통증이 심하고 이제는 귀 안까지 부은 듯 하면서 욱신욱신 거리기 까지 합니다 이비인후과 의사가 말씀하신 건 아무래도 후두신경통인 것 같은데 약에 효과가 없다면 다른 질환일 까요  그럼 진료를 어디로 가는게 좋은지 알려주셨으면 합니다  ,신경과
