0,1,2
며칠전부터 왼쪽 손에 떨림이 있는데 많이 심각한건가요   손을 가만히 냅둘때는 전혀 안떨리는데 밥을 먹거나 주먹을 쥐고 있을땐 떨립니다 무섭고,며칠전부터 왼쪽 손에 떨림이 있는데 많이 심각한건가요   손을 가만히 냅둘때는 전혀 안떨리는데 밥을 먹거나 주먹을 쥐고 있을땐 떨립니다 무섭고 불안해서 그런데 병원엘 꼭 가봐야하는건지 궁금합니다,신경과
수전증   도와주세요  ,전   살 여자구요 운동하는거 되게 좋아해서  구기종목  하루에 적어도 한시간은 공던지고 놀거든요 근데 그거때문인지 손이 자꾸 떨려요   평소엔 조금만 떨리다가 가끔씩 뭐 펜같은거 잡으면 덜덜떨리고 그래요 긴장하면 그럴수있다고 하고 힘주면 그럴수있다는데 진짜 긴장 하나도 안하고 수업시간에 펜 하나 잡았는데 떨리고   이 생활이 지금  개월째에요 아프지는 않은데 너무 거슬리고 짜증나요    오늘은 너무 심해서 펜 안잡고 그냥 손 폈는데도 막 떨려서 애들이 손좀 가만히 있어보라고 할 정도였어요    저번에 내과가서 피뽑아봤는데 신경쪽에 문제있는것같다는데 신경외과 가려면 오래걸리기도 하고 돈도 너무많이들고   이거 무슨 병인것같나요     치료방법이 있을까요   ,신경과
제가 어제 달리는 차에서 굴럿는데요 팔이,구르면서 왼팔이랑 오른쪽 무릎에 큰 통증을 받잇고 마리도 세게 박아서 머리도 웅웅 거렷는데 자고 일어나니까 무릎과 팔에 멍이 들고 왼팔에 근육통같은 통증이 심하고 왼팔에 힘이 아예 안들어가고 위로 안들어집니다  통증은 근육통 같은 느낌이라 파스만 붙이고 잇는데 시간 지나면 나아질까요   ,신경과
선천성대뇌낭 수시로 어지럼증이 있어요,선천성대뇌낭  수시로 어지럼증이 있어요  코로나백신 접종 해도될런지   혹이 cm정도이고  뒤통수랑 어지럼증이 같이와서 힘들어 합니다  ,신경과
자다 일어나먼 쓰려져요,  대 여자입니다  자고 일어나서 앉으면 어지러운 기색없이 몸에 힘이 빠지면서 옆으로 풀썩 쓰러져요 이유가 뭘까요  길걸어가다가도 가끔은 어지러워서 쓰러질것같아요,신경과
몸 떨림을 멈출수 있는 방법쫌여   ,제발제발 읽어주세용 역류성 식도염과 목감기로 한달 정도 아팠습니다   식도염  주일 약먹고 완치  바로 목감기 인후염  주일 약먹고 어느정도 괜찮아짐  그러고 하루 술마시고 바로 상태 악화   인후염 편도염 인파선  인가  여튼 목밑부음 그외 다들 아는 감기 증상들이 후다닥옴 약을 쫌 쎄게 처방  약먹는 일주일동안 식욕없고 음식냄새 약 먹어도 토함 침대에 일어서는 순간부터 어지러움증 빈속이지만 토하고싶은 증상 소화 안됨 하루종일 잠만 잤음  알고보니 엘트라셋 이라는 진통제가 바로 위와 같은 증상이 나타나는 부작용이라고함 그약을 안먹으면 다시 회복 가능하다함  혹시 몰라 이틀 쉬고 일하러 나오는데 출근길 심장이 빨리 뛰고 온몸이 떨림 손만 봐도 떨림이 보임 출근하고 시간이 지난 지금도 그럼  계속 누워만 있고 먹는것도 늘 흰죽 누룽지 죽이였으니 몸이 아직 완전히 회복되지 않았다는건 알지만 떨림때문에 긴장하지 않던 제가 더 긴장하게되네요 가다듬고 심호흡을 해도 똑같아요   근육이 놀라서 일까요  떨림을 멈추게 해주세요    ,신경과
편두통 약 복용,편두통 때문에 신경과에서 인데놀정  에이스타정  낙센에프정  일치를 복용 받았습니다   낙센에프정은 저녁 때만 먹는 약이라고 적혀있는데 약사님께 설명을 들을때는 아플때 먹으라고 이야기를 들었습니다   그러면 낙센에프정은  일동안 매일 먹어야 하는 건가요  아니면 아플 때 저녁에만 먹어야 되는건가요   낙센에프정은 아침이나 낮에 편두통이 오면 아무 때나 먹어도 괜찮은 것인가요 ,신경과
하루종일 두통과 울렁거림이 있어요 토를 할 것같지만 토는 나오지 않고요 목이 뻐근하고 안압도 있습니다 그리고 가슴이 답답합니다 숨이 잘 안쉬어,하루종일 두통과 울렁거림이 있어요 토를 할 것같지만 토는 나오지 않고요 목이 뻐근하고 안압도 있습니다 그리고 가슴이 답답합니다 숨이 잘 안쉬어 져서 과호흡이 올 때가 있습니다 왜 이러는건가요 ,신경과
팔 저림,오른쪽 가슴 안쪽에서부터 팔 안쪽으로 신경이 저려요 등으로는 바깥부분이 좀 저린거같기도하고요  갑작스레  일째인데 몇일전 뒤통수가 저려서 병원갔더니 목디스크초기 의심을 하시던데 그거랑 연관있을까요 ,신경과
여자친구가   살인데 중학생 때부터 이유 없이 머리가 지끈거리고 눈이 초점이 안 잡히고 어지러운 현상이 자주 있다고 합니다 대학병원에서 정밀 검,여자친구가   살인데 중학생 때부터 이유 없이 머리가 지끈거리고 눈이 초점이 안 잡히고 어지러운 현상이 자주 있다고 합니다 대학병원에서 정밀 검사도 다 받았는데 아무 이상이 없다고 하고 답답하네요 무엇이 문제일까요,신경과
내공   학교에서 뒤로 넘어져서 머리를 박았어요,월요일쯤에 뒤로 넘어져서 머리를 박았는데 어제 새벽에도 코피가 났었는데 지금도 나요 이거 왜 이런걸 까요,신경과
질문 있습니다 ,근육이완제 사려면 의사선생님 처방전이 있어야 하나요  제 증세가 발등이 무겁고  무릎 뒤쪽이 많이 땡기고 있습니다  증세가 호전되지 않아 걱정입니다  ,신경과
뇌에 문제가 있는것 같아요  ,우선 경구피임약을  팩째 복용중이였습니다 끊을 예정이고  증상은 머리 쎄한느낌 머리에 압력이 가해지는 느낌 기억력 저하 어지러움 인데 무슨 병일까요   경구피임약을 끊은지 얼마 안됐는데 더 지켜보고 병원을 가야될까요 아님 당장 병원을 가야되나요 무섭습니다,신경과
 차신경통과 유사한 증상이 나타나는데 왜 그럴까요 ,제가 어제   일 얼린 초콜릿을 꽤 많이 씹어 먹었습니다  왼쪽 치아가 좋지 않아 오른쪽 치아로 씹는 습관이 있어 오른쪽으로만 계속 얼린 초콜릿을 부수어 먹었는데요   하루에 걸쳐 얼린 초콜릿을 계속 먹었고 시간이 지나 저녁쯤 되었을 때  씹어 먹었던 오른쪽 치아에 통증이 생겼고  통증이 있는 치아 주변의 잇몸이 부어올랐습니다  또한 오른쪽 귀 안쪽의 피부가 욱신거리며 아팠고  머지않아 오른쪽 얼굴 옆면 전반적으로 피부   가 당기는 듯한 통증이 느껴지기 시작했습니다   두피까지   굳이 비유하자면 머리를 바짝 당겨 묶고 한참 뒤에 풀렀을 때 피부가 당기는 그런 아픔이었는데  어제는 목넘길 때 통증도 함께 있었다 보니 감기증상인가 싶어 감기약을 먹고 잤었거든요   그런데 일어나보니 목아픔은 거의 사라졌으나 그 외의 증상들은 여전히 지속되고 있습니다   그냥 가만히 있을 때는 오른쪽 얼굴 옆면 전반적으로 살짝 화하다  아프다  정도의 느낌이 있으나  멍 때리거나 집중하면 크게 신경이 쓰이지는 않습니다  다만 불규칙적으로 이따금 찌릿  하며 두통 속이 아니라 겉면이 아픈 느낌 이 오는데 이게 뭔가 싶어서요   이리저리 검색을 해보니  차신경통  안면신경통  증상과 꽤나 흡사하다는 인상을 받았습니다  번개치듯 찌릿 하다는 설명    혹시 이게  차신경통 증상일까요   차신경이 씹는 근육에 관련이 되어있다는 설명을 읽긴 했는데  며칠 기다려보아야 할지 아니면 병원을 가봐야 할지 고민이 되어서요   보시고 설명과 소견 부탁드립니다 ,신경과
편두통약 헤다크캡슐 복용 후 다른진통제 복용해도 되나요,몇일째 머리가 너무 아파서 오늘 신경과가서 이것저것 검사후 편두통 진단받고 헤다크캡슐 처방 받았는데요 저녁 먹은 후 한알먹고 두시간 지나도 머리가 똑같이 너무 아프네요 혹시 지금 약국서 사온 다른 진통제 먹어도 될까요  너무아파 잠도 못들고 내일 출근도 해야하는데요,신경과
좌우 균형 어지러움,어지러움에 관해 인터넷을 찾아보면 이석증이나 공항장애 후 빙빙 도는 듯한 어지러움에 관해서만 많이 나와서 질문 드립니다    년 전쯤부터 약간의 어지러움이 생겼는데요  그때 첫 직장 생활을 하게 되어서 스트레스를 많이 받아서라고 생각했습니다  어지러움이 심할 때는 걸어가다보면 바닥이 울렁거린다던가   심하지 않을 때는 그냥 정면을 보고 걸어가는데 바닥 균형이 맞지 않고 계속 흔들리는 느낌이 들었습니다   일하면서 평생 잘 안 아프던 제가 역류성 식도염에   장염과 위염이 같이 오기도 했습니다      단순히 스트레스 때문이라고 생각해서 대수롭지 않게 넘어갔지만  퇴사 이후에도 걸을 때 약간씩 지속되더라구요  지금은 다시 일하는 중이지만 예전만큼은 아니여도  또 지속적으로 걸을 때 어지러운 느낌이 들어서 질문 드립니다   만약 진료를 받아야한다면 이비인후과를 가야할까요 아니면 신경과를 가야할까요 ,신경과
고개를 돌리면 어지러워요 ,그제부터 고개를 돌리면 어지러움이 있어요  두통이나 토할 것 같은 느낌은 없고  뒷목이 뻐근하거나 이런 느낌도 없습니다  갑자기 일어났을 때 눈 앞이 까매지는 느낌도 아니고  현기증이 날 때랑은 느낌이 전혀 다르게 정신도 똑바로 있는데  머리 속에서 인식하는 시야가 휘청거리는 느낌이에요   왼쪽으로 고개를 돌리는 것보다 오른쪽으로 고개를 돌릴 때가 더 그러는 것 같고  누워 있을 때에도 어지러움증이 있어요   그렇다고 또 엄청 심해서 중심을 못 잡겠거나 하는 정도도 아니고  잠깐잠깐 그러는 거라 병원에 가야하는지 어쩔지 모르겠어요   엄마는 혹시 혈압이 있는 거 아니냐고 하시는데  위에 썼듯 구토감이나 두통같은 건 없거든요  갑자기 이러고  덜 하긴해도 빈도가 점점 잦아지는 것 같아서 당황스럽네요  짐작되는 어떤 병이 있지  병원을 간다면 어떤 병원으로 가야하는지도 알려주세요 ,신경과
증상 좀 봐주세요,시골에 계신   대 후반 아버지의 증상입니다 며칠전부터 뒷목이 뻣뻣해지고   머리에 폭탄이 맞은거 같다고 합니다   머리가 아픈거냐고 물으니 아프지는 않고 어지럼증이 계속 지속된다고 하네요  몽의 균형을 잘 못 잡겠다고 하시고요  흡연은 안 하시고 음주는 자주 하십니다  내일 병원에 가신다지만 걱정이 되어 이렇게 질문 올립니다   유추해볼 수 있는 증상은 무엇이고 예방은 어떻게 할까요 ,신경과
뒷통수가 답답한 느낌이 나요 ,어제부터 이러기 시작했는데요 어제 배가 너무 쓰려서 진경제랑 파모큐 알약 초록색인거 하나랑 가스트론 가루로 된걸 물이랑 같이 먹었어요  계속 따뜻하게 찜질해주면서 버텼는데 괜찮아지더라구요  그러고 잘라는데 뒷통수 약간 머리 반절 뒷부분이 뭐랄까 통증까지는 아닌데 뭔가 무겁고 어지러워요  그래서 누워있는게 힘들다라고 해야하나 잠 자기가 어려워요  잠을 자려고 누워서 눈 감으면 머리 때문에 일어나게 되요  누워서 하품이 나오려 해서 하품 하려니까 안나오고 약간 헛구역질 나와서  양치 할 때 혀 닦으면 하게 되는 헛구역질 느낌  앉아서 하품 하니까 하품이 되더라구요   이게 대체 뭐지 싶어요  계속 뒤척거리다가 누웠다 앉았다 하는데 너무 졸리고 짜증나서 화가 치밀어 오를 때 드디어 잠이 들었었나 눈 떠보니 아침이었어요  다행이라고 생각해서 그냥 내가 잠 잘 때 예민했나 싶었는데 지금 낮잠을 잠깐 잘라니까 또 이래요 ,신경과
손가락 저림,사진처럼 여기만 자꾸 찌릿찌릿하고 콕콕 쑤시는 느낌이 드는데 백신 때문일까요 병원가야하는게 맞나 아니면 그냥 냅둬도 될지 모르겠어요   ,신경과
얼굴 특정부위가 움찔거려요,며칠전부터 얼굴 한 부위가 미세한 경련처럼 떨려요 방금도 몇번 떨리더니 그 떨린 부근이 감각이 좀 둔해진 느낌이에요 원인이 뭘까요,신경과
머리가 갑자기 확 어지러워요,이게 무슨 증상일까요 언제 부터 그랬는지는 잘 모르겠습니다 하지만 자꾸 머리가 띵하고 핑 돌때가 있어요 막 넘어지거나 쓰러질 정도는 아니고 시야도 괜찮아요 근데 약간 불편하고 잠잘때도 그래서 잠에 잘 못들때도 있어요 일분에 두번정도씩 반복되는거 같은데 약간 어질 합니다 무슨 증상일까요,신경과
얼굴 떨림 증상    세 여 , 일전쯤부터 저녁만 되면 코 옆쪽 가까이 볼에 얼굴 근육  같은게 떨려요 오른쪽 볼만 그래요 거울로 잘 보면 눈에 보일 정도이고  주변 사람한테 보여줘도 보일정도로 떨려요 평상시에 마그네슘은 잘 챙겨먹는 편인데 원인이 뭘까요  매일 저녁마다 이러니 너무 신경쓰이네요  병원 가야하나요  광고는 사절할게요 ,신경과
왼팔이 저리고 몸에 힘이빠집니다 ,안녕하세요  현재   세 남자입니다  몇일전 목감기로인해 약을 처방받고  틀이 지났습니다  원래는 안 이랬는데 제가잠을 잘려하니 가슴중앙부분 흉골  부분이 누르듯이 작은 통증이있고 왼쪽 어깨와 팔 전체에 힘이 빠지고 저려옵니다   어떻게든 노래 들으면서 잘려고 했는데 몸에 힘이 축빠지는 느낌이들면서 머리도 같이 어지러워지고 잠이 오질않습니다   딱히 숨이 막히거나 심장이 빨리 뛰는 증상은 없는데 무슨 경우인가요  불안증상에 일부인가요    아니면 전조증상 같은것인가요    아시는분 계시면 답변 부탁드립니다  ,신경과
백신  차 맞은지 거의  주 다되가는,백신  차 맞은지 거의  주 정도 되가는데  일째 편두통이 있어요 이렇게 오래 아픈적 없었는데 혹시나 관련이 있을까요   ,신경과
음주 후 손저림  과 두통,요근래 술을 마실 일이 잦아서 과음을 자주 했습니다     월   일 마지막 과음을 했고    일 아침에 일어나니 오른손 검지 측면에서 손저림을 느꼈습니다  별 일 아니겠거니 넘겼는데   일 현재까지 손저림이 계속 되고 있습니다  정확히 얘기하면 실제 저린 건 아니고 저린 거 같은 느낌이 듭니다  무거운 물건을 들거나 움직이는데는 전혀 지장이 없고 그 느낌만 지속됩니다  그리고 두통은 전혀 없는 편인데 아픈 정도는 아니고 약간의 느낌이 오는 두통이 아주 간헐적으로 한번씩 있습니다  만   세 키    에   킬로  흡연은 하지 않습니다  평소 식습관이 기름지거나 하진 않습니다  병원은 갈 예정인데 이런 증상이 주로 의심되는 원인은 무엇인지  병원에 가려면 어느 진료과목을 찾아가야하는지 궁금해서 남깁니다 ,신경과
어지러움 증상,제가 정자세로 자는 경우가 많은데 정자세에서 얼굴을 똑바로 천장을 보고자려고 눈을 감으면 머리가 어지러워서 얼굴을 돌리고 자요  몸은 정다세인데 얼굴만 옆으로 돌리거나 이거 문제있는거죠   얼굴도 정자세로 천장을 보고 자면 머리가 도는 느낌이서 다시 얼굴을 돌리고 잡니다  증상이 뭔가요  ,신경과
뇌진탕 일까요 ,  월  일날 내린 눈덕분에 자정에 퇴근하다가 미끄러운 눈위에서 슬라이딩  듯 뒤로 미끄러져서 우측 뒷머리에 혹이 생겼고 목을 움직일 수 가 없어서 응급실서 ct찍고 이상 없고 혹여 팔다리에 문제가 생기면 오라고 해서 목 보호대를 하고 퇴원했어요  그날   일 경 오전에 출근해서 물을 마시는 거 부터해서 먹는 것들은 다 토하길래 오후 시쯤 응급실가서 물어보니 그럴 수 있다며 진정제와 울렁임 어지러운거 잡아주는 주사를 맞고 다시 퇴원 했는 데도 아직도 울렁울렁 토하고 그래도 토하는 건 안먹어서 토를 잘 안하지만 머리는 깨질 듯 간간히 아프고 어지럽고 이러네요  정말 머리에 문제가 없는 건가요 ,신경과
두통 관련 질문,제 머리가 정수리 보단 앞 이마보단 위에 중간이 나무 아픈데 어카나요,신경과
두통이 자주 찾아옵니다,  년생 입니다  어렸을 때 부터 일주일에 한두번 두통이 있었는데 요즘들어 투통이 자주 찾아옵니다 엄청 막 아프진 않는데 신경이 자꾸 쓰입니다  왜 이럴까요   ,신경과
흥분하면 자꾸 마비가 와요,대화하다가 억울하거나 화나는 일 있으면 흥분해서 말하게 되는데 그러면 얼굴과 손 발에 마비가 와서 입술이 오므라들고 눈꺼풀도 저리고 손 발이 저려요  가끔 심하면 팔 다리도 마비가 오고 머리도 저리더라고요  이거 왜 이런건가요    ,신경과
브레인 포그 같은 증상이 나타납니다  해당 내용에 대한 소견을 요청드립니다 ,아래와 같이 브레인 포그 같은 증상이 나타납니다  해당 내용에 대한 소견을 요청드립니다      머리가 띵함      전두엽    부근에 돌이 있는듯이 무거운 느낌이고 머리가 멍한 상태임  업무를 진행할 수 없거나 기억이 안나는 증상은 없으나 멍때리는 시간이 길어지고 피곤하고 무력감을 느낌     시야가 흐려짐      특히 컴퓨터 작업을 할때 시야가 흐려지는 듯한 느낌이 자주 들며 라섹수술하기전 난시가 있던 때로 돌아간듯함      목 아픔 증상      목의 최상단 부분  턱과 만나는 부분  에 뼈가 만져지는데 이 부분에 통증이 있음  물을 마시거나 음식을 먹을때 약간 걸리는 듯한 통증이 있으며 해당 증상에 대해 이비인후과에 방문하였으나 별다른 소견없이 소염진통제만 처방 받음     특이사항    코로나 확진    년  월 코로나 확진 후 현재 완치 판정  음성  을 받음                  화이자  차 접종까지 완료한 상황,신경과
눈밑 떨림과 입주변 뺨 통증 및 무감각  마비  증상,일주일전부터 오른쪽 한쪽으로만 눈밑이 파르르 떠는증세와 빰과 입술주변으로 통증이라 표현해야될지  여튼 감각이 이상한 증상과 마비된 느낌이 하루종이 있어서 오늘 신경과에서 mri   mra 찍었습니다  선생님 말로는 특이한 이상소견은 없으시다고 하시는데요  혹시 저 두개말고 다른 검사 또 해볼만한것이 있을까요  지금 약은  주일치 처방받았도 오늘부터 먹을려고 합니다   ,신경과
갑작스런 실신 병원 어딜 가야하는지 궁금합니다,아버지가 오늘 집에서 자다가 일어나서 집을 걷다가 갑자기 뒤로 넘어가셨는데요 마룻바닥에 머리를 크게 박았는데 몇분동안 말이 조금 어눌하고 걱정돼서 병원 응급실에 갔는데 뇌ct 피검사 등을 했는데 뇌쪽에 문제 없다는 소견을 받았습니다 몇시간 지나니 정신도 멀쩡하고요   일단 문제 없어 보인다 하여 집으로 돌아왔습니다 딱히 별다른 문제가 없어 보여서 갑자기 실신한 원인도 정확하지 않다 하고 병원에서는 아마도 미주신경성 실신 같다고 하시는데        대에게도 미주신경성 실신이 잘 일어나나요     아버지가 매일 반주하시고 흡연도 하시는   대인데  또다른 실신의 원인이 될만한 질병이 있을까요     정확한 원인 알아보기 위해서 병원 어느 과에 가면 좋을까요   월에 신경과 진료를 보려 하는데 신경과 말고도 검진해볼만한 과가 있나요 ,신경과
어지럼증과몸이좌우로흔들거리며눈이흐렷하게보입니다,제가욕실에서 넘어져머리를부딪혀어요 그당시머리가안조아ct찍었는데 별문제는없다고했어요 저는머리에혹도크게생기고머리도아프고해서 처방전을받아 약을먹었습니다       월쯤 그러다가 좀나아서약을먹지않고  월쯤어느날속이 미식거리거리더니 머리가 한번씩어지러윘어요 그이후로mri사진도찍고 신경과도다녔어요 근데검사상은별이상이 없다고 말하시는데 저는 지금까지 증상 이 계속계속더심해져 지금은 너무힘들게하루하루살아갑니다 이비인후과 안과 신경정신과 다녔 습니다 지금저의증상은 고개를좌우보면서살살돌려도어질어질 걷기운동을하면 걸을땐잘걷다가 서면또핑도는어지럼느끼면서 옆에잡아야할정도로입니다 가만히서거나앉을때도 몸이좌우 앞뒤로흔들리구요 눈은왼쪽이 자꾸뿌엿게보이면서 맑지않아요 왼쪽눈두덩이가 오른쪽보다 많이 튀어나온느낌이듭니다 머리아플때에이마랑이마윗쪽이항상않조아요 머리넘어진쪽은오른쪽뒷통수입니다   이러고 벌써 년째접어듭니다 어디서진찰을받아야할까요  정확한병명이라도알려주심감사하겠습니다     ,신경과
몸이 위아래로 움직이는 느낌이 듭니다, 일 전부터 조금씩 몸이 물 위에 떠있는 것처럼 위아래로 움직이는 느낌을 받기 시작했습니다  첫날은 별로 가끔씩 느낌이 있다고 생각했는데 그 다음날은 좀 심하게 위아래로 파도가 치는 것 처럼 이상한 느낌을 받았습니다 두통은 따로 느껴지지 않았고 이 증상이 심해지면 약간 매스꺼운 느낌이 있긴 했습니다 배나 방방같은 것은 타지 않았고 차를 조금 탄 것 외에는 이동수단을 타지 않았습니다,신경과
머리 뒤통수쪽 땡김 속미식거림,제가  일전쯤에 밖에서 노는데 갑자기 속이안좋고 머리가아파서 잘놀지도못하고 들어왔다가 자고 그다음날부터  오른쪽뒤통수쪽이 목이랑 뒤통수연결되는쪽 목위  부분이 땡겨서 처음엔 잠잘못잣다 싶었는데  이게  일째되는 오늘까지 그럽니다    머리가아프니 당연히 속도 미식거리고요 근육쪽이아닌거같고 의학적인 지식은 하나도없지만 뭔가 신경이나 핏줄쪽에 문제가생긴느낌이 듭니다   고개를 오른쪽으로돌려도 막떙기고요 무슨증상일가요   추가로 자세에따라 침삼킬때도 통증이있습니다,신경과
왼쪽다리저림 쥐가납니다,왼쪽다리가저리고쥐가난듯감각이없어요 잘려고누우면심해서밤에깊은잠을못잡니다왼쪽으로누우면눌려서쥐가나면서아파돌아누워야합니다 발바닥도지압을해주면조금덜한데불편합니다 천장쪽으로발을들고있으면조금편합니다원인이뭘까요 ,신경과
눈 두덩이,눈두덩이 라고 할까요 오른쪽 눈썹 뼈 안쪽이 욱신거리고  두통까지 오고 눈도 아프고 아프다 안아프다 반복하구요  지금은 두세번되었습니다   제가 중대뇌동맥 폐쇄 및 협착이란 질병이 있는데  이와 관련이 있을까요 ,신경과
다리 따가움,밤이 되면 양다리 아래쪽이 수시로 매우 따가워 지는 증상이 최근 생겼는데 이거 무슨 병이죠 ,신경과
발작과 어지럼증호소 후 기절,안녕하세요 우울증과 공황장애를 가지고 있는   살입니다  발작할땐 침흘리며 숨이 가빠오고 한  분정도 경련을 합니다  어지럼증이 자주 있는데 어지러우며 정신혼미 눈깔이 풀리며 그대로 주저앉아버리거나 기절하게 됩니다 그 이유와 어느병원 진료과에 가는지 궁금합니다  꼭 좀 잘부탁드립니다 ,신경과
안녕하세요 제사 목디스크 두개 터진,안녕하세요 제가 목디스크 두개 터진 목디스크 환자입니다 그런데 요즘 선톱 끝이나 발톱끝이 따끔거리고 아파요 발목이나 발뒤꿈치도 따끔거리고 아프고요 머리도 어지럽고 뇌압이 자꾸생겨 신경과 가서 ct촬영했는데 이상 없대요  생식기에 이상있어도 그런다고해서 산부인과 가봤는데 이상없대요 산부인과나 내과에서는 신경과에 가서 진단 받아야 한다고 하는데요 신경과에서는 아무 이상 없다고 하니 정형외과로 가봐야 하나요 ,신경과
뇌를 다친 일이 있었는데 궁금한 점이 있습니다,뇌는  월 다치고 현재 재활치료 받느 중 눈깜빡임  개월부터 시작        같이 동시 다발 증상 입턱 좌  우측으로 삐뚤어짐 약  초간 머리 좌  우측으로 왔다갔다 약    분 우측 팔 올라감  약   초   어떤 증상일까요 ,신경과
