0,1,2
자다가 다리가 너무 아파서  ,안녕하세요 오늘 시험 보고 와서 잠깐 쉬다가 낮잠 자게 되었는데 쥐나는거랑 다리 저리는거랑 차원이 다르게 다리 아파서 잠에서 깨서 다리 나아질때까지 계속 울었어요  다리를 다 펴 보기도 하고 엄마가 다리를 주물러 주기도 했는데 정말 이렇게 아픈 고통은 인생에서 처음이었어요  저번에도 한번 그러기는 했는데 울정도는 아니었는데    오늘은 진짜 아파서 눈물밖에 안 나오더라구요  다리가 원래 무릎을 중심으로 종아리가 접히잖아요  근데 다리를 누가 피게 만든다음 바깥쪽  옆쪽 으로 휘게 만드는 느낌이었어요 그래서 진짜 자다가 너무 아파서 한   분동안 다리 계속 아파서 울고 그랬어요 근육통 느낌도 아니였던 것 같아요   왜 그러는 걸까요     성장통이라기엔 전   살 여학생이고 키도 작년까지 자라다가 더이상 크지 않아요   병원 가볼까요   병원이라면 어디 병원 가야할까여 병원 가야하는 증상인가요  내공은   입니다 ,신경과
엄마가 시도때도 없이 몸을 좌우로 움직여요,요새 엄마 치매랑 뇌졸중이 의심 되는 중인 상황인데 병원 예약 때문에 다음주가 돼서야 병원을 가보기로 했어요   근데 며칠전부터 엄마가 앉아있으면 수시로 자주 몸을 좌우로 흔들흔들 해요 가끔 신나는 사람마냥 팔도 막 휘적이면서 댄스  까진 아니고   뭐 이런 행동도 취하는데 막상 엄마한테 흥나냐고 물으면 아니래요 나도 왜 이러는지 모르겠다면서 무의식적으로 하시는 것 같더라고요   원래 이러시던 분이 아닌데 치매  뇌졸중이 의심되는 상황에 이런 행동들을 보이시니까 괜히 더 불안하고 심란하네요 혹시 저 행동도 치매나 뇌졸중에 관련있는 행동인가요 ,신경과
자율신경실조증,자율신경불균형으로 자율신경실조증 판정을 받았습니다  너무힘드네요   한의원은 치료시작한지  주일째이고 신경과병원은 이제 일차입니다   치료하는데 보통 얼마나 걸릴까요  운동도하고 산책도하고 허리피고앉자있고 비타민c도 먹고있습니다  유자차도 매일 마시고 있구요  먼가 죽을거같고 숨쉬는게 의식되서 너무 힘들어요    빨리 완치안될거 알고있습니다  그런데 너무 힘들어서 보통 어느정도 치료를 받아야 하나요 ,신경과
큰소리를 들으면 어지러워요 왜 이럴까요 ,대화를 하다가 상대방이 갑자기 큰 목소리로 말하거나 혼자 길을 걷다가 주변에서 사람들이 크게 떠들면서 지나가거나 벤치에 앉아있는데 아가들이 소리 지르면서 뛰어가면 어지럽고 순간 머리가 멍해지는데 왜 그럴까요  막 그렇게 큰 소리는 아니거든요  오히려 공사장 소리나 구급차 사이렌 소리가 더 큰데 그런 소리는 괜찮아요  ,신경과
자꾸 방금전일을 까먹어요,제가 자위  그걸 맨날하는데 어느순간 갑자기 방금전 일도 까먹더라구요   너무 무서워요  그래서 금딸 할려고 합니다    나을 수 있겠죠  제가 운동도 안하고는 있습니다,신경과
엄지발가락에 감각이 없어요,하루에 무리해서  시간 정도를 앉지도 못하고 걸어다니고 뛰어다녔어요 그런데 그 이후로 엄지발가락에 감각이 없어요 엄지발가락에 피를 안 통하게 한 느낌   한 이틀정도 됐어요   병원 가봐야 되는건가요   오른쪽 엄지만 그래요,신경과
바닥에 앉아있는데 왼쪽 발이 저려와요 ,예전엔 안그랬는데 바닥에 앉아있다보면 왼쪽발이 저려오더라구요 이유가 뭘까요 ,신경과
성인 소발작,검사받으러 가려는데 어느 병원으로 가야하나요  바로 대학병원 가도 진료 받아주나요 ,신경과
뇌전증 완치,중학교때 뇌전증발병이되고 지금  살까지 약을먹고있는데요 고등학교때부터는 이상없었고 검사도 이상없어요  약먹으라해서 먹고있는중이에요  근데 군대는 완치가되야 갈수있다해서요  뇌전증 완치판정은 어떻게해야 받을수있나요  채택합니다,신경과
배가 갑자기 미친듯이 아픈뒤 실신  ,저는 아니고 신랑이 올해 두번이나 실신을 했어요  두가지의 공통점은 갑자기 배가 엄청 아파서 이상하다고  느끼자 마자 기억을 잃었다는 것이고  과식을 한 뒤였다는것   화장실갈 상황이 아니라 참았다는점   금방 정신이 돌아오긴 했지만   식은땀을 흘렸어요  한번은 근무 하면서 그랬고  한번은 오늘 운전중에 배가 아프다고 차를 잠시 멈춘뒤  갑자기 기억을 잃은 상태에서 주먹을 불끈지고 크게 으아아아악  하고 고함   치듯이 소리를 질렀는데 본인은 기억이 안난대요   이상한게 기억을 잃고나서 고함을 쳤다는 거에요   그리고는 정신이 곧 들어 차에서 내려서  배가아프다며 설사를 하고 나니까 금방 괜찮아 졌어요    지금은   대 중반인데    대 초반에 딱 한번 배가 아픈뒤 실신한적이 있었고  올해  번까지 총  번째입니다  처음에 병원갔을때는  미주신경성 실신이라는 진단 외에는 다른것은 문제 없다고 했었는데    위경련인가 싶고 원인이 뭔지 찾고싶어요,신경과
발작인가요,새벽부터 속이 너무쓰리면서 아팠어요 가만히 있지도 못하고 숨도 제대로 못수 서 헥헥거려야 하는데 아팟다 안아팠다 이러거든요 근데 이렇게 아플때마다 손이랑 발이 굳어서 안움직여요 발작 하는거처럼 손발이 저릿해지면서 이상한 모양으로 굳어서 덜덜 떨리고 안움직여요 왜이러죠    방금도 너무아파서 응급실에 가려고했는데 또 괜찮아졌어요 ,신경과
뇌전증이 의심됩니다,혀옆에를 깨물었는데 자는동안 몰랐나봐요  아침에 일어나 아파서보니 베개에 피가 묻어있었데요  혀가 깨물려서 피가 났을 정도면 아파서 자다 깼을 법한데도  몰랐다는게 너무 걱정됩니다 무슨일일까요   저희 엄마 이야기구요 올해   세 되십니다  예전에 뇌전증 앓으셨다가 병원에서 이제 약 않먹어도  된다고 하셔서 약 않드신지  년이상 된것같아요,신경과
아빠가 한순간에 멍때리면서 침 흘리고 하는데 무슨 문제가 있나요   ,아빠가 말 하다가 갑자기 한 순간에 멍 때리면서 경직  된 상태로 침을 질질 흘리시고 진짜 너무 걱정돼요 담배때문에 그런걸까여     병원가서 검사를 받아보는게 좋을까요  간다면 어디 무슨과를 가야하나요 제발 알려주세요   너무 걱정돼요 예전에는 해봤자 한번 밖에 안하고 그럼증상 별로 없는데 오늘은 두번이나 그랬어요   진짜 부탁드릴게요   증상도 알려주세요 아니면 지금 먹고 있는 약이 독해서 그런걸까요    진짜  이러다 큰일 나는거 아닌가 싶어요  ,신경과
손과 몸떨림 증상, 달반 정도 전부터 몸에 진동오듯이 몸떨림이 시작됐고 같이 손떨림도 시작되었습니다 손떨림은 진동오듯이 올때도 있고 진짜 손이 살짝 떨릴때도 있습니다 자고일어나면 제일 심하고요 근데 몸을 움직이면 몸떨림 손떨림이 사그라들었다가 쉬거나 가만히 있으면 몸과손이 떨려 미치겠습니다 혹시 크게 아픈걸까봐 무섭네요 광고성글 진짜 제발 달지마세요 ,신경과
남편이 수면중에 다리를 움직여요,남편이 수면 중 다리를 움직이는데요 좌우로    번 정도 짧게 흔들듯이 움직이입니다 찾아보니 하지 불안 증후군 인 거 같은데 하지 불안 증후군은 다리에 불편한 감각이 있어서 움직일 수밖에 없다는데 본인은 누워있을때나 잠들기전에 다리에 이상한 감각이 전혀 안 느껴진다고 해요 왜 그러는 걸까요   ,신경과
악성 뇌종양도 크기와 위치에 따라 생존율이 다른가요 ,크기가 작거나 위치가 괜찮다면 생존율 자체가 많이 올라갈수있나요 아니면 양성이 아니고 악성이 붙은이상 너무 힘든 상태인가요 정밀검사를 한것이 아니라 뇌경색으로 의심하여 신경과에 입원했는데 신경과에선 악성 뇌교종을 말하고 신경내과로 아직 과가 바뀌진않앗어요,신경과
매운음식 먹고 몸 경직 증상  ,엄청 매운 짬뽕을 먹는중에  갑자기 배가 엄청 아픈거예요 윗배가   가슴과 배꼽 사이 상복부  위치  엄청 아파서 잠깐 누웠는데 온몸에서 땀 줄줄 나고 손발 경직돼서 안 펴지고   진짜 죽는건가   했는데 서서히 나아졌어요    왜 이러는 거죠 지금은 정상인데 응급실이라도 가봐야할까요,신경과
저 진짜 어떡하죠,꽤 됐는데 요즘 너무 심해졌어요 우울증도 없고 그닥 스트레스를 많이 받지도 않는데 요즘 그냥 별일 없는 일상을 보내고 있는데도 지금처럼 제가 하려는 말도 잘 못하고 기억력이 너무 안 좋아졌어요 진짜    너무 심각해요 방금 내가 뭐를 하려고 했는지도 까먹고 뭔가 기억이 지워진 것처럼 아무것도 기억이 안 나요 고 인데 이런 것 때문에 스트레스를 지금 너무 심하게 받아서    머리가 아예 굳은 느낌이라고 해야 하나 머리가 안 굴러가요 멈춘 느낌  회전이 아예 안 돼요 어떡하죠 진짜 너무 심각한 것 같아요 내가 무슨 말을 했는지도 기억을 못 해요,신경과
화이자 차 후 담 걸린 것 처럼 아파요,제가 하루전에 백신을 맞았는데 오전까지는 괜찮았는데 오후 되니까 갑자기 목에 담 걸린 것 처럼 아픈데 그냥 아플건지 부작용인지 모르겠어여,신경과
오른손 손가락 끝이 저림,새끼손가락 빼고 나머지 손가락 끝이 다 저려요 몇일동안 이러는데 왜 이럴까요 ,신경과
두통  메스꺼움  헛구역질  어지러움,안녕하세요    대 여자입니다  요즘따라 두통도 심하면 하루에 한 번  덜 하면 이틀이나  일에 한 번 꼴로 아픈데 항상 두통이 올 때마다 속도 메스껍고 헛구역질도 나요  평소 편두통도 좀 심한 편이었고  최근 몇 달 동안 학업과 일을 병행하면서 몸이 많이 지치기도 했었었어요  늘 밖에 나가있을 때나 회사에 있을 때  아니면 막혀있는 실내 안에 있을 때 등 이럴 때는 꼭 아팠던 것 같아요    이 외에는 조금 불편함이 느껴지는 정도   속이 안 좋아서 밥을 먹기에도 불편하고 편두통 약을 먹어도 그렇게 나아지는 것 같지도 않아요  도대체 뭐 때문에 이렇게 아픈 건지 알고 싶어요     ,신경과
의사선생님 도와주세요  너무 어지러워서 미칠거 같애요,진짜 다른 증상 아무런 증상 없고   일 내내 이랬는데 씻다가 어지러워서 넘엊지고 이거 병원 가야겠다 싶어서 병원 갔습니다  ct 채혈 어지럼증검사 받았는데 뭐 뇌에 문제 있는것도 빈혈도 아니라고 하고 전정 신경염일거라고 하더군요   그러면서 약을 처방받았는데   부터   까지 숫자가 있고   이 제가 일상생활도 못할정도로 어지러움이라 치면  까지 아프던게 약 먹으면 딱  정도까지 아픕니다   예  별 효과가 없어요  걍 이 악물고 약 처방받고  일째 일상생활 중입니다  총  일째 어지러운거죠   어지럽고 독감에 걸린적 있는데 지금 열만 없고 독감 걸린 느낌이에요  어지러워서 빙빙 돌고 다리에 힘풀리고 눈에 힘이 안들어가요   진짜 미칠거 같애요  제발 같은 병원에 다시 가야할까요  진짜 가도 검사 다 찍어도 아무 이상 없다고만 하고 아프기만 하고 약도 효과 있는지도 모르겠어요   진짜 이런적이 없는데 그냥 미쳐버릴거 같애요  의사선생님 여기 계시나요  짐작되는 병명이라도 있을까요  참고로 코로나는 음성입니다  백신은  차 접종한지 한달은 넘었고요  저 대체 언제까지 아픈거고 대체 왜 이런건가요  처방 받은 약 첨부합니다,신경과
머리 어지러움 증상,일주일 전부터 하루에 한 번씩 머리가 띵하면서 어지럽습니다  앉아있을 때만 증상이 나타나고 주로 오후 시간에 나타납니다  구체적으로는 기립성 저혈압처럼 누워있다가 갑자기 일어나면 머리가 띵한 것처럼 한  초 정도 증상이 나타납니다    병원에 방문했을 때는 뇌와는 관련이 없어보인다고 하시는데 본인이 원한다면 뇌 ct 검사를 받아보라고 하셨습니다  뇌 ct를 찍을 때 조영제를 맞아야 한다고 해서 부작용의 불안함 때문에 생각해본다고 했습니다   알레르기 비염을 앓고 있는데 조형제를 맞고 뇌 ct를 찍어도 괜찮을까요   또한  뇌 ct를 찍을만큼 심각한 증상인가요   최근 심리적으로 큰 충격을 받아 불안 우울감이 조금 있습니다  심리적인 문제와도 관련이 있나요 ,신경과
가만히 있는데 자꾸 멀미나여,어제 저녁에 버스에서 잠깐 멀미를 했어서 내려서 공기 좀 쐬니까 나아지는듯하더니 바로 학원가니까 멀미가 약하게 자주 나고 다시 버스타고 집 올땐 안나더니 집오니까 멀미가 약하게 나네요   오늘은 아침에 학교가니까 머리가 아파서 약 먹으니까 나아졌긴했는데 멀미가 약하게 자주나고 지금도 약하게 멀미나요    차에 있는것도 아닌데   심하게 나는건 아닌데 좀 토할거같고 불편하네요 괜찮아졌다가 다시 멀미나다가 또 괜찮아졌다가    가만히 있었는데 왜그런가유,신경과
계속 공부하거나 뭐 할때 갑자기 머리가 어지러우면서 손이나 몸에 힘이 없어지고 갑자기 하던게 멈춰지면서 생각이없어지는데 왜이러죠      한 번,계속 공부하거나 뭐 할때 갑자기 머리가 어지러우면서 손이나 몸에 힘이 없어지고 갑자기 하던게 멈춰지면서 생각이없어지는데 왜이러죠      한 번씩 어지러워서 내가 뭘 했는지 기억도 안날때가 있어요,신경과
관자놀이 통증  고개 위로 들면 턱 통증,안녕하세요 스무살 남학생입니다 오늘따라 왼쪽 관자놀이가 누르면 굉장히 아픈데 무슨 이유일까요   뭐 처음있는 일은 아니라서  그리고 입술 포진도 나고 고개를 위로 바라보고 들면 턱이 아픕니다  건강에 이상이 있는 걸까요  운동은  년 내내 하는 중입니다,신경과
머리 속이 간질간질 울려요,술취한 것처럼 머리가 어지러운 느낌이에요 간질간질 하고요    왜 그런지 궁금해요   멍한 느낌  골이 울리는 느낌이랑 비슷해요   ,신경과
한달의 한번은 뒷머리가 아파요,여기 부분이 계속 통증이 옵니다 제가 일단 경우에수는 자세가 안좋구요 잘때 몸은 침대에 있고 머리는 뒷쳐서 잘때가 있어요 베게에 있으면 조금 나지는데 베게가 없으면 진짜 아파요 게보린 먹어도 통증이 계속 됩니다 제가   살인데 잠은  시  분정도 잡니다 잠을 별로 안자서 이나요  경우에 수를 다 알려주세요,신경과
오른쪽 두통과 콧물 및 재채기,어제까진 살짝 스치는 두통만 있다가 갑자기 오른쪽 두통이 심해지면서 끈적하고 투명한 콧물이 흐르면서 재채기가 동반되는데 알레르기성 비염이 두통도 동반하나요  아니면 얼마전부터 오른쪽 발 저림 및 근육 부르르    떨림이나 수전증 증세도 나타나고 있는데 뇌 질환 위험성이 있는 건가요  mri를 찍어봐야 할 것 같은데 부작용이 있을 수도 있다고 해서 너무 무섭네요   ,신경과
체력 저하로 인한 두통,가끔 많은 활동을 하고 나서 조금 지나면 두통이 몰려와 밤까지 고생하다 자면 나아질 때가 많습니다  체력이 저하돼서 두통이 오는 것일까요 아니면 다른 이유가 있는 것일까요 ,신경과
갑자기 어지럽고 식은땀이 나요,저는   살인 여학생입니다  줄넘기 하면서 운동하고 있었는데요 갑자기 식은땀이 나면서 어지러운데 왜그런거죠   그리고 평소에는 잘 체하기도 하고 위도 엄청아프고 그런데 왜그런걸까요   내공   걸게요,신경과
빛에 민감해서 두통이 생기는 경우도 있나요 ,종종 아침 해가 떠오를 시간대가 되거나 실내에서 실외로 나가거나 하면 순간적으로 두통이 일어나는 경우가 많아서 걱정이 되고는 합니다      태양광을 보고나면 자주 발생함     처음에는 왼쪽 이마  관자놀이 정도 위치 머리 안쪽이 아파오다 조금씩 뒤로 번져감     지속시간은 짧으면   초에서 길면   여분 이상 다른 행동을 하기 어려운 정도로 머리가 깨질듯 아픕니다     주기는 비 주기적으로 한번 발생하면 약     정도는 같은 증상이 조건을 만족하면 자주 발생합니다     집 인근 병원에서  개월 전 진료를 보았을 때 편두통 약을 처방 받았었습니다만 큰 효과는 느끼지 못했습니다   이러하다보니 태양광에 민감해서 그런건지 아니면 다른 병같은게 있는건지 걱정이 됩니다만 생업으로 인해 병원에 다녀오기에는 부담이 되네요 ,신경과
머리가 아파요,스트레스만 받으면 머리가 지끈지끈 아파요  뒷통수가 움직일 때마다 아플 때도 있고 간헐적으로 찌릿 따끔 이럴 때도 있어요 단순 스트레스 때문에 이럴 수가 있나요  그냥 심리적인 원인인걸까요 ,신경과
밥 먹을 때나 등 머리가 떨려요,어디에 집중을 하거나 밥을 먹을 때 고개를 숙일 때 긴장을 하면 목이 좀 뻣뻣하면서 머리가 떨려요   근긴장이상증인가 그거라던데 진짜인가요  아니면 무슨 병이죠 ,신경과
대변 보다가 아득해지고난후로 계속 머리가 아파요,한 달 전에 대변을 보면서 힘을 살짝 줬는데  갑자기 앞이 하얗게 아득해지면서 머리가 확 당기더라구요  하룻밤 자고 난 후로 괜찮아졌었는데 그 후부터 대변 본다고 힘을 약간 주거나  무거운거 든다고 힘을 쓰거나 하면 머리가 아프기 시작했어요  그리고 갑자기 고개를 확 돌리거나 하면 미약하게 어지럽네요  최근에는 고개 돌리거나 몸을 확 틀면 어지러운 증상은 사라졌는데   신경쓰거나 스트레스 받거나 하면 수시로 두통이 찾아옵니다   두통이 있을때는 설거지 하다가 그릇끼리 쨍 하고 부딪히는 날카롭고 높은 소리에  머리가 크게 아프네요   직장에서 날카롭고 높은 소음에 노출되서 귀가 아프고 머리 아픈 탓도 있는듯해요   병원에 가보니 검사를 해보자해서 시간이 없다고 하니까  대변 보다 힘줘서 그런거같다  약부터 먹어보자고 한 뒤로  주 정도 지났는데 검사를 받아봐야할까요    고맙습니다,신경과
어지러움  메스꺼움이 생겼어요  ,오늘 새벽부터 갑자기 생긴 증상인데요   스마트폰 하며 누워있었는데 갑자기 술 마신것 처럼 핑핑 도는 느낌이 계속 났고 몇 분 정도 가만히 있으면 좀 괜찮아 지다가 움직이거나 하면 또 어지러운것 같고 자고 일어났을 때도 마찬가지로 어지러움을 느꼈습니다  메스꺼움도 느껴져서 헛 구역질도 했구요    술 마신것 처럼 어지럽고  메스꺼운 증상만 있으며 다른 증상은 전혀 없습니다  지금도 앉아 있는데 계속 어지러움이 느껴지고 메스껍네요    이게 무슨 증상인가요  새벽에 갑작스럽게 생겨버려서 당황 스러워요,신경과
평상시 두통은 달고 살았지만 요 몇일 두통이 약을 먹어도 가시질 않아 mri를 찍었더니 좌측 빈공간에 뇌에 물주머니가 있다네요  정확한 병명이,평상시 두통은 달고 살았지만 요 몇일 두통이 약을 먹어도 가시질 않아 mri를 찍었더니 좌측 빈공간에 뇌에 물주머니가 있다네요   정확한 병명이 뭔가요 ,신경과
 일 식했는데 몸무게가 안줄어듬  ,며칠전에 원인모를  키로가 갑자기 쪘거든요  그래서  일 식을 며칠만하려고 어제 진짜 아침에 소량 사과  당근주스  먹고 그뒤론 굶었거든요  근데오늘아침에 재보니 몸무게는 그대로    그전에는 이정도하면 한      정도는 빠졌단말예요   근데 왜 갑자기 안빠지는거죠 ,신경과
쓰러질 뻔 한 이유,  분 정도 그냥 서 있었는데 발 시렵고 좀 다리가 추운 정도 였어요  시쯤 이었는데 아예 공복 상태였고요 갑자기 눈 앞이 점점 하얘지더니 속이 안 좋고 어지럽고 몸도 휘청거리고 땀이 엄청 많이 났었어요 이러다 쓰러질 것 같다는 생각이 들어서 앉아서 물이랑 초코릿 좀 먹고 살짝 어지럼증만 남았었는데 원인이 뭘까요  병원을 가봐야할까요  어느 병원을 가야하나요,신경과
왼손 움직임 둔함,평소에는 잘 모르겠는데 흔히 말하는 반짝반짝  손동작을 빠르게 하면 왼손이 오른손보다 둔하고 빠르게 움직이지 않습니다 혹시 문제 있는 걸까요 ,신경과
백신 맞고  주후  차접종 가능한가요 ,    에  차접종완료했는데 아무 이상이 없어 최대한 빨리   일에  차를 맞고싶어서요    일로 예약날짜를 변경해달라고 하면 변경해주나요 ,신경과
뇌 mri  조영제x 로 뇌수막염  뇌염진단이 가능한가요 ,두통이  달째 지속되었는데 mra  mri 소량 서비스로 찍었을때 뇌동맥류 의심소견으로 나왔었습니다  뇌동맥류는 ctangio 로 내년 월 추적검사하기로 했었고  설사 뇌동맥류라 하더라도 두통이있을만하지는 않다    mm  라고 여러병원 의사들이 말씀하셨습니다  다른것은 이상없음  두통이 또 세게 지속되어 응급실을 갔고  남은검사가 사실상 요추천자밖에 없어 문의를 드렸으나 염증수치가 보통    이나     이상이 되어야 세균성이나 감염의심된다고 요추천자를 한다하였고  저는     이어서 염증수치가 전혀없고 열도 거의없어서 요추천자의 위험성이 훨씬 크다고 병원에서 거부하였습니다 피검사 오줌검사도이상무   그래서 뭐라도 해달라해서 의사가 고민하다가 뇌mri 오더가떨어지고 mri 찍은후 역시 깨끗하다고 합니다  결국 머리아픈상태 그대로 퇴원을 하게되었습니다  그런데  조영을 넣지 않았더라구요  의사쌤이 mri 조영하면 어느정도알수있다고 말했는데  여튼 조영을 넣진 않았습니다  제가 응급실 방문전 구토하여서 그런것 같기도하고요 뇌염 또는 뇌척수액에 염증이 있을시  mri 비조영시에도 이것을 충분히 진단할 수 있나요  다시 조영을 하고 찍어야하나 궁금합니다  아 그리고  예전에 두통으로 경추 mri도 해봤는데 두통을 일으킬만한 소견은 없다고 하네요 ,신경과
의료보호 종 뇌혈관 mri 얼마나 하나요 ,제목그대로    의료보호 종 뇌혈관 mri 얼마나 하나요  의사가 권유해서 해도 많이 나오나요 ,신경과
식욕억제제에 부작용으로 우울감 있나요 ,원래 우울감을 많이 느끼는 편인데 식욕억제제 먹고 나서 엄청 심해졌어요   그러고 몇시간 지나면 우울감 다시 사라지고 반복하는데   식욕억제 효과는 하나도 없는데 원래는 없던 차멀미랑 우울감이 심해졌네요   약 먹고나서 우울감이 평소에 안좋은 생각 하던게 더 증폭되는 느낌이에요,신경과
병원 진료과 질문,제가 편두통이 굉장히 심한데 가끔은 눈 안쪽 부분이 눈을 뽑고 싶을정도로 눈이 아플때도 있습니다  이럴 때는 안과를 가야하나요 아니면 어디로 진료를 받으러 가야하나요 ,신경과
