0,1,2
손바닥이 꾹꾹 찌르는 느낌이에요 얼마전 부터 하루에 한번씩은 땡기는느낌이 너무 쎄요    뭔가 바늘로 꾹  찌르는것 같은 느낌이  초 정도 가다,손바닥이 꾹꾹 찌르는 느낌이에요 얼마전 부터 하루에 한번씩은 땡기는느낌이 너무 쎄요    뭔가 바늘로 꾹  찌르는것 같은 느낌이  초 정도 가다가 멈춰요  ,신경과
뇌진탕 어지럼증,뇌진탕이 있고  달 뒤에도 어지럼증 등 일상에 영향이 가는 경우가 있나요    달 전 쯤에 뒤로 넘어지면서 머리를 박았던 적이 있는데요  다행이 응급실가니 뇌출혈은 없다고 하더라구요  그 뒤로 일주일정도 심한 어지럼증 있었고  한달까지는 아주 가끔씩 어지러운 증상있었는데 지속적으로 이어지진 않고 금방 가라앉아서 따로 병원간 적은 없어요  한 달이 지난 이후에는 어지러움을 느낀 적이 없구요   근데 최근에 어지러움을 느끼기 시작했어요  약  주 전 쯤인가  부터 핑  돈다고 해야하나요  그런 어지럼증이 있더라구요  그래도 전보다 짧은 시간 안에 괜찮아지기도 하고  일상에는 지장이 없다고 생각해서 놔뒀습니다  그런데 오늘 갑자기 자동차 운전하는데 핑글 도는 느낌으로 어지럼증이 오더니 조금 있다가는 눈이돈다는 느낌이 들고  세상이 빙글 돈다고 느껴질 정도로 어지럽더라구요  시야도 흐릿한 느낌 같기도 하고 해지고 운전하다가 어지럼증 느끼고 제가 불안해서 그렇게 느낀 건진 모르겠지만    다행히 운전을 잘 마치긴 했는데    그 뒤부터 계속 걷고 있을 때도 어지럽고  고개 돌릴 때도 어지러워요   오늘 어지럼증이 단순히 운전하다가 긴장을 해서 그런걸까요  아님  달 전 있던 뇌진탕의 영향인 걸까요    만약 긴장해면 휴식 취하고 내일 일하러 나가도 될까요   ,신경과
갑자기 놀란거 처럼 발작,잘때 떨어지는꿈 꾸면 놀랠때 발작 일으키는거 처럼 뭐 하다가 머리가 띵 하면서 한번 발작 이라해야하나 깜짝 놀란거 처럼 이래요     이거 왜이래요         ,신경과
허리 아픈 꿈을 꾸고나서부터 허리가 너무 아파요,제가 꿈을 자주 꾸는 편이거든요 근데 허리가 안펴지고 꾹꾹눌러도 아프고 허리가 펴지지 않는 꿈이었는데 깨자마자 허리가 죽을듯 아파서 미치겠어요,신경과
팔 스트레칭도중 부상 ,운동 끝나고 팔 스트레칭도중 쭉늘리는 과정에서 갑자기 엄지손가락에 약간 무딘증상  이 있습니다 그리고 팔에 힘을주지않아도 팔이 접히는 증상이 있습니다 심하진않음 큰 문제는 없을까요  통증은 없습니다 갑자기 이러니까 당황스럽네요 빠른답변부탁드립니다 ,신경과
머리 뒤쪽부터 자꾸 띵해요,제가 빈혈이 조금 있는데 조금만뛰거나 숨차거나 몸에 힘이들어가면 갑자기 머리 왼쪽 뒤쪽부터 띵 하면서 어지러워요 가만히 있어도 숨차고 손에 힘도 잘 안들어가요   왜 그럴가요오    혹시 무슨 병은 아닌지  걱정되요    ,신경과
앉았다 일어날때,말그대로 어머니가 앉았있다가 일어날때 힘들게 일어나시더라구요 다리근육이 약해서 그런건가요  두통이나 허리통은 아니구요 어머니가 계속 서서 근무를 하시는데 그런것도 어느정도 있는건가요    대 중반이십니다,신경과
누르면 두통 생기는 이유,머리를 누르면 쿡쿡 찌르는듯한 느낌이 드는데 이유가 뭘까요,신경과
어지럼증 증상 원인이 멀까요   어디가야하죠,나이는    여자 입니다  코로나  차 백신 맞은지   일째부터 조금씩 어지럽기 시작했던 것 같고 오늘은   일째 입니다   가끔씩 핑 하고 머릿속이 도는 것 같은 느낌이고 앉아서 일을하는데 가끔씩 어질 하고 다시 괜찮고 걷다가 어질 하고 괜찮고 그렇습니다  처음엔 컨디션이 안좋나 하고 어질하는 시간도 순간이고 그래서 별로 신경 안썼는데 요즘은 더 자주 어질해서 자꾸 어지러우니까 멀미나서 시선을 잘 못돌리겠는 느낌도 있어요    일째에 자동차를탔는데 멀미를 심하게 하고나서 증상이 더 심해졌습니다  그날 저녁에 지하철을 탔는데 앉아서 창에 뒤로 기대니까 너무 어지러운게 심하고 멀미나고 누워서 머리가 세상이 도는것처럼 어질어질 하더라구요  다음날 아침에일어나서는 괜찮아서 나아졌나보다 하루좀 어지럽고 말았나보다 싶었는데 저녁되니 잠깐잠깐 어지럽고 멀미나요  백신맞고   일째는 장염때문에 열이   도 올랐고   일째   도 링겔맞고    일째   도로 정상으로 내려왔습니다 장염증세도 싹 낫고 배아픔만 약간 있었습니다  항생제알러지때문에   일째 항생제 한번먹고 그이후로 안먹었습니다      일째부터 알러지주사와 알러지약 먹었습니다  항생제가  종이었는데 하나는 고정약진이 있어서 입술붓고 팔목에 벌겋게 붓고 나중엔 어둡게 착색이됩니다  지금 포함해서  번정도 경험하여 알게되었습니다   다른하나는 근육뭉침과 얼굴저림 반신저림이 생깁니다       일쯤부터 근육뭉침이 풀리면서 뒷목 피부가 만지면 따끔한 증상 있었습니다 몸살과 비슷한데 피부 아픔 증상만 있음  지금포함해서  번정도 경험했는데 복용약과 상관성은 이번까지  번 있습니다   장염이   일까지는 배가 계속 좀 아프다가   일부터는 안아픕니다     어지럼증 병원은 어디로 가야하나요    어지럼증이 백신 부작용인가요     장염이 백신 부작용인가요     어지럼증이 장염때문인가요    가만히 있어도 어지러우니까 이석때문은 아닌가봐요    다른증상은 없는것 같습니다 ,신경과
뇌졸중 영양제 질문이요,뇌경색약 혈압 당뇨약 섭취중인데 포스파티딜세린 뇌영양제 먹어도 상관없나요 ,신경과
말초신경병인데 완치가능한가요,말초신경병으로 전신이 랜덤으로 화끈거리구 저리구 신경통오구 따갑구 아픕니다  목허리디스크 정상 당뇨도 정상수치  종합검진도 이상무 퀴놀론항생제 부작용으로 강하게 의심하구 있습니다 한번도 이런적도없었구 아주 정상으로 잘지내다가 퀴놀론먹구 다음날부터 전조증상도없이 전신신경통 관절통 인대통 브레인포그 극심한 불면증 비정상적인 신체증상이한번에와서요 증상발현  개월정도 됬구요 지금 엠코발   이랑 네오팬틴캡슐 가바펜틴  복용중에 있습니다  말초신경병 완치가능한가요   통증완화가 목표가 아닌 완치를 목표로 하구 싶습니다 병원에서는 엠코발이랑 네오팬틴 일단 한달먹어보라는데 말초신경병이  차 약제  차  차 이런식으로  접근하는 개념인가요  신경줄기세포가 있는거같은데 상용화되있나요  그리구  최종적으로는 신경줄기세포치료로 완치가능한가요   이렇게 랜덤적으로 가만히있는데도 화끈거리구 극심한신경통오구 따갑구 좀만자극주면 아픈게 왜 그런걸까요   이제는 너무 지쳣구 앞으로 계속 이렇게 아플꺼 생각하면 막막해서요 완치가 가능한걸까요    줄기세포는 비용이 어느정도할까요   ,신경과
몸 안이 간질거려요  어느 진료과를 가야 할까요 ,아주 어렷을때부터 다리쪽이나 단전에서 상체쪽 신체 안 쪽이 간질간질 거려요  그럴때마다 몸에 힘을 주고 부들부들 떤다고 해야하나  그렇게 해야 잠깐 괜찮아지고 조금 있으면 또 그렇게 간질간질 거려서 계속 반복하게 돼요  안 하면 몸이 계속 느낌이 이상해서   이거 뇌쪽에 신경 문제가 있는 걸까요  기분탓 느낌 탓 아니고 정말 이상해서 글 올립니다  정확히 아는 분만 답변 부탁드려요 ,신경과
흡연으로인한 두통과 어지러움,어지러움증과 두통이심해 신경외과에서 뇌 mri와 ct찍었는데 이상소견이없어서 이비인후과를 진료보라고 선생님이 해주셨는데 이비인후과에도 이상이 없었습니다 신경외과 진료당시 흡연으로인한 심한두통과 어지러움증이라고 말씀안드렸는데 mri와ct에 이상이없으면 흡연으로인한 뇌에 영향은없다는건가요 자세한답변부탁드립니다 신경과를 다시내원해서 흡연으로인한 두통과 어지럼증이라고 진료다시봐야하나요,신경과
 발 사진 주의 하세요      ,자꾸 사진에 표시한 부분의 핏줄이 땡긴다고 해야할까요  걸을 때마다 뭔가 튀어 나와서 같이 바닥에 닿는 느낌인데 이거 왜 그런걸까요      만약 병원에 가야 한다면 어느 병원으로 가야하나요  ,신경과
뇌경색 후 성격장애  인격장애,안녕하십니까  저의 아버지 만   세  증상에 대하여 문의 드립니다      년  월과  월 두 차례 뇌경색이 있었습니다  재활을 위한 병원 입원을 완강히 거부하여 집에서 요양 중이십니다  신체적으로는 특히 다리 근육이 많이 빠지고  힘이 많이 떨어진 상태지만 주위 물체를 손으로 집고  평지에서 지팡이를 집고  때론 지팡이 없이 자력 보행이 가능하시고  상체 힘은 뇌경색 전과 비슷하십니다  장기기억  단기기억 모두 좋으시고  인지기능 역시 크게 떨어져 보이지 않습니다  발병 후 집에서 요양하는 중 거동이 불편한 점을 빼면 크게 문제를 보이지 않으셨으나  약   주 전부터 이상행태를 보이십니다  크게 치명적이지는 않았으나 자살을  번 시도하셨고   번은 칼을 들고 가족들을 위협하여 경찰과    가 출동한 적이 있습니다  자주는 아니지만 밤에 주방에 누군가 있다는 말씀을 하시거나  가끔 허공을 응시하는 행동을 보이십니다  어머니의 불륜을 의심하시며  누나들에게 빌려 준 돈을 부풀려 받지 못했다고 특정 누나를 싫어하십니다  신경과 주치의는 정신병원 입원을 권유하셨습니다  이상행동이 있으신 후 정신과 약을 복용했습니다    월  일부터 쿠에타핀    mg  t  리보트릴  t 취침전    쿠에타핀    아침 에    월  일부터 폭력성을 이유로 리스페리돈    mg  t 아침  저녁 을 추가적으로 처방받았습니다  이상의 약을 복용하면 이상증세가 발현되지 않았지만  몸이 너무 쳐지셔서 자력보행 조차 못하는 상태로 지내셨습니다  이 후 모 대학 정신과 진료 후 위의 쿠에타핀 등 약 대신에 쎄로켈정   mg  t  심발타캡슐   mg  t를    월   일 부터 복용하고 있습니다    일부터 오늘까지 아버지 상태가 매우 좋았는데 오늘밤에 다시 어머니에게 부부관계를 요구하고 화를 내는 상황이 벌어졌습니다   정신과 진료시 담당교수는 치매나  섬망증상으로 보기는 어렵고  뇌경색 후 우울증 증세가 있는 것으로 보았습니다  뇌경색에 따른 전두엽 손상으로 인한 성격변화 등은 좀 더 지켜보자고 하셨습니다  지금은 아들인 제가 휴직하여 고향에서 아버지 간병을 하고 있습니다  약도 조절하고 재활도 다시 시킬 생각으로 휴직을 하고 간병을 시작했는데  아버지의 이상행동이 치료 또는 교정될 수 있는 건지 모르겠습니다  한 없이 휴직을 할 수 없는 상태이고  이러한 경우 아버지의 이상행동의 원인과 효과적인 치료방법이나 간호계획을 조언해 주시면 감사하겠습니다   ,신경과
걷는거를 줄이면 서서히 나을까요    바로채택합니다 ,제가 아르바이트때매 최근  주동안    만보정도로 오래걸었는데 전단지 부착 및 배포 알바하였습니다    잠도 깊게 못자고 일했었습니다   해당 사진부분의 오른발 뒤꿈치의 위에부분이 가만히잇음 욱신거린다거나 그런건아닌데 손으로 누르거나 완전히 바닥에 디디기전에 바닥에 살짝디디면 바늘찔리듯이 살짝 찌릿거리면서 따끔거리면서 아픈데 오늘 오후까지 멀쩡하다가 저녁부터 증세가 갑자기 나타났슨비다   오래걸으면서 해당부분의 근육에 자극이 계속가서 그런건가요  족욕하고 파스바르면서 걷되 무리하게 걷는거를 피하고 푹자면서 쉬다보면 며칠안에 나을까요   족저근막염이 오려는 걸까요       빠른답변부탁드립니다 ,신경과
머리가 어지럽고 띵해요,안녕하세요   살 학생이고요 자퇴생입니다  일단 저는 자퇴를 했기 때문에 독서실을 다닙니다  인실을 사용하고 있고요 이곳에 창문은 없지만 환풍기 는 있고 보통  시에 가면 오후   시 반에서   시 사이에 집을 갑니다 저는 이런 생활을 한 두 달 정도 했는데 갑자기 어제부터 머리가 띵  합니다 저도 어느정도 했다하면  보통  시간  시간 반 공부에   분 휴식을 합니다  쉬는 시간에 테라스를 가기도 하고 학원도 가고 하는데 갑자기 왜 이러는 걸까요 뭐에 체한 것도 아니고 딱 머리만 이럽니다 이거 왜 이러는 걸까요 열이라도 나면 병원이라도 갈텐데 그것도 아팠다가 안 아팠다가 해서 더 힘듭니다 제가 뭘 어떻게 해야할까요,신경과
머리가 띵한 느낌,제가 누워 있거나 엎드려 있거나 가만히 서있으면 머리가 눌리는 느낌  약간 띵한 느낌  이 나면서 귀가 먹먹해져요 이게 뭔가요 ,신경과
하지불안증후군은 정확이 무슨 과에서 보나요 ,신경과인줄 알았고 신경과를 다녔었는데 네이버 검색해서 제일 처음 나오는 내용에는 정신건강의학과라고 되어 있네요 정확히 무슨 과에서 진료 받아야 하나요  수면장애를 일으키고 도파민과 관계있다고 하니 정신건강의학과하고도 관계가 있을 것 같은데요 그리고 세부 분야 어떤 의사에게 진료 받아야 하나요  종합병원에서요,신경과
머릿속에서 계속 웅웅대요,수능이 얼마 남지 않은 고 입니다 요즘 들어 스트레스를 많이 받아서 그런 건지 모르겠지만  매일 심한 두통을 앓고 있습니다  그냥 찌릿찌릿하는 두통이 아니라  머릿속에서 웅웅 소리가 들리면서 마치 제가 어떠한 상태 또는 새로운 차원으로 빨려들어가는 것 같은 느낌이 듭니다  머릿속이 그럴 때마다 많이 어지럽구요  그 웅웅대는 게 약간의 컨트롤 이 가능해서 의도한다면 끝없이 머릿속이 윙윙대도록 할 수도 있습니다  제가 빈혈기가 좀 있긴 한데 그게 원인이 되었을까요 어떻게 하면 나을 수 있을까요  오메가   빼고는 약을 별로 먹지도 않습니다  오히려 먹어야 하는 우울증 약을 안 먹고 있습니다,신경과
후각상실과 미각상실 증상을 겪고 있습니다,후각은       정도는 돌아온듯 한데  맛은 약하게나마 잠시 났다가 사라지고 또 어떤 특정한 맛들은 아예 느끼질 못하네요    후각이 돌아오면 미각도 같이 좋아진다고 하던데 그것도 아닌거 같고        미각신경 손상이 심해서 이런 증상들이 계속 되는지 정말 궁금합니다    또 미각상실 치료법에는 어떤것들이 있는지 궁금합니다 ,신경과
머리가 띵한느낌,안녕하세요 저번 주에 일때문에 날을한번 새고 머리 앞쪽 이마쪽에 경미한 두통과 띵한느낌이 지속되어서 한번 여쭤봅니다  역류성식도염을 앓고 있는데 이로 인한 증상은 아닌 것 같고 내과에서 약처방을 받았는데 효과가 없는 것 같습니다  신경과에가서 진료를 봐야 하나요  지속적인 증상이면 문제있는건가요 ,신경과
손가락쪽 관절 저림,그림에 표시된 쪽이 어제부터 슬슬 저린데요  평소 강의 들을때나 집안일 할때는 멀쩡한데 잠자려고 그러면 저려요 ,신경과
눈알통증심한데 시신경염일까요, 일전부터 오늘쪽 눈알쪽이 아파서 안과 두군데 가봤는데 염증이 쪼금있다고 염증약 처방해주셨어요 근데도 계속 아파서 오늘 신경과 가봤는데 그냥 먹는 약맘 처방해주셨거든요    혹시나 시신경염일수도 있을까요   처음엔 이비인후과에 있는 안과에 가서 약처방받고  일후 안과전문의에 가서 물어보니 괜찮다고 눈에 뭐 별다른 특이사항없다고 처음받은 약 넣으라고 하셨거든요  일째에 신경과 가니 눈알은 보지도않규 소염진통제렁 근이완제 처방해주셨어요    인터넷 찾아보니 시신경염일수도 잇는거같은데 설마 의사쌤들이 모르시진 않으셨겠죠   ,신경과
아침마다 손에 쥐나는 이유,매일 아침은 아니지만 한달사이에 한 세번정도  아침에 자고 일어났는데 손에 쥐가 나더라구요 처음 쥐났을 땐 잔잔히 하루종일 그랬고 그뒤로 두번정도 손에 쥐가 났어유 왜그런건가요  나이는   대 중반이에요,신경과
기절할것같을때,갑자기 서있다가 졸린듯한 느낌이 들다가 식은땀이 나면서 뭔가 쓰러질것같다는 느낌을 가끔씩 받는데 왜 그런지 알 수 있나요 병원은 어떤과로 가면될까요   무슨 검사를 해야하나요 ,신경과
왜이러는지 알려주세요,그저께부터 자꾸 어지럼증이 가끔씩 생겨요 대댓글로 계속 악플 달리는 거 때매 스트레스 받은건지는 모르겠는데 막 괜찮다가도 갑자기 띵하는 느낌 들고 어지러워지거든요 이게 뭐 병같은게 있나요 아니면 그냥 스트레스 때문에 이런건가요,신경과
눈이 멍해지고 초점이 흐려져요,눈이 계속 멍해져요 초점이 금방금방 흐려지고 눈이 흔들리는 느낌  눈을 계속 움직이니까 괜히 어지러운것같기도하구요 하루종일 매직아이를 하고 있는것같고 의식하니까 이젠 어딜 보고있는건지도 잘 모르겠어요 눈이 방황하는 느낌이랄까   요즘 잠을 자도 하루종일 졸린데 피곤하면 눈에 힘이 풀리잖아요 그런 이유일까요  계속 그러면 안과를 가야할까요 아니면 신경계 쪽이려나요,신경과
오른쪽 가슴 통증과 편두통 관계 ,어제부터 가끔 오른쪽 가슴에 통증이 약  분 정도 지속되는 걸 두 번 겪었는데 제가 어릴때부터 평소에 편두통이 심한 편이거든요  오른쪽 가슴 통증이 편두통 증상 중 하나일까요 ,신경과
자율신경실조증  뒷쪽머리떨림저림  뒷머리저림떨림 ,    년  월 부터 굉장히 스트레스를 받는 일이 많았어요  근데 한  월부터 자다가 머리 뒤쪽이 자꾸 떨리는 거예요   그래서 처음에는 목디스크 인줄 말고 병원에 가서 검사도 받고 약도 먹고 물리치료도 하고 베개도 바꾸고 다 해봤습니다 그런데도 아무 효과가 없고 뭐 병원에서도 일자목 증상이 약간있지만  목디스크까지 아니다라고 말씀을 하셨어요 이병원 저병원 다니면서 검사를 하고 치료를 받고 또 신경안정제 소량도받아서 잘때먹어도봐도 효과가 없었습니다   제 아는 지인이 신경정신과에 가서 상담을 받아보는 게 어떠냐라고 해서 갔더니 선생님께서 상담을 하시고는 자율신경실조증이라고 하시면서 약을 지어주셨어요   일은하루  번씩딱먹고 다음부터는 증상이있을때만 먹으라고 하시더군요   그래서 상담도받고 약을 받고 나오면서 바로 약을 한첩 먹었습니다  정말 일만에 엄청좋아졌죠   그래서 지금까지도 증세가 있을 때마다 약을먹습니다  근데 제가 궁금한 것은 저처럼 자율신경실조증으로 이런 증세가 있는 사람이 있나요    사실 저는 과거에 공항 장애를 심하게 한 적이 있습니다 지금도 완전하게 낫지는 않았지만 예전에 비하면 아주 비하면 아주 경미한 수준이지요 근데 지금 자율신경실적 증세로 뒷머리 저림이 자다가 한 번씩 생길 때마다 너무 괴롭습니다  저리기 시작하면 누워 있을 수도 없고 저림때문에 잠이깨서 침대에 앉아 있을 때가 많아요   선생님은 약을 증세가 있을 때만 먹으려고 했는데 갑자기 찾아오는 경우가 있어서 너무 고민이 됩니다 이게 진짜 자유 신경실조증 증세가 맞는지 아니면 다른 증세인지 너무 궁금합니다,신경과
수전증 때문에 고민이 있습니다 ,  살 청년입니다     학교 다닐때까지만 해도 수전증이 있었어도 수전증에 관한 문제를 그닥인지 하지 못했습니다  하지만 사회를 나오니 손 왜 떠냐고 계속 물어보더군요  전 수전증이라고 솔직히 말했습니다  그랬더니 아   하고 넘어가시더군요 근데 처음 그 소리를 듣고 이게 이상한건가  하고 생각하게 되었습니다  그런걸 알고보니 왠지 계속 신경쓰이더군요  수전증 있다는걸 어떻게 극복해야 할지 모르겠습니다       개인적으로 질문이 있습니다  여러분들은 수전증에 관해 어떻게 생각합니까 ,신경과
머리 세게 맞으면 뇌세포 죽나요 ,제가 친구랑 장난치다가 친구가 머리를 쩌억 소리 나게 때렸는데 뇌세포 죽었나요    뇌세포 죽으면 생성되는 시간이 얼마나 걸리나요  뇌세포 죽으면 기억력도 안좋아지고 공부도 못하나요  제발요     다 알려주세요 제가 머리 예민해서 그런지 그 이후로부터 원래 잘했던 문제도 잘 못풀고 수업시간에 멍을 많이 때려요    뇌세포 빨리 자라는 법도 알려주세요,신경과
멈추지 않는 손가락 떨림,오늘 오전  시  분부터 갑자기 오른쪽 엄지손가락이 떨리기 시작하더니 거의   분이 넘은 현재에도 멈추지 않습니다 피로가 생길 정도로 펜을 잡고 있지도 않았어요 행동을 할 때는 괜찮은데 가만히 있음 계속 움찔거립니다 대부분 잠깐 움찔거리다 멈춘다는데 전 지금도 계속 이러네요 혹시 내일 병원을 가야하는걸까요 굽혔을 때는 괜찮은데 손가락을 필 때 움찔거림이 심해지고요 침대에 누운 상태로 손이 하늘로 향하게 하면 좀 덜 움찔거리지만 침대에 누워 양손을 일자로 편하게 두면 움찔거림이 더 심해지면 멈추지 않고 계속 그럽니다 내일 일어나서 아침 때도 그러면 가려 하는데 어디 병원으로 가야 하나요  Loading                  화질 선택 옵션,신경과
예전에는 안그랬는데요  요새 종종 이런증상이 있어서 이게 어떤 증상인지 여줘보아요  지하철 탈때마다 약간 대변이 마려운 신호가 오면서 갑자기 식,예전에는 안그랬는데요  요새 종종 이런증상이 있어서 이게 어떤 증상인지 여줘보아요  지하철 탈때마다 약간 대변이 마려운 신호가 오면서 갑자기 식은땀이 확 나면서 막 어지러움과 눈앞이 별이보이고 그런 증상이 있어요  지하철에서 앉아서 가면 안그러는데,신경과
눈을 감으면 머리에서 맥박 머리조여옴,  살 여자인데요 금요일에 새벽부터 머리에서 심장뛰는거같은 느낌과 눈을 감으면 머리가 조여오면서 아픕니다   그래서 잠도 못잤고요 처음에는 심장이 두근거리는줄 알고 심장두근거림을 완화시켜주는 심장약을 먹고 겨우 잠들었네요 최근에 매운걸 많이먹어서 역류성 식도염 약 받아서 먹고있었고요 화이자 백신 차맞고서 가슴이 두근거려서 심장초음파와 심전도 했더니 정상이였습니다  앉아있거나 누워있거나 가만히 있을때 눈을 감으면 더욱 잘느껴지고요 오늘 동네에 신경과가서 언어 보행이런 검사를 했는데 정상이였습니다  그리고 물리치료랑 목에 주사를 맞고 록소디펜정이라는 약을 먹었는데도 아직 눈을 감으면 여전히 머리가 두근거리면서 가끔씩 머리가 조여와요 왜그런걸까요 제발 알려주세요  ,신경과
몸에 힘이 없어요,안녕하세요 올해 중학교 학년 됩니다  요즘 몸에 힘이 안들어갑니다  자도자도 피곤하고 눈이 무거워요 두통도 약간 있습니다  이거 뭔가요,신경과
찌릿찌릿해요  ,등이 너무 찌릿찌릿하고 따가워요   팔이랑 다리도 아주 조금씩 찌릿찌릿하고 저려요    타이레놀 먹었을 때 괜찮았는데 먹고 몇시간 지나니까 다시 너무 찌릿찌릿 거려요   ,신경과
어지러운  ,안녕하세요 초  여자입니다  요즘 어지러워서 쓰러질거같은 느낌을 많이 받았어요  학교에서 시끄러울때 쓰러질거같음  밖에서 놀다왔을때 머리가 깨질거같아요    원인이 뭔가요   ,신경과
