0,1,2
수전증 병원 안가고 고치는 법,요즘 수전증이 가면 갈수록 심해지는 거 같아서요 평소 일상 생활하는 도중에 갑자기 떨고 그러지는 않지만 갑자기 무언가를 인식하거나 긴장하면 제어를 못할 정도로 부들부들 떨리더라구요 가끔은 힘줄 때도 힘을 세게 주어서 떨리는 게 아니라 수전증으로 인해 떨리는 현상이 많아서 불편하더라구요 병원을 가지 않고 혼자 고칠 수 있는 방법 없을까요 자세 문제라면 자주 누워있기는 해요 앉아 있을 때도 허리 펴서 앉아 있으려고 노력은 하지만 무의식에 구부리고 앉을 때가 많은 거 같아요,신경과
비린내만 맡으면 머리가 너무 아파요,평범하게 살고있는데 어느 순간 생선 튀긴 냄새나 비린 냄새 만 맡으면 머리가 너무 아파요   ,신경과
자율신경검사 질문입니다,작년에 자율신경검사를 의원에서 했었는데 안좋게 나왔었거든요 근데 안좋게 나왔다해서 약처방 해주는것도 없더라고요 그래서 안좋게나왔는  도 치료도 못했어요 만약에 다시 대학병원가서 자율신경검사를 하게되면 의원에서 한 자율신경검사랑 다른가요   ,신경과
통증 두통  울렁거림  식은땀  귀 먹먹  눈 안 보임 ,제가 조금 전에 안과를 다녀왔는데 아직 검사밖에 안 해서 눈에는 아무짓도 안 했거든요 그러고 상담받는데 갑자기 가슴이 답답해지기 시작하더니 숨도 쉬기 불편해지고 귀도 먹먹해졌어요 그래서 부모님께 속이 안 좋다고 양해를 구하고 화장실로 가려는데 눈이 점점 안 보이더니 거의 안 보였어요 화장실 팻말 보고 가다가 너무 힘들어서 앞에 의자에 앉아서 앞을 봤는데 너무 안 보여서 이러다 실명하는 건 아닌지    엄청 걱정하고 있었어요 자꾸만 눈을 감고 싶더라구요 근데 뭔가 감으면 안될 거 같아서 감지 않았어요 정말 조금 보이자 부모님께 전화해 도와달라했거든요 한      분 지나니 괜찮아졌어요 총정리를 해보자면 약간의 두통이 있었고 귀가 눈이랑 같이 점점 먹먹해지더라구요 눈도 점점 안 보이고요 가장 안 보이고 안 들렸을 때 식은땀이 폭발했어요 무릎뒤  가슴골  등 어디다 할 거 없이 몸 전체가요 속도 조금 울렁거렸어요 음     분 지났을 땐 눈이 점점 보이기 시작했는데 꽃무늬  자국이 남으면서 보였어요 혹시 코로나 걸린건가 무섭기도 하고 눈 안 보였던 게 제일 컸어서 찾아보니 뇌졸중  이랑 비슷한 거 같기도 하고   그러기엔 아직   살이긴 한데  제가 쌍둥인데 제 쌍둥이 동생도  년반 전에 같은 증상을 느낀 적이 있대요 지금까진 별 문제 없다고 하고요 혹시 비슷한 증상 느끼신 분이나 이게 무슨 증상인지 아는 분 있을까요  ,신경과
머리 어지러움,머리가 어지러워요 중심을 약간 못잡겠고 휘청거려요 가만히 있어도 살짝 어지러워요 전날 잠을 잘 못자긴했는데 낮잠을 자도 좀 어질어질 해요 머리는 아프지않고 어질어질만 한데 두통약 먹어야하나요 ,신경과
말할 때 혀 경련 머리 찌릿,말할 때 종종 갑자기 혀에 경련이 와서 말을 더듬거나 멈추고 머리까지 찌릿해질 때가 있고 또 생각을 깊게 할 때 머리가 찌릿할때가 있는데 머리에 경련이 오는 느낌 뭐가 문제인가요 스트레스 받거나 신경을 쓰면 더 심해지는것 같습니다  그리고 요즘은 공부를 오래하면 머리가 술 취한 것처럼 어지럽고 띵하고 그러네요   걱정 되는데 광고성 글 말고 진지한 답변 부탁드립니다    ,신경과
뇌세포간의 시냅스 연결 손상은 복구가 가능한가요 ,뇌세포 본체가 손상되면 재생이 되지 않다는 것은 너무 잘 알고 있습니다  그런데 뇌세포 본체가 아닌 뇌세포 사이에 뻗어나와 뇌세포 사이를 잇는 시냅스는 손상되거나 끊어져도 다시 재생되어 뇌세포들이 재연결이 될 수 있나요 ,신경과
전완근 뭐가 막힌느낌 입니다,팔에 전완근 하늘방향 위쪽이 혈관이 있는지 모르겠지만 가다가 막힌것처럼 그런 기분이네요 멍든곳 누르는 느낌이기도 한데 뭔가요 ,신경과
매일 지속적인 두통이 있다면 ,매일 두통이 있는데 이마 앞쪽으로 지끈거리는 두통입니다  초반에 진통제를 먹지 않으면 계속 심해져 나중엔 열이나고 머리에서 심장이 뛰는듯아프고 심할때는 토까지 하는데요 빈번하지 않음  드물게  그나마 빠르게 두통을 가라앉히는게 판콜이라 매일 먹고있는데  안좋은건 알지만 안그럼 두통이 안가라앉네요  두통의 원인이 많으니 병원을 가려면 어디부터 접근하면 좋을까요 짐작하기로 베개없이 자면 그나마 덜한것으로 보아 목쪽이 원인이 아닐까 조심스레 추정은 해봅니다  ,신경과
뒷목  뒤통수 통증,뒷목부터 가슴까지 삐끗한 이후 약  개월정도 뒷목이 뻐근하고 뒤통수까지 저린 통증이 있습니다  침샘쪽도 풍선을 많이 불었을때 아프고 땡기는 증상과 왼쪽눈에만 충혈되는 듯한 증상이 동반하구요  제가 역류성 식도염이 있는데 가슴이 항상 답답하고 뒷목부터 시작하는 두통때문에 도무지 사람 사는게 아닌거 같습니다  일상생활도 힘들구요  병원을 가려고 하는데 어떤 과로 가서 진료받고 어떤 치료를 우선시 해야될까요  ,신경과
두통이 있어요, 시부터 계속 관자 있는 쪽이 너무 아파요  너무 지속적으로 아프고 일상생활이 약간 어려울 정도로 너무 아픈데   병원 가봐야 하나요 아니면 코로나 검사를 받아봐야 하나요  ,신경과
뒷골이 땡기고 마비되는 것 같아요,어떤 사람이 술은 거의 매일 새벽    까지 먹고 담배도 많이 태우는데 이게 뇌졸증 증상일까요 많이 아파보였대요,신경과
머리가 터질 거 같아요, 일 전 아침에 처음 증상 발현 됐구요 처음에는 머리 흔들면 아픈 거 아시죠  그러다가 그 날 저녁부터 앉아있다가 일어나거나 누워있다 앉으면 머리가 지끈지끈 하더니 어제부터는 가만있어도 머리가 두근두근하고 움직이거나 일어나면 잠깐동안 진짜 머리가 터질 거 같아요   뒤통수 안 쪽하고 오른쪽 눈 안쪽이 진짜 터질 거 같은데 뭐죠   흡연도 하고 술을 최근  달 정도 계속 마신 거 같아요,신경과
오른쪽 전체적인 두통과 멍든거같은 안구통,  월  일 부비동염 수술후 지속적인 두통과 화끈거리거나 콕콕쑤시는 느낌  오른쪽 눈썹 아래쪽 멍든거같거나 빠질듯한 눈통증이 지속되어 수술한 대학병원에서 재검사를하였는데 별 이상없다는 소견으로 신경과로 전이하여 신경성 약을 처방받인 일단 먹어보자하였습니다 그런데 차도가 없습니다 어떤날은 열감있는 두통이 더 아플때도있고 어떤날은 눈이 빠질거같고 멍든 통증이 하루종일 지속됩니다 안과도 가보았습니다 이상이 없다합니다    혹시 왜 이런걸까요  지금도 눈이 너무 아파 신경질적이고 힘드네요   ,신경과
편두통 없앨 수 없나요   ,편두통은 치료 방법이나 그런거 없나요      중학교 때부터 있었는데 고등학교 올라오고서 더 심해진거 같아요    심할 때는 진짜 다른거에 집중을 할 수가 없고 머리 전체가 욱신욱신거려서 머리가 움직이는 기분이에요  몇 년 전에는 약 먹으면 괜찮아졌는데 이제는 약을 먹어도 소용이 없어요   ,신경과
시야가 흐려지면서 쓰러질 것 같을 때,옛날부터 오른쪽을 보려고 눈을 돌리면 시야가 흐려지면서 쓰러질 것 같을 때가 있는데 오늘 유독 심하게 흐려지면서 정말 쓰러질 것 같더군요 현재 뇌전증을 앓고 있습니다 혹시 뇌전증때문일까요  아니면 다른 원인이 있을까요,신경과
어지러움증,다른 아픈 곳은 없고 눈 앞이 핑핑 돌고 어지럽기만해서 누워만 잇어요  주말 이 시간이라 병원도 딱히 연 곳이 없을 것 같은데 약국에서 사 먹을 수 잇는 약이 잇을까요 ,신경과
집에 있으면 어지러움,집이나 어떤공간안에 조금만 있거나 오래앉아있으면 어지러워요 활동을 거의하지 않을때나 공부핱때도 그래요 밖에 나와서 활동하고 움직이면 금방 괜찮아지고 기분도 상쾌해지는데 이유가 뭐죠  코로나때문에 집안에서만 생활해서 그런가요 ,신경과
커피를 마신 후 뒤통수 저림,안녕하세요  아픈 곳 하나 없이 건강했던   대 후반 남성입니다  코로나  차 백신으로 화이자를 접종 후 여러 부작용에 시달리고 있는데요  차 화이자 부작용 없었음     심장통증    몸에 힘 빠짐    근육튐  경련  꿈틀거림 전신을 돌아다니며 부위상관없이     소화불량    저혈압    불안증   오한    커피 마신 후 뒤통수 저림  현재는    근육튐     소화불량    커피 마신 후 뒤통수 저림이 부작용으로 남아있습니다  궁금한 사항이    커피 마신 후 뒤통수 저림 입니다                                                                                        제가 워낙 커피를 좋아해서 접종 전에는 커피를 정말 많이 마셨습니다 물론 아무런 증상도 없었습니다  그런데 접종 후에 커피만 마셨다 하면   분에서  시간 뒤부터 목부터 뒤통수까지 저리면서 제가 정신줄을 놓으면 쓰러질 것 같더라구요 뇌mra  자율신경계 검사 등 이상소견없음   이런 증상으로 부작용 초반에는 아예 커피를 안마시다가 접종 후  개월이 지난 뒤부터는 한잔씩 먹고있는데 아니나 다를까 전 만큼은 아니지만 목부터 뒤통수까지 저리고 잠들기 전까지 계속 멍해지더라구요   부작용으로 초반  주 정도를 집에서 이렇게 죽는건 아닌지 공포에 떨며 시간을 보냈는데 그래서 인지  상체 쪽이 많이 경직되어있고 목  어깨  등판 쪽 근육이 뭉쳐있습니다 특히 목  파란색 부분이 저릴 때 느껴지는 부위  빨간색으로 표시한 곳이 뭉쳐있는 곳입니다   뭉쳐있는 근육이 신경을 누르고 있는데 거기에 카페인 섭취 후 혈관이 좁아지면서 이중적으로 악영향을 미치는 건지 개인적인 생각  진짜 너무 힘드네요  참고로 커피를 마신다고 심장이 빨리 뛴다거나 손발이 저리지는 않습니다  초반에 쓰러질 정도로 머리가 저렸던 경험으로 그때처럼 되는건 아닐까 하며 불안함 정도는 생깁니다   어떤 이유로 이런 증상이 나타나는지 전문가 분들의 의견이 듣고 싶습니다     ,신경과
머리가 어지러워요,오늘따라 머리가 어지럽고 좀 뇌가 움직이는 것 같은 느낌나고 땅 움직이는 느낌나고 속도 좀 안 좋아요  최근 들어서 스트레스 많이 받고 신경 쓸 일이 많아져서 스트레스 때문인가요      좀 알려주세요   기립성 빈혈도 포함인가요  ,신경과
본태성떨림 수전증때문에 사람들이 조금 오해하는거 같아요,어디가면 사람들이 저한테 수전증으로 타인의식해서 떠는게 아닌데 사람들이 오해해요 본태떨림은 못없애나요 ,신경과
기면증인가요,안녕하세요   대 초반 남성입니다  주 회 근력운동 주  회 유산소 하고있고  비만 없고 흡연자입니다  기면증이 의심되는 증상은    년 정도 된 것 같은데  전날 밤에 잠을 잘 자더라도  낮이 일과시간에 일을 할 때 혹은 잠시 일을 쉴 때 시도때도 없이 졸리고  잠시라도 멍 때리면 바로 졸아버립니다  심지어 펜을 잡고 글씨를 쓰다가도 졸고  운전할 땐 극심해져서 고속도로에서 모든 창문을 열어재끼고 노래도 크게 틀고 숨도 크게쉬고 소리도 질러보고 담배도 태워보고 허벅지를 꼬집고 뺨과 목을 후려쳐도 잠이 안깹니다  정말 이러다 죽을 것 같습니다  일상생활이 너무 힘듭니다  기면증 증상 중 가위눌림 같은 것이 있던데 가위는 안눌려봤습니다  그냥 낮에 일과시간에 너무 졸려죽겠습니다  보는 눈도 걱정이고 제 업무 능률도 떨어져요  운전할 때는 정말 이러다 죽겠구나 싶고요  기면증 증상이 맞나요  의심된다면 어느 병원에 가서 진료를 봐야 하나요  신경과로 가야하나요 ,신경과
발작   ,제가 앉아서 핸드폰 보다가 천장봤는데 갑자기 눈 앞이 깜깜해지면서   잘 기억은 안나거든요  근데 막 팔이랑 다리를 엄청 심하게 떨고 책상에 있던 책들 다 떨어질 정도로 갑자기 의식도 못하고 막 떨었어요  정신차리고 보니까 책은 다 떨어져있고    기억은 잘 안나고   이거 무슨 경우인가요    심각한건가요  ,신경과
소발작 원인,제가 제작년부터 소발작이 생겼는데요  계속 이렇게 살다보니까 왜 이런지 왜 갑자기 생긴 건지 궁금해서요  발작이 사춘기때문일수도 있다고 하는데 제가 가진 병의 원인이 사춘기가 아니래요  병원에서는 갑자기가 아니라 증상으로 갑자기 멍을 때리는 현상등이 옛날부터 있었을 거라고 하는데 전 감정기복이 심해서 많이 왔다갔다 거리는 성격이라 생각도 많이 왔다갔다 거려서 멍을 때리긴하지만 갑자기 생각하는 경우는 없었거든요  진짜 이렇게 살기 너무 싫어서 말하는건데 증상을 조금이라도 줄여보게 원인이나 이렇게하면 이러하게된다같은 현상있나요 ,신경과
스트레스를 받거나 신경이 날카로워 질 때 뒷목이 대부분 당기잖아요,뒷목이 심하게 당길 때 목을 조금만 돌려도 아플 때는 어떤식으로 풀어줘야 좋을까요  목이 뻣뻣한것 같기도 하고 평소처럼 움직이기 힘들때가 종종 있습니다 ,신경과
이건 무슨 병인가요  스트레스 때문인가요 ,이 증상이 일어날 때는 압박감을 받거나 화를 낼때 순간적으로 혈압이 머리쪽에 쏠리면 나타나는 것 같아요   대체적으로 사람과 대화하고 있을 때 사람의 얼굴을 보면 어지러워지면서 점점 제 코앞에 있는 것처럼 느껴져요  그리고 몸이 되게 무거워지고 관절이나 손가락 사이사이마다 돌을 넣어놓은 느낌이 들어서 무거워요  심하게 어지러워서 눈을 감지도 뜨지도 못하고 실눈뜨고 있고 마치 제자리에서 열바퀴이상 돌고 난 느낌이에요  또 제 주변에 시간이 진짜 빠르게 지나가는 기분이라 사람이 말하면 엄청 빠르게 말하는거 같고 머리에 울려서 머리가 어지러워요  구토나 다른 증상은 없고 이게 단순 스트레스성인지 위험한 질병인지를 모르겠네요  현재는 고등학생이고 초등학생 때도 자주 이랬던 것 같아요  가만히 있다가도 갑자기 찾아오고는 하는데 가만히 있다가 찾아올 때는 서서히 점점 무거워지면서 어지러운 반면에 화나서 소리칠때 찾아오면 머리속에서 종이 울리면서 털썩 앉아요    머리를 다친적은 없는데 단순 스트레스 때문인가요 ,신경과
중학생 빈맥 화이자  차 접종 이후 부작용,어제       일  오전   시경 화이자  차 접종을 하였습니다     어제 오후까지 괜찮다가 저녁이 되니 새벽에 분명히 아플것같다는 예감이 등어서 타이레놀 한알 먹고 잤습니다 그런데 새벽  시   분경 컨디션이 안좋아 체온을 재보니 당시 체온은         초반이였습니다  열은 새벽  시가 되도 내려가지 않았고 그 다음날 아침 오늘       일 이 되서야          로 떨어졌습니다     아침을 먹은뒤 약  시경 타이레놀 한알 복용하였고  오전   시 까지 자다가 깨서 체온을 재보니          가 나오고 혈압이    에 심박수    이 나왔습니다 원래 빈맥이 있어서 그런진 몰라도 심박수가 꽤 높게 나와서 계속 누워있는중인데 오늘 새벽부터 지금까지 계속 가슴통증이 일시적으로 나타났습니다  약   초간 심장을 쪼이는 느낌이나거나 팍 하고 일시적으로 심장이 아팠었습니다    요약하면 저는 빈맥을 앓고 있는 중학생이고 화이자  차 접종 이후 타이레놀 복용 이후 열이 내려가지 않고 있고 두통과 심박수  혈압 상승 일시적인 가슴통증이 있는데 병원을 방문해 봐야할지 질문드립니다 내공    걸어요 제발 부탁드려요,신경과
다리 저림비슷한 찌릿한느낌,가끔가다 다리다 저리는듯한 느낌과 비슷하게 겉 피부가 아닌 다리 속이 간질간질한 느낌이 들면서 계속 다리 신경반사처럼 혼자 움찔움찔하는데 무엇때문에 계속 이럴까요 ,신경과
두개골 움푹 파임   ,저는 고등학생입니다  제가 머리 오른쪽 일부분이 피곤할 때 머리 아픈거 말구 그 머리 뼈가 아파요  가끔 아파서 봤더니 그 부분만 살짝 움푹 패여있어요  계속 아픈건 아니고 가끔 아프고 아플 때도 신경 쓰일 정돈 아니고 아 그냥 아프네 이러고 지나갈 정도이긴 한데 무슨 문제가 있는 건가요  아니면 그냥 살아도 되나요   ,신경과
왼쪽 얼굴이 평소랑은 달라진거같아요  ,왼쪽얼굴에 문제가 생긴걸까요  왼쪽 관자놀이 뒷쪽   귀위쪽  두피가 뭔가 쓸린것처럼 아프길래 대수롭지않게 넘겻는데 하루이틀사이 왼쪽 눈쪽이 박하사탕 바른것처럼 화 하고 안구근처가 뭔가에 피부가 쓸린것같은 느낌입니다  며칠지나니 볼쪽과 왼쪽입꼬리도 얼얼한 느낌인데 뭔가 안좋은걸까요 ,신경과
피검사 이후 쓰러짐,토요일에 건강검진에서 피검사를 받고있는 중은 괜찮았는데 받고 일어나서 밖으로 나가는데 갑자기 열이 오르고 식은땀이 나면서 앞이 안 보이고 귀 한 쪽이 마치 산에 올라간 것 처럼 멍멍하면서 잠깐 정신을 잃다가 금방 정신 차렸는데 왜 이런건가요  간호사언니가 긴장을 하면 그럴 수도 있다고 하면서 미주신경성 실신  그런 거 일 수도 있다그 하네요   빈혈은 항상 있어 왔는데 쓰러진 적은 태어나서 처음이라 걱정이 되어요  ,신경과
속이안좋음 구토 두통 가슴답답 호흡곤란 다리저림 시야흐림,속이안좋음 구토 두통 가슴답답 호흡곤란 다리저림 시야흐림  뭐때문일까요   현재 공황장애약먹고있고 rtg오메가  챙겨먹고있고 그외에는 먹는게없는데 이런증상이 나타나네요   ,신경과
두통 메스꺼움 정신 몽롱,안녕하세요   월  일부터 아침에 일어났는데 진짜 머리가 깨질듯이 아프면서 속이 메스껍다가 다시 잠을 자다 일어나봐도 마리가 계속 아파서 오후 되니까 괜찮아지더라구요 일주일 정도 괜찮아지다가   일정도애 또 같은 증상이 반복되고   일에도 같은 증상이 반복되었습니다  오늘은 약을 안먹었는데 약먹은 것 같은 기분이럴까 정신이 멍롱해지는 기분이였어요 술 안마시고 평소에 건강했습니다,신경과
머리가 깨질것같아요,머리가 막   주전부터 누군가 제 머리를 쥐어짜고 막 터뜨려버릴라 하는 느낌이예요 머리가 진짜 풍선처럼 펑 터질것같고 온 몸의 피가 모두 머리에 쏠린 기분이예요 특히 학원에 간다거나 하는 등 스트레스를 조금만 받아도 터질것같이 아프고 속도 안좋아져서 자꾸 구토를 하게 되네요   심각한걸까요  두통은 정확한 원인 이 없어서 병원에 가도 큰 답을 못듣는다던데 병원에 가봐야겠죠 ,신경과
머리가 핑 돌아요,오늘 아침 눈떠서 앉았는데 핑돌아서 옆으로 엎어진 자세로 눈을 천천히 감았다 떠도 핑돌고 회복하고 다시 일어나 아침먹고 학교에 갔는데 핑돌아서 아침에 조금이라도 수업시작전에 잘려고 하니 엎드렸는대도 핑 돌아요 진짜 너무 어지럽고 한  초동안 그게 지속 되고 평소 있는 아픈걸론 편두통이랑 기립성 빈맥이 있고 평소엔 심장이 좀 느리게 뛴다 그러시더라구요 의사 선생님이 전에 편두통이 심해 검사 받았을때 들었던 말씀 입니다 고  이고 요새 늦게 자고 스트레스나 우울감이 심한데 이중에 원인이 있을까요 정확한 느낌으론 눈알이 빠질거같은 느낌도 살짝있고 그리고 머리가 핑 돌아요 어지럽고,신경과
머리가 멍하고 어지럽고 담배를 피면 더 심해짐,자고 일어나면 괜찮아지는데 회사에 오면 머리가 무겁고 어지러운 증상이 있습니다  흡연을 하고 나면 더 아파 집니다  집중을 하지 못하게 머리가 멍합니다    증상이 뭘까요  혹시 이석증일까요 ,신경과
옷입으면 손발저림 증상문의,안녕하세요  손발저림증상 문의할게 있습니다   증상이    대후반부터 믹스커피나 아이스티를 먹고 종아리떨림증상이 첫시작이였고 현재는 특정옷 무거운옷 이나 바지를 입으면 손등이 화끈거리고 오른손 약지 및 새끼손가락과 발가락이 저립니다  욱신거리고 저릴때 손등에 붉은반점처럼 빨갛게 올라오기도 합니다  자극적이거나 맵거나 짠음식을 먹으면 종아리가 욱신욱신 아픕니다   그래서 현재는 특정옷을 못입고 안저린 옷으로만 가려입는 상황입니다   여러가지 치료방법을 찾아보았고 병원도 방문을 해봤으나 현재 찾지못했습니다   혈액순환에 문제가 있나 확인해보려고 검사를 받아봤으나 혈압도 정상이고 신경과에 가서 말초신경장애검사도 받아보았으나 정상이라고 합니다   어느병원에 가서 진료를 받아봐야할지 정확히 몰라서 그런데 어떤 병명인지와 어느병원 내과 외과 한의원 큰병원 에가서 어떤검사를 받아보면 좋을지 알려주시면 감사하겠습니다 ,신경과
경련성 질환 위험한가요,신경외과 피검사했더니 경련성질환이 의심된다고 mri찍으라고 하셨는데 찾아보니까 딱히 왜 위험한지를 모르겠어서 찍어야하나 고민되네요 자주쓰러지거나 심한것도 아니라서   너무 무지한 생각인가요,신경과
아버지 다리가 혈관이 터진것처럼 빨갛게 올라오는데 혹시 이런게 어떤증상이고 병원을 간다면 무슨과를 가봐야하는지 아시는 분조언즘 부탁드려요 파킨슨,아버지 다리가 혈관이 터진것처럼 빨갛게 올라오는데 혹시 이런게 어떤증상이고 병원을 간다면 무슨과를 가봐야하는지 아시는 분조언즘 부탁드려요  파킨슨병이 있으신데 종종 다리가 었다가 빠졌었는데  이번에는 빨갛게 오르기까지 해서요  아시는분 답변주시면 감사하겠습니다,신경과
머리 다친 후 헛소리,아빠가 머리를 다친 후 헛소리를 자꾸하세요 가끔 맞는 말도 하시는데 헛소리가 대부분이세요  왜 그럴까요 ,신경과
해면상혈관종으로 뇌출혈과 신경손상,남편이 해면상 혈관종 진단을 받았습니다  두통과 다리 저림이 너무 심해 병원을 갔더니 뇌출혈이 있어 신경을 건드렸다고 하더라구요  수술 할 수 없는 부위라 평생 살면서 조심할 수밖에 없다라는 진단을 받았습니다  과도한 운동도 안 된다고    그런데 백신 접종을 해도 될까요  코로나 백신 접종으로 혈종에 관련된 부작용들이 너무 많은데 걱정이 됩니다  방역 패스 문제까지 생기니 어떻게 해야 할지   답변 부탁드립니다   참고로 일상생활은 가능하지만 뇌출혈로 인해 왼쪽 다리를 절고 팔에 힘을 못주는 상황입니다 ,신경과
목을 못 돌리겠어요,안녕하세요  제가 원래 공부를 하나도 안 하다가 요새 공부를 시작했는데 공부할 때 자세가 너무 안 좋은지 항상 허리랑 목이 너무 뻐끈해서 수시로 목을 완쪽 오른쪽으로 틀어서 뚜둑 소리 내 주고 허리도 그렇게 하고   그랬는데 며칠 전에 그 날따라 뭔가 좀 뻐근하고 그랬는데 다음 날 되니까 그냥 있으면 뭐 아픈지도 모르겠는데 왼쪽으로 고개를 기울이면 아프더라구요   그래서 담 걸린 건가   했는데 이런 적이 처음이라 이게 담이 맞나  싶고 왼쪽으로 기울이지만 않으면 괜찮아서 풀릴 때까지 기다려보려는데 괜찮을까용  ,신경과
