0,1,2
소아 무릎 MRI,아이가 무릎이 아프다 해서 엑스레이를 찍었는데 큰 병원가서 MRI를 찍어보라는 소견을 받았어요   대학 병원 예약 겨우 해서 MRI는 찍었는데 다시 진료를 받기 위해서는  주일 이상을 기다려야 한답니다         MRI상에 있는 저 검은 부분이 도체 무엇일까요      여기서는 하얗게 나왔네요     아무것도  알 수 없는 이 상황이 너무 화가 나고 지옥 같은 기분입니다 ,정형외과
발톱 들렸을 때 샤워,제가 오늘 새끼발가락 발톱이 약간 들렸어요 피 진물이 나왔고 발톱이 빠지지는 않았구요 그래서 소독하고 테이핑을 옆 위로 다 한 상태인데 샤워를 그냥 해도 괜찮을까요 ,정형외과
견쇄관절 탈구,축구하다가 낙상으로 견쇄탈구가 되었는데 몇형으로 보여지나요  수술을 해야한다는데 이정도면 심각한건가요   ,정형외과
손목 인대 늘어남 ,제가 아까 쉬는시간에 친구들이랑 서로 웃고 떠들고 이랬는데 갑자기 수업시간이 되니까 손목을 뒤로 꺽으면 손목이 잔짜 너무 아파요   아까 쉬는시간을 기억해도 제가 손목을 쓴 일은 하나도 없는 것 같은데 인대가 갑자기 늘어난건가요   뭘까요    ,정형외과
허리 좀 봐주세요     요통 ,안녕하세요 고수님들  아래 허리가 너무 아프고  특히 앉거나 누웠다가 일어날 때 엉치 부분이 매우 아픕니다  평소에 바르게 있으면 괜찮다가 순간 순간 자세 변경할때 엄청  엑스레이 찍어보니 척추가 이렇게나 심하게 휘어서 일단 시술 받기는 이르다고 해주셔서 도수 치료 받기로 했는데  도수 치료 받으면 어느 정도 나아질 수 있을까요     우선 오늘  회 했는데  왼쪽으로 많이 몸이 기울었다고 정방향으로 서라고 알려주셨네요      대 후반인데 벌써 이러면 너무 심각한건 아닌지      보통 사무직들 허리 건강에 비해 아주 심각한걸까요    친구는 수술도 했다고 해서 두려워하고 있네요     답변 미리 감사드립니다   ,정형외과
발목삔거어떻게 해야하나여  ,복도에서 쳐 랄을 하다가 넘어지면서 발목을 삐었거든요 근데 걷는데는 큰지장은없고 절뚝거리기만하는데 이거 빨리 나을수 있는 방법 없나요   ,정형외과
허리디스크 증상,이게 허리 디스크가 맞는지는 모르겠지만 궁금해서 물어봅니다  힉생이라 요즘 온라인 클래스와 게임  공부 등등 해서 의자에 장시간 앉아있는 일이 많은데 의자에 앉아있을때 마다 척추가 너무 아프네요  병원에 다니지 않고는 나아질 방법이 없나요 ,정형외과
인공관절수술 꼭 해야 하는 거면,인공관절수술을 꼭 해야 하는거면 아무래도 잘하는 곳에서 하고 싶은데   근데 요즘은 대부분 인공관절수술을 하지 않나요   혹시 인공관절수술을 할 때 신경을 많이 써야 할 것들이 있을까요 ,정형외과
무릎연골주사효과 어떻게 될지,무릎연골주사효과가 궁금합니다  무릎연골주사를 맞아 보려고 해서요  그래도 많은 사람들이 무릎연골주사효과가 있다는 얘기를 듣긴 했지만 그래도 전문의 선생님의 의견이 궁금하긴 합니다    근데 또 무릎연골주사효과 별로라는 사람도 있고 어떤 경우 그런건지도 궁금하구요 ,정형외과
갑자기 방바닥에 발이 닿기만 해도 미친듯이 아파요   발바닥 옆에부터 안쪽까지 너무 아파서 정형외과 갔는데 사진상에는 문제가 없고 족저근막염도,갑자기 방바닥에 발이 닿기만 해도 미친듯이 아파요   발바닥 옆에부터 안쪽까지 너무 아파서 정형외과 갔는데 사진상에는 문제가 없고 족저근막염도 아닌 거 같고 약이랑 충격파치료해주셨는데   계속 아프면 어디 병원으로 가야하나요 의심할 병이 있을까요  아예걷질못하겠요 ,정형외과
무릎인대접합수술 무엇인가요 ,무릎인대접합수술이 뭔지 궁금합니다   봉합술을 말하는 건가요  아님 인대 재건술을 말하는 건가요  만약 그렇다면 무릎인대접합수술은 어떻게 진행되는지도 궁금하구요  그리고 무릎인대접합수술을 하고 나서 회복은 언제부터 되는 건지도 궁금합니다 ,정형외과
무릎연골 절제 해도 되는 건가요 ,엄마 무릎이 안 좋아서 병원을 갔는데  무릎연골이 파열된 상태더라구요  근데 이게 이상하게 아문   암튼 그래서 무릎연골 절제술을 해서 재활운동을 하는거 어떻겠냐고 하시는데요  무릎연골 절제를 하게 되면 나중에 재활을 하더라도 일상생활에 조금 부담이 되지 않나요  무릎연골 절제를 해도 될지 잘 모르겠습니다   ,정형외과
발등뼈 엑스레이,발등에 무거운걸 떨어뜨렷는데  욱신거리고 되게 아파요 골절되엇을까봐 응급실 가봤는데 시골 응급실이라 정형외과 전문의가 없어서 판단하기 힘들대요 일단 엑스레이를 찍어놨는데 내일 다시 와보라고     사진만 봐서는 골절이 있나요     내일까지 기다리기 겁나요,정형외과
발뒤꿈치 통증, 년반 정도 전에 슬리퍼를 신고 집이 언덕이라 뛰어내려가서 운동을 하러갔는데 줄넘기를 뛰는도중 아킬레스건에 통증이 생겨서 병원을가서 초음파를 촬영했는데 염증은 보이지않는거 같다고 하고 물리치료를 받아라 해서 받고 했는데 통증이 가시질않아서 한의원가서 침도 맞고 체외 충격파도 해봤는데 통증이 여전히 사라지지 않아서 너무 답답해요  도대체 병명이 뭔가요 뼈가 변형 되거나 한건 없다고 합니다  빨간색 칠한부분에서  번은 서있을때 항상 아프고요  번은 가끔 아프다 안아프다 하는데요    해결방법이 뭐가있을까요 집에서 맨바닥 밟거나 하면 더심해집니다 그래서 실내 슬리퍼 신어서 너무 답답합니다 제발 도와주세요,정형외과
척골신경 수술 마비 오나요 ,척골신경 압박이 있습니다   그래서 척골신경 수술을 해야 하는데 척골신경 수술을 하지 않게 되면 마비가 더 빨리 찾아 오게 되나요  지금도 움직임이 다소 불편하긴 하지만    척골신경 수술을 빨리 해야 하는건지 아님 다른 치료를 해보고 해도 되는건지 궁금해서요 ,정형외과
어깨 염증주사 맞아야 하면,어깨에 염증이 있어서  어깨 염증주사를 맞아보려고 합니다  그런데 회전근개 부분에 어깨 염증주사 맞아도 되죠  오히려 더 염증이 덧나는 건 아닌지 걱정이 되서요   어깨 염증주사는 종류가 다양한가요  사실 스테로이드 같은 경우에는 부작용도 좀 걱정돼요 ,정형외과
발목통증 왜 이렇게까지,발목통증이 꽤 오래전부터 있었던 것 같아요  예전에는 발목통증 때문에 불편하고 그랬었는데 시간이 지나니까 괜찮은 것 같아서 이젠 발목통증이 있으면 그냥 쉬기만 해요  그래도 생활하는데 큰 문제는 없었던 것 같아서요  하지만 최근에 발목통증이 다시 생겼는데 이번에는 좀 심한 것 같습니다  제대로 걷는게 힘들기도 하니 출퇴근도 어려워요     왜 이렇게까지 된 걸까요 ,정형외과
휜다리 교정하는 수술,  대 중반 정도 되는데요   휜다리를 교정하는 수술을 하고 싶어서요  근데 이렇게 일찍 휜다리 교정 수술을 해도 되는건지 아님 나중에 휜다리 교정 수술을 해야 되는건지 궁금합니다  별다른 통증 같은건 없지만 그냥 다리 모양이 별로라서요 ,정형외과
발통증 많이 걸어야 하는데 불안해요,며칠뒤에 등산을 가기로 했는데 최근에 생긴 발통증 때문에 어떻게 해야 할지 모르겠어요  일단 걷다 보니 발바닥이 아픈데    발통증 원인이 뭘까요  어떻게 해야 발통증 괜찮아질 수 있죠 ,정형외과
발이 아파요 왜 이럴까요 ,넘어지면서 발을 삐끗한 것 같은데 발이 아파요    그 때는 놀라서 아픈 것도 몰랐는데 지금은 너무 발이 아파요  그래서 병원을 가야 될 것 같은데    근처에 정형외과가 없습니다  발이 아파요    찜질을 하면 좀 괜찮을까요 ,정형외과
척추관절염 회복되나요 ,척추관절염도 생길 수 있나요  무릎이나 어깨 이런데만 관절염 생기는 줄 알았는데    척추관절염 같은 경우에는 회복이 어떻게 되나요  아무래도 몸의 중심이다 보니 이리저리 많이 사용하게 되서 척추관절염 잘 안 나을까 걱정입니다  ,정형외과
발목 통증 허리디스크,나이는   중반 여성 입니다   허리디스크 초기 라고 작년에 그랬었는데요   한달전부터 오른쪽 발목이 묵직하고 불편합니다  오른쪽 허벅지가 힘이 안들어가는 느낌인데  보행할때 문제는 없는데 그냥 뭔가 불편하고 묵직하고 힘이 안들어가는 느낌 입니다   운전 할 때도 오른쪽 발목이 느낌이 이상합니다   신경외과를  주 정도 다니면서 괜찮길래 안 갔는데 다시 또 그러네요   심각한걸까요       제가 살 빼려고 헬스장 다니는데 러닝머신 뛰면 안되나요      한의원  정형외과  지압원 중에 어디가 나을까요    장난 광고 신고 차단 합니다 ,정형외과
무릎 염증,병원에서 초음파상으로 염증이 보인다고 하네요 염증치료및연골주사 병행 치료해도 염증이 치료가 안되고 그대로 있습니다 그래서 병원에서 MRI 찍어 보라는데 비용이 비싸서 못해봤어요 증상으로는 무릎을 구부리면 너무 아프고 밤에 잠잘때 미치도록 시큰거리고 아파서 잠도잘 못잠니다,정형외과
갈비뼈쪽 골절 금 담 근육통 등 관련질문,안녕하세요 제가 이틀전에 여행을 갔는데 거기서 애들끼리 장난을치다가 한명이 제 뒤에서 팔로 갈비쪽쪽을 힘줘서 꾹 눌렀는데 그때 당시 아침까진 괜찮았는데 갑자기 다음날부터 통증이 심하더라고요 갈비쪽이 붓는다거나 피멍들고 그런건 아닌걸로봐서 골절은 아니고 금간거나 담 쪽은 근육통 같은데 제가 다음주부터 출근을 다시해서 그러는데 통증이 혹시 며칠정도 가나요 보통 ,정형외과
