0,1,2
발목인대파열 재활 ,안녕하세요 발목인대파열로 반깁스 한지  주 지나가고  주째 되어가는 남성입니다  뼈조각은 안떼어진 상태이고 골절은 없습니다 병원에선 목발없이 서서히 걸어보자고 해서  처음엔 걷기가 힘들고 통증 종아리  아킬레스 발가락 복숭아뼈통증  이 있어서 목발로 서서히 딛다가  이젠 반깁스와 목발 없이도 정말 아주 천천히 걸을수있는 상태입니다  걸을 때 통증은 많이 줄어들었고 아주 가끔가다가 복숭아 뼈 부근에 통증이 있긴한데 심하지는 않습니다  근데 아직 잘걷는게 아니고 종아리근육이 짧아져서 그런지 걷는게 발목도 조심스러우면서 불안하다는 느낌이 든다고 해야할까요    벽밀기   발끝 위아래 가동운동  운동과 약간의 붓기가 있어서 냉찜질도 해주고있는데  이러한 움직임 또는 재활을 계속 해도 되는것인지  혹시나 나중에 발목불안정성 이 오는건 아니겠죠    ,정형외과
척골신경 팔 펴는 동작 안좋나요  내공   ,척골신경 증후군을 앓고있는데 팔은    도 쫙 피면 소리가 뚜두둑 나더라고요 이 동작이 척골신경 증후군을 악화시킬 수 있나요  아니면 무관한가요  전문적 지식을 가진 의사분만의 답변을 원합니다  원하는 답변시 무조건 채택합니다 ,정형외과
동구라미표시,이쪽 만지면 동그랗게 만져지고 딱딱한데 다잇나요   한쪽 팔에는 없어요 몰까요 왓다갓다 하면 올라갓다 내려가는데 뼈인가여    ,정형외과
발등골절 후유증,현재   살 청년 입니다  과거   살때 발등이 골절된 경험이 있습니다  이 때문인지 오래 걷거나 뛸때 상당한 불편함을 겪고 있습니다  그리고 가벼운 착지 동작을 할때에도 고통이 오는데 원래 다 그런건가요   ,정형외과
증상이 있을때와 없을때 촬영하는 MRI검사와 근육조직검사 정확도,제목그대로  제가 몸이 고관절쪽 앞근육이랑 중둔군 그리고 종아리 앞근육쪽으로 경직및 강직 힘이 들어가면서 꼬임 증상이 심한데  요쪽 하체쪽으로 근육들이 탱탱붓고 시간이 오래되면서 근육들이 비대해졌습니다  그래서 이번에 대학병원가서 검사를 근육 MRI 검사와 근육생검 근육조직검사를 하는데  이게 증상이 일정하지가 않고 괜찮았다가 증상이 갑자기 발현되서 증상이 심해졋다 오른쪽으로 증상이 생겻다가 왼쪽으로 증상이 생겻다가 이런상황인데  MRI나 근육생검 검사시 증상이 있을때 검사를 할때와 증상이 전혀없을때 검사나 촬영을 하면 결과가 달라질수잇기도 하나요   병의 원인을 못찾거나 제댜로 판독이 안될까봐 걱정되서 그럽니다    방금 오전에 mri 다리쪽으로 하반신촬영을 햇는데 하필 증상이 전혀 없다가  오후 작성하는 지금시간때에 증상이 발현되서 다시 재촬영할수잇는지 물어보니 불가능하다고하셔서   그런데 검사할때 접수하시는 데스크분 말씀으론 차이가 없을거라곤 하시는데 실제로 그런지 궁금합니다,정형외과
무릎통증 진료내역서에 인대장애라고 적혀있는데,출퇴근시 무리해서 계단등 뛰어다녔고 무릎이 뻐근한데도 무리해서 뛰어다니고 나서 그래요 정형외과에서 무릎통증으로  주정도 치료했으나  물리치료 충격파 받을때만 잠깐 시원 출퇴근하면 또 다시 아픔  낫지를 않아서      재활의학병원으로가서  초음파찍고  염증있고 안쪽연골이 좁아져있고 약해진상태고 그래서  무릎에 dna주사 식염수 뭐뭐해서 맞았는데요  보험회사제출용 서류를 발급해주시더라고요   집에와서 보니  진료내역서에  인대장애라고 적혀있는데    무릎염증은 그냥 인대장애라고적어주는건가요    아님 말론염증인데  인대에 정말 문제가 있는건가요   근데  여기서 일주일전에 주사맞고도  통증이 더오는데  어떻게 해야하나요    미치겠어요  회사다니는데  무릎아파서  출퇴근 자체가 무리인듯하고  쉬어야할까요    쉬자니 언제나을지도 모르는데 며칠쉬겠다고 할수도없고       계단이나 내리막내려갈대 무릎이불편하고 살짝 통증있었는데  이젠  계단오를때  무릎위쪽도 아파요 의자에 앉아잇어도 무릎위쪽이 아파요  구부러져서그런지   뭐가 문제일까요    이제 한달되었어요,정형외과
무릎 근육문제에도 히루안주사가 효과가 있나요 ,운동중 무릎을 과하게 써서 무릎에 통증이 생겼습니다   병원에서 초음파를 찍고 무릎 연골에는 물이 찼었으나 문제없음을 확인했고  무릎 위아래 힘줄문제라고 하면서 히루안 주사 맞을 것을 권유받았습니다   검색해봐도 히루안은 관절염주사이지 근육에 놓은 사례는 찾아지지않는데  무릎 위아래 근육의 통증에도 히루안주사가 효과가 있나요 ,정형외과
정형외과 진통제,말 그대로 정형외과 진통제 처방받아서 아침에 먹었습니다  오전에  번정도 구토를 했고 울렁거림도 계속있습니다  언제까지 울렁거릴지 미치겠네요  배는 고픈데 먹기만 하면 토나올거같고 그래서 아무것도 먹고싶지않아요    약은 중단했는데 오늘 하루종일은 이상태인거겠죠  오전엔 호흡도 힘들었었습니다  ,정형외과
늑골 골절 질문,늑골 부러진지  주됐는데 지금 뿌러진 뼈끼리 완전 맞닿으려면    센치정도 남았습니다 이게 완전 맞닿는다고해서 뼈가 붙은건 아니죠  완전 맞닿은상태에서 뼈끼리 완전 붙으려면 며칠정도 걸리나요 ,정형외과
발목 골절후 통증은 언제까지 ,발목 비골 사선골절되서 수술완료한지 다음주면  개월이 되갑니다 재활치료는 주 번씩해서 한달가량 했구요 초반에 비해 도수치료받을때 통증이 처음보다 심하진않고 안정성도 전보다 훨씬 좋아지긴하는데요 걸을때 정상보행처럼 보이나 아직 발목이 많이 아픕니다 족저근막염도 있고 운동화신으면 철심이 닿아서 따가워서 실내화 신고 다닙니다  궁금한거 순서대로 질문매기겠습니다    나이는   세 남성 통증이 안다쳤을때처럼 없어지려면 몇개월이 지나야하나요    가동범위가 발목을 위로 올렸을땐 거의 풀로 올라가고    부족 아래로 내렸을땐    프로중   프로만 내려가서 밑으로 내리는게 유독 더 안됩니다 퇴근하고 발목 위로 올렸다 내렸다 운동도 꾸준히 하고있구요 체중부하 운동도 하고 있습니다 어느시점부턴 여기가 마지노선인가싶을정도로 호전이 되는지 잘 모르겠어요 한달정도 더 재활을 해야 정상범위로 돌아올까요  사람마다 차이는 당연 있겠지만 평균 질문입니다   수술하고 술을  번 먹었습니다 다음날 평소 통증보다  배는 있었구요 발등이 유난히 아프던데 비골 신경이 발등에 연결되이있어서 아픈건가요    술은 당연히 먹지말아야겠지만 수술후 몇개월까진 술을 안먹어야 더 회복이 빠른가요     년안에 철심빼는 수술을 할건데 지금처럼 재활기간이 길진않나요    철심뺀 수술후 걷는데까지도 처음 수술했을때보다 어느정도 더 단축되나요    철심이 발목에서 철심라인이 보이는데 붓기가 빠지면서 당연한 증상이고 이제 이물감도 느껴집니다 이물감은 철빼기전까진 안고 살아야하는 부분인거죠    현재까지 걸을때 제일 아픈부위는 발목위로접히는부분  발등  아키레스건  부위가 대표적인데 이또한 수술후 자연스러운 증상인가요   고리타분한 답변과 광고글은 차단합니다 경험자 또는 의학적인 측면에서 답변부탁드립니다,정형외과
어깨 조각난뼈를 다 맞추고 나사로 다 박은경우는,몇달정도 지나야 뼈가 붙나요 ,정형외과
정형외과 수술,정형외과 접합수술할때 신경도 정형외과의사가 하나요,정형외과
습관성탈골 수술 후 운동,습관성탈골 수술을 한지 한달반이 지났습니다   일전에 보조기 풀었는데 일상생활은 어느정도 하지만 아직 좀 불편하긴하네요  지금 이 상태에서 가벼운 조깅 유산소 운동 해도될까요  달리기를 하게되면 어깨가 어쩔 수 없이 흔들리게 되니 혹시나 위험할까요 ,정형외과
기능성깔창 구매하려고하는데 파는 회사가 너무많네요 많이 써보신분,기능성깔창 구매하려고하는데 파는 회사가 너무많네요 많이 써보신분 추천좀 부탁드려요  오래 서있는 일을 하고있는데  아킬레스건 쪽이랑 발바닥이 너무 아파서 기능성 깔창 찾고있는데  제품이 너무많아서 어떤걸 구매해야할지 모르겠네요  다들 자기들꺼가 최고라고 하니까    많이 써보신분 괜찮은 제품좀 추천부탁드립니다,정형외과
무지외반증,제가 무지외반증이 있는데 무지외반증 때문에 아치가 가라앉는 경우도 있나요     올해 쯤 통증이 심해졌는데 얼마 전 부터 아치가 가라앉는게 느껴져서요    ,정형외과
회전근개 파열인가요 ,팔을 위로 들때  아픈 쪽으로 누울때 아파서 눕지도 못합니다   안에 유리조각 껴있는 느낌 그리고 움직일때 통증이 있습니다,정형외과
아세바정과 비모보정,발목인대 염좌로 치료다니면서 아세바정을 처방받아 먹었었습니다  이제 약이 다 떨어졌는데  예전에 다른 병원에서 처방받았던 비모보정이 집에 남아있는데 이거 먹어도 관계없을까요  효능이 동일한가요 ,정형외과
내성발톱 고름,오른쪽 엄지발가락 오른편 살이 부어올랐는데 내성발톱 때문인것 같기도 하고   계속 붓네요    이럴땐 어느 병원을 가야하나요 ,정형외과
팔꿈치통층,오른팔로 폰을 하던도중 갑자기 팔꿈치뼈가 엄청 뾰족한거로 찌르듯이 아파서 그냥 삐끗했나보다 했는데 그뒤로 팔꿈치를 피거나 접을때   번 했다치면  번은 아프더라구요  팔꿈치 쭉 폈을때 양쪽에 움푹 들어간곳 안쪽  그냥 진짜 단순이 삐끗한건가요   지금은 안아픈줄 알았는데 책상에 팔꿈치를 대고있다가 팔을 떼면서 피니까 엄청 아프더라구요 아플때도 있고 안아플때도 있고  ,정형외과
보호대 착용한 느낌이 들 때,최근 약  주전까지 발목 보호대를 착용했었습니다  운동할때는 거의 필수로  년정도 착용했고 가끔 걸을 때도 착용했었습니다  지금은 보호대를 착용하지 않음에도 달리거나 점프를 뛰는 동작을 하면 보호대가 눌렸던 부분 발바닥 이 찌릿거리는  느낌이 있습니다  보호대를 오래 착용했어서 그런거 같은데 시간이 지나면 괜찮아지나요  아프진 않은데 아무래도 느낌이 있다보니까 불편하네요  ,정형외과
작년   월 초에 발목을 다쳤는데요 ,작년   월 초에 왼쪽 발목을 다쳤는데요  엑스레이 상으로는 뼈는 크게 이상은 없는데 인대손상 가능성이 있다고 합니다   병원에서 스트레칭 알려주셔서 나아져서 살살 걷기 시작했는데 계단을 한번 내려갔다가 그 이후로 오래 걸으면 발목 통증이 있어요   주로 하는 스트레칭은 발을 쭉 뻗었다가 안으로 꺾어주는 걸 하는데 안으로 꺾어줄 때 아프네요   어떤 쪽이 문제일까요    너무 안걸어줘도 이게 좋지 않을 것 같은데 더 걸어주는게 좋을까요   달이 다 되어가도록 안나으니 너무 답답하고 걱정입니다 ,정형외과
허리디스크,작년에 허리 디스크가 있어서 mri 검사를 하고 간단한 시술을 하였습니다 근데 최근에도 아프길래 다시 검사를 해보려고 하는데 검사하면 작년보다 더 안 좋아졌을 수도 있나요  ,정형외과
우측 허리 뒤 통증,  세 이상이신 엄마가 허리 뒤쪽이 X표시  아프다고 하시는데 병원을 잘 안가시네요   왜 이부분에 통증이 있다가 없다가 하시는 걸까요 ,정형외과
추간판탈출증 시술 수술 어떤걸 해야하나요  mri첨부 ,수술은 너무 안좋은 후기가 많아서 겁나서 여쭤봅니다   시술로도 가능할까요 ,정형외과
꼬리뼈 통증 넘어졌는데 골절일까요 ,앉을 때랑 누울 때 꼬리뼈 통증이 있어요   사실 제가 넘어지면서 엉덩방아를 찧었는데 이것 때문에 꼬리뼈 통증이 생겼습니다  혹시나 이게 골절은 아닐까 하는 생각이 드는데 꼬리뼈 통증이 골절 때문이라면 어떡하죠 ,정형외과
협착증수술 앞두고,협착증수술을 해야 하는데  협착증수술을 앞두고 좀 걱정입니다  근데 협착증수술을 안하게 되면 계속 증상 때문에 너무 고통스럽겠죠 ,정형외과
팔 허리 mri,팔꿈치랑 허리를 둘 다 다쳐서 아픈데 mri를 둘 다 같이 찍어볼 수 있나요 ,정형외과
발목 염좌 아무래도,발목을 삐끗했는데 발목 염좌인가봐요  멍 생겼는데 아직도 안 사라지네요  붓기도 좀 있는 것 같고    이정도면 발목 염좌 심한걸까요  혹시 인대가 찢어진건 아닐런지  발목 염좌 어떻게 해야 되는 걸까요 ,정형외과
발목 삐끗 처음엔 괜찮은 것 같았는데,발목 삐끗하고 나서 처음에는  너무 당황스러워서 제대로 살펴 볼 생각도 못했어요  그런데 지금은 발목 삐끗했던 부위가 많이 아픈데 병원을 가봐야 할 것 같습니다  바로 갔어야 했는데 며칠이 지나서    일단은 발목 삐끗한 부위 지켜볼까요 ,정형외과
족저근막염 가능하면 빨리,족저근막염 빨리 낫고 싶은데  왜 이렇게 오래 걸리는지 모르겠어요  어떤 방법으로 족저근막염 치료를 해줘야 빨리 낫게 되나요  가능하면 빨리 나아야 해서    족저근막염 빨리 치료하는 법 알려주세요 ,정형외과
오십견치료방법 어떤 도움을 받나요 ,오십견치료방법이 궁금한데요   오십견치료방법으로 치료를 하게 되면 어떻게 도움이 될 수 있는 건가요  사실 이전에 한달 정도 치료를 했었지만 그때 오십견치료방법이 맞는건지 아닌지 괜찮은지도 모르고 계속 했는데 오히려 더 안 좋아진 것 같습니다  그래서 다른 곳을 방문해서 치료를 받으려구요 ,정형외과
회전근개 치료 늦은건 아니겠죠 ,회전근개가 안 좋을 것 같다는  짐작만하고 제대로 된 치료를 하지는 않았던 것 같아요  그런데 다시 운동을 시작하려니 회전근개 쪽  안 좋은 것 같아서 선생님이 병원을 가보라고 하더라구요  그래서 회전근개 치료 받아 보려고 하는데 좀 시간이 지났다 보니    지금 치료를 해도 되는 건지 궁금합니다 ,정형외과
인공관절수술잘하는곳 찾아가면,무릎이 너무 아프다고 하셔서  그냥 엑스레이 촬영 해보러 갔는데 퇴행성관절염이 심해서 수술을 해야 될 수도 있다고 했습니다  그래서 인공관절수술잘하는곳을 찾아가 보려고 하는데    인공관절수술잘하는곳을 찾아가면 또 엑스레이 촬영을 해야 하나요  그리고 다른 정밀 검사도 해야 하는지 궁금합니다  인공관절수술잘하는곳에서는 검사를 어떻게 하고 수술을 하게 되는 건가요 ,정형외과
휜다리 증상 악화되면,휜다리 증상이 악화된다면  어떻게 해야 되는 건가요  어느 병원을 가서 휜다리 증상 치료를 하고 교정을 해줄 수 있죠  병원 말고 그냥 일반 교정치료센터 뭔 이런데 가도 될지    그리고 휜다리 증상 치료나 교정은 어떻게 되는지 궁금합니다 ,정형외과
십자인대파열 부상이 심할 경우,조심한다고 했는데 타이밍이 안 좋은 건지 십자인대파열 부상을 입게 되었습니다  처음에는 아프다가 나중에는 괜찮아져서 십자인대파열 금방 괜찮아질 거라고 생각했는데 며칠 뒤에 또 십자인대파열 그 부위를 다친거 있죠  아무래도 연속으로 강한 충격이 있다 보니 치료가 시급할 것 같은데 수술을 해야 할까요 ,정형외과
주짓수 하다가 중추 쪽에서 뿌득소리,제가 트라이앵글 초크 라고 도장에서 같이 배우시는 분들이랑 스파링을 했었는데요 제가 상대목에다 초크를 걸었는데 그분이 안걸리려고 살짝 저를 밀었거든요 전 누워있는 상태에서 새우등처럼 구부리고 있었는데 그분이 압박을 가하니까 갑자기 등에서 뿌득 소리나면서 입에서 컥 소리가 나는거에요 지금 한 일주일 가는거 같아요 뛸때마다 통증있고 누워서 뒹굴때도 조금 아프고 혹시나해서 정형외가 가봤는데 근육에 염증도없고 뼈에도 이상이없어서 물리치료를 받고있거든요 근데 이거 진짜 물리치료로 괜찮은 걸까요 날개뼈와 날개뼈 사이에 중간 부분이에요,정형외과
오른쪽 다리 힘풀림,질문이 있어서 글 남깁니다  유독 오른쪽 다리가 저린다고 해야 할까요  얼마전에 발로 공을 차는 운동을 하는데 공이 발에 닿자마자 발목부터 허벅지까지 진동 같은 게 올라오더라고요 오늘 아침에는 일어나서 화장실에 가려고 하는데 다리에 피가 안통했는지 바닥에 닿여도 아무런 감각도 없었어요 그대로 일어나려고 했는데 힘이 안들어가서 넘어졌어요 왜 그런건 가요 ,정형외과
무릎이 뜨거워요,하루 일과를 다 마치고 밤이 되서 누워잇으면 무릎이 뜨거워지면서 아픈데 관절염 일까요 무슨 병원 가야되나요,정형외과
무릎 뼈소리,스쿼트할때나 자전거탈때나 무릎에 약간 자극이 가면 불편하고 뼈소리가 계속 나는데 이유가 뭘까요 ,정형외과
비골골절 후유증,제가 작년  월중순쯤에 오토바이 사고로인하여 비골이 골절되었는데 병원에서 수술은 안하고 지켜보기만 하자고했고 지금 현재 일을 하면서도 보호대는 착용하고 있고 오래서있다보면 통증이 느껴집니다  근데 병원에가서 사진은 찍어봤는데 뼈는 붙었다고 하더라구여 그러면  개월이지난 이시점에서 통증이게속 느껴지는 이유는 뼈가아니라 근육에문제가있는걸까요 아니면 제가 몸무게가    키로 정도되는데 하중을 많이받아서 다리가 안나고있는걸까요 ,정형외과
내성발톱 수술 ,내성발톱인가요  수술해야되나요 ,정형외과
인공관절후 휴유증,  세이신 친정엄마가 관절염이 너무 심하셔서 남은일생 편히사시리고 인공관절 수술을 받았습니다 수술 받은지는  개월이 넘어가는데 염증도 없고 상처도 잘 아물었는데 다리가 너무 아프시다고 고통스러워하십니다 아프지말고 편히 사시라고 수술한건데 더 아퍼하시니깐 어떻게해야할지 모르겠어요 소염진통제는 듣지도 않고 진통제를 장기 복용하니 위경련이 자주 일어나서 이러지도 저러지도 못할 입장인데  수술한 병원에서는 수술 잘 되었고 염증도 없다고 진통제만 처방해주는데  지금 이 시점에서 어느 병원에서 어떻게 치료 받아야할까요 ,정형외과
무릎 통증,사진의 동그라미 친 부분이 반대쪽 무릎에 비해 부어있고 구부렸다가 필 때 뭐가 걸려있는거같은 통증이 느껴집니다  왜 그런건지 알수있을까요 ,정형외과
놀다가 삐끗했는데 복사뼈 부은건가요 , 학년인데 놀다가 삐끗했어요   복사뼈 부은건가요  멍은 없는것같아요 걸을때 안아퍼요 조금 욱씬 됩니다    걱정되요오오   ,정형외과
어깨충돌증후군 치료,이거 치료할때 재활운동도 같이하잖아요  근데 재활운동을 어쩔수없이 못하게되었다고 했을때  충격파치료와 주사치료만으로 호전이 가능한가요   그리고 호전되었을경우 부상당하기 전의 팔 기능까지 회복 가능한가요,정형외과
무지외반증인가요    ,육안으로 봤을때 많이 휘어보이는데   무지외반증 증상이 있어 보이나요  ,정형외과
통풍 혹은 신경종 혹은 관절염 혹은 인대문제   발사진 주의    ,이번과 같은 상황이 전에도  번정도 있었습니다    대 후반 여자이고 왼쪽 발이 문제인데요  아무렇지 않다가      분 정도 걷고 나면 이런 상태로 변하고 갑자기 걸을 때 통증이 매우 심해집니다  딛으면 아치의 끝부분  발가락과 발바닥 사이부분 이 매우 아파서 절룩거리게 되고요  붓기는 심하지 않은데 이렇게 피멍이 자꾸 생기네요  자꾸 재발을 하니 이유를 좀 알고 싶습니다  통풍일까요        작년   월 멍 발생 사진  빨간 화살표는 붓기                    올해  월   일   분 걷고 통증과 멍 발생,정형외과
넘어진 뒤 무릎에 혹,어제부터 배구를 하다가 슬라이딩하면서 어제 크게 한 번 무릎을 찧어서 작은 혹이 생기고 멍도 들었는데 오늘도 크게 넘어져서 혹이 더 커지고 멍도 더 생긴 거 같은데 이거 언제쯤 없어질까요   누르면 아파요   ,정형외과
오스굳 증후군,고 인데 오스굳 증후군 무릎아름 이 고등학생한테도 나타나는게 신기하네요 병원에서 진단받았는데      가끔 무릎이 엄청 아프던데 가벼운 스트레칭 좋을까요 예를 들어 앉았다 일어나는거요 그리고 오스굳 증후군 고등학생한테도 나타나는건가요 ,정형외과
어깨 수술 이노그램 비스코씰 ,일단 글쓴이는   살 남자 입니다  내일 방카르트 수술을 하는데 수술 예후가 좋게 해주는 이노그램  비스코씰을 할지 말지 결정하는데 가격이 각각  만원   만원이라 싼가격도 아니고 인터넷에 찾아봐도 정보가 잘 나오지도 않아서 이렇게 글 올립니다 혹시 이노그램 비스코씰에 대해 잘 아시는 분이나 할지 말지 추천해주실 분 있나요  ,정형외과
통풍인지 족저근막염인지 알려주세요  ,통풍인지 족저근막염인지 모르겠는데  일단 벙원은 한번 가봤는데 발목을 삔지 알고 갔다가  인대가 늘어난거같다 통풍부위가 아니라고 했거든요  술먹고 새벽에 발목에 통증이 있는거같드라고요  근데 가만히 있거나 마사지해주면 편해지는데  걸을때 첫발을 대면 걸으면 발바닥이랑 발목쪽 통증같은거때문에  번정도 아팠다가 저녁쯤에 통증이 사라졌습니다  붓기 열감 빨개진거 없습니다  가만히 있을때 괜찮고 마사지하면 발바닥 근육이 뒤로 밀면 아프고  하중실려 걸을때면 아프고 계속 걷다보면 쫌 풀리다  앉아있다 다시 걸을때 처음에 아프고 이렇게  저녁쯤 되니 괜찮아 지더라고요 이렇게  주전 이틀  어제 하루 그랬었네요  통증이 생기면 몇일 가는게 아니고 하루 이틀이면 너무 멀쩡해집니다   증상으로 봤을땐 통풍일까요 족저근막염 일까요 ,정형외과
특수검사 결과 해석좀 해주세요 ,추가적인 의사 소견은 괜찮으니 아래 소견만 해석 부탁드립니다      그냥 정확하게만 해석 부탁드립니다      검사 명  Knee Both AP s p Biopolar hemiarthroplasty Lt s p stem revision  s p grip plate and wire fixation  for prosthetic fracture  immediate post op state  knee CPPD crystal deposition OA  Osteopenia   검사명  Hip  D CT s p Biopolar hemiarthroplasty Lt  s p stem revision s p grip plate and wire fixation  for periprosthetic fracture   immediate post op soft tissue swelling and airs no post op unusual finding  CPPD crlystal deposition at Rt hi  both hamstring tendon  both knees  and intervertebral discs degenerative spondylosis with neural foraminal stenosis and lateral recess stenosis osteopenia ,정형외과
어깨 조각난뼈를 다 맞추고 나사로 다 박은경우는,몇달정도 지난뒤부터 재활치료가능한가요 ,정형외과
발목이 안좋아요,발목이 안좋아서 걷다가도 삐끗하고  뛰는건  초도 못뛰어요 초등학교 중학교때  계주까지 했는데 몇년 전 부터 발목이  아픈걸 느꼈는데 크게 신경 안썼었는데요  요즘 최근들어 너무 아파서 그런데 어느병원  가야되나요 ,정형외과
줄넘기 할 때 발목이 아파요 ,제가 다음주 월요일에 체육 수행평가로 줄넘기를 해야하는데요  모둠발 뛰기나 쌩쌩이는 좀 할만한데 양발 번갈아 뛰기를 하면 발목 아킬레스건 종아리 종아리 앞쪽 뼈  그냥 무릎 아래 부분 다리가 아프고 누르면 멍든 것 같이 아파요  연습할 때마다 너무 아픈데 평가는 봐야하니 참고 하고 있는데 어떻게 해야 안 아파질까요 ,정형외과
