0,1,2
팔씨름 손목 뚝 소리 통증,친구랑 준비운동 안하고 팔씨름을 했는데 뚝 소리가 나면서 인대가 늘어난 것처럼 아프다가 지금  달반정도 지났는데요 평소엔 안아프고 운동할때도 안 아픈데 한번씩 당기는 동작을 할때 손목 바깥쪽이 욱씬거릴 때가 있는데 소염제 먹으면 괜찮을까요 ,정형외과
발목 인대 다침,어제 풋살하다가 발목이 살짝 돌아가서 인대가 많이 아픈데 신발을 신으면 걸을만한 정도입니다  단기 아르바이트가 있어서 가야하는데 괜히 돌아다니면 증상이 더 악화될까요 ,정형외과
허리근육 질문,허리 아래쪽을 마사지하듯 조금 세게 누르면 조금통증이 오는데 이거 허리에 이상이 있는 건가요 ,정형외과
팔꿈치 통증이 있어요 ,아까 팔꿈치 안 쪽 부분이 벽에 부딪쳤습니다  누르거나 팔꿈치를 계속해서 움직일시 아픕니다  혹시 금이 간건가요    사진에 나온 동그라미 부분이 아픈 부분입니다 ,정형외과
병원 비용 문의,화요일에 넘어졌는데 무릎에 멍들고 붓고 열감이있어요 걸을때도 괜찮은거 같다가 통증이 오기도해요 병원 가봐야될까요  가야되면 엑스레이 촬용 비용이랑 검사 비용 어느정도 들까요    ,정형외과
목디스크 전조 증상인가요   급합니다   ,어제 갑자기 목을 돌리거나 들려고 할 때 목 뒤쪽에 통증이 있어서 담인가 보다 하고 마사지를 수차례 해보았더니 나아지는가 싶더니 다시 돌아오더라구요  고개를 똑바로 들수 없을 정도로 아파서 일단 근이완제  소염진통제  경구진통제 먹고 어찌저찌 자긴했는데 자고 일어나도 통증이 그대로 있더라구요  새벽에 팔저림 현상도 있었구요      목디스크 의심해 봐야겠죠     그리고 지금 당장 병원을 가지 못하는 상황이면 어떤 조치를 취할 수 있을까요     앉아있어야 하나요 누워있어야하나요 ,정형외과
손가락 변연절제,골절상을 입고 살이 터지고 손톱이 다 죽어서 손톱에 구멍을 뚫고 절개를 해서 피를 빼내는 방법도 변연절제술에 해당되나요 ,정형외과
추우면 손 끝 통증,요즘 아침에 쌀쌀한데 찬바람에 손이 따가워요 손 끝이 바늘로 찌르는 듯한 고통이고 찬물이 닿으면 손 전체가 통증이 와요 손 안에서 불이 나는 것 같은 고통입니다 이거 동상 같은 건가요 이러다 따뜻하게 해주면 금방 또 가라앉아요,정형외과
선생님들 제 손가락이 마니 휘었는데요     좀 심한편인가요    원인이 있나요    고칠 수 있나요  나이   대 입니다,선생님들 제 손가락이 마니 휘었는데요      좀 심한편인가요     원인이 있나요     고칠 수 있나요   나이   대 입니다,정형외과
허리디스크 물리치료만 다른병원가도 상관없죠   ,허리랑 목디스크 인데 물치받아야 하는데 진료본병원은 한시간거리라 동네 가고싶은데 다른곳가서 물치 받아도 괜찮겠죵  ,정형외과
발가락에 멍이랑 반점이 있어요,저희할머니가 발 붓기가 심한편인데 붓기는 그렇게 심하지 않고 빨간 반점이랑 멍이 발가락에 있네요 병원에선 알수 없다고 했데요 이거 왜그런건가여  ,정형외과
손가락 통증,손가락이 아파서 글 올려봅니다  딱히 손가락에 무리가 갈 행동이나 활동은 하지 않았습니다  주먹을 쥐려고 하면 약지 손가락에 통증이 느껴지고 손목 안쪽을 톡톡 쳐도 똑같이 통증이 느껴집니다   손가락이 부은거는 아닌거 같은데 이럴때는 어떤 증상이 의심되나요   병원은 내일 가려고 합니다     아파서 젓가락질   필기 도 못하는 상태 입니다  ,정형외과
무릎 십자인대 내측인대 어디가 다쳤을까요 ,하루전에 풋살을 하다가 공을 밟으면서 미끄러져 무릎이 돌아 갔습니다  뚝소리가 난건지 잘 기억은 안나는데 처음에 혼자 일어서서 걸어서 집까지 알아서 차를 몰고 갔고 집 가자마자 얼음 찜질을 했습니다  그래서 그런건지는 잘모르겠는데 붓기가 심하진 않았습니다  다음날 아침 바로 병원에가서 진료를 했는데 누워서 무릎을 만져보시더니 무릎이 빠지지는 않는다고 하셨고 x레이를 찍고 왔는데 붓기도 그렇고 피가 별로 안차 있는거 같다며 십자인대보다는 내측인대가 다친거 같다고 했지만 십자인대 일수도 있다고 하셨습니다 현재 보조기를  무릎쪽에만있는  처방 받았고 약은 붓기가 별로없다해서 안주셨습니다      만약 십자인대 파열이라하면은 지금 상태 걸을수있고  이튿째 붓기 별로 안심함   수술을 해야하는건가요      수술을 해야한다면 큰 대학병원에 가는게 나을까요      내측인대를 다치면 치료는 어떻게 해야하나요      내측인대를 다치면 증상이 어떻게 되나요      내측인대와 십자인대를 같이 다칠수도 있나요  그렇다면 증상이 어떻게 되나요      전방 십자인대 증상이 어떻게 되나요      재활은 언제부터 하면 좋을까요   답변 해주시면 정말 감사하겠습니다    ,정형외과
탁구 척추측만증,탁구를 배우고있는데 계속허리를 숙이고치니까 어제는  시간 쳤는데 허리에 근육통이 있고 거울보니까 좀 기울어진 느낌인데 원래 탁구배우면 척추측만증 걸리나요   아니면 그냥 기분탓일까요  ,정형외과
내공    드려용,아랫팔 안쪽 부분에 통증이 있어서 만져봤는데 진짜 작은    센치정도  되는 혹같은게 만져지더라구요   통증 있었던건 꽤 됐는데 혹이 있었는지는 기억이 안나네요   외관으로는 보이지가 않아서 살짝 닿여도 느낌이 나요 혹시 어떤거일까요  ,정형외과
 일만에 척추측만증, 일동안 계속 잘못된 자세로 있거나 운동하면  일만에 척추측만증이 생길 수도 있나요  ,정형외과
연골주사 보험기간질문이요,히알론주사  개월 무릎양쪽  회씩 보험적용된다고 알고있습니다  현재 관절염치료로 꾸준히 맞고있는데요  이게 최초 맞았던날부터  개월인가요 아니면 최종으로 맞았던날부터  개월이 지나야 적용되는건가요   회주사를  월에맞고  회주사를  월에 맞으면 대략  월부터 다시 보험적용이 되겠죠  또한 제가 다니는곳은 보험적용돼서 양쪽맞으면 대략 만원내는데요   회지나고 보험적용안되면 대략얼마 나올까요 ,정형외과
팔 깁스 문제 내공   ,안녕하세요 고  남학생입니다 제가 중 때 친구가 장난으로 밟아서 팔 골절을 당했는데 그때 심하지는 않다고 그냥 깁스만 하라했는데 너무 불편해서  일하고 그냥 풀고있었습니다 근데 지금 고 까지 왔는데 팔을 필때 골절됬던곳이 아프고 계속 피고있다가 접으면 아프고 팔에 힘도 잘안들어가고 복싱할때 쨉을 날릴때도 아픈데 이거 어케해야하나요   ,정형외과
손가락 혈관 터짐 ,친구랑 손목맞기하다가 너무 세게때렸는지 검지 두번째마디가 땡땡하게 붓다가 보래졌어요   사진으로 보면 별로 안그런데 실제로 보면 그냥 검은색됐어요   아파요   어떡하면 좋죠   손가락을 못펴겠어요 후엥,정형외과
뼈스캔에 관한 질문입니다,뼈스캔은 류마티스 관절염을 확실히 구분할 수 있나요  초음파 관절도 필요한가요  ,정형외과
디스크 터진건가요   mri 확인 부탁드리비다   ,이 정도면 회복 기간이 얼마나 걸릴가요    주 전에 고중량 스쿼트 하다가 코어가 훈련으로 지친 상태에서 스쿼트를 계속 진행하다가 깔렸고 처음  주간은 정말 아파서 일어나질 못했습니다   주 전부터 일상통증은 심하지는 않지만 침대에서 일어날 때  오래 앉을 때  재채기할 때 스쿼트 자세할 때 엉치가 아픕니다  또 앞으로 숙일 때도요   그 외에는 지낼만 합니다  방사통도 쭈구려 앉으면    시간 정도 생겼다가 없어집니다      제가 정말로 궁금한 것은 이 정도 돌출이면 들어가는 데 얼마나 걸릴까요       철봉에 매달리는 것도 디스크 돌출이 들어가는 데 좋은지 궁금합니다 ,정형외과
제 손가락이 마니 휘었는데요 ,  좀 심한편인가요    원인이 있나요    고칠 수 있나요 ,정형외과
중수골 골절 증상 질문,안녕하세요  제가 월요일쯤에 주먹으로 벽을 좀 세게 친 적이 있는데요  새끼손가락 너클부분이 다친것같은데요  처음엔 자세히보면 반대쪽보다 아주 살짝 부었었는데요  지금은 완전히 붓기는 빠진거같아요  현재 일상생활에 이렇다할 지장은 없는데요  아직 그 부분을 누르거나  주먹을 쥔 상태에서 새끼손가락 부분만 피려고하면 약간의 통증   과 자연스럽게 펴지지않는데요  그 외엔 의식적으로 느껴질정도로 불편함은 없는데요  혹시 앞으로 평생 손가락이 제대로 안펴지면 어떡하나 걱정이되네요     골절이 맞을까요  ,정형외과
발바닥 부은건 어디 병원 가야하나요,운동선수라 어쩔 수 없이 꽉 끼는 신발을 신어야하는데 아파서 눈물 나요    냉찜질해도 안 가라앉네요,정형외과
다리 허벅지 뒷편에 뼈  근육이 튀어,다리 허벅지 뒷편에 뼈  근육 이 튀어나왔어요 발에 염증이 생겼어서 한동안 절뚝거렸어요 그러다가 괜찮아졌는데 나중에 몸을 만져보는데 허벅지 뒤에 뼈같은게 튀어나와있습니다 무릎위로부터    지점쯤에요 다른 통증은 없습니다 혹시 왜그런걸까요 한쪽으로 절뚝거리는 분들도 이런 이유인건지 걱정되서요,정형외과
뼈가 붙는 원리,뼈가 부러지고 뺘가 골절 됬을 때 부러지고 골절된 뼈가 붙는 원리가 뭐예요 ,정형외과
왼쪽 발목 골종양 군대 문의,왼쪽 발목 윗부분에 양성 골종양이 있습니다 발목 윗부분에 반 정도 덮고 있는데 군대 신검 몇 급 받나요  ,정형외과
복숭아뼈 골절 벌어짐,오른쪽 발 복숭아뼈가 골절됬는데 엑스레이 찍어보니까 뼈 사이가 벌어져있더라구요 뼈 조각은 없었구요 의사선생님은 수술하라고 권하시는데 수술없이는 안되나요     살이라 부담 되기도 해서요,정형외과
무릎염증 이렇게 오래가나요    ,  입니다    거의 한달째 무릎통증있어요  붓기도 살짝있구요 출퇴근시 무리하게  서있고 시간에 쫓겨 계단을 무리하게 뛰어다녔거든요  무릎이 뻐근해도  뛰었어요  병원  주넘게다녀도 구두진단  엑스레이X   충격파 물리치료  차도가없어서   지난주에 다른병원 갔더니    초음파찍자고해서 찍어보니  무릎에 염증좀있고  안쪽 연골이 약해져있고  예전에 무릎다친적있는듯하다  염증이 계속 재발한거같다 라시던데  제가 고딩때 버스타러뛰어가다가 아스팔트에 무릎끓고 넘어졌는데 상당히 아팠고 피났는데 엄마한테 혼날까봐  제대로 치료를 안받고 그냥 지났고  그뒤로 무릎을 땅에 대질못해요 느낌이 이상해서요   근데  그이후로딱히 무릎이 탈난적없었구요  이번에 새로이직하면서  무리했더니  그래요  초음파찍고  무릎에 DNA주사랑 붓기가라앉히는 주사를 놓아주셨구요  근데 주사맞고나서 어쩨 오늘아침에 출근길에도 더 아픈듯 하고 좀덜하던 다른무릎마저 더 아파옵니다      차도가 없는것같아요          회사가는길이 경사도있고  지하철에서 서서다니고 계단오르내리니   이래서 안낫는건가요    병원에  회사쉬어야하냐 하니 그정도아니다 무릎을 최대한 쓰지말라는데  출퇴근하는데 어떻게 안써요     쉬어야 낫는거 아닌가요    무릎이 왜이리 안나아요             ,정형외과
발등 골절 의심됩니다,발등에 무거운걸 떨어뜨렷는데  욱신거리고 되게 아파요 골절되엇을까봐 응급실 가봤는데 시골 응급실이라 정형외과 전문의가 없어서 판단하기 힘들대요 일단 엑스레이를 찍어놨는데 내일 다시 와보라고     사진만 봐서는 골절이 있나요     내일까지 기다리기 겁나요,정형외과
  대 여 무릎수술 비용이 어느정도 인가요 ,광고 차단 신고 합니다 무릎수술비용 입원치료비 약 등등 한쪽에 어느정도 비용이 들까요       수술을 한꺼번에 양쪽 다 하는건 아니지요  답변 부탁드려요,정형외과
무릎과 허벅지 사이 뒤쪽의 혹,정확한 위치는 무릅 뒷쪽인데 오금 주위 보다 좀 위쪽이고 허벅지 뒤쪽이라고 하기에는 좀 아래쪽입니다  오른쪽이고 정상적인 왼쪽에 비해 물혹같이 불룩한것 같이 보이고  지금은 셀루라이트 같이 좀 살이 부어 있는 것 같이도 보입니다   일전에     년 정도 인근의 정형외과 진료시에는 엑스레이 소견상으로는 이상이 없고  통증이 없으니 지켜 보자 하셨고  그이후로 수년이 지난 지금도 크게 통증은 없지만  눈으로 보거나 만져 보면 꼭 부어 있는 것 같이 보여서 다시 문의 하게 되었습니다   이런 증상이 보인 것은   년이 넘습니다   어떤것이 의심이 되는지  치료과정 및 비용은 어느 정도인지를 문의 드립니다 ,정형외과
왼쪽 발등 무릎 통증,안녕하세요   제가 작년  월에 오른쪽 무릎 수술을 하였고 오른쪽 발에 힘이 없다보니 왼쪽 무릎으로 생활을 하였습니다   계단을 내려갈때에도 왼쪽을 많이 쓰다보니 조금씩 아파왔습니다   그런데 약  달 전 낮잠을 자고 계단을 올라가다가 종아리에 엄청난 통증을 느끼게 되었습니다   통증이 약    틀간 지속되었고 종아리에 힘이 들어가지 않았습니다   문제는 이때 부터 입니다    왼쪽 무릎이 아파오더니 언제부턴가 발목에서 발등까지 통증이 오기 시작했습니다   계단을 오르다가도 연골이 찢어질 수도 있다고 들었습니다   현재 증상은 지속적으로 약한 통증이 옵니다      계단을 오르다가 극심한 종아리 통증이 왔는데 이거는 무슨 증상이죠   처음에는 하지정맥류로 생각했는데 아닌것 같습니다       연골파열이 되면 특정 각도 또는 행위를 했을 때 아파오는데 저는 지속적으로 약한 통증이 옵니다   오른쪽 연골파열로 수술하여 경험  힘줄에 염증이 생긴걸까요      복숭아뼈와 발등에 통증이오는데 이것도 궁금합니다 ,정형외과
무릎이 너무 아파요  ,아픈지는 오래됐어요  개월 정도  아팠다가 안 아팠다가 그랬는데 그 때는 아파도 별로 안 아팠어요 그리고 안 아플 때가 더 많았고요 그래서 그냥 병원 안 가고 방치했습니다 지금도 어쩔땐 아프고 어쩔땐 안 아픈데요 아플 때는 진짜 서있지도 못 할 정도로 아파요 무릎이 아플땐 진짜 너무 아파서 서있지도 못 하고 앉아있어야합니다   제가 다이어트 하느라 싸이클을 맨날  시간씩 탔거든요 그거 때문에 그럴까요  무릎 아픈 이후로는 싸이클 끊었어요   원래 정형외과 갈려고 했는데 코로나 걸려서 격리 끝나면 갈려고 합니다   저   살인데 왜 벌써 무릎이 아플까요   많이 심각 해보이나요  정형외과 가면 고칠 수 있을까요    ,정형외과
걸을 때 발바닥이 아파요 ,얼마전 런닝머신에서 조금 뛰었고  그 뒤로 발바닥이 아프기 시작했습니다   증상은 걸을 때 양 발바닥 바깥쪽에서 통증이 느껴지고  가끔 통증이 없었다가 있었다가 하기도 합니다  그리고 오른발은 발끝을 발 뒤꿈치 쪽으로 펴면 통증이 나타는 부위에 꾸르륵 하는 듯한 느낌이 듭니다   처음엔 근육통으로 생각했으나  그런 것 같진 않습니다  마사지 건으로 발바닥에 마사지를 하고나면 일시적으로 통증이 완화되는 것 같습니다   병원에 가서 치료를 받는 것이 좋을까요  ,정형외과
발접지른후상처,저번주 금요일        에 발을 접지른후 괜찮은 것같아서 병원도 안가고 있었는데 하루지나니 멍이 더 심해진 것 같아요 종아리도 근육이 아픈느낌이고 내일 시간내서 병원가보긴 할건데 별일아니겠죠   가면 설명 듣겠지만 걱정돼서 올려봐요 보기 흉하긴한데 사진도 올려봐요,정형외과
팔꿈치 인대 부상으로 인대강화 주사 맞는 방향이요 ,테니스엘보가 양측 모두 손상되었습니다  인대 힘줄 등    오늘 주사치료를 받고왔는데 생각보다 안아파서 다시 보니     외측 주사가 아니라 내측 주사더라구요    원래 부상부위가 아닌 반대쪽에 주사를 맞나요    아니면 의사 실수인가요     ,정형외과
전방십자인대 재건술 질문있습니다  두가닥  한가닥 ,이번에 전방십자인대 재건술을 동종건으로 했습니다  완파는 아니였고 수술전 애매하단 말을 들었기에       가 남지 않았나 싶습니다  저의 수술은 매우 성공적이라 들었고 동종건 겉에 잔여인대를 덮어서 진행하여 자기인대화를 돕는 형태의 수술을 진행하였다고 들었습니다  헌데 수술전에도 프로선수나 동호회를 할 정도가 아니라 정적인 운동 ex 헬스 은 딱히 동요와 상관성이 크지 않아서 두가닥 복원술을 할 필요는 없다고 안내받아서 한가닥 동종건 사용으로 진행했습니다  실밥제거를 하러간 날 의사분은 아닌든 하였고  소독이나 깁스등을 도와주는 분이셨던것 같은데 어지간하면 두가닥복원 할텐데 왜 한가닥을 하냐면서 비아냥거리는 말투였습니다  저도 스트레스가 심해서 많이 알아보았고  두가닥 복원술이 한때 유행처럼 퍼졌지만  사람마다의 뼈의 면적등 차이가 있어 예후가 좋지않은 사례가 있다고도 들어서 헬스정도와 가끔 농구공 골넣는 정도의 Max범위를 갖는 저로서는 한가닥을 해도 괜찮다고 생각되었습니다      한가닥 복원술을 하는사람은 정말 드뭅니까    두가닥 복원술이 꼭  더 좋습니까 ,정형외과
팔씨름 하다가 손을 세게 박앗는데 계속 아파요,팔씨름 하다가 상대가 손을 세게 내리쳐서 아까부터 계속 아팠는데 아픈지  시간은 됐어요   근데 연필 쥐거나 따봉같이 주먹을 쥐는 행동을 하면 그 손바닥이랑 손가락 연결된 부분이 계속 아픈데 정형외과 가봐야 할까요 ,정형외과
복숭아뼈 튀어나옴,평상시에는 괜찮았는데  제가 갑자기 운동을 안하다가 농구를 했는데  왼쪽 복숭아뼈가 많이 튀어나왔어요 농구를 좀 심하게 했긴했는데  삐끗하거나 다치지도 않았는데  갑자기 튀어나왔어요   발목까지 오는 신발을 자주신는데  자꾸 복숭아 뼈를 건드려서 계속 아픈데   계속 신으니깐 거의 못걸어다닐정도라서  가까운 정형외과 가보니 xray 상으로는 문제가 없다고   뼈 안쪽을 찍으려면 mri를 찍어야한다고 하더라구요   평상시에 낮은 신발을 신고 다니면 뼈에 자극이 없으니깐 괜찮은데   발목까지오는 신발은 못신겠어요   뼈에 문제가 있는건가요  이게 크게 지장이 없으면 mri를 찍어야 하나 싶기도 해서   전문가님의 도움이 필요합니다,정형외과
  대 무릎 통증,제가 좀 운동을 과하게 하긴 해요 전부 점프하는 운동과 몸 싸움을 하는 운동을 해요 그리고 어디에 계속 무릎을 부딪혔어요 오늘 집에오니 무릎이 아파요 계속 주물러도 아파요 병원 가봐야 할까요 성장판에 문제는 없겠죠  계속 아픈데  ,정형외과
발 다친 뒤 통증,사진속 부분이 다쳤고  주가 지나 깁스를 풀었습니다  의사선생님은  주까지 보자고 하셨는데 너무 풀고싶어서 풀고 보호대를 착용하고 있습니다    질문   깁스를 풀고 걸어다니다 넘어졌는데 아킬레스건이 너무 아픕니다  원래 그런것인가요  질문   누군가의 조언으로 무리하게 걸어다니다 다친부위가 시리듯이 아픈데 괜찮은 것인가요 ,정형외과
척추측만증 인데 짝다리 될까요 ,척추측만증이 있어서 심하게는 아니고 약간 오른쪽 어깨가 올라가있고 왼쪽 날개뼈가 나와있어요 골반이 틀어진거라고 짝다리된다고 하더라구요 진짜인가요 ,정형외과
일자목 턱관절,일자목때문에 턱관절이 안좋아지거나 변형되나요 ,정형외과
왼쪽 골반위 허리통증,한 주전에 쭈그려 앉아서 일할때 갑자기 너무 아프다가 또 코로나 걸려서 있는  일동안은 그렇게 아프지않고 약간 뻐근하다 엿는데 오늘 일하다가 갑자기 왼쪽 허리 골반위쪽이 통증이 와서 그쪽으로 스트레칭 하니깐 더아파서 앞으로 숙일때 통증오고 대체적으로 왼쪽 허리 가운데서부터 골반 까지 통증이 오는거같애요  디스크일까요  몇달전애 엑스레이 찍엇을때는 정형외과에서 문제없다하긴햇는데 혹시나해서요,정형외과
 세 팔꿈치골절 성장판 ,몇일전 교통사고 상대편낙하물로 인한충격 가 났습니다  와이프 저  세아들 이렇게 타고 있었는데 와이프와 저는 염좌  아들은 팔꿈치 성장판골절진단이 나왔습니다 아이가 아프다하여 대형병원급응급실에서 판정을 받았고 걱정스런 마음에 오늘 세종소재큰병원으로 갔습니다 오전진료만가능하여 엑스레이로 골절확인 추가CT촬영 했는데 오후수술일정때문에 결과를 못들었네요 내일 CT보고 입원 수술 여부 결정하자고 하셔서 걱정입니다 첫날응급실에선 수술정도까진 아니라고 하셨는데 판단부탁 드려요,정형외과
요추 압박골절 상태, 년지난 L  요추 압박골절 상태입니다  어떤가요   압박골절 시  제대로 관리 하는 전제하에  후유증 및 통증 재발 가능성이 있나요   뼈는   년 주기로 완전히 새로워 진다고 하는데  앞으로 평생 통증이 없다면 완치를 기대해도 될까요   꾸준하게 영양 운동 관리중입니다  손해사정 후유보상은 모두 지급받았습니다 ,정형외과
손가락 손등 손목 통증,  살   월 정도에 손목 건초염 진단을 받고 체외충격파 치료를 받았습니다  그런데   살 되고 손목이 다시 아파요   주 전에는 엄지  검지  손목이 아파서 테이핑을 했고  저번주에 좀 괜찮아진 줄 알았는데 이번주 되니까 손등이 아프기 시작했어요  손가락은 엄지 검지 중지 이렇게 아픕니다  건초염이 재발한 걸까요 ,정형외과
손가락이 아파요,예전에  년전에 손가락을 다쳤는데  마디에 시퍼렇게 멍이 들었는데 돈도 없고 안갔었어요  근데 손가락의 붓기는 빠지는데 가끔씩 아려와요   그래서 한번 맘 먹고 병원에 가서 엑스레이도 다 찍었는데 손가락에 금은 하나도 안갔다고 하는데 지금까지도 손가락 마디쪽이 아려오는건 뭔가요      ,정형외과
손목터널증후군 질문,제가 손목터널증후군이 있어요   년수로는 벌써  년차입니다   정식 진단은 작년   월에 받았습니다   제가 복지계열 종사자인데 직업 특성상 몸을 많이 써서 손목이 악화되어서 약이 안들어 주사를 맞았습니다   지금 주사 맞은지 거의  달이 되었습니다   당연히 멀쩡한 손목은 아직까지는 건강합니다   아픈 손목이 오른쪽인데 오른손잡이라 힘을 최대한 빼도 어쩔 수 없이 힘이 들어가네요   중간에 손목보호대도 사용을 해왔는데 어느순간부터 주사맞은 쪽 손목에 힘줄이 붉게 보이고 손목이 꼭 고무줄처럼 늘어졌다 쪼인 느낌이 듭니다   저 수술하지는 않겠죠   ,정형외과
손가락 부목 붕대  갈기,어제 손가락이 다쳐서 병원에 갔는데 부목을 해주시고 붕대랑 반창고  같은거로 해주셨는데 붕대에 뭐가 묻어서 갈고 싶은데 갈아도 되나요   그리고 약국에서 파나요        병원에서 한 부목  갈아도 되나요       약국에서 파나요  ,정형외과
대퇴골 골절 수술,수술 후  주 좀 안됐는데요 의사선생님이 수술한 다리는 땅에 짚지 말라고 하셨거든요 핀 박아놓은거 뭐 허물어져서 큰일난다고    근데 실수로 까치발로 짚어버렸는데 큰 문제 없겠죠    ,정형외과
mri 검사결과 판독 좀 부탁드립니다,교통사고 허리통증으로 mri 촬영을 했는데 어떤 증상인건가요  심각한건가요,정형외과
고관절 다치면 사망률이 높은이유가뭔가요 ,합병증때문인가요  합병증 일어나는게 흔한가요  ,정형외과
