0,1,2
사랑니 발치 후,오른쪽 아래 사랑니를 발치 한지  일째 되었습니다  아직 입을 크게 벌리기가 힘들어서 양치를 할때 오른쪽 아래 어금니쪽을 제대로 하지 못하고 있습니다  가글은 하고 있지만 오른쪽 아래 어금니 바깥쪽이 계속 텁텁해서 확인을 해보니 살짝 흰색   이물질 같은것들이 어금니 잇몸쪽을 덮고 있더라고요  이쑤시개로 조금씩 걷어내 지길래 딱딱하지 않고 약간 물뭍어서 뭉쳐진 가루 같은 느낌   앞부분을 조금 걷어 냈더니 피가 살짝 나더라고요  잇몸 치유 과정에서 생기는 건가요   아니면 음식물 같은게 찌꺼기가 된건가요   걷어내도 될까요  ,치아 유지  관리
치과 스케일링,작년 가을에 스켈링 하고 난 뒤 예약 잡고 방문해서  좌측 잇몸 치료 스켈링후 긁어냄   다시 예약후 가운데 잇몸치료 또 예약후 우측 잇몸치료  그렇게 한달이 걸렸고요      년  월   일 스켈링 후  좌측 가운데 우측하고 있는데요 치석이 많다는건 알겠는데  일반적으로 잇몸 치료는 스켈링을 전체적으로 한번하고  끝나는게 정상 아닌가요 건강보험이 된다지만  전체적으로 하고 나서 왜 좌 우를 나눠서 다시 하는거죠   아무래도 과잉진료가 아닌가 싶어서 질문 남깁니다,잇몸질환
사랑니 지혈, 월  일 어전에 사잔니 발치를 했는대 오늘  일짼 데 아직도 피가 살짝씩 나와요   침 뱉어도니까 피도 살짝 섞여있구요   괜찮은건가요   ,치아 유지  관리
어금니가 아파요 도움 부탁드립니다,한달 전 즈음부터 사진 상 보이는 오른쪽 치아가 딱딱한 음식물을 씹을때마다 아파왔습니다 처음에는 윗니가 아픈건지 아랫니가 아픈건지 분간이 되지 않아 치과 내원하여 잇몸치료만 하고 왔는데 그 후로도 통증이 가라앉지 않았고 확실히 아래쪽이 아픈 것을 느끼고 지난 월요일 다시 치과 내원하여 아래쪽 사랑니를 발치한 상태입니다 발치한 지  일 된 상태로 오른쪽으로 음식물을 씹어 봤는데 통증이 그대로인거예요   의사 선생님 보시고 조언 부탁드릴게요 사진 상 보이는 오른쪽 사랑니 옆 어금니가 아픈데 혹시 어떻게 치료를 해야 할까요  치과에서는 오른쪽 아래 어금니도 상태가 좋지는 않다고 하셨습니다 다만 흔들리지는 않아요 사진 상 왼쪽 어금니도 현재 발치 후 임플란트 기다리고 있는데 그 옆 기존 임플란트한 치아가 흔들려서 임플란트 발치 후 재임플람트 할 예정입니다  ,의치  임플란트
큰 어금니 발치와 임플란트 뼈이식 나사식립 동시에 했는데 잘 아물고 있는건가요 , 이틀전에 큰 어금니 발치와 뼈이식 나사식립을 동시에 했는데 어제까진 검붉은 피딱지였는데 오늘은 하얗게 변했거든요    잘 아물고 있는 과정인지 궁금하고 원래 나사가 안보이는것도 정상인가요 ,의치  임플란트
교정이 필요한 어금니 교합인가요 ,한쪽은 어금니 교합이 좋은데 반대쪽은 안좋다고 합니다  앞니도 돌출되어있긴한데 불편함은 크게 못느껴요  나이가 있어 교정이 망설여지는데 어금니 교합이 교정이 꼭 필요한 교합인가요 ,치아교정
입술살 질문,제가 무턱에 윗입술이 튀어나와서 너무 걱정입니다 윗입술만 좀 드러가도 괜찮을거같은데 제가 볼살이 무지 많거든요 혹시 살을 빼면 입술이 들어갈수있나요 ,치아교정
침 삼킬때 따끔해요,침을 삼키거나 물을 마실때 왼쪽 위 어금니쪽 잇몸부터 아래쪽 어금니 잇몸과 목부분이 따끔합니다  혀 완쪽 부분도 뭔가 났습니다   어제 커피랑 율무차를 많이 마시긴 했는데 그것때문에 잇몸이랑 혀에 뭐가 난걸까요   ,잇몸질환
어금니에 구멍이 생겼어요,윗쪽 어금니에 구멍같은게 생겼는데요  년전에 충치치료를 다 마쳤었고  개월전에 스케일링겸 검사한번 받았었습니다 레진이 깨진건가요 아니면 충치가 다시 생긴건가요 ,충치  치아질환
저 파란색 보충제 뒤에 있는 치아에 까만 부분 혹시 충치인가요     어제 진료 받아서 원래 저 부분도 파란색 보충제로 채워져 있었는데 오늘 식,저 파란색 보충제 뒤에 있는 치아에 까만 부분 혹시 충치인가요     어제 진료 받아서 원래 저 부분도 파란색 보충제로 채워져 있었는데 오늘 식사하다 빠지고 보니까 충치같은게 보이네요 혹시 이게 정상인지 아니면 의사분께 말씀 드려야 하는지 모르겠네요,충치  치아질환
 나눈질문   치은암 인가요  심각한 병인가요  혐오주의,안녕하세요 중국에서 교정을 시작해서  년정도 했는데 현재 코로나로 인해서 치료를 못 받고 방치했습니다  그래서 보니까 일단 잇몸 구석구석 뭐가 생겼고 잇몸 색도 하얗게 변하고 부어있습니다  뿌리가 튀어나온건가요  무엇일까요  통증은 없지만 이상이 생겨서 걱정이 되네요    ,잇몸질환
코로나 확진자 급성치수염,이번에 코로나 양성떠서 확진되었는데요  며칠전부터 치통이 있더니 금일 치통 증상이 너무 심하네요 인터넷과 검색을 통해 지켜보니  제 상태가 급성치수염같아요  타이레놀과 자이날 진통제 복용중인데 아무 소용없고  그나마 차가운물 입에 머금고 있어야 살맛   이것도 물 식으면 또 아파짐  이번주 일요일날 격리 해제되는데  진짜 도저히 못참겠어요  코로나 치과 사례도 아무리 찾아도 없고  도와주세요 코로나가 아니라 급성치수염이 사람잡겠어요 ,치아교정
신경 치료후 크라운으로 씌웠습니다 통증이 계속있어 완전 붙이지는 않은 상태인데 뿌리부분이 아닌 동그라미부분에 염증이 생겨 염증은 제거 했는데 발,신경 치료  번하고 크라운으로 씌웠습니다 좀 심하게 썩은 어금니였습니다 기둥도 세웟구요  통증이 계속있어 완전 붙이지는 않은 상태인데  가끔 뜨거운 찬물에 꾹쑤심 아침저녁으로 그냥 욱신거림 씹을때 불편  뿌리부분이 아닌 동그라미부분에 염증이 생겨 염증은 제거 했는데 발치 할수있다고 겁을 줘서요   저쪽에 신경이 남아있거나 크라운이 안맞아서 염증이 생길수도 있나요  신경치료를 급하게 끝낸 느낌이 있어서요 신경치료 마지막때 아팟어요   전에는 마지막 신경치료때 마취없이도 안아팟던거 같은데  ,의치  임플란트
코로나 치통,동생이 코로나 확진되고 같이 생활해서 저는 계속 pcr 신속항원 검사받는데 매일 음성 나오구용 다른 증상은 없는데 치과 치료 받고 축농증 수술한지 수술한 부위랑 인후통이 심하고 잇몸이 너무 아파서 병원에 가니 이상은 없고    통증은너무 심해서 처방받은 진통제를 거의 두시간 마다 먹어야 그나마 버틸수있고 너무 아파서 새벽애 겨우 잠드는디    언제까지 이럴지   코로나는 아닌데 통증이 너무 심해서 병원가도 방법이없어서 진통제만 먹으면 되는지 그리고 혹시 치통 있으셨던 분들은 몇일 뒤에 통증이 사라지셨는지 궁금합니다 ,잇몸질환
