0,1,2
충치 양치질,제가 두달 전에 이에 까만 점을 발견했어요  아무 생각없이 숨을 크게 삼키는데 갑자기 너무 시린 통증이 느껴져서 발견하게 됐어요  크기가 그렇게 크진 않고 작아서 잘 몰랐는데 보면 볼수록 충치같더라고요     다른 곳도 작은 점을 발견했어요  치아 바깥면에 치아 모양 따라 까만 선도 발견했어요   일단 통증은 그 뒤로 한 번도 없고 거울보다가 다른 곳에 충치 있단 걸 알게 된 거라 양치질로 커버가 될지 궁금해요  제가 사실 양치질에 좀 소홀하고 잔 간식을 많이 먹기도 해서 충치 발견한 후론 일단 간식도 안 먹고 빡세게 신경써서 양치를 하고 있긴 하거든요    아님 이미 늦은 걸지 좀 궁금합니다    치과 치료를 한다면 통증이 없는 상태인데도 혹시 신경치료를 하게 될 수도 있나요  겉에서 보기엔 진짜 점이거든요  근데 위에만 이렇고 속이 많이 썩는 경우도 있는지도 궁금해요 ,충치  치아질환
치아교정 끝내고,치아교정을 다 끝낸다음에 시간이 지나면 다시 교정을 하기 전처럼 되돌아가나요 ,치아교정
치아교정 마쳤는데 수정할 수 있나요 ,치아교정을   세에 시작해서   세에 마졌어요  교정 끝나고  년정도 됐습니다  그런데 앞 윗니가 좀 안으로 들어가서 윗입술과 인중있는 쪽이 안쪽으로 좀들어왔어요  이걸 다시 앞으로 좀 나오게 하고 싶은데 그럴 수 있을까요 ,치아교정
치아 교정,나비이빨인데요 윗니입니다 위에만 부분교정하고싶은데 이정도면 발치해야하나요,치아교정
충치인가요  사진에 보이는 검은 점들은 충치인가요  바로 내원해서 치료를 하는게 좋을까요  그리고 사진에 있는 하얀색은 뭔지 궁금합니다 ,충치인가요  사진에 보이는 검은 점들은 충치인가요  바로 내원해서 치료를 하는게 좋을까요  그리고 사진에 있는 하얀색은 뭔지 궁금합니다 ,충치  치아질환
치아 변색,이 치아는 유치가 다 빠지고 난 후부터 계속 이렇게 누랬는데 이거 왜그런건가요   라미네이트 밖에 답이 없나요   ,치아 유지  관리
턱관절이 아파요,안녕하세요 저번주에 확진이 되어서 집에서 자가격리 하던 중에 갑자기 턱관절이 아프기 시작했습니다 저는 처음에 그냥 자세가 잘못 돼서 아픈건가 생각해서 대수롭지 않게 넘겼는데 어제부터 조금씩 아프기 시작하더니 오늘은 입을 크게 벌리기도 힘들 정도입니다     치과에 가야하는지 어디로 병원을 가야하는지 몰라 이렇게 질문을 남깁니다   ,치아 유지  관리
치과 충치 크라운 브릿지,치과 치료를 받고 있는데 일단은 현재 신경치료만 몇번 받고 있는 중입니다   개 치아 중에서 위왼쪽 가장 안쪽에서  번째  번째  번째 치아  임플란트는 안해도 된다고 하시는데 아래 두가지 방법중에서 하나를 선택하라고 하시더라구요   크라운  번째  하나는 인레이  번째    그리고 가운데 치아는 그냥 가만히 두기  근데 이 가운데 치아가 좀 입안쪽으로 삐져 들어와 있는상태    브릿지 가운데 치아 둬봐야 나중에 음식물 껴서 또 충치 생길수 있으니 이참에 발치하고  양쪽 치아와 브릿지 하기  이것참 애매하네요   번을 하자니 나중에 또 치료해야 할것 같고  번을 하자니 멀쩡한 치아 발치하는게 맘에 좀 걸리고   혹시 이런 경험 있으신분들 어떤게 더 나을지 도와 주실수 있을실까요  치과 의사샘은  번을 추천하는 눈치입니다  좀더 비싸더라구요,충치  치아질환
눈 코  돌출입 교정 질문입니다 ,안녕하세요    대 남자입니다  눈  코 성형 및 돌출입 교정을 생각하고 있습니다  그런데 어디서부터 이걸 해야할지 감이 안와서요   교정을 먼저하고  눈 코를 해야하는지 눈코를 먼저하고 교정을 해야 하는지 아니면 한번에 이과정을 해야하는지  순서나 방법이 궁금합니다 ,치아교정
치아교정 무턱 돌출입, 년 정에 치아교정을 해서 아직까지 하고 있는데 일반 치아교정도 무턱 돌출입이 개선되나요  아니면 따로 무턱돌출입 교정을 안하면 잘 개선 안되나요 ,치아교정
치과선생님들 이런거 무슨 증상 인가요 ,  번 치아 어금니가 레진 치료 받고  개월 동안 이가 시렸다가 이제는 시리는게 사라 졌습니다  대신에 얼굴 근육이 크게 증가 했는데요  얼굴 근육 때문에 입 벌릴때 힘들어 합니다  이런경우도 문제가 크나요 ,충치  치아질환
사랑니 나는부분,찢어진거같은데 안아프고 피도안나는데 발치해야되나여 ,치아 유지  관리
턱관절 장치치료 코로나,안녕하세요 저는 코로나 확진자인데 제가 턱관절이 안 좋아서 스플린트를 밤마다 끼고 자는데 이 장치를 코로나 완치 후에도 계속 껴도 될까요   ,치아 유지  관리
사랑니 실밥제거 기간,요번주월요일날 매복사랑니뽑고 다음주 화요일날 실밥제거하러가는날이였는데 오늘 코로나 확진이되서 치과를 못가는데 실밥제거하는거는 예정보다 좀 늦어도 상관없나요   ,치아 유지  관리
사랑니 발치 후 피떡,사랑니 발치한지  시간정도 지났는데 저게 정상인가요   파떡이 너무 없는거 같아서 걱정돼요 드라이소켓인가요 ,치아 유지  관리
임플란트는 어떤경우에 하게되나요  ,제가 잇몸은 좋은편도 나쁜편도 아닌데  크라운은 좌우 위쪽어금니  개씩 오른쪽아래 어금니 개 총 개했고  인레이는 왼쪽아래 어금니  개  왼쪽위 어금니 앞에작은니  개 총 개 했습니다   앞니 아래쪽  개 교합이 잘 안맞는지 이빨위쪽이 마모된 상태입니다   어금니 말고도 앞니쪽에도 크라운을 좀 하는 편인가요    그리고 임플란트는 어떤경우에 하는건지  ,의치  임플란트
치아 임플란트,어머니가  이번에 치과에 검진을 받으러가니  치아 아랫니를 예전에 치과가 아닌곳에서 금니로 씌웠는데 하나하나 씌운게 아니라  개를 한꺼번에  연결해서 씌워져있다네요  현재 임플란트를 하던지 치료를 받아야 할것 같은데  개가 연결되어있어 치료를 받으면  개를 한꺼번에 받아야 할것 같은데   상태가 임플란트가 가능한 상태라고 했을때 임플란트를  몇개를 심어야할까요  예를 들어 임플란트 개 브릿지 개 등 이렇게도 가능할까요    아니면 다른 방법이 있을까요   대략적인 금액이 어느정도 되는지도 궁금합니다 ,의치  임플란트
치아교정 부정교합,교정을 하려고 하는데 제가 앞니 치아 중심선이 위 아래 안맞거든요    그리고 턱에 소리도 나서 턱 관절장애도 있는거 같은데 이상태에서 교정하면 안면비대칭이 올까요     교정 하려고 했더니 치과의사선생님이 턱 교정부터 하라고 해서요     ,치아교정
돌출입 수술,돌출입인가요  돌출입이라면 수술 비용은 얼마나하나요 ,치아교정
무턱인가요 돌출입이라서 투턱이 심해진건가요 ,유독 턱살만 많아서 너무 스트레스예요 어떤 요인때문에 턱살이 유독 많은 걸까요  살을 빼도 턱살은 잘 안 빠지는 거 같아요,치아교정
돌출입 질문,사진처럼 윗입술 돌출이 심한데 어떻게 해야할까요  질문  지금 나이가   살인데 이런 입술 교정이나 시술은 기능한가요  질문  집에서 자가로 교정하는 방법이 있나요  입술 운동이라던지 그런건 없나요  질문  돌출입은 교정을  개월 간 하고 시술을 한다던데 맞나요  비용은 얼마정도 드나요 ,치아교정
이정도면 돌출입인가요  ,혹시 돌출입이라면 교정 이외에 고칠 수 있는 다른 방법은 없을까요 ,치아교정
사랑니 절개해야할까요 ,몇 년 전에 난 사랑니인데 방치하다보니 좀 썩었더라구요 더 썩기 전에 뽑으려 하는데 이 정도면 절개해야할까요  아니면 절개없이 뽑을 수 있을까요,충치  치아질환
교정한뒤턱,지금 앞니가 아랫니를 가리는 상황이라 앞니 뒤쪽에 동글동글한걸 붙혀서 위아래가 닿지않게 해놓은 상태인데 그러다 보니까 턱이 길어보여요 원래 턱이 좁고 작았는데 갑자기 길어지니까 너무 못생겨보이고    원래도 불편하진 않았거든요 교정 치료 끝나도 턱 길어보이는건 그대로 일까요,치아교정
교정기 고무줄,교정 하고 있는데 고정하는 고무줄을 답답해서 뺐는데 교정기가  개나 빠졌어요   이러면 안됐나요  내공   ,치아교정
턱에서 소리나요,턱에서 소리가 나는데 평소엔 입벌릴때 딱딱 이정도만 나는데 하품할때나 입 크게 벌릴때 우드득 소리가 나면서 벌어지거나 안 벌어지고 그래요  이거 비대칭 생기나요  어케 고쳐요,치아교정
남자만 있는 치과,지역은 상관 없고 남자만 있는 치과가 있긴 하나요 ,충치  치아질환
재신경치료 가능성  , 년전 크라운 씌운곳 옆에 인접면충치가 생겨서 갔는데 크라운 한 치아도 안좋다고 하시네요   뿌리쪽으로 염증이 크게 있다고 하는데 이 이빨은 딱히 아프지 않아요 그 뒤쪽 치아에 충치때문에 통증이 있거든요 둘다 발치하고 임플란트 해야할수도 있다고 하는데 아직   대 중반이라   혹시 재신경치료 할 수 있을 가능성이 있을까요    하더라도 지금은 아니었으면 해요   그림때문에 잘 안보이지만 부탁드립니다  ,충치  치아질환
치아사이를 혀로 누르면 시큰거리는느낌 잇습니다,우선 치과에 방문하여 충치나 염증같은게 잇는지는 확인햇지만 다행히 없다고 하셧습니다 그런데 치아 사이에 혀로 눌러보면 약간 시큰거리는듯한 느낌이 잇는데요 충치나 염증이 아닌이유로 치아사이가 시큰거릴만한 이유가 잇나요  치아가 깨진것도 아닙니다 계속 시큰거리진않고 가끔씩 그럽니다,충치  치아질환
신경치료 후 크라운 씌운 당일 통증 질문입니다 ,크라운을 씌우기 전까지는 항상 반대쪽으로만 음식물을 씹다가  오늘 크라운을 씌우고 처음으로 음식물을 씹어 보았는데 통증이 있습니다   스파게티 면이라 굉장히 부드러운 음식인것 같은데    손가락으로 살짝 눌러보아도 통증이 있습니다   원래 당일에 통증이 느껴지기도 하나요 ,의치  임플란트
교정 안쪽 유지장치가 자주 떨어집니다,교정 끝난지  년 개월 됐는데 안쪽 유지장치만  번째 떨어졌습니다  한번은 떨어진줄도 몰라서 틈이 생겼고 최근에 또 떨어져서 탈부착 기구로 어떻게든 좁혀보려고 몇주 고생하다가 붙이려는데 그 사이에  개가 추가로 떨어져 있어서 총  개 붙였네요    근데 오늘 또 떨어졌어요   아니 근데 주위 교정한 사람이 많은편인데 유지장치 떨어진 사람을 못봤거든요 대체 뭐가 문젤까요  제가 치과에 따져도 되는건가요  한두푼도 아닌데 틈 줄이려면 재교정 해야한다니까 열불나고   교정한 후로 앞니가 약해져서 최대한 어금니 쪽으로 먹고 했는데 개인적으로 너무 억울합니다,치아교정
맨 끝 어금니 안맞게 자람,잇몸 때문에 이렇게 자란거같은데  거울로보니까 눕혀서 자랐거든요 이게 제가 원래 치열이 안좋아서 대부분의 이빨들이 다 삐둘어요 이 경우 성인때 교정해도 무난하나요  그리고 앞이빨은 심하게 삐둘고 밑에이빨들고 좀 많이 삐둘어요 이경우    은 기본인가요 ,치아교정
급  어금니가 흔들리는데요  ,어금니가 하루아침에 흔들려서 그러려니 치는데 오늘 피자먹다가 어금니가 조금 깨졌습니다   잇몸쪽으로 깨졌는데 평범할때 흔들릴 때보다 깨진게 더 아파요     근데 내일 친구들이랑 마라탕 먹으러 가는데 어떻게 가요      진짜 가고 싶은데 먹으면 어금니 빠질까봐요     어금니 빠지면 되게 아프잖아요    아프면 친구들이랑 노는데 지장이 갈거고   그냥 오늘 어금니 빼고 고통 다 받고 낼 편하게 놀까요   아님 낼 약속 취소하고 치과 갈까요     등등 꿀팁  좀요    ,의치  임플란트
치과 염증난 치아 발치하다가 염증난 뿌리가 상악동에 들어갔습니다,안녕하세요 원장님 저는 치과 염증난 치아를 발치하고 교정치료계획을 세웠습니다  그런데 발치 도중 천공되어 염증난 뿌리조각이 상악동에 들어갔습니다  저는 발치할때 천공될 위험성에 대해서는 듣지못했고요  이 병원에서는 본인들 실수를 인정하고 상악동에 들어간 염증조각빼는 상악동수술을 무료로 시술은 해줬습니다  그런데 이 수술을 하고난 뒤에 진짜  주일간 잇몸을 다째고 빼서 그런지 너무 고통이 심했습니다  무료로 사후책임을 져줬다고해도 이에 대해 손해배상이나 교정비에서 차감을 받는등 배상을 요구해야하는 문제의 의료실수일까요  아니면 의료상 충분히 일어날수있는 일로 생각하고 사후수술은 공짜였으니까로 그냥 불행했다고 생각하고 넘어가야하나요  원장님의 의견을 듣고싶습니다 ,치아교정
치과 신경치료 첫날 후 병원 옮겨도 되나요 ,인레이를 하려고 마취를 하고 치료를 하다가 신경치료 해야할것같다고 하고 진행했는데 너무 아파서 잠깐 중단했는데 하는말이 인레이 할 만큼의 마취만 했는데 추가로 마취하면 기다려야하니깐 그대로 진행했다네요  다 아프고 난 뒤에 마취 더하고 첫날 치료는 끝났는데     신경치료할때 러버댐도 안하고    영 맘에안들어서 다른데 가고싶은데 치료 중간에 병원 옮겨도 괜찮나요 ,충치  치아질환
원래 교정할때 이아픈건 당연한거죠 ,지금 교정기 단지 한달 넘엇는데 아파서요,치아교정
크라운염증,이빨을크라운으로씌웠는데 안쪽을쇠로 씌워났더라구요근데 만질때마다약간시린느낌이고심하진않아요  년전에한건데  년동안이랬어요 크게문제없겠죠   ,의치  임플란트
이빨 씌운곳이 아파요 도와주세요  ,제가  년정도 전에 충치가 심해서 신경치료  하고 이빨에 뭘 씌웠어요 근데 이게 지금까지 괜찮았는데    일 전부터 그냥 있어도 통증이 있고 작고 밀랑할것도 못씹을 정도로 아파요 그냥 있으면 괜찮을 때도 있는데 쫌 아프고 뭘 씹거나 이빨끼리 부딪치면 그때부터 지옥이에요 제가 최근에 얼음을 자주먹었었는데 이게 원일일까요  혹시 수술이나 큰 치료를 해야하나요  그냥 있으면 괜찮아질까요   도와주세요   ,충치  치아질환
어금니 깨짐,  년전에 떼운어금니가 깨져서 치과갓는데 심한 경우 발치해야할수있다 그러는거에요     제가  개월에한번씩 치과를가구 아프면 바로 치과가서 검진 받는데     지금은 씹을때만 조금 아프고요 평소에는 전혀아프진않아요 윗부분 이 깨졋고 저기르르 누르면 좀 아파요   발치해야하나요     너무무서워요    ,충치  치아질환
골드인레이 궁금합니다  ,제가 요즘 치과를 다니고 있습니다   위쪽 두번째 어금니가 많이 썩어있어서 일단 신경치료 없이 충치치료하고 임시보철물 을 넣어두고  주정도 써본다음 통증을 보고 신경치료를 정하기로 했습니다  근데 도자기랑 금중에 떼우는걸 무엇으로 할건지 고르라고 하셔서 물어보니 실장  이란분은 충치가 깊고 신경이랑 가까이 있어서 금으로 떼우게 되면 치아가 많이 시릴거라고 하시더라구요   도자기는 깨질수도 있다 그러셔서 그냥 참고 금으로 하려고 했다가 많이 시릴수도 있을거같아 무서워서 도자기로 바꾸고 왔습니다 치과 원장님들은 뭐를 더 추천하시나요  좋은 답변 부탁드립니다   광고 달지마세요,충치  치아질환
치아 통증,오른쪽 어금니 위아래가 가만히 있어도 통증이 있고 스케일링 한쪽을 누르면 굉장히 심한 통증이 있어요 이유가 뭘까요  그리고 만약 안 좋은 쪽으라면 치과에 가야 하나요  치과에 안 가도 통증을 사라지게 할 수 없나요 ,충치  치아질환
손톱 뜯는 버릇때매 앞니 두개 길이가 다른데 어떻게 해야하나요 ,손톱을  년정도 계속 뜯는 버릇을 못고쳐서 앞니 두개 길이가 다르고  앞니에 하얀 점   같은게 있는데 병원 가봐야하는건가요 ,치아 유지  관리
치아교정 전 날 술,치아교정 하기 전 날에 술 마셔도 괜찮나요 ,치아교정
충치 떼우기 후 음식 섭취시 너무 아파요  ,안녕하세요 제가 치과에서 충치치료 떼우기를  개 했는데 하나는 잘되었는데 하나는 약간 깨져 있어서 다시 해야한다고 하셔서 다 떼운 거 다시 다 긁어내고 지금 잠시 다른걸로 막고 일주일 뒤 다시 치아 본뜬거 넣어주시는데 현재 음식씹을때 너무 아프더라구요    맨 처음 했을 땐 안 아팠는데 왜 이러는걸까요   치아가 잘못된걸까요   ,충치  치아질환
신경치료 후 덮었는데,신경치료 후 덮었는데 구멍이 있어도 괜찮나요  ,충치  치아질환
치과 치료 궁금해요  ,첫번째 사진은 아무치료도 안한 충치사진 두번째 사진은 신경치료  회 후 사진입니다 오늘까지 신경치료 총  회 마치고 이제 크라운 씌우는 치료만 남았는데 치과에서 안에 콘크리트같이 기둥을 세우고 크라운을 씌운뒤 마지막으로 이를 단단하게 마무리 하는 레진   을 한다는데 제 치아 상태에서 기둥과 레진이 꼭 필요한 치료가 맞나요  주위에선 크라운만 씌워도 되지않냐 하는데 전문의의 답변이 궁금합니다  그리고 기둥  크라운  레진    총 다 해서   만원이면 비싼건가요 저렴한건가요 ,의치  임플란트
치과의사 되는 법,교정과 치과의사가 되고 싶은 고 입니다  치과대학하고 치의학전문대학교중에 뭐가 더 좋나요   차이점도 알려주세요   치과대학은 연세대에만 있다는데 저희 고등학교에서 연세대를 가는거는 아주 무리에요  ,의치  임플란트
사랑니 약 언제 먹을까요 ,오늘  시에 사랑니 뽑았는데  일치 약 처방 받았습니다   점심은 미리 먹었는데 저녁부터 약을 먹을까요 아님 오늘 점심  저녁  번 먹을까요 ,치아 유지  관리
이빨때문에 절망적이에요,제가 이빨이 좀 시려요 충치인 거 같은데 너무 절망적이네요 충격받아서 좀 걱정되는데 혹시 지금부터라도 단 음식 먹는 걸 줄이고 양치질 잘 하면 괜찮을까요  전   살 밖에 안 됐는데 의사선생님들이 저 보고 이렇게 하면 절대 안된다고 자꾸 말씀하셔서 걱정돼요 저도 끊으려고는 하는데 잘 안돼요 이번에는 진짜 끊을건데 질문 할게요   이빨을 잘 닦는 법   단 걸 줄이는 법   튼튼한 이빨 만드는 법 제가 원래 이빨이 약하기도 해서요 이것 좀 알려주세요 진짜 중요한 문제에요     ,치아 유지  관리
턱관절이 아파서 병원을 가려고 합니다,턱관절이 좀 뻑뻑해요 턱을 열면 맷돌가는 소리도 나고 이것때문에 두통도 가끔 있는거 같아요   아무튼 병원을 가려고 하는데 제가  년전에 교정을 했었거든요    년전쯤에 교정기 제거하고 유지장치만 하고 있는데 제가 지금 사정상 타지에 있어서 교정을 했던 병원에 다시 가서 치료를 받을 수 없는 입장입니다  교정을 했던 병원이 아닌 타 구강내과에서 턱관절 진료를 받아도 괜찮을까요  교정때문에 턱이 아픈건지는 정확히 모르겠어요,치아교정
초등학생  학년입니다 ,제가 오늘 충치를    개 차료하고 발치를 한번 했는데 하는 과정에 마취주사기로 마취를 충치치료 하는 곳에 놨거든요  그리고 다 했는데 물은 마실수았지만 음식은 좀 나중에 먹으랬어요  그래가지고 지금 햄버거가 왔는데 제가     분에 치료 끝냈거든요  그래서 몇시쯤에 먹어야될까요,충치  치아질환
입천장 마취 풀리고 아픈 시간,치아교정 시술 과정중에서 급속구개확장장치 RPE 를 장착하려고 마취 주사를 입천장에 맞았는데요  시  분쯤에 마취를 맞고  시  분정도부터 많이 아프기 시작했는데 얼마나 더 아플까요   그리고 마취 풀리는동안 안 아프려면 아이스크림 먹으면 좋다는데 사실인지도 궁금해요,치아교정
치아교정 치아변형,치아교정이 끝난지 오래되었는데도 꼇다 뺏다 하는 유지장치를 낀날과 안낀날 치아가 좀 차이나는거같은데 정상인가요  밑니가 앞니보다 점점 튀어나오는거같아요,치아교정
치아교정하는데,그림처럼 이빨과 이빨사이에 파란 고무줄을 끼워주셨어요 근데 제가 까먹고 왜 끼운 건지 못 물어봤는데    왜 끼우는 건가요      곧 빼나요   아님 교정끝날 때까지 끼고 있나요      상악확장장치는 이미 교정시작하면 못하는 걸로 아는게 저 이미 교정장치 세라믹으로 붙여져있고 철사도 연결했어요 그럼 tpa장치다나요     참고로 그림은 아랫니를 위에서 봤을 때입니다,치아교정
광주에 치아 유지장치붙여주는 치과,서울에살다 교정까지 다 끝내고 광주로 내려왔는데 유지장치 아랫부분이 떨어져서요   광주에 해당병원이 아니더라도 붙여주는 치과있을까요 ,치아 유지  관리
사랑니 발치 후 빈 공간,안녕하세요  년 전 쯤에 사랑니 발치후 비는 공간이 많아 그 안으로 타원형  무언가를 넣었던 것 같은데 그게 뭔지 잘 기억이 나질 않아 혹시 아시는 의사분께서 있으실지 글 올려봅니다     한국에서 발치를 하고 현재는 쭉 외국에 있는 상태라 그 병원에 가서 물어보기도 힘들어서요  기억이 가물가물하지만 최대한 생각해보자면 오른쪽 사랑니가 긴 타원형으로 나 있어서 그걸 뽑고 빈 공간에 의사선생님께서 무언가를 넣어주신다고 하셨는데 이게 영구적인 것인지 아니면 주기적으로 관리를 하러 치과에 들러야하는지 모르겠습니다   이것 때문에 한  만원   만원 정도 더 나왔던것같아요  혹시 아시는 분 계시면 답변 부탁드립니다      혹시 주기적으로 갈아줘야하는건데 모르고 있다가 염증 생기긴 싫어서     ,치아 유지  관리
 빨리 해주세요 치아에 관한건데 기억이 안나요   ,제가 치아 교정을 하러갔을때 치과 의사선생님께서 치아만 있고 뿌리가 없어서 맹목적 함출 실패라고 하셨던것 같은데 기억이 잘 안나요 알려주세요,치아교정
앞니 신경치료 치아 재 충치  차충치, 년전 교통사고로 앞니 하나는 임플란트 하나는 금이가서 신경치료 하였습니다 재작년   월쯤 신경치료한 치아에 충치가 생겨서 재신경치료를하였고  달전부터 그쪽 치아가 아파서 여러 병원을 다닌결과 뿌리쪽에 전혀 염증이 보이지않고 문제가 없다고 하였습니다 하지만 계속 통증이 있고 냄새가 심해지며 가끔 고름같은것도 잇몸과 치아 사이에 보입니다 그리고 그 치아 치실을 하면 딱 냄새가 나는 부위가있습니다  대학병원에서도 문제가 없다고했지만 통증을 호소하니 치근단 절제술을 말씀하셨는데요 엑스레이상 전혀 염증이 없는데 치근단절제술로 해결이 되는문제인지 의문이듭니다 신경치료한 치아에 보철물을 제거해달라고하니 제거하면 다시는 보철물을 씌울수 없는상태일수도있다고 제거를안해주시는데요  제가볼땐 치아 머리 부분에 충치가 심하게있고 뿌리까지는안간상태인거같은데요 이러면 발치밖에 답이 없나요   ,충치  치아질환
