0,1,2
임플란트 할때 다들 금속  니캘  티타늄 검사 안하고 하나요  ,https   www youtube com watch v q  azU UYTk  https   www youtube com watch v uS j sLViPk   아무리 엄청 희귀한 알레르기라고 해도 그렇지  티타늄은 희귀해도 니캘은 그렇게 희귀하지도 않을걸요  또 임플란트 부품이 티타늄이라 해도      티타늄이 아니라 별의별 금속을 합쳤다네요  표기도 안해놓고  뉴스에도 나왔는데 알레르기 있을시 문제 생겨서 결국 임플란트 다 빼야 하고 돈 보상 못 받는데요  왜 아직도 치과에서는 반드시 체크해야할 사항들을 그냥 무시하고 그냥 임플란트를 하나요   잘하는 좋은 곳으로 치과를 가도 그냥  안해도 될텐데 라고만 하네요  뭔가 빨리 그냥 취소 안하고 임플란트해서 돈 벌고 싶은데 라는 느낌  그것도 좋은 치과라고 고객 소중히 생각한다는 글도 있고 하는데  뭔가 이상할정도로 임플란트를 모두에게 심고 싶어하는듯하네요  심어서 뭔가 이익되나요   돈말고도요   치과가 아니라 나라에서 도움이 되나봐요    검색해보면 진짜 정보가 별로 없고요   다른 분은 접촉으로 검사를 했다네요  첩포검사라고  등에 여러가지 금속 알레르기 검사로 등에 붙여   시간 동안 샤워도 못하고 있다가 나중에 빼서 확인한데요  그런데 이게 진짜 임플란트를 위한 검사인지 아니면 무관한 방식의 검사 인지는 모르겠네요  왜냐하면 임플란트는 뼈에 심는거고 피부에 닿는게 아니긴한데 별로 상관없는걸려나요   잘못된 검사인지   피부과  내과  이비인후과에서 검사 한다는데   이 등에 붙이는 첩포 검사  피검사  머리 두피 검사  가지가 있다는것 같네요   내과에서는   만원이 넘고  머리를 땜빵내서 머리 모근을 어떻게 채취해야 한다는데  쪽팔리게  대학병원은   달을 기달려야 결과가 나온다 하고 있고  치과에서 빨리 해야 한다 하고   진짜 혼자서 난리 치고 있는 기분이네요   아니 임플란트 안할려는건 뭐 그렇다 치고 어쩔수 없는것 같으니 할려하면 또 무슨 검사가 이렇게 정보도 없고 복잡하고 어렵고 비싸고 하기 싫은건지  귀찮게   그냥 이빨 놔두고 썩으면 자연대로 놔오라 하고 아무것도 하기 싫네요  부분틀니 하고 싶네요  왜 또 틀니는 그렇게 나쁘다고 하는지   모두가 다 당연히 그냥 하니까 왜 난리냐고 하는데 정말 알레르기 있어서 다시 뽑으면 그래도 괸찮겠어요    그냥 운에 맞기나요  ,의치  임플란트
저 돌출입인가요 ,치아교정으로 될 케이스인가요    제발 답변 부탁드려요,치아교정
돌출입 교정하는법,제가 아랫입술이 돌출했는데 돈 안 들이고 교정하는 방법 있을까요   광고 댓글 달지 말아주세요,치아교정
턱 돌출   ,턱이 이렇게 튀어나왔어요 치아교정은  년 조금 넘었는데 턱 돌출된건 어떻게 해야지 들어가요  ,치아교정
돌출입 질문,밑에 첨부한 사진을 보고 판단해주세요      돌출입인가요      발치나 수술이 아닌 일반 교정으로도 심미적인 개선을 가져올 수 있을 정도의 돌출인가요        만약 일반 교정으로도 개선을 가져올 수 있을 정도의 돌출이라면 비용과 기간은 대략 얼마나 걸릴까요      돌출입을 야기하는 습관 중에 혀로 치아를 미는 것 외에 어떤 것이 있나요 ,치아교정
임플란트 피 덩어리,지금 식립한 째  일인데 출혈이 잇는건 아니고 소독하거나 양치할때 피가 조금씩 나오는   정도     자고 일어나면 항상 피 섞인 침이 입술에 묻어 있고 식립한 부위에 피 덩어리가 생기는데     일차인데도 자고 일어나면 피 섞인 침이 이렇게 입술 주변에 묻어 있고 피 덩어리 있으면    치과 가봐야 하나요   ,의치  임플란트
치아 교정 질문이요, 급 부정교정 입니다  아랫니가 윗니보다 앞으로 나와있는 경우인데요  양악수술 없이 교정으로만 하고싶습니다  질문   환자 본인이 양악수술을 원하지 않으면 교정으로만으로 치료 받을 수 있나요   질문   대략적으로  급 부정교합의 경우 비용은 얼마정도 들까요   질문   큰대학병원  지방에있는큰병원  동네에있는치과  동네에있는교정전문치과  이 네곳 대략적으로 가격비교해주세요   질문   치아교정상담을 보통 여러곳을 돌아다니더라고요  치아 교정상담시 무엇을 하고 상담비용은 어떻게 되는지요   답변 자세히부탁드려요  광고는 사절합니다  ,치아교정
치과 임플란트,제가 초콜릿을 쎄게 씹어서 어금니에 통증이 있습니다  년 전에도 초콜릿을 쎄게 씹어서 병원에 갔는데 사진상에 별 문제가 없어서 약먹고 그냥 넘어갔지만 이번에는 사진에 염증이 보여서 저걸 뽑아서 임플란트 해야한다고 하네요 솔직히 약먹고 며칠 버티면 안아플거같긴합니다 나이는   살이라 더 나중에 하고 싶습니다  굳이 지금 뽑이서 임플란트 해야하나요  안하면 다른 치아에 문제가 생기나요 ,의치  임플란트
치아교정 안면비대칭,치아교정으로 안면비대칭이 해결이 되나요    ,치아교정
아래 앞니 교정 기간 비용 궁금해요,대충 통상적으로 이정도면 어느정도 비용과 시간 소요될까요  점점 더 틀어지는거같아요  ,치아교정
돌출입 재교정,비발치로  년 전에 교정을 마쳤는데요 너무너무 후회가 돼서 교정을 다시 하고싶은데 돌출입 교정이 가능할까요  치아문제인지 잇몸 문제인지 모르겠습니다 또 발치하게되면 재교정은 비용이 얼마나 들까요 ,치아교정
양악수술과 교정,안녕하세요 최근에 치과를 갔는데 선생님께서 양악수술을 해야한다고 하더라고요    제가 앞니끼리 서로 닿지 않는 상태이고 입을 다물 때 좀 신경을 써야하는 편입니다  일상생활에서 큰 지장은 없지만 웃는 거나 이갈이 때문에 치료를 하고싶은 마음은 있습니다  근데 양악수술은 너무 부담되고 무서운데 치과를 여러군데 가면 수술이 아닌 교정으로 가능하다는 의견도 나올 수 있을까요  좀 무서워서 글 올립니다  ,치아교정
발치교정 거즈제거,발치한지  시간정도 되었는데 거즈 빼는게 무셔워요   뺐는데 피나는것도 무섭고 여분 거즈도 없는데 어떡하죠 ,치아교정
잇몸 동그랗게 부은 거 뭔가요 ,잇몸이 동그랗게 부어있는데 이 윗쪽 이에 충치가 생겼어서 치료를 했거든요  충치가 옮아서 부은걸까요  이나 잇몸에 통증은 전혀 없어요,잇몸질환
임플란트 해야할가요 ,저희 어머님께서   세 이십니다  위 아래 왼쪽 맨 끝에 있는 이를 발치하신지 가  개월이 지나셨읍니다  임플란트 하시도록 권유하였는데 안 하시려고 합니다  이가 부족하면 침해 걸릴확률이 높다고 해서 임플란트 하시도록 하지만 안 하시려고 합니다  치과 의사 선생님 께서 뼈가 좋아서 임플란트 어렵지 않다고 하시는데   어머님 께서는 맨 끝 에 있는 치아는 안해도 괜찮다고 하더라 시면서 안하셔서 여쭈어 봅니다  더 나이 드시기 전에 해야될텐데  전문 가분의 의견 듣고 십습니다  맨 끝 에 있는 치아는 임플란트 안하고 없는 상태로 지내셔도 될가요 ,의치  임플란트
치아교정 윤곽,제가 윤곽수술을 했는데 윤곽수술후에 치아교정 해도되나요    뭐문제없나요    순서 상관없나요    교정하고 윤곽해야하거나 윤곽하고 교정해야하거나 그런거 순서상관없는거죠   ,치아교정
사랑니 수면마취 되나요 ,제가 사랑니가 총  개 생겼는데 매복은 아니고 다른 치아에 비해 좀 옆으로 휘어서 자랐는데 매복사랑니에 비해 완전히 다 보여요 이것도 매복사랑니인가요 혹시 수면마취를 한다면 꼭 매복사랑니여만 수면마취를 하나요 게다가 발치하면 마취주사 놓는다는데 그것도 진짜 아프다던데 수면마취하고 놓을순없을까요 마지막으로 동네치과는 수면마취 안해주나요 ,충치  치아질환
임플란트 대신 가짜 이빨을 이식할수 없나요  ,임플란트 대신 가짜 이빨을 이식할수 없나요    사랑니가 아직 뽑지 않았거나 나중을 위해 얼려보관 이라고 하나 하면은 가능하다는데  티타튬과 지르코니아 알레르기 반응이 거이 없어 괸찮다는데 왜 꼭 턱 뼈에다가 드릴질을 해서 고정해야 하나요  ,의치  임플란트
치과진료 비용,치과진단이 임플란트  개    만원  지르코니아크라운  개 개당  만원  레진  개  만원  총           선결제           외 비용이 궁금해서요     첫번째치료 오전은 일단 상담위주로 사진 촬영하고         원  오후에는 왼쪽 치료부터 시작하기로했어요 임플 개 크라운 개 사랑니발치  신경치료 사랑니발치 개 스켈링       원  참고로 어금니 발치된지 꽤되어서 윗쪽 치아가 내려와서 깍아내고 신경치료들어가고크라운씌우고 다른쪽  개 크라운치료할거있구요 이런 과정이에요  두번째치료 간단히 위쪽 신경치료 임플란트 심는 거했어요 마취 촬영여러번        원   본인부담금인데 이렇게나 진료비가 나오는게맞나요  예전에 앞니 임플란트한적이있는데 진료비가 이렇게 들어가지않은것같은데 한번에 치료할려니 비용이 꽤드는건지   참고로 치과보험있어요 보험이있어서 여러번촬영하고 그래서 사랑니 스켈링 이런치료는 서비스로해주는것같은데 안해주는지 의무는 아니지만요 진료비가 너무나가는것같아 글남겨봅니다   제가 너무 모르는건지,의치  임플란트
어금니 발치 문의인데 질문입니다,  번 신경치료  번 후에도 차도 없어 발치하려는데  질문입니다      상악동 건드릴 위험이 있어보이나요      치아 머리부분이 없이 GI충전제로 거의 가득 차 있는데 포셉보단 엘리베이터 발치로 갈 확률이 높나요      엘리베이터 넣으면 저 상황에서는      이나      번에 거는지 궁금합니다  발치 사고 영상 보면 이빨 사이에 엘리베이터 넣다가 옆치아 부서진다는데  설마 저도 그럴까 너무 불안합니다    보통 치과 의사분은 어디다 넣으시나요    내공     채택 무조건 하니 알려주세요 ,치아 유지  관리
교정 유지장치,교정  년 반정도 하고나서 안에 붙인 유지장치와 뺐다 꼈다 하는 유지장치를 받았는데요 유지장치를 잘 안낀지 벌써  년 다되어가는데 오랜만에 뺐다 꼈다하는 유지장치를 계속 끼고 생활하는데요 위에 유지장치는 괜찮은데 아래 유지장치가 안맞아요 어금니 부분이 자꾸 안 들어가는데 이 유지장치 그냥 끼고 있는게 맞을까요  치과를 가서 유지장치를 바꾸면 비용은 얼마 정도 들까요  ,치아교정
턱관절장애인가요 ,예전엔 딱딱소리가 났는데 이제는 그런 소린 안나고 벌어지다가 뭔가 턱이 엊갈려서 막히는 느낌인데 느낌상 오른쪽만 그런것 같아요 이런거 찾아봐도 다 딱딱소리 관련인데 전 이제 딱딱거리는 소린 앙나요 뭐죠 이건도 턱관절장애중 하나인가요 ,치아교정
잇몸관련 질문,얼마전에 양치를 하다가 아랫이빨 잇몸에 치솔 끝부분이 부딪혀서 상처가 동그랗게 났습니다 피가 나거나 그런건데 아닌데 물집잡힌것 처럼 나있고 오늘  일정도 지났는데 옆으로 퍼지는것 같아서 질문해요 엄마가 병원가는거 아니라는데 엄마가 조금 옛날 사람인것 같아서 믿음이 안가네요  전문인 사람의 의견을 거의 맹신 하는사람이라서   ,잇몸질환
임플란트 식립후 잇몸에서 썩은내가 진동을 해요   치실도 해주고 양치도 계속하구 그러는데도 잇몸을 만지면 냄새가   그래서 치과를 갓더니 스켈링,임플란트 식립후 잇몸에서 썩은내가 진동을 해요   치실도 해주고 양치도 계속하구 그러는데도 잇몸을 만지면 냄새가   그래서 치과를 갓더니 스켈링만 해주더라구여   임플란트를 빼고 소독후 다시 부착하는건 안되는걸까요 너무 스트레스 받아요   입냄새때문에 대화하기도   ,의치  임플란트
몇달 전 부터 뭐 씹을때 아주 가끔 통증이 오길래 그냥 잘못 씹었겠지 싶어서 넘어갔는데 씹을때마다 한번씩 통증이와서 방금 양치하다 자세히보니 빵,몇달 전 부터 뭐 씹을때 아주 가끔 통증이 오길래 그냥 잘못 씹었겠지 싶어서 넘어갔는데 씹을때마다 한번씩 통증이와서 방금 양치하다 자세히보니 빵꾸가 나있는데 이거 충치인가요    치료비 얼마정도 나오나요  ,충치  치아질환
 사진혐주의  앞니 구멍 질문이요   ,사진은 아래에서 찍은 사진입니다    예전에 뭐 씹다가 이빨 사이가 부러졌던 걸로 기억해요 충치는 아닌거 같은데 확실하지 않습니다   충치가 생기면 보통 저렇게 파고드나요  아직까지 아픈적도 시린적도 한번도 없어요  문제가 될까요      정확한 답변 부탁드립니당    ,충치  치아질환
충치 검사  치과 ,아니 제가 충치가 있어요 근데 제가 오늘 보니깐 충치가 더 심해진거 같은데 대충 검사만 해도 얼마 정도 나오나요   질문     앞니보면 사이에 검은거 있는건 충치인가요       윗앞니에 보면 이빨에 연한 검은색 가로로 보이는건 뭔가요    꼭 답변 부탁드려요       내공    ,충치  치아질환
치아충격으로 치근흡수,일주일전 부분 엑스레이에서는 염증 및 치근흡수 증상없엇습니다 치아가 좀 교정당기기처럼 뻐근한 느낌이 들었고 일주일만에 파노라마엑스레이에서 뿌리가짧아져있습니다  그 일주일간 오한과 발열에 시달렸고 코로나 검사를 했으나 여러번 음성이나왔습니다  전신 오한과 발열이 치근 흡수와 관련있을 수있나요 일주일사이에 치근흡수가 시작될 수있나요    ,충치  치아질환
잇몸 하얗게 부음,매복사랑니가 옆 어금니 뿌리에 닿은 채 썩고 사랑니 발치 후 어금니 뿌리쪽 충치가 계속 퍼졌는데요  치료를 받으려니까 살리지 못 한다고 아직 학생이니까 쓸 수 있을 때까지 쓰라더라고요  통증은  년간 없다가 일주일 엄청 아팠고 다시 멎어서 일단 어영부영 쓰고 있는데 사진처럼 동그랗게 부었더라고요  잇몸은 통증이 없는데 부어있는 게 자꾸 신경쓰여서요  찾아 보니까 염증일 수 있다길래 소염제 먹고 있는데 괜찮을까요  이제     일 정도 됐어요,충치  치아질환
치과치료 이가 시려요,크라운 치료를 했는데 교합 맞추는 도중에 맞닿는 치아 삭제를 조금 하셨습니다 제 맞닿는 치아가 금인레이로 되어있었는데 조정하는 순간 시린느낌이 찌릿하게 들어서 원장님께 알렸고 일주일뒤에도 시려서 그 금인레이를 제거하고 레진으로 층층이 쌓아서 마무리 해주셨습니다 금인레이일때보다는 덜하지만 그 맞닿는이 삭제전 금인레이일때는 전혀 하나도시린증상이 없었는데 레진으로 하고 나서는 그래도 찬물이 닿으면 순간 시린게 확 왔다가 가시는데 원장님께서는 다음치료는 삭제범위가 커져서 크라운으로 가야 한다 하시더라고요 솔직히 억울한 감이 없지 않아 있어서요 건들지만 않았어도 신경도 안쓰고 지나갔을 치아인데  찬물마실때 시린정도면 그냥 지금 해주신 레진으로 지내는게 좋을까요   치아는 건들수록 안 좋아진다 들어서요  ,충치  치아질환
상악동 내 물혹제거 임플란트예정  질문,안녕하세요  임플란트 수술을 앞두고 발치후 뼈차오르길 기다리고 있는데요 발치전 크라운 상태일때 잇몸에 고름  염증이 생겨 한달동안 낫지않아 결국 발치 결정을했는데  그 한달동안 잇몸치료하는데 어느순간되니 뿌리끝  치아 안쪽 깊은곳이 충치처럼 쿡쿡 바늘로 쑤셔서 깜짝 놀랄정도의 간헐적 통증이 있었구요   그래서 발치 후 괜찮아지겠지 했는데 잇몸염증 생기기전까지는 평생 통증이 없었는데  발치후에 평소 서있거나 앉아있을땐 없다  잘때 뒤척이면서 누운채로 고개를 양옆으로 휙휙 돌린다거나 물건집는다고 고개만 숙엿다가 든다던가 할때 물구나무처럼    상악동내에 있는 물혹이 움직이는 것인지 위 내용처럼 쿡쿡 통증이있어요   물혹은 있은지 오래고  그동안 통증없었고 염증은 아니고 그냥 저류낭종  물혹이라고했구요      치과에서 이비인후과를 연계해 약물치료도해봣지만 안됫고  물혹제거 딱히 이비인후과에서는 통증없음 권하진않고 그냥 임플란트해도되는데  통증이있음 제거하는게 좋다   코내시경으로     치과에서는 상악동거상술중 복잡수술로 잇몸측면에서 상악동거상술을 하면서 물혹제거후 뼈이식만 한후 뼈자리잡으면 임플란트 진행하자      또다른 치과에서는 그냥 일반 상악동거상술로 임플란트 심기전 상악동거상술할때 물혹을 가는주사기로 물만 빼내고 크기만 좀 줄여도 통증이 나아질수있으니 그렇게 진행후  뼈이식과 임플란트 바로 가능하다  라고 합니다   번경우 전신마취에 비용도 만만찮구   번경우는 통증도 그렇구 뼈이식후 임플란트까지 대기기간이 또 오래 걸린다고하구요    번이 제 상황상 가장 편한방법이긴하나   질문     제가 알기론 상악동천공 엄청 조심해야 되는것으로 압니다만  주사기로 물혹내 물이든 염증동반이든 빼고 임플란트시 물주머니 자체는 그대로 남게되는것인데 괜찮은건지      가는 주사기로 상악동막을 찔러 빼내는데 이건 천공이라고 볼순없고  이렇게도 수술진행 하기도하는지     물빼고 바로 뼈이식과 임플란트를 진행시 뼈이식 알갱이가 바늘찌른곳으로 역류해 상악동내로 들어가 염증을 생긴다거나  반대로 상악동 물혹의 잔여물이 뼈이식한곳으로 스며들어 임플란트 회복시 염증을 일으키게한다던가등등 하진않을까 걱정이됩니다   어떤게 최선의 방법인지   전문가분께 자문  질문드립니다   답변  조언 부탁드립니다  홍보글은 달지 말아주세요 ,의치  임플란트
교정용 미니 스크류를 식립할 때,치근부에 식립이 되어 느슨하게 식립된 채로 고무줄을 걸고 사용하였다면 효과가 아예 없나요  아니면 효율은 떨어지지만 어느 정도의 효과는 있었을까요 ,치아 유지  관리
크라운치아 흔들림,작은 송곳니가 크라운인데 흔들려요 치과갔는데 흔들림은 있는데 기둥이 부러지거나 한거같지는 않데요 씹을때도 아픔없고 원래 부러지면 씹을때 통증 생긴다는데 치과 쌤은 차라리 쓰다가 기둥만남고 크라운 빠지면 다시 끼고 기둥이 부러지면 발치하고 임플하자는대 이게 답일까요  ,치아 유지  관리
혀가 아픈게 오미크론 때문인가요 ,오미크론에 감염된지  일 정도 후에 혀에 안쪽에 뭐가 나서 아프더라구요  진통제 먹어도 효과 없구요   근데 제가 요즘 양치를 잘 안하고 자서 오른쪽 이에 충치가 생겼었는데 혹시 이에 충치가 생겨서 혀에 뭐가 난 걸까요  오미크론 보다는 충치 영향이 더 클것 같다고 생각해서요  혀가 너무 아파서 며칠째 죽만 먹는 중입니다   혀에 뭐가 난게 오미크론 영향일까요 아니면 충치 영향일까요  그리고 어떻게 하면 빨리 나을 수 있나요 ,충치  치아질환
충치레진치료후,어제하고 오늘 왼쪽 오른쪽 두개씩 어금니에 충치레진치료를 했는데 어제는 오른쪽하고 오늘 왼쪽을 했고 오늘 떡 먹을려고 오른쪽으로 씹었는데 오른쪽 어금니가 너무 아프고 시린데 몇분째 통증도 안멈추고 너무 아픈데 어떻게 해야 되나요   내일 윗쪽 어금니도 치료해야 하는데 그쪽으로도 씹으면 이렇게 될까봐 음식을 못먹겠네요 ,충치  치아질환
제가 투명치아교정장치를 끼는데 주의사항은 어떻게 되나요   부산   대후반 여 교정장치 ,제가 며칠전부터 투명치아교정장치를 끼기 시작했는데 주의사항을 숙지하지는 못하고 있어서요   꼭 지켜야할 숙지사항이 있나요 ,치아 유지  관리
가철식유지장치조절,안녕하세요 저가 교정장치를 제거하고 현제 투명유지장치로 유지하고있습니다 가철식유지장치는 만드는 기간이 있어 그동안엔 투명유지장칠 끼라고 하였습니다 오늘 가철식유지장치 다 만들어져서 받아오라는데 저가 치과랑 거주지가 너무 멀어 택배로 보내달라고 하니 조절해야해서 안된다고 하는데 저의 치아모양을 본을 떠서 가철식유지장치를 만든거 아닌가요  따로 가서 조절을 해야하나요  그냥 택배로 받아서 끼면 안되는건가요    ,치아교정
교정후 앞니 벌어짐,교정끝난지  년지났고 아직까지 가철식유지장치도 잘 착용하고있습니다  근데 어제 저녁에 치킨을 먹고 앞니에 고기가 껴서 치실로 빼고 보니까 앞니사이가 벌어져있더라구요    아침까지멀쩡했었는데   전에 앞니 고정식유지장치가 떨어져서    일뒤에 병원가서 붙였는데 그때도 벌어지지않았던 앞니가 음식물이 껴서 벌어진거 같아요   그리고 송곳니쪽에 유지장치도 어제 저녁에 떨어져서 주말에 병원을 바로 가긴 합니다     이런 경우는 유지장치 잘 착용하고 시간이 며칠 지나면 다시 붙나요   인터넷 찾아보니까 가철식유지장치를 조여서 붙이기도하던데 그런 경우에는 고정식 유지장치를 다 떼고 가철식으로 조인 다음에 고정식유지장치를 다시 붙이나요 아니면 고정식유지장치가 있는 상태에서 가철식유지장치로 조이기만 하나요 ,치아교정
이 교정하고싶어요,이는 가지런한 편이긴한데 위앞니가 약간 벌어진데 너무 싫어서 교정을 꼭하고 싶은데 하면  년 정도 해야하나요 ,치아교정
잇몸이 부었어요,치실을 한후에 잇몸이 갑자기 부었는데 왜 그런건가해서요 살짝 흔들리는 것 같기도하고 어떻게해야할까요 ,잇몸질환
요즘 자고 일어나면 혀가 건조해요 ,혓바닥에 침이 아예 없어 겉이 딱딱한 정도로 건조한데 어떻게 고치죠  이거 때문에 목구멍쪽 까지 아파요 ,잇몸질환
발치 후 처방약 복용시 증량,이틀전에 발치 후 록소진정 오구멘틴정 모사비스정  세개 하루 식후  회   일 처방받고 자기전에 에드빌 하나씩 먹고 잡니다   근데 어제와 오늘 체중이  키로나 증가했어요   약의 성분 때문인지 궁금합니다 ,치아 유지  관리
고 인데 왼쪽 위 송곳니오른쪽에있는영구치가흔들려요,제곧내 전 망한 건가요  고 인데 생치뽑고임플란트해야하나요  정말요  어떡하죠  일단 치과는 토요일에 가기로했는데,충치  치아질환
치아교정 술,교정한 지 이틀 지났는데 술 마실 수 있죠   ,치아교정
입버릴때마다 턱관절이 너무 아픈데요 ,입을 벌릴때마다 턱관절이 너무 아픈데요  소리도 나고    어디가서 어떻게 치료 받아야 되나요 ,의치  임플란트
임플란트 뼈이식,저희 어머니께서 임플란트 하려고 하는데 오른쪽 위 두개 발치하고 상악동 뼈이식 임플란트 진행하고 오른쪽 아래 두개 왼쪽 아래 두개 이렇게 동시에 진행한다고 들었습니다     동시에 진행 가능한가요     그리고 오른쪽 위 상악동 뼈이식은 많이 힘든가요     붓기는 어느정도 부을까요    통증은 많이 심할까요 ,의치  임플란트
교정시 어금니 건드리면 소리,교정한지 일주일 차입니다 현재 상악에만 교정기를 부착한 상태이구요  왼쪽 작은 어금니 부분을 실수로 건드리거나 입술을 오므리려고 힘을 줄 때마다 교정기에 약간 힘이 가면서 어금니에서  똑  이런 소리가 나는데 괜찮은 건가요  소리가 나서 그런지 괜히 아픈것같은 느낌도 들어요  부작용을 너무 많이 찾아봤는지 걱정이 되네요   ,치아교정
 급 부정교합,중 인데요 이갈이 습관이여서 그런지 치아가 개판이네요 이정도면 심각한건가요,치아교정
