0,1,2
치아교정 중 치아 흔들림,딱딱한 걸 잘못 씹었는데 이가 흔들려요 다른 덴 괜찮은데 하나만 그래요 혀로 세게 밀면 진짜 빠질거같아서 무서워요 제가 윗니가 아랫니를 조금 덮는 편인데 아랫니랑 그 흔들리는 치아랑 맞물려서 흔들리는 느낌이 많이 나요 아픈 게 아니고 흔들리는 거 같아요 어떡하죠     ,치아교정
치아교정 파란고무줄 왜 해요 ,윗니에 총  개 꼈어요  반지 땜에 꼈다는데 저 악궁장치도 안하고 윗니에 금니 없고 다 제 치아인데 왜 피란고무줄 한 걸까요     너무 아파요      아파서 진짜 하루에 두 번 씩 빼고  분정도 즐기고 다시 끼고 있어요     ,치아교정
교정 발치 후 식사,제가 교정 때문에 오른쪽 윗니 아랫니  개씩 발치를 했거든요  다음주에 이제 왼쪽도 발치를 하는데 왼쪽 발치하기 전에는 왼쪽으로 아무거나 씹어먹어도 되나요  ,치아교정
치아 교정 고통,안녕하세요 담주에 교정하는 중 입니다   제가 이가 조금 삐뚤빼뚤하고 부모님도 커서 후회안한다고 교정을 합니다   근데 오늘 그 본뜨는거를 했는데 충치는 없고 이는 안 빼도 된다는데 뭐 나사  그런 얘기를 들었습니다   뭐 피가 나나요   너무 두렵고 무섭습니다   얼마나 아프죠  ,치아교정
교정 가격 내공    ,얼마정도 나올까요 윗니에 뻐드렁니 한개 있음,치아교정
치아유지장치,치아교정이후에 지금 앞니가 다시 살짝 나왔는데 치아유지장치만 잘 껴도 앞니가 어느정도 들어가나요 ,치아교정
 급 부정교합 가격,중 인데요 아랫니 튀어나왔고 평소에 이갈이도 심해서 치아가 마모됐고 윗니 중에 한개가 뻐드렁니고 점점 심해지는데요 부모님한테 얘기 하긴 했는데 부모님은 하라고 하시는데 솔직히 말하면 아버지가 경제적으로 어려운 상태에서 걍 안하고 냅두려 하는데 괜찮을 까요,치아교정
치아교정 철사 치위생사,제가 다니는 치과가 원장 명이고 좀 큰데요   원래 철사 바꿀때 치위생사 혼자서 하는건가요  전 교정하면 의사쌤이 해주시는줄 알앗는데    브라켓은 교정과 원장님이 붙여주시긴햇는데 아랫니에 브라켓 위치가 너무 치아 아래쪽에 있어요 ,치아교정
나이트가드  마우스 피스  맞춤시 위 아래 어느쪽을 하는게 좋을까요 ,자고나면 턱관절이 뻐근하고 앞쪽 아래 치아에 약간의 마모가 보여 나이트가드를 하고 싶은데요   위   아래 쪽중에 어느 쪽을 하면 좋을까요 ,치아교정
평택 치아교정기 제거 비용 문의합니다,제가     년 말에 교정기를 달고   년까지 치과에 다니다   년 봄부터 실직을 하고 제주도 부모님댁에 살면서 돈과 거리 문제로 치과를 다니지 않았습니다  교정기를 설치한 상태로 관리를 안하다보니 지금 치아가 많이 망가진 상태인데 재취업을 한 상태라 교정기를 제거하고 치료후에 다시 재 교정하려고 하는데  평택에 치아교정기 제거 비용 저렴한곳 있을까요    제거 비용도 궁금합니다 참고로 위 아래 전체 교정기를 끼고있습니다,치아교정
이빨이 분홍색이됐어요,이빨이 흔들려서 보니까 분홍색이됐어요 좀 낮아보이는건 앞니는 영구치로 새로나서 그런것같고 동그라미된 분홍이빨은 아직 유치에요 지금 흔들리는데 빠질것같이 엄청 많이 흔들리는건 아니고 만지면 흔들리는 정도 이거 안좋은건가요   무서워요 수술해야돼요  해야돼면 많이아파요    살여자예요 겁도많고 엄살도 심해요 사진첨부요 그리고 옆에 구멍처럼 보이는건 그냥 썩은거고 앞니교정할거니까 교정해라 이런말 하지마세요,치아교정
치과교정후,교정을했었는데 일년정도하고 병원이사라져 그후 일년더있다가 못참고 집에서 교정기 손으로다뜯어냈습니다 근데 치아표면에 투명접착제  그게아무리긁어도 안떨어지고 치아표면 몇개에 붙어있어요  제가 치아미백을할생각인데 이거먼저 접착제 처리해야할것같아서요 치과가면 이거때주 나요  어떤방식으로 없에주나요 갈아서 아님녹혀서 ,치아교정
치아 교정 미니스크류 식립,고  학생입니다 오늘 치아교정 하러가는데 미니스크류 네개 심기로 했습니다 마취하고 진행하는걸로 아는데 마취는 몇방놓나요  미니스크류 한개당 한방씩 놓나요 ,치아교정
악궁확장장치를 위에 철로된걸 꼈는데 초콜릿이나 사탕을 못먹나요 ,제목 그대로,치아교정
하품 턱 목 치아,  제가 하품을 많이해서그런지 턱을 자주 벌립니다 그래서그런지 입을 벌리면 뚜둑소리가 납니다 가끔씩 아프고요  병원에 간다면 어디병원으로 가야할까요      제가 발음이 조금씩 불안해지는데  번과 상관이 있나요  아니면 치아 사랑니를 빼서 그런가요 ,치아교정
교정언제해야되나요 ,지금 초등 학년 남자아이예요 앞니가 한개가 계속안나와서 나올공간이 점점작아지더니 사진처럼 저렇게 공간이 좁아요 앞니가 안나와 잇몸절개했더니 저렇게 나오네요  나중에 앞니도 영구치도 다나오면 교정하라는데 교정은 언제쯤 해야하나요  지금 다니는치과에선 앞니자리공간확보를 위해 벌려주는교정을 해야된다는데 해야되는게 맞나요  아님 그냥 이 다나면 교정만 할까요  걱정이네요  답 변좀주세요 ,치아교정
치아 중심선 안맞음,현재 치아 교정  년차인데 사진처럼 아랫니는 인중하고 잘 맞는데 윗니가 틀어져 있어요 아랫니가 중심선에 안맞으면 턱에 문제가 있을텐데 윗니가 중심선에 안맞아서 뭐가 문젠지 모르겠어요,치아교정
치아교정 착색,치아교정했는데 치아가 잘 닦이지 않아 치아가 표백되어서 나중에 심해지면 구멍이 생긴다고해요 또 나중에 장치를 제거했을때 치아가 얼룩덜룩해보인다고 하는데 지금부터라도 깨끗하게 닦으면 표백된게 없어질까요   ,치아교정
잇몸 내려감,안녕하세요 중  여자이구요 유치원 때부터 조금씩 잇몸이 내려가기 시작했는데 요즘에는 진짜 보니깐 심각해서요    제가 교정을 할 생각인데 아마 교정하면 잇몸이 더 내려가겠죠    잇몸 이식 수술이 있다고 들었는데 비용이 얼마나 되는지 알려주세요,잇몸질환
치과 신경치료 후,크라운과 레진기둥은 다른건거요 ,충치  치아질환
사랑니 당겨 쓸 수 있을까요 ,  년생이고 남자입니다     번 어금니가 상태가 좋지 않아  발치 후 사랑니 당겨오는 교정을 하고 싶은데요       공간이 꽤 넓어 보이는데 당겨 올 수 있는지 궁금합니다      다른 치아에 브라켓 걸지 않고 사이드에 나사  미니스큐만 박아서 당길 수 있나요  이미 기존 치아가 교합이 완벽하게 브라켓 걸면 작용 반작용 부표 효과 때문에 기존 치아 교합이 틀어진다고 들었습니다  사랑니가 완벽하게 자리 잡지 않아도 괜찮고 그냥 저작력만 보유하면 됩니다  가능할까요 ,치아교정
치과 임플란트 임플란트 틀니 관련,아버지께서 치아가 엄청나게 안 좋습니다   아무튼          치과를 가지 않아 상태도 사실 잘 알 수 없습니다   몇년만에 만난거라    다만 궁금한 것은  무치악 상태로 갈 시  당장은 비용이 없기에 임플란트 틀니로 할 생각입니다   하지만 언제든 돈이 생긴다면 모든 이빨을 임플란트로 해드리고 싶습니다   궁금한 건 임플란트 틀니를 사용하다가 모든 이빨을 임플란트로 바꿀 수 있는지 궁금합니다   그리고 알콜 중독자시라 알콜 담배 등을 하시는데 치료를 잘 할 수 있을지도 궁금합니다  치료기간에 끊어야 겠죠     ,의치  임플란트
크라운 느낌 질문이요 ,어금니 오른쪽위 맨끝  이맥스크라운  금크라운  뭐가더느낌이 좋을까요   자연치아느낌으로요,의치  임플란트
교정 질문이옹,제가 음 살짝 주걱턱인데요 주곡턱에다가 이 두개가 살짝 튀어나와잇어서 앞니 하나 윗니 하나를 아랫니가 덮어요 그리고 맞물리는게 아래가 튀어나와있어서 살짝 부정교합 같은데 저 두개 이 말고는 정상 치아 처럼 덮여 있는 상태에요 대체 뭘까요 부정교합이 맞는걸까요   ,치아교정
제가 지금   살이고 평소에 입으로 숨을 쉬는데,그거 때문에 돌출입이 되고  턱이 길어졌는데  교정하는법 없을까요  아직 만   세도 안됬는데    제가 봤을때는 알레르기비염이 있어서 그런거 같은데   입으로 호흡하는걸 교정하는 법이 있나요  턱 길어진거랑 돌출입을 교정할수 있나요 ,치아교정
맹장염 수술후 흡연,언제부터 되나요    복강경으로 했는데  일차입니다,의치  임플란트
교정후 유지장치,안녕하세요 교정한지   년이 지났습니다  의사선생님께서는 유지장치를 매일밤에 끼라고 하시지만 자주 깜빡하고 또 귀찮아서 실제로는 한달에 한번정도 끼는데 매일 안끼다보니까 낄때마다 다음날 이빨이 너무 아프네요   이렇게 한달에 한번만 끼면 유지되기보다는 그냥 아프다 말거같은데 매일끼지 못할거면 아예 안끼는게 나을까요   ,치아교정
교정관련 질문,제 이빨이 덧니 쪽니가 있어서 자리가 없어서 튀어나온 그런 상태고 윗니가 부정교합으로 튀어나와서 들린다는데 아랫니는 정갈하고요 이런 경우는 어떤 방식의 교정을 하고 기간은 얼마 정도 걸릴까요  그리고 고등학생일때 하는것과 성인된후에 하는 교정은 별 차이가 없을까요  성장은 거의 끝난거같아서 그리고 제가 약간 돌출입  아랫턱을 넣고 싶은데 제 이빨 구조상 교정을 하면 그부분도 하는지 궁금해요,치아교정
돌출입 무턱 수술 후,안녕하세요   수술  일차인데 수술전에는 윗니가 튀어나와 아랫니를 가렸었는데 수술 후에는 반대교합으로 윗니가 들어가고 아랫니가 나와서   발음이 엄청 새고 음식을 전혀 씹을 수 가 없어요   수술이 잘 못 된건가요 아니면 붓기때문에 그런걸까여    직업이 말을 많이해야하는 직업인데 발음이 전혀 안되서 걱정입니다    처음 옆 모습 사진이 수술전이고 두번째가 수술 후 반대교합 된 사진입니다 제발 도와주세여  광고 홍보 사절,치아교정
돌출입 인중,돌출입때문에 인중이 올라가 있어서 너무 인중이 뚜렷해서 길어져도 되니까 인중 좀 어떻게 안될까요  ,치아교정
구외교정장치,지금 제가 부정교합이라 구외교정장치를 하고있는데요 원래 이걸 하면 윗니가 나오는게 맞나요   자꾸 나와서 옆모습으로 보면 입술이 튀어나와보여서요   ,치아교정
치아 교정,제가 치아교정을 한지  개월 조금 넘었는데요  원래는 이빨을 가지런히 정리하는 정도만 했었는데 어제부터 본격적으로 이빨를 들어가게 하는 과정을 시작했어요  근데 고무줄을 밤에 잘때만 끼면 되는지 아님 아침에도 껴야 되는지를 모르겠어요   원래는 밤에 잘때만 끼면 됬는데 답변 부탁드려요,치아교정
교정 임플란트, 월  일날 치과 예약을 했는데 아마 이날이 교정 마지막 일 것같은데 끝에서 두번째 왼쪽 어금니 하나가 없어서 교정하면서 이부분은 스프링으로  하고 아무튼 임플란트를 해야 하는데    월까진 제가 거지 확정이라서      교정기 빼고    달 뒤에 임플란트를 해야 할 것같은데 교정기를 빼면 치아가 다시 이동 할 수 있다던데 혹시 문제가 될까요   ,의치  임플란트
어금니 임플란트 가격,어제 어금니 발치를 했는데요  개월 후에 임플란트를 할수 있다고 하네요 임플란트 가격은 얼마정도인지 알고 싶어요 나이가   세라 건강보험 적용은 안되나요 ,의치  임플란트
어금니 임플란트했는데 치아모양이 이상해요 ,낮에 임플란트 끼우고 왔고 화요일에 마지막단계로 위에 구멍 나있는거 메꾸기로 했어요 시술후 거울도 안보고 나왔다  저녁때 보니 임플란트가 안쪽으로 많이 들어가 있어요 나사 심었을때 안쪽으로 들어와 있다고 말하니 정상이라고 했는데 임플란트가 양쪽옆 치아랑 나란히 있지를 않고 잇몸에 닿는 부분이 살짝 오목하고 치아모양이 살이 없다고 해야될지  높이도 짧고 이상하네요 양쪽 치아랑 나란히 있지를 않아요  검색해보니 임플란트 한거 티도 안 나던데 저는 왜 이렇게 됐을까요 ,의치  임플란트
신경치료 염증,제가 잇몸에 염증이 있어서 부어있고 얼굴도 부었었는데 신경치료를하니까 더붓고 심지어 잇몸은 부어서 이빨을 가릴정도로 잇몸이 붓더라고요 근데 약먹어서 그렇게 아프진 않은데 문제있는 걸까요     걱정돼용  ,잇몸질환
잇몸 부음,표시한곳에 잇몸이 부었어요   갑자기 붓고 통증도 있어요 굳이 병원 안가도 괜찮을까요   빠른 답장원해요  그냥 병원만 가라하지말고 무엇인지 대충 알려주세요  ,잇몸질환
중학생 치아 교정,중 인데요 저는 주걱턱만 있는줄 알았는데 보니까 치아 정중선도 안 맞더라고요 아마 이갈이 할 때 그런거 같은데 아랫니를 오른쪽 왼쪽으로 옮길 수 있는데 맞춰보니까 코가 휘더라고요 이러면 어떡하죠,치아교정
치과에대한질문,애들 아빠가 틀니도하구 임플란트도햇는데요 자기가 알기론 계란이 안좋다구해서 안 먹을라구 합니다 이것이 맞는 말인가요  답변 부탁합니다,의치  임플란트
이거    충치에요 ,레진했던 곳이에요    좀 깊어서 레진으로 메웠던 곳인데    저렇게 된거면 충치인가요    지금 먹는데는 지장이 없거든요    다음주에 치과 갈 생각인데    충치에요 ,충치  치아질환
신경치료 재치료 필요한지, 년 전쯤 오른쪽 윗니 제일 안쪽에서 두번째 치아를 신경치료 했습니다  금니를 씌웠습니다  작년부터 그 치아가 간헐적으로 차가운거 먹을 때 시리다거나 고름 주머니가 생긴다거나 잇몸이 붓는 등의 증상이 나타났습니다  현재는 신경치료한 치과가 아닌 다른 곳을 다니는데 그곳에서 딱히 문제는 없어보이니 재치료는 하지 않는게 좋고 나중에 차라리 발치를 하는게 낫다고 하더라구요  그러다 지난주에 제일 안쪽 치아 충치치료를 했는데 치료하면서 치아가 시리더니 이후부터 신경치료한 치아에 또 고름주머니가 생기고 시리고 씹는데 불편함이 느껴지더라구요  이런 경우에 재치료를 해야하는 걸까요 ,충치  치아질환
크라운 충치 치료 기둥,  대이고 제 충치인데 신경치료 후 꼭 기둥을 해야하나요  알아보니 기둥이 발치 전 마지막 살리는 거라고 해서 두려운데 꼭 기둥을 해야할까요     위에 레진 제거후 충치치료 제거하면 별로 안 남아서 기둥을 해야하는걸까요    아님 다른치과가면 기둥은 안할까요    근데 의사쌤이 치위생사께는 엔도까진 안 갈 것 같은데 일단 치료해보신다하셨는데 상담 실장님께서는 신경치료랑 기둥 해야한다고 말씀하셨거든요  그래서 치료 동의도 했는데 나중에 알고보니 엔도라는 단어가 신경치료였더라고요   다시 전화해서 의사쌤이 그렇게 말씀하셨다고 여쭤봐야할까요    이것때문에 잠도 못자고 계속 생각나요  ,충치  치아질환
인레이 제거,인레이가 보기 싫은데 제거는 안 되겠죠    금이라서 더 잘 보이고 괜히 신경 쓰입니다 나이도 어린데 그냥 했다는 게 화만 나네요     평생 달고 살아야 되나요 ,의치  임플란트
임플란트 식립 후 술먹어도 되는지 빠른답변채택,왼쪽 어금니  개 식립하고 실밥 뺀상태이고  주동안 술안먹었는데 내일 한잔 거하게 해도 되나요   뼈이식도 했습니다   혹시 된다고 해도 임플 실패하거나  염증생기는거 아니죠 ,의치  임플란트
임플란트 픽스처와 어버트먼트 회사가 다를경우,안녕하세요  이번에 임플란트를 하게되었어요  치과에는 메가젠  오스템 이렇게  종류가있다고했고  제일 대중적인 오스템으로 결정했습니다  가격차이가   만원정도있었구요   지난주에 픽스처를 심고나서 인증서를 주셨어요  픽스처는 오스템인데  어버트먼트를 보니까 메가젠 제품이더라구요  이렇게되면 오스템 메가젠이 된거잖아요     대부분의 치과들이 이렇게 픽스처와 어버트먼트를 다른회사제품으로하나요  오스템에서 픽스처와 어버트먼트를 셋트로 만들어서 제공하는게아닌가요   오스템으로만 믿고있는데   물론 문제가없으니 치과에서도 이렇게 진행하겠지만  이렇게 픽스처와 어버트먼트가 다르다는 설명은 전혀 못들어서 좀   이상합니다  임플란트에 큰 문제가 발생할거란 생각은하지않지만   혹시모르는일이 있을수도있으니까요   임플란트해보신분들의 경험이나 치과의사선생님들 답변부탁드립니다 ,의치  임플란트
크라운 느낌 질문이요 ,어금니 오른쪽위 맨끝  이맥스크라운  금크라운  뭐가더느낌이 좋을까요   자연치아느낌으로요,의치  임플란트
제발 빠른 답변 부탁드립니다  어금니 발치 후 임플란트한지  시간 지났어요  내공   , 시간 전 즈음 어금니  개 발치 후에 임플란트 식립 했습니다  수술  도중에도 피가 많이 안 난다고 말씀 해주셨었는데 그 후 다 끝나고 따로 거즈를 물고 귀가하지 않았습니다  발치 후기 글을 보니까 단 한분도 거즈를 물지 않은 분이 없으셨는데 피가 많이 안 날 경우 거즈를 물지 않기도 하나요  뒤 늦게 깨닫고 전화드렸더니 문이 닫은 상황이었어요  제가 보기에는 피가 많이 나지 않았고 삼킬만 해서 계속 삼키다 마취 풀리고 거울을 보는데 이런 식으로 튀어나와 있는게 보여요  혀로 건들지 말라고 말씀하셔서 건들지 않았는데 괜찮은 걸까요  아 그리고 입천장  혀 밑  목구멍 까지 엄청난 통증이 있어요    너무 입을 크게 오래 벌려서 그런 걸까요 ,의치  임플란트
임플란트 뿌리 후 통증,아빠가 지금 임플란트 뿌리 심은지  일이 지났는데 안아무니까 의사가 말도 하지말라고하는데 너무 아파합니다  원래 이렇게 피도 안멈추고 말도 하면 안되나요 ,의치  임플란트
임플란트 수술하고 실밥 해놓고    일째 되는날 인대요     일날 오라는대 부드러운 음식은 뭘 먹으면,임플란트 수술하고 실밥 해놓고    일째 되는날 인대요     일날 오라는대   부드러운 음식은 뭘 먹으면 좋을까요    냉면 실수로 너무 맵게 먹어서 치아가 아프긴 했는대 약 꾸준히 먹고 있어서 안아프긴 하네요   우유도 매일 먹고는 있습니다   차가운거 먹으면 좋다고 해서  잘 먹고는 있습니다     알려주시면 감사합니다  ,의치  임플란트
교정 후 크라운 브릿지 치료 질문,안녕하세요 조만간 교정이 완료가 되는데 교정 후에 교합때문에 몇몇 크라운 브릿지 씌웠던걸 다시 손봐야한다더라구요 궁금한게 두가지입니다     일반적인 크라운 해놨던 치아는 그대로 크라운 교체만 하면 될까요      브릿지 해놨던 치아는  개를 연결해놨었는데       이런식 이었던게 교정한다고   없음   이렇게 잘라놨다가 교정이되면서 치아가  개 있던 공간이  개반     개  정도로 좁아졌는데 이럴땐 브릿지를 다시 만드나요 아니면 양옆 치아를 크라운으로 만드나요   교정과 선생님은 사랑니로 어금니를 대체할거라 사랑니 어금니를 아래로 좀 당기면서 공간이 더 좁아져서 새로 만드는 치아 크라운or브릿지 를 조금 크게 만들면 교합에 이상이없을거라고 했어요  병원가서 상담받을거긴한데 대충이라도 알고가고싶어서 질문합니다      아 그리고 보통 어떤 재료가 튼튼하고 오래갈까요  어금니쪽이라 보이는건 그다지 개의치않아서 튼튼한 재료로 하고싶은데 추천부탁드립니다 ,의치  임플란트
임플란트   개를 식립해야 하는데 문제가 생길까요 ,  살 남자입니다 태어날때부터 영구치가 많이 없이 자라서 유치가 현재 많습니다 그래서 현재 임플란트  개를 식립했고 추가로 유치 개를 뽑고 임플라늩  개를 더식립해야 합니다  아직 나이가 젊고 그런데 임플란트를 이렇게 다수 식립하면 문제가 생길까요 ,의치  임플란트
치과에서 신경치료 해야한다고 하던데 일반 충치치료랑 다른가요   부산 서면   대중반 여 신경치료  충치치료 ,어릴때부터 충치가 잘 생겨서  치아 여러군데를 때웠거든요   최근에 어금니쪽이 욱신거려서 치과에 갔더니  신경치료를 해야겠다고 하시더라고요   일반 충치치료랑 신경치료랑 많이 다른가요   치과는 많이 다녔지만 신경치료는 처음이라서 떨리네요 ,의치  임플란트
돌출입 교정,돌출입 인간요  ,치아교정
임플란트 후 치아 유지장치, 일 전에 임플란트를 했는데 유지장치를 끼면 수술한 부위 바깥쪽에 있는 잇몸을 살짝 누르는데 그냥 껴도 될까요  ,의치  임플란트
세라믹 유통기한,금이랑 세라믹크라운 치료했는데 이거 유통기한 얼마나가나요   평생 쓸 수도 있나요  ,의치  임플란트
잇몸 봉합 실,제가 송곳니에 임플란트를 했는데 내일모레    일날  봉합된 실을 풀러 가는데 치아 부분 말고 잇몸 부분에도 봉합 한 실이 있었는데 이게 풀려서 제가 그냥 뺐거든요  근데 잇몸상태는 약간 흉터  같은 패인자국처럼 쫌 파였지만 피는 안나오는데 이게 잘 아물까요  ,의치  임플란트
돌출입무턱 수술 후 이빨,돌출입 무턱 수술  일차 입니다 수술 전에는 윗니가 아랫니보다 좀 더 튀어나왔었는데 수술후에는 반대교합으로 아랫니가 앞으로 훨씬 튀어나와서 발음도 안되고 음식을 씹을 수 가 없어서 좀 그렇네여   수술이 잘못 된건가요 아니면 턱 붓기때문에 그럴까요  ,치아교정
