0,1,2
뒷목 뼈소리 모래소리,전에 고개 좌우로 돌리기 시작할때부터 뒷목에서 뼈 움직이는 소리가 들려서 수시로 소리 나나 안나나 확인했었는데 이젠 뼈소리가 덜나고 갑자기 모래 스륵스륵 소리로 바뀌었는데 이거 왜 이런 건가요   정형외과에서는 일자목이 좀 있긴 하다고 했는데 목디스크는 아니라고 하셨는데 넘 비싸더라구요      목 뼈도 턱관절 디스크 갈리는 것마냥 모래 갈리는 소리가 나나요 ,운동치료
체중 증가 질문입니다,안녕하세요 마른당뇨를  개월째 앓고있는 남성인데요     보통      kg 체중 증가한거로는 전체적으로 살이 찐게 티나지도 않고 배가 나왔어도 전혀 티나지않고 소화가 되면 다시 들어가고 그러나요  분명      kg정도 쪘는데 배가 크게 나온거같지도 않고 막상 먹은게 소화되면  kg늘어나기전처럼 배가 쏙 들어가서 달라진게 없어보여서요      보통 전체적으로 허벅지든 팔이든 배도 나온게 티가 날정도로면 최소한 몇kg정도는 체중을 늘려야 하나요      제가 현재 당뇨를 앓고서부터 식단관리랑 헬스도 잘다니다  년 넘게 그만두고 맨몸운동이나 걷기운동만 해서 그런지는 몰라도      kg가량이 빠지고 간신히 지금 겨우  kg를 늘리긴했는데   마른체질이나 마른당뇨같은 경우는 잘찌는 체질과 달리 헬스를 병행하지않는한 끼니나 자주먹는 습관을 조금씩 해준다한들 체중만 조금 늘어서 배만 조금 나오다 말고 전체적으로 팔이나 허벅지가 커지긴 힘든가요      빠른답변부탁드립니다   ,운동치료
등 통증 과 가슴통증이 있습니다  어디라도 특정하기는 어려운데 왼쪽쯤으로 해서 가슴까지 이어지구요 브라 끈 선상에서 아파요  쥐어짜듯이 끊어질듯,등 통증 과 가슴통증이 있습니다  어디라도 특정하기는 어려운데 왼쪽쯤으로 해서 가슴까지 이어지구요 브라 끈 선상에서 아파요  쥐어짜듯이 끊어질듯이 아픈데 어떤병원을 가야하나요  조금만 움직여도 아파서 숨쉴때도 왼쪽갈비뼈부터 등까지 통증이 심합니다,운동치료
손목  손가락  손등에 통증이 있습니다 ,손에 파스랑  손목 손 보호대 착용중인 사진이라 죄송합니다  일하다가 물어보려고 그냥 찍었습니다   빨간원쪽이 통증이 있는 쪽이고 통증은 아래와 같이 찾아오고 있습니다  손목은 항시적으로 욱신 거리고요  엄지손가락 아래부분과 새끼손가락 아래부분은 손등 손바닥쪽 다 붓고 컴퓨터 작업이나 다른 잡업무를 하다 보면 쿡쿡 쑤십니다  손가락 검지랑 넷째 손가락 쪽도 일하다 보면 쿡쿡 쑤시는 통증이 옵니다   반대쪽 손도 같은 상황입니다     개월 전에 양손 손목 터널 증후군 수술 받았고요  아침에 손 저림은 많이 사라졌는데 다르게 아프고 있습니다  약은 수술 이후로 관절약  소염진통제 등의 약을 쭉 복용중인데 효과가 있는지 의문입니다    병원에서는 수술이 문제가 아니라는 말만 하는데 뭐가 문제일까요 ,운동치료
허리와 다리가아파요,도움 부탁드립니다  몇년전부터 허리가 쑤시가 무릎쪽이 조금 열이나고 쑤시는 증상이 있었습니다  많이 불편하지 않아서 그냥 넘겼는데 최근에는 허리의 불편보다는 골반쪽부터 발까지 엄청나게 쑤시고 잠을 자기힘든정도입니다  무릎에서는 열이 느껴지고 종아리는 손으로 주물러줘야만 지원함이 느껴지고 왼쪽종아리는 머라고할까 감각이 없다고할까 꼭 남의 살같습니다 발가락은 종종 바늘로 찌르는듯한 느낌이 있구요   평소 서있거나 걸을때는 통증이 전혀없습니다  그냥 좀 무거운느낌 그런데 누워있으면 통증이 느껴지고 오른쪽발은 양반다리가 되지않습니다  예를들어서 밥상에서 밥을 먹는다면 왼발은 양반다리가 되지만 오르발은 펴놓고 있는데 근육이 땡기면 오른발은 무릎을 굽혀 자세를 바꿔주고를 반복합니다   잠을 자지못할정도로 통증이 심해서 병원에 가서 엑스레이를 찍었는데 무릎을 포함한 하체에 전혀 이상이 없다는겁니다  신경이 좀 놀랐을수있다가 주사한대맞고 물리치효 한번해주고 끝났습니다  이럴경우 어떻게 대처를 해야할지 조언좀 부탁드립니다 ,운동치료
이두박근 부위 통증, 달전 단시간에 가구 등 무거운 물건을 옮기느라 우측팔을 무리하게 쓴 후 이두박근 통증이 심해서 약    주 조심을 해서 많이 나아졌습니다  그런데 또 무거운 물건을 옮기면서 우측팔 이두박근 부위에 심한 통증을 느꼈는데  그후로 조금만 힘을 쓰도 통증이 있습니다  당시 심할 때는 과도로 과일을 깎는데도 통증을 느낄 정도 입니다  지금 한달 이상이 지났는데도 조금만 힘을 써도 이두박근 부위에 통증이 있어서 생활이 불편해서 의도적으로 오른팔 대신 왼팔을 쓰고 있습니다  전제적으로 팔을 쓰는데는 이상이 없기 때문에  스스로 생각하기에  인대나 근육 파열이라고 판단되지 않아 그냥 쉬면 나아질 거라 생각하였는데 다음주에 병원 진료를 빋아보려하는데 어느과 진료를 받는 것이 좋을까요  지금 오른손 중지로 글을 쓰는데도 이두박근 팔목 가까운 쪽 에 약한 통증과 불쾌한 기분이 있습니다  좋은 자가치료 방법이 있으면 조언 바랍니다 ,운동치료
허리가 삐어서 못움직일때,제가 이틀전에 머리를 숙여서 감다가 신경인지 뭔지 바짝서는듯한 아니면 약간 끊어지는 것같은 느낌으로통증이 있었고 그 후로 숙이질 못했습니다 잘 양말 신을 때 불편하고 속옷 갈아입을때 불편한 수준이얐는데 어제 침이랑 물리치료 받고 제가 사실 오늘 운동을 갔습니다 안일한 생각으로 운동을 하다가 허리가 정말 강하게 놀래는 것같은 느낌으로 오늘 병원가서 신경주사 맞고 허리 손대면서 집에 왔는데 지금 화장실 가려는데 일어나지도 돌아눕지도 잘 못겠습니다 이거 심각한건가요 엑스레이 상으로눈 문제없다고하겼고 엠알아이 찍어봐야 자세히 나온다 했습니다,운동치료
라운드 숄더 인가요 ,라운드 숄더 인가여 ,운동치료
양 팔이 당기고 가슴 부분이 통증이 있습니다 ,가슴 부분에 통증이 있은지는  년 정도 된 것 같습니다  처음에는 미미한 통증이었으나 최근에는 오른쪽 가슴이 시리고 찌르는 듯한 느낌이 계속 듭니다  또한 불규칙적으로 양 팔의 근육이 조이는 듯한 느낌이 들고 통증이 있습니다  다리 또한 종아리 부분에 무언가 누르는 듯한 통증이 있고 뒤쪽이 약하게 부어올라옵니다  무언가 불안하지만 여러 유튜브 영상을 봐도 확답이 서지 않아  이렇게 질문을 드려봅니다 ,운동치료
정강이가 아파여  내공     ,자다가 어디 부딪힌건지 너무아파서  정형외과 가서 엑스레이 찍어봣는데 뼈는 아무이상이 없대여  그래서 그냥 진통제만 받아왓는데  피가 쏠리면 못걸을정도로 너무 아파요   ,운동치료
등 어깨 명치등 상체가아파요  ,안녕하세요 중 남학생입니다  몇일전부터 갑자기 등이집중적으로 아프면서 어깨 명치통증도 나타나요   가끔은 상체에 찌릿한느낌도 들고요   계속검색해봤는데 원인을 잘모르겠어요    혹시나 큰병은아닌가 걱정은되는데 갑자기 추워져서 근육통인걸까요  유독등이 집중적으로아프고 오른쪽이 왼쪽보다아파요  갈비뼈부분통증도있고요  제발 무엇때문인지 좀 알려주세요    원래 자세가 평상시에안좋긴했고 몇일동안 연휴라 집에서 스마트폰만봐서 그런지   좀 알려주세요   부탁드립니다 ,운동치료
발가락 마비  채택은 보는대로 해드릴게요,아니 제가 몇시간전 부터 발가락이 조금 꼬이더라 고요 한   분   분 정도 되다가 괜찮아 져서 쉬고 있는데 갑자기 새끼 발가락이 잘안 움직 입니다   오른쪽 발만 그렇고 왼쪽발은 안그래요 그리고 왼쪽으로 만 잘 안움직여요 헷갈려서 질문남깁니다 인터넷을 뒤져보니 뇌졸중증상 이라는데 뇌졸중 전조 인가요  급합니다 채택은 답변 보는대로 하겠습니다 이상하거나 욕하는 답변은 가챠 없이 삭제 하겠습니다 이상하고 부실한 답변말고 성의 있게 답변해 주세요 대부분 의학 에 대해 빠삭히 알고 계신 분이나 전문가 분들이 해주셨으면 좋겠습니다 참고로 앞쪽 오른쪽 뒤쪽은 잘움직여요  뇌졸중 전조 증상인가요  심각한 병인가요  자면 해결 되나요  별거아닌가요 ,운동치료
린매스업 방향 질문드립니다,  세남성       kg 배만나온타입 기초대사량             일pt  회 시작하여 어제 끝났습니다 근육은조금씩 붙고있으나 체지방이왜이리안빠지죠      평생을 거의운동을안하고 복부비만을 간직한채살았습니다 그래서 더더욱 느린건지    웨이트      분  유산소 인터벌러닝  분  식단은  아침 현미밥   g 닭가슴살       g   견과다섯개   시  분  점심 동일   시  분  저녁 동일   시  분  운동 후   시 프로틴 네스푼 단백  g  닭가슴살   g 삶계  알  영양제 테아닌 밀크씨슬 종합비타민멀티미네랄 레모나 프로바이오틱스 칼슘보충제  팩 하루야채 매일  병  검은콩두유  팩 중입니다  왜이리 뱃살감량이더딜까요   식단이나 운동을 바꿔야하나요 ,운동치료
플웨이트 어깨,풀웨이트 자주하면 어깨 넓어지나요   풀웨이트 효과는 뭐가 있나요  ,운동치료
안녕하세요  운동  년차 헬린이입니다  근합성을 위한 필수 영양제 추천해주세요  ,운동 시작하기전엔 몸무게가    KG   근육량    KG 였나 그쯤 나왔던거같은데    꾸준히  시간  시간   분씩 웨이트 하다보니 어느 순간 이렇게 많이 불렸네요    지금           근윤량    KG 정도 나오는데  지금 저기서 정체기입니다     피티받기엔 너무나 금전적인 부담도 들고    제가 현재 운동하면서 챙겨먹는 것들이  오메가  L 아르기닌 BCAA 프로틴 보충제  이렇게 섭취중입니다   저기서 추가로 저는 근비대가 목적이기때문에      KG 까지는 불리고싶은데  정말 근비대에 어느정도 도움이 되는 그런 영양식품  그런 약이 있나요    스테로이드는 당연히 안되고    뭐 운동강도를 올려랴 이런거 말구요     그냥 영양제가 다른사람들에 비해 많이 안먹는거같아서 여쭙숩니다   꼭 질문과 상관없어도 되니 따로 추천해줄만게 있으면 해주세요  피드백도 좋구요      광고는 사절하겠습니다  ,운동치료
러닝 심박수 고민,  대 초반 여성입니다 러닝시 평균 심박수가 아래와 같은데 정상인가요   페이스 상관 없이 뛰기만 하면 평균 심박수는    이고 최대 심박수는      올라갑니다 안정적이지 않아서 오버페이스로 뛰나 싶어 페이스를 늦추어도 동일합니다 페이스는  분대이며  분이던  분이던 심박수는 같습니다  러닝 완료    분 후에는     까지 내려가는거 보면 회복은 빠른 거 같은데 뛸 때는 안정적이지 못해서 고민과 걱정도 있습니다  제 나이에 저 심박수면 거의 최대 심박수인 거 같은데 그러면 심장에 무리가 많이 간다고 들었습니다  어떻게 해야 안정적일까요 ,운동치료
광배는 허리쪽까지 붙어있다고,광배는 허리끝쪽까지 붙어있는걸로 아는데 광배가 짧은 사람들은 왜그런건가요 ,운동치료
집에서 인바디를 쟀는데 평가해주십쇼 ,  대 초반  키      체중     골격근량       체지방률      내장지방  kg 나왔습니다  표준이 얼만지 잘 몰라서 그러는데 어디가 표준이고 표준 이한지 이상인지 알려주세요 ,운동치료
제자리 멀리뛰기 하다가 미끄러져서 엉덩방아 세게 찧었어요  ,제목 그대로 완전 세게 찧어서 찍소리 못내고 몇분간 일어나질 못했어요       그것도 아스팔트 바닥에서요    멍 들거 알도 아픈거 참을 수 있는데 내일이 제자리 멀리뛰기 수행평가 예요   팝스에 들어가는거라 잘하고 싶어요  오늘 학교에서 뛰어봤다가 최대  M나와서 기뻤는데   멍들고 아픈것 때문에 뛸 때 지장 있을까요  이 악물고 뛰면 될까요       통증 완화로 얼음찜질 말고도 뭐 있나요,운동치료
운동 휴식중량,  살이고 슬럼프때문에 운동을  달 정도 아예 안하고 어제  대 측정을 했는데 스쿼트    에서     벤치프레스    에서       데드리프트    에서      로 증량 했는데 이게 가능한가요  예전에 트레이너가 제 나이에는 운동을 오랬동안 안해도 신체 자체가 아직 덜 성장해서 운동을 안해도 강해진다는데 이게 실제로 되는군요 체중도    kg밖에안쪗는데  가능한건가요 ,운동치료
호신술 배워보고 싶어요 ,체력도 기를 겸해서 호신술에 관심이 생겼는데요   어디서 배워 볼 수 있을까요   그리고 가서 구체적으로 뭘 어떻게 배우나요   초보여도 괜찮겠죠 ,운동치료
풀업 근육통   체형 분석,  풀업후 제가 파스 붙여논 위치를 누르면 기분좋은 통증이 있습니다  어디 부위고 뭐가 문젠가요     앉아있을때 날개뼈가 보이면 익상견갑인지     왼쪽 승모근이 더 길고 어깨가 더 높은거 같은데 체형 분석좀 해주세요  내공    ,운동치료
헬스 머신 이름 좀 찾아주세요    급듭,어드밴스꺼고 거꾸리 처럼 생긴건데 행잉레그레이즈를 할 수 있는   그냥 행잉레그레이즈랑 다른점은 약간 반자동차럼  발 둘곳이 있는 복근 운동 머신이에여,운동치료
조금만 걸어도 다리가 너무아파요,한두블록  되는 거리만 가도 다리가 너무 아파요 근데 막상 숨은 하나도 안차는데 다리만 아프고      발목 바로 웟쪽에 바깥쪽이 너무 아파서요 요즘 몇주들어서 갑자기 아프네요 그전까진 멀쩡했는데      전보다 운동량이 줄지도 않았는데    왜그럴까요   몸무게가 좀 많이나가기는 해요    에    넘는정도,운동치료
정강이뼈 밑 근육,사진 속 손으로 누르고 있는 부분있잖아요  거기가 정강이 뼈 바로 밑에 인 거 같은데 예전부터 아파왔어요  요즘 줄넘기를 매우 많이 하고 뛰는 운동을 좀 하면 아퍼요  뭔가 튀어나온 거 같기도 하고 그 부분 일직선으로 그렇게 아픈 거 같아요  그리고 제가 오른손 오른발 잡이에요  뭐 때문에 그럴까요 ,운동치료
운동 골반 틀어질 수도 있나요 ,제가 이 영상에 있는 운동을 해보려고 하는데 첫번째랑 두번째 동작을 자주하면 골반에 무리가 가거나 틀어질 수도 있나요  몇번만 해도 좀 뻐근 한 것 같이 뭐가 느껴져서요   비만은 아니고 평균인 중  여자입니다  그냥 혹시나 해서 물어봐요   Loading                  화질 선택 옵션,운동치료
어깨재활운동에서 팔꿈치모으기동작 왜하는거죠 ,제가 예전에 굽은등에다 골반도틀어져 한의원에서 추나치료  무튼 자세교정치료를  달정도 받은적있는데요 사진과같은 저동작을 팔꿈치 붙히도록하게했는데 보통저동작은 가슴모아주고 뭐 그런동작인데   완전 엉망인제몸상태에서 저동작이 어느근육에 도움이되서 했을까요  제가 저동작을하자마자 팔을 부들부들떨어서   부들부들안떨릴때까지 하라고했는데   느낌으론 겨드랑이 랑 가슴 그리고 팔뒷편이 살짝땡기는거같은데    완전저강도운동만시켰던 한의원에서 저운동을한 이유는뭐죠  저한테 정말중요한거라고 꼭하라고까지한 유일한운동이거든요   근육명칭까지 자세히알려주세요 이유까지,운동치료
인바디 문의 드려요,키      몸무게     체지방률     골격근량   면 심각한건가요 ,운동치료
복근운동 식스팩,문틀에 다는 턱걸이 철봉 하고 맨몸으로 할수있는 복근운동 알려주세요,운동치료
목 뒤에 견갑 어쩌고 근육,도 승모근인가요  저게 많이 뭉쳐있는데 저거 풀면 목 더 길어보이나요  앞에선 괜찮은데  옆모습으로 보면 등쪽에 근육이 올라와있너서 뒷목이 짧아보여요  ,운동치료
초등 유연성테스트 좌전굴 평균좀알려주세요,제가 유연성테스트 좌전굴하는데 초등학생평균알려주세요,운동치료
레슬링 유도 중 몸 좋아지고 실전성있는거,안녕하세요 제가 무술에 관심이 많아 유도와 레슬링중에 고르고있는데요    현재 유도를 배우고있는중인데 레슬링이 더 좋은것같아서 실전성이 있고 몸이 더 좋아지는게 어느것인지가 궁금합니다     유도는 스파링보다는 익히기를 주로 많이해서 별로일것같은데 레슬링은 다른점이 있나요     유도는 기술이 너무 복잡하던데 레슬링은 간단해보여서 레슬링이 더 간단하나요 ,운동치료
아침루틴정하기,겨울이라 학교가기전에 계속 이불속에만 있어서 일찍일어나 밥도좀 먹고 운동좀 하려합니다  시까지등교고 학교가가까워   분이면갑니다 짤공부     분씩나눠서하는공부  복습 밥 운동 다하려면 운동을 대략      분정도 할 예정입니다  몇시에 일어나야 넉넉할까요  계산이 잘 안되서 도움요청합니다sos     중 이에오,운동치료
남자 헬린이 바디프로필,안녕하세요 남자 헬린이입니다 바디프로필 d   일 남았는데 아침 고구마    g 닭가슴살    g 점심 고구마    g 닭가슴살    g 저녁 고구마    g 닭가슴살    g 운동후 프로틴 한스쿱 이렇게 고정으로 먹고있습니다 지금 체중   kg 근육량    체지방률     입니다 아침 공복 유산소  시간 저녁 퇴근후 웨이트  시간 유산소  시간 이렇게 하는데   일동안 충분히 뺄수있을까요 딱히 먹는것에 스트레스 받진 않습니다,운동치료
근육 튐 손목 피 안 통하는 느낌,고 이구요 건강에 걱정이 많은 편이라 글을 쓰게되었습니다   의료 관련 종사자분들 답변해주셨으면 좋겠어요   최근 팔다리 근육이 튀는거 같아 찾아보니 큰 병들이 나와서 며칠전에 신경과 가서 반사검사해보고 루게릭은 아니라고 들었어요 근데 엎친데 덮친 격으로 저번 주말에 겪은 몸살 기운이 남았는가 다리 발가락 저림  근육통  뼈도 아픈거같고 손목에 피도 안 통하는 느낌이 들더라구요 좀 좋아하졌는데 가끔 손가락이 아프고 특히 손목에 피가 안 통하는 느낌이 하루에    번 강도도 세지는거 같아요 괜히 걱정이 되서 대학병원에 가봐야하나 생각도 들었는데 수능이 코앞이라 망설여져요 그치만 간과하는건 아닌가 걱정도 되고요수능 끝나고 바로 검사해보는게 나을까요다음주에라도 검사받는게 나을까요 ,운동치료
무릅바깥쪽뼈가 아픈데요 벌써 몇개월째 아픕니다 그것도 양쪽 똑같은부위가 똑같이 아프네요 부딪치거나 넘어지거나 한것도아닌데 구부리면 통증이심하고,무릅바깥쪽뼈가 아픈데요 벌써 몇개월째 아픕니다 그것도 양쪽 똑같은부위가 똑같이 아프네요 부딪치거나 넘어지거나 한것도아닌데 구부리면 통증이심하고 펴고잇음 그나마들하네요 무슨이유일까요 ,운동치료
안녕하세요 초등학교  학년 인데 너무 뻗뻗해요 내공    내공냠냠 금지,안녕하세요 그 두다리 앞으로 뻗고 숙이는거 스트레칭 할려했는데 다리를 뻗기만해도 너무아파요 팔은 뻗을수도 없고요  척추에서 뚝뚝 소리도 나고요  너무심각해요 뻗뻗하긴 해도 이정도는 아니었는데 왜이러죠    병원에 가야할까요     내공냠냠 신고,운동치료
승모근 없애기,제가 승모근이 너무 커서 줄이고 싶은데 승모근울 누르고 원모양으로 굴리면 작아지나요 ,운동치료
많이 앉아있으면 상체가길어지나요,안녕하세여  학년 여자인데여 오늘 한        시간  정도 푹신한 소파에 앉아잇엇오요    책읽으면서 근데 어떤사람이 상체만 길어진다고 말한걸 들은적이잇어서 좀 걱정이 되여    저 비율  깡패라서     퓨  정말 길어질까요 ,운동치료
중  안쪽 허벅지살 아랫배살,중 인데 키 크는 데 지장 안 가도록 안쪽 허벅지살 아랫배살 빼는 방법 좀 부탁드려요 키     몸무게    입니다 목표는    에요 제가 무용을 해서  ,운동치료
어깨 통증,제가 어제 주짓수를 하고 집에 왔는데 저녁에 어깨가 너무 아파서 봤더니 피부에 연한 빨간 줄  이 있고 움직이거나 누르면 아파서 파스를 붙였는데 더 나아지지는 않습니다  양쪽 다 이런 증상이 있는데 근육에 문제가 생긴건가요  아님 그냥 근육통인가요   내공    겁니다 잘 아시는 분 있으시면 알려주세요 ,운동치료
등 오른쪽 약간 밑의 통증과 팔 저림,오래 됐어요 등 오른쪽 갈비뼈 부근 한 지점의 심한통증과 오른쪽 라인 팔저림 증상이요  최근에 오른쪽 손가락 라인으로까지의 저릿저릿한 느낌까지  제 생각엔 등쪽 어느 신경라인의 문제가 생긴 것 같은데   혹시 이런 증상을 겪어 보신분이나 잘 아시는 분의 의견   이런 증상일때는 무슨과를 가야하는지   오른쪽 라인을 많이 쓰는데 자꾸 찜찜하게 아파오니 병원 가보기에 앞서 자문을 구합니다      ,운동치료
오른쪽 목 회전 움직인 제한,오른쪽으로 목을 회전시 움직임을 제한할때 오른쪽 왼쪽 각각 어떤 근육들이 신장성 부족을 유발하는지 쓰시오라는 문제에서 오른쪽에 상부승모근 scm이 왼쪽인 견갑거근 판상근 후두하근이 답이라는데 왜 오른쪽이 상부승모근 흉쇄유돌근인가요  오른쪽 회전시 오른쪽은 동측회전히는 근육을 써야하는 거 아닌가요   ,운동치료
왼쪽 뒤통수가 아파요,왼쪽 뒤통수 그림에 있는 빨간점있는부위가 가끔씩 저릿저릿하면서 아프다가 또 금방괜찮아졌다그래요  몇년전에도 그러다가    년새에는 괜찮았어요  근데 다시 요즘 저 부위가 아프기시작하는데 mri찍어봐야할까요   최근에 시작한건 유산소운동밖에없어요 ,운동치료
벤치프레스 무게를 좀 올려서 하다가요,왼쪽 손목이 할때마다 꺾여서 지금 살짝 통증이 잇는데요 압박붕대갑고 내일 가슴하는 날인데 해도 괜찮을까요  뭐 붓거나 만지면 아프다거나 하진 않는데 그니깐 벤치프레스 방향대로 지금손으로 꺽으면 안아프거든요 벤치프레스 할때도 그렇케 아플것 같진 않은데 오늘 바벨컬 덤벨컬 할때 아프더라구요 그러니 벤치때메 손목이 꺾여서 오는통증같은데 반대방향으로 꺽으면 아픕니다,운동치료
화이자 접종 후 운동,안녕하세요 제가   월  일 점심   시에 화이자  차 접종을 했는데 운동은 언제부터 해도 되나요  빡센운동은 안하고 자전거  팔굽혀펴기  저중량 아령만 하려고 합니다,운동치료
유산소 위주 단백질섭취,제가 체지방량은 높고 골격근은 낮지만 일단 체지방부터 빼려고 하루 유산소 시간 근력 시간 하려는데 체지방 반년만에   키로정도 빼고 골격근도 차차   키로정도 늘리려면 식단을 단백질 체중  하면 안돼나요  그렇다고 골격근을 안 늘릴껀 아닌데 하루 근력  시간정도 하면 단백질섭취 얼마나 해야 살크업을 피할까요  몸무게가  정도고 단백질   정도 지방    탄수화물    같이  섭취할 생각이었습니다  단위는 g,운동치료
허벅지 앞 근육 빼는 방법,사실 이게 근육인지 살 인지는 잘 모르겠지만 만지면 딴딴하긴 해요 근육인가요 아님 살 인가요 빼는 방법도 알려주세요,운동치료
