0,1,2
도와주세요,중 인데요 기계체조를 하다가 한쪽다리 무릎을 바닥에 찧였는데 그땐 안아프더니 점점 다리도 떨리고 아파요  가만히 있을땐 괜찮은데 계단을 다닐때  무릎에 힘주거나 무릎을 폈을때 아파요  기계체조랑 태권도를 같이 하고있어서 원래 다리힘이 좋았는데 이제는 준비운동만 하고나면 한쪽 다리가 후들후들 떨려요  다른사람이 봐도 보일만큼 심하게 떨려서 다리힘도 많이 줄었어요  기계체조는 진짜 허벅지 근력이 필요한데 다리가 아파서 잘하던 기술도 잘안돼요  저희집이 가난한 집은 아닌데 아빠가 직업을 바꾸시면서 연봉 억 벌던 집이 한달    밖에 못벌고 다섯식구라 빠듯해서 제가 다니던 학원도 태권도 기계체조 학원 빼고는 다 그만둬서요   제가 알바를 해서 검사비를 벌수있다면 벌겠지만 전단지 알바나 신문알바 다 찾아봐도 할수있는게 없어요  돈버는앱도 엄마 아빠가 다 감시하셔서 마음대로 못깔구요  식비만    만원 나오는데 어떻게 부탁드려요  가면 갈수록 비용더 비싸지는건 저도 알아요  하지만 말씀드리기엔 좀 그래서 혹시 혼자 마사지로 풀순 없을까요 아니면 그냥 냅두면 나아질까요  의심되는 병명 있다면 알려주세요 감사합니다  혹시 알바도 있다면 알려주세요,운동치료
키커지는법 좀  ,중  인데    이에요  도와주세요,운동치료
진짜 키 잘 크는 방법 알려주세요,키가    인데    까지 크고 싶어요  아직은 시작 안 했는데 진짜 한달에  cm씩 크는 방법좀여  ,운동치료
주짓수하다목이꺾였는데 ,주짓수하다 상대방이 잘못해서 제 뒷목이 꺾였는데 너무 아픈데 어떡하죠,운동치료
팔근육 땡김,사진에 동그라미 쳐있는 부분이 어제 밤부터 계속 근육통처럼 쑤시기 시작했는데 잠이 깰정도로 아픈데 왜 이러는 건가요 ,운동치료
치골 밑 통증 어떻하죠 ,쪼그리고앉거나 누워서 다리를 웅크리고 있으면 않아픈데여 다리에 힘이들어가거나 디딜려구하면 많이 아파요 그래서 한방병원에서 약침맞구 뜸질하구 전기치료 한번 받았었는데 좋은거 같더라구요 근데 문제는 통증부위가 돌아다닌다는거에요   어쩌죠 기계로 찍어서 왜그런지 볼수있는 방법은 없을까요  초음파나 뭐 그런거요 잘 아시는분 답변 기다리겠습니다  감사합니다 ,운동치료
한달안에  키로 빼는 방법좀 알려주세요  ,한달 안에  키로를 빼야되는데 식단이나 관리법  같은거 알려주세요   ,운동치료
쇄골 및 목이 아프고 답답합니다 ,  대 후반입니다 일주일 전부터 쇄골부분과 목이 답답하고 약간의 통증도 있습니다 자려구 누워도 잠도 오지 않고 답답해서 잠들기가 계속 힘듭니다 일을 막 하고 있을때는 잊고 있다가 아무것도 않할때는 계속 답답합니다 계속 답답하여   년정도 차고 다니는 목걸이도 뺏고 옷의 목 부분이 쇄골부위에 닿는것만으로도 답답함을 느껴요 한의원가서 침도 맞았는데 크게 변화가 없어요 혹시 이런 증상일때는 어떤 병명인지 제가 어느 병원으로 가야하는지 궁금합니다 하루 하루 너무 힘드네요,운동치료
칼로리 소모에는 뭐가 더 좋아요 ,살뺄려고   방과후 할려는데 줄넘기가 더 좋나요 아님 방송 댄스가 더 좋아요  저는 개인적으로 댄스가 좋은데   칼로리소모에는 줄넘기가 좋을거 같아서요     월  일부터가 신청이니까아    제발 칼로리 소모에 좋은거 추천해 주세요 ,운동치료
온몸의 뼈마디가 욱신거리는 증상이 있습니다 특별히 손가락관절과발고락 관절 어느과를 내원해야 정확한 진단을 받을수 있는지 조언 부탁드립니다 ,손가락 관절 욱신거리는 통증  발가락 발등 욱신거리는통증  오른손 붓기가 있고 양쪽 무릎 발뒤축 고관절 통증도 있습니다  내과 나 정셩외과 나 어느쪽에서 진료받는게 더 좋을까요  조언 부탁드립니다 ,운동치료
무릎에 힘이 없고 무릎뼈 내측쪽에 압통이 있어요, 달전 트럭위에서 뛰어내렸는데 가 이후로 걸으면 오른쪽 무릎이 힘이 없고 내측뼈쪽에 누르면 압통이 있습니다 걸을때 무릎이 힘이 없으니 헐렁거리는 느낌이 듭니다 mri까지 찍었는데 뼈에 멍이 들었다고 들었고 반월상연골이고 인대는 아무 이상없다고 합니다  너무 답답해서 잠이 안옵니다  답변 부탁드립니다 ,운동치료
후두하근 염증,후두하근에 염증이 있는지 확인하려면 어떻게 해야하나요  ,운동치료
엉덩이부근이 아파요 도와주세요   ,안녕하세요 아직 학생인데요 제 진로 특성상 앉아있는시간이 대부분이라 잠자는 시간과 이동시간을 제외하면   시간 이상은 앉아서 생활하는데요 운동도 좋아하는편이 아니라 체력과 신체는 망가지고있습니다    그런데 일주일전부터 왼쪽 엉치부분이 아프더라구요 시큰거리고 앉을땬 괜찮은데 몸을 한 방향으로 비틀면 욱신거려요  근육통인지 뭔지    월경주도아니라 병원을 안가봐서 짐작되는 부분이없네요    어떤 병인지 알 수있을까요 아니면 짐작되는 부분이라도 있으신가요 ,운동치료
목 뒤 당김  결림,인터넷 쳐보니깐 혈관이 좁아지면 이렇다던데 제가 육회 먹고 소고기국밥 국물을 많이 먹긴햇는데 갑자기 이렇게 당기고 결리니 넘 아프네요  이거왜 이러는건가요,운동치료
엄지손가락 핏줄부음,어제 밤에 갑자기 핏줄이 올라오면서 멍든것처럼 부었는데 통증도 있구요 지금은 통증은 없고 저런 모습인데 왜 이런건가요 ,운동치료
치골근 파열,치골근 파열시 생기는 현상  통증  치료방법에 대해 알려주세요,운동치료
몸 만들기,답변부탁드립니다,운동치료
오금 통증 때문에 힘들어요,통증이 심할때는 너무 심해서 힘든데 오금 통증은 어떻게해야 괜찮아지나요  평소에 해주면 좋은 스트레칭이나 마사지가 있을까요,운동치료
근손실 질문,      키로에서 벌크업후       키로가 되었는데요   개월걸렸어요  지금 유지중인데 원래 하루  끼   닭가슴살    g   프로틴    병  한병당 단백질 최소   그램 최대   그램  이렇게 먹는데요  최근 운동은 계속 해줬는데 하루  끼   닭가슴살    G만 먹었습니다  몸 크기 줄어들까요 ,운동치료
근육양이 많아지면 손도 두꺼워지나요 ,안녕하세요 이제 막 헬스를 한지  년 된 헬린이입니다  근데 쇠질을 시작하고 몸무게는 그대로인데 손가락이 이전 보다 두꺼워졌길래   운동하면서 달라진거라곤 근육량 조금인데요   근육형님들 지식 좀 부탁드려요       만약 근육 때문이 아니라면 관리법이나 장비라도    ,운동치료
근손실 질문,      키로에서 벌크업후       키로가 되었는데요   개월걸렸어요  지금 유지중인데 원래 하루  끼   닭가슴살    g   프로틴    병  한병당 단백질 최소   그램 최대   그램  먹거든요  최근 일때매 밥을 제대로 못먹었는데 지금 제 상태에서 근손실이 나려면 얼만큼 적게먹어야 근손실이 발생하나요    운동은 매일 하고있습니다 ,운동치료
푸쉬업 자극점,안녕하세요  푸쉬업을 정자세로 하면 자극이 주로 가슴 어느 부위에 와야하는 건가요  그리고 그림에 빨간색 표시한 어깨에서 가슴으로 이어지는 근육  그게 푸쉬업하고 자극이 오는데 정상적인건가요 ,운동치료
근손실 질문,      키로에서 벌크업후       키로가 되었는데요   개월걸렸어요  지금 유지중인데 원래 하루  끼   닭가슴살    g   프로틴    병  한병당 단백질 최소   그램 최대   그램  먹거든요  최근 일때매 밥을 제대로 못먹었는데 근손실이 나려면 얼만큼 적게먹어야 근손실이 발생하나요   운동은 매일합니다,운동치료
공복 체중에 대한 질문드립니다,평균적으로 저는 공복몸무게가    그람에서   그람 늘오르락내리락한답니다  보통 공복 몸무게 소수점까지 같은분들 많나요  이정도 공복몸무게 편차는 살찐거라고 보기힘들죠   거의 평균적으로  주일기준에서 늘   그람에서    그람사이 왔다갔다한답니다  상세답변 주시면 채택하겠습니다     ,운동치료
근손실 질문,      키로입니다   개월전에       에서 벌크업한건데요    키로일때 하루  끼   닭가슴살    G   프로틴      G 병으로된거 하루    병 마셨는데  지금 몸상태 유지하려면 닭가슴살 몇그램 먹어야하나요  하루  끼는 유지해야하나요  그리고 벌크업 더 하려면 어떻게 해야할까요   지금 현재    끼  닭가슴살        G 먹고있습니다,운동치료
근손실 질문,      키로에서 벌크업후       키로가 되었는데요   개월걸렸어요  지금 유지중인데 원래 하루  끼   닭가슴살    g   프로틴    병  한병당 단백질 최소   그램 최대   그램  먹거든요  최근 일때매 밥을 제대로 못먹었는데 근손실이 나려면 얼만큼 적게먹어야 근손실이 발생하나요 ,운동치료
근손실 질문,      키로입니다   개월전에       에서 벌크업한건데요    키로일때 하루  끼   닭가슴살    G   프로틴      G 병으로된거 하루    병 마셨는데  지금 몸상태 유지하려면 닭가슴살 몇그램 먹어야하나요  하루  끼는 유지해야하나요  그리고 벌크업 더 하려면 어떻게 해야할까요   지금 현재    끼  닭가슴살        G 먹고있습니다,운동치료
아니 스쿼트 가동범위가 너무잘나와요,스쿼트 평소에 너무안되는거예요 보통 일정 깊이이상 앉으면 벗윙크가 된다고 하지말라고 하시잖아요 근데 전 거의 엉덩이가 바닥에 앉을듯이 해도 벗윙크가 안생겨요   그래서 그렇게 안하면 자극도안오고요    이거 좋은건가요    아니면 제가 허벅지가 길고 종아리 좀 짧은 체형인데 그래서 그런가요     엉덩이 힘이없어서 쭉쭉내려가는건가요  ,운동치료
무릎 안 좋은 사람이,체력 기르기용으로 할만한 운동 추천해주세요 수영은 당장 어려워 수영 제외한 운동으로 부탁드려요 ,운동치료
요즘 어깨가 단단히 굳어요     ,어깨 사이에 뒤쪽도 뻐근하고 뭉친것처럼 굳었어요       풀어주는 스트레칭이나 방법 좀 알려주세요   요새 어깨 너무 굳으니까 일상에서 힘드네요  ,운동치료
운동을 하려고 하는데   그동안 운동부족이였는지 되는게 없네요 ,그동안 운동안하고 살면서 사는데 지장만 없으면 된다고 생각하고 뒹굴면서 안먹고 정말 주위에서 좀 먹으라고 하는 정도  운동도 안해서 딱히 살은 없어요  그런데 기초체력  면역력이 너무 부족합니다  현재 거북목도 심하고 허리도 굽었으며 조금만 운동해도 쉽게 지칩니다  그래서 운동좀 해보려고 했더니 뛰려니까 다리와 무릎에 통증이 생기고 윗몸일으키기는 혼자하면    개도 힘들어요 이건 자세의 문제도 있는듯 학교에서 체력측정할땐 친구가 잡아줘서    개를 하긴 했지만 엉덩이를 들어 반동으로 올라와서 하는 등 꼼수를 써서 아마 제대로 하면 정말 몇개 못할겁니다   인터넷에서 보고 팔굽혀펴기를 해보려는데  개도 못합니다  정말 모든 힘을 짜내서 도전하였지만 결과는  개  그나마 집으로 오는 길엔 일부러 돌아가서 약  킬로정도 지칠때까지 뛰다가 도저히 못뛰면 걷고 하는식으로 옵니다  그런식으러 해도 뛰는건    정도  그거보다 더 적을 수도 있습니다    어떻게 해야 할까요 ,운동치료
다리 스트레칭하면 더 다리가 저려요,다리 스크레칭 하는데 다리가 더저려요 운동 다하고나면 시원한데 운동할때눈 더저려요,운동치료
체성분 측정기 아큐닉 accuniq  인바디 아님  골격근량 어떻게 보나요 ,사진은 체성분검사기 모델명 bc    에 나온 QR코드를 아큐닉어플로 찍어서 나온 결과화면인데  인바디나 인터넷에 나오는 아큐닉 검사표는  골격근량 이 나오는데 어플에는  근육량 으로만 나와서 아큐닉으로 골격근량을 볼 방법은 없나요   예전에 인바디로 재던 골격근량이랑 비교하고싶어서요 골격근량이 보고싶은데 프린트를 해야 보이는건지 어플업데이트되고 골격근량이 사라졌는지 안보이네요  아큐닉관계자분이나 아큐닉 잘 다루시는분들이나 해결방법아시는분들 답변 부탁드려용 ,운동치료
헬스 벌크업식단,  살       키로정도 되구요 기초대사량은     정도됩니다 하루섭취량 다더해서 계산한건데 더하거나 빼야되는거 있나요   식이섬유 권장섭취량보다 많이먹으면 오히려 소화불량 유발할수 있다길래 야채는 뺐습니다 고구마 오트밀만으로도 식이섬유가 다차더라구요,운동치료
불균형 도움이 필요해요,제가 어깨 불균형이 있어서 교정을 하고 있는데 어깨의 높이는 비교적 잘 맞춰졌는데  승모근부분만 유난히 차이가 납니다  승모근부분만 높이 차이가 나는데 어떻게하죠    ,운동치료
틱톡 골반 튕기기,골반 튕기기 어떻게 하나요    ,운동치료
상승 다이어트 식단검사,운동선수 입니다  현재 체중     골격근   체지방     식단검사 부탁드립니다   목표는 상승 다이어트 입니다  체지방   근육     끼     난단백    g 잡곡밥    g 스리라차 소스   g  끼     닭가슴살   g 잡곡밥   g 양배추  g 소스  g  끼      일반식 학교급식 쌀밥    g  유무산소 운동  시간   분 정도  끼      닭가슴살   g 잡곡밥   g 양배추  g소스  g 크로스핏 근력 유산소   시간  끼     닭가슴살   g 잡곡밥   g 양배추  g 소스  g,운동치료
통뼈다이어트 발목,통뼈인데 아킬레스건때문에 두꺼워 보이거든요 어떻게 해야 얇아보일까요  ,운동치료
목에서 삐꺽거리는 소리가 너무 심하네요,원래 삐꺽거리는 소리 나는게 정상이라는건 아는데 왜이렇게 많이 나는거죠  그냥 폰 보다가 목 살짝 돌리면 삐꺽거리고 티비보다가 목 돌리면 삐꺽거리고 잘때도 삐꺽거려서 죽겠어요      이건 정상인가요        ,운동치료
사이클 인터벌 질문,안녕하세요 제가 사이클로 다이어트 운동 중인데   분  단  분   초  단 휴식 놓고 인터벌 해서   분 하기    단 놓고   분 쭉 타기 하면 어떤게 효과가 더 있을까요 ,운동치료
잇몸치료하고 난후 운동은 당분간 안하는게 좋은가요 ,현재 잇몸부근에 이가 세군데 좀 패이고 피가나요  내일 치과에 가려고 하는데 듣기로는 잇몸치료 한날은 운동 안하는게 좋다는데 정말 그런가요  지금 현재 복싱운동을 하고 있는데 너무 무리한 운동은 안 좋은 걸까요  만약에 그렇다면 가벼운 런닝머신만 우선 할까 싶기도 한데    아니면 잇몸치료를 받게 될경우 운동은 아예 안하는게 좋을까요  답변 부탁드립니다 ,운동치료
스트레스성 근육통 근손실  ,어제 스트레스를 많이받아서 삼각근쪽이 아프기시작했는데 오늘 학교갔다와서 만져보니 근육통이 있더라고요   이러면 근손실을 유발하는건가요   특히 삼각근쪽이요  ,운동치료
저녁 줄넘기    시 사이  초저녁 줄넘기    시 사이 ,저녁 줄넘기랑 초저녁에 줄넘기 하는 거랑 둘 중에 뭐가 키 크는데 더 좋나요  유의미한 차이는 없는 건가요 그리고 달리기랑 줄넘기 중에 키 크는데에 뭐가 도움이 되나요 ,운동치료
엑스바이크,숀리 엑스바이크는아니고 그냥 엑스바이크 실내자전거처럼타는건데  상체는 가만히있고 다리만굴리는데 이게 전신으로 살이빠지긴하나요  땀은 송골송골나는데 전신으로빠지는직  금해요  광고글 복사붙여넣기글 신고합니다,운동치료
등운동 대원근,안녕하세염 이제 운동 년차 되어가고있는 헬린이입니당 제가 등운동을 제일 좋아하고 제일 어려워하면서 제일 자신있는 부위인데요 제가 목표가 약간 피지크 이다보디깐 V테이퍼를 더 각지게 살리기위해서 대표적으로 풀업이랑 렛풀다운을 할 때 팔꿈치를 앞에다 놓고 하거든요 고립이랑 자극을 신경많이 쓰면서 하고있는데 요즘 제가 다이어트를 해서 그런가 원래        체지방     이였는데 현재         체지방    으로 다이어트가 되면서 등운동을 하고 나서 이제 스트레칭 하듯이 팔을 살짝 구부리고 그대로 원암 덤벨 한다고 생각하고 당기면 대원근이 그 근육통이 아니라 여기서 더 땡기면 정말 막 근육 그 뭐냐 몸안풀고 수영하면 쥐날 것 같은 느낌이 들고 억지좀 부리면 근육이 파열될 것 같은    느낌이 들어요 제가 운동을 되게 많이 타이트하게 하는데 오늘 되게 잘됬거든요 턱걸이하면서 그냥 대원근이랑 광배쪽이 메챠쿠챠 되는 느낌도들고   아이고 말이 좀 길어졌네요  이거 왜 그런   가요  ,운동치료
견갑 통증,헬스할때 시티드 로우아 랫풀다운 좁은그립 삼각형같이 생길걸로 하면 견갑 안쪽이 왼쪽만 통증이 느껴지는데 왜그로나요  당분간 안해야 할까요 ,운동치료
유도  주짓수  합기도  태권도 복싱 중에 무슨 운동을 하는게 좋을까요 ,저는 중 인데요 최근 살도 빼고 제 몸도 좀 지키고 싶어서 위에 나온 운동들 중에 고민중입니다 무슨 운동을 하는게 가장 좋을까요   그 종목의 비용은 어느 정도인지 알려주시면 감사하겠습니다 ,운동치료
대원근이 아파욘,운동  년차된 헬린이 입니다 제가 제일 잘하면서 제일 어려워하고 제일 자신있는 부위가 등인데 v테이퍼를 더 각지게 키우고싶어서 루틴에 있는 풀업이랑 렛풀다운을 대원근 주 타켓으로 하고있거든요 제 스타일도   루다가 정신 못차리는 고립을 선호하는데 요즘 따라 운동이 너무 잘된 날들은 다음날 광배근이 아픈게 아니라 막 뭐라해야될꺼 일어서있는 상태에서 팔을 구부리고 뒤로 재끼면 대원근이 수축되자나요 근데 대원근이 막 근육통이 심한걸 넘어서 막 그 부분만 찢어질 것 같은    억부리면 파열될 것 같은 느낌이 들어요   제가 원래       에 체지방    이옇고 지금은        체지방  을 유지하고있는데 그거 때문에 그런가요   오늘 등운동도   잘되긴했습니저 헬창여러분 도와주십시요  ,운동치료
몸 만들기,답변부탁드립니다,운동치료
다리 마비 걸린듯 아파요,말그대로 그냥 침대에 앉아있다가 누울려고 하는데 왼쪽 다리가 쥐가 난듯이 아픈게 아니라 갑자기 꼬이듯이 아파오더니 약간 근육통 비슷한 느낌이 났고 또 억지로 걸을려고 했는데 일단 조금 걸어지긴 하는데 계속 다리가 무거운 느낌이 나요 제가 화이자  차를 맞은지  주 넘었늗데  차 부작용인가요 아님 다른 이유인가요 제발 알려주세요    분   분 동안 지속되었는데 다리 아예 못들고 움직이지도 못했어요 지금도 계속 무거운 느낌 나고 좀 아파요   ,운동치료
재질문 공복 웨이트 운동시 음료 섭취,제가 아침에 운동을 하는데요 아침밥을 먹으면 속이 더부룩하고 안좋아서 아침식사는 거르는 편이에요 그래서 유튜브를 찾아봤는데 핏x리 이분 영상에서 공복 웨이트전에 흡수가 빠른 음료나 꿀 이런거를 먹고 운동하면 에너지원으로 빠르게 쓸수 있다고해서 파워에이드를 운동전에 마시는데요 이렇게 꾸준히 해도 건강에 괜찮은 걸까요   음료가 좋지않으면 꿀로 바꿀 생각이 있습니다 잘 아시는 분이 답변 해주셨으면 좋겠습니다,운동치료
  대 골격근량 늘릴수있을까요 ,  살 남자   인바디상의 골격근량     kg인데 헬스한다면 더 늘릴수있을까요   나이가   대로 접어들어서 힘들것같다는 생각이 들어서 궁금합니다 ,운동치료
삼두근건염 재활운동하다가 아픔,평소에 마사지만하다가 괜찮은줄알고 재활운동따라하니까 아프기 시작하는데 계속하면 나아질까요  하지말아야 할까요 ,운동치료
플랭크 운동하다가 근육떨림  ,전 현재 중    살이구요 약 일년 전 여름에 살을 빼려 플랭크를 하고 있던 중 갑작스레 근육을 쓴 탓에 팔 윗부분에 근육떨림이 있었습니다 그리고 다리살 빼는 운동하다가 발바닥 떨림도 곧이어 생겼구요 저녁이나 아침 굶는 일이 많아서도 영향이 있는 것 같구요 이게 전신떨림으로 번지더라구요 희귀병 의심은  년이 지난 지금 아직까진 힘빠짐이나 근력약화는 없고 오히려 살이 더 찌고 있는 것 같네요    이건 약물로 치료해야하나요    ,운동치료
어떤 스트레칭운동을 설명한것일까요 ,첨부의 설명에 해당하는 스트레칭운동을 설명하는 간단한 일러스터나 그림 등을 찾고 있습니다  나이 많은 아버지가 엉치뼈 관절이 아프다고 하셔서 관련된 회복운동을 권해드리려고 찾아보니 첨부의 스트레칭이 좋다고 하네요  근데 아무리 읽어봐도 도대체 어떤 자세인지 감이 오질 않네요      어차피 아버지한테도 그림설명이 가장 좋을텐데   나름대로 구글링을 열심히 해봐도 감을 못 잡겠네요   도와주세요 ,운동치료
양궁할때 부상,팔 신경이 다치면 양궁 하기 어렵나요 ,운동치료
견갑 전인 질문,플란체 기울이기 연습을 하는데 견갑을 최대로 전인시켜도 날개뼈가 살짝 튀어나옵니다 등보단 살짝 옆   왼쪽만 그러고 오른쪽은 잘됩니다   이때 왼쪽 팔 내회전 하면 튀어나온 게 좀 줄어들고 외회전 하면 강해지는데 왜 이런 건가요  어떻게    고칠 방법이 있을까요   아 전인했을 때 하강하는 것도 외회전이랑 비슷한 혹은 똑같은  튀어나옴이 있는 듯합니다,운동치료
남자 남자 몸 키우기,열심히 운동을 하고 있는 한 사람입니다  제가 처음 운동을 시작했을때 몸 상태는    에      을 왔다갔다 하는 몸무게였고 어렸을때 부터 축구 등 활동을 좋아하고 많이 해서 체력도 좋은 편이엇고 말랐지만 그래도 운동량이 없고 그런 마른 몸은 아니였어요  그러다 운동을 시작하고 몸이 조금씩 좋아지는게 보이는디 아무리 생각해도 태생적으로 체격자체가 큰 편도 아니고 골격도 넓은편이 아니라 뭔가 좋아지기는 하는디 그래도 몸이 작아보이더라고요 그래서 살을 찌우기 위해서 최대한 많이 먹기 시작해서      까지 올라왔습니다 여기서 고민이 생기더라고  애초에 생각은 일단 운동하면서 유산소 안하고  많이 찌우고 체중을 늘린다음에 유산소 추가하면서 체지방률은 관리 할려고 했어요  먹는걸 그래도 과자나 라면 보다는 에너지바 등 그나마 건강한거 챙겨 먹었을때도 있고 그냥 그런거 신경 안 쓰고 먹었던 시기도 있어요 갈팡질팡하고 있죠 뭐가 맞는지 모르겠어어요  그러다보니 배가 조금씩 나오고 있어서 복근 운동도 매일은 못해주지만 최소 일에 한 번은 해주고 있습니다  남들이 보기에는 그렇게 많이 나온게 아니라고 하는디 저는 보기 싫더라고요 전에 있던 복근도 사라지고 저도 잘보면 그렇게 많이 배가 나온것도 아닌거 같기도 해요    그래서 많이 자주 먹는것도 어케 해야되는게 제일 궁금하네요  확실히 골격 자체가 외소해서 키우고 싶은디 지금 제가 하고 있는게 많는건지 모르겠어요    시간이 안되서  일하고 하루는 꼭 쉬게 되고  일 동안 어깨 등 복근 하거나 어깨 등만 하거나 합니다  시간 정도 하는디  일 연속으로 하니까 힘이 딸려서 운동 부위를 바꾸거나 운동 종류를 바꾸거나 세트나 횟수를 컨디션 보고 조절 해요   이것도 좀 고민 입니다   운동 할 수 있는 날이 부족하다보니 욕심 부리는거 같기도 해요  말이 너무 두서가 없어서 죄송합니다   그냥 하소연 같아졌네요  ,운동치료
