0,1,2
왼쪽가슴 근육 뻐근 통증문의요 ,평소 스트레스가 심하여 자다가 쿵하는 느낌  활동후 앉았을때 심장이 파르르띄는 느낌 장기적 지속으로 세종충대 심장내과서 각종검사 시행하였으나 이상없다는 결과 받고 코로나 모더나  차 접종 후 왼쪽가슴 압박 간헐적 통증 있어 동네의원서 심전도후 접종 권하여  차도 접종 완료  그 이후 낮동안보다 취침시에 압박감과 통증의 빈도가 높아져 불안한 상태로 있었는데 전날밤은 끊임없는 통증으로 잠을 못이룸  너무나 겁이 납니다  심근 심낭염 뭐 그런것은 아닐까 걱정됩니다    ,운동치료
겨드랑이쪽 근처 왼쪽 상체 통증  ,제가 팔을 올리고 자는 버릇이 생겼어요  처음에는 편해서 했는데 어느 순간부터 일어나면 어깨가 약간 올라가 있고 내릴려고 하니 통증이 조금 있었어요  그래도 한시간 정도 지나면 괜찮아져서 아무렇지 않게 생각했는데 언제부터 인지 왼쪽 겨드랑이 근처로 해서 가슴 팔 어깨 목 등 전체 통증이 있습니다  등쪽은 근육통 같은 느낌이고 나머지는 근육통이 아니고 뼈가 아픈 느낌    자는 습관 때문인가요  습관 고치면 괜찮아지나요 ,운동치료
헬스 손목 빠짐,운동을 하는데 스트렙을 껴도 등운동할때 손목이 빠지는 느낌이나요 물론 손목에 고통도 있습니다 이거 해결 가능한가요 관련 운동이나 해결 방법 알려주세요    리스트컬 한 번씩 해주고 있어요,운동치료
목뒤 두개 인대 물렁뼈 아파요,어깨쪽이랑 두개골이랑 이어진 인대인지 물렁뼌지 두개있잖아요      목뼈 양옆에라 해야돼나 뒷부분에 거기 오른쪽이 오른쪽으로 고개돌릴때마다 아픕니다 마치 다리 삔발을 땅에 닿았을때 통증 느낌   그렇게 쌔게 아프진않지만  누워서 잘떄 많이 불편하네요              제가  자목 역c라      반년전 병원갔을떄 아마 이정도면 목디스크 있을거라 하셔서 MRI찍으라 하셨는데 아직 안찍었거든요      요즘은 잘때 목이 가슴근육 어깨 다아파서 못자긴하는데            목뒤 인대 물렁뼈  가 젤 거슬리고 아프네요,운동치료
   에   키로 헬린이입니다  인바디보고 운동방향 조언 부탁드리겠습니다 ,운동시작한지는 한달정도 되었구요 체중은  키로 정도 찌워서 지금은   입니다  그런데 몸매를 보면 배가 좀 나온거 같고 체지방률도 좀 느는거 같아서 걱정입니다   그렇다고 덜 먹자니    신경이 쓰이구요   운동은 pt를 끊어서 진행하고 있구요 전문가분들의 많은 조언 부탁드리겠습니다 ,운동치료
갈비뼈 통증 질문,아는 분이 왼쪽인지 오른쪽인지는 모르지만 갈비뼈 갈빗대 그 쪽에 통증을 느낍니다 가끔은 잠에서 깰 정도에 통증이고 한  년 전부터 그랬던 걸로 알고 있는데 무슨 병일까요 ,운동치료
어제 옆돌기를 틈날때 마다 했거든요    기분이 좋아서   ,근데 배랑 팔이 아픈것 같은데 옆 돌기 할때 배근육도 쓰나요 ,운동치료
근육 인대 구별법,뒷목에서 뼈소리가 나고 어깨쪽이 뻐근한데 인대가 약해져서 그런건지 근육이 뭉쳐서 그런건지 어떻게 구별하나요 ,운동치료
발등뼈가 아파요,평소에 축구나 족구 등을 많이 하는데 한달전쯤 실수로 기둥같은걸   발등으로 찼는데 그 이후  일정도 아프다가 약먹고 하니 괜찮아져서 다시 축구 족구 뜀뛰기 등 운동을 하다가 일주일전 밤부터 갑자기 찌릿찌릿하고 근육통 오듯이 아프고 지금까지 아픈데 왜그럴까요    군병원에선 단순 타박상이라고 하는데 그 아픈당일엔 운동을 하지않았던걸로 기억하고있습니다 벽에 부딪히거나 그러지않아도 타박상이 생기나요    검은색으로 표시한곳은 발가락을 올릴때 통증이 좀 있고 휜색부분으로 표시한곳은 발을 디딜때 좀 아픈곳입니다    답변 부탁드립니다  그리고 내일 신경외과를 가는데 가는김에 발등에 있는 통증도 신경외과에서 봐주시긴하나요   ,운동치료
근력운동질문,근력운동하다가 만약에 목표가  개인데   개들고 힘들어서못하겠어도 참고해야하나요 ,운동치료
운동 질문드립니다 ,몸을 쓰는직업을 하는사람입니다   결혼후 몸무게가   kg가 쪄서 다시 운동을 시작하려하는데 전형적인 팔다리 얇고 배만있는체형입니다   근력도 최근에 많이 줄고 인바디는 체크 안해봤지만 체지방이 많이 증가된걸로 보입니다  최근 운동을 시작하면서 새벽 시에 기상해서 공복유산소운동을  시간정도 진행하고있습니다   일주일정도됬는데 몸무게는 줄어도 이게 몸에 근력은 더없어지는기분이들더라구요 저녁에 웨이트를 병행하려고하는데     새벽공복 유산소  시간 저녁웨이트후  시간   분 걷기 해도 괜찮은지 더 효율적인 방법이있는지 알고싶습니다 근무시간                     저같은사람의 보충제 추천 부탁드립니다      운동은 주  회 진행하고 공복유산소는 매일 진행하려고합니다 몸을 쓰는직업이라 일주일 내내 운동할수있는 체력이안되서 오히려 재대로 된자세도 안나올꺼같아서 더 좋은 운동계획이있으면 추천부탁드립니다  전문가분들에 답글 기다리겠습니다  내공    겁니다,운동치료
상체를 좌우로움직이면 호흡기소리 가 나요,하체는 가만히 있는 상태에서 상체를 좌우로 움직이면 심장  호흡기  쪽에서 훅훅 하는 소리가 나요 정상인건가요 ,운동치료
팔꿈치 통증 채택 내공    ,  세 팔꿈치 퇴행성 관절염이라 골극이 있는데 랫풀 다운 시티드 로우 같은 등 및 팔을 아무래도 쓰는 운동을 해도 괜찮은지 궁금합니다 ,운동치료
운동기구 이름 효과,이 운동기구 이름이 뭔가요  그리고 운동 효과 알려주세요  어느 부위를 자극이 되는지 궁금해요,운동치료
직각어깨 만드는법 어깨유형,안녕하세요 중  남자입니다 요즘에 옷을입으면 어깨가 옷걸이가 되서 고치고싶은데 어깨를 펴도 별로 다를게없고 그리고 제 어깨유형좀 알려주세요,운동치료
하리짧은사람 허리라인만들려고하는데 어떻게하면되나여 ,하이짧은사람인데 허리라인이 갖고싶습니다,운동치료
스플릿스쿼트 가블릿스쿼트는 햄스트링쪽 자극 오는 스쿼트인가요   ,우선 남자입니다  제가 지금은 헬스를 안다니지만    헬스경력  년반에 유도 년입니다   헬스했을땐 햄스트링보다   앞벅지가 더 좋았다가   어쩔수없이 홈트로   kg가블릿스쿼트하고   kg스플릿스쿼트 를 하는데 뒷벅지는 엄청 발달하고   앞벅지는    사라지고 있는것 같이    뒷벅지가   발달이 엄청되고 있습니다   원래 헬스할땐 뒷벅지보다 앞벅지가 더 발달이 잘되서 고민이었는데 반대입니다   우선 스플릿스쿼트는 제가 헬스장에서 운동해도 뒷벅지 자극오는걸 잘 못느꼈는데    스플릿스쿼트는   엉밑살쪽에 엄청난 자극이 오고    가블릿스쿼트를 같이 라는데   헬스장에서 운동햐도 엉밑살부위엔 근육통을 느껴본적없는데   스플릿스쿼트가 엉밑살쪽 운동인가요   그리고 가블릿스쿼트는뒷벅지운동인가요   아니 헬스장에선    kg로 백스쿼트  rm을 했는데도 그렇게 큰 자극을 못느꼇는데       물론 맨날 같은 무게로 해서 그런잔 몰라도     우선 근데 스플릿 가블릿 뒷벅지에 느낌이 헬스장에서 하체운동했을때보다   다른데   느낌이 잘 오는 운동인가요           헬스장에선 하체운동을 해도 엉밑살 부위에 자극을 느끼기 힘들었는데    제가   남자인데   힙업이 약간 되있어서    전 뭔가   민망한데    여자들도 남자 힙업 좋아한다해서   물론 저도 밋밋한건 별로라   하고 있는데    스플릿 가블릿   이제 헬스를 못다녀서    중량 스쿼트는 못하지만        스플릿 가블릿으로 하체를 때우고 있는데      ,운동치료
자다가 깨서 일어날려면 가끔 두 다리가 안 움직임 마비된것처럼 바로움직일려면 아픔 천천히 안자서 마사지도 하면서 천천히 움직이면 그때 풀려요 왜,자다가 깨서 일어날려면 가끔 두 다리가 안 움직임 마비된것처럼 바로움직일려면 아픔 천천히 안자서 마사지도 하면서 천천히 움직이면 그때 풀려요 왜 그런걸 까요,운동치료
스트레스 받아도 근육 떨림이 있나요 ,스트레스를 막 요근레 많이 받는데 떨린지 한달 두달 됬는데 스트레스 받을때부터 뭔가 떨리는가 같아서요 스트레스 받아도 떨리는지 알려주세요  ,운동치료
손가락 마디 찬바람  찬물에 극심한 통증,제목 그대로 입니다  검지 손가락 마디가 찬바람이 불거나 찬물  찬 물건에 닿기만 하면 찌릿찌릿한 극심한 통증이 있습니다  움직이거나 만지는건 전혀 문제가 안되는데 차가운 것에만 그렇게 반응을 해요  오늘 정형외과 가서 엑스레이도 찍어봤으나 아무 문제가 없다고 하고 내과를 갔더니 좀 더 지켜보자는데 이거 왜 이러는건가요  어느 과를 가야하나요 ,운동치료
