0,1,2
제 인바디 어떤가요 ,  살 여자이고 키는     입니다  근육 증량을 위해 운동하고 있는데 몸무게가 너무 높은가 싶어 살을 조금 뺄까 고민중입니다  근육량이나 지방량이 적당한지  어떤 상태인지 봐주실 수 있나요 ,운동치료
훙근 스트레칭,흉근 스트레칭 자세 좀 알려주세요  ,운동치료
축구 골키퍼 하다가 중지 손가락 꺾이고 운동질문,제목대로 축구 골키퍼를 하다가 중지 손가락이 꺾여서 조금 붓고 굽히면 조금 아픈데요 이상태로 풀업하니까 조금 아프긴해도 괜찮게 당겨지더라고요 다음주월요일부터 헬스를 다닐려고했는데 이상태에선 절대 무조건 쉬어야하나요  보통 손가락 꺾였을때 얼만큼 쉬어야 나을수있을까요 ,운동치료
근육에 알 베긴 채로 화이자 백신,걸을때마다 근육을 쓰는데 너무 아픈거에요 그래서 알이베겼구나 해서 있었는데 알고보니깐 팔 쪽에도 알이 배겼는데 저번에도 알이베긴채로 독감주사를 맞았는데  년전이랑 몇년전만해도 맞고나서 아무증상도 없었다가 알이베긴채로 맞으니깐 너무 아프더라고요 혹시 화이자 맞을때도 같은 경우인가요  알이베긴채로 맞으면 더 아픈가요 ,운동치료
하체운동을    일 이상 안하면 종아리 근육통이 와요,헬스 다니며 운동중인   대후반 여성입니다  가슴 하체 등 팔어깨 이렇게  분할로 매일 운동을 하는데요 약속이나 일이 있어서 운동을 못갔을 때     일 이상 하체운동을 못하면 오히려 근육 통증이 옵니다  일반적인 상황은 아닌거 같아서 질문드립니다  운동을 못했을때 오히려 종아리 근육통증 붓고 땡김  혈액순환 안되는 느낌 이 오는게 무엇 때문일까요 ,운동치료
대드리프트 및 햄스트링  둔근운동,  데드리프트 및 둔근운동이 순발력이나 점프력향상에 도움이될까요    웨이트를 하면 둔해지진 않나요    도움이 된다면 몇회 몇세트정도 해야하나요 ,운동치료
 년전에 살빼려 운동을 하다가 근육떨림,팔 다리 순으로 점점 번져 온몸까지 번졌네요 설마 희귀병이면 어쩌지 하는 마음에 써봅니다 중 여서 시험에 스트레스 받으면서 더 심해진 것 같습니다   검사할시간도 없고 담주는 백신때메 시간이 없네요 저랑 비슷한 증상을 가진 사람들 글을 보면 검사는 했는데 정상이라 뜬다고 하네요 쉽게 고칠 수 없는 증상인가요   넘 무서워서 잠도 못자겠어요      놀러나와서도 걱정이 한가득이네요,운동치료
어깨 주변 찝힘,어깨를 위로 올리고 뒤로 넘기고 밑으로 내릴때 저 부분이 찝혀요   ,운동치료
쳐진어깨 올리는법,헬스하는 남고생인데요 어깨가 첫번째그림처럼 안쳐지고 각이있으면 좋겠는데 제어까는 두번째그림처럼 아래로 떨어지는 그런느낌인데 어디를 운동해야 어깨가 올라가는지 알려주세요,운동치료
체력시험 준비 중입니다  운동방법좀  ,안녕하세요 환경미화원 준비 중인 사람입니다  곧 환경미화원을 채용하는데 실기 시험 준비 때문에 글 올립니다  세달 전부터 혼자 헬스도 하고 오래달리기도 해서 체력을 나름 키웠다고 생각했는데요  시험을 자신있게 볼 정도가 아니네요      실기시험은   kg 모래주머니  개를  톤 트럭에 상차 후 또 다른  개의 모래주머니를 들고   m 달린 후 반환점을 돌아   m 복귀하는 시험입니다   약  주 정도 시험이 남았습니다  늦게나마 pt도 끊어서 근력운동 같이 진행 중이고   kg    kg 사낭을 주문했습니다  참고로 저는    cm   kg   대 후반 남자입니다   시험을 어떻게 준비해야 효율적으로 하는 걸까요   알려주시면 너무 감사드리겠습니다     ex  첫주는 달리기  둘째주는 근력운동  셋째주는 달리기 이런식으로 대략적인 스케쥴을 짜주시면 감사하겠습니다 ,운동치료
플란체 팔뚝통증,플란체 연습을 하고있는데요   계속 팔뚝 뼈가 아픈거같은 느낌이 드는 거 같은데 그래도 괜찮은건가요 ,운동치료
마이프로틴 비타민들 zma  카페인  알파맨  비타민d   zinc  섭취방법 알려주세요,안녕하세요 헬스를 꾸준히 하고 있는 사람입니다  몸회복이 필요하고 식단도 잘 관리를 합니다만 비타민이 부족한거같아서 비타민  개정도 샀습니다  마이프로틴 카페인  zma   알파맨  비타민d   zinc 를 샀습니다  기본적으로 카페인은 운동하기  시간전에 먹으면 되는 걸로 알고있고 알파맨은 종합비타민이라서 하루에  개 챙겨먹고 그외  개 비타민들은 언제 먹어야 좋은지 알고싶고 무엇과 무엇을 같이 먹으면 좋은지 상관없는지 아니면 같이 먹으면 부작용이라던지 몸에 해로운지도 알고 싶습니다   ,운동치료
싯업이후 왼쪽아래복근 통증,제목 그대로 싯업 연습하다가 복근 전체에 알이배겨    일 정도 휴식후 싯업을 실시했습니다 평소 하루이틀만 쉬어주면 복근 알 통증이 하나도 없었는데 왼쪽아래 제일밑 왼쪽  복근 한개만 통증이 심합니다 싯업중 일어나면 찢어진곳에 물이 들어가는 비슷한 통증이 드는데 오늘 유독 평소보다 통증이 십합니다 살면서 이런적이 없었는데 복근 한개 통증만 심한데 단순 알이겠죠    병원을 방문해야면 무슨과를 가야될까요   운동할때만 통증있고 일상에는 지장없슴니다,운동치료
운동후 근육통 펌핑은 무엇인가요,운동후 펌핑은 진짜 터질정도로 오고 힘들어서 몸에 힘도 안들어가고 등같은 경우는 딱 펌핑이 되서인지는 모르곘지만 빡빡한 느낌도 들고 누가봐도 운동 한거 같은 느낌인데 운동하고 다음날이 되면 근육통이 진짜 하나도 없습니다 좀 그냥 몸이 찌뿌등한 느낌 뿐이고 근육통 처럼 아픈건 하나도 없는데 어쩌나요 ,운동치료
코로나 입원 중 운동,코로나 확진으로 입원한지  일째인데 크게 아픈지는 좀 돼서요 지금은 기침과 깊은 숨을 못쉬긴 하는데 운동해도 되나요  복근이랑 힙만 간단하게요 호흡 딸리려나    우짤까유    ,운동치료
데드리프트 중량,제가 데드리프트를    정도 치는데요 궁금한게 데드리프트는 왜    달 정도 안하다가 해도 중량이 줄지를 않나요  어쩔때는 중량이 더 늘기도 하던데 이건 무슨이유 인가요 ,운동치료
중학생  대운동 질문,제가 중 때 데드           들었었는데 오늘부터 꾸준히하면 몇까지될까요 또   가슴 근육이랑 어께가 좀 많이약한데  벤치    못들었던걸로 기억  어떻게하면 세지나요  스퀏은     가볍게 했던거 같은  ,운동치료
파워리프팅 훈련,스트렝스 즉 파워리프팅 운동을 하고 싶은데요 루틴이나 몇 분할로 해야할까요 파워리팅 훈련 은  x 가 좋은거 같은데 스트렝스 운동하는사람들중에  rm까지 찍는건 무슨운동법인가요 분할마다 운동법이랑 휴식시간 알려주시면 감사하겠습니다  내공    드립니다,운동치료
어깨비대칭 병원 질문,안녕하세요   살 남자이고  눈에 띄는 어깨비대칭이 있고 갈비뼈  가슴뼈까지   누워서 허리 들어올리면 높낮이가 다름  일괄된 비대칭이 있습니다  그런데 몇개월전 허리 통증때문에 정형외과를 갔을때는 척추측만증이  도 내외로 괜찮다고 하셨는데도  이런 비대칭이 있는데 운동을 할수록 너무 신경쓰이고    골반 비대칭이 좀 있는거같기도 한데  만약 골반비대칭이 주 원인이라면  정형외과  한의원 추나치료   체형교정센터  어디를 가야하면 좋을지    그리고 치료방법과 비용은 각각 어느정도 나오는지 궁금합니다     사실 체형교정센터가 보험도 안되고 너무 비용이 많이 들꺼같아 걱정입니다 ,운동치료
복근 운동 후 복근통증 내공     ,하체 운동을 마치고 나서 복근운동을 하는데 보통 복근운동 마무리로 행잉레그레이즈 자세를 많이 합니다   철봉에 메달려서 하체를 들었다 내리는  복근 운동하려고 하는데 갑자기 복부에 쥐나는 듯하면서 끊어지는 듯한 느낌이 드는 통증과 함께  일이 지났는데 통증이 있네요  통증   손으로눌렀을때 아프거나   행잉레그레이즈자세를 다시 하려면 아픕니다           크런치나 윗몸일으키기 자세시는 그렇게 불편하지는 않아요      이런 통증은 왜그러는걸까요     차도가 없으면 병원을 방문하려고 하는데 어떻게 어디병원을 가야하죠   내과 초음파검사를 해야하나  ,운동치료
전신운동하려는데 최근 혈변도 보고 복부팽창있는거 같아서 장이 예민한거 같은데 장이 예민할때는 하는게 좋다는거 같은데 머리가 예민한건지 장이 예민,전신운동하려는데 최근 혈변도 보고 복부팽창있는거 같아서 장이 예민한거 같은데 장이 예민할때는 하는게 좋다는거 같은데 머리가 예민한건지 장이 예민한지 몰라서요 그냥 운동해도 될까요 오히려 하는게 좋은가요 ,운동치료
운동 식단 질문합니다 ,매일 웨이트 운동을  시간씩  주말에는 보충으로 유산소도  시간씩 더 하며 지내는 사람입니다   인바디상 기초대사량은     kcal로 나오구요   원래 먹는것에 큰 흥미가 없는 편이라 뭐 먹을지 고르는게 항상 스트레스였는데  그 문제도 해결할 겸해서 약  주전부터 식단을 시작했습니다   정확한 영양 지식없이 그냥 괜찮을 것 같은대로 짜서 먹고있는데요   아침   고구마 개  우유 or 그래놀라  우유  간식   편의점 닭가슴살  개  점심   햇반   G  돼지 등심    G  저녁   햇반   G  돼지 등심    G  자기  시간 전쯤 닭가슴살  개  단백질 보충제 한잔  이렇게 먹고 있는데요   급하지 않게 천천히 운동을 통해 체중 및 근골격량을 채워 나가려는 목적으로 괜찮은 식단이 맞을까요    영양제는 멀티비타민  오메가 를 챙겨먹습니다 ,운동치료
통뼈 발목,통뼈인데 발목 얇아지는법 없나요  아킬레스건만아니면 얇은데  ,운동치료
내전근 부상 근육이완제,안녕하세요 햄스트링인지 내전근인지 허벅지 안쪽이 툭하는 느낌이 들면서 엄청난 고통이 느껴지는 거 있잖아요 나았다가 부상당했다가를 한 세번 반복하고 다시 나았는데 그러고 나니까 다리찢기가 안됩니다    다리를 꼭 찢어야되는데 근육이완제 먹으면 좀 수월할까요  그리고 부작용이 있나요 ,운동치료
어깨 짝짝이,제가 운동한지 중간기간 빼면  년이 넘었습니다  저는 분명 오른팔 잡이인데 전면 후면은 왼쪽이 압도적으로 두껍고 측면은 또 오른쪽이 좋습니다 어깨 두깨와 더불어 등도 왼쪽이 더 두껍습니다  그런데 힘은 여전히 오른쪽이 좋고 더 단단합니다  대체 무엇이 문제일까요  참고로 중간기간에 오른쪽 회전근개가 찢어져  개월 가량을 쉬었습니다,운동치료
아침이랑 낮에 다리가 붓는데 아침 일어날때 붓기빼는 스트레칭같은걸 하면 그날하루동안에는 다리가 안붓겠죠   ,학교에서 계속 장시간에 똑같은 자세로 앉아있어서그런가 수족냉증이여서 그런가는 잘 모르겠지만 밤에는 다리붓기가 싹 빠지는데 아침이랑 낮에만 다리가 퉁퉁 붓고 그래서 교복치마도 못입고     그래서 붓기를빼는데 스트레칭을 하면 좋다는데 아침에 붓기빼는 스트레칭을 하고가면 학교에서 다리 상태가 괜찮을까요    괜찮지 않다면 학교에서 붓기뺄수있는 방법 좀 알려주세요  ,운동치료
취미 리듬체조,  학년도 대학 입시가 끝난 고 입니다   수시 합격  평소 유연성이 좋은 편에 가깝고 몸매교정 겸 취미로 유연성과 근력운동을 함께 병행하고 싶어서 취미로 배워보려 하는데 저같은 고등학생이나 성인   대분들 중 요즘 취미로 리듬체조 배우시는 분 계시는지 궁금하고 배우신다면 간단한 후기  알려주실 수 있나요  그리고 결론적으로 추천하시는지 알려주세요  하게 되면 개인레슨을 받을예정입니다   ,운동치료
어께 넓어지는 체조좀 알려주세요 ,어께 좁은거 콤플렉스인데 좀 알려주세요유 ,운동치료
궁금하네요,제가 고  남자인데 몸좋은편인가요  상체 하체 둘다 좋나요  제가 학교에서 몸 제일 좋은편인데,운동치료
발목인대 늘어남 회복기간,내공    드려용    어제 저녁에 계단에서 넘어졌는데 못 걸을정도로 너무 아파서 오늘 정형외과를 가보니까 인대가 늘어났다고 하더라고요 그래서 발목보호대 착용하고 학교 다니는데 어제보다는 걸을순 있긴한데 학교를 다니다보니 학교안에서 자꾸 걸어다녀서 더 심해지진 않을지 걱정이고 다음주 수요일에 약속이 있어서 그때까지 회복할순있을지 그때까지 보호대를 꼭 착용해야할지 궁금해서 올려요   ,운동치료
어깨 크기차이,왜 여기는 비어있죠  헬스는 꾸준히 합니다        내공    ,운동치료
운동과 저녁시간 순서을 어떻게 잡으면 좋을까요 ,   cm   kg 배나온 마른비만 남성이고  체지방감소와 근육증가가 목적입니다   시간의 웨이트와   분의 유산소로 운동 중 입니다         퇴근하여 집 오자마자 운동시작        운동종료 후 씻기        저녁식사        취침  현재 이렇게 하는 중인데 저녁 시 이후의 늦은 저녁식사는 소화기관에 좋지않다 하고  만성위염도 있어 식사를 먼저 해야하나 고민중입니다   만약 선식사 후운동을 한다면 밥먹고 씻으면      는 될것이고   시간은 지난뒤에 운동해야하니            이 운동시간이 될것입니다  그런데 운동하고나면 땀이나니 또 씻어야하는데  연속해서 씻으면 피부가 건조해져서 트러블이 생깁니다  그리고 잠시뒤에 잠을 자야하는데 운동을 해서 수면도 방해가 될것같구요   선식사 후운동은 씻는것과 수면이 문제고  선운동 후식사는 소화기관이 문제입니다    먹는것과 수면은 근성장을 위하여 운동하는것만큼 중요한걸 알기에 고민이 되네요  어느쪽을 선택해야좋을지 조언부탁드립니다 ,운동치료
학생이 하는 운동인데 채력관리랑 학업에 지장 없을까요 ,지금 상체 위주로 운동하는데 특히 팔을 굉장히 열심히 달련중인데 몸통 버리고 팔만 키울까요  여유증 때문에 팔을 달련 후 푸시업으로 가슴을 안으로 집어넣을 생각인데 어떤가요    팔운동   팔굽혀펴기    복근 운동    복근 생성    하체는 근근히 함,운동치료
윗몸일으키기 싯업,발 잡아주는 끈 달린 싯업보드가   cm  너무 짧아서 누우면 등 중간에서 끊기는데    공무원 체력 시험에서 사용하는 싯업보드 는 머리까지 누울 수 있게 충분한 길이인가요     윗몸일으키기 연습할 때 어깨 등을 땅에 닿을 정도로 완전히 눕지 않고 도중에 멈추고 올라가는 건 신체 건강에 어떤  보통의 싯업보다 어떤 추가적인  악영향 을 주나요     윗몸일으키기할 때 무릎은 어느 정도로 굽히는 게 관절건강 에 최선인가요     윗몸일으키기할 때 발바닥 전체는 바닥에 붙여야 하나요 들어야 되나요 어느 게 자연스럽고 좋은건가요 ,운동치료
헬스 루틴,교통사고가 났어가주고 현재 완치는 아니지만 어느정도 걸을수는 있어가주고 헬스장을 다닐려고합니다 루틴 생각한게있는데 이렇게 적당할까요 아니면 수정해야할 부분이있나요  스쿼트 안한이유는 스쿼트를 하면 발목에 무리가 가서 못합니다    양해해주세요,운동치료
불균형 스트레칭,운동  년찬데 왼쪽은 등 허벅지 가슴 큰 근육만 크고 오른쪽은 자잘한 나머지가 더 크길래 몸을 봤는데 오른쪽은 어깨랑 날개뼈가 따로따로 움직이고 왼쪽은 같이 움직이는거 같은데 어떻게 고치죠   스트레칭 가튼거좀 알려주세요,운동치료
헬창  트레이너  헬스마스터 님들 헬프에요 추가 내공    ,안녕하세요  이제 벤치     데드     스쿼트    이제 막    씩 넘은  년차    따리 헬린이 입니다   다름이 아니라  정말 궁금한게 있어서 여쭤봅니다   운동방식은 힘 쎄지는게 좋아서  x  파워게르만님 식으로 리프팅식으로 하고 있습니다   근데  젊은 나이다 보니 몸이 멋지게 커지는 모습도 동경하게 되더라고요   근데 힘이 쎄지고 파워리프팅만의 희열은 놓치기 싫고    아둔한 헬린이의 모습이겠죠   그래서 보디빌딩과 파워리프팅 같이하는 분들이나 루틴은 없나 봤는데  하제용 선수님이 주 회 파맆  빌딩 같이 하시더라고요 예를 들어 월요일 스쿼트날 파맆식으로 하고 돌아오는 스쿼트 하는 요일에 빌딩식 이렇게요   근데 이게 헬린이 에게 오히려 독이 되는지  자세 잘 잡고 꾸준하게 하면 정말 효과가 좋은지 궁금합니다   좋은 방법이라면 왜 다들 안 하실까 당연히 생각도 들고요   아니면 세계적으로 유명한 운동방법님은 헬린이   직장인은 시간도 없으니  대로 전신 잡고 부족한 부분만 보디빌딩 방법으로 채우라 하시는데 이게 더 좋을까요   이방법이라면 파맆  x  하고 부족한 부분 채우면 될까요   친절하고 자세한 답변 부탁드립니다   추가 내공    ,운동치료
허벅지와 정강이가 땡깁니다,오른쪽 다리는 완전 멀쩡하고 이상하게도 왼쪽 다리가 땡깁니다 처음에는 사타구니가 땡기다가 사진처럼 허벅지 저기가 땡기다가 현재는 정강이 까지 땡기네요 정강이는 땡긴다는 느낌보다는 멍든 느낌이네요 토요일에는 평상시 처럼 산 갔다오고 일요일에는 집에만 있었고 월요일에는 학교에서 운동 한게 전혀 없는데 화요일 아침부터 땡기기 시작하네요 운동을 했으면 이해가 되는데 운동을 안했는데 땡기니 이상해서 남겨봅니다  걸어다닐때 많이 땡깁니다 지금은 크게 땡기지는 않습니다 서 있는 상태로 몸을 뒤로 져치면 허벅지 거기가 땡기네요,운동치료
살 찌우는 법,제가 스트레스를 엄청 잘 받고 몸이 약해서 살이 너무 안 쪄요 근데 요 며칠 밥을 못 먹고 힘 없게 지냈더니 몸무게가 원래    였는데   까지 내려가버렸어요    키가    이라 너무 심각한데 혹시 운동이나 식단 좀 알려주실 수 있나요   에서    만들기 하고 있었는데 갑자기 또 확 빠져서 너무 스트레스 받네요  스트레스 받으면 식욕이 너무 떨어지는 타입에다 위장장애랑 과민성대장증후군   뭐 여튼 장이 아픈 거요 다 합쳐져서 맨날 체하거든요 어떻게 할 수 있는 방법이 없을까요    밀가루도 많이 먹으면 안 돼서 건강한 식단으로 알려주세요 틈나면 과자먹기 이런 거 말고요   운동법도 꼭 꼭 부탁드립니다 살이 이렇게 빠지니까 서있는 것도 힘들어요 뼈가 아파서,운동치료
근손실 질문,      키로에서 벌크업후       키로가 되었는데요   개월걸렸어요  지금 유지중인데 원래 하루  끼   닭가슴살    g   프로틴    병  한병당 단백질 최소   그램 최대   그램  먹거든요  최근 일때매 밥을 제대로 못먹었는데 근손실이 나려면 얼만큼 적게먹어야 근손실이 발생하나요 ,운동치료
  대 초반 여자 운동 추천,다이어트겸 근력  체력향상 겸으로 운동을 시작하려고 하는데 일단 저는 필라테스 하고 있고 유산소랑 근력운동이 필요해요 푸쉬업 한개도 못 합니당    제가 생각한 거는 일단 크로스핏이랑 복싱 둘 중에 고민인데 저는 진짜 근력 없는 종이인간이여서 혹시나 부상을 입진 않을까 걱정이 되기도 하네요 둘 중에 뭐가 더 나을까요  다른 운동 있으면 추천해주세요 ,운동치료
벌크업 닭가슴살 질문,      키로입니다   개월전에       에서 벌크업한건데요    키로일때 하루  끼   닭가슴살    G   프로틴      G 병으로된거 하루    병 마셨는데  지금 몸상태 유지하려면 닭가슴살 몇그램 먹어야하나요  하루  끼는 유지해야하나요  그리고 벌크업 더 하려면 어떻게 해야할까요   지금 현재    끼  닭가슴살        G 먹고있습니다,운동치료
도구없이 힘 기르는 법,도구없이 홈트로 힘 기르는 운동 알려주세요  너무 복잡한 건 힘들 거 같아요  ,운동치료
마른체격 운동,제가 약골체격인데요  마른데 배만 나온상태  이런 상태에서 운동을 시작했을때  몸변화가 몇개월 후부터 바뀌기 시작하나요  춤추기  줄넘기  훌라우프로만 했을시에요  여자기준  혹시 추천해주고 싶은 운동이 있다면 말해주세요 ,운동치료
손가락 곪음,엄마께서 손가락이 곪으셔서 병원에서 주사 맞고 약도 드시고 꾸준히 약 바르고 계시는데 손가락에 있는 고름을 다 뺐는데도 엄청 아프다고 하시더라구요 보니깐 고름 있던 자리가 약간 찢어져있는 상태로 작고 볼록하게 튀어나와있던데 왜 이런걸까요    원인이랑 치료법 좀 최대한 빨리 알려주세요 내공    겁니다,운동치료
고등학생 체력운동,이번에 고  올라가는 여학생입니다  이제 시험공부 말고 본격적으로 공부를 시작했는데 요즘따라 힘도 없고 무기력한게 체력이 부족해서 그런것 같아서 겨울방학동안 체력을 기르려는데 산책이나 계단 오르기로도 괜찮을까요  평소에 운동을 하나도 안 해서 동네 뒷산 오르기도 벅차 고강도의 운동은 무리일것 같아요 산책이나 계단 오르기 말고 다른 운동이랑 방법도 추천해주시면 감사하겠습니다,운동치료
줄넘기 잘하는 방법 알려주세용,제가 요즘 줄넘기에 빠졌는데   줄넘기 잘하는 방법 알려주세요 동영상 보고 배우는게 나을까요     어디서 배우고싶어요,운동치료
체지방이 연소될때 에너지 사용 과정  의사선생님이나 운동  영양전문가 답변 부탁드립니다 ,뱃살이나 허벅지에 붙은 지방이 연소될때요 그게 에너지로 사용될때 지방이 녹아서 혈액으로 넘어오나요   그래서 연소되는 순간 혈중 지방농도가 올라가나요 ,운동치료
홈트 근육,허벅지 가늘어지는 운동법  팔 가늘어지는 운동법 이런 운동 하면 오히려 근육이 붙어서 더 두꺼워지고 단단해지는거 아닌가요   어떤 원리로 허벅지 같은 라인이 더 예뻐질 수 있는 건지 궁금해요,운동치료
파워리프팅식 루틴 짜주세요,근비대 없이 힘만 늘리는 게 목표입니다 체격을 많이 키우지 않고 근밀도와 힘만 향상시키고 싶은데 어떻게 운동하면 좋을까요   회 이하로 몇 세트 해야 되는지 알려주세요,운동치료
허리통증 병원가야할까요 ,저번주에 일어날 수 없을 정도로 심한 허리통증이 주말까지 지속되다가 금방 나았어요  근데 이틀 전에 또 허리가 아프더라구요  지금은 전혀 아프지 않는데 사진이라도 찍어봐야할까요  이번이 처음이 아니라서 걱정되네요,운동치료
좌측 새끼 손가락 통증,어제부터 좌측 새끼손가락 마디에 욱씬거리는 통증이 시작하더니  지금은 팔꿈치까지 땡기는듯한 통증이 있다가 없다가를 반복하는 통증이 있어요  무리한 운동및 작업을 한적도 없고 부딛치거나 하는 압박도 없었구요  이건 왜 그런거죠 ,운동치료
뛰거나 눕거나 일어날 때 뒷 목 욱씬거림,목에 근육통이 생긴 느낌이 아니라 뭔가 높낮이가 바꼈을때 일어날때나 누울때  또는 갑작스럽게 뛰거나 활동량이 증가했을때 왼쪽 뒷목이 심장뛰는 것 터럼 욱씬욱씬거리는 증상이 있습니다  왼쪽 뒤통수까지 함께 아픈 느낌이구요 계단을 오르거나 약간 숨이 찬 행위를 해도 약하지만 같은 증상이 생깁니다  왜 그런건가요   ,운동치료
