,0,1,2
54,의학용어좀 알려주세용   ,담낭파열 췌장머리부분 파열 의학용어   ,영상의학과
55,췌장 스크리닝 MRI와 상복부 MRI는 췌장을 보는 것의 정확도가 똑같나요   서울 동작   대후반 남 간담췌 MRI ,췌장 스크리닝 mri와 상복부 간담췌  mri는 췌장을 보는 것의 정확도가 같나요   췌장으루 보는 정확도가 같다면 기왕이면 간담췌로 하고싶어서요,영상의학과
56,복부 mri 문의드립니다,내일 췌장쪽 건강삼아 mri를 찍어보려고 하는데요  시반쯤요 아침이나 점심 먹어도 되나요    Mri 결과는 바로 니오나오  ,영상의학과
57,오늘 뇌 초음파 를 찍었는데요,제가 두통이 좀 있어서 뇌 초음파를 찍었는데요 초음파상 이상은 없다고 하셨거든요 근데 질문이 있습니다    이 초음파로 뇌쪽의 무슨 문제를 잡을 수 있나요  저 사실 제 증상 보고 뇌졸증 같은 개 아닐까 싶어서 갔거든요 근데 제가 간 신경과는 ct가 없어서 초음파를 찍어주셨는데 결과에 이상 없으면 뇌졸증 같은 건 걱정 안 해도 되나요 ,영상의학과
58,CT결과 판독 부탁드려요, 검사명   Chest CT  enhancement 타부위동시  cavitary lesion with adjacent consolidations in LUL    r o TBc  indeterminate nature  rec  clinical correlation bilat  pleural effusion with passive atelectasis of BLLs sub subsegmental atelectasis  RML and lingular division coronary calcification,영상의학과
59,CT  MRI 결과 해석 좀 부탁드립니다   ,CT      No evidence of  hyperdense lesion calcific plaque with mild stenosis at right proximal ICA  and both C  severe stenosis at both M  moderate stenosis at right V   underlying hypoplasia mild  stenosis at right proximal M   left VA os and right P    MRI   sequence   DWI  T FLAIR  T  GRE  enhanced carotid MPA PWI   contrast enhancement   Gadovision   cc   Two DWI high lesions in right pons an right medial T lobe  R o acute infarctions   a few microbleeds in left thalamus   Nonspecific WM change  severe   old lacunar infarctions in both MPVWM  both thalami both pons   No evidence of D P mismatch   Unremarkable caeotid MRA,영상의학과
60,췌장암일까요 ,안녕하세요 다름이아니고     년   월   일 건강검진중 간에 석회화가의심되어 조영제를사용한 복부 골반ct를 촬영하였고 간부분은 중증도 지방간이어서 그리보였다고하고 이상없음으로 나왔습니다  그후     년  월   일경부터 ct촬영후 개월후  등중간부분통증 상복부통증 옆구리통증이 있고 체중도 지금까지 약    개월 동안   키로에서   키로까지  키로가 빠졌고 몸살감기처럼 전신에 힘이없어요 해서 췌장암및 상복부에 암이의심되서 다시 ct를찍고 싶은데 얼마지나지 않아 피폭이 걱정됩니다 이경우 mri로 대체해서 촬영을해더 효영성이 있을지요 ,영상의학과
61,상복부 문제관련 ct 촬영,안녕하세요 다름이아니고     년   월   일 건강검진중 간에 석회화가의심되어 조영제를사용한 복부 골반ct를 촬영하였고 간부분은 중증도 지방간이어서 그리보였다고하고 이상없음으로 나왔습니다  그후     년  월   일경부터 등중간부분통증 상복부통증 옆구리통증이 있고 체중도 지금까지 약    개월 동안   키로에서   키로까지  키로가 빠졌습니다 해서 췌장암및 상복부에 암이의심되서 다시 ct를찍고 싶은데 얼마지나지 않아 피폭이 걱정됩니다 이경우 mri로 대체해서 촬영을해더 효영성이 있을지요 ,영상의학과
62,의학용어 해석 부탁드립니다,부탁드립니다 ,영상의학과
63,복부 mri문의,복부 mri찍으면 장기중에 어디어디 볼수 있나요 전체는 다 못보는건가요 전체는 ct찍으면 볼수있는건가요 두가지 차이점이뭔가요 저는 전체 복부내부장기를 보고 싶은데요    그리고 복부에 자꾸 가스가차는데  ct 찍으면 가스차있는것도 보이나요 의사님 답변좀부탁합니다 ,영상의학과
64,의학용어   ,초음파검사들 어떻게 쓰는지 알려주세요   상복부 초음파 갑상선 초음파 유방 초음파 하복부 초음파 남자  하복부 초음파 여자  각각 의학용어 어떻게 쓰는지 알수있을까요 급해요  ,영상의학과
65,얼마전 직장신경내분비종양 판정 받고 복부ct찍었는데 영상의학과에서는 담낭이 좁게 보인다며 mri권했다고 하더라구요 그런데 제 담당 교수님께서는,얼마전 직장신경내분비종양 판정 받고 복부ct찍었는데 영상의학과에서는 담낭이 좁게 보인다며 mri권했다고 하더라구요 그런데 제 담당 교수님께서는 나이도 그렇고 아무리 생각해도 암은 아닌거 같다며  개월후에 복부초음파 해보자고 하시네요 담낭이좁게 보일수가 있나요,영상의학과
66,뇌 혈관 CT,뇌출혈 시술하면서 뇌  CT를 찍었는데 뇌CT는 고막부분은 아예 안나오는건가요  머리 전체를 찍었다고 했어요 처음에 찍은거는 빈속이 아니여서 조영제 없이 찍었고 나중에 중환자실 가서 찍은거는 조영제 있는 상태로 찍은거에요  여러번 찍었습니다,영상의학과
67,뇌수하체 종양,안녕하세요 현재 군인이고 몇주전 군병원에서 일반 뇌 MRI 촬영을 했습니다  군의관님께서는 다른곳은 이상 없는데 뇌하수체만 한번 더 조영제를 투여하고 셀라MRI 재촬영을 하자 하셨습니다  현재 안검연축  눈떨림  눈감김  눈부심  증상이 있습니다      뇌 종양일 가능성이 많나요      일반 MRI 에서는 뇌하수체의 종양이 잘 보이지 않는건가요      종양말고의 다른 이유가 있나요       만약 뇌종양이 신경을 누르고 있으면 병역판정은 몇급이 나오나요  의무조사 가능성이 많나요      재촬영 후 아무 이상 없는 경우가 있나요 ,영상의학과
68,CT결과 해석 부탁드립니다 , Conclusion     Acute interstitial edematous pancreatitis with peripancreatic and retroperiotneal fluid collections     Probably secondary edematous wall thickening of GB     About  cm R O dermoid cyst in left ovary    Finding    Abdominal pain    Pancreas의 swelling과 peripancreatic fluid collections 있으며 left retroperitoneum으로 extending 하고 있음   Liver에 focal enhancing lesion 없음  GB의 mild edematous wall thickening 있음  Spleen and both kidneys에 이상 소견 없음  Small amount of ascites 있음  Aorta와 IVC 주위에 의의 있게 커진 LN 없음   Left ovary에 약  cm well defined fat density lesion 있음,영상의학과
69,경동맥초음파 결과 해석,경동맥초음파 결과 경동맥프라그 죽상경화반 이 발견되었는데 크기가     cm라고 하네요  이게 혹시 IMT 두께를 의미하는 건가요  아니면 단순히 플라그의 크기를 말하는 건가요   정상 범위를 알고 싶습니다 ,영상의학과
70,혈관 못찾아서 뺐던 바늘을 다시 찌르는게 가능한가요 ,저희 엄마가 요번에 검사를 하고 왔는데 간호사분이 혈관을 못찾아서 뺐다가 그 바늘을 그대로 다시 찔렀다고 하더라고요   MRI찍기 전  조형제 혈관주사 였다고 합니다   그렇게 다시 사용해도 되나 싶어서 질문드립니다  ,영상의학과
71,ct 결과 해석 좀 도와주세요 ,Liver의 morphology는 정상이며 Liver내에 enhancing lesion은 보이지 않음  Low attenuation in sbcyst  Bile duct는 늘어나지 않았음  GB stine      adenomyomatosis pancreas는 정상 BOW의 및 mesentery에 특이소견 없음     cm 이상의 의미있는 lymph node 없음    cm cystic lesion in Lt inguinal area with high density on prescan and contrast leakage  hematoma with active bleeding,영상의학과
72,뇌 검사 조영제 주입 후 mri 촬영  조영제가 뇌까지 돌지 않아   두번 시도 후 담주에 또 하기로  ,연령대는   대중반이시고  거기 쌤들도 의아해 하시면서    이런경우는 거의 없다며  다음주에는 손등말고 발등에 해보고 다시 mri 찍어보기로 했는데  어디가 막혀있어 조영제가 뇌까지 안도는걸까요 ,영상의학과
73,복부mri,ct찍어서 췌장에 혹이 있는걸 확인했는데 복부 mri를 다시 찍었는데요 복부 mri찍으면 장폐색이 있는지도 확인이 되나요 찍을때 확인해달라고 의사선생님께 따로 얘기를 해야하하나요 얘기안하면 췌장쪽만 알수 있는건가요 아니면 복부 전체 소장대장위십이지장 간 신장 다 볼수 있는건가요   따로 얘기안해도 장폐색정도는 알수 있나요 ,영상의학과
74,MRI 판독결과인데   악성인가요 ,직장쪽에 덩어리가 만저져서   작은병원에서 큰병원 가보라고 해서 검사중입니다   이거 중한 병인건가요   metastasis 단어도 도 보이고   답답한 마음에 올려봅니다     MRI Rectum  Diffusion  CE    A lobulated cystic and solid mass lesion at left ischiorectal fossa   heterogeneous contrast enhancement and equivocal diffusion restriction  suspicious anoperineal fistula  anteroposterior  cm x transverse    cm x longitudinal    cm  suggesting neurogenic tumor or solitary fibrous tumor    DDx  metastasis    No ascites or abnormal lymphadenopathy  Otherwise unremarkable  ,영상의학과
75,영상의학 결과보고서 해석 도와주세요,Intervertebral disc가 diffuse한 bulging을 보이고 있다,영상의학과
76,진료의뢰서 해석 부탁드려요   ,부탁드립니다      cm sized irregular mass  close abutting the gb  R   distal gb cancer with direct invasion to hepatic parenchyma  DDX peripheral cholangiocancer  with close abutting the gb       cm sized cepsular mass in rt upper anterior hepatic segment  probably drop metastasis of   lesion   several small low densities in peripheral portion of liver  R   hepatic metastasis  ddx due to mild ihbd dilatation or cysts   CBD dilatation  but no definite visible focal lesion on this ct   large subtle increased density lesion in distended gb body R   sludge ball   fluid in pelvic cabity  cyst in RK,영상의학과
77,담배 폐 사진,이번에 코로나가 걸렸어서 폐사진 찍을려고 하는데요 제가 담배를 하는데 어느정도 폈어야 폐사진에 담배 유무를 알 수있을까요 급합니다,영상의학과
78,발목 mri시 발가락도 나오나요,인대 부상으로 영상의학과 가서 발목 mri 찍었습니다  발의 입방뼈  종족골 국소미세골절과 발목인대 부분파열 진단을 받았는데요   이미 정형외과에  주정도 내원하며 반깁스중이었는데 엄지발가락이 계속 저리고 피가 안통하는 느낌이라서요      보통 일반적으로 발목 mri를 찍으면 발가락도 같이 나오나요    제 진단의 경우 발가락까지 다 찍어봐야 나올 수 있는 건지  진단을 통해 미루어봤을 때 발가락까지 다 찍어본것 같은지   Mri까지 찍었는데 아직 발견 안 된 엄지발가락 이상이 있을까봐 두려운 마음에 질문 남깁니다 ,영상의학과
79,폐ct 검사결과 질문드릴게요,아버지 폐ct 검사결과인데요  소견이 저런데 저게 심각한 수준인가요   담배를 한   년은 피우셔서 폐가 안좋을거란 짐작은 가는데 어느정도 안좋은건지 혹시 폐암 가능성은 어떤지 궁금해요,영상의학과
80,CT확인 질문,만약에 이비인후과에서 ct를 찍었는데 머리같이 다른 곳에서 이상이 발견되면 따로 고지를 해주시나요 ,영상의학과
81,타 병원에서 촬영한 영상검사 MRI  판독 및 검사결과지 판독이 가능한가요   제주   대후반 남 간MRI ,간암 확진 받고 간 절제술을 했습니다  다른 병원에서 촬영한 영상 MRI  및 조직검사 결과지를 들고 또 다른 병원으로 가면 판독을 할수 있을까 해서 문의 드립니다 ,영상의학과
82,자궁근종이 있다고 하는데요   자궁 적출수술을 꼭 해야 하나요   천안   대후반 여 자궁근종 ,생리통이 심해서 병원을 방문했는데 근종이  cm정도와 cm정도  개가 있다고 합니다   진료당시 의사선생님께서 첫번째로 자궁수술 하게된다면 자궁이 없음   그리고 호르몬 치료를 권했는데요     그런데 어제 허리통증때문에 MRI촬영을 하였는데  MRI상에 자궁근종이 크다고 산부인과 가보라하더라구요    자궁적출수술을 꼭 해야 될까요  MRI상에서도 자궁근종이 찍히나요     고민에 올려봅니다 ,영상의학과
83,남성 골반울혈증후군 진단은 어떻게 하나요   서울 송파   대중반 남 골반울혈증후군 ,자위로 사정후 좀 강하게 쥐고있었는데 발기가 정상적으로 풀릴듯 하다가 갑자기 음경과 골반쪽으로 혈액이 들어가는 듯한 위화감이 들었고 놀라서그런지는 모르겠지만 평소와 다르게 급격히 발기가 풀리고 위화감이 있었던 골반옆에 살짝 묵직한 느낌이 느껴졌습니다   비뇨기과에서는 정계정맥류로 보이지도않고 특별히 문제있다는 얘기가 없어서 항생제와 소염제 처방을 받고 돌아왔는데 위화감이 있는 한쪽골반 부터 치골 허벅지까지 혈관을 따라가듯이 묵직한 느낌과  욱신거리는  따가운  약한 통증이 왔다갔다합니다   증상발현 이후로 발기시 강직도가 평소보다 낮고 잘 발기하지 않는 느낌도 듭니다   손으로 누르거나 했을때 따로 통증은 없고 자세에 따른 통증 변화도 없는 것 같습니다   인터넷으로 알아보다보니 비슷한 사례도 안나오고 느낌상 혹시 과도한 혈압증가로 정맥 판막에 손상이 생긴것이 아닌가하여 질문합니다 ,영상의학과
84,영상 판독지 해석 부탁드립니다 ,Liver right lobe anterior segment에 compact하게 lipiodol uptake되어 있는 long diameter   cm size의 mass가 있고 그 주위로 perinodal daughter nodule이 있음  그 외 liver에 faint한 multifocal staining이 있어 이는 parenchymal staining으로 생각되고 daughter nodule의 evidence는 없음  TAE에 의한 complication 없음   결론    Single nodular hepatoma  right lobe anterior segment     No TAE complication ,영상의학과
85,의학용어 질문이요   신경계 ,impression에 EDH FP Rt  SDH A FTP bilateral Hmr contusion F  FX Skull FP Rt 이렇게 써있는데 검색해도 안나오고 도저히 모르겠네요 FP는 전두엽과 두정엽같은데 특히 SDH A FTP bilateral Hmr contusion F 이부분 해석을 못하겠어요,영상의학과
86,혈관 도플러 초음파 경동맥 방사선검사 해석 부탁드려요,해석 부탁드립니다,영상의학과
87, 월  일 비파열성 뇌동맥류 코일색전술 시술예정인데 현재복용중인 고지혈증약 병원처방  과 오매가  끊어야 하는지요  , 월  일 비파열성 뇌동맥류 코일색전술 시술예정인데 현재복용중인 고지혈증약 병원처방  과 오매가  끊어야 하는지요  ,영상의학과
88,MRI 판독,MRI 결과 사진 입니다  혹시 판독소견지에  multiple small high SI lesions are seen at both cerebral WMs on the FLAIR and T WI  라고 나왔는데 이 말이 사진처럼 보이는 부분을 말하는건가요  주치의는 다발성 경화증이라고 하면서 검사를 더 받아야 한다고 하는데 맞는건가요 ,영상의학과
89,신검 검사 받으러갔는데 척추측만증,제가  년전에 병원해서 척추측만증   도 였는데 이사람이 수술받은적있냐해서 없다했는데 다음으로 가라해서 갔다가 결과나왔는데  급이 나왔습니다  엑스레이 확인도 안한거같고 대학교 수업 때문에 일단 나왔는데 나중에 다시 가서 재검사 해달라 하면 가능할까요 ,영상의학과
90,MRI 검사결과 해석 부탁드립니다,Consistent with Lt bresat cacer with axillary LNE Lt upper outer breast에   cm less enhancing mass 보이며 axillaryLNE보임,영상의학과
91,폐 엑스레이 진단검사결과지 해석 부탁드려요,코로나로 인한 폐렴 진단 받고 세번째 엑스레이 촬영 후 진단지입니다   지난 두번째 촬영과 비교해봤을때 뚜렷한 변화가 없다는 내용이 맞을까요  아시는분 해석 부탁드려요  ,영상의학과
92,의학용어 해석좀 부탁드리겠습니다  chest x ray검사 결과입니다 ,안녕하세요 chest x ray 검사결과인데 이해를 못해서 질문 올립니다  진단은 흡인성 폐렴입니다    Central venous line insertion state  Tracheal intubation state  Diffuse haziness in LLL  Mild haziness in both lung  Marked scoliosis of thoracolumbar spine  R O Collapse of LLL  Pulmonic congestion   감사합니다,영상의학과
93,의학용어 해석 질문 드립니다 ,Parenchymal tissue loss with surrounding minimal high Si area in anteroinferior portion of bilateral frontal lobes  문장 해석 부탁드려요   그리고 isointense 등신호와 Si가 무슨 의미인지 이해가 안 가요 설명 부탁드립니다  ,영상의학과
94,방사선사 법규 질문,이 문제 정답 좀 부탁드리겠습니다   ,영상의학과
95,뇌졸증이 살짝 왔다가 멈춘상황도 뇌mri에 나오나요 ,저희아빠가   세  코로나 확진으로 자택격리중 갑자기 걸음을 잘 못걷고 말도 어눌해지며 손을 조금 떠는 현상이 일어났어요  보건소에 연락했더니 뇌졸증 초기증상 으로 보인다고    불러서 코로나 지정병원 응급실로 가보라고 조언을 해주셔서 바로 전담병원 응급실로 가서 피검사  뇌MRI 와 CT를 찍었습 다  의사선생님 소견은 불행중 다행으로 뇌는 깨끗한데 위의증상은 아마도 기력저하로 보이는데 산소포화도가 낮아서 흉부X레이 찍었는데 폐렴증상이 있어 감염병동에 입원 치료에 있어요  여전히 말투도 어눌하고 걸음도 못걸으시고   혹시 경미한 뇌경색이였더리도 MRI상에는 나오는지요  또 퇴원해서도 계속 활동이 어려우면 병원 무슨과로 가서 치료를 받아야 하는지    불과  일전에는 저보다 더 잘 걸으셨는데   ,영상의학과
96,췌장 스크리닝 mri 하고 싶은데 궁금한점 알려주세여,  mri 있는  차병원가서 췌장mri스크리닝 접수하면 되나요     mri    t      t 있던데 어떤게 좋고   비용차이가 있나요     판독은 바로 검사후 바로 판독을 해주시나요     등쪽 통증과 명치 답답에 소변거품 많이 나오는데 mri 건강보험 적용 될까요     부산쪽에 췌장 mri스크리닝 잘보시고 판독 잘하시선생님이나 병원좀 알려주세요 지방이라 정보가 없어요     간 담도 같은 곳도 부분 스크리닝이 가능 한가요 ,영상의학과
97,헤어롤 하루종일 말고 있으면,앞머리 내려가는 게 불편해서 헤어롤 하루종일 말고 있는중인데 계속 말고 있으면 뭐 어캐 되나요   곧 씻을거임 씻으면 원래 머리로 돌아오나여,영상의학과
98,방사능 키 질문 내공   ,안녕하세요   살 남학생입니다 제가 팔이부러져서 ct x ray를 많이 찍게 되었는데 키 가 안 큰다거나 지정이 있나요 그리고 보통 몸에있는 방사능은 없어지는데 몇일정도 걸리나요  ,영상의학과
99,일산동구 흉부 x ray,일산동구 흉부 엑스레이 찍을 수 있는 병원 있나요  코로나 격리 끝나면 찍어보려고요,영상의학과
100,방사능 키 질문,제가 어제 ct를 찍었는데 키에 지장이 가나요  그리고 몸에있는 방사능을 없앨려면 어떡해 해야하나요  ,영상의학과
101,종합검진 문의 드립니다 ,종합검진 내용 밑에 패기지 상품인데요  제가 암관련된거 검사를 다 받아보려고 하는데   밑에 패기지 상품에  위암  대장암 간암 등등 을 검사받을수 있는 항목이 포함된건가요     폐기지 상품 고급형 대장수면내시경 동맥경화도 초음파  부위 ct  부위   mri 부위   초음파  부위 선택 ct  부위 선택 mri  부위 선택 뇌 mri 요추 mri 경추 mri,영상의학과
102,건강검진 결과서에 뇌 MRA 결과좀 봐주세요,저렇게쓰여져 있는데 무슨말인지 모르겠어서요   우측대동맥 분지가 좁아져있다는데 어떤건지 척추동맥의 형성부전이 뭔지 알려주세요  일단 대학병원 예약 잡아놓긴 했는데  월이 가장 빠른 진료라서   빨리 진료 봐야하는걸까요 ,영상의학과
103,뇌 MRI,군병원에서 뇌 MRI 촬영결과 군의관님이 보시더니 뇌하수체 MRI 정밀검사를 해야할거같다고했습니다  뇌하수체에 종양일 가능성이 큰가요  현재 안면연축 증상이 있습니다 ,영상의학과
104,MRI MRA 판독 소견서 결과지,MR    T Brain MRI MRA IC  MRA Ne  Diffusion 소견 no abnormal high SI lesion is seen at brain parenchyme on DWI multiple small high SI lesions are seen at both cerebral WMs on the FLAIR and T WI pituitary gland and stalk are not remarkable ventricular system is not dilatated Cortical sulci are not prominent  Clival fat and cerebellar tonsil are not remarkable  On SWI  no abnormal low SI lesion is seen at brain parenchyme  On  D TOF MRA  no abnormal vascular outpouching or narrowing is seen at intracranial arteries  The both carotid arteries are not remarkable   conclusion 결론 no diffusion restricted lesion Small vessel disease with mild leukoaraiosis at both cerebral WMs  No microbleed  No ventriculomegaly  No cerebral cortical atrophy  Unremarkable brain MRA  Unremarkable both carotid MRA   라고 나왔습니다  주치의 말로는 다발성 경화증이라는데 맞나요     다발성 경화증으로 검사를 더 해봐야 한다고해서 PFO test  난원공개존증 을 해봐야한다고 하는데 어지러움으로 인해 MRI 검사를 했습니다  회전성 어지러움도 아니고 일상생활에 지장이 생기는 어지러움도 아니고 코로나 백신 차를 맞고난 뒤에  개월째 비회전성 어지러움이 생겨서 찍게되었습니다  주치의는 설명도 제대로 안해주고 MRI 결과 사진도 보여주지도 않고 그냥 다발성 경화증이라고 하네요  저도 나름 병원에서 일을 하는데 많이 알아보고 찾아봤는데 판독하는 의사분이랑 진료보는 신경과 주치의랑 결과가 다른거 같아서요 과잉진료인지 궁금합니다  대학병원에서 했습니다 ,영상의학과
105,CT 판독결과 해석,Undrelying hepatomagaly  Alcoholic liver cirrhosis  No focal lesion in liver  And others no abnormal findings in abdomen ,영상의학과
106,제 무릎 MRI 판독보고서 해석 좀 부탁드립니다 ,영상의학과에서 MRI 찍고 제 무릎 연골이 두군데 파열되었단 설명을 들었는데요  그 당시에는 제가 무릎에 대한 지식이 전혀 없기도 하고  두군데나 파열되었다는 말에 당황하여 그런지  듣고도 어느 부위가 파열됐는지 잘 모르겠어요   보존치료를 하더라도 정확히 어느 부위에 얼마만큼 파열됐는지 그리고 파열 양상 같은걸 알고 나야지 치료방향을 정할수 있을거 같아서 판독지 해석할수 있는 분께 부탁드리고자 합니다  자세한 설명 좀 부탁드립니다 ,영상의학과
107,Mri 판독지 해석 부탁드려요,무릎이 자꾸 낫지 않아서 MRI를 찍었는데요  다니던 병원 의사 선생님이  주일간 휴가라고 하시네요     판독지 보시고 해석 부탁드립니다   FST Wt and PD Wt sagittal and coronal images and T Wt axial images      Bone and joint    Local tear of articular cartilage at center of lateral tibial plateau without subchondral bone signal change     Spared lateral femoral condyle  medial tibiofemoral joint   patella     Some amount of joint fluid collection     Ganglion formation at posterior of PCL     Otherwise  no remarkable abnormality      Ligaments     ACL         PCL         MCL         LCL         Menisci    MM        LM         Muscles   tendons    no remarkable abnormality    결론      Focal tear of lateral tibial plateau cartilage      Some joint effusion with PCLganglion formation     부탁드립니다 ,영상의학과
108,어깨엑스레이,어깨아파서 엑스레이찍었는데 정상인건가요  원래저렇게 떨어져있나여 ,영상의학과
109,복부 초음파 검사 결과 원래 늦게 나오나요 ,복부 초음파 검사는     년도   월 말쯤에 받았는데     년에  월달 쯤에 갑자기 작년 복부 초음파 이상소견으로 추적검사가 필요하다는 문자를 받았습니다  이런 경우도 있는건가요 ,영상의학과
110,암 진단,내시경 없이 ct mri 초음파 등으로 암 진단할수 있나요 ,영상의학과
111,충수염 ct랑 초음파,충수염 증상 있을때 ct촬영되는 건 알고 있믐데 초음파도 가능한가요  시티는 너무 비용이 부담돼서요 초음파 검사로는 안되겠죠  시티는 보험처리 하면 어느정도인가요 ,영상의학과
112,일반 뇌mri로 청신경종양알수있나요 ,이명 원래 갖고있었는데 최근에 너무심해지고 몸도안좋아져서요 대학병원 말고 일반 뇌mri로 싸게찍고싶은데 청신경종양mri는 따로있나요 아니면 일반 뇌mri로 다 볼수있나요 ,영상의학과
