,0,1,2
113,뇌mri 판독지 해석 부탁드립니다,두통이 너무심해서 진통제도 먹었는데 나아질 기미가 안보여서 뇌mri를 찍었는데 급하게 검친센터에서 찍어서 판독지만 받았습니다  판독지 해석좀 부탁드릴께요 ,영상의학과
114,경동맥초음파 판독부탁드립니다, Compared with previous Carotid US on           Focal calcified plaque  Rt  proximal ECA  increased size  Focal small smooth plaque  Rt  proximal ICA  new   image    Smooth plaque  Lt  carotid bulb     stenosis in diameter   equivocal change   IMT intima media thickness      mm slightly increased   bilateral  ICA CCA PSV ratio  within normal limit  bilateral ,영상의학과
115,경동맥 초음파검사결과지 설명좀해주세요  ,아버지께서 건강검진차 경동맥초음파검사 받으셨는데 협착이 있다고 합니다  검사결과상 현재 상태가 많이 안좋은 상태인건지 걱정스러워 문의드려봅니다 ,영상의학과
116,방사선 MRI,방사선학과를 나온 방사선사가 mri 도 찍을 수 있나요 ,영상의학과
117, 년 정도 지방변을 보고 있는데 췌장에 문제가 있을지도 모른다고 합니다   MRI 검사해도 될까요   경기 성남   대중반 여 췌장 MRI ,제가  년정도 지방변을 보고 있습니다  괜찮을때도 있긴 하지만 요즘엔 지속적이고 예전에 비해서 부쩍 몸도 누렇게 변했고요  만성 복부팽만도 있어요  위 내시경 했을때 증상이 심하지않다며 이것때문에 복부 팽만은 아닐거라고 함   췌장에 문제가 있으면 나타나는 증상들 이라고 하는데  작년 가을쯤에한 복부초음파는 이상이 없었고  병원에 검진차 mri를 하고싶은데 문진 없이 예약 하고 진행 하면 될까요  ,영상의학과
118,MRI 사진입니다 진짜 문제가 있는건가요,최근 어지럼증과 현기증이 발생되어 MRI를 촬영하게 됐는데 수술을 말씀 하시길래 은근히 걱정되네요  사진을 보시고 의사선생님의 고견을 듣고싶습니다  감사 합니다,영상의학과
119,뇌 mri 치아 교정,제가 오늘 뇌mri를 찍으러 병원에 갈 예정인데요  mri를 찍을때 쇠붙이 같은게 있으면 안되는걸로 알고있는데 이빨 안쪽에 붙어있는 치아교정기도 mri를 찍을 때 문제가 될까요   정확한 답변 부탁드립니다 ,영상의학과
120,두경 skull 촬영 질문,이 사진에서 잘못된 부분이 있다고 지적해주셨지만 뭐가 잘못됬는지를 안알려주시고 직접 찾아보라는데 아무리 봐도 모르겠어서 부탁 좀 드릴게요   ,영상의학과
121,MRI를  번이나 찍었는데 이석증이 재발한 것 같아 걱정됩니다  MRI는 뇌에 무해한지요   서울 동작   대중반 여 MRI ,안녕하세요  최근  월    월 사이  뇌 mri 를  번 찍게 되었습니다   조영제 X      월 초 건강검진       코로나 감염 후 손발저림 심해 혈전 걱정되어       머리 부딪힘으로      두통 심해       또 머리 부딪힘으로  항응고제 복용중이라 머리를 부딪히고는 출혈이 걱정되어 mri 를 찍다보니  번이나 찍게 되었습니다     전부 결과는 이상 없었으나  개월 사이 뇌 mri 한 부위만 집중적으로  번이나 찍은게 마음에 걸립니다  심지어 마지막  번은  일간  번 찍은거라 더욱 걱정됩니다    번째 mri 찍은날부터 이석증이 약하게 재발한 듯한 느낌이 들어 더 걱정되는 듯 합니다  이런 경우에도 mri 는 뇌에 무해한지요    그리고 앞으로도 건강검진 목적으로 뇌 mri 를 찍어보는 것은 괜찮을까요    답변 주시면 매우 감사하겠습니다  잘 부탁드립니다,영상의학과
122,정계정맥류가 의심됩니다   전주   대후반 남 정계정맥류 ,정계정맥류가 의심되는데요   비뇨기과 병원가서 검사를 했는데  갈때마다 긴장해서 혈관이 수축해서 그런지 검사가 정상적으로 안되서 정상으로 나오네요   따뜻한 물로 샤워할때  엄지      마디 정도 왼쪽 음낭이 쳐집니다    정상적으로도 원래 약간의 차이나는것은 알고 있어요    혈관다발들이 만져지며  왼쪽 사타구니 허벅지안쪽 대퇴골위치 느낌상  그부위에 당기는 통증이 계속 지속적으로 있는데요   당기는 통증같은 느낌때문에  일상생활을 계속 방해하네요   현재같은 상황인데  의료기관에 방문하면 정계정맥류확인하고  바로 인터벤션치료 가능할까요   따뜻하면  왼쪽음낭이랑 오른쪽음낭이랑 높낮이  혈관이랑 확연히 차이나는데  긴장하고  수축하면 안잡히네요   발에 복숭아뼈 아래쪽으로 모세관 정매류 약하게 있는데 같이 치료 가능한가요 ,영상의학과
123,Brain tumor 랑 Brain neoplasm 차이점,Brain tumor 랑 Brain neoplasm 차이점이 뭔가요   ,영상의학과
124,ct판독해주세요,이글증후군인건알겠는데 뇌에 문제 생긴건지알려주세요    년도에 우측 중대뇌동맥으로경색증발병이력있습니다  새로운뇌동맥류가발견된게아니면 천천히진료보려고합니다   Clinical information  r o SMG stone  r o Eagle syndrome  Finding  About     cm sized calcified right stylohyoid ligament  distal portion      Compatible with Eagle syndrome  right  No visible radiopaque stone in bilateral submandibular glands and ducts  Localized cerebromalacia in right temporal lobe of scanned brain  known old infarction  with luminal narrowing of right paraclinoid ICA and proximal MCA ,영상의학과
125,어렸을때 교통사고로 머리다치고 최근에 찍은 뇌mri결과,제가 어렷을때   년 전에 교통사고로 머리를 다쳣엇는데 회사에서 건강검진을해서 뇌 mri를 찍었었는데 결과가 저렇게 나왔었는데 국소뇌연화증이 먼가요    지금은 제가   대중반이고   대 중반까지 교통사고휴우증이잇다가   대 중반이후엔 아예없었거든요 그럼 괜찮은게 맞는건가요  ,영상의학과
126,건강검진 결과 이게 무슨 말인가요 ,  복부 CT   췌장 두부와 간의 고음영병변   내과 진료 및 정밀검사 요함      뇌 MRI   우측 측두엽에  mm크기의 저신호강도 병변 해면상혈관종 의증  신경외과 진료 요함   아버지 건강검진 후 문자가 왔는데 심각한걸까요 고음영병변  저신호강도병변 해면상혈관종 의증   무슨 뜻인가요 쉽게 설명좀부탁드립니다,영상의학과
127,뇌MRI 촬영 전 가다실 ,뇌 MRI 촬영  일쯤 전에 가다실  예방주사 맞아도 상관없나요  혹시나해서요  ,영상의학과
128,무릎 mri 판독지 해석 부탁드립니다  ,무릎 mri 판독지 입니다  병원 업무가 마감되면서 의사선생님의 설명을 듣지 못했습니다  판독 부탁드립니다 ,영상의학과
129,병리보고서 확인좀해주세요,온통 모르는 용어라 이해가 잘안가요,영상의학과
130,생후   일 아기 머리 씨티,찍어더 괜찮나요   ,영상의학과
131,췌장 기형    ,안녕하세요   살 남자인데요   제가 사정이 있어서 조영제는 안넣은 일반CT를 찍었는데요   근데 CT에서 췌장이 약간 삐뚤어져      있다고 하네요     의사는 췌장이 사람마다 달라서 삐뚤어져있어도 이상한건 아니라는데 왜 췌장이 삐뚤어져있을까요    췌장 기형인가요     ,영상의학과
132,mri 판독지 설명 좀 부탁드려요,무릎이 좋지 않아 mri 촬영을 했는데 설명이 너무 빨라 못 들었어요   설명좀 부탁드려요,영상의학과
133,임산부인데 파노라마 때문에 질문드려요,안녕하세요 제가 임산부인데   주차  치과에서 근무하고 파노라마를 찍습니다  파노라마 조사 할때는 차폐문 차폐유리 때문에 엑스선이 통과가 안되는거는 알고 있습니다만  찍고나서 안에 바로 들어가는데 잔여 방사선 남아있는지 궁금합니다   어떤분은 없다고 하시고 어떤분은 소량 남아있다고 하시고  하루에도 몇번씩 찍는데 걱정이 너무 됩니다   파노라마 찍고 바로 들어가도 방사선이 남아있는지 태아에 영향은 없는지 궁금합니다,영상의학과
134,초음파  ct 결과지 두 문장만 봐주세요,Imp      Known Rt thyroid cancer  clinical staging T  R O N  a  K TIRADS       mm   imp  several small lymph nodes at Rt  Supraclavicular area and both upper paratracheal area  R O indeterminate  이 두문장은 인터넷에 쳐도 안나오고 파파고 돌려도 무슨말인지 모르겠어서요   해석 부탁드립니다   ,영상의학과
135,이거 해석 좀 해주세요  ,Pleural effusion  both  right     left  and right interfissural effusion Passive ateletasis  right basal Multifocal pneumonia  both Left paratracheal LN enlargement GB stone,영상의학과
136,의사선생님들 이게무슨 사진인지알려주세요 대충아는건 복부쪽인걸로 알고있어요,전문의 의사선생님들 이게 무슨사진인지알려주세요 mri인지 ct인지 뭔지모르겠네요,영상의학과
137,Mri 판독,이게지방종 이라는건가요  여러개   근데 경계불분명하다는데 지방종은  경계가분명하지않나요   조직 검사하러 내원하라는데 걱정이되서요 지방종 인데 조직 검사를왜하나싶기도 하고,영상의학과
138,뇌출혈 진단하는 방법이요,Mri 촬영할때 조영제를 넣어야지만 뇌출혈 여부를 알 수 있나요 ,영상의학과
139,췌장 결절의 크기변화가 없는경우 대처법 ,췌장몸통에 mm 결절이초음파상 발견되어 ct 촬영 결과 나타나지 않아서  개월후 다시초음파상 크기 변화가 없는경우 입니다  이후 대처법이 궁금 합니다,영상의학과
140,등과 옆구리 통증이 있고 살이 빠졌습니다  불안한데 MRI 촬영을 해도 소용 없을까요   서울 동작   대후반 남 MRI ,안녕하세요  다름이아니라     년   월   일 건강검진도중 간에 결절이 보인다하여 당일 조영 복부ct를 찍었습니다 찍은 결과는 간에결절은 낭종으로 보이고 양쪽부신에 선종이 있다는 이야기를 들었습니다 그후 대학병원에서 추가 검사 후 비기능성 선종으로 진료 받았습니다   그런데 올해  월 중순부터 등쪽 통증과 옆구리가 땡기는증상이 있어  월 말에 건강검진을 하였던 병원에 내원하였으나 작년에 찍었던 조영복부ct상으로 이상 이상이 없으니 추가 mri등의 촬영은 불필요 하다고 말씀하십니다   아 그리고 이런걱정때문인지는 모르겠는데  월중순부터 현재까지 체중이 원래      kg인데      kg으로 감소하였습니다  이경우 등과옆구리통증으로 불안한데 추가 mri촬영은 실효성이 없는지요 ,영상의학과
141,자궁근종 하이푸 가능할까요  복강경 전신마취는 피하고 싶습니다    서울 강동   대중반 여 자궁근종 하이푸 ,  제왕절개   번했는데  하이푸 시술 가능할까요     오른쪽에서 난 혹이 배 앞 쪽으로 초음파상   cm  체감상 더 클것 같습니다      cm이상    년 전엔 큰 것 밑으로  cm 자잘한 것도 몇 개 보였는데  없어진 건지 숨은 건지 이번엔 안 보입니다   이 정도 크기도 하이푸 가능할까요     하이푸 가능하도록 뱃살은 뺄 수 있습니다      자궁동맥색전술은 안하고 싶고  복강경 전신마취는 피해보고자 간절한 마음에 올립니다 ,영상의학과
142,측두골Ct뇌혈관 MRI,이명때문에 ct랑mri를 찍을려고 하는데 측두골ct는 어디를 찍는건가요 그리고 뇌혈관 MRI 를 찍게 되며는 뇌종양 그런것도 나오나요,영상의학과
143,무슨 증상일까요  ,재가 몇주전부터 다리가 계속 저리고 답답하고 무거워서  병원에갔는데 엑스레이만찍고 척추 휘었다해서 약받아와서 약을 먹었는데도 막 다리도 붓고 뭔가 제다리가 아닌것같이 감각이 없어진것같고 손도 막 팔신경도 뭔가 제 손과 팔이 아닌것같고 이거뭐죠 대체    왜갑자기 다리가 이런걸까요    ,영상의학과
144,간호기록 검사결과 질문,검사 결과가 chest   abd CT angio   G    이렇게 나오면 무슨 의미인가요    ,영상의학과
145,temporal bone ct 측두골 ct 검사결과,측두골 검사 결과 해석 부탁드립니다  mastoid sclerotic middle ear cavity soft tissue filling     ossicle intact scutum intact tegmen intact  이상소견이 있으면 알려주세요   ,영상의학과
146,신장질환으로 스테로이드 치료를 받고있는데 치료 중에 간 프리모비스트 MRI 찍어도 되나요   광주 동구   대초반 여 간 MRI ,현재 IgA신증으로 신기능과 여과율은 정상  고용량 스테로이드 치료를 하고 있는데  월에 치료는 끝날 예정이에요   치료중에 간 프리모비스트 MRI 찍을 수 있을까요      년부터 AFP수치가     사이로 작년에 CT도 이상이 없다 하지만 불안해서 MRI찍어보고 싶어요 ,영상의학과
147,허리  엉치뼈에 암이 전이되었는지 조영제 안넣고 찍은 mri로도 알수있나요 ,허리  엉치뼈에 암이 전이되었는지 조영제 안넣은 mri로도 알수있나요  조영제를 안넣고 mri 찍으면 허리  엉치뼈에 암이 전이되었는지 알 수 없는건지 의사선생님의 답변 부탁드릴게요 ,영상의학과
148,Ct촬영시,주파수 파장  방사능 양을 조절할수있다고하는데요 궁금한게 찍어주는사람이 실수나 고의로 높게 올리고 촬영할경우 이거를 숨기게되면 환자입장에서 알수있는방법이없나요  나중에라도 알수있는방법이없나요 높게올려서찍고 정상치로 했다고 그만이 아닐까 싶어서 불안하네요,영상의학과
149,뇌 ct 이상없으면 mri,뇌 ct검사에서 이상없으면 mri 안찍어도 되는건가요 ,영상의학과
150,해석해주시면 감사하겠습니다   ,과제를 하는데 해석이 안되서 여기에 도움을 청해요     varicose to cystic bronchiectasis in RUL and RLL   Diffuse ground glass haziness in  RML and RLL   aspirated blood   no LNS enlargement in mediastinum and both hilum    Fibrosis and bronchiectasis in RUL     R O  old pulmonary TB    Mild cardiomegaly    otherwise  no active lesion in lung     follow up examination show slightly improved pneumonic  right lower lobe     otherwise no visible changed   알려주시면 감사하겠습니다 ,영상의학과
151,X ray 테크니션 vs mri 테크니션,미국에 거주중 입니다  기술학교에 입학 하려 하는데 둘중 하나만 고를수 있다면 어떤 기술을 고르는게 좋을까요 ,영상의학과
152,병원에서 X레이 찍은 사진 못 봤나요 ,병원에서 X레이를 돈주고 찍는데 X레이 촬영한거 못 가져가나요  큰병원으로 가보라고 소견서 써주고 X레이 찍은 사진은 복사해서 받는 비용이     원이 든다고 하네요  X레이 촬영을 만원주고 찍었는데 복사비용    원을 내야되는게 맞나요  내가 돈주고 X레이 촬영했음 당연히 받게 되는게 아닌가요 ,영상의학과
153,뇌혈관코일색전술후방사선으로인한탈모가온지석달째입니다 일부머리가비어있어넘초라해보여펌을하려하는데해도될까요 혹시머리가다시나는데지장을주거나부작용이생기진않,방사선탈모,영상의학과
154,전립선비대증 수술했는데도 왼쪽 고환통증이 지속됩니다   수원 고등동   대초반 남 전립선비대증 ,    년  월경  회      년  월경  회  전립선 비대승수술  회  시간차로     년   월경 요로결석수술을 했습니다   고환통증과 소변줄기가 약하고 소변을 자주 봐서 진료를 또 받았는데  진료후 소변줄기 및 자주 소변을 보는 증상은 많이 개선이 됐습니다   그런데 왼쪽 고환통증은 그대로입니다   앉아있는시간이 약  분정도 지나거나  겨울엔 통증이 덜한데 날씨가 따뜻해지면 고한이 늘어지면서 통증이 더 심해집니다   통증이 발생시 퇴행성 근육통 연고제를 바르면  통증이 가라앉곤 합니다   이유가 무엇일까요 ,영상의학과
155,영상의학과 판독좀 부탁드립니다 ,판독 부탁드립니다  바로 채택 해드리겠습니다 ,영상의학과
156,비파열성뇌동맥류시술관련,지난달 건강검진에서 뇌동맥류    mm발견 되어 큰병원가 가보라해서 대학병원 전문의 상담후  월  일 코일색전술시술 예약된 상태입니다 어제 건강검진 종합판정 결과지를 받았는데 동맥경화검사결과 혈관의 탄력이 감소된거루 나왔구요 경동맥초음파에서는 우측 경동맥분지부 섬유지방성 경화반     cm 있다고 진단받았는데 이런 상황에서 코일색전술 시술 진행 해도 될런지 문의드립니다,영상의학과
157,병원 영상자료 cd,X ray mri 찍고 영상제출할게 있어서 cd로 받았는데 둘다 들어있나 확인할수 있는방법있나요 ,영상의학과
158,임신 중에도 하이푸로 자궁근종을 치료할 수 있나요   서울 강동   대중반 여 자궁근종 ,안녕하세요   현재 임신   주차 입니다     주차 부터 아랫배 튀어나온 부분에 일상 생활이 불가능할 정도로 고통이 극심하여 응급실에 다녀왔는데요   임신 호르몬때문에 자궁근종이 커져서 현재 자궁근종이 사이즈가         cm 라고 합니다   태아와 산모에게는 문제가 없으나 고통은 지속될거라고 하는데 타이레놀도 효과가 그닥 없습니다   혹시 임신 중에도 안전하게 하이푸로 자궁근종 치료가 가능할까요  임신중 자궁근종 고통을 완화할 수 있는 방법이 궁급합니다   감사합니다     ,영상의학과
159,췌장 MRI상 문제가 없었다면 담낭  담도  담관 쪽에는 문제가 없는 건가요   수원   대초반 남 췌장 MRI ,얼마전 췌장 스크리닝을 했습니다   결과상 문제는 없었는데  대변이 자꾸 연한 노란색으로 나와서   담즙 폐쇄 와 관련이 있나 무섭네요     복부초음파  상 문제가 없었고  췌장 mri 상 문제가 없었다면  담낭 담도 담관 쪽에는 문제가 없다고 생각해도 될까요   아니면 다른 추가 검사가 필요한 상황일까요   복부초음파 상 잘 안보이는 부분이 췌장 mri에는 나온다고해서  나름 생각을 해서 복부초음파 췌장mri로 선택을 했던건데  제가 의학적 지식이 없다보니까 걱정이 되네요   답변 부탁드리겠습니다 ,영상의학과
160,angio   ,angio   는 무슨 뜻인가요 ,영상의학과
161,소뇌출혈에 의한 소뇌위축증 궁금합니다,소뇌에 출혈이 생기면 mri상 소뇌가 위축되어 보이는 건가요  아니면 출혈이 생겨 소뇌가 위축이 된건가요   아니면 출혈과 별개로 위축이 되는걸까요      소뇌출혈이 있으면 무조건 소뇌위축증인지 궁금합니다   신생아 입니다 ,영상의학과
162,뇌mri cd복사한거,a병원에서 복사한거 b병원에서쓰면 c병원에서는못쓰는건가요 궁금합니다,영상의학과
163,심각한건가요   ,부모님 ct결과판독지인데 심막낭종이 신경쓰여서요   안좋은건가요  Small right pericadial cyst    cm 마음이 심난합니다    답변부탁드립니다   ,영상의학과
164,mri 촬영주기,작년   월에 허리 mri 촬영을 했고   번  번 착추 사이 추간판 돌출 및 척수관 협착증이었습니다  재촬영은 언제쯤 하면 좋은지 궁금합니다 ,영상의학과
165,뇌가 문제가 있는거 같아요 병원좀 추천해 주세요,뇌에 문제가 있는거 같아 mri찍고 싶은데 어느 대학병원으로 가야 좋을까요 추천좀 해주세요,영상의학과
166,mri 촬영후골절판정 받았는데 깁스나치료받은건없고 담당의는다친다리 최대한쓰지말라고만하는데  주정도지났는데 디디거나하면 넘아픈데 얼마나시간이 지나,mri 촬영후골절판정 받았는데 깁스나치료받은건없고 담당의는다친다리 최대한쓰지말라고만하는데  주정도지났는데 디디거나하면 넘아픈데 얼마나시간이 지나야할까요,영상의학과
167,의무기록차트 해석해주세요,   right upper lobe collapse    R O endobronchial lesion calcified granulomas in right upper lung field    partially reversible  large  severe perfusion defect in apex  apical mid anterior  septum  inferior and posterior wall two vessel disease    번  번 한글 해석 부탁드려요,영상의학과
168,스노우 필터 질문,저거 어디서 찾아요,영상의학과
169,무릎에서 뚝,축구하다가 착지 잘못해서 무릎 돌아가면서 뚝 소리나면서 다리 피지 못했는데 다음날 병원갔는데 다리 부어서 갔는데 무릎에 피찼다고   cc정도 빼고 mri는 월요일날 찍자고 하는데 괜찮은걸까요    ,영상의학과
170,chest pa x ray 흉부 사진에 이상한 게 보여요 , 인 근무하는 방사선사입니다  검진 때문에 엑스레이를 찍었는데 이상한 모양이 보여서요   혹시 문제가 있는건 아닌지 알고 싶습니다,영상의학과
171,위 식도 장 천공좀 봐주세요,안녕하세요  제가 탁센을 두번 먹고 떼굴떼굴 굴러서요 명치랑 너무 아파서요  위  식도  장 천공좀 봐주세요 부탁드립니다  참고로 왼측 결핵앓은 흔적 있고  전내장 역위증 입니다  부탁드립니다 ,영상의학과
172,울아기좀 봐주세요,맘마먹는 도중에 자꾸 용을 써요    ,영상의학과
173,이거빨리 해석 해줄 사라무   급해요   낼 아침까지라서   발표하는데 도와 주세요  ,      Chest AP   Pleural effusion  both  right     left  해석         AbdomenSupinel   Fecal stasis 해석         HR CT   Pleural effusion  both  right     left  and right interfissural effusion Passive ateletasis  right basal Multifocal pneumonia  both Left paratracheal LN enlargement GB stone 해석         Chest PA   interval decreased extent of right pleural effusion 해석          Chest AP  no significant interval changed 해석        내공 많이 드릴께요    제발 도와주세요  ,영상의학과
174,간유리음영 사진 판독 부탁드립니다,만   세 남자고요   저선량 폐ct촬영을 하였는데 간유리음영 소견을 받았습니다 판독지 나오려면  주일정도 걸린다는데   너무 불안합니다  일단  개월 후에 추적관찰 하자고 하는데요 호흡기전문 내과에서 진단받은게 아니라서 다른 병원에서 진료받아야 하는지 수술해야할 단계인지  ,영상의학과
175,복통관련으로ct를찍었는데 의사선생님은복통에관련이상은없다는데 소견서에 cul de sac 내 physiologic ascites 가보이고  ret,복통관련으로ct를찍었는데 의사선생님은복통에관련이상은없다는데 소견서에 cul de sac 내 physiologic ascites 가보이고  retroperitoneal LAPS는 보이지않음 해석좀부탁드려요 ,영상의학과
176,MRI 판독결과 해석 부탁드립니다 ,   SWI에서 left parietal WM에 small dark SI가 있음    Ventricular system 과 cerebral cortical sulci 이 약간 prominent 함  극심한 두통으로 일상생활이 어려워 MRI MRA 검사받은 결과입니다  상세한 답변 요청드립니다  감사합니다 ,영상의학과
177,MRI 판독해주실분 계신가요 ,오른쪽 가슴부위에있는 갈비뼈 앞뒤 옆 전체적으로 통증있어요 앉아있거나 평소에는 심하지않은데 누우면 더 불편해져서 병원갔는데 엑스레이찍고 더 자세히 보자고 MRI찍었는데 빨간원부분이 까맣게되서 그게원인인것같다고그러네여 근데 병명도없고 항염성분이 들어있는약주고 그래도 통증 있음 신경약 처방해준다고 했어여 근데 이아픈게 승모근이랑 날개뼈뒤쪽이 진짜 마니아파여 두통도있구여 척추도 심하게 굽어서그런지 어떤건지 정확한병명이랑 재활치료는 뭘해야하는지 자세하게 알고싶어여 부탁드립니다,영상의학과
178,,,
179,,,
180,,,
181,,,
182,,,
183,,,
184,,,
185,,,
186,,,
187,,,
