104,근육올리기 ,나이가   살이구요  파킨슨 장애 입니다  온몸에 근육이 모두빠져 집박에도 못나가요  제일 문제는 허리에 힘이없어 바지도 못입고 무거운 옷도 못입을 정도입니다  병원에가서 mri 까지 했는데  몸에는 아무이상 없데요  다만 근육을 올리라 합니다  재활해서  재활병원에가서 도수도 받으며 재활했더니 정말 많이 좋았는데 재활병원은 오래입원할수가 통원치료 하래요 그러나 혼자는 위험해서 나갈수가 없어 인터넷을 봤더니 AB요법이 있길래 상담요청 합니다  저에게 맞는 운동 있을까요 ,재활의학과
105,브이 스쿼트 하는 도중에 오른쪽 허벅지 바깥쪽이 찌릿찌릿,어제 브이스쿼트를 하는데 앉았다가 일어날때 전기가 통하는 것 처럼 오른쪽 허벅지 바깥 쪽에 찌릿찌릿하면서 아프더니 피부를 손으로 쓸면서 만지면 그쪽 피부에 감각이 없어요 뭐 잘못된건가요   ,재활의학과
106,손가락 골절 재활,안녕하세요 손가락 골절 된지  주차가 다되가는데요 아직 뼈는 다 붙지 않았습니다 엑스레이상으로  자 골절이 보이구요 이 상태인데 의사 선생님이 반대손을 이용한 재활 치료를 더 뻣뻣해지기 전에 계속 하라하셨습니다 아직 뼈가 가 안붙었는데 반복적인 재활 운동과 따뜻한물속에 손을 담그고 구부렸다폈다 하는 등 자주 해도 되는건지 궁금합니다 붓기는 거의다 빠진거같아요 반대손에 비해 약간 부어있는 정도고요,재활의학과
107,우울증 약을 정신과말고 다른과에서도 처방 가능한가요 ,제가   년전에 뇌출혈로 쓰러진뒤로 신경외과에서 처음 약을 처방받았었는데요  그 뒤로  년정도 재활받았던 병원 재활의학과에서 그 뒤로도 약을 계속 꽤 오래 받았었는데  그때는 무슨약인지도 모르고 그냥 먹었었는데  약들을 지금 다시 확인해보니까   아리셉트  mg 익셀캡슐   mg 알닥톤필름코팅정   mg 네비레트정  mg 올메텍정   mg 익셀캡슐     mg 노바스크정  mg 글리세틸정    mg  이 정도였는데요    약들이 치매치료제  정신신경용제  이뇨제  혈압강하제  정신신경용제  뇌기능개선제 등등 굉장히 다양한 과에서 받는 약들이었네요    수술했던 병원가서 상담하니까 의사분이 그냥 약 다 그만 먹고 혈압약만 먹으라고 하셔서 그렇게 했었는데요    요즘 대학병원 정신과에서 상담하고  오르필서방정    mg 렉사프로정  mg  이런 우울증 관련 약들을 먹고 있는데요   이젠 대학병원 정신과에 가도 특별하게 뭔가 상담하는것도 없고 거의 약만 받고 있는데 예전에 다니던 재활의학과에 가서 상담하고 이런 약들을 예전처럼 처방받을 수 있나요 ,재활의학과
108,결절종 체외충격파에 대하여 물어봅니다,제가 손목에 결정종 진단을 받았습니다   개월전부터 통증이있었는데  군데병원에선 결절종얘기없이 근육문제등 이유로 치료를 받았으나 진전이없어 지금까지오게되었는데여 어제 직장근처 병원에가서 결절종진단을 받았습니다 초음파상으로 물  이 찬것이보여지고 의사선생님은 물같은거면 지금 당장 뺄수있다고하시고 젤리처럼굳었으면 체외충격파로      회정도 잘게 또는 깨부셔서 뽑아내자고하셨습니다 일단 첫번째로 주사기로뽑으려고했는데 잘 안나온다고하시고 바로  회 체외 충격파 치료를 팔꿈치부터 손목 손등까지하였는데  회 비용이   만원이던데 금액이 부담스럽기도하고 이걸해서 안되서 수술까지된다고하시던디  일단 제 손목은 뒤로 많이 젖혀지지않고 땅을짚기힘든상태입니다 저같은 결절종에 체외충격파 치료를 하는게 좋은방법인가여  좋은 조언부탁드립니다 직장사람들 말씀에 진료잘하신다고하여 갔는데 제가 예민한걸까여    조언부탁드립니다,재활의학과
109,오른쪽어깨,오른상완골어깨골절로 년 댜되가는데 아직도   도가 왼쪽처럼 안돌아갑니다 견갑골이아픈건지 게다가 며칠 오른쪽으로 옆으로누워잣더니 돌릴때 통증마저있습니다 어떡햐죠  Loading                  화질 선택 옵션,재활의학과
110,아클펜정  아트놀셋세미정,발목 삐끗했는데  잘 못 걷겠다 해서   아트놀셋세미정 추가되었어요   혹시 반알짜리 때문에 설사할수 있나요     아클펜정    아트놀셋세미정       모사포트정    아침저녁으로 복용   숫자는 투약량,재활의학과
111,코로나   ,의사는 격리  일만 하나여,재활의학과
112,감염취약시설 질문드려요,요양병원에서 근무중입니다   이런 경우 법적조치 또는 신고가능한곳 없나요    내용은 이렇습니다    층 병동에서 확진자가 나왔습니다   확진자는 다른 층으로 이동하였으나  병원에서는 확진자가 나왔던  층 병동 사람들을 치료시키라고 작업실로 보냅니다   그리고 방호복은 커녕 페이스쉴드 하나만 착용합니다  방호복이라도 지원해주면 좋겠는데 없습니다   감염취약시설인데 확진자가 나왔으면 같은 층 병동 사람들 당분간은 치료보내지말고 격리해야하는거 아닌가요     잠복기가 있을텐데    제가 확진돠면 회사에서는 유급은 커녕 무급처리합니다   무급으로 처리되서 지원금 신청해도 지원금 금액도 적은데    너무 스트레스 받네요 ,재활의학과
113,교통사고입원치료 필요할까요  작은 접촉이 있었는데 허리가 살짝 아파요   강남   대후반 여 교통사고입원치료 ,안녕하세요   저는 교통사고입원치료는 굳이 안해도 될거 같은데     주변에서 계속 입원하라고 그러네요   사고난지는 며칠 지나지 않았구요   몸 상태는 약간의 두통과 허리아픔 정도가 있어요   보통 이런 경우에도 교통사고입원치료를 하나요 ,재활의학과
114,병원에서 코로나검사 보건소 pcr검사 차이,제가 감기인지 코로나 인지 몰라서 일단 병원에서 했는데  후기보다는 안아팠어요  코로 물 들어가는 느낌인데 끝까지 의사쌤이 넣는다고 하셨고 아빠도 되게 많이 들어갔다고 하셨는데 의사쌤이 코 벌려주는 기계로 해서 그런지 모르겠는데    pcr은 더 아픈가요  아님 똑같은가요  ,재활의학과
115,골반 비대칭 관련  재활의학과  병원 ,현재 필라테스 거의    년째 꾸준히 하고있는데 아무래도 습관  꾸준한 운동하면 체형교정 된다고는 하는데 최근에 근육량이 좀 늘어서 그런지  힙  대둔근 중둔근  양쪽 비대칭이 눈에띄게 느껴져서 문의드립니다   아마도 덜 발달된 힙 근육쪽의 골반 근육이 더 늘어진거 같은데  이게 운동법으로는 필라테스 쌤한테 들었는  요  습관  다리꼬기 짝다리  로 인한 틀어짐 같아요 평소 골반 소리도 나고     인터넷 검색해보면 재활의학과나 한의원 홍보글이 많더라구요  그런곳에서는 엑스레이를 찍어보나요  어떻게 진행  이 되는건지 궁금해요  추나요법을하는건지  필요하다면 초기에 한번 가서 필요한 치료 원인분석 해보고 꾸준히 운동으로 유지  하고싶어서요  광고글 채택 안합니다  ,재활의학과
116,혹시 계단에서 굴어떨어지면,많이 부러지나요  부러지면 병원빈 최소 얼마 나올까요  뼈 부러지면 오래 입원해 있겠져 ,재활의학과
117,허리 통증이 자주 재발되요  MRI 상소견으로는 정상이라는데 ,현재 나이   인데 젊어서 부터 일년에 서너번은 허리통증으로 고생하고 있습니다  허리 전문 병원에서 입원해 척추 MRI도 찍어 보았는데 정상이랍니다  약간의 퇴행성소견만 있으니 운동 열심히 하고 허리에 무리가 되는 자세만 취하지 마라고 하네요  그래도 자주 재발되는데  모 허리 전문병원 의사가 올린 유투브 의학 영상자료를 보니 저의 척추 촬영 사진과 같은 아랏쪽에서  번째 디스크 부위에 하얀 반점이 있어 문의 드립니다  이 하얀반점의 병변이 허리통증의 원인은 아닐까요  더 나이들어 허리 때문에 삶의 질이 떨어질까 두렵습니다  전문의님과 동일한 증상으로 치료 경험이 있으신분들의 고견 부탁드립니다   상단 사진은 유투브에 올려진 자료이고  하단은 저의 척추사진입니다 ,재활의학과
118,발목 인대 파열 완치 후 부음, 월 중순에 발목 인대가 파열되서 수술을 했고  월 말에 이제 병원 안와도 된다는 소리를 들었습니다  병원 다니면서 도수치료 전기치료 이런건 했는데 재활운동은 아예 안해주고 그냥 걸어도 된다고 했어요  그런데 저는 지금 발목돌리기도 완벽하게 안되고 계단 내려갈때 발목이 땡겨서 보통 사람들처럼 내려가지도 못하고 걸음걸이도 남들보다 늦고 남들이 보기에 삐걱거린대요  또 문제인건 잠깐   분정도 산책하고 왔을 뿐인데 발목이 매우 부어있습니다    수술하기 전보다 더요     얼음팩 하면 가라앉긴 하지만 왜 이런걸까요      이게 정상인건가요  시간이 해결해주나요  ,재활의학과
119,대학교 학과 선택,궁극적인 목표가 선수촌 재활치료사인 고 입니다    스포츠 의학과  운동재활학과  물리치료학과 등 여러 학과가 있는데 그 중 목표와 가장 적합한 곳이 어디인가요      선수촌 재활치료사를 하기 전 프로팀에서 경력을 시작하려고 하는데 괜찮을지요      선수촌에서 일을 하려면 어떤 경력이 필요하고 요구되는 자격증같은 것들은 무엇이 있나요  선수촌 내에 to가 나서 면접을 보고 입사한다 전까지의 자세한 설명 부탁드립니다      학과에 맞는 대학 추천과 그 이유에 대해서도 자세히 부탁드립니다 ,재활의학과
120,고관절수술후 재활병원가야할까여 , 월 일 수술받고  주후퇴원해 집에서 가벼운운동으로 재활하고있습니다 오른쪽 다리가 짧아 수술후 조금길어졌지만 골반이 틀어져 지금은 절뚝이로 걸음걷고있습니다 교수님은 현재 길어진 다리는 맞춰진다고 말씀하시구요 시간이 답이겠지요  재활병원을 들어가는게 좋은지 집에서 운동하는게 좋은지 고민이 됩니다 주위분들은 나이가젊어 회복도 빠르다하시구요 제나이 올해   입니다   너무 고민이 됩니다 아이들과 같이있고 싶은맘에 병원은들어가긴싫고  많은분들의 조언과 답변부탁드립니다,재활의학과
121,손목 아픔,제가 예전부터 손목이 많이 아프긴 했는데 그게 많이 악화된 거 같습니다    수특 국어  권만 들어도 오른쪽 손 전체가 저려요    예전에 깜찌를 많이 써서 그런지 모르겠지만 최근 들어 더 안 좋아요    학교에서 필기를 조금만 해도 아프고요    정형외과 가보는게 좋을까요   파스 붙이고 보호대를 차고있지만 나아질 기미가 안 보여요    무엇보다 고 이라 병원 가기도 겁나고요    병원에 갔다가 재활을 해야한다  당분간 필기를 하지 말아라 이런 소리 들을까 너무 겁나요  ,재활의학과
122,앉아있을 때 오른쪽 햄스트링이 아파요,태권도를 전공으로 하는 고  학생입니다  아무래도 도장에서 하체 운동을 많이 하는데 작년 겨울방학부터 한   분  정도만 앉아있어도 오른쪽 의자에 닿는 부분 햄스트링이 진짜 꽉 뭉친 것처럼 아프거나 시리듯  아픕니다    고 이라 학교에서도 많이 앉아있는데 그 시간에 진짜 눈물이 나올 거 같아요    병명이 뭐고 집에서 간단히 재활할 수 있는 방법이 있을까요 ,재활의학과
123,발목 염좌  발목 인대 파열 문의드립니다,제가    년전에 발목을 심하게 접질렀었는데 그때 뚝하는 소리가 나면서 주저앉았습니다       분정도 있다보니 걸을수는 있었어요  사정상 병원을 못가서 방치했는데 당시 일주일인가 발목에 피멍이 심하게들었었고 붓기도 엄청 부었었어요  그렇게 몇주를 절뚝대다가 일상생활이 가능해져서 여태까지 놔두고있는 상황이에요   일반 마사지를 받을때 발목쪽을 땡기고 그러면 아파서 그 이후론 안받았구요  평소에 다른쪽 발목과 비교했을때 좀 부어있고 오래 걸으면 통증이있습니다  몇년전에 동네병원에가서 검사받았을때 뼈는 이상이 없다고 그랬구요  큰 병원에 가보라고 권유 받고 또 여태까지 방치했네요    요즘엔 계속 앉아있는 일을하는데도 이따금씩 통증이있어서 제대로 치료를 받고싶거든요  이제는 상황이 괜찮아져서 병원을 가볼까싶은데 치료할수있을까요  수술이 필요할수도있을까요  잘아시는분들 답변 부탁드려요   ,재활의학과
124,팔을 쭉피면 힘줄이 올라오면서 아파요,오른쪽 팔을 쭉피면 사진처럼 힘줄 같은게 올라오고 손목부터 이두까지 통증이 있어요  신경외과에서는 물리치료 및 스트레칭을 하라는데 맞는 진료인가요 ,재활의학과
125,초등학교  학년 아이인데 작년부터 발목  무릎 등 관절이 아프다는 소리를 많이 하고 어깨  무릎  발목 등을 움직일때 주변 사람들이 다 들릴 정,초등학교  학년 아이인데 작년부터 발목  무릎 등 관절이 아프다는 소리를 많이 하고 어깨  무릎  발목 등을 움직일때 주변 사람들이 다 들릴 정도로 딱딱 소리가 나요  오늘도 오른쪽 무릎이 아프다고 해서 보니 많이 부은듯 보이네요 어떤병원을 가야할지 원인은 무엇일까요 ,재활의학과
126,코로나 확진자 접촉,어제 개학해서 새로 사귄 친구랑 거의 붙어다녔어요   그 친구랑 이야기도 했고  물론 마스크는 다 lf    착용 했습니다  음   팔짱까진 아니더라도 계속 이야기 하고 가정통신문 전해주고 그랬었어요    제가 그 친구 앞자리라 제가 그 친구 한테요  물건 빌려쓴건 없고요   그런데 그 친구가 자가키트 양성이라고 합니다   전 이미  차 백신까지 접종 했고 그 어떤 증상도 없는데 확진일 가능성 많이 클까요 ,재활의학과
127,pcr검사결과 통보 시간,pcr검사 결과가 당일에 나올수 있을까요   제가 오늘 검사하러 오전   시   분쯤에 갔을 때 사람이 없어서 텅텅 비었더라구요 검사자가 별로 없는 날에는 검사결과를 당일에 통보받을수도 있나요   급합니다    ,재활의학과
128,작업치료사,제가 체육학과 졸업하고 작업치료사 같은 걸로 나가려고 하는데요  작업치료사도 병원같이 재활센터 이런 거 낼 수 있나요 ,재활의학과
129,제가 측만증인데요 체육 수행평가를 해도 되는건지 모르겠습니다  급해요,제곧내입니다   수행평가 종목은  물구나무서기 풍차처럼 옆으로 돌기 구르기     정확한 이름은 모릅니다   손 안 쓰고 앞구르기 저도 이렇게 들어서 정확히 뭔지는 모르겠습니다  덤블링    일까요   입니다   내일 체육 수업때 평가 관련해서 바로 말씀드릴 생각이라 급합니다 의사님들 답변 기다리겠습니다    부탁드려요,재활의학과
130,허리디스크 중량운동,안녕하세요   남자 입니다  최근부터 바디프로필을 찍어보고자 헬스에 빠져있는중인데요    년전 군대에서 꼬리뼈 부근    번  이던가 아무튼 허리디스크 진단받았습니다    다리저림은 하나도없는 상태입니다  PT를 받아서 정확한자세로 운동한다고 나름 자부하는데요    정확한자세를 잡더라도 고중량 스쿼트나 데드리프트 같은경우는 위험할까요 ,재활의학과
131,통깁스 풀고 물리치료를 받고 있는데 여기가 아픈게 맞나요 ,빨강 동그라미는 부러진 곳이고 파란 동그라미가 아픈곳입다  물리치료 시작하고   물리치료는 따뜻하게 하는  것과 근육을 풀어주고 힘주는것을 다시 배우거든요 발목과 발가락을 계속 힘주거든요 최대한 근데 뼈 부러진곳보다 파란 동그라미부분이 아파요   이거 정상인가요  오래 근육을 안쓰다가 쓰는 원래 이런건가요  그리고 발 색깔이 혈색이 너무 없고 좀비 발 같아요   왜 그런가요  정상인가요  일려주세요     내공    이요   ,재활의학과
132,초음파유도하 주사치료,근막통증후군때문에 해보려고합니다 주사를 맞게 되는 경우 바로 효과가 나타나나요  아니면 몇번 맞아야 되나요  방사통이 원인이된 통증으로 다른 근육이 부어 있는건가요  음식물을 삼킬때도 불편하고 뭔가 부어 있는 느낌이 있습니다 증상은  달된거 같습니다,재활의학과
133,어깨 불균형   무슨운동을 해야되나요  ,앞이나 뒤에서 볼때 좌우가 불균형합니다  무슨 운동을 해야될지 어느병원을 가야될지 모르겠습니다  저도 이쁜 몸 만들고싶습니다   도와주십시오,재활의학과
134,제가거북목,제가 거북목이랑 턱관절장애가 있는데 병원을 치과로 가야되나요 자세교정같은거하는 한의원을 가야되나요 ,재활의학과
135,무턱이유와 교정,정면에서 봤을때는 브이라인이 있는데 옆에서 보면 턱이 없어요   왜 이런가요 성형없이 고칠 수 있나요 ,재활의학과
136,허리가 너무아픈데 정형외과 한의원,허리가  주째 너무아파요   골반쪽이랑 같이아픈데 이게 뼈가아픈건지 근육이 아픈건지모르겠습니다  중간에 한의원 한번가서 침과 물리치료를 받았지만 전혀 나아지지않고 더 아픈것같은데 눌러서 있는 통증이 아니라 움직이거나 힘이 들어가면 더 아픈것같아요  근데 이게 근육인지 뼈인지 모르겠어서 어느병원으로 가봐야할까요   ,재활의학과
137,도대체 여기가 왜 아픈걸까요 ,이게 도대체 어느 부위인지도 모르겠고 무슨 문제인지도 모르겠고 왼쪽으로 씹어도 아프고 입을 벌리면 아프고 힘을줘도 아프고 정형외과를 가도 아무 문제가 없다고 하고,재활의학과
138,재활 의학과 선생님들 한테 질문 합니다 ,뇌동맥을 발견하여 시술을 받았습니다  사타구리를 째서 그쪽 방면으로 멀 집어놓은지는 모르겠지만 조영술인거 같습니다  그럼 뇌동맥을 조영술로 터트리고 뇌동맥 있던자리에 조영술이 남아 있는 겁니까 ,재활의학과
139,연골파열수술,오른쪽 무릎뒷쪽이 아파서 병원에 갔어요 진단은 연골파열입니다   대 후반입니다 연골파열 수술만 하고 싶은데    자꾸 절골술까지 하자고 하시네요 관절염이 빨리 올수 있다고요 저는 자세가 M자로 앉아서리 다리가 휘어다고 하는데 꼭해야 할까요  저는 사실 두렵거든요 주변에서는 병원 잘알아보고 무릎수술은 함부로 하는것이 아니라고 하는데 우째해야 할까요 ,재활의학과
140,물리 치료 온습포 찜질치료 부위 방법,물리치료할때 흔히 목이나 어깨 허리 등 부위별로 수건으로 감싸는  방법을 자세히 알려주실 분이 계시면 좋겠어요  가능하면 이미지가 있다면 더 좋겠습니다   ,재활의학과
141,발목 꺾임,몇개월전에 한번 제대로 꺾이고나서 종종 또 꺾이는데 몇개월전에 꺾였을때가 인대늘어나고 인대때문에 뼈 사이가 벌어졌더고 했던것 같은데 병원에서 깁스안해도 된다해서 안했어요 그리고 다 낫고 오늘 아침에 학교 걸어가다가 확 꺾여서 넘어지면서 무릎도 까졌는데 진짜 평평한 바닥에서 갑자기 꺾였어요 처음에 욱신거리다가 괜찮아졌는데 시간지난 지금은 발바닥이랑 발등 있는 곳이 걸을때마다 아프고 발바닥을 바닥에 딛기만해도 아파요    새끼발가락쪽 발등이 유독 아파요       살입니다 왜이러죠 발목꺾였는데 발버닥이랑 발등이 아파요,재활의학과
142,x자다리 질문,  다리 유전인데 그럼 뼈모양 이니까 교정 못하나요    그 내측어쩌구 근육 단련하면 유전인데도 일자 되나요    척추같은 뼈를 비틀어지게 하나요 척추측만증이라   납둬도 몸에 이상 없나요 내공냠냠땜에 재업 다른소리 마시고 질문만 답해주세요,재활의학과
143,재활트레이너가되려면,안녕하세요 재활트레이너가 되려면 대학어느학과에 들어가나요 ,재활의학과
144,뒤로 엎드리기,허리에 좋나요 ,재활의학과
145,똥이 안 나와요요여오 급해요진짜로요,똥이 안 나와서 미치갰어요 진짜 다리하고 팔이 떨리고 힘도 없고살아있는게 기적일정도로 죽겠어요  분뒤에 줌 수업 시작인데 히발 어떡하죠 어떤분은 앉아서등꼿꼿하게 펴서 힘줘서 누라고 하고 어떤 분은 배를  허벅지에 밀착해서 누라고 하고 밖에 배달 왔는데   분째 화장실 변기에 앉아 있어 미칠 거 같아요  도와주세요 진짜 죽을거 같아요 농담 어니고 창자까지 나올 기세로 힘 주고 잇는데 진짜로 죽을거 같아요,재활의학과
146,연관통과 방사통,저 두개의 의미는 뭔가요  그리고 목을 왼쪽으로 누르고 있으면 오른쪽 승모근 아래 부분이 찌릿하고 앞가슴도 답답합니다,재활의학과
147,A  B에 들어가는 단어 뭔가요 ,   A는 심한 충격으로 근육이 끊어진 상태이다  운동 전 스트레칭을 통해 근육의 유연성을 높이도록 해야 한다      B는 근육과 신경이 피로해져서 근육이 수축하거나 떨게 되는 상태이다  이는 가벼운 걷기가 정리운동으로 근육의 피로를 풀어준다  또한 뭉친 근육 부위를 따뜻하게 마사지 하고 스트레칭을 해야 한다   체육 과제인데 도저히 답을 모르겠어서요  최대한 빨리 답변 주시면 감사하겠습니다 ,재활의학과
148,척추가 오른쪽으로  ,검사받아보니까 척추가 휘어졌어요    치료방법이 있을까요 ,재활의학과
149,족부통증 ,먼저 광고글은 정중하게 사양할게요   족부쪽 선생님이 봐주셨으면 좋겠어요  인솔쪽 전문가나         년   월부터 양발 앞꿈치가 아파왔고   맞춤깔창 제작해서 생활하다가 작년  월에 좀 더 아픈 왼쪽 발 중족골 교정 절골술  수술을 받은상태 입니다    요족 상 중하 중에 중간정도  기존 맞춤 인솔이 아치쪽 공간이 있어서 탄성이 있는 상태가 아니라  그 공간을 메워서 바닥에 놓고 눌러도 탄성이 없고 딱딱한 상태의 인솔인데  이것을 신발에 넣고  걸을때 발 아치쪽에 인솔이 아치쪽을 많이 받쳐준다는 느낌을 받는상태로  발앞꿈치 통증은 많이 적거나 없습니다  그런데  이번에 좀더 체계적으로 봐주시며 운동선수도 많이 가는 업체에서 마추게 되었는데   아치쪽은 탄성이 있어야 한다고  기존 제품처럼 아치쪽이 압박이 되면 근육이 유연해저야 하는대 굳는다나  잘 기억이 안나지만 좋지 않다고 말씀을 하셨습니다  새로 마추고 걸을 거리는  키로 정도   저녁부터 밤에 잘때까지  예전에 많이 아팠을때가 생각 날정도는 아니었지만 발 앞 부분 화끈거리면서 아프더군요   기존에 신고 있던 깔창은 분명 아치에 안좋다고 하시지만 통증이 많이 없거든요   새로 마춘 깔창은 몸의 움직임에 따른 교정 까지해서  제작해서 신었지만 아치를 지지해주는느낌이 미비한 느낌이고   여쭈어보니  원래 그렇다고 합니다       그러니까 아치쪽이 많이 받쳐지는 쪽은 아픈게 많이 덜 한데  아치쪽 압박받으면 안 좋다고함  새로 마춘 깔창은 아치쪽이 분명 있지만 탄성으로 인해 체중이 실리면 내려가나봄  하지만 신는 입장에선 아치 받쳐 진지 안 받쳐 진지 모를 정도   신으면 발 앞쪽 통증이 생김  밤에도 욱씬욱씬 화끈화끈  여기서 제 생각은 어쨌든 인솔을 신었을대 안 아픈 기존 방식을 새로 마췄던 인솔에 적용해서 신는것 인데  인솔 아치부분 탄성이 없어서  발 아치부분이 인솔에 압박을 받을시에 다리에 발에 안좋다고 했는데 어떤식으로 안좋아지는건지 궁급합니다  안 아픈대로 하는게 나은 것 인가요   설명을 잘못해서 죄송하네요 ,재활의학과
150,어제 코로나 검사했는데 아직까지 결과가 안나왔어요,오전에 나온다고 하던데 검사는 어제       오후  시쯤 했구요  시 안까지는 나오겠죠 ,재활의학과
