104,골반 교정운동,골반 오른쪽이 좀 높은데 교정운동이나 스트레칭좀 알려주세요 영상링크달아주시면 좋고요 그리고 효과가 있을까요 ,재활의학과
105,꼭지 어깨 골반  비대칭,사진처럼 꼭지는 위치가 다르고 어깨는 살짝 비대칭이고 골반도 비대칭인데 저거를 집에서 다 교정할려하는데  병원도 가긴할겁니다  자세교정 스트레칭이나 골반 어깨 교정에 효과가있는 운동좀 알려주세요 그리고 병원은 어디로 가야하나요 ,재활의학과
106,뇌가이상합니다,대충 몇주전부터 뇌에자꾸 뭔가낀느낌이들고 뇌가 꽉찬거같은느낌이듭니다 또 집중이안되고 뇌가 자꾸 막힌거같고  잠도안와서 미쳐버리겠습니다  정말  시간은누워있어야 잠드는거같아요 근데 잠을자도 잔거같은 느낌이들지도않아요  현실감각이 떨어진거같기도하고    갑자기왜이럴까요 ,재활의학과
107,이게 무슨 주사인가요,이거 주사인가요    주사면 무슨 주사인가요,재활의학과
108,발목 인대 부상,점프하고 착지하다가 발목이 안쪽으로 꺾여서  주일정도 반깁스를 했는데 언제부터 깁스를 풀고 테이핑이랑 발목호대를 해도 되나요 ,재활의학과
109,안녕하세요 가자미근  종아리 통증 질문드려요,안녕하세요 종아리 근육 통증 질문드려요 제발 답변 부탁드립니다   개요 먼저 제 증상은 첨부한 사진과 같은 부위에서 오래달리기    m이상   약간이라도 경사가 있는 경사로 등의 등산  등산시작후  분이내 통증  줄넘기같은 반복적 뛰는 행동  경보 빠른걸음 분가량   조깅 등과같은 천천히 걷는게아닌 살짝이라도 속도를 내면 쉽게 극심한통증이 시작됩니다  처음엔 사진과 같은 부위위주의 통증 그후엔 그위에까지 서서히 통증이 번지듯이 심해져 결국 주저않거나 더이상못가 바닥에 앉아서 쉽니다  군대제식걸음 때도 빠른걸음으로 인해 열외를 한적이 몇번있습니다  한번은 병원을가 검사를 했더니 뛰었을때 종아리근육쪽 무슨 수치가 평균보다 높게나와 자세한 검사를 하려면 근육조직을 떼어내 다른곳 다른나라  의 검사기관으로 보내야 한다더라구요 시간도 시간이고 비용도 비용이라 우선 일상생활의 지장은 없기에 별다른 조치는 하지않았지만 그당시 의사 선생님 말씀으로는 희귀 유전  비슷한 뉘앙스로 말씀하셨습니다     그리고 그이전 모든 과를 돌며 심전도검사  척추관협착증  가장증세가 비슷하다고 말씀하시더군요 의심으로 검사를 진행했으나 허리는 전혀문제가 없이 깨끗한 상태였습니다 결국은 협착증은 아니라고 말씀 하셧구요  또한 인터넷을 보니 종아리 에 근육이 모자라서 그럴수있다 내지는 잘사용치않아 그럴수있다 라는 글도 더러 있던데  저는 헬스를 즐기는 사람이라 종아리 허벅지 그외 상하체 구분없이 운동을 오래 하였습니다 또한 양종아리의 통증은 동시 시작 통시 가라앉음입니다  그래서 요약하여 질문을 드리자면    혹시 이글을 보시는 선생님들께서는 비슷한 증상을 보시거나 치료경험  혹은 짐작가는 병명이 있으실까요     있다면 치료가 가능한 병일까요     그렇다면 그비용은 어찌되고 기간은 어찌되는지 여쭙고 싶습니다   소중한시간 내 글읽어 주셔서 감사합니다 ,재활의학과
110,어떤 병이죠,계속 떨리고 불안하고 뭔가 몸이 급하고 가만히도 못 있겠고 안절부절해요 말하기도 싫고 혼자있고 싶고 밥도 먹기 싫고 아무것도 하기가 싫어요 누가 몸을 주먹으로 때리는 거 같은 통증도 있고 이게 뭘까요,재활의학과
111,골반 교정운동,사진을 찍긴 좀 그래서 옆쪽을 그렸는데 오른쪽은 안으로 들어가고 왼쪽은 정상인거같은데 오른쪽 골반이 위로 올라간게 맞나요  그리고 교정 운동이랑 일상생활할때 골반에 안좋은 자세 등등 알려주세요   오른쪽 골반이 올라간건가요    골반 교정운동 알려주세요   골반에 안좋은 자세 내공   이요,재활의학과
112,위탁검사 사유,위탁검사 뭐검사받는거예요 ,재활의학과
113,물리치료사 선물,물리치료사인 제 남친한테 뭐 선물하면 좋아할까요 ,재활의학과
114,척추측만증,제가 요즘 허리가 너무아픈데 가끔씩 이유없이 아플때도 있습니다 근데 어렸을때 척추측만증 판정을 정형외과에서 받았었는데 그때는 치료방법이 없다해서 그냥 냅뒀는데 혹시 척추측만증이 심해져서 허리가 아픈걸까요  만약 척추측만증이면 치료비용이 많이들까요  ,재활의학과
115,부산 사하구 코로나검사,선별진료소 무료로 진행하는곳 좀 알고싶습니다  부모님 간병으로 들어가려고 하는데 서류가필요한지  그냥가도 되는지 알고싶습니다 ,재활의학과
116,코로나 감염 확률 높을까요 ,일요일 아침부터 월요일 아침까지 약   시간을 함께 보낸 친구의 아버지가 월요일에 확진 판정을 받으셨고 그 친구 또한 목에 약간의 통증을 호소하여 일반 병원에 가 신속항원검사를 받았습니다 결과는 음성이었고 다음날인 화요일 컨디션이 더 안 좋아져 같은 병원에 가서 재검사를 받자 양성 판정을 받았는데요 저 또한 소식을 듣고 화요일 당일에 검사를 받고 음성 판정을 받았습니다 그후 증상은 없으나 금요일인 지금까지 모든 일정을 취소하고 현재 집에서 격리하고 있는데요 내일 중요한 일정 때문에 오늘 다시 일반 병원에 재방문하여 신속항원검사를 받고 음성 판정을 받았습니다 이럴 경우 코로나에 감염됐을 확률이 많이 낮은가요 두 번의 검사에도 신속항원검사가 pcr검사에 비해 정확도가 매우 떨어진다는 것을 알기 때문에 많이 불안합니다 내일 일정 또한 취소하고 격리를 하는 게 맞을까요 ,재활의학과
117,선별진료소에서 코로나 검사를 받고 다음날이 쉬는 날이면 검사 결과가 나오나요 ,제가      월요일날 pcr 검사를 하려고 하는데 그 검사결과는    일 이내로 알 수 있다고 들었는데 다음날이     쉬는 날이면 검사 결과를 못 받나요  받을 수 있나요 ,재활의학과
118,평소에 옆으로 누워서 자는데,제목 그대로 평소에 옆으로 누워서 자는데 그럴때 마다 골반뼈가 아파요  왜그런 걸까요,재활의학과
119,전기 물리치료 노란 스펀지 빠진채로 하면 흉터가 남나요 , 한의원에서 전기치료기하면서 중간에 노란 스펀지가 빠졌습니다  빠진줄 모르고 계속 받았고 끝나고 나서야 알았습니다   엉덩이쪽이 빠진 줄 알았는데 방금보니 어깨쪽이었습니다   어쩐지 일어나고보니 엉치쪽이 아니라 가슴쪽에 스펀지가 빠져 있었는데 중간에 엉덩이쪽도 빠져서 스펀지를 교체해주셔서 어깨쪽일거라곤 생각도 못했습니다   몸에 전기가 흐르는 느낌도 심하고 근육이 쪼이는 것 같습니다  전기치료후 다른때와 다르게 컨디션도 좋지 않습니다   한의원에서 나와 제조사에 문의하니 화상입으면 부항자국처럼 생긴다고 했는데   방금보니 자국이 있습니다   화상처럼 따갑거나 쓰린지는 잘 모르겠는데 하얗게 피부가 벗겨지는 것 같습니다  흉터로 남을까요  몸에 전기흐르는 느낌은 언제 없어질까요    혹시 남는다면 치료방법이 있을까요  괴롭네요 ,재활의학과
120,수면중 꿈을 매번 꾸는건 뇌나 어디에 문제가 있는건가요  ,몇년됐는데요  시간을자든   분을자든   시간을자든  년동안 낮잠이든 등 다 포함해서 수면통틀어서 한    번을 잔다고하면    번 다 꿈을 꾸는것같은데 이게 혹시 어디 문제가 있는건가요  ,재활의학과
121,플랭크로 골반교정,골반이 오른쪽이 좀 더 높아서 집에서 교정해볼려는데 플랭크가 효과가있나요  그리고 효과가있는 운동이 또 뭐가있나요  병원도 갈 예정이긴 합니다  남자입니다,재활의학과
122,척추전방전위증 자전거,안녕하세요   년전쯤 척추전방전위증 진단을 받은   살 학생입니다  취미로 싸이클 같은 자전거를 타는데 허리를 많이 구부리게 되서 계속 타도 되는건지 궁금합니다 ,재활의학과
123,재활치료 입원,안녕하세요 지금 병사로 군복무중인 군인입니다 제가 발목 주상골 골절로   월에 다쳐   월에 수술받고 현재까지 치료중입니다  주전에 깁스를 풀고 재활치료를 받아야하는데 군병원에서 마땅히 치료를 안해줘서 민간재활병원 입원할려고하는데 수술한지 기간이 많이 지나 안된다고 합니다 근데 수술한의사 소견서에는 깁스를 풀고  개월간 재활치료가 필요하다 하는데 입원가능한 대구인근병원 없을까요 ,재활의학과
124,목근육이 비대칭인것 같아요,왼쪽목근육이 오른쪽 근육보다 좀 부어   있는것같아요    그냥 제 느낌일수도 있는데 외관상으로는 잘안보이고요 손으로 좀 만져보면 좀 부어있는것 같아요  제가 일자목이랑 거북목이 있는데 이것때문에 목에 근육이 뭉친걸까요 ,재활의학과
125,골반 틀어짐,골반이 완쪽이 더 높게 틀어졌는데 헬스하면 괜찮아지나요 ,재활의학과
126,발목 무릎 수술 재활기간 질문드립니다 ,발목골절에 핀수술   전방십자인대 타가건 수술 재수술  을 동시에 진행합니다   혹시 재활기간이 얼마나 지나야 보정기정도만 착용하고 걸어다닐수 있을까요   ,재활의학과
127,인공수술 반치환술,인공관절 반치환술  달 정도 되었구요 다리 굽혀지지 않는데 수술부위가 찌릿하고 저녁에 찌릿하고 따끔하고 우신거린다고 하신데 왜 그럴까요  ,재활의학과
128,특수부대 척추분리증,안녕하세요 특전사를 희망하는 고 입니다  저는 척추분리증이 있는데 이게 특수부대를 가는데 발목을 잡거나 못할수가 있나요  그리고 고 때 병명을 잘못외워서 무슨 신체검사  같은거할때 실수로 척추측만증있다고 말해서 제 신체기록같은데 척추측만증적힌거로 알고있는데 혹시 이것도 문제가될까요     척추분리증은 특수부대를 가는데 발목을 잡거나 못가나요    고 때 병명을 잘못외워 척추측만증이있다고 신체기록에 기록되어있을텐데 이것또한 문제가되나요 ,재활의학과
129,대퇴골절 재활 시 근육강직 해결방법 문의,대퇴골절 수술한지 한달 되었습니다   이제 재활치료 좀 해보려고 하는데  근육이 강직되어 말을 듣지 않네요   발가락과 발목은 잘 움직이는데 무릎부터 엉덩이까지는 제 의사대로 움직이질 않고 근육이 딱딱하게 굳어있어요   엉덩이는 말랑말랑   일단 재활이라는게 계속 머리에선 명령하면서 근육을 움직이도록 하는거죠   그 전에 이 근육을 좀 풀어줬으면 하는데 어떻게 하면 좋을까요  며칠째 주무르고 있는데 별로 나아지질 않네요   ,재활의학과
130,머리 맞았을 때 여쭙습니당,친구가 장난이랍시고 제 이마에 본인 손을 올려놓고 다른 손으로 그 손을 쳤습니다 그러니까 본인 손을 대고 본인의 손을 친건데 제 이마나 머리로 충격이 와서 머리가 띵 울리고 혀를 씹을 정도로 강하게 치긴했는데 이정도로 머리에 심각한 충격이 가서 출혈이 생기거나 머리에 이상이 생기는 경우는 거의 없을까요  지금   분이 지났고 머리 매스꺼움이나 목쪽 목돌리기 하면 큰 이상은 없는데 큰 이상은 없을까요  ,재활의학과
131,손가락에 뭔가 생겼는데 뭔가요 ,만져보면 굳은살 느낌인데,재활의학과
132,뇌경색 재활치료 혜택,뇌경색으로 인해 오른쪽 팔  다리가 마비가 와서 치료 해야하는데  병원비 혜택이나 할인같은거 어디 없을까요  ,재활의학과
133,라운드숄더 교정하는 법,뭐가 좋을까요  ,재활의학과
134,등 허리 통증때문에 질문드립니다,사진에 파란 부분에 통증이 있습니다 작년  월부터 아프기 시작했습니다 일할때는 통증이 거희없고 어쩌다 가끔 숙일때 허리쪽 땡기는느낌하고 승모근쪽과 등상부쪽에 뻐근한 느낌이 있을때가 있긴한데 아픈지는 않고 일하는데 전혀 지장이 없습니다 근데 일끝나고 퇴근시에 걷다보면 통증이 옵니다 특히 허리쪽에 통증이 심하고 골반쪽에도 통증이 오네요 집에 도착하고 씻고 나오면 통증이 조금 덜하고 등쪽에 근육이 땡기는 느낌이 심해지고 자고 일어나면 뻐근함이 좀 있고 출근하고 일하다보면 괜찬아집니다 이게 계속 반복되고 주말에 쉴때는 안아픕니다 가끔 뻐근할때도 있긴한데 통증은 없네요 정형외과 가니 그냥 근육통이라고 하고 허리주사 근육이완제 주고 말고 재활의학과 가서 주사맞고 도수치료 회를 받았는데도 통증이 그대로 이네요 답답하네여 낫지않아서 어떻게 해야되는지 궁금합니다,재활의학과
135,근전도검사 해석좀요,    년도랑     년도  번받으거 기록지인데 해석좀 부탁드려요,재활의학과
136,자물쇠 푸는법,사물함에 쓸 자물쇠를 샀는데 뭘 잘못해서 비밀번호를 다르게 했어요 푸는법좀 알려주세요 제발요 쇠구슬도 없고요 어떡하죠,재활의학과
137,도수치료 실비 청구,골반 교정이 필여해서 도수치료 받을려고 하는데 자세교정이 목적이면 도수치료 받으면 될까요   도수치료 실비는 다 청구 되나요 ,재활의학과
138,인공고관절,인공관절  달정도 되었구요 몇일 전까지는 다리 구혀졌는데 왜 그런가요 다리가 굽혀지지 않네요 화장실 의자에 안을수가 없네요 수술부뉘가 스쳐서 찌릿거리고 안아 있으면 찌릿하고 따꿈거리고 욱신거리네요 저녁에 통증이 조금 있어요 아직통증이 올수 있는건가요 집에서 할수 있는 방법 가르쳐 주세요,재활의학과
139,어떤 승모근이고 어떻게 없애나요,상견 중견 하견 중에 어떤거고 제 승모근은 어떻게 없애는지 알려주세요 스트레칭같은거요 효과 좋은거로요  승모근부분으랑 그 위 근육들 손으로 누르며 마사지 해도 되나요   평소에 거북목하고 라운드숄더 안되게 자세는 바르게 하려고해요,재활의학과
140,물리치료학과 입시  년제 vs 전문대,저는   살 현재 군대에 있습니다 제 수시 내신은  등급 후반에서  등급 초반 문과입니다 원래 지방대 국립 경영학과  학년을 마치고 입대했는데 스포츠 구단에서 선수들의 재활을 돕는 일을 하고싶어졌숩니다 그래서 물리치료학과나 재활의학과를 알아보는 중인데    물리치료일보다 지방 국립 경영학과가 더 비전있나요      년제와 전문대간 차이가 큰가요      제 내신 성적으로 갈 수 있는곳 리스트를 알려주세요     전문대나와도 스포츠 팀 구단에서 일 할 가능성이 있나요  ,재활의학과
141,어깨 근전도검사,어깨 근전도검사 기록지입니다  영어로 된부분및 전체해석 부탁합니다 감각신경  운동신경 침근전도  체성감각유발전위검사에 이상이 있으면 어깨에 어떤문제가 발생하나요,재활의학과
142,아버지 환자 가 코로나 확진이 되셨습니다 ,현재 재활병원에 계시는데 병원 안에서 확진 판정을 받으셨어요  근데 병원에서는 퇴원을 해서 집에서 격리를 하라고 하셨다네요   같이 있던 간병인은 음성이 나왔는데 확진자와 한 집에 가서 캐어를 해달라고 하셨다는데 이게 맞나요   어머니는 안 계시고 아들만 둘 있는데 확진자를 데리러 갈 때의 접촉과 화장실도 스스로 못 가시는 분을 때마다 모시러 가서 접촉하는 것이 가능한일이에요 ,재활의학과
143,척추측만증,제가 척추측만증이 있어서 어깨 양 높이도 다르고 골반도 양쪽 높이가 달라요 평소에는 괜찮은데 공부하느라  시간이상 앉아있으면 어깨가 너무 아파요   며칠 쉬면 괜찮아지다가 또 오래앉아있으면 엄청 아파요  고등학생이라 앞으로 더 오래 앉아있어야하는데 많이 앉아있으면 엄청 아파요     척추측만증은 아프지만않으면 교정해도 안해도 상관없다는 걸 어디서 본것같은데 교정 해야할까요     교정은 어떻게 하나요   병원가야하나용 아니면 한의원에서 도수치료같은걸 받으러 가야하나요,재활의학과
144, 년전쯤에   여일간 의식불명에 빠질만큼 큰 교통사고를 당했던 아들의  지적장애 등록 을 약 한달전쯤에 등록해놨는데요  ,부모된 입장에서 이 사실이 너무나 속상하고 괴로운 일이지만  이미 닥친일을 되돌릴 수는 없으니   이번엔 상태에 맞게 등급부여가 잘 될까요  아래 첨부한 사진은 교통사고 민사소송 중 법원이 지정해준 대학병원에서 받았던 신체감정서의 일부 내용이고  신체감정을 한 대학병원측에서 교수님을 당분간 대면할수가 없다하여  환자측으로부터 교수님의 보호를 위해선지  서로 짜고 허위통정을 할수가 있어서 그런건지 정확한 이유는 모르겠습니다   장애관련한 직접적인 진단서는 원래 아들 상태를 봐주시던 다른 종합병원의  차는 못되도    차쯤 되는 사이즈의 병원입니다 의사선생님께 부탁해 주민센터를 통해 공단에 자료를 제출했습니다  대학병원의 검사를 받으면서 찍었던 mri  pet ct 등의 cd 자료들은 당연히 함께 제출했고요  이전에 대학병원에서의 신체감정을 받기 전에도 아들 머리상태가 원체 이상해서 미리  웩슬러 지능검사 를 받고 그 결과지를 장애진단서와 함께 제출해봤었는데  그땐 웩슬러 검사지상으로는 장애가 맞으나  영상자료에서의 근거가 부족하다며 미등록처리가 됐었습니다   당시 제출했던 영상cd는 사고초기에 찍은 종합병원의 mri가 전부였습니다  ,재활의학과
145,재활요양병원 고관절 입원하면 받는 치료는 어떤게 있나요   강남   대초반 여 재활요양병원 ,최근에 고관절 수술을 받아서 재활요양병원에서 재활을 하려고 합니다   혼자 왔다갔다 하기가 불편해서 아예 입원치료를 받으려고 하는데요   재활요양병원 통원치료와 입원치료에 차이가 있나재활요양병원의 입원치료 프로그램에 대해 궁금합니다 ,재활의학과
146,허리디스크 있는 고딩인데요,새벽 밤만 되면 다리가 유독 저려요 너무 저려서 잠도 안오고요 이게 계속 저리니까 밤을 새게되는데요 어느병원에 가야하죠 원래 다니던 병원에서 약을 받아 계속 먹는데 너무 약한 것 같아서요  재리는데 좀 잘 잡는 약 타고 싶어요 진짜 푹 자고 싶은데 오늘 밤도 못 자고 밤새게 생겼네요     하    신경외과를 가야 하나 싶기도 하고요 디스크 터져서 필테 재활 치료 받고 있는데 지금은 필테만 받고 있어요  재활물리치료를 다시 가야 될 것 같긴 해요,재활의학과
147,허리디스크 터진 고딩,말 그대로 허리디스크 터졌구요 제가 좀 완전 밑에 살아서 작은 병원이든 시내병원이든 서울 아산병원도 순천 병원도 다 다녀 봤는데요  그때는 다리가 저려서 밤 샐 정도는 아니었어요 지금은 밤을 새다 못해 아침까지 쭉 저려서 울고 못 걸을 정도 구요 한 작년  월   월 달 쯤 갔는데 벌써  월이고 저도 운동도 꾸준히 가지만 뭔가 안 나아진다는 생각이 자꾸 들어요 소염제 약으로 치료도 해 봤는데 안 먹혀요이젠 내성이 생긴건지 아플 때마다 먹으랬는데 전혀 안들구요 안 아픈 자세  그거 따라 해봐도 소용  도 없어요 그냥 아픈 다리 부여잡고 다양한 자세로 끙끙 대기 밖에 없어요   진짜 저 이제 고 인데 어떻게 살아야할지 모르겠어요 죽고싶다고도 엄청 빌었구요 이게 아는 사람만 아는 고통이라고 진짜    그래서 주사를 맞아야 하나 싶기도 해요 아님 더 강한 약을 타야 하나   밤마다 저리니까 하지불안증후군도 생각 해 봤고 이걸 쓰는 지금도 다리 겁나 저려서 못 걸어서 주저앉고 써요   하 진짜 살기 너무 힘이드네요,재활의학과
148,손가락 골절 재활치료  방치  늦었을때,손가락 후유장애 후유증에 관해 질문드립니다  안녕하세요 작년  월에 부대에서 풋살하다가 손가락이 골절  부위는 중지손가락 중수지 관절  되었고 뼈는  주만에 붙었습니다 병원에서 재활 해주라고 했지만 정확하게 알려주지 않고 그냥 휴지 같은거 쥐었다 폈다 해주라는 식으로만 얘기해서 그런식으로 조금 하다가 일상생활에 별 지장없어서 어느덧  개월이 지났는데 아직도 주먹을 못쥐는 겁니다   중지 손가락만 안 쥐어짐  제가 게을리 재활한 것도 있고 군병원이다 보니 대충대충 알려주는 상황도 있었습니다  최근들어 운동 다시 시작하려하는데 주먹이 안쥐어지니 갑자기 너무 불안해서 전역하고 오늘 정형외과 가보니 많이 늦었다고 아마 예전상태로 돌아가기는 힘들수도 있다고 얘기하시는데    지금부터 재활 열심히 해도 다시 돌아가기 많이 힘들까요     만약 주먹을 평생 못쥔다면 수술 같은건 있나요   알아보니 손가락 관절은 초기관리가 엄청 중요하다고 하는데 그 얘기만 해주셨어도 이 상황까지는 안 왔을거 같고 너무 후회스럽고 힘듭니다 도와주십쇼  아직 손가락 재활운동하면 구부릴때 아프긴 합니다   엑스레이 결과 뼈는 정상적으로 다 붙었다고 합니다 ,재활의학과
149,청소년 디에타민 처방,제가 발레를 했었는데 허리부상때문에 반년정도 쉬었더든요 그래서 살이   키로 가까이 쪘어요   발레 다시 시작해야되는데 도저히 이 몸으론 어떻게 할 수 없고 이런 몸이 처음이여서 막막하고 우울해요   저는   살이고 만으로   살인데 디에타민 처방 가능하나요  부모님께선 허락안해주실꺼 뻔한데 저 혼자 병원 가면 처방해주시나요  대전에 사는데 처방 거의 무조건 해주시는 병원 좀 알려주세요,재활의학과
150,팔꿈치 부상 치료방법,제가 팔꿈치에 물이 찼다는 진단을 받았는데 제가 냉찜질을 안 하고 있단 말이죠  냉찜질을 하는 게 좋을까요  그리고 약을   일 정도 먹었음에도 상태가 호전되지 않네요 그냥 계속해서 찜질을 하는 게 좋을까요  그리고 팔꿈치를 조금씩 펴려고 노력을 해야할까요 아니면 그냥 팔꿈치를 최대한 사용을 하지 말까요,재활의학과
151,팔꿈치추벽증후군,헬스를 하시는 분들 중에서 팔꿈치추벽증후군을 겪고 계시거나 겪으셨던 분이나 이 질환에 대해서 잘 아시는 분 혹시 있으신가요  약물치료는 호전이 하나도 없고 더욱 심해져서 도수치료에서 체외충격파치료 열치료  번 받았는데 호전이 별로 없어서요 다쳐서 아픈게 아니라 어느 날 갑자기 양쪽 팔꿈치에서 통증과 증상이 나타났습니다 그 후  개월이 지났는데 더 심해진 기분입니다 이 팔꿈치 추벽 질환을 다루는 글 같은건 쉽게 찾을 수가 없어서 저와 같거나 잘 아시는 분 부탁좀 드리겠습니다     증상    팔을 오래 굽히고 있다가 피면 팔꿈치에서 걸리는 느낌과 함께 뚝소리가 난 후 펴짐    팔을 접을땐 괜찮다가 필 때 뚝 소리    팔을 일자로 쭉 피면 팔꿈치 통증    팔 전체에 힘을 주면 팔꿈치에 힘이 들어가면서 통증,재활의학과
152,운동하고나서 발가락이 이상해요,두번째 발가락만 이렇게되는데 어떻게해야되고 왜 이런건가요 ,재활의학과
153,거북목 교정,거북목이라 그런지 평상시에도 어깨가 많이 결리고  업무할때 뒷목이 너무 뻐근하네요  시간나면 조금씩 스트레칭을 하는데 교정을 하면 얼마나 걸릴까요 ,재활의학과
