151,팔꿈치 골절 수술후 군 면제 문의,자전거 타다가 넘어졌는데 팔꿈치가  조각이나서 수술후 인공뼈와 철심 철판을 박고 현재 재활중이며 다 붙은후 철판은 제거하고 인공뼈와 철심은 그대로 둡니다 현재 치료가 좋은방향으로 잘 되고있는데 손목이 위로   도까지 안올라가지고   도정도만 올라가지는데 수술과 휴유증으로 공익이나 면제판정 받읗수있나요  ,재활의학과
152,손등 부었는데,손등이 심하게 부었습니다 딱히 맞거나 부딪히거나 한건아니고  주전에 맹장수술 하면서 링겔 맞았습니다 그리고나서 이주정도 뒤부터 붓기 시작했는데 속등이랑 팔이 많이 부었습니다 뼈가 아픈건아닌데 힘줄이라 해야되나 그 링겔맞는 핏줄이 다 아픕니다 어디가 잘못됬을까여    내공    걸어요 특히 손목 위에 있는 핏줄이 너무 아픕니다  ,재활의학과
153,거북목과 허리질병 관련하여 궁금한게있습니다,제가 많이 비만이엇는데 걸어다닐때 구부정 했엇어요  그래서 최근에 허리를 펴려고 노력을하고 있긴한데 잘안되는데    다이어트를 조금 진행했고 현재도 징행중인데  체형교정이 필요하다고 생각합니다  그냥 체형잡아준다고 붙어있는 병원  도수치료인가   이런데 가는게좋을까요  아니면 체형교정운동 필라테스나 이런데를 병행해야 할까요      제가 나름 조사한바로는 운동 치료 습관고정   이 병행되야 고칠수있다고 들엇어요  ,재활의학과
154,x자다리 질문,다리 유전인데 그럼 뼈모양 이니까 교정 못하나요  그 내측어쩌구 근육 단련하면 유전인데도 일자 되나요  척추같은 뼈를 비틀어지게 하나요 척추측만증이라 납둬도 몸에 이상 없나요,재활의학과
155,코로나 확진 등교,제가 학교 기숙사를 쓰는데 코로나 양성이 떠서 못갔습니다  그래서 자가격리 끝나고 학교에 가려면 어떡해 해야하죠    전화를 하고 가야되겠죠    확진이 뜨고나서도 학교측에서 연락이 안와서 당황스럽네요  학교에서 아무 연락을 받지 못했는데 등교할때 연락을 하고 가야겠죠   기숙사도 들어가고 하려면   ,재활의학과
156,매몰법 재수술 했는데 라인이 울퉁불퉁 튀어나왔어요  주 됐습니다,매몰법   년 전에 한게 풀려서 이번에 다시 했는데  땀 꼬맷구여  주 지났습니다 근데 라인이 울퉁불퉁 튀어 올라와서요 이거 염증인가요  흉질까봐 걱정이네요  ,재활의학과
157,한쪽 어깨 통증,작년 겨울때  주동안 왼쪽 어깨 팔둑이 너무 아팠었는데 처음엔 그냥 담인줄 알았지만 팔을 아래로 내리면 유독 아파서 팔을 굽히고 허리에 손을 대고만 살았습니다  주가 지나고 통증은 좀 사라졌는데 어깨가 뻐근하고 뭉치고 어깨가 과하게 움직임과 동시에 뚜득 소리가 가능 해졌습니다 또 왼쪽 쇠골이 거의 안보입니다 척추측만증으로 어깨가 비대칭이라 그런지 왼쪽어깨가 올라가서 가방 맬때 압박이 됐나 싶기도 해요 그리고 제가 오른손 잡이 임에도 불구하고 오른손 악력   왼손 악역  로 나왔고 거울을보면 왼쪽 어깨가 더넓고 오른쪽은 작습니다 왼쪽 어깨가 뻐근해서 걸을 때도 왼쪽팔은 움직임이 없고 어색합니다 그때문에 거를때도 불편하고 일상생활이 전혀 안돼네요    갑자기 나빠진 몸에 죄책감도 들고 너무 무서워요   도와주세요,재활의학과
158,안녕하세요   살 소녀입니다,담배를  년펴왔는데 요즘 가끔 목욕을 하다가 움직이기가 힘들고 답답하고 어지럽고 그래서 무슨 증상이고 폐나 심장이 많이 안좋은지 유전때문에 몸이 많이 안좋은데 계속 펴도 괜찮은지 등등   그리고 우울증 검사나 불면증 검사 등도 받고 싶은데 정신병원이나 일반병원 어딜가야되고 뭐라고 해야되고 비용도 얼마인지 알려주세요 그리고 담배도 확 끊어버리는 방법도 알려주세요,재활의학과
159,왜이렇죠 ,누워서 기지개를 펴면 다리까지 쫙피게 되잫아요 그렇게하면 종아리쪽이 근육파열된것마냥 졸라게 아픕니다  그러다가잠깐뒤에 다시 괜찮아져요  제가 많이 뚱뚱한 편인데 그래서 그럴까요 ,재활의학과
160,왼쪽아래 복부가 맞은것 처럼 아파요,어제부터 살짝 아프더니 지금은 맞은것처럼 순간순간 아프네요  근육뭉친것처럼 당기면서 아프구요  제가 방귀는 자주        병원을 간다면 어느 과를 가야 할까요  CT는 찍어야겠죠 ,재활의학과
161,걷기가 힘들어서 학교에 생활에 지장이 많아요, 주 깁스하고 개학  일 전에 풀었는데 걷기가 힘드네요 그래서 목발에 의지하면서 걷고 있어요 제가 낯가려서 중  새학긴데 친구도 없어요  월 안엔 걷게 될테지만 급식 먹기도 불편해요  선생님이 가져다 주시고 잔반 버려주시긴 함  체육 수행평가도 못해서 생기부에 지장이 있을거 같아요 그리고 제가 약간 편애  같은걸 받으니 주변 눈치도 보여서 힘드네요 저는 완전히 걸을수 있을 때 까진 학교를 쉬고 재활에만 집중하고 싶은데 부모님은 허락을 안해주시네요 쉬는시간에도 어딜 갈수가 없으니 반에 혼자 버려져요 진짜 너무 힘들어요 어떻게 해야 목발 없이 걸을수 있나요  전 최대한 빨리 가능하다면  월   일 전까지 걷고싶어요 기구같은걸 착용하면 될까요  참고로 발목 수술했어요 교정 목적으로 진짜 짜증나요 새학기 첫날에 친구들도 못사귀고 너무 짜증나요,재활의학과
162,손목 강화 재활 운동, 달전에 인대가 늘어났는데 지금 병원 다니면서 통증도 많이 좋아졌어요 그런데 팔을 안쪽으로 돌리면 아직 미미한 통증이 남아있는데 재활운동으로 통증을 잡을 수 있을까요   어디서 들었는데 다쳤던 인대 주변 근육을 강화하면서 동시에 인대를 잡아준다  그런 얘기가 있더라고요  사람한명 구한다고 생각하시고 답변해주세요   ,재활의학과
163,목동에 무릎인공관절 수술 후 입원재활학과 추천좀 해주세요,어머님이 목동 힘찬병원에서 양쪽 무릎 인공관절 수술을 하셧습니다  퇴원후 재활병원에 입원예정인데 목동에 추천할만한 입원할수 있는 재활병원 소개좀 해주세요  간호간병통합이면 더 좋겠는데  추천부탁합니다,재활의학과
164,흉부 흉추 어깨당김,흉부 흉추 어깨 당김이 있습니다  당김증상이 심하면  찢어질것같고 호흡곤란이 옵니다  목디스크 허리디스크 있습니다 흉부디스크는 아니라고합니다   목 등 허리 골반mri는 찍었습니다  대학병원 무슨과에가서  무슨검사를 해야할까요 ,재활의학과
165,근육때문에,가슴이 답답할수있나요  호흡하기도 불편하고 마스크끼면 더욱더 답답합니다 동네마트가도   분이상 못있겠습니다 근데 또 동네한의원을 다니고 있지만   분정도 버티긴합니다 심폐기능은 검사상 정상입니다,재활의학과
166,발목 인대가 부었어요 병원 갔고 지금 한  주 정도 됐는데 제가 운동이 너무 하고싶어서 운동을 했거든요  아픈채로 운동하면 이거 평생 안나을까요,발목 인대가 부었어요 병원 갔고 지금 한  주 정도 됐는데 제가 운동이 너무 하고싶어서 운동을 했거든요  아픈채로 운동하면 이거 평생 안나을까요    걱정은 되는데 운동은 너무 하고싶고 그래서 질문 남겨요,재활의학과
167,진짜 너무답답합니다,아빠가 쓰러진지  개월이 넘어가고 소득이 없는데도 이전에 받았던 소득때문에 지원을 받지 못한답니다 아버지 재활비용이랑 입원비 합치면      만원정도 나갔는데 이마저도 마이너스 통장을 개설해서 그런건데 나라에서 지원받을수있는 방법이 있을까요 ,재활의학과
168,무릎 장애 관련 해석 쫌 해주세요  ,안녕하세요 저는 이번에 장애진단서를 발급 받았는데 아무리 검색하고 해봐도 해석이 안되서 이렇게 글을 남깁니다     수술은     년    에 좌측 무릎 관절경하 전 후십자인대 재건술 및 외측부인대 재건술     년   에 우측 무읖 관절경하 전십자인대 재건술 및 연골 연마술 외측부인대재건술을 했습니다   그리고     년 월  일에는 양측 무릎 관절 운동 범위 검사를 했습니다  좌측 신도 도 굴곡  도  우측 신도 도 굴곡   도  또 엑스레이 동요검사도 하였습니다  전방동요 우측 mm 좌측 mm 후방동요 우측 mm 좌측  mm 외반 불안정성 우측  mm 좌측    mm 내방 불안정성 우측  mm 좌측 mm 이렇게 결과가 나왔습니다   교수님 다음 진료는  개월 후 라서 자세한 설명을 못 들었는데 이런 결과로 장애등급을 받을 수 있을까요 ,재활의학과
169,팔 골절 후 야구 재활,그냥 야구좋아하는   대 초반 남자입니다 골절로 인해 철심을 박는 수술을 했고 현재 회복후 야구를 하고있는데 공을 세게 던지면 원래 팔꿈치가 아팠는데 반년간 야구 쉰 뒤 하고나니 팔꿈치는 아프지않고 어깨가 아프며 구속또한      km 줄어들었습니다     깁스하며 팔을 전혀 사용하지 않아서 구속이 떨어진걸까요      악력도   중반에서   대로 반토막이 났습니다 무슨운동을 해야할까요     구속 회복 및 어깨통증  팔 컨디션 올리는 튜빙이나 운동법좀 알려주세요  구속은 예전에는 툭툭던져도    은 그냥 넘고 최고    초중반까지 나오다가 이제는    정도 나옵니다    ,재활의학과
170,입원 소견서요청,안녕하세요   월에 발목 골절 수술을 받고  월에 군병원에 입원했을때 치료를 제대로 받지못하여 여기서 퇴원 후 민간 개인정형외과에  주간 입원재활치료를 받으려합니다 개인정형외과에서 입원을 위해 수술한 병원에서 소견서를 받아오라는데 소견서 요청을 하면 요청한대로 적어주실까요 ,재활의학과
171,체형교정 질문 드립니다,진짜 온갖 안 좋은건 다 있는 상태입니다 어깨비대칭 익상견갑 라운드숄더 골반틀어짐 등등    체형불균형 그 자체인데    병원 다닐 형편은 안 되어서 일단 유튜브를 보며 여러 스트레칭과 운동을 따라해보는데 효과가 보이는건지도 모르겠고 좋아지는게 눈에 보이지 않습니다    헬스장에서 웨이트를 해도 양쪽 느낌이 달라서 한 쪽만 잘 되는 느낌이고    오래 꾸준히 하면 되겠지만 더 좋은 방법이나 팁이 있으면 도움 받고 싶습니다   예를 들면 등 운동 하는 날에는 로우 동작을 더 많이 해야한다던가   인터넷에서 봤던거 같음   체형불균형이 있을 때는 운동을 어떻게 해야할까요  날이 갈 수록 몸이 좋아진다기보다 더 나빠지는 기분입니다   ,재활의학과
172,척추측만증 증상,제가 초 때부터 척추측만증이 심한 상태였고  고 인 지금 더 심해졌습니다    버릇이 허리에서 뚜둑 소리내는건데 가끔 허리 잘못 움직이면 갈비뼈가 끊어질 것 같은 통증이 와서 그만뒀고    숙여서 보면 왼쪽 갈비뼈가 엄청 많이 튀어나왔고 오른쪽은 또 들어가 있어요 요즘에는 면역력이 떨어져서 그런지 두통도 오고 목도 뻐근한데  일주일에 한번씩 가슴 주위 갈비뼈가 찌릿찌릿했다가   초 정도 지나면 괜찮아지는데 측만증 증상이 심해서 주변 장기가 눌리거나 심장이 눌리거나 하면 간헐적인 부정맥 같은게 생기기도 하나요  갈비뼈가 찌릿할때 심장에 충격 같은 것이 같이 와서 그런지 쿵쿵 뛰었다가 잠잠해지네요   일주일에 한번      초쯤 발생해요   년 전 갔던 병원에서는 교정기가 최선이고 여기서 더 심해지면 수술해야 한다고 하셨습니다 ,재활의학과
173,pcr검사 후 당일외출 가능한가요 ,검사결과는 내일오전에 나온다는데 지금 외출이 가능한지 궁금합니다 ,재활의학과
174,발목 뻐근,고 여자입니다 오른쪽 발목이랑 복숭아뼈가 아픈건 아닌데 기분나쁘게 약간 뻑뻑하달까요 뻐근하고 제 발목이 아닌거같은 느낌이 들었어요 오늘 조금 경사로계단을 많이 왔다갔다해서 그 영향으로 그런걸까요  많이 안 좋은 걸까봐 불안해요  ,재활의학과
175,,,
176,,,
177,,,
178,,,
179,,,
180,,,
181,,,
182,,,
183,,,
