53,코로나 밀접촉자 관련 문의,오늘 새벽 남자친구가 코로나 증상이 있다고 말을 했고  아침에 일어나서 자가검사 키트를 사서 했는데   줄이 나왔습니다  선별진료소 가서 둘 다 신속항원 검사를 받고  남자친구 친구도 와 있었어서 같이 받았습니다   자차이동   남자친구 친구랑 저랑은 신속항원검사  줄이 나왔고  남자친구는  줄이 나와 pcr검사를 받고  지금 따로 격리중입니다  이럴 경우 저도 pcr검사를 받아야 한다 생각이 들어서 선별진료소 관계자분께 말씀 드리니  신속항원검사  줄이 나와야 하거나 보건소에서 연락이 와야 pcr검사를 받을 수 있다고 안내 주시더라구요    여기서 제가 궁금한건 남자친구가 거의 확진 판정을 받을 것 같은데 내일 보건소에서 연락이 올 지   만약 보건소에서 연락이 오지 않는다면 어떻게 해야하는지    그리고 저는 저도 따로 집에서 자가격리를 하고 다시 검사를 받아야 한다고 생각을 하는데 남자친구는  신속항원검사 음성판정이 나서 일상생활 해도 된다고 하고     저는 이해가 가질 않습니다  같은 공간에서 있었는데 어떻게 일상 생활을 해도 되는건지    백신은  차까지 맞은 상태이며 금일            기준    일 경과입니다       신속항원 음성이 떴다고 일상생활을 해도 되나요      보건소에서 연락이 안 오면 어떻게 해야 하나요      지금은 음성 떴지만 나중에 양성 뜰 수도 있으니 집에서 자가격리 해야 하는거 맞죠 ,재활의학과
54,왼쪽 턱 근육에 통증이있어요 자고 일어났을때나 오랫동안 입을 쓰지 않을때  공부할때 등  뻐근하고 아파요이를 꽉 깨물어서 확인해보면 왼쪽턱만 아,왼쪽 턱 근육에 통증이있어요 자고 일어났을때나 오랫동안 입을 쓰지 않을때  공부할때 등  뻐근하고 아파요이를 꽉 깨물어서 확인해보면 왼쪽턱만 아파요 턱운동 하고 손으로 마사지해주면 좀 풀리기는한데 며칠째 아프네요 어디 병원에 가야할까요,재활의학과
55,필라테스 하면 다리 불균형 좋아지는가요,재활의학과에서 양쪽 다리길이가 다르다해서 깔창을 맞췄습니다 무릎과 허리통증이 있어가지고 나아진것 같긴한데 필라테스 가 도움이 되는가요,재활의학과
56,제가  주정도 고관절 통증이있어 MRI찍고 무혈성 괴사가 양쪽에 있다고 진단을 받았습니다  아직 초기 단계라고 하는데 초기단계에 혈액공급을 원활,제가  주정도 고관절 통증이있어 MRI찍고 무혈성 괴사가 양쪽에 있다고 진단을 받았습니다  아직 초기 단계라고 하는데 초기단계에 혈액공급을 원활히해주는 시술이 있다고 들었습니다 어떤건지 궁금합니다  그리고 어떤 운동을 어느정도의 강도로 해야할지 궁금합니다 ,재활의학과
57,재활병원 연하장애치료를 받으면 경관식 그만할 수 있을까요   서초구   대초반 여 재활병원치료 ,최근에 어머니께서 뇌졸중 후유증으로 재활병원 입원을 하셨습니다   후유증 탓에 연하장애도 함께 와서 재활병원에서 경관식을 하면서 연하장애 치료도 함께 한다고 상담받았는데요   혹시나 평생 어머니께서 경관식을 해야할까봐 걱정이 됩니다   재활병원 연하장애치료를 받으면 일반식이 가능해질 수 있나요 ,재활의학과
58,제가 다친뇌쪽이 증상이 혹시뭔가요 ,저희 담당교수님은 제가 다친쪽에 딱히 말을 안해주고 진단서에서 좌측 열공 연수 뇌경색이라고 적혀있는데 부위가 별로 크지 않다고 괜잖다고 하시는데 아직도 일년다되가는데 어지러움으로 인한 균형장애 걸을때 한쪽쏠림이 안없어지는데 원래 이런건가요 ,재활의학과
59,종아리 알 빼는 법,종아리을 열심히 마사지 하고 걸음걸이도 바꾸고 스트레칭도 해서 엄청 말랑해 졌는데요   말랑 해지기만 하고 왜 얇아 지진 않죠    내일 모레 개학인데    어떡하죠 안쪽이 뽁 튀어나와서 진짜 엄청 두꺼워 보임여   들어가기만 하면 얇아 보이는데     ,재활의학과
60,다리가 저려요,금요일에 운동 후 스트레칭을 하는 도중 종아리쪽이 좀 뻐근했는데 이게 스트레칭때문이겠지 하고 버텼는데 끝나고 나니까 종아리부터 발바닥까지 엄청 저리고 찌릿찌릿했어요  집가서 다리 스트레칭 좀 더 해주고 시간이 지나면 해결되겠지 했는데 일요일까지 계속 저리고 아직도 찌릿찌릿한게 안풀리네요  시간이 해결해 줄까요 ,재활의학과
61,자가격리후  일 격리해제,  일   시 부터 해제됬는데 따로 보건소가서 뭔갈 해야하나요  스치듯 본건데 그냥 일반병원에서 신속항원만 하고 음성받은걸 제출하면되는건거요 ,재활의학과
62,제가 입 안 물혹 제거수술을 했는데 입이 안 열려요,수술 한지는 약  주 됐는데 재활  운동이라고 입 열리는 연습을 하래요 근데 맘처럼 되질 않고 입을 벌리면 얼굴 뼈가 부서질 듯한 느낌이 들고 근육이 찢어질 듯이 아파요   근데 재활운동을 하지 않으면 앞으로 이대로 지내야 한다면서 아프더라도 하라는데 어떡하죠   무서웡요,재활의학과
63,허리디스크 운동,제가 허리디스크 탈출증인데 다이어트를 하고 싶거든요 특히 복부 쪽으로 할건데 혹시 허리디스크 환자가 하면 안 되는 운동이 있을까요 ,재활의학과
64,어지러워요   제가 불과 몇주전에만 해도 별로 안심했는데 갑자기 심해졌어요 몇주전에는 그냥 너무 오래 누워있으면 좀 어지러워서 앞이 조금 안보였,어지러워요   제가 불과 몇주전에만 해도 별로 안심했는데 갑자기 심해졌어요 몇주전에는 그냥 너무 오래 누워있으면 좀 어지러워서 앞이 조금 안보였던 정도 근데 갑자기 요즘은 일어날때마다 어지러워요 심각한거 아니겠죠  백신  차 를 최근에 맞긴 했어요,재활의학과
65,손목터널증후군 ,요즘 손목이 너무 아파여 한번 손목 돌려주면 더 아퍼짐    먼가 찡 하면서 아픔   이거 손목터널증후군인가여,재활의학과
66,손목 골절,손목이 골절돼서  수술 안해도 될 정도  깁스를 일단 햇는데 지금 팔꿈치 위로 올라오는 통깁스   를 햇는데 반깁스로는 안되는 건가요  그라고 석고깁스를 하면 석고깁스도 반깁스처럼 짧게 할 수 있나요  ,재활의학과
67,발바닥 다침 ,제가 침대에서 백공중을 하다가 침대딱딱한곳에 쌔개부딫여서 아픈데   분지다고 보니 다친곳이 걸을때 아파요 왜그러죠,재활의학과
68,잡생각 때문에 빨리 못자요 ,제가 잡생각이 많아서 매일    시간 잡생각하다가 잠드는데 왜이럴까요   고 이고 일어날때 상쾌하게 일어날 때보다 몸이 무거운 적이 많은 것 같습니다  잡생각 안하는 방법 있을까요 ,재활의학과
69,어깨랑쇠골쪽 인대다쳤는데 멍이늧게올라왔어요,멍이없다가 갑자기 멍이올라왔어요 최대한빨리 대답해주세요   ,재활의학과
70,다리비율이 너무 이상한데 종아리 길어지는 법 있나요,무릎을 기준으로 위아래가     이정도에요      정도가 가장 이상적이라고 하던데 종아리만 길어지는 법 있을까요    하비는 아니라서 종아리 살 뺄 이유도 없는데 검색해보면 종아리 살 빼는 영상만 나오더라고요     이해를 도울 사진 첨부해요  ,재활의학과
71,척추측만증  목뼈 질문,등에 힘을 주면 목뼈가 옆으로 휘는데 왜 이런걸가요  양쪽 어깨 길이  높이도 약간 다른거 같은데   제가 척추측만증이 있는데 척추측만증 때문인가요  ,재활의학과
72,무릎퇴행성 관절염 운동,무릎퇴행성 관절염으로 인하여 통증이 심합니다  특히 밤만 되면 더 심합니다  운동 어떤걸로 해야하나요    실내자전거운동은 해도 되나요   안된다 된다 말이 다다르네요 ,재활의학과
73,발목 통증,제가  개월 전에 운동을 하다가 발목을 안쪽    그러니까 쭈그려 앉은 상태에서 위에서 눌려서 삐었는데요 첨에 한의원에서  달 동안 침 맞고 그러다가 조금 괜찮아져서 안 다니고 있었는데 통증이 완전 사라지지는 않고 계속 조금씩 아프네요 지금이라도 병원가서 검사를 받아야 할까요 ,재활의학과
74,재활 치료,저 진짜 다시 앉고 걷고싶은데 도움 되는 재활 운동 없어요 지금 혼자서 앉지도 못하고 말도 안되고요 걷지도못해요     도와주세요   ,재활의학과
75,발목인대 늘어났을때 재활,축구선수인데요  발목을 옆이 아닌 앞으로 꺾여서 병원에 가보니 가운데 인대가 늘어났다는데요   주일만 쉬고 조깅부터 천천히 시작하라고 하시는데 지금  주일이 됐어요  하지만 통증이 있는데 걸을때도 살짝 통증 있고 한 발로 중심 잡고 서있는 운동도 하는데 그거 할때도 통증 있고 세라밴드로 발목 운동 할때도 통증 있어요  특히 발목 돌릴때도 있는데 필때와 굽힐때 특히 새끼발가락 쪽으로 돌릴때가 가장 통증이 심해요  가운데 인대가 늘어났다는데 바깥쪽 전체적으로 통증이 심합니다  가운데든 바깥쪽이든 눌러봤을때 다 괜찮아요  지금 현재로서 어떻게 해야할까요  가벼운 재활을 시작할까요  또 가장 알고싶은건 통증이 있는데 재활을 해도 되나요  통증이 있어도 재활을 하다보면 점점 통증이 줄나요  그리고 맨날 한의원 침 맞는데 잘못하면 더 악화 되나요  구체적으로 좀    ,재활의학과
76,코로나 확진자 접촉,어제 친구랑 밥 먹고 카페 가고 노래방 가고 막 친구가 제꺼 음식도 뺏어먹고 손도 맞대고 이랬는데 놀고 헤어지고 몇 시간 뒤에 친구가 자기 코로나 자가진단키트 양성 떴다고 카톡 왔습니다 심지어 머리도 아파해서 유증상자였고요 당장 어제 대학교 기숙사 땜에 코로나 검사 했었는데 음성이어서 안심 했었다고 하네요  일단 전 유증상자랑 밀첩 접촉 한 상태입니다 근데 저는 친언니랑 만나서 같이 밥 먹는 도중에 친구한테 코로나 양성 떴다는 카톡을 받았었고요  제가 타지에서 언니 자취방으로 온건데 사실 오늘 언니가 서울에 가고 싶어하는 곳 한달 전부터 예약해놔서 가는 날이었거든요  새벽에 자가진단키트로 언니랑 해보긴 했는데 어차피 걸렸어도 잠복기일테니 음성이 떴고요  저는 확진자랑 접촉 해서 못 간다 하는데 언니가 자꾸 그냥 가자고 하네요  어떡하면 좋을까요 역시 그냥 안 가야겠죠 ,재활의학과
77,어깨 근육이 너무 아파요   ,한 열흘전부터 어깨가 이상해요 운동떄문인지는 모르겠고  뼈가 아픈건 아니에요 삼각근 쪽에 불편증상이 있는데   가만있으면 안 아프고요 팔을 들어올리거나 어깨를 움직이는 동작을 하면 근육이 뭔가 뭉치고 걸린 느낌  이 들어요 열중쉬어 자세가 젤 불편해요 떙기는 느낌  사진에 보이는 자세가 젤 불편해요 아예 통증떔에 못하겠어요 운동해서 알배기는 근육통은 아니고요  되게 기분 나쁜 느낌이에요 정형외과 가서 엑스레이 찍어도 뼈가 아니니까 별거 나올거 같지도 않은데   아주 아프진 않고 저런 자세만 피하면 생활하는데 약간 불편한 정도에요  운동후에 이런 증상이 나타날 수도 있나요  그냥 가만 있으면 나아질까요,재활의학과
78,어깨 목 부분이 진짜 너무 빠릿하고 아파요  ,안녕하세요 전   살남학생입니다 아까 팔굽혀펴기를 하다가 목에서 갑자기 쉬원한 느낌이 들더니 엄청 찌릿거리고 일어서서 앉아보 니 왼쪽어깨 등 목이 너무 아픕니다 뼈 뿌러진건가요  아님 시간 지나면 괜찮어지나요  알려주세요,재활의학과
79,어제 심하게 아팠는데 모든게 딱딱해지고 굳는거 같은 느낌,정신적으로 이상해진걸까요  이게 뭔뜻이냐면 지금 폰도 딱딱해지고 있는거 같고 제 몸이 딱딱해지는거 같아요 왜이래요 ,재활의학과
80,고관절 수술,인공고관절 반치한술 달 정도 되었는데 집에서 혼자서 재활 할수 있는 운동,재활의학과
81,오른쪽 무릎 뒤쪽 찌릿함,정확히는 잘 모르겠는데 사진처럼 오금은 아니고 오금 옆 뼈  걸을 때 가끔씩 찌릿 하면서 아파요 특정한 동작을 했을 때 아픈게 아니라 그냥 걸을때 아픈데 발 디딜 때 말고 디디고 나서 밀어서 반대 쪽 발로 바꿀 때 아파요    무릎 쫙 폈을 때 아픈 것 같긴한데 정확히는 잘 모르겠어요 오늘 갑자기 이런거라서 당황스럽네요    제가 x자 다리이고 척추 측만이 있긴한데 이거랑은 관련 없겠죠  이거 무슨 증상인지 알려주세요  ,재활의학과
82,척추랑 골반이 문제면 척추만 교정해도 골반이 자동으로 교정이 되나요 ,척추랑 골반이 둘 다 삐뚤고 휜 것 같은데   척추만 교정한다면  골반도 같이 자동으로 교정이 되나요   아니면  척추도 교정 하고  골반도 같이 교정 을 시켜야만 되나요   척추 교정 비용이랑 골반 교정 비용을 둘 다 하기엔  제법 비싼 것 같아서 이렇게 여쭤 봅니다 ,재활의학과
83,측만증이 하면 안되는 운동이 무엇인가요,제가 척추 측만증이 있는데 운동은 해야 할 것 같아서     측만증이 하면 안되는 운동이 있나요  있다면 어떤걸 하면 안되나요  알려주세요,재활의학과
84,안녕하세요 갑자기 손이 떨려요,곧 있을 개학때문인지 아닌지 갑자기 손이 떨려요 오늘 저녁 부터 계속 떨리는데 왜그런걸까요,재활의학과
85,코로나 해제했는데 다리가 아프네요 ,오늘 퇴원했는데 ,재활의학과
86,발목쪽이 부었습니다,사진과 같이 왼쪽 복숭아뼈 아래 부분이 부었어요 축구하다가 접질렀는데 저쪽 부분이 부어올랐네요 만져보니 뭐가 뭉친거마냥 합니다 병명은 무엇이며 치료방법은 무엇인가요,재활의학과
87,제발아무나도오 주세요깁스좀풀고싶음   ,한달전에길가다가발목을삐엇는데인대가파열나서지금까지씻을때만빼고반깁스를하고잇거든요근데의사쌤께서안아프면빼라고하셧기도하고부기도좀빠져서조금씩걸어보려고오늘 시간정도인대보호 같은거차고걸어다녓는데집와서보니까다시또부어잇는데걸어다녀서부은건가요아님반깁스를해서부은걸까요 그리고원래발목인대가이리오래가나요   ,재활의학과
88,어머니께서 대동맥류 수술을 하시고 대학병원에서 회송동의서를 작성하여 요양병원으로 가셨습니다 오른쪽 다리가 불편하여 재활을 하면서 회복을 하기 위,어머니께서 대동맥류 수술을 하시고 대학병원에서 회송동의서를 작성하여 요양병원으로 가셨습니다 오른쪽 다리가 불편하여 재활을 하면서 회복을 하기 위해 입원하셨는데 일대일 관리를 하지 않으면 힘들어하셔서 일반병원으로 전원을 해야 할것 같은데요 어떻게 하면 좋을까요 ,재활의학과
89,허벅지검다,허벅지나 허리분위 무릎 분위다꺼멋게되엿 습니다 해결방법잇을까요,재활의학과
90,오른쪽 팔을 계속쓰면 왼쪽 어깨가 아픈이유,제가 그림그리거나 공부할때 오른손만쓰는데요 그렇게 한시간 정도 오흔팔만 쓰다보면 나중에 돼서 왼쪽 어깨가 아파요 뭔가 대놓고 아픈게 아니라 은근 답답하게 아프다 해야하나요   암튼 왜 그러는걸까요 병원가야할까요,재활의학과
91,엉덩방아를 세게 찧었는데 꼬리뼈 골절인 것 같아요  어떡하죠 ,빙상장에서 스케이트 타다가 뒤로 세게 넘어졌습니다 넘어질 당시에 엉덩이와 허리가 너무 아파서 바로 일어날 수 없는 상황이었고 순간적으로 시야가 뿌옇게 변하고 이명이 들릴만큼 세게 넘어졌어요  지금  시간 정도 지났는데 누워있을때와 걸을때는 아주약간 불편하지만 앉아있으면 꼬리뼈가 엄청 아파요  허리는 이제 전혀 안 아픕니다  찾아보니 골절인것 같은데   병원에 가도 물리치료 받고 천천히 나을 때까지 무리하지 말라는 진단이 대부분이라고 하더라고요  아직 첫 날이니 온찜질 하면서 경과를 지켜보다가 월요일에도 계속 아프면 병원에 갈까 하는데 괜찮을까요  아니면 일요일에 하는 한의원이나 정형외과를 찾아서 가야할까요  그리고 앉아있을때 방석에 앉으라고 하던데 걷는건 상관없나요 ,재활의학과
92,움직일 때 폐가 꿀렁이는 느낌이 들어요 ,허리를 숙였다가 다시 필 때 라던가 침을 삼킬 때 라던지 몸을 움직일 때 오른쪽 폐  폐인지 아닌지는 정확히는 잘 모르겠네요   에서 꿀렁이는 느낌이 들어요 꿀렁일 때는 통증은 없는데 헛기침이 나올 때가 있고 방금 침대에 다이빙을 하면서 눕는데 오른쪽 폐가 찌릿하고 통증을 느꼈습니다  그리고 관련이 없을 수도 있지만 어제 밤에 배가 딱히 고픈 것도 아닌데 배에서 꾸르륵소리가 끊기지 않고 빈번하게 일어났어요   일전 부터 그랬던 거 같고 담배 음주 절대 안하는 학생입니다   일주일전에 누워서 덤벨로 벤치프레스를 했는데 호흡법이 엉망이긴 했는데 그당시 몸에 이상은 없었습니다 ,재활의학과
93,장애진단등급신청 궁금해요,  월에 아버지께서 뇌경색진단으로 처음엔 왼쪽팔다리 편마비가 왔고 현재는 별차이는 없지만 워커나 휠체어사용함 발음도 조금 어눌하시고 대화는되지만 인지 판단기능이 떨어진상태로 보임 대학병원에서 급성기치료 마치고 재활이되는 요양병원에서  달동안 입원 퇴원을  번째반복하셨고 집에도 한동안 계셨고 지금은 재활이 안되는 요양병원에 일주일째 계십니다 장애등급신청은  개월이 지나야되는걸로 아는데 재활치료를 이렇게 병원을 옮겨다녀도 되는건지 병원에서 재활치료기간을 딱  개월을 채워야하는건지 궁금합니다,재활의학과
94,견갑골 운동장애,오른쪽 견갑골 쪽이 많이 안 좋은데 구미에 괜찮은 병원이 있을까요  헬스를 다니려하는데 예전에 이 상태로 운동하면 오히려 더 안 좋아진다고 들어서 치료 받고자합니다,재활의학과
95,방금 넘어졌는데, 중족골 부분이 엄청 심하게 부었거든요 골절일까요      병원은 내일 가려구요 발을 심장보다 높이하고 냉찜질은 하고 있습니다 ,재활의학과
96,데드  스쿼트,제가 정면에서 거울로 봤을때 오른쪽 치골이 왼쪽보다 올라와있던데 이런 경우에 데드나 스쿼트 할때 오른쪽 신발만 벗어서 양쪽 치골 높이를 맞춰서 데드나 스쿼트를 진행해줘도 괜찮을까요 ,재활의학과
97,허벅지 힘,무릎 연골 수술하고  일 정도 지났는데 허벅지에 힘이 안 들어가네요 원래 힘주면 갈라지는게 보이는데 이제는 그냥 살덩이처럼 있어요 허벅지에 힘을 주려고 하면 무릎에만 힘이 들어가고 너무 아프네요 방법좀 알려주세요,재활의학과
98,수면자세   잠잘때 자세 질문,평소선호하는 자세  옆으로 누워 손을 박수치는모양으로 포개어 그위에 얼굴에 대고 다리에 배게를 끼고 새우잠으로 잠    그런데 요즘들어 허리가 많이 아프고 키가 자꾸 줄어요   성인  아무래도 자세때문에 그런 것 같은데 어느순간 부터 진짜 졸린거 아니면 천장보고 일자자세로는 잠이 안와요        허리펴고 키 안눌리려면 다른 자세는 없나요    아니면 허리디스크 방지할 자세는요    새우잠고칠방법,재활의학과
99,전방십자인대 타가건 수술 후 회복에 관하여,안녕하세요 저는   살 남자입니다  작년   월   일 축구를 하던 중 전방십자인대가 완전히 파열되었고   월  일에 수술을 진행하였습니다  그리고  개월 후 엑스레이 촬영 후 이상이 없다는 판단 하에 보조기 제거 후 생활하고 있습니다  지금은 수술 후  개월  주 정도가 지났고 현재 저의 상태는 이렇습니다   평지 보행 가능하나 다소 부자연스러움  오르막길 및 계단 오르기 가능하나 다소 부자연스러움  수술한 다리 일자로 쭉 펴지긴 하나 반대쪽 다리와 비교 시에 다소 덜 펴진 느낌  내리막길 보행 매우 불안정  쩔뚝거림  수술한 다리 먼저 내딛고 계단 내려가기 거의 불가능  수술 한 다리 쪽 허벅지 근육 거의 다 빠져있는 상태  수술 한 무릎 아직 부어있고 열감도 있는 상태  물리치료 시에 기계 가동 최대 범위    도는 무난하게 수행하나 본인 의지로 구부릴시        도 가능   이런 상태입니다  의사 선생님께서는  개월 뒤에 다시 보자고 말씀하셨고 계단 오르기 가능하나 조심하라 하셨습니다  하지만 허벅지 근육이 올라와야 보행 시에 불안정한 느낌이 사라질 거 같아 계단을 오르는 운동을 가끔 하는 편이고 집에서 무릎 각도 만들어주는 행위도 꾸준히 합니다     어린 나이이고 평소에 운동을 좋아했던 만큼 몸도 건강했는데 회복이 더디고 완쾌를 할 수 있을까 싶어 질문을 드립니다      다리가 반대쪽 다리와 똑같이 펴질 수 있는가   집에서 꾸준히 펴는 운동 중이고  허벅지 뒷근육이 올라오면 좀 더 나아질 것이라고 생각중      다리 각도가 점차 좋아져 추후에 완전 회복 후 무릎 꿇는 자세 밑 쪼그려 앉는 자세가 가능한가      아직 무릎이 부어있고 열감이 있어도 되는가     계단 오르기 및 맨몸 스쿼트   무리하지 않고 적정선에서  가능한지 여부와 효과가 있을지     내년 중순에 소방공무원 실기시험을 치룰 수 있는 상태가 될까   이상입니다 긴 글 읽어주셔서 감사합니다 ,재활의학과
100,골반비대칭관련 오른쪽무릎수술후,제가 오른쪽무릎십자인대수술한지  개월째인데 체중지지가 제대로 되지가않어 항상 쩔뚝이면서 걷거나 재활운동했을시 양쪽으로 한게아니라 거의 환측오른쪽다리만 해왔습니다 그리고 체형은 X자다리이고 왼쪽은 과신전이고 오른쪽은 과신전까지는 안나오고요 계속재활운동과 일상생활하던중에 걸을때 왼쪽골반이 뒤로가는느낌과 오른쪽골반은 바깥으로빠지는 그런보행의 느낌이고 앉거나 누워있을때 왼쪽엉덩이 왼쪽상체롱만 바닥에 닿는 느낌이 나고요 그리고 오른쪽발목아치가 아예 없어진것같아요 그래서 병원에가서 엑스레이촬영했는데 척추측만조금있고 흉추후만에 일자목에 라운드숄더 골반비대칭 그리고 몸이 왼쪽으로 틀어져있다고 하셨고요 아무래도 오른쪽무릎수술한것때문에 제대로 지지가 안되다보니 왼쪽으로만 많이 썼던것같네요 그러면 혹시 오른몸상태가 오른쪽발아치무너지면서 고관절이 내회전되고 골반이 전방경사가되고 흉추랑어깨는앞쪽으로쏠리고 왼쪽은 골반이 내려간거와 동시에 후방경사되고 척추가 왼쪽으로쏠리고요 교정센터를다니고는있는데 제가 왼쪽오른쪽 각각 약하된근육단축된근육 풀어주는것과 스트레칭 강화를 정확하게 어떻게 해야하는지 궁금해서요 광고홍보댓글은 사양하겠습니다,재활의학과
101,깁스풀고 할만한 운동,인대   발목   이 다쳐서 오늘 깁스했는데 다 났고 할수있을만한 운동이 뭐가 있을까요   알려주세요 심장수술을해서 과하지 않은 선에서 해주세요  ,재활의학과
102,선별검사 비용,요즘 선별 검사 비용이 얼마정도 되죠 ,재활의학과
103,산타면 거북목 해결되나요,저는 예전부터 아빠랑 의견차이로 자주 싸웠었는데 제가 이번에 거북목도 좀 심해지고 어깨도 쳐져서 제 돈으로 자세교정기 사겠다는데 그거 가지고 시비를 걸더라구요 제가 운동을 안해서 그렇다네요  근데 저는  년동안 꾸준히 운동도 해왔었어요  무슨 산을 안 다녀서 그렇다는둥 저한테 또 엄청나게 뭐라고 하는데 제가 산을 좀 싫어하거든요 그래서 제가 나 운동하잖아 라고 하니까 또 버럭하면서 저한테 화내네요 정말 산타면 거북목 해결되고  어깨도 펴지나요  ,재활의학과
